A new study created in memory with name: no-name-ddc17d9b-1a43-4397-832a-13a01fc2019d
Trial 0 finished with value: 0.5195366144180298 and parameters: {'n_layers': 6, 'weight_decay': 4.3410595660932676e-09, 'n_units_l0': 7, 'n_units_l1': 7, 'n_units_l2': 9, 'n_units_l3': 117, 'n_units_l4': 11, 'n_units_l5': 45, 'optimizer': 'Adam', 'adam_learning_rate': 0.026989606786786174}. Best is trial 0 with value: 0.5195366144180298.
Trial 1 finished with value: 0.5056328773498535 and parameters: {'n_layers': 9, 'weight_decay': 5.672497911892441e-05, 'n_units_l0': 9, 'n_units_l1': 4, 'n_units_l2': 15, 'n_units_l3': 21, 'n_units_l4': 72, 'n_units_l5': 36, 'n_units_l6': 43, 'n_units_l7': 25, 'n_units_l8': 10, 'optimizer': 'RMSprop', 'rmsprop_learning_rate': 0.00012739928495182843, 'rmsprop_weight_decay': 0.9124527330079587, 'rmsprop_momentum': 0.0008524114873926936}. Best is trial 0 with value: 0.5195366144180298.
Trial 2 finished with value: 0.521675705909729 and parameters: {'n_layers': 8, 'weight_decay': 3.5920282723183125e-07, 'n_units_l0': 112, 'n_units_l1': 13, 'n_units_l2': 102, 'n_units_l3': 54, 'n_units_l4': 7, 'n_units_l5': 69, 'n_units_l6': 115, 'n_units_l7': 15, 'optimizer': 'RMSprop', 'rmsprop_learning_rate': 0.00037334056999067207, 'rmsprop_weight_decay': 0.852704368250834, 'rmsprop_momentum': 0.00034418056750299336}. Best is trial 2 with value: 0.521675705909729.
Trial 3 finished with value: 0.5238146185874939 and parameters: {'n_layers': 10, 'weight_decay': 0.00014252245619020835, 'n_units_l0': 63, 'n_units_l1': 64, 'n_units_l2': 7, 'n_units_l3': 66, 'n_units_l4': 25, 'n_units_l5': 6, 'n_units_l6': 4, 'n_units_l7': 51, 'n_units_l8': 11, 'n_units_l9': 5, 'optimizer': 'Adam', 'adam_learning_rate': 0.03017547205752001}. Best is trial 3 with value: 0.5238146185874939.
Trial 4 finished with value: 0.5186452865600586 and parameters: {'n_layers': 5, 'weight_decay': 7.081856595014833e-09, 'n_units_l0': 40, 'n_units_l1': 83, 'n_units_l2': 111, 'n_units_l3': 5, 'n_units_l4': 71, 'optimizer': 'SGD', 'sgd_opt_learning_rate': 0.001923592360063476, 'sgd_opt_momentum': 1.9426138715613686e-05}. Best is trial 3 with value: 0.5238146185874939.
Trial 5 finished with value: 0.7766844034194946 and parameters: {'n_layers': 8, 'weight_decay': 1.7024126536360007e-09, 'n_units_l0': 52, 'n_units_l1': 43, 'n_units_l2': 6, 'n_units_l3': 12, 'n_units_l4': 4, 'n_units_l5': 30, 'n_units_l6': 4, 'n_units_l7': 47, 'optimizer': 'Adam', 'adam_learning_rate': 0.00034202562807461855}. Best is trial 5 with value: 0.7766844034194946.
Trial 6 finished with value: 0.5267738103866577 and parameters: {'n_layers': 8, 'weight_decay': 1.899009529498612e-09, 'n_units_l0': 10, 'n_units_l1': 25, 'n_units_l2': 12, 'n_units_l3': 12, 'n_units_l4': 4, 'n_units_l5': 7, 'n_units_l6': 42, 'n_units_l7': 6, 'optimizer': 'RMSprop', 'rmsprop_learning_rate': 0.001452781867351996, 'rmsprop_weight_decay': 0.9423276455613367, 'rmsprop_momentum': 0.0012265038708768954}. Best is trial 5 with value: 0.7766844034194946.
Trial 7 finished with value: 0.5068092346191406 and parameters: {'n_layers': 4, 'weight_decay': 4.2365240332339e-09, 'n_units_l0': 98, 'n_units_l1': 120, 'n_units_l2': 48, 'n_units_l3': 25, 'optimizer': 'RMSprop', 'rmsprop_learning_rate': 0.019850696109064328, 'rmsprop_weight_decay': 0.9747380912490387, 'rmsprop_momentum': 0.00017825651138322695}. Best is trial 5 with value: 0.7766844034194946.
Trial 8 finished with value: 0.46684491634368896 and parameters: {'n_layers': 8, 'weight_decay': 2.5588433149249085e-06, 'n_units_l0': 4, 'n_units_l1': 11, 'n_units_l2': 4, 'n_units_l3': 8, 'n_units_l4': 60, 'n_units_l5': 124, 'n_units_l6': 14, 'n_units_l7': 50, 'optimizer': 'Adam', 'adam_learning_rate': 0.05883290638628368}. Best is trial 5 with value: 0.7766844034194946.
Trial 9 finished with value: 0.7315862774848938 and parameters: {'n_layers': 2, 'weight_decay': 3.9388063827726746e-07, 'n_units_l0': 9, 'n_units_l1': 30, 'optimizer': 'Adam', 'adam_learning_rate': 0.0003911786462196128}. Best is trial 5 with value: 0.7766844034194946.
Trial 10 finished with value: 0.5119785666465759 and parameters: {'n_layers': 1, 'weight_decay': 1.8122386621639514e-10, 'n_units_l0': 27, 'optimizer': 'SGD', 'sgd_opt_learning_rate': 1.1042016815401053e-05, 'sgd_opt_momentum': 0.06857986321511388}. Best is trial 5 with value: 0.7766844034194946.
Trial 11 finished with value: 0.5110160112380981 and parameters: {'n_layers': 1, 'weight_decay': 2.038241772864022e-07, 'n_units_l0': 18, 'optimizer': 'Adam', 'adam_learning_rate': 8.697831878244492e-05}. Best is trial 5 with value: 0.7766844034194946.
Trial 12 finished with value: 0.7033867835998535 and parameters: {'n_layers': 3, 'weight_decay': 1.4763479321740946e-07, 'n_units_l0': 17, 'n_units_l1': 38, 'n_units_l2': 31, 'optimizer': 'Adam', 'adam_learning_rate': 0.0002578837314383628}. Best is trial 5 with value: 0.7766844034194946.
Trial 13 finished with value: 0.5249910354614258 and parameters: {'n_layers': 6, 'weight_decay': 4.122857263372506e-06, 'n_units_l0': 44, 'n_units_l1': 36, 'n_units_l2': 4, 'n_units_l3': 18, 'n_units_l4': 23, 'n_units_l5': 15, 'optimizer': 'Adam', 'adam_learning_rate': 0.0014581657206070443}. Best is trial 5 with value: 0.7766844034194946.
Trial 14 finished with value: 0.5240998268127441 and parameters: {'n_layers': 3, 'weight_decay': 1.7798655084844852e-10, 'n_units_l0': 4, 'n_units_l1': 47, 'n_units_l2': 21, 'optimizer': 'Adam', 'adam_learning_rate': 1.688275393162814e-05}. Best is trial 5 with value: 0.7766844034194946.
Trial 15 finished with value: 0.5032085180282593 and parameters: {'n_layers': 7, 'weight_decay': 3.6720584052524925e-08, 'n_units_l0': 31, 'n_units_l1': 20, 'n_units_l2': 6, 'n_units_l3': 4, 'n_units_l4': 4, 'n_units_l5': 17, 'n_units_l6': 4, 'optimizer': 'Adam', 'adam_learning_rate': 0.0018070667474197998}. Best is trial 5 with value: 0.7766844034194946.
Trial 16 finished with value: 0.5208556652069092 and parameters: {'n_layers': 2, 'weight_decay': 0.00099834056007423, 'n_units_l0': 65, 'n_units_l1': 22, 'optimizer': 'SGD', 'sgd_opt_learning_rate': 0.062013108652933455, 'sgd_opt_momentum': 0.0018483489210136483}. Best is trial 5 with value: 0.7766844034194946.
Trial 17 finished with value: 0.5150088667869568 and parameters: {'n_layers': 10, 'weight_decay': 1.7286910115889183e-06, 'n_units_l0': 15, 'n_units_l1': 61, 'n_units_l2': 45, 'n_units_l3': 37, 'n_units_l4': 12, 'n_units_l5': 26, 'n_units_l6': 11, 'n_units_l7': 125, 'n_units_l8': 103, 'n_units_l9': 110, 'optimizer': 'Adam', 'adam_learning_rate': 0.0003275311561912771}. Best is trial 5 with value: 0.7766844034194946.
Trial 18 finished with value: 0.5062744617462158 and parameters: {'n_layers': 5, 'weight_decay': 3.1335977731311444e-08, 'n_units_l0': 7, 'n_units_l1': 30, 'n_units_l2': 17, 'n_units_l3': 8, 'n_units_l4': 41, 'optimizer': 'Adam', 'adam_learning_rate': 4.7871655452623e-05}. Best is trial 5 with value: 0.7766844034194946.
Trial 19 finished with value: 0.5089483261108398 and parameters: {'n_layers': 7, 'weight_decay': 1.6785252641400136e-05, 'n_units_l0': 12, 'n_units_l1': 14, 'n_units_l2': 6, 'n_units_l3': 12, 'n_units_l4': 7, 'n_units_l5': 11, 'n_units_l6': 7, 'optimizer': 'SGD', 'sgd_opt_learning_rate': 1.0595713420324128e-05, 'sgd_opt_momentum': 1.7047739399362244e-05}. Best is trial 5 with value: 0.7766844034194946.
Trial 20 finished with value: 0.5452761650085449 and parameters: {'n_layers': 4, 'weight_decay': 5.453891105292865e-10, 'n_units_l0': 26, 'n_units_l1': 122, 'n_units_l2': 39, 'n_units_l3': 7, 'optimizer': 'Adam', 'adam_learning_rate': 0.006554247046555294}. Best is trial 5 with value: 0.7766844034194946.
Trial 21 finished with value: 0.608663022518158 and parameters: {'n_layers': 3, 'weight_decay': 1.3044908475860649e-07, 'n_units_l0': 19, 'n_units_l1': 39, 'n_units_l2': 31, 'optimizer': 'Adam', 'adam_learning_rate': 0.00024227779889200363}. Best is trial 5 with value: 0.7766844034194946.
Trial 22 finished with value: 0.5180392265319824 and parameters: {'n_layers': 2, 'weight_decay': 2.8557521583729612e-08, 'n_units_l0': 6, 'n_units_l1': 50, 'optimizer': 'Adam', 'adam_learning_rate': 0.000376290463527644}. Best is trial 5 with value: 0.7766844034194946.
Trial 23 finished with value: 0.5249555110931396 and parameters: {'n_layers': 3, 'weight_decay': 9.31627450872734e-07, 'n_units_l0': 14, 'n_units_l1': 19, 'n_units_l2': 28, 'optimizer': 'Adam', 'adam_learning_rate': 0.00011811285358647147}. Best is trial 5 with value: 0.7766844034194946.
Trial 24 finished with value: 0.7721922993659973 and parameters: {'n_layers': 2, 'weight_decay': 8.167081584886948e-08, 'n_units_l0': 68, 'n_units_l1': 32, 'optimizer': 'Adam', 'adam_learning_rate': 0.0008370809892558475}. Best is trial 5 with value: 0.7766844034194946.
Trial 25 finished with value: 0.7615684866905212 and parameters: {'n_layers': 2, 'weight_decay': 1.2749926257897502e-09, 'n_units_l0': 72, 'n_units_l1': 84, 'optimizer': 'Adam', 'adam_learning_rate': 0.002866135307661903}. Best is trial 5 with value: 0.7766844034194946.
Trial 26 finished with value: 0.7755435705184937 and parameters: {'n_layers': 1, 'weight_decay': 8.107260961695378e-10, 'n_units_l0': 62, 'optimizer': 'Adam', 'adam_learning_rate': 0.005119547406751723}. Best is trial 5 with value: 0.7766844034194946.
Trial 27 finished with value: 0.7809979915618896 and parameters: {'n_layers': 1, 'weight_decay': 6.344760159190856e-10, 'n_units_l0': 50, 'optimizer': 'Adam', 'adam_learning_rate': 0.007501956515939575}. Best is trial 27 with value: 0.7809979915618896.
Trial 28 finished with value: 0.5277718305587769 and parameters: {'n_layers': 1, 'weight_decay': 5.546917379123553e-10, 'n_units_l0': 48, 'optimizer': 'SGD', 'sgd_opt_learning_rate': 0.07066140914691059, 'sgd_opt_momentum': 0.05103764211537534}. Best is trial 27 with value: 0.7809979915618896.
Trial 29 finished with value: 0.515614926815033 and parameters: {'n_layers': 7, 'weight_decay': 5.39056920335755e-09, 'n_units_l0': 97, 'n_units_l1': 7, 'n_units_l2': 11, 'n_units_l3': 13, 'n_units_l4': 118, 'n_units_l5': 78, 'n_units_l6': 28, 'optimizer': 'RMSprop', 'rmsprop_learning_rate': 1.7367135334952092e-05, 'rmsprop_weight_decay': 0.8572547221587574, 'rmsprop_momentum': 0.06500558426371342}. Best is trial 27 with value: 0.7809979915618896.
Trial 30 finished with value: 0.5202495455741882 and parameters: {'n_layers': 4, 'weight_decay': 1.1636238817063558e-10, 'n_units_l0': 37, 'n_units_l1': 8, 'n_units_l2': 59, 'n_units_l3': 35, 'optimizer': 'Adam', 'adam_learning_rate': 0.007516382947401156}. Best is trial 27 with value: 0.7809979915618896.
Trial 31 finished with value: 0.7103385329246521 and parameters: {'n_layers': 1, 'weight_decay': 5.613381858107373e-10, 'n_units_l0': 55, 'optimizer': 'Adam', 'adam_learning_rate': 0.004500103223467696}. Best is trial 27 with value: 0.7809979915618896.
Trial 32 finished with value: 0.5243493318557739 and parameters: {'n_layers': 1, 'weight_decay': 1.4957859510851412e-08, 'n_units_l0': 72, 'optimizer': 'Adam', 'adam_learning_rate': 0.0007826793162998544}. Best is trial 27 with value: 0.7809979915618896.
Trial 33 finished with value: 0.48292332887649536 and parameters: {'n_layers': 9, 'weight_decay': 1.3944313344245329e-09, 'n_units_l0': 82, 'n_units_l1': 86, 'n_units_l2': 8, 'n_units_l3': 111, 'n_units_l4': 14, 'n_units_l5': 4, 'n_units_l6': 121, 'n_units_l7': 112, 'n_units_l8': 86, 'optimizer': 'Adam', 'adam_learning_rate': 0.018559565254064363}. Best is trial 27 with value: 0.7809979915618896.
Trial 34 finished with value: 0.730980396270752 and parameters: {'n_layers': 2, 'weight_decay': 2.5597283125270342e-09, 'n_units_l0': 119, 'n_units_l1': 17, 'optimizer': 'Adam', 'adam_learning_rate': 0.0009559760421615535}. Best is trial 27 with value: 0.7809979915618896.
Trial 35 finished with value: 0.4877361059188843 and parameters: {'n_layers': 9, 'weight_decay': 3.9605475565046514e-10, 'n_units_l0': 54, 'n_units_l1': 26, 'n_units_l2': 72, 'n_units_l3': 6, 'n_units_l4': 7, 'n_units_l5': 25, 'n_units_l6': 7, 'n_units_l7': 4, 'n_units_l8': 4, 'optimizer': 'RMSprop', 'rmsprop_learning_rate': 0.045510000885708606, 'rmsprop_weight_decay': 0.9084247048092563, 'rmsprop_momentum': 1.2791383344694292e-05}. Best is trial 27 with value: 0.7809979915618896.
Trial 36 finished with value: 0.5186452865600586 and parameters: {'n_layers': 6, 'weight_decay': 1.0237294328519965e-08, 'n_units_l0': 35, 'n_units_l1': 5, 'n_units_l2': 5, 'n_units_l3': 16, 'n_units_l4': 32, 'n_units_l5': 10, 'optimizer': 'Adam', 'adam_learning_rate': 0.012695960023403034}. Best is trial 27 with value: 0.7809979915618896.
Trial 37 finished with value: 0.5219252109527588 and parameters: {'n_layers': 1, 'weight_decay': 1.0500463984186445e-09, 'n_units_l0': 83, 'optimizer': 'RMSprop', 'rmsprop_learning_rate': 0.004361950991518122, 'rmsprop_weight_decay': 0.9808644649995663, 'rmsprop_momentum': 0.05978510516040922}. Best is trial 27 with value: 0.7809979915618896.
Trial 38 finished with value: 0.7552582621574402 and parameters: {'n_layers': 2, 'weight_decay': 3.411592491982191e-09, 'n_units_l0': 49, 'n_units_l1': 9, 'optimizer': 'Adam', 'adam_learning_rate': 0.002195892747104227}. Best is trial 27 with value: 0.7809979915618896.
Trial 39 finished with value: 0.7633867263793945 and parameters: {'n_layers': 5, 'weight_decay': 5.4138638914449864e-08, 'n_units_l0': 24, 'n_units_l1': 55, 'n_units_l2': 12, 'n_units_l3': 29, 'n_units_l4': 16, 'optimizer': 'Adam', 'adam_learning_rate': 0.000858395962497276}. Best is trial 27 with value: 0.7809979915618896.
Trial 40 finished with value: 0.5140464305877686 and parameters: {'n_layers': 4, 'weight_decay': 2.353203105756461e-10, 'n_units_l0': 95, 'n_units_l1': 4, 'n_units_l2': 19, 'n_units_l3': 55, 'optimizer': 'SGD', 'sgd_opt_learning_rate': 0.0004426458939050518, 'sgd_opt_momentum': 0.001255356405765794}. Best is trial 27 with value: 0.7809979915618896.
Trial 41 finished with value: 0.5125846862792969 and parameters: {'n_layers': 5, 'weight_decay': 6.353483245018912e-08, 'n_units_l0': 24, 'n_units_l1': 60, 'n_units_l2': 13, 'n_units_l3': 30, 'n_units_l4': 17, 'optimizer': 'Adam', 'adam_learning_rate': 0.0010453380601493196}. Best is trial 27 with value: 0.7809979915618896.
Trial 42 finished with value: 0.5171478986740112 and parameters: {'n_layers': 8, 'weight_decay': 1.3257918185148775e-08, 'n_units_l0': 63, 'n_units_l1': 72, 'n_units_l2': 10, 'n_units_l3': 10, 'n_units_l4': 9, 'n_units_l5': 43, 'n_units_l6': 17, 'n_units_l7': 14, 'optimizer': 'Adam', 'adam_learning_rate': 0.0006313198473296126}. Best is trial 27 with value: 0.7809979915618896.
Trial 43 finished with value: 0.5219606757164001 and parameters: {'n_layers': 10, 'weight_decay': 5.361446411928084e-07, 'n_units_l0': 31, 'n_units_l1': 103, 'n_units_l2': 9, 'n_units_l3': 89, 'n_units_l4': 5, 'n_units_l5': 122, 'n_units_l6': 8, 'n_units_l7': 41, 'n_units_l8': 30, 'n_units_l9': 36, 'optimizer': 'Adam', 'adam_learning_rate': 0.003609852652238613}. Best is trial 27 with value: 0.7809979915618896.
Trial 44 finished with value: 0.5156150460243225 and parameters: {'n_layers': 1, 'weight_decay': 2.4747157028291597e-09, 'n_units_l0': 127, 'optimizer': 'Adam', 'adam_learning_rate': 0.010626523880498494}. Best is trial 27 with value: 0.7809979915618896.
Trial 45 finished with value: 0.7646343111991882 and parameters: {'n_layers': 5, 'weight_decay': 7.80077157564309e-08, 'n_units_l0': 39, 'n_units_l1': 42, 'n_units_l2': 7, 'n_units_l3': 49, 'n_units_l4': 17, 'optimizer': 'Adam', 'adam_learning_rate': 0.0005487166400055501}. Best is trial 27 with value: 0.7809979915618896.
Trial 46 finished with value: 0.5082709193229675 and parameters: {'n_layers': 3, 'weight_decay': 6.111741272397133e-09, 'n_units_l0': 41, 'n_units_l1': 44, 'n_units_l2': 5, 'optimizer': 'RMSprop', 'rmsprop_learning_rate': 1.9763239113517032e-05, 'rmsprop_weight_decay': 0.8846154337959246, 'rmsprop_momentum': 0.009120690398027553}. Best is trial 27 with value: 0.7809979915618896.
Trial 47 finished with value: 0.7445988655090332 and parameters: {'n_layers': 8, 'weight_decay': 7.5728101455674346e-06, 'n_units_l0': 57, 'n_units_l1': 31, 'n_units_l2': 15, 'n_units_l3': 44, 'n_units_l4': 44, 'n_units_l5': 73, 'n_units_l6': 67, 'n_units_l7': 9, 'optimizer': 'Adam', 'adam_learning_rate': 0.00012643178457393502}. Best is trial 27 with value: 0.7809979915618896.
Trial 48 finished with value: 0.5183243751525879 and parameters: {'n_layers': 2, 'weight_decay': 8.02120236496975e-08, 'n_units_l0': 45, 'n_units_l1': 72, 'optimizer': 'Adam', 'adam_learning_rate': 0.03580089343440929}. Best is trial 27 with value: 0.7809979915618896.
Trial 49 finished with value: 0.5225312113761902 and parameters: {'n_layers': 9, 'weight_decay': 2.976209434365616e-10, 'n_units_l0': 75, 'n_units_l1': 25, 'n_units_l2': 7, 'n_units_l3': 85, 'n_units_l4': 5, 'n_units_l5': 32, 'n_units_l6': 25, 'n_units_l7': 30, 'n_units_l8': 41, 'optimizer': 'Adam', 'adam_learning_rate': 0.0005274214916189839}. Best is trial 27 with value: 0.7809979915618896.
Trial 50 finished with value: 0.49105170369148254 and parameters: {'n_layers': 7, 'weight_decay': 1.0826846154637412e-10, 'n_units_l0': 32, 'n_units_l1': 14, 'n_units_l2': 24, 'n_units_l3': 22, 'n_units_l4': 10, 'n_units_l5': 18, 'n_units_l6': 5, 'optimizer': 'Adam', 'adam_learning_rate': 0.07760337059770248}. Best is trial 27 with value: 0.7809979915618896.
Trial 51 finished with value: 0.5328699946403503 and parameters: {'n_layers': 6, 'weight_decay': 6.685914774933216e-08, 'n_units_l0': 22, 'n_units_l1': 54, 'n_units_l2': 8, 'n_units_l3': 27, 'n_units_l4': 17, 'n_units_l5': 55, 'optimizer': 'Adam', 'adam_learning_rate': 0.001525361960236677}. Best is trial 27 with value: 0.7809979915618896.
Trial 52 finished with value: 0.5304456949234009 and parameters: {'n_layers': 4, 'weight_decay': 2.2927751160869174e-07, 'n_units_l0': 39, 'n_units_l1': 42, 'n_units_l2': 5, 'n_units_l3': 48, 'optimizer': 'Adam', 'adam_learning_rate': 0.00019049181898945843}. Best is trial 27 with value: 0.7809979915618896.
Trial 53 finished with value: 0.5319786667823792 and parameters: {'n_layers': 5, 'weight_decay': 2.4062128146040152e-08, 'n_units_l0': 28, 'n_units_l1': 34, 'n_units_l2': 14, 'n_units_l3': 18, 'n_units_l4': 17, 'optimizer': 'Adam', 'adam_learning_rate': 0.0005382927068673293}. Best is trial 27 with value: 0.7809979915618896.
Trial 54 finished with value: 0.5064883828163147 and parameters: {'n_layers': 5, 'weight_decay': 6.955753013589545e-07, 'n_units_l0': 56, 'n_units_l1': 52, 'n_units_l2': 10, 'n_units_l3': 37, 'n_units_l4': 37, 'optimizer': 'SGD', 'sgd_opt_learning_rate': 0.000528164290628158, 'sgd_opt_momentum': 0.00018147036796180535}. Best is trial 27 with value: 0.7809979915618896.
Trial 55 finished with value: 0.7515863180160522 and parameters: {'n_layers': 1, 'weight_decay': 7.936116700032509e-10, 'n_units_l0': 63, 'optimizer': 'Adam', 'adam_learning_rate': 0.0013980505071968447}. Best is trial 27 with value: 0.7809979915618896.
Trial 56 finished with value: 0.5153297781944275 and parameters: {'n_layers': 6, 'weight_decay': 3.5817365290528e-07, 'n_units_l0': 49, 'n_units_l1': 72, 'n_units_l2': 4, 'n_units_l3': 63, 'n_units_l4': 25, 'n_units_l5': 12, 'optimizer': 'Adam', 'adam_learning_rate': 0.0009576103104195308}. Best is trial 27 with value: 0.7809979915618896.
Trial 57 finished with value: 0.520784318447113 and parameters: {'n_layers': 3, 'weight_decay': 1.2042909800161475e-07, 'n_units_l0': 42, 'n_units_l1': 98, 'n_units_l2': 6, 'optimizer': 'Adam', 'adam_learning_rate': 0.0028589480635332573}. Best is trial 27 with value: 0.7809979915618896.
Trial 58 finished with value: 0.5135115385055542 and parameters: {'n_layers': 4, 'weight_decay': 0.00015681956619009385, 'n_units_l0': 20, 'n_units_l1': 27, 'n_units_l2': 8, 'n_units_l3': 72, 'optimizer': 'Adam', 'adam_learning_rate': 5.3646453321870453e-05}. Best is trial 27 with value: 0.7809979915618896.
Trial 59 finished with value: 0.5125846266746521 and parameters: {'n_layers': 2, 'weight_decay': 9.062982785909016e-09, 'n_units_l0': 106, 'n_units_l1': 36, 'optimizer': 'RMSprop', 'rmsprop_learning_rate': 0.00622151667366472, 'rmsprop_weight_decay': 0.9475784036619648, 'rmsprop_momentum': 1.0235187070699242e-05}. Best is trial 27 with value: 0.7809979915618896.
Trial 60 finished with value: 0.634652316570282 and parameters: {'n_layers': 1, 'weight_decay': 1.563155768220925e-06, 'n_units_l0': 33, 'optimizer': 'Adam', 'adam_learning_rate': 0.00040981967575569805}. Best is trial 27 with value: 0.7809979915618896.
Trial 61 finished with value: 0.5268092751502991 and parameters: {'n_layers': 2, 'weight_decay': 1.6115069481786492e-09, 'n_units_l0': 69, 'n_units_l1': 85, 'optimizer': 'Adam', 'adam_learning_rate': 0.0058757765185218375}. Best is trial 27 with value: 0.7809979915618896.
Trial 62 finished with value: 0.7688769698143005 and parameters: {'n_layers': 2, 'weight_decay': 9.410296021029325e-10, 'n_units_l0': 77, 'n_units_l1': 63, 'optimizer': 'Adam', 'adam_learning_rate': 0.0035367939565858417}. Best is trial 27 with value: 0.7809979915618896.
Trial 63 finished with value: 0.5144028663635254 and parameters: {'n_layers': 3, 'weight_decay': 4.1423839800701e-08, 'n_units_l0': 78, 'n_units_l1': 61, 'n_units_l2': 16, 'optimizer': 'Adam', 'adam_learning_rate': 0.011031716532658959}. Best is trial 27 with value: 0.7809979915618896.
Trial 64 finished with value: 0.7582529783248901 and parameters: {'n_layers': 1, 'weight_decay': 4.485213491520109e-09, 'n_units_l0': 61, 'optimizer': 'Adam', 'adam_learning_rate': 0.00217464474812345}. Best is trial 27 with value: 0.7809979915618896.
Trial 65 finished with value: 0.5288769602775574 and parameters: {'n_layers': 2, 'weight_decay': 2.1067426408698598e-08, 'n_units_l0': 88, 'n_units_l1': 47, 'optimizer': 'SGD', 'sgd_opt_learning_rate': 0.0057534993067789595, 'sgd_opt_momentum': 0.0057999252861332595}. Best is trial 27 with value: 0.7809979915618896.
