Trial 220 finished with value: 0.5301246643066406 and parameters: {'n_layers': 2, 'weight_decay': 9.41203851565239e-10, 'n_units_l0': 112, 'n_units_l1': 101, 'optimizer': 'Adam', 'adam_learning_rate': 0.021169778524724896}. Best is trial 115 with value: 0.798573911190033.
Trial 221 finished with value: 0.7537610530853271 and parameters: {'n_layers': 2, 'weight_decay': 2.1872830483987309e-10, 'n_units_l0': 118, 'n_units_l1': 92, 'optimizer': 'Adam', 'adam_learning_rate': 0.0007533537944545652}. Best is trial 115 with value: 0.798573911190033.
Trial 222 finished with value: 0.7561140060424805 and parameters: {'n_layers': 2, 'weight_decay': 6.582517566155124e-10, 'n_units_l0': 119, 'n_units_l1': 31, 'optimizer': 'Adam', 'adam_learning_rate': 0.0008377435114150359}. Best is trial 115 with value: 0.798573911190033.
Trial 223 finished with value: 0.7734044790267944 and parameters: {'n_layers': 2, 'weight_decay': 1.2073967069135276e-09, 'n_units_l0': 128, 'n_units_l1': 105, 'optimizer': 'Adam', 'adam_learning_rate': 0.001114034335399316}. Best is trial 115 with value: 0.798573911190033.
Trial 224 finished with value: 0.7713010907173157 and parameters: {'n_layers': 2, 'weight_decay': 1.6758533139116013e-10, 'n_units_l0': 106, 'n_units_l1': 33, 'optimizer': 'Adam', 'adam_learning_rate': 0.001449687449298301}. Best is trial 115 with value: 0.798573911190033.
Trial 225 finished with value: 0.7688767910003662 and parameters: {'n_layers': 2, 'weight_decay': 3.098119342651544e-10, 'n_units_l0': 117, 'n_units_l1': 24, 'optimizer': 'Adam', 'adam_learning_rate': 0.0006697313139434498}. Best is trial 115 with value: 0.798573911190033.
Trial 226 finished with value: 0.6295543313026428 and parameters: {'n_layers': 2, 'weight_decay': 4.6453636535535355e-10, 'n_units_l0': 81, 'n_units_l1': 81, 'optimizer': 'Adam', 'adam_learning_rate': 0.0004591384494184246}. Best is trial 115 with value: 0.798573911190033.
Trial 227 finished with value: 0.7645987868309021 and parameters: {'n_layers': 2, 'weight_decay': 1.939727105020354e-09, 'n_units_l0': 110, 'n_units_l1': 36, 'optimizer': 'Adam', 'adam_learning_rate': 0.0009143268371844533}. Best is trial 115 with value: 0.798573911190033.
Trial 228 finished with value: 0.7795005440711975 and parameters: {'n_layers': 2, 'weight_decay': 2.0368375331085727e-10, 'n_units_l0': 76, 'n_units_l1': 40, 'optimizer': 'Adam', 'adam_learning_rate': 0.0005674377915248378}. Best is trial 115 with value: 0.798573911190033.
Trial 229 finished with value: 0.7695187330245972 and parameters: {'n_layers': 3, 'weight_decay': 9.456666033682193e-10, 'n_units_l0': 74, 'n_units_l1': 42, 'n_units_l2': 70, 'optimizer': 'Adam', 'adam_learning_rate': 0.00039164728388856507}. Best is trial 115 with value: 0.798573911190033.
Trial 230 finished with value: 0.7663813233375549 and parameters: {'n_layers': 2, 'weight_decay': 1.3664510457847044e-10, 'n_units_l0': 87, 'n_units_l1': 40, 'optimizer': 'Adam', 'adam_learning_rate': 0.0005549120875715567}. Best is trial 115 with value: 0.798573911190033.
Trial 231 finished with value: 0.7677002549171448 and parameters: {'n_layers': 2, 'weight_decay': 1.934263946428242e-10, 'n_units_l0': 74, 'n_units_l1': 48, 'optimizer': 'Adam', 'adam_learning_rate': 0.0007255025799002118}. Best is trial 115 with value: 0.798573911190033.
Trial 232 finished with value: 0.7537254095077515 and parameters: {'n_layers': 2, 'weight_decay': 2.590840080337387e-10, 'n_units_l0': 119, 'n_units_l1': 31, 'optimizer': 'Adam', 'adam_learning_rate': 0.0008277680169776929}. Best is trial 115 with value: 0.798573911190033.
Trial 233 finished with value: 0.7528342008590698 and parameters: {'n_layers': 2, 'weight_decay': 1.9606053219071012e-10, 'n_units_l0': 81, 'n_units_l1': 35, 'optimizer': 'Adam', 'adam_learning_rate': 0.001034324862428714}. Best is trial 115 with value: 0.798573911190033.
Trial 234 finished with value: 0.5183600783348083 and parameters: {'n_layers': 2, 'weight_decay': 3.183566178536529e-10, 'n_units_l0': 70, 'n_units_l1': 127, 'optimizer': 'Adam', 'adam_learning_rate': 0.04395709675975485}. Best is trial 115 with value: 0.798573911190033.
Trial 235 finished with value: 0.7616039514541626 and parameters: {'n_layers': 2, 'weight_decay': 1.3039234023550513e-10, 'n_units_l0': 128, 'n_units_l1': 38, 'optimizer': 'Adam', 'adam_learning_rate': 0.0005858913116334121}. Best is trial 115 with value: 0.798573911190033.
Trial 236 finished with value: 0.7522279620170593 and parameters: {'n_layers': 2, 'weight_decay': 1.3884980560552581e-09, 'n_units_l0': 94, 'n_units_l1': 33, 'optimizer': 'Adam', 'adam_learning_rate': 0.001330728163184747}. Best is trial 115 with value: 0.798573911190033.
Trial 237 finished with value: 0.7007130980491638 and parameters: {'n_layers': 2, 'weight_decay': 6.44459390954168e-10, 'n_units_l0': 112, 'n_units_l1': 44, 'optimizer': 'Adam', 'adam_learning_rate': 0.0006388339936425331}. Best is trial 115 with value: 0.798573911190033.
Trial 238 finished with value: 0.7613188624382019 and parameters: {'n_layers': 2, 'weight_decay': 4.421381908049744e-10, 'n_units_l0': 120, 'n_units_l1': 29, 'optimizer': 'Adam', 'adam_learning_rate': 0.0002970355307984226}. Best is trial 115 with value: 0.798573911190033.
Trial 239 finished with value: 0.7543671727180481 and parameters: {'n_layers': 2, 'weight_decay': 8.978433760802882e-10, 'n_units_l0': 104, 'n_units_l1': 37, 'optimizer': 'Adam', 'adam_learning_rate': 0.0004719191039301648}. Best is trial 115 with value: 0.798573911190033.
Trial 240 finished with value: 0.7455258369445801 and parameters: {'n_layers': 2, 'weight_decay': 2.019569176196236e-10, 'n_units_l0': 89, 'n_units_l1': 34, 'optimizer': 'Adam', 'adam_learning_rate': 0.0021578190536879665}. Best is trial 115 with value: 0.798573911190033.
Trial 241 finished with value: 0.7761850953102112 and parameters: {'n_layers': 2, 'weight_decay': 8.337236189235711e-10, 'n_units_l0': 110, 'n_units_l1': 114, 'optimizer': 'Adam', 'adam_learning_rate': 0.0007736540773246335}. Best is trial 115 with value: 0.798573911190033.
Trial 242 finished with value: 0.7706949710845947 and parameters: {'n_layers': 2, 'weight_decay': 1.3183057919147474e-09, 'n_units_l0': 77, 'n_units_l1': 121, 'optimizer': 'Adam', 'adam_learning_rate': 0.0008031512820501158}. Best is trial 115 with value: 0.798573911190033.
Trial 243 finished with value: 0.7806771397590637 and parameters: {'n_layers': 2, 'weight_decay': 5.633361078088751e-10, 'n_units_l0': 113, 'n_units_l1': 105, 'optimizer': 'Adam', 'adam_learning_rate': 0.0009952230625745356}. Best is trial 115 with value: 0.798573911190033.
Trial 244 finished with value: 0.772513210773468 and parameters: {'n_layers': 2, 'weight_decay': 3.5304090389559275e-10, 'n_units_l0': 119, 'n_units_l1': 103, 'optimizer': 'Adam', 'adam_learning_rate': 0.0010249123686433635}. Best is trial 115 with value: 0.798573911190033.
Trial 245 finished with value: 0.6522637009620667 and parameters: {'n_layers': 2, 'weight_decay': 5.895076638532669e-10, 'n_units_l0': 119, 'n_units_l1': 39, 'optimizer': 'Adam', 'adam_learning_rate': 0.0016809427630166832}. Best is trial 115 with value: 0.798573911190033.
Trial 246 finished with value: 0.74737948179245 and parameters: {'n_layers': 2, 'weight_decay': 2.4793196785042273e-10, 'n_units_l0': 127, 'n_units_l1': 31, 'optimizer': 'Adam', 'adam_learning_rate': 0.0011788233720122288}. Best is trial 115 with value: 0.798573911190033.
Trial 247 finished with value: 0.7748662233352661 and parameters: {'n_layers': 2, 'weight_decay': 2.677251534387263e-09, 'n_units_l0': 100, 'n_units_l1': 35, 'optimizer': 'Adam', 'adam_learning_rate': 0.0009695508851535498}. Best is trial 115 with value: 0.798573911190033.
Trial 248 finished with value: 0.5083422064781189 and parameters: {'n_layers': 2, 'weight_decay': 1.6664709512728248e-09, 'n_units_l0': 113, 'n_units_l1': 95, 'optimizer': 'RMSprop', 'rmsprop_learning_rate': 1.0924948384779322e-05, 'rmsprop_weight_decay': 0.8646454960028063, 'rmsprop_momentum': 4.095370114143279e-05}. Best is trial 115 with value: 0.798573911190033.
Trial 249 finished with value: 0.7851691842079163 and parameters: {'n_layers': 2, 'weight_decay': 1.48616045661868e-10, 'n_units_l0': 84, 'n_units_l1': 41, 'optimizer': 'Adam', 'adam_learning_rate': 0.0006591946509937196}. Best is trial 115 with value: 0.798573911190033.
