Trial 66 finished with value: 0.7530480027198792 and parameters: {'n_layers': 7, 'weight_decay': 7.340223281912657e-10, 'n_units_l0': 28, 'n_units_l1': 32, 'n_units_l2': 11, 'n_units_l3': 15, 'n_units_l4': 9, 'n_units_l5': 7, 'n_units_l6': 12, 'optimizer': 'Adam', 'adam_learning_rate': 0.00020312533589266277}. Best is trial 27 with value: 0.7809979915618896.
Trial 67 finished with value: 0.5228520035743713 and parameters: {'n_layers': 5, 'weight_decay': 3.7861603945374866e-10, 'n_units_l0': 51, 'n_units_l1': 40, 'n_units_l2': 5, 'n_units_l3': 128, 'n_units_l4': 13, 'optimizer': 'Adam', 'adam_learning_rate': 0.004361960364075668}. Best is trial 27 with value: 0.7809979915618896.
Trial 68 finished with value: 0.7594295740127563 and parameters: {'n_layers': 3, 'weight_decay': 2.129780963187397e-09, 'n_units_l0': 45, 'n_units_l1': 55, 'n_units_l2': 122, 'optimizer': 'Adam', 'adam_learning_rate': 0.000311367141058938}. Best is trial 27 with value: 0.7809979915618896.
Trial 69 finished with value: 0.5040285587310791 and parameters: {'n_layers': 1, 'weight_decay': 1.9724638778588345e-10, 'n_units_l0': 36, 'optimizer': 'Adam', 'adam_learning_rate': 0.000709098232534773}. Best is trial 27 with value: 0.7809979915618896.
Trial 70 finished with value: 0.4586809575557709 and parameters: {'n_layers': 6, 'weight_decay': 1.8770244087524934e-07, 'n_units_l0': 107, 'n_units_l1': 67, 'n_units_l2': 7, 'n_units_l3': 22, 'n_units_l4': 29, 'n_units_l5': 23, 'optimizer': 'Adam', 'adam_learning_rate': 0.008130665156488349}. Best is trial 27 with value: 0.7809979915618896.
Trial 71 finished with value: 0.7906593680381775 and parameters: {'n_layers': 2, 'weight_decay': 1.3132324048955323e-09, 'n_units_l0': 71, 'n_units_l1': 100, 'optimizer': 'Adam', 'adam_learning_rate': 0.0031196630807299574}. Best is trial 71 with value: 0.7906593680381775.
Trial 72 finished with value: 0.524741530418396 and parameters: {'n_layers': 2, 'weight_decay': 8.409621133725741e-10, 'n_units_l0': 66, 'n_units_l1': 109, 'optimizer': 'Adam', 'adam_learning_rate': 0.00137414589721068}. Best is trial 71 with value: 0.7906593680381775.
Trial 73 finished with value: 0.5177183747291565 and parameters: {'n_layers': 2, 'weight_decay': 3.55900275604874e-09, 'n_units_l0': 58, 'n_units_l1': 126, 'optimizer': 'Adam', 'adam_learning_rate': 0.0030292417121171806}. Best is trial 71 with value: 0.7906593680381775.
Trial 74 finished with value: 0.7631015181541443 and parameters: {'n_layers': 1, 'weight_decay': 1.2707925905057615e-09, 'n_units_l0': 91, 'optimizer': 'Adam', 'adam_learning_rate': 0.005790026180722105}. Best is trial 71 with value: 0.7906593680381775.
Trial 75 finished with value: 0.7367199659347534 and parameters: {'n_layers': 2, 'weight_decay': 4.774522067549304e-10, 'n_units_l0': 71, 'n_units_l1': 46, 'optimizer': 'Adam', 'adam_learning_rate': 0.0004450145602140787}. Best is trial 71 with value: 0.7906593680381775.
Trial 76 finished with value: 0.5173974633216858 and parameters: {'n_layers': 3, 'weight_decay': 4.355723384622064e-08, 'n_units_l0': 82, 'n_units_l1': 22, 'n_units_l2': 19, 'optimizer': 'RMSprop', 'rmsprop_learning_rate': 0.09767007550251146, 'rmsprop_weight_decay': 0.8869286372993623, 'rmsprop_momentum': 0.007599434791884408}. Best is trial 71 with value: 0.7906593680381775.
Trial 77 finished with value: 0.5053475499153137 and parameters: {'n_layers': 1, 'weight_decay': 8.899788034000735e-09, 'n_units_l0': 16, 'optimizer': 'Adam', 'adam_learning_rate': 0.016651166761869268}. Best is trial 71 with value: 0.7906593680381775.
Trial 78 finished with value: 0.5107308626174927 and parameters: {'n_layers': 4, 'weight_decay': 9.553263743266064e-08, 'n_units_l0': 47, 'n_units_l1': 93, 'n_units_l2': 4, 'n_units_l3': 30, 'optimizer': 'SGD', 'sgd_opt_learning_rate': 8.52004311490548e-05, 'sgd_opt_momentum': 0.0001267943752988988}. Best is trial 71 with value: 0.7906593680381775.
Trial 79 finished with value: 0.5234581232070923 and parameters: {'n_layers': 5, 'weight_decay': 1.5230605741191137e-10, 'n_units_l0': 51, 'n_units_l1': 58, 'n_units_l2': 92, 'n_units_l3': 10, 'n_units_l4': 52, 'optimizer': 'Adam', 'adam_learning_rate': 0.0021023470243619123}. Best is trial 71 with value: 0.7906593680381775.
Trial 80 finished with value: 0.7522280812263489 and parameters: {'n_layers': 2, 'weight_decay': 1.8948027317892277e-09, 'n_units_l0': 40, 'n_units_l1': 76, 'optimizer': 'Adam', 'adam_learning_rate': 0.0008636278378888412}. Best is trial 71 with value: 0.7906593680381775.
Trial 81 finished with value: 0.5150445103645325 and parameters: {'n_layers': 1, 'weight_decay': 1.2768411182211617e-09, 'n_units_l0': 87, 'optimizer': 'Adam', 'adam_learning_rate': 0.005040446950272663}. Best is trial 71 with value: 0.7906593680381775.
Trial 82 finished with value: 0.7660960555076599 and parameters: {'n_layers': 1, 'weight_decay': 1.0197313372080435e-09, 'n_units_l0': 99, 'optimizer': 'Adam', 'adam_learning_rate': 0.007907568555356462}. Best is trial 71 with value: 0.7906593680381775.
Trial 83 finished with value: 0.4932263195514679 and parameters: {'n_layers': 1, 'weight_decay': 2.8853836872227985e-10, 'n_units_l0': 67, 'optimizer': 'Adam', 'adam_learning_rate': 0.007415728736114686}. Best is trial 71 with value: 0.7906593680381775.
Trial 84 finished with value: 0.5137968063354492 and parameters: {'n_layers': 1, 'weight_decay': 1.6942785145539692e-08, 'n_units_l0': 104, 'optimizer': 'Adam', 'adam_learning_rate': 0.026860614854990483}. Best is trial 71 with value: 0.7906593680381775.
Trial 85 finished with value: 0.5213902592658997 and parameters: {'n_layers': 8, 'weight_decay': 6.002273087964479e-10, 'n_units_l0': 119, 'n_units_l1': 28, 'n_units_l2': 13, 'n_units_l3': 43, 'n_units_l4': 95, 'n_units_l5': 5, 'n_units_l6': 36, 'n_units_l7': 75, 'optimizer': 'Adam', 'adam_learning_rate': 0.0031677317302311533}. Best is trial 71 with value: 0.7906593680381775.
Trial 86 finished with value: 0.7719072699546814 and parameters: {'n_layers': 2, 'weight_decay': 3.0558510359148085e-09, 'n_units_l0': 59, 'n_units_l1': 40, 'optimizer': 'Adam', 'adam_learning_rate': 0.004231536535983609}. Best is trial 71 with value: 0.7906593680381775.
Trial 87 finished with value: 0.5298395156860352 and parameters: {'n_layers': 2, 'weight_decay': 3.211392709623313e-09, 'n_units_l0': 59, 'n_units_l1': 23, 'optimizer': 'Adam', 'adam_learning_rate': 0.008309256483346572}. Best is trial 71 with value: 0.7906593680381775.
Trial 88 finished with value: 0.47775405645370483 and parameters: {'n_layers': 2, 'weight_decay': 1.0153977455013689e-09, 'n_units_l0': 76, 'n_units_l1': 19, 'optimizer': 'Adam', 'adam_learning_rate': 0.013098101533728939}. Best is trial 71 with value: 0.7906593680381775.
Trial 89 finished with value: 0.6907307505607605 and parameters: {'n_layers': 1, 'weight_decay': 5.459103953847929e-09, 'n_units_l0': 53, 'optimizer': 'Adam', 'adam_learning_rate': 0.004364455577091951}. Best is trial 71 with value: 0.7906593680381775.
Trial 90 finished with value: 0.51165771484375 and parameters: {'n_layers': 2, 'weight_decay': 3.903461306587416e-10, 'n_units_l0': 96, 'n_units_l1': 48, 'optimizer': 'RMSprop', 'rmsprop_learning_rate': 0.00011227165628052872, 'rmsprop_weight_decay': 0.9479523389050024, 'rmsprop_momentum': 5.9819924964635366e-05}. Best is trial 71 with value: 0.7906593680381775.
Trial 91 finished with value: 0.7876647710800171 and parameters: {'n_layers': 3, 'weight_decay': 2.134815035996347e-09, 'n_units_l0': 81, 'n_units_l1': 39, 'n_units_l2': 24, 'optimizer': 'Adam', 'adam_learning_rate': 0.0016105624148640002}. Best is trial 71 with value: 0.7906593680381775.
Trial 92 finished with value: 0.775258481502533 and parameters: {'n_layers': 3, 'weight_decay': 2.3690506950698518e-09, 'n_units_l0': 81, 'n_units_l1': 38, 'n_units_l2': 26, 'optimizer': 'Adam', 'adam_learning_rate': 0.001746011886387493}. Best is trial 71 with value: 0.7906593680381775.
Trial 93 finished with value: 0.5195721983909607 and parameters: {'n_layers': 3, 'weight_decay': 2.616170562542923e-09, 'n_units_l0': 81, 'n_units_l1': 37, 'n_units_l2': 35, 'optimizer': 'Adam', 'adam_learning_rate': 0.0025040257838190726}. Best is trial 71 with value: 0.7906593680381775.
Trial 94 finished with value: 0.5234224796295166 and parameters: {'n_layers': 3, 'weight_decay': 1.7471769459340363e-09, 'n_units_l0': 73, 'n_units_l1': 34, 'n_units_l2': 25, 'optimizer': 'Adam', 'adam_learning_rate': 0.001748801400626925}. Best is trial 71 with value: 0.7906593680381775.
Trial 95 finished with value: 0.717896580696106 and parameters: {'n_layers': 2, 'weight_decay': 7.480464339133923e-10, 'n_units_l0': 64, 'n_units_l1': 30, 'optimizer': 'Adam', 'adam_learning_rate': 0.0011839748337367847}. Best is trial 71 with value: 0.7906593680381775.
Trial 96 finished with value: 0.5092334747314453 and parameters: {'n_layers': 3, 'weight_decay': 1.0473653659664967e-09, 'n_units_l0': 102, 'n_units_l1': 40, 'n_units_l2': 50, 'optimizer': 'Adam', 'adam_learning_rate': 0.004020657830692526}. Best is trial 71 with value: 0.7906593680381775.
Trial 97 finished with value: 0.7134402990341187 and parameters: {'n_layers': 2, 'weight_decay': 6.681830555470555e-09, 'n_units_l0': 90, 'n_units_l1': 66, 'optimizer': 'Adam', 'adam_learning_rate': 0.0017435475417316567}. Best is trial 71 with value: 0.7906593680381775.
Trial 98 finished with value: 0.5104812979698181 and parameters: {'n_layers': 1, 'weight_decay': 4.178290484968533e-09, 'n_units_l0': 77, 'optimizer': 'SGD', 'sgd_opt_learning_rate': 0.007477222171982066, 'sgd_opt_momentum': 0.010955860205228221}. Best is trial 71 with value: 0.7906593680381775.
Trial 99 finished with value: 0.5086631774902344 and parameters: {'n_layers': 3, 'weight_decay': 2.6414060767267034e-09, 'n_units_l0': 115, 'n_units_l1': 51, 'n_units_l2': 41, 'optimizer': 'Adam', 'adam_learning_rate': 0.005760670443065168}. Best is trial 71 with value: 0.7906593680381775.
Trial 100 finished with value: 0.7839928269386292 and parameters: {'n_layers': 2, 'weight_decay': 2.754220103063201e-10, 'n_units_l0': 128, 'n_units_l1': 34, 'optimizer': 'Adam', 'adam_learning_rate': 0.00335177810964795}. Best is trial 71 with value: 0.7906593680381775.
Trial 101 finished with value: 0.7391085624694824 and parameters: {'n_layers': 2, 'weight_decay': 3.4920714886306563e-10, 'n_units_l0': 111, 'n_units_l1': 24, 'optimizer': 'Adam', 'adam_learning_rate': 0.0038035166948328127}. Best is trial 71 with value: 0.7906593680381775.
Trial 102 finished with value: 0.60035640001297 and parameters: {'n_layers': 1, 'weight_decay': 2.2668738299637937e-10, 'n_units_l0': 128, 'optimizer': 'Adam', 'adam_learning_rate': 0.0025841166441353818}. Best is trial 71 with value: 0.7906593680381775.
Trial 103 finished with value: 0.4992513954639435 and parameters: {'n_layers': 2, 'weight_decay': 5.178399519064679e-10, 'n_units_l0': 84, 'n_units_l1': 34, 'optimizer': 'Adam', 'adam_learning_rate': 0.00964238490519556}. Best is trial 71 with value: 0.7906593680381775.
Trial 104 finished with value: 0.770695149898529 and parameters: {'n_layers': 2, 'weight_decay': 1.6314597192496629e-09, 'n_units_l0': 93, 'n_units_l1': 44, 'optimizer': 'Adam', 'adam_learning_rate': 0.003191097831312623}. Best is trial 71 with value: 0.7906593680381775.
Trial 105 finished with value: 0.5222102403640747 and parameters: {'n_layers': 10, 'weight_decay': 1.5918834155296137e-09, 'n_units_l0': 68, 'n_units_l1': 43, 'n_units_l2': 58, 'n_units_l3': 4, 'n_units_l4': 6, 'n_units_l5': 93, 'n_units_l6': 73, 'n_units_l7': 18, 'n_units_l8': 6, 'n_units_l9': 4, 'optimizer': 'Adam', 'adam_learning_rate': 0.0034371159276165523}. Best is trial 71 with value: 0.7906593680381775.
Trial 106 finished with value: 0.5131906867027283 and parameters: {'n_layers': 3, 'weight_decay': 1.6447770095482647e-10, 'n_units_l0': 62, 'n_units_l1': 38, 'n_units_l2': 33, 'optimizer': 'Adam', 'adam_learning_rate': 0.001993376155335541}. Best is trial 71 with value: 0.7906593680381775.
Trial 107 finished with value: 0.7785025238990784 and parameters: {'n_layers': 2, 'weight_decay': 5.402597949877556e-10, 'n_units_l0': 93, 'n_units_l1': 28, 'optimizer': 'Adam', 'adam_learning_rate': 0.002579179171609897}. Best is trial 71 with value: 0.7906593680381775.
Trial 108 finished with value: 0.7079856991767883 and parameters: {'n_layers': 2, 'weight_decay': 6.914537636000473e-10, 'n_units_l0': 5, 'n_units_l1': 29, 'optimizer': 'Adam', 'adam_learning_rate': 0.0011792501419850266}. Best is trial 71 with value: 0.7906593680381775.
Trial 109 finished with value: 0.5280572175979614 and parameters: {'n_layers': 3, 'weight_decay': 1.0537127567941563e-10, 'n_units_l0': 92, 'n_units_l1': 17, 'n_units_l2': 23, 'optimizer': 'Adam', 'adam_learning_rate': 1.527537945280281e-05}. Best is trial 71 with value: 0.7906593680381775.
Trial 110 finished with value: 0.5189661383628845 and parameters: {'n_layers': 2, 'weight_decay': 2.0910307402120427e-09, 'n_units_l0': 54, 'n_units_l1': 26, 'optimizer': 'RMSprop', 'rmsprop_learning_rate': 0.0012071661657904497, 'rmsprop_weight_decay': 0.8817576535957753, 'rmsprop_momentum': 0.007057889607176263}. Best is trial 71 with value: 0.7906593680381775.
Trial 111 finished with value: 0.755222499370575 and parameters: {'n_layers': 2, 'weight_decay': 4.764608134675644e-10, 'n_units_l0': 71, 'n_units_l1': 34, 'optimizer': 'Adam', 'adam_learning_rate': 0.0025605690870050633}. Best is trial 71 with value: 0.7906593680381775.
Trial 112 finished with value: 0.5113725066184998 and parameters: {'n_layers': 2, 'weight_decay': 1.329029405782308e-09, 'n_units_l0': 11, 'n_units_l1': 32, 'optimizer': 'Adam', 'adam_learning_rate': 0.004842209667016615}. Best is trial 71 with value: 0.7906593680381775.
Trial 113 finished with value: 0.767058789730072 and parameters: {'n_layers': 2, 'weight_decay': 2.9980650059854295e-09, 'n_units_l0': 80, 'n_units_l1': 43, 'optimizer': 'Adam', 'adam_learning_rate': 0.0016359695332105774}. Best is trial 71 with value: 0.7906593680381775.
Trial 114 finished with value: 0.5037076473236084 and parameters: {'n_layers': 3, 'weight_decay': 2.681778260483999e-10, 'n_units_l0': 58, 'n_units_l1': 49, 'n_units_l2': 29, 'optimizer': 'Adam', 'adam_learning_rate': 0.003641573976259096}. Best is trial 71 with value: 0.7906593680381775.
Trial 115 finished with value: 0.798573911190033 and parameters: {'n_layers': 2, 'weight_decay': 1.0325812267590434e-09, 'n_units_l0': 86, 'n_units_l1': 40, 'optimizer': 'Adam', 'adam_learning_rate': 0.002375367385948983}. Best is trial 115 with value: 0.798573911190033.
Trial 116 finished with value: 0.526238739490509 and parameters: {'n_layers': 4, 'weight_decay': 3.676752635085115e-05, 'n_units_l0': 97, 'n_units_l1': 40, 'n_units_l2': 81, 'n_units_l3': 5, 'optimizer': 'Adam', 'adam_learning_rate': 0.0023717217304458967}. Best is trial 115 with value: 0.798573911190033.
Trial 117 finished with value: 0.7763992547988892 and parameters: {'n_layers': 1, 'weight_decay': 4.41612107598368e-09, 'n_units_l0': 86, 'optimizer': 'Adam', 'adam_learning_rate': 0.001367808761981676}. Best is trial 115 with value: 0.798573911190033.
Trial 118 finished with value: 0.5156862735748291 and parameters: {'n_layers': 1, 'weight_decay': 4.630857742538606e-09, 'n_units_l0': 84, 'optimizer': 'SGD', 'sgd_opt_learning_rate': 8.734074746122356e-05, 'sgd_opt_momentum': 0.0001816683644366364}. Best is trial 115 with value: 0.798573911190033.
Trial 119 finished with value: 0.7110159993171692 and parameters: {'n_layers': 1, 'weight_decay': 9.721427257292677e-09, 'n_units_l0': 111, 'optimizer': 'Adam', 'adam_learning_rate': 0.0011647493656874812}. Best is trial 115 with value: 0.798573911190033.
Trial 120 finished with value: 0.5477005243301392 and parameters: {'n_layers': 1, 'weight_decay': 6.135086996158123e-10, 'n_units_l0': 67, 'optimizer': 'Adam', 'adam_learning_rate': 0.001927054014801885}. Best is trial 115 with value: 0.798573911190033.
Trial 121 finished with value: 0.7742956876754761 and parameters: {'n_layers': 2, 'weight_decay': 1.51975746784102e-09, 'n_units_l0': 89, 'n_units_l1': 20, 'optimizer': 'Adam', 'adam_learning_rate': 0.0014860086557301653}. Best is trial 115 with value: 0.798573911190033.
Trial 122 finished with value: 0.7812477350234985 and parameters: {'n_layers': 2, 'weight_decay': 2.219230738507915e-09, 'n_units_l0': 73, 'n_units_l1': 36, 'optimizer': 'Adam', 'adam_learning_rate': 0.0013081322682697797}. Best is trial 115 with value: 0.798573911190033.
Trial 123 finished with value: 0.7700532078742981 and parameters: {'n_layers': 1, 'weight_decay': 8.804138966210426e-10, 'n_units_l0': 120, 'optimizer': 'Adam', 'adam_learning_rate': 0.0014051204543888034}. Best is trial 115 with value: 0.798573911190033.
Trial 124 finished with value: 0.7870228886604309 and parameters: {'n_layers': 2, 'weight_decay': 1.2034709129322621e-09, 'n_units_l0': 71, 'n_units_l1': 17, 'optimizer': 'Adam', 'adam_learning_rate': 0.0007235419537430732}. Best is trial 115 with value: 0.798573911190033.
Trial 125 finished with value: 0.7697325348854065 and parameters: {'n_layers': 2, 'weight_decay': 1.231249691880393e-09, 'n_units_l0': 73, 'n_units_l1': 16, 'optimizer': 'Adam', 'adam_learning_rate': 0.0009689279601051653}. Best is trial 115 with value: 0.798573911190033.
Trial 126 finished with value: 0.5147237777709961 and parameters: {'n_layers': 1, 'weight_decay': 2.0560135697264826e-09, 'n_units_l0': 86, 'optimizer': 'Adam', 'adam_learning_rate': 0.0005825406845177388}. Best is trial 115 with value: 0.798573911190033.
Trial 127 finished with value: 0.6965063214302063 and parameters: {'n_layers': 3, 'weight_decay': 4.1353575649594023e-10, 'n_units_l0': 102, 'n_units_l1': 20, 'n_units_l2': 19, 'optimizer': 'Adam', 'adam_learning_rate': 0.0006771551695249151}. Best is trial 115 with value: 0.798573911190033.
Trial 128 finished with value: 0.7627807855606079 and parameters: {'n_layers': 2, 'weight_decay': 6.391399139727893e-10, 'n_units_l0': 78, 'n_units_l1': 10, 'optimizer': 'Adam', 'adam_learning_rate': 0.0015711573737245046}. Best is trial 115 with value: 0.798573911190033.
Trial 129 finished with value: 0.5531551241874695 and parameters: {'n_layers': 1, 'weight_decay': 1.5625084146502675e-09, 'n_units_l0': 86, 'optimizer': 'Adam', 'adam_learning_rate': 0.0007910990739828521}. Best is trial 115 with value: 0.798573911190033.
Trial 130 finished with value: 0.7782529592514038 and parameters: {'n_layers': 2, 'weight_decay': 4.117661187687343e-09, 'n_units_l0': 63, 'n_units_l1': 13, 'optimizer': 'Adam', 'adam_learning_rate': 0.001310322682845097}. Best is trial 115 with value: 0.798573911190033.
Trial 131 finished with value: 0.7481996417045593 and parameters: {'n_layers': 2, 'weight_decay': 4.241293424335428e-09, 'n_units_l0': 64, 'n_units_l1': 14, 'optimizer': 'Adam', 'adam_learning_rate': 0.0012790145368189682}. Best is trial 115 with value: 0.798573911190033.
Trial 132 finished with value: 0.505918025970459 and parameters: {'n_layers': 2, 'weight_decay': 6.718934254335667e-09, 'n_units_l0': 71, 'n_units_l1': 18, 'optimizer': 'Adam', 'adam_learning_rate': 0.001053924341468656}. Best is trial 115 with value: 0.798573911190033.
Trial 133 finished with value: 0.5062031149864197 and parameters: {'n_layers': 1, 'weight_decay': 2.510675772541198e-09, 'n_units_l0': 76, 'optimizer': 'Adam', 'adam_learning_rate': 0.0019693641669702782}. Best is trial 115 with value: 0.798573911190033.
Trial 134 finished with value: 0.5373618006706238 and parameters: {'n_layers': 2, 'weight_decay': 1.124269578559487e-09, 'n_units_l0': 61, 'n_units_l1': 13, 'optimizer': 'Adam', 'adam_learning_rate': 0.0003298830235245472}. Best is trial 115 with value: 0.798573911190033.
Trial 135 finished with value: 0.507165789604187 and parameters: {'n_layers': 3, 'weight_decay': 8.269214729832561e-10, 'n_units_l0': 92, 'n_units_l1': 12, 'n_units_l2': 37, 'optimizer': 'Adam', 'adam_learning_rate': 0.001484648413859077}. Best is trial 115 with value: 0.798573911190033.
Trial 136 finished with value: 0.7746167778968811 and parameters: {'n_layers': 2, 'weight_decay': 2.1549716839583054e-09, 'n_units_l0': 68, 'n_units_l1': 11, 'optimizer': 'Adam', 'adam_learning_rate': 0.002558152815970733}. Best is trial 115 with value: 0.798573911190033.
Trial 137 finished with value: 0.5140820145606995 and parameters: {'n_layers': 2, 'weight_decay': 1.2728526923752932e-08, 'n_units_l0': 51, 'n_units_l1': 8, 'optimizer': 'Adam', 'adam_learning_rate': 2.162936371796106e-05}. Best is trial 115 with value: 0.798573911190033.
Trial 138 finished with value: 0.5141177177429199 and parameters: {'n_layers': 9, 'weight_decay': 2.3804360063935292e-09, 'n_units_l0': 68, 'n_units_l1': 10, 'n_units_l2': 52, 'n_units_l3': 5, 'n_units_l4': 4, 'n_units_l5': 9, 'n_units_l6': 20, 'n_units_l7': 9, 'n_units_l8': 18, 'optimizer': 'RMSprop', 'rmsprop_learning_rate': 7.204862959131009e-05, 'rmsprop_weight_decay': 0.9303494142657697, 'rmsprop_momentum': 5.4228009103785396e-05}. Best is trial 115 with value: 0.798573911190033.
Trial 139 finished with value: 0.7654902338981628 and parameters: {'n_layers': 1, 'weight_decay': 3.754817586183488e-09, 'n_units_l0': 44, 'optimizer': 'Adam', 'adam_learning_rate': 0.00295437969044352}. Best is trial 115 with value: 0.798573911190033.
Trial 140 finished with value: 0.504349410533905 and parameters: {'n_layers': 3, 'weight_decay': 3.1670593607028054e-10, 'n_units_l0': 55, 'n_units_l1': 15, 'n_units_l2': 21, 'optimizer': 'Adam', 'adam_learning_rate': 0.006554423902931774}. Best is trial 115 with value: 0.798573911190033.
Trial 141 finished with value: 0.5388591289520264 and parameters: {'n_layers': 2, 'weight_decay': 1.6838228258197188e-09, 'n_units_l0': 80, 'n_units_l1': 11, 'optimizer': 'Adam', 'adam_learning_rate': 0.0019276103086906342}. Best is trial 115 with value: 0.798573911190033.
