Trial 142 finished with value: 0.7667022347450256 and parameters: {'n_layers': 2, 'weight_decay': 9.690994256887121e-10, 'n_units_l0': 8, 'n_units_l1': 12, 'optimizer': 'Adam', 'adam_learning_rate': 0.002280625939818823}. Best is trial 115 with value: 0.798573911190033.
Trial 143 finished with value: 0.508306622505188 and parameters: {'n_layers': 2, 'weight_decay': 5.5358535864465766e-09, 'n_units_l0': 72, 'n_units_l1': 21, 'optimizer': 'Adam', 'adam_learning_rate': 0.0027681631011967777}. Best is trial 115 with value: 0.798573911190033.
Trial 144 finished with value: 0.7794651985168457 and parameters: {'n_layers': 2, 'weight_decay': 1.8970766458978012e-09, 'n_units_l0': 62, 'n_units_l1': 36, 'optimizer': 'Adam', 'adam_learning_rate': 0.0016494106946987254}. Best is trial 115 with value: 0.798573911190033.
Trial 145 finished with value: 0.7509445548057556 and parameters: {'n_layers': 2, 'weight_decay': 3.4062781723457827e-09, 'n_units_l0': 64, 'n_units_l1': 36, 'optimizer': 'Adam', 'adam_learning_rate': 0.00045713657729438777}. Best is trial 115 with value: 0.798573911190033.
Trial 146 finished with value: 0.596113920211792 and parameters: {'n_layers': 1, 'weight_decay': 2.258761928575721e-09, 'n_units_l0': 59, 'optimizer': 'Adam', 'adam_learning_rate': 0.0008869511759071416}. Best is trial 115 with value: 0.798573911190033.
Trial 147 finished with value: 0.5120141506195068 and parameters: {'n_layers': 4, 'weight_decay': 6.148970026758335e-10, 'n_units_l0': 65, 'n_units_l1': 30, 'n_units_l2': 27, 'n_units_l3': 9, 'optimizer': 'SGD', 'sgd_opt_learning_rate': 0.015780214469899183, 'sgd_opt_momentum': 0.009623225027997647}. Best is trial 115 with value: 0.798573911190033.
Trial 148 finished with value: 0.5110517144203186 and parameters: {'n_layers': 7, 'weight_decay': 1.2744103591375791e-09, 'n_units_l0': 49, 'n_units_l1': 27, 'n_units_l2': 45, 'n_units_l3': 6, 'n_units_l4': 79, 'n_units_l5': 48, 'n_units_l6': 6, 'optimizer': 'Adam', 'adam_learning_rate': 0.00023934685645172414}. Best is trial 115 with value: 0.798573911190033.
Trial 149 finished with value: 0.49012473225593567 and parameters: {'n_layers': 2, 'weight_decay': 0.0009934629529885154, 'n_units_l0': 77, 'n_units_l1': 15, 'optimizer': 'Adam', 'adam_learning_rate': 0.00014867395951336722}. Best is trial 115 with value: 0.798573911190033.
Trial 150 finished with value: 0.7721567153930664 and parameters: {'n_layers': 3, 'weight_decay': 4.939345223932162e-10, 'n_units_l0': 56, 'n_units_l1': 32, 'n_units_l2': 66, 'optimizer': 'Adam', 'adam_learning_rate': 0.0021949501267518605}. Best is trial 115 with value: 0.798573911190033.
Trial 151 finished with value: 0.7749375700950623 and parameters: {'n_layers': 2, 'weight_decay': 1.323099828521288e-09, 'n_units_l0': 98, 'n_units_l1': 36, 'optimizer': 'Adam', 'adam_learning_rate': 0.001644300243122079}. Best is trial 115 with value: 0.798573911190033.
Trial 152 finished with value: 0.7706594467163086 and parameters: {'n_layers': 2, 'weight_decay': 8.570466498618222e-10, 'n_units_l0': 98, 'n_units_l1': 35, 'optimizer': 'Adam', 'adam_learning_rate': 0.0017300219674549692}. Best is trial 115 with value: 0.798573911190033.
Trial 153 finished with value: 0.7794296145439148 and parameters: {'n_layers': 2, 'weight_decay': 1.7452260437990823e-09, 'n_units_l0': 81, 'n_units_l1': 37, 'optimizer': 'Adam', 'adam_learning_rate': 0.0011303727044260903}. Best is trial 115 with value: 0.798573911190033.
Trial 154 finished with value: 0.6329054832458496 and parameters: {'n_layers': 1, 'weight_decay': 1.1084567381165923e-09, 'n_units_l0': 107, 'optimizer': 'Adam', 'adam_learning_rate': 0.0010879495717849542}. Best is trial 115 with value: 0.798573911190033.
Trial 155 finished with value: 0.7876290678977966 and parameters: {'n_layers': 2, 'weight_decay': 2.0335538071483388e-10, 'n_units_l0': 82, 'n_units_l1': 38, 'optimizer': 'Adam', 'adam_learning_rate': 0.0012794762423957032}. Best is trial 115 with value: 0.798573911190033.
Trial 156 finished with value: 0.7334045767784119 and parameters: {'n_layers': 2, 'weight_decay': 1.4082529155554502e-10, 'n_units_l0': 84, 'n_units_l1': 38, 'optimizer': 'Adam', 'adam_learning_rate': 0.0012019626694634402}. Best is trial 115 with value: 0.798573911190033.
Trial 157 finished with value: 0.6014261245727539 and parameters: {'n_layers': 1, 'weight_decay': 2.145262682385285e-10, 'n_units_l0': 81, 'optimizer': 'Adam', 'adam_learning_rate': 0.0007434106126431387}. Best is trial 115 with value: 0.798573911190033.
Trial 158 finished with value: 0.7639924883842468 and parameters: {'n_layers': 2, 'weight_decay': 2.7967077227783713e-10, 'n_units_l0': 76, 'n_units_l1': 5, 'optimizer': 'Adam', 'adam_learning_rate': 0.0012867172307017816}. Best is trial 115 with value: 0.798573911190033.
Trial 159 finished with value: 0.5137611031532288 and parameters: {'n_layers': 3, 'weight_decay': 4.0870544970332917e-10, 'n_units_l0': 61, 'n_units_l1': 46, 'n_units_l2': 17, 'optimizer': 'Adam', 'adam_learning_rate': 0.0010407234033159927}. Best is trial 115 with value: 0.798573911190033.
Trial 160 finished with value: 0.7345810532569885 and parameters: {'n_layers': 2, 'weight_decay': 6.93289125076838e-10, 'n_units_l0': 72, 'n_units_l1': 28, 'optimizer': 'Adam', 'adam_learning_rate': 0.004789602283794899}. Best is trial 115 with value: 0.798573911190033.
Trial 161 finished with value: 0.7452760338783264 and parameters: {'n_layers': 2, 'weight_decay': 1.7750016834807434e-09, 'n_units_l0': 94, 'n_units_l1': 34, 'optimizer': 'Adam', 'adam_learning_rate': 0.001783453829670413}. Best is trial 115 with value: 0.798573911190033.
Trial 162 finished with value: 0.768306314945221 and parameters: {'n_layers': 2, 'weight_decay': 2.938828237092115e-09, 'n_units_l0': 87, 'n_units_l1': 38, 'optimizer': 'Adam', 'adam_learning_rate': 0.0014369172998727686}. Best is trial 115 with value: 0.798573911190033.
Trial 163 finished with value: 0.7797502875328064 and parameters: {'n_layers': 2, 'weight_decay': 1.1950735832198325e-09, 'n_units_l0': 119, 'n_units_l1': 32, 'optimizer': 'Adam', 'adam_learning_rate': 0.0009218100176765285}. Best is trial 115 with value: 0.798573911190033.
Trial 164 finished with value: 0.657646894454956 and parameters: {'n_layers': 1, 'weight_decay': 4.817329332799061e-10, 'n_units_l0': 126, 'optimizer': 'Adam', 'adam_learning_rate': 0.0008934207016341844}. Best is trial 115 with value: 0.798573911190033.
Trial 165 finished with value: 0.7840283513069153 and parameters: {'n_layers': 2, 'weight_decay': 8.131452646857902e-10, 'n_units_l0': 116, 'n_units_l1': 32, 'optimizer': 'Adam', 'adam_learning_rate': 0.0006252617400487874}. Best is trial 115 with value: 0.798573911190033.
Trial 166 finished with value: 0.7440284490585327 and parameters: {'n_layers': 2, 'weight_decay': 1.9093790984032892e-10, 'n_units_l0': 116, 'n_units_l1': 24, 'optimizer': 'Adam', 'adam_learning_rate': 0.0006426505199092988}. Best is trial 115 with value: 0.798573911190033.
Trial 167 finished with value: 0.5131193995475769 and parameters: {'n_layers': 2, 'weight_decay': 8.177880287920985e-10, 'n_units_l0': 110, 'n_units_l1': 31, 'optimizer': 'RMSprop', 'rmsprop_learning_rate': 0.007403749968113532, 'rmsprop_weight_decay': 0.9649247163418961, 'rmsprop_momentum': 0.002139246870441653}. Best is trial 115 with value: 0.798573911190033.
Trial 168 finished with value: 0.755793035030365 and parameters: {'n_layers': 1, 'weight_decay': 3.204908329326599e-10, 'n_units_l0': 123, 'optimizer': 'Adam', 'adam_learning_rate': 0.00044197073181955203}. Best is trial 115 with value: 0.798573911190033.
Trial 169 finished with value: 0.7831014394760132 and parameters: {'n_layers': 2, 'weight_decay': 6.586056774381639e-10, 'n_units_l0': 115, 'n_units_l1': 41, 'optimizer': 'Adam', 'adam_learning_rate': 0.0007312650858100829}. Best is trial 115 with value: 0.798573911190033.
Trial 170 finished with value: 0.7767913341522217 and parameters: {'n_layers': 2, 'weight_decay': 5.553980816729582e-10, 'n_units_l0': 104, 'n_units_l1': 42, 'optimizer': 'Adam', 'adam_learning_rate': 0.0005394650775340764}. Best is trial 115 with value: 0.798573911190033.
Trial 171 finished with value: 0.7688055634498596 and parameters: {'n_layers': 2, 'weight_decay': 5.855022643830405e-10, 'n_units_l0': 106, 'n_units_l1': 41, 'optimizer': 'Adam', 'adam_learning_rate': 0.0005298264098794542}. Best is trial 115 with value: 0.798573911190033.
Trial 172 finished with value: 0.6761496067047119 and parameters: {'n_layers': 2, 'weight_decay': 1.0538552090825356e-09, 'n_units_l0': 115, 'n_units_l1': 45, 'optimizer': 'Adam', 'adam_learning_rate': 0.0003495301800035686}. Best is trial 115 with value: 0.798573911190033.
Trial 173 finished with value: 0.7843135595321655 and parameters: {'n_layers': 2, 'weight_decay': 4.3390070786617654e-10, 'n_units_l0': 127, 'n_units_l1': 33, 'optimizer': 'Adam', 'adam_learning_rate': 0.0008251269915211466}. Best is trial 115 with value: 0.798573911190033.
Trial 174 finished with value: 0.7824953198432922 and parameters: {'n_layers': 2, 'weight_decay': 3.646669412932066e-10, 'n_units_l0': 120, 'n_units_l1': 33, 'optimizer': 'Adam', 'adam_learning_rate': 0.000820736030436746}. Best is trial 115 with value: 0.798573911190033.
Trial 175 finished with value: 0.7806771993637085 and parameters: {'n_layers': 2, 'weight_decay': 2.3232675084942276e-10, 'n_units_l0': 128, 'n_units_l1': 32, 'optimizer': 'Adam', 'adam_learning_rate': 0.0007317110749930545}. Best is trial 115 with value: 0.798573911190033.
Trial 176 finished with value: 0.7470231056213379 and parameters: {'n_layers': 2, 'weight_decay': 1.4376629911382295e-10, 'n_units_l0': 127, 'n_units_l1': 32, 'optimizer': 'Adam', 'adam_learning_rate': 0.0006721858229587765}. Best is trial 115 with value: 0.798573911190033.
Trial 177 finished with value: 0.7791085243225098 and parameters: {'n_layers': 2, 'weight_decay': 1.945831900531012e-10, 'n_units_l0': 118, 'n_units_l1': 29, 'optimizer': 'Adam', 'adam_learning_rate': 0.0007896559072435996}. Best is trial 115 with value: 0.798573911190033.
Trial 178 finished with value: 0.7446343898773193 and parameters: {'n_layers': 2, 'weight_decay': 2.284940109323044e-10, 'n_units_l0': 121, 'n_units_l1': 30, 'optimizer': 'Adam', 'adam_learning_rate': 0.0008525524000601664}. Best is trial 115 with value: 0.798573911190033.
Trial 179 finished with value: 0.5165063142776489 and parameters: {'n_layers': 2, 'weight_decay': 3.194899409344652e-10, 'n_units_l0': 116, 'n_units_l1': 26, 'optimizer': 'SGD', 'sgd_opt_learning_rate': 8.848978493474696e-05, 'sgd_opt_momentum': 7.58569924693778e-05}. Best is trial 115 with value: 0.798573911190033.
Trial 180 finished with value: 0.7852048277854919 and parameters: {'n_layers': 2, 'weight_decay': 1.7928625626804989e-10, 'n_units_l0': 128, 'n_units_l1': 28, 'optimizer': 'Adam', 'adam_learning_rate': 0.0007744943944225479}. Best is trial 115 with value: 0.798573911190033.
Trial 181 finished with value: 0.7506237030029297 and parameters: {'n_layers': 2, 'weight_decay': 1.3332592087574215e-10, 'n_units_l0': 114, 'n_units_l1': 33, 'optimizer': 'Adam', 'adam_learning_rate': 0.0007443913647691631}. Best is trial 115 with value: 0.798573911190033.
Trial 182 finished with value: 0.7819250226020813 and parameters: {'n_layers': 2, 'weight_decay': 2.0663138487274207e-10, 'n_units_l0': 123, 'n_units_l1': 35, 'optimizer': 'Adam', 'adam_learning_rate': 0.0006059193379504662}. Best is trial 115 with value: 0.798573911190033.
Trial 183 finished with value: 0.7792155146598816 and parameters: {'n_layers': 2, 'weight_decay': 1.0139669286976829e-10, 'n_units_l0': 127, 'n_units_l1': 36, 'optimizer': 'Adam', 'adam_learning_rate': 0.000615514106953678}. Best is trial 115 with value: 0.798573911190033.
Trial 184 finished with value: 0.7894830107688904 and parameters: {'n_layers': 2, 'weight_decay': 1.801901560419721e-10, 'n_units_l0': 127, 'n_units_l1': 36, 'optimizer': 'Adam', 'adam_learning_rate': 0.0005881252605672345}. Best is trial 115 with value: 0.798573911190033.
Trial 185 finished with value: 0.7627448439598083 and parameters: {'n_layers': 2, 'weight_decay': 2.400601510948297e-10, 'n_units_l0': 123, 'n_units_l1': 35, 'optimizer': 'Adam', 'adam_learning_rate': 0.00048152212637941585}. Best is trial 115 with value: 0.798573911190033.
Trial 186 finished with value: 0.7653117179870605 and parameters: {'n_layers': 2, 'weight_decay': 1.6203698221593854e-10, 'n_units_l0': 111, 'n_units_l1': 38, 'optimizer': 'Adam', 'adam_learning_rate': 0.0009623200032522031}. Best is trial 115 with value: 0.798573911190033.
Trial 187 finished with value: 0.7534045577049255 and parameters: {'n_layers': 2, 'weight_decay': 3.5808524727437225e-10, 'n_units_l0': 126, 'n_units_l1': 33, 'optimizer': 'Adam', 'adam_learning_rate': 0.0006153408959318088}. Best is trial 115 with value: 0.798573911190033.
Trial 188 finished with value: 0.6962209343910217 and parameters: {'n_layers': 2, 'weight_decay': 3.833518487668065e-10, 'n_units_l0': 112, 'n_units_l1': 40, 'optimizer': 'Adam', 'adam_learning_rate': 0.0007438918457383433}. Best is trial 115 with value: 0.798573911190033.
Trial 189 finished with value: 0.6776469349861145 and parameters: {'n_layers': 2, 'weight_decay': 2.533213558251607e-10, 'n_units_l0': 106, 'n_units_l1': 31, 'optimizer': 'Adam', 'adam_learning_rate': 0.0003816630003112539}. Best is trial 115 with value: 0.798573911190033.
Trial 190 finished with value: 0.7555436491966248 and parameters: {'n_layers': 3, 'weight_decay': 1.7087429307579362e-10, 'n_units_l0': 119, 'n_units_l1': 37, 'n_units_l2': 88, 'optimizer': 'Adam', 'adam_learning_rate': 0.000943734243839687}. Best is trial 115 with value: 0.798573911190033.
Trial 191 finished with value: 0.7718715071678162 and parameters: {'n_layers': 2, 'weight_decay': 1.674297832496543e-10, 'n_units_l0': 126, 'n_units_l1': 36, 'optimizer': 'Adam', 'adam_learning_rate': 0.0005990962306752296}. Best is trial 115 with value: 0.798573911190033.
Trial 192 finished with value: 0.7615682482719421 and parameters: {'n_layers': 2, 'weight_decay': 1.0389219947227228e-10, 'n_units_l0': 126, 'n_units_l1': 35, 'optimizer': 'Adam', 'adam_learning_rate': 0.0006770666930528558}. Best is trial 115 with value: 0.798573911190033.
Trial 193 finished with value: 0.759750247001648 and parameters: {'n_layers': 2, 'weight_decay': 1.1171097741329998e-10, 'n_units_l0': 116, 'n_units_l1': 32, 'optimizer': 'Adam', 'adam_learning_rate': 0.0005697924392226592}. Best is trial 115 with value: 0.798573911190033.
Trial 194 finished with value: 0.7628164291381836 and parameters: {'n_layers': 2, 'weight_decay': 2.2251310253256078e-10, 'n_units_l0': 127, 'n_units_l1': 41, 'optimizer': 'Adam', 'adam_learning_rate': 0.0010137429609365558}. Best is trial 115 with value: 0.798573911190033.
Trial 195 finished with value: 0.7780032753944397 and parameters: {'n_layers': 2, 'weight_decay': 2.906926291730661e-10, 'n_units_l0': 103, 'n_units_l1': 34, 'optimizer': 'Adam', 'adam_learning_rate': 0.0008247109934695885}. Best is trial 115 with value: 0.798573911190033.
Trial 196 finished with value: 0.7483064532279968 and parameters: {'n_layers': 2, 'weight_decay': 1.0667865867220632e-10, 'n_units_l0': 109, 'n_units_l1': 30, 'optimizer': 'Adam', 'adam_learning_rate': 0.00042095541677231114}. Best is trial 115 with value: 0.798573911190033.
Trial 197 finished with value: 0.7606773972511292 and parameters: {'n_layers': 2, 'weight_decay': 3.266859643862844e-10, 'n_units_l0': 118, 'n_units_l1': 38, 'optimizer': 'Adam', 'adam_learning_rate': 0.0004993646522103336}. Best is trial 115 with value: 0.798573911190033.
Trial 198 finished with value: 0.6997503042221069 and parameters: {'n_layers': 2, 'weight_decay': 4.820527117138142e-10, 'n_units_l0': 100, 'n_units_l1': 44, 'optimizer': 'Adam', 'adam_learning_rate': 0.0011240311318883416}. Best is trial 115 with value: 0.798573911190033.
Trial 199 finished with value: 0.7488412857055664 and parameters: {'n_layers': 3, 'weight_decay': 1.753620812262603e-10, 'n_units_l0': 127, 'n_units_l1': 28, 'n_units_l2': 127, 'optimizer': 'Adam', 'adam_learning_rate': 0.0007306952504017442}. Best is trial 115 with value: 0.798573911190033.
Trial 200 finished with value: 0.7788947820663452 and parameters: {'n_layers': 2, 'weight_decay': 8.141453378999673e-10, 'n_units_l0': 110, 'n_units_l1': 116, 'optimizer': 'Adam', 'adam_learning_rate': 0.0007916243433582659}. Best is trial 115 with value: 0.798573911190033.
Trial 201 finished with value: 0.7719071507453918 and parameters: {'n_layers': 2, 'weight_decay': 1.464907193023123e-10, 'n_units_l0': 113, 'n_units_l1': 30, 'optimizer': 'Adam', 'adam_learning_rate': 0.000625905064682612}. Best is trial 115 with value: 0.798573911190033.
Trial 202 finished with value: 0.775793194770813 and parameters: {'n_layers': 2, 'weight_decay': 2.0613370506180492e-10, 'n_units_l0': 128, 'n_units_l1': 36, 'optimizer': 'Adam', 'adam_learning_rate': 0.0008731248034038505}. Best is trial 115 with value: 0.798573911190033.
Trial 203 finished with value: 0.7742958068847656 and parameters: {'n_layers': 2, 'weight_decay': 2.2946254948805387e-10, 'n_units_l0': 119, 'n_units_l1': 33, 'optimizer': 'Adam', 'adam_learning_rate': 0.001095986136257212}. Best is trial 115 with value: 0.798573911190033.
Trial 204 finished with value: 0.7609623074531555 and parameters: {'n_layers': 2, 'weight_decay': 1.0005213583089087e-10, 'n_units_l0': 118, 'n_units_l1': 29, 'optimizer': 'Adam', 'adam_learning_rate': 0.0007728783561035643}. Best is trial 115 with value: 0.798573911190033.
Trial 205 finished with value: 0.7788233160972595 and parameters: {'n_layers': 2, 'weight_decay': 4.298239530315623e-10, 'n_units_l0': 100, 'n_units_l1': 39, 'optimizer': 'Adam', 'adam_learning_rate': 0.0005355212218521827}. Best is trial 115 with value: 0.798573911190033.
Trial 206 finished with value: 0.7688412666320801 and parameters: {'n_layers': 2, 'weight_decay': 2.713241222779265e-10, 'n_units_l0': 128, 'n_units_l1': 26, 'optimizer': 'Adam', 'adam_learning_rate': 0.000914979376167632}. Best is trial 115 with value: 0.798573911190033.
Trial 207 finished with value: 0.5128698945045471 and parameters: {'n_layers': 2, 'weight_decay': 3.945911238134002e-06, 'n_units_l0': 105, 'n_units_l1': 36, 'optimizer': 'RMSprop', 'rmsprop_learning_rate': 0.0005991457074774481, 'rmsprop_weight_decay': 0.9007869103192165, 'rmsprop_momentum': 0.022900962074098998}. Best is trial 115 with value: 0.798573911190033.
Trial 208 finished with value: 0.745561420917511 and parameters: {'n_layers': 2, 'weight_decay': 1.4883903854147703e-10, 'n_units_l0': 118, 'n_units_l1': 33, 'optimizer': 'Adam', 'adam_learning_rate': 0.0006356567682012673}. Best is trial 115 with value: 0.798573911190033.
Trial 209 finished with value: 0.7346165180206299 and parameters: {'n_layers': 3, 'weight_decay': 3.6366254765861477e-10, 'n_units_l0': 111, 'n_units_l1': 28, 'n_units_l2': 108, 'optimizer': 'Adam', 'adam_learning_rate': 0.001197446950638038}. Best is trial 115 with value: 0.798573911190033.
Trial 210 finished with value: 0.7443135976791382 and parameters: {'n_layers': 2, 'weight_decay': 7.108523147579264e-10, 'n_units_l0': 13, 'n_units_l1': 41, 'optimizer': 'Adam', 'adam_learning_rate': 0.0010048870877342312}. Best is trial 115 with value: 0.798573911190033.
Trial 211 finished with value: 0.7852049469947815 and parameters: {'n_layers': 2, 'weight_decay': 8.635459626536228e-10, 'n_units_l0': 111, 'n_units_l1': 110, 'optimizer': 'Adam', 'adam_learning_rate': 0.0007831265043439108}. Best is trial 115 with value: 0.798573911190033.
Trial 212 finished with value: 0.7673439383506775 and parameters: {'n_layers': 2, 'weight_decay': 9.745308221512892e-10, 'n_units_l0': 119, 'n_units_l1': 92, 'optimizer': 'Adam', 'adam_learning_rate': 0.0007573829384452343}. Best is trial 115 with value: 0.798573911190033.
Trial 213 finished with value: 0.7691976428031921 and parameters: {'n_layers': 2, 'weight_decay': 1.2343108602968548e-09, 'n_units_l0': 109, 'n_units_l1': 100, 'optimizer': 'Adam', 'adam_learning_rate': 0.0005143385322240986}. Best is trial 115 with value: 0.798573911190033.
Trial 214 finished with value: 0.7606415748596191 and parameters: {'n_layers': 2, 'weight_decay': 6.58025402088155e-10, 'n_units_l0': 128, 'n_units_l1': 115, 'optimizer': 'Adam', 'adam_learning_rate': 0.000668918585184417}. Best is trial 115 with value: 0.798573911190033.
Trial 215 finished with value: 0.7822456955909729 and parameters: {'n_layers': 2, 'weight_decay': 1.74191239900171e-09, 'n_units_l0': 96, 'n_units_l1': 108, 'optimizer': 'Adam', 'adam_learning_rate': 0.0008261783689252066}. Best is trial 115 with value: 0.798573911190033.
Trial 216 finished with value: 0.7647058367729187 and parameters: {'n_layers': 2, 'weight_decay': 1.5988347626416183e-09, 'n_units_l0': 95, 'n_units_l1': 111, 'optimizer': 'Adam', 'adam_learning_rate': 0.0012670135712610654}. Best is trial 115 with value: 0.798573911190033.
Trial 217 finished with value: 0.7715506553649902 and parameters: {'n_layers': 2, 'weight_decay': 1.4643716757600982e-09, 'n_units_l0': 91, 'n_units_l1': 38, 'optimizer': 'Adam', 'adam_learning_rate': 0.0009191588459671479}. Best is trial 115 with value: 0.798573911190033.
Trial 218 finished with value: 0.4998929500579834 and parameters: {'n_layers': 2, 'weight_decay': 4.441958493139949e-10, 'n_units_l0': 103, 'n_units_l1': 35, 'optimizer': 'SGD', 'sgd_opt_learning_rate': 0.0017692080090634305, 'sgd_opt_momentum': 0.0005610344645096792}. Best is trial 115 with value: 0.798573911190033.
Trial 219 finished with value: 0.7513011693954468 and parameters: {'n_layers': 2, 'weight_decay': 1.9424274601089473e-09, 'n_units_l0': 99, 'n_units_l1': 121, 'optimizer': 'Adam', 'adam_learning_rate': 0.0006084058929810458}. Best is trial 115 with value: 0.798573911190033.
