A new study created in memory with name: no-name-50f59255-857b-48c2-b643-0b7c3037da4f
Trial 0 finished with value: 0.534065306186676 and parameters: {'n_layers': 5, 'weight_decay': 2.580300631214757e-10, 'n_units_l0': 15, 'n_units_l1': 9, 'n_units_l2': 45, 'n_units_l3': 28, 'n_units_l4': 24, 'optimizer': 'RMSprop', 'rmsprop_learning_rate': 1.2303623996985438e-05, 'rmsprop_weight_decay': 0.8711331780438308, 'rmsprop_momentum': 0.0009610510630042119}. Best is trial 0 with value: 0.534065306186676.
Trial 1 finished with value: 0.5093768239021301 and parameters: {'n_layers': 1, 'weight_decay': 5.158049883301461e-06, 'n_units_l0': 90, 'optimizer': 'RMSprop', 'rmsprop_learning_rate': 0.09228319362950446, 'rmsprop_weight_decay': 0.9708554255266374, 'rmsprop_momentum': 0.006495315907883375}. Best is trial 0 with value: 0.534065306186676.
Trial 2 finished with value: 0.5093768239021301 and parameters: {'n_layers': 6, 'weight_decay': 9.810762501095867e-08, 'n_units_l0': 88, 'n_units_l1': 75, 'n_units_l2': 88, 'n_units_l3': 7, 'n_units_l4': 21, 'n_units_l5': 9, 'optimizer': 'Adam', 'adam_learning_rate': 0.0016686890075192301}. Best is trial 0 with value: 0.534065306186676.
Trial 3 finished with value: 0.5093768239021301 and parameters: {'n_layers': 1, 'weight_decay': 0.0003970240434987626, 'n_units_l0': 46, 'optimizer': 'SGD', 'sgd_opt_learning_rate': 0.00015052574998110322, 'sgd_opt_momentum': 7.254162079153121e-05}. Best is trial 0 with value: 0.534065306186676.
Trial 4 finished with value: 0.6067061424255371 and parameters: {'n_layers': 2, 'weight_decay': 0.00034555738409479327, 'n_units_l0': 6, 'n_units_l1': 7, 'optimizer': 'SGD', 'sgd_opt_learning_rate': 0.008085318957646376, 'sgd_opt_momentum': 0.0002493816881735124}. Best is trial 4 with value: 0.6067061424255371.
Trial 5 finished with value: 0.7636786699295044 and parameters: {'n_layers': 2, 'weight_decay': 2.994991459577728e-09, 'n_units_l0': 65, 'n_units_l1': 24, 'optimizer': 'SGD', 'sgd_opt_learning_rate': 0.03212896402693415, 'sgd_opt_momentum': 0.007473390225526082}. Best is trial 5 with value: 0.7636786699295044.
Trial 6 finished with value: 0.7813644409179688 and parameters: {'n_layers': 6, 'weight_decay': 7.399811736679369e-10, 'n_units_l0': 8, 'n_units_l1': 32, 'n_units_l2': 64, 'n_units_l3': 30, 'n_units_l4': 4, 'n_units_l5': 21, 'optimizer': 'Adam', 'adam_learning_rate': 8.892948215151603e-05}. Best is trial 6 with value: 0.7813644409179688.
Trial 7 finished with value: 0.5093768239021301 and parameters: {'n_layers': 2, 'weight_decay': 1.2304199841761502e-06, 'n_units_l0': 10, 'n_units_l1': 104, 'optimizer': 'Adam', 'adam_learning_rate': 0.0011424407062986476}. Best is trial 6 with value: 0.7813644409179688.
Trial 8 finished with value: 0.5093768239021301 and parameters: {'n_layers': 7, 'weight_decay': 4.870434427351911e-08, 'n_units_l0': 5, 'n_units_l1': 16, 'n_units_l2': 4, 'n_units_l3': 58, 'n_units_l4': 19, 'n_units_l5': 4, 'n_units_l6': 79, 'optimizer': 'Adam', 'adam_learning_rate': 0.09356568088561669}. Best is trial 6 with value: 0.7813644409179688.
Trial 9 finished with value: 0.5093768239021301 and parameters: {'n_layers': 3, 'weight_decay': 8.532915277460162e-08, 'n_units_l0': 4, 'n_units_l1': 83, 'n_units_l2': 21, 'optimizer': 'SGD', 'sgd_opt_learning_rate': 1.7281679578833842e-05, 'sgd_opt_momentum': 0.07254252845489739}. Best is trial 6 with value: 0.7813644409179688.
Trial 10 finished with value: 0.7596434354782104 and parameters: {'n_layers': 10, 'weight_decay': 1.292916554642619e-10, 'n_units_l0': 31, 'n_units_l1': 35, 'n_units_l2': 18, 'n_units_l3': 97, 'n_units_l4': 4, 'n_units_l5': 118, 'n_units_l6': 4, 'n_units_l7': 12, 'n_units_l8': 73, 'n_units_l9': 74, 'optimizer': 'Adam', 'adam_learning_rate': 1.6049009444991008e-05}. Best is trial 6 with value: 0.7813644409179688.
Trial 11 finished with value: 0.730147659778595 and parameters: {'n_layers': 4, 'weight_decay': 2.5909913409031693e-09, 'n_units_l0': 18, 'n_units_l1': 28, 'n_units_l2': 114, 'n_units_l3': 12, 'optimizer': 'SGD', 'sgd_opt_learning_rate': 0.06351240143501266, 'sgd_opt_momentum': 0.021741652625170634}. Best is trial 6 with value: 0.7813644409179688.
Trial 12 finished with value: 0.5093768239021301 and parameters: {'n_layers': 8, 'weight_decay': 4.131553131640285e-09, 'n_units_l0': 37, 'n_units_l1': 17, 'n_units_l2': 43, 'n_units_l3': 28, 'n_units_l4': 4, 'n_units_l5': 41, 'n_units_l6': 10, 'n_units_l7': 108, 'optimizer': 'SGD', 'sgd_opt_learning_rate': 0.08713382248946594, 'sgd_opt_momentum': 0.004979126558332254}. Best is trial 6 with value: 0.7813644409179688.
Trial 13 finished with value: 0.6710381507873535 and parameters: {'n_layers': 5, 'weight_decay': 2.5828153170419825e-09, 'n_units_l0': 8, 'n_units_l1': 43, 'n_units_l2': 8, 'n_units_l3': 4, 'n_units_l4': 73, 'optimizer': 'Adam', 'adam_learning_rate': 1.8429516467072206e-05}. Best is trial 6 with value: 0.7813644409179688.
Trial 14 finished with value: 0.5093768239021301 and parameters: {'n_layers': 8, 'weight_decay': 1.1212893754775495e-08, 'n_units_l0': 124, 'n_units_l1': 4, 'n_units_l2': 54, 'n_units_l3': 50, 'n_units_l4': 8, 'n_units_l5': 26, 'n_units_l6': 128, 'n_units_l7': 4, 'optimizer': 'RMSprop', 'rmsprop_learning_rate': 0.0009901853177303299, 'rmsprop_weight_decay': 0.8505221535800127, 'rmsprop_momentum': 1.1206319028644854e-05}. Best is trial 6 with value: 0.7813644409179688.
Trial 15 finished with value: 0.7536496520042419 and parameters: {'n_layers': 4, 'weight_decay': 4.5079792699276556e-10, 'n_units_l0': 11, 'n_units_l1': 56, 'n_units_l2': 13, 'n_units_l3': 17, 'optimizer': 'Adam', 'adam_learning_rate': 0.0001347786386422573}. Best is trial 6 with value: 0.7813644409179688.
Trial 16 finished with value: 0.5093768239021301 and parameters: {'n_layers': 10, 'weight_decay': 6.629147319445208e-06, 'n_units_l0': 59, 'n_units_l1': 25, 'n_units_l2': 35, 'n_units_l3': 125, 'n_units_l4': 128, 'n_units_l5': 13, 'n_units_l6': 28, 'n_units_l7': 99, 'n_units_l8': 5, 'n_units_l9': 4, 'optimizer': 'SGD', 'sgd_opt_learning_rate': 0.0021822661459949596, 'sgd_opt_momentum': 0.0017131755533826374}. Best is trial 6 with value: 0.7813644409179688.
Trial 17 finished with value: 0.5093768239021301 and parameters: {'n_layers': 7, 'weight_decay': 1.1557894206454365e-09, 'n_units_l0': 26, 'n_units_l1': 9, 'n_units_l2': 84, 'n_units_l3': 10, 'n_units_l4': 9, 'n_units_l5': 63, 'n_units_l6': 27, 'optimizer': 'SGD', 'sgd_opt_learning_rate': 0.007317293669208718, 'sgd_opt_momentum': 2.114696989551413e-05}. Best is trial 6 with value: 0.7813644409179688.
Trial 18 finished with value: 0.759346604347229 and parameters: {'n_layers': 3, 'weight_decay': 1.403435175371191e-08, 'n_units_l0': 15, 'n_units_l1': 17, 'n_units_l2': 9, 'optimizer': 'Adam', 'adam_learning_rate': 0.00019688028133525172}. Best is trial 6 with value: 0.7813644409179688.
Trial 19 finished with value: 0.669673502445221 and parameters: {'n_layers': 6, 'weight_decay': 6.694035531091229e-07, 'n_units_l0': 67, 'n_units_l1': 49, 'n_units_l2': 27, 'n_units_l3': 47, 'n_units_l4': 41, 'n_units_l5': 12, 'optimizer': 'RMSprop', 'rmsprop_learning_rate': 1.0530119342928663e-05, 'rmsprop_weight_decay': 0.9862722740597963, 'rmsprop_momentum': 2.920810650001101e-05}. Best is trial 6 with value: 0.7813644409179688.
Trial 20 finished with value: 0.5093768239021301 and parameters: {'n_layers': 4, 'weight_decay': 7.380120277259573e-10, 'n_units_l0': 21, 'n_units_l1': 12, 'n_units_l2': 65, 'n_units_l3': 22, 'optimizer': 'SGD', 'sgd_opt_learning_rate': 0.000384060031351547, 'sgd_opt_momentum': 0.010960376604080798}. Best is trial 6 with value: 0.7813644409179688.
Trial 21 finished with value: 0.7372695803642273 and parameters: {'n_layers': 10, 'weight_decay': 1.075698950712796e-10, 'n_units_l0': 30, 'n_units_l1': 36, 'n_units_l2': 17, 'n_units_l3': 115, 'n_units_l4': 4, 'n_units_l5': 118, 'n_units_l6': 5, 'n_units_l7': 10, 'n_units_l8': 120, 'n_units_l9': 126, 'optimizer': 'Adam', 'adam_learning_rate': 1.0318827809930286e-05}. Best is trial 6 with value: 0.7813644409179688.
Trial 22 finished with value: 0.5093768239021301 and parameters: {'n_layers': 9, 'weight_decay': 1.1956781730247382e-10, 'n_units_l0': 43, 'n_units_l1': 31, 'n_units_l2': 12, 'n_units_l3': 71, 'n_units_l4': 8, 'n_units_l5': 99, 'n_units_l6': 4, 'n_units_l7': 22, 'n_units_l8': 83, 'optimizer': 'Adam', 'adam_learning_rate': 7.455620662555798e-05}. Best is trial 6 with value: 0.7813644409179688.
Trial 23 finished with value: 0.7795246243476868 and parameters: {'n_layers': 9, 'weight_decay': 6.116616597605371e-10, 'n_units_l0': 30, 'n_units_l1': 24, 'n_units_l2': 5, 'n_units_l3': 84, 'n_units_l4': 6, 'n_units_l5': 27, 'n_units_l6': 13, 'n_units_l7': 23, 'n_units_l8': 26, 'optimizer': 'Adam', 'adam_learning_rate': 5.551788449935815e-05}. Best is trial 6 with value: 0.7813644409179688.
Trial 24 finished with value: 0.5093768239021301 and parameters: {'n_layers': 8, 'weight_decay': 2.481364799309895e-08, 'n_units_l0': 55, 'n_units_l1': 20, 'n_units_l2': 4, 'n_units_l3': 35, 'n_units_l4': 11, 'n_units_l5': 25, 'n_units_l6': 14, 'n_units_l7': 36, 'optimizer': 'Adam', 'adam_learning_rate': 0.0003581566780162991}. Best is trial 6 with value: 0.7813644409179688.
Trial 25 finished with value: 0.5093768239021301 and parameters: {'n_layers': 7, 'weight_decay': 6.765690950525634e-09, 'n_units_l0': 83, 'n_units_l1': 22, 'n_units_l2': 6, 'n_units_l3': 82, 'n_units_l4': 6, 'n_units_l5': 41, 'n_units_l6': 11, 'optimizer': 'Adam', 'adam_learning_rate': 0.004186488003503809}. Best is trial 6 with value: 0.7813644409179688.
Trial 26 finished with value: 0.7315132021903992 and parameters: {'n_layers': 9, 'weight_decay': 1.0000249326120394e-09, 'n_units_l0': 7, 'n_units_l1': 13, 'n_units_l2': 127, 'n_units_l3': 39, 'n_units_l4': 15, 'n_units_l5': 16, 'n_units_l6': 51, 'n_units_l7': 38, 'n_units_l8': 15, 'optimizer': 'Adam', 'adam_learning_rate': 6.385636658907955e-05}. Best is trial 6 with value: 0.7813644409179688.
Trial 27 finished with value: 0.5093768239021301 and parameters: {'n_layers': 6, 'weight_decay': 2.470837363403329e-07, 'n_units_l0': 23, 'n_units_l1': 57, 'n_units_l2': 29, 'n_units_l3': 15, 'n_units_l4': 6, 'n_units_l5': 7, 'optimizer': 'Adam', 'adam_learning_rate': 0.008508659737693469}. Best is trial 6 with value: 0.7813644409179688.
Trial 28 finished with value: 0.5093768239021301 and parameters: {'n_layers': 9, 'weight_decay': 1.2357822103869952e-09, 'n_units_l0': 11, 'n_units_l1': 24, 'n_units_l2': 6, 'n_units_l3': 67, 'n_units_l4': 6, 'n_units_l5': 38, 'n_units_l6': 7, 'n_units_l7': 6, 'n_units_l8': 23, 'optimizer': 'RMSprop', 'rmsprop_learning_rate': 0.04463734499959598, 'rmsprop_weight_decay': 0.9176436362894508, 'rmsprop_momentum': 0.07810833699514919}. Best is trial 6 with value: 0.7813644409179688.
Trial 29 finished with value: 0.7070025205612183 and parameters: {'n_layers': 5, 'weight_decay': 3.224934098058172e-10, 'n_units_l0': 14, 'n_units_l1': 40, 'n_units_l2': 6, 'n_units_l3': 22, 'n_units_l4': 13, 'optimizer': 'SGD', 'sgd_opt_learning_rate': 0.015496887784351297, 'sgd_opt_momentum': 0.0005982339164732563}. Best is trial 6 with value: 0.7813644409179688.
Trial 30 finished with value: 0.5093768239021301 and parameters: {'n_layers': 3, 'weight_decay': 3.1473381411990474e-10, 'n_units_l0': 123, 'n_units_l1': 67, 'n_units_l2': 13, 'optimizer': 'RMSprop', 'rmsprop_learning_rate': 0.0021563986872370584, 'rmsprop_weight_decay': 0.9234695180353493, 'rmsprop_momentum': 0.0003151582758419625}. Best is trial 6 with value: 0.7813644409179688.
Trial 31 finished with value: 0.7638572454452515 and parameters: {'n_layers': 10, 'weight_decay': 1.29498725023041e-10, 'n_units_l0': 32, 'n_units_l1': 32, 'n_units_l2': 19, 'n_units_l3': 90, 'n_units_l4': 4, 'n_units_l5': 74, 'n_units_l6': 18, 'n_units_l7': 13, 'n_units_l8': 38, 'n_units_l9': 84, 'optimizer': 'Adam', 'adam_learning_rate': 3.176974408480726e-05}. Best is trial 6 with value: 0.7813644409179688.
Trial 32 finished with value: 0.8073586225509644 and parameters: {'n_layers': 9, 'weight_decay': 2.409256329598316e-09, 'n_units_l0': 44, 'n_units_l1': 30, 'n_units_l2': 29, 'n_units_l3': 89, 'n_units_l4': 5, 'n_units_l5': 58, 'n_units_l6': 18, 'n_units_l7': 19, 'n_units_l8': 28, 'optimizer': 'Adam', 'adam_learning_rate': 4.258233179167567e-05}. Best is trial 32 with value: 0.8073586225509644.
Trial 33 finished with value: 0.7935310006141663 and parameters: {'n_layers': 9, 'weight_decay': 2.9469907564190957e-10, 'n_units_l0': 36, 'n_units_l1': 34, 'n_units_l2': 30, 'n_units_l3': 91, 'n_units_l4': 5, 'n_units_l5': 58, 'n_units_l6': 19, 'n_units_l7': 17, 'n_units_l8': 26, 'optimizer': 'Adam', 'adam_learning_rate': 4.7494808781529565e-05}. Best is trial 32 with value: 0.8073586225509644.
Trial 34 finished with value: 0.7807706594467163 and parameters: {'n_layers': 9, 'weight_decay': 5.274831459271129e-10, 'n_units_l0': 40, 'n_units_l1': 44, 'n_units_l2': 28, 'n_units_l3': 67, 'n_units_l4': 6, 'n_units_l5': 59, 'n_units_l6': 21, 'n_units_l7': 24, 'n_units_l8': 22, 'optimizer': 'Adam', 'adam_learning_rate': 5.3662113648815526e-05}. Best is trial 32 with value: 0.8073586225509644.
Trial 35 finished with value: 0.5093768239021301 and parameters: {'n_layers': 8, 'weight_decay': 2.0351041736388266e-09, 'n_units_l0': 46, 'n_units_l1': 127, 'n_units_l2': 38, 'n_units_l3': 53, 'n_units_l4': 5, 'n_units_l5': 60, 'n_units_l6': 33, 'n_units_l7': 41, 'optimizer': 'Adam', 'adam_learning_rate': 0.00020012037336252991}. Best is trial 32 with value: 0.8073586225509644.
Trial 36 finished with value: 0.7792280316352844 and parameters: {'n_layers': 9, 'weight_decay': 7.317817510098499e-05, 'n_units_l0': 40, 'n_units_l1': 47, 'n_units_l2': 27, 'n_units_l3': 108, 'n_units_l4': 5, 'n_units_l5': 51, 'n_units_l6': 19, 'n_units_l7': 20, 'n_units_l8': 12, 'optimizer': 'Adam', 'adam_learning_rate': 3.620559738105423e-05}. Best is trial 32 with value: 0.8073586225509644.
Trial 37 finished with value: 0.8592284917831421 and parameters: {'n_layers': 7, 'weight_decay': 3.276360364108335e-10, 'n_units_l0': 80, 'n_units_l1': 59, 'n_units_l2': 58, 'n_units_l3': 67, 'n_units_l4': 8, 'n_units_l5': 34, 'n_units_l6': 39, 'optimizer': 'Adam', 'adam_learning_rate': 0.00043820901384716734}. Best is trial 37 with value: 0.8592284917831421.
Trial 38 finished with value: 0.5093768239021301 and parameters: {'n_layers': 7, 'weight_decay': 6.444967230779771e-09, 'n_units_l0': 78, 'n_units_l1': 83, 'n_units_l2': 69, 'n_units_l3': 37, 'n_units_l4': 9, 'n_units_l5': 33, 'n_units_l6': 43, 'optimizer': 'Adam', 'adam_learning_rate': 0.0005142316390625273}. Best is trial 37 with value: 0.8592284917831421.
Trial 39 finished with value: 0.5093768239021301 and parameters: {'n_layers': 6, 'weight_decay': 2.372264370274754e-08, 'n_units_l0': 100, 'n_units_l1': 66, 'n_units_l2': 55, 'n_units_l3': 31, 'n_units_l4': 5, 'n_units_l5': 19, 'optimizer': 'Adam', 'adam_learning_rate': 0.00012347488925033194}. Best is trial 37 with value: 0.8592284917831421.
Trial 40 finished with value: 0.8823151588439941 and parameters: {'n_layers': 7, 'weight_decay': 2.6390409644339194e-10, 'n_units_l0': 69, 'n_units_l1': 57, 'n_units_l2': 50, 'n_units_l3': 42, 'n_units_l4': 8, 'n_units_l5': 85, 'n_units_l6': 56, 'optimizer': 'Adam', 'adam_learning_rate': 0.0003668093578725912}. Best is trial 40 with value: 0.8823151588439941.
Trial 41 finished with value: 0.5093768239021301 and parameters: {'n_layers': 7, 'weight_decay': 2.5309271143731956e-10, 'n_units_l0': 52, 'n_units_l1': 56, 'n_units_l2': 50, 'n_units_l3': 44, 'n_units_l4': 8, 'n_units_l5': 79, 'n_units_l6': 63, 'optimizer': 'Adam', 'adam_learning_rate': 0.00046819243657212554}. Best is trial 40 with value: 0.8823151588439941.
Trial 42 finished with value: 0.8754897117614746 and parameters: {'n_layers': 6, 'weight_decay': 2.8384260961233743e-10, 'n_units_l0': 72, 'n_units_l1': 101, 'n_units_l2': 94, 'n_units_l3': 59, 'n_units_l4': 11, 'n_units_l5': 82, 'optimizer': 'Adam', 'adam_learning_rate': 0.0002610455554550559}. Best is trial 40 with value: 0.8823151588439941.
Trial 43 finished with value: 0.5093768239021301 and parameters: {'n_layers': 8, 'weight_decay': 2.304822717437622e-10, 'n_units_l0': 68, 'n_units_l1': 111, 'n_units_l2': 101, 'n_units_l3': 61, 'n_units_l4': 11, 'n_units_l5': 87, 'n_units_l6': 36, 'n_units_l7': 59, 'optimizer': 'Adam', 'adam_learning_rate': 0.0007229805726546265}. Best is trial 40 with value: 0.8823151588439941.
Trial 44 finished with value: 0.8279527425765991 and parameters: {'n_layers': 6, 'weight_decay': 1.6489957031808952e-09, 'n_units_l0': 102, 'n_units_l1': 92, 'n_units_l2': 79, 'n_units_l3': 74, 'n_units_l4': 12, 'n_units_l5': 49, 'optimizer': 'Adam', 'adam_learning_rate': 0.00027064739928921253}. Best is trial 40 with value: 0.8823151588439941.
Trial 45 finished with value: 0.7897326350212097 and parameters: {'n_layers': 5, 'weight_decay': 1.6829256452715475e-09, 'n_units_l0': 103, 'n_units_l1': 101, 'n_units_l2': 81, 'n_units_l3': 77, 'n_units_l4': 14, 'optimizer': 'Adam', 'adam_learning_rate': 0.00026804358075559036}. Best is trial 40 with value: 0.8823151588439941.
Trial 46 finished with value: 0.5093768239021301 and parameters: {'n_layers': 6, 'weight_decay': 4.08564350811175e-09, 'n_units_l0': 77, 'n_units_l1': 83, 'n_units_l2': 101, 'n_units_l3': 56, 'n_units_l4': 25, 'n_units_l5': 47, 'optimizer': 'Adam', 'adam_learning_rate': 0.0019978677951097016}. Best is trial 40 with value: 0.8823151588439941.
Trial 47 finished with value: 0.5093768239021301 and parameters: {'n_layers': 7, 'weight_decay': 4.786600405618696e-06, 'n_units_l0': 87, 'n_units_l1': 101, 'n_units_l2': 74, 'n_units_l3': 43, 'n_units_l4': 18, 'n_units_l5': 75, 'n_units_l6': 94, 'optimizer': 'Adam', 'adam_learning_rate': 0.0015720354230529371}. Best is trial 40 with value: 0.8823151588439941.
Trial 48 finished with value: 0.7320465445518494 and parameters: {'n_layers': 6, 'weight_decay': 5.796126917935184e-08, 'n_units_l0': 106, 'n_units_l1': 72, 'n_units_l2': 43, 'n_units_l3': 62, 'n_units_l4': 29, 'n_units_l5': 96, 'optimizer': 'RMSprop', 'rmsprop_learning_rate': 0.00024079655004744308, 'rmsprop_weight_decay': 0.9338307070844629, 'rmsprop_momentum': 0.07697457240812534}. Best is trial 40 with value: 0.8823151588439941.
Trial 49 finished with value: 0.5093768239021301 and parameters: {'n_layers': 7, 'weight_decay': 6.742920827377289e-09, 'n_units_l0': 62, 'n_units_l1': 128, 'n_units_l2': 57, 'n_units_l3': 103, 'n_units_l4': 11, 'n_units_l5': 33, 'n_units_l6': 53, 'optimizer': 'Adam', 'adam_learning_rate': 0.003011565620907474}. Best is trial 40 with value: 0.8823151588439941.
Trial 50 finished with value: 0.5093768239021301 and parameters: {'n_layers': 5, 'weight_decay': 1.8787976266445238e-10, 'n_units_l0': 93, 'n_units_l1': 89, 'n_units_l2': 93, 'n_units_l3': 5, 'n_units_l4': 18, 'optimizer': 'Adam', 'adam_learning_rate': 0.0007612080609400994}. Best is trial 40 with value: 0.8823151588439941.
Trial 51 finished with value: 0.8624929785728455 and parameters: {'n_layers': 8, 'weight_decay': 6.508652872211112e-10, 'n_units_l0': 48, 'n_units_l1': 59, 'n_units_l2': 35, 'n_units_l3': 95, 'n_units_l4': 7, 'n_units_l5': 52, 'n_units_l6': 27, 'n_units_l7': 8, 'optimizer': 'Adam', 'adam_learning_rate': 0.00014877363854217442}. Best is trial 40 with value: 0.8823151588439941.
Trial 52 finished with value: 0.8796442151069641 and parameters: {'n_layers': 8, 'weight_decay': 6.061600018003956e-10, 'n_units_l0': 52, 'n_units_l1': 61, 'n_units_l2': 37, 'n_units_l3': 73, 'n_units_l4': 7, 'n_units_l5': 49, 'n_units_l6': 39, 'n_units_l7': 7, 'optimizer': 'Adam', 'adam_learning_rate': 0.0001269547492600103}. Best is trial 40 with value: 0.8823151588439941.
Trial 53 finished with value: 0.8761424422264099 and parameters: {'n_layers': 8, 'weight_decay': 6.811912498831519e-10, 'n_units_l0': 71, 'n_units_l1': 61, 'n_units_l2': 37, 'n_units_l3': 72, 'n_units_l4': 7, 'n_units_l5': 44, 'n_units_l6': 40, 'n_units_l7': 7, 'optimizer': 'Adam', 'adam_learning_rate': 0.00013966422434513523}. Best is trial 40 with value: 0.8823151588439941.
Trial 54 finished with value: 0.5093768239021301 and parameters: {'n_layers': 8, 'weight_decay': 6.658536649171928e-10, 'n_units_l0': 53, 'n_units_l1': 59, 'n_units_l2': 35, 'n_units_l3': 55, 'n_units_l4': 7, 'n_units_l5': 41, 'n_units_l6': 41, 'n_units_l7': 7, 'optimizer': 'Adam', 'adam_learning_rate': 0.00012902304949443638}. Best is trial 40 with value: 0.8823151588439941.
Trial 55 finished with value: 0.5093768239021301 and parameters: {'n_layers': 8, 'weight_decay': 4.539522397823987e-10, 'n_units_l0': 69, 'n_units_l1': 50, 'n_units_l2': 47, 'n_units_l3': 48, 'n_units_l4': 9, 'n_units_l5': 32, 'n_units_l6': 28, 'n_units_l7': 4, 'optimizer': 'Adam', 'adam_learning_rate': 0.0001741988397914189}. Best is trial 40 with value: 0.8823151588439941.
Trial 56 finished with value: 0.7918093800544739 and parameters: {'n_layers': 8, 'weight_decay': 0.0007050405407888978, 'n_units_l0': 51, 'n_units_l1': 68, 'n_units_l2': 23, 'n_units_l3': 118, 'n_units_l4': 7, 'n_units_l5': 71, 'n_units_l6': 66, 'n_units_l7': 7, 'optimizer': 'Adam', 'adam_learning_rate': 0.00010534005396216888}. Best is trial 40 with value: 0.8823151588439941.
Trial 57 finished with value: 0.831394374370575 and parameters: {'n_layers': 7, 'weight_decay': 9.625290884268264e-10, 'n_units_l0': 60, 'n_units_l1': 40, 'n_units_l2': 35, 'n_units_l3': 27, 'n_units_l4': 10, 'n_units_l5': 98, 'n_units_l6': 89, 'optimizer': 'Adam', 'adam_learning_rate': 0.0003371253907184291}. Best is trial 40 with value: 0.8823151588439941.
