Trial 58 finished with value: 0.5093768239021301 and parameters: {'n_layers': 7, 'weight_decay': 1.8987466763788912e-10, 'n_units_l0': 74, 'n_units_l1': 4, 'n_units_l2': 61, 'n_units_l3': 75, 'n_units_l4': 7, 'n_units_l5': 51, 'n_units_l6': 49, 'optimizer': 'RMSprop', 'rmsprop_learning_rate': 0.005461379379523893, 'rmsprop_weight_decay': 0.889251228388523, 'rmsprop_momentum': 0.00012201922492833435}. Best is trial 40 with value: 0.8823151588439941.