Trial 290 finished with value: 0.780307412147522 and parameters: {'n_layers': 2, 'weight_decay': 1.86262959355792e-08, 'n_units_l0': 73, 'n_units_l1': 12, 'optimizer': 'Adam', 'adam_learning_rate': 0.0005228753234501693}. Best is trial 154 with value: 0.7876920700073242.
Trial 291 finished with value: 0.5132308602333069 and parameters: {'n_layers': 2, 'weight_decay': 0.00015965289514376167, 'n_units_l0': 46, 'n_units_l1': 20, 'optimizer': 'Adam', 'adam_learning_rate': 0.008112735389032262}. Best is trial 154 with value: 0.7876920700073242.
Trial 292 finished with value: 0.784615159034729 and parameters: {'n_layers': 2, 'weight_decay': 3.558963705677917e-08, 'n_units_l0': 63, 'n_units_l1': 15, 'optimizer': 'Adam', 'adam_learning_rate': 0.0006563750425990335}. Best is trial 154 with value: 0.7876920700073242.
Trial 293 finished with value: 0.5132308602333069 and parameters: {'n_layers': 2, 'weight_decay': 3.611795951457536e-08, 'n_units_l0': 65, 'n_units_l1': 16, 'optimizer': 'RMSprop', 'rmsprop_learning_rate': 0.0004958049685775207, 'rmsprop_weight_decay': 0.9112645433356495, 'rmsprop_momentum': 0.00041623892700642267}. Best is trial 154 with value: 0.7876920700073242.
Trial 294 finished with value: 0.7815380692481995 and parameters: {'n_layers': 2, 'weight_decay': 2.958273060930198e-08, 'n_units_l0': 61, 'n_units_l1': 15, 'optimizer': 'Adam', 'adam_learning_rate': 0.0006253868826620039}. Best is trial 154 with value: 0.7876920700073242.
Trial 295 finished with value: 0.7335383296012878 and parameters: {'n_layers': 2, 'weight_decay': 1.0249919695010562e-08, 'n_units_l0': 40, 'n_units_l1': 19, 'optimizer': 'Adam', 'adam_learning_rate': 0.0004383025522458455}. Best is trial 154 with value: 0.7876920700073242.
Trial 296 finished with value: 0.7360000014305115 and parameters: {'n_layers': 3, 'weight_decay': 7.356827103216324e-09, 'n_units_l0': 70, 'n_units_l1': 14, 'n_units_l2': 28, 'optimizer': 'Adam', 'adam_learning_rate': 0.0015779677399220488}. Best is trial 154 with value: 0.7876920700073242.
Trial 297 finished with value: 0.7587689757347107 and parameters: {'n_layers': 2, 'weight_decay': 2.0348263926752336e-08, 'n_units_l0': 63, 'n_units_l1': 17, 'optimizer': 'Adam', 'adam_learning_rate': 0.0010317839503274776}. Best is trial 154 with value: 0.7876920700073242.
Trial 298 finished with value: 0.5132308602333069 and parameters: {'n_layers': 2, 'weight_decay': 4.347595389297422e-06, 'n_units_l0': 74, 'n_units_l1': 15, 'optimizer': 'Adam', 'adam_learning_rate': 0.052397118965989205}. Best is trial 154 with value: 0.7876920700073242.
Trial 299 finished with value: 0.7636921405792236 and parameters: {'n_layers': 2, 'weight_decay': 1.341435463720806e-08, 'n_units_l0': 58, 'n_units_l1': 13, 'optimizer': 'Adam', 'adam_learning_rate': 0.001255269241176349}. Best is trial 154 with value: 0.7876920700073242.
Trial 300 finished with value: 0.5132308602333069 and parameters: {'n_layers': 2, 'weight_decay': 1.4954164964075192e-05, 'n_units_l0': 67, 'n_units_l1': 16, 'optimizer': 'Adam', 'adam_learning_rate': 0.013128463052937711}. Best is trial 154 with value: 0.7876920700073242.
Trial 301 finished with value: 0.7796920537948608 and parameters: {'n_layers': 2, 'weight_decay': 2.5522105444369984e-08, 'n_units_l0': 53, 'n_units_l1': 11, 'optimizer': 'Adam', 'adam_learning_rate': 0.0008779152512227125}. Best is trial 154 with value: 0.7876920700073242.
Trial 302 finished with value: 0.7809229493141174 and parameters: {'n_layers': 2, 'weight_decay': 4.2355662809442575e-08, 'n_units_l0': 48, 'n_units_l1': 18, 'optimizer': 'Adam', 'adam_learning_rate': 0.0005121330807820421}. Best is trial 154 with value: 0.7876920700073242.
Trial 303 finished with value: 0.7667689919471741 and parameters: {'n_layers': 2, 'weight_decay': 1.6712700051021985e-08, 'n_units_l0': 29, 'n_units_l1': 14, 'optimizer': 'Adam', 'adam_learning_rate': 0.0023612052881016522}. Best is trial 154 with value: 0.7876920700073242.
Trial 304 finished with value: 0.7803074717521667 and parameters: {'n_layers': 2, 'weight_decay': 6.882029590752337e-09, 'n_units_l0': 60, 'n_units_l1': 13, 'optimizer': 'Adam', 'adam_learning_rate': 0.0006565072787453257}. Best is trial 154 with value: 0.7876920700073242.
Trial 305 finished with value: 0.616615355014801 and parameters: {'n_layers': 1, 'weight_decay': 7.297692475288346e-08, 'n_units_l0': 43, 'optimizer': 'Adam', 'adam_learning_rate': 0.0017264258960843055}. Best is trial 154 with value: 0.7876920700073242.
Trial 306 finished with value: 0.7415384650230408 and parameters: {'n_layers': 3, 'weight_decay': 2.7888949128134664e-08, 'n_units_l0': 51, 'n_units_l1': 15, 'n_units_l2': 128, 'optimizer': 'Adam', 'adam_learning_rate': 0.0007509577370045326}. Best is trial 154 with value: 0.7876920700073242.
Trial 307 finished with value: 0.5132308602333069 and parameters: {'n_layers': 2, 'weight_decay': 1.069294772246101e-08, 'n_units_l0': 65, 'n_units_l1': 12, 'optimizer': 'SGD', 'sgd_opt_learning_rate': 0.00045274465551316864, 'sgd_opt_momentum': 0.0021214869230308814}. Best is trial 154 with value: 0.7876920700073242.
Trial 308 finished with value: 0.5132308602333069 and parameters: {'n_layers': 2, 'weight_decay': 4.8007737657497144e-08, 'n_units_l0': 118, 'n_units_l1': 9, 'optimizer': 'Adam', 'adam_learning_rate': 0.0010612164968701481}. Best is trial 154 with value: 0.7876920700073242.
Trial 309 finished with value: 0.5132308602333069 and parameters: {'n_layers': 2, 'weight_decay': 1.7242145029673384e-08, 'n_units_l0': 7, 'n_units_l1': 11, 'optimizer': 'Adam', 'adam_learning_rate': 0.0005950809985534593}. Best is trial 154 with value: 0.7876920700073242.
Trial 310 finished with value: 0.5132308602333069 and parameters: {'n_layers': 3, 'weight_decay': 9.973363030376447e-08, 'n_units_l0': 59, 'n_units_l1': 13, 'n_units_l2': 47, 'optimizer': 'Adam', 'adam_learning_rate': 0.0014125248664971482}. Best is trial 154 with value: 0.7876920700073242.
Trial 311 finished with value: 0.7550767660140991 and parameters: {'n_layers': 2, 'weight_decay': 4.428326751269422e-09, 'n_units_l0': 55, 'n_units_l1': 14, 'optimizer': 'Adam', 'adam_learning_rate': 0.0034649528462022275}. Best is trial 154 with value: 0.7876920700073242.
Trial 312 finished with value: 0.7655382752418518 and parameters: {'n_layers': 2, 'weight_decay': 1.555306661295182e-07, 'n_units_l0': 76, 'n_units_l1': 17, 'optimizer': 'Adam', 'adam_learning_rate': 0.0008457160461227602}. Best is trial 154 with value: 0.7876920700073242.
Trial 313 finished with value: 0.7833843231201172 and parameters: {'n_layers': 2, 'weight_decay': 3.680694142457895e-08, 'n_units_l0': 108, 'n_units_l1': 15, 'optimizer': 'Adam', 'adam_learning_rate': 0.000394192299287476}. Best is trial 154 with value: 0.7876920700073242.
Trial 314 finished with value: 0.5132308602333069 and parameters: {'n_layers': 1, 'weight_decay': 3.5105579128131605e-08, 'n_units_l0': 114, 'optimizer': 'RMSprop', 'rmsprop_learning_rate': 0.03665137022184093, 'rmsprop_weight_decay': 0.8613994947859422, 'rmsprop_momentum': 0.001687586587520452}. Best is trial 154 with value: 0.7876920700073242.
Trial 315 finished with value: 0.7501537799835205 and parameters: {'n_layers': 2, 'weight_decay': 2.358828053983584e-08, 'n_units_l0': 103, 'n_units_l1': 10, 'optimizer': 'Adam', 'adam_learning_rate': 0.0019392562376441902}. Best is trial 154 with value: 0.7876920700073242.
Trial 316 finished with value: 0.7833843231201172 and parameters: {'n_layers': 2, 'weight_decay': 3.4537446809812755e-08, 'n_units_l0': 104, 'n_units_l1': 14, 'optimizer': 'Adam', 'adam_learning_rate': 0.0003986327547527781}. Best is trial 154 with value: 0.7876920700073242.
Trial 317 finished with value: 0.5132308602333069 and parameters: {'n_layers': 8, 'weight_decay': 3.605508306808599e-08, 'n_units_l0': 106, 'n_units_l1': 15, 'n_units_l2': 5, 'n_units_l3': 16, 'n_units_l4': 126, 'n_units_l5': 71, 'n_units_l6': 90, 'n_units_l7': 6, 'optimizer': 'Adam', 'adam_learning_rate': 0.00029009879320476405}. Best is trial 154 with value: 0.7876920700073242.
Trial 318 finished with value: 0.7544613480567932 and parameters: {'n_layers': 2, 'weight_decay': 5.269718575022692e-08, 'n_units_l0': 106, 'n_units_l1': 8, 'optimizer': 'Adam', 'adam_learning_rate': 0.00035111233827038674}. Best is trial 154 with value: 0.7876920700073242.
Trial 319 finished with value: 0.7716920971870422 and parameters: {'n_layers': 2, 'weight_decay': 3.044074393295722e-08, 'n_units_l0': 112, 'n_units_l1': 14, 'optimizer': 'Adam', 'adam_learning_rate': 0.00037829545092356857}. Best is trial 154 with value: 0.7876920700073242.
Trial 320 finished with value: 0.780307412147522 and parameters: {'n_layers': 2, 'weight_decay': 4.5034689484722356e-08, 'n_units_l0': 83, 'n_units_l1': 16, 'optimizer': 'Adam', 'adam_learning_rate': 0.0004012997865987696}. Best is trial 154 with value: 0.7876920700073242.
Trial 321 finished with value: 0.7833842039108276 and parameters: {'n_layers': 2, 'weight_decay': 1.3549401007172681e-08, 'n_units_l0': 98, 'n_units_l1': 12, 'optimizer': 'Adam', 'adam_learning_rate': 0.0004624446442569799}. Best is trial 154 with value: 0.7876920700073242.
Trial 322 finished with value: 0.7803074717521667 and parameters: {'n_layers': 2, 'weight_decay': 1.065582011962298e-08, 'n_units_l0': 112, 'n_units_l1': 12, 'optimizer': 'Adam', 'adam_learning_rate': 0.0004472780566471734}. Best is trial 154 with value: 0.7876920700073242.
Trial 323 finished with value: 0.7341538667678833 and parameters: {'n_layers': 3, 'weight_decay': 1.4368298115811915e-08, 'n_units_l0': 99, 'n_units_l1': 11, 'n_units_l2': 39, 'optimizer': 'Adam', 'adam_learning_rate': 0.0004678369679367778}. Best is trial 154 with value: 0.7876920700073242.
Trial 324 finished with value: 0.781538188457489 and parameters: {'n_layers': 2, 'weight_decay': 8.546596476602279e-09, 'n_units_l0': 86, 'n_units_l1': 10, 'optimizer': 'Adam', 'adam_learning_rate': 0.00038640223899182193}. Best is trial 154 with value: 0.7876920700073242.
Trial 325 finished with value: 0.6615383625030518 and parameters: {'n_layers': 2, 'weight_decay': 6.11564867324195e-09, 'n_units_l0': 117, 'n_units_l1': 12, 'optimizer': 'Adam', 'adam_learning_rate': 0.0003115760935665685}. Best is trial 154 with value: 0.7876920700073242.
Trial 326 finished with value: 0.5427691340446472 and parameters: {'n_layers': 1, 'weight_decay': 1.684939342414398e-08, 'n_units_l0': 100, 'optimizer': 'Adam', 'adam_learning_rate': 0.0005196592291346456}. Best is trial 154 with value: 0.7876920700073242.
Trial 327 finished with value: 0.5132308602333069 and parameters: {'n_layers': 2, 'weight_decay': 1.2592692593670555e-08, 'n_units_l0': 128, 'n_units_l1': 11, 'optimizer': 'Adam', 'adam_learning_rate': 0.0013228021985363261}. Best is trial 154 with value: 0.7876920700073242.
Trial 328 finished with value: 0.7366153597831726 and parameters: {'n_layers': 2, 'weight_decay': 2.310071213466336e-08, 'n_units_l0': 105, 'n_units_l1': 14, 'optimizer': 'Adam', 'adam_learning_rate': 0.0022361365015569003}. Best is trial 154 with value: 0.7876920700073242.
Trial 329 finished with value: 0.5132308602333069 and parameters: {'n_layers': 2, 'weight_decay': 8.795054098717398e-09, 'n_units_l0': 70, 'n_units_l1': 15, 'optimizer': 'Adam', 'adam_learning_rate': 0.0018183613975198036}. Best is trial 154 with value: 0.7876920700073242.
Trial 330 finished with value: 0.5132308602333069 and parameters: {'n_layers': 1, 'weight_decay': 1.9530586896276923e-08, 'n_units_l0': 95, 'optimizer': 'SGD', 'sgd_opt_learning_rate': 0.025111783916128824, 'sgd_opt_momentum': 0.007759070749016997}. Best is trial 154 with value: 0.7876920700073242.
Trial 331 finished with value: 0.7581536173820496 and parameters: {'n_layers': 2, 'weight_decay': 3.0959367758100557e-08, 'n_units_l0': 108, 'n_units_l1': 13, 'optimizer': 'Adam', 'adam_learning_rate': 0.0027073915114017508}. Best is trial 154 with value: 0.7876920700073242.
Trial 332 finished with value: 0.7766152024269104 and parameters: {'n_layers': 2, 'weight_decay': 1.3824187616456812e-08, 'n_units_l0': 91, 'n_units_l1': 12, 'optimizer': 'Adam', 'adam_learning_rate': 0.0005324086279143322}. Best is trial 154 with value: 0.7876920700073242.
Trial 333 finished with value: 0.5132308602333069 and parameters: {'n_layers': 2, 'weight_decay': 3.734871251273282e-08, 'n_units_l0': 62, 'n_units_l1': 14, 'optimizer': 'Adam', 'adam_learning_rate': 0.0011030832485106157}. Best is trial 154 with value: 0.7876920700073242.
Trial 334 finished with value: 0.7439998388290405 and parameters: {'n_layers': 3, 'weight_decay': 2.0283848078527772e-08, 'n_units_l0': 78, 'n_units_l1': 22, 'n_units_l2': 95, 'optimizer': 'Adam', 'adam_learning_rate': 0.0014256001756698155}. Best is trial 154 with value: 0.7876920700073242.
Trial 335 finished with value: 0.5612306594848633 and parameters: {'n_layers': 2, 'weight_decay': 5.3108520195876745e-09, 'n_units_l0': 121, 'n_units_l1': 16, 'optimizer': 'Adam', 'adam_learning_rate': 0.00031266851893725243}. Best is trial 154 with value: 0.7876920700073242.
Trial 336 finished with value: 0.5132308602333069 and parameters: {'n_layers': 2, 'weight_decay': 2.63069371233068e-08, 'n_units_l0': 68, 'n_units_l1': 11, 'optimizer': 'RMSprop', 'rmsprop_learning_rate': 3.0578468215085055e-05, 'rmsprop_weight_decay': 0.9304118883401995, 'rmsprop_momentum': 0.03502995163138538}. Best is trial 154 with value: 0.7876920700073242.
Trial 337 finished with value: 0.5132308602333069 and parameters: {'n_layers': 2, 'weight_decay': 3.5922861336721092e-09, 'n_units_l0': 63, 'n_units_l1': 13, 'optimizer': 'Adam', 'adam_learning_rate': 0.0009661460818388603}. Best is trial 154 with value: 0.7876920700073242.
Trial 338 finished with value: 0.754461407661438 and parameters: {'n_layers': 2, 'weight_decay': 6.77774333532152e-09, 'n_units_l0': 59, 'n_units_l1': 15, 'optimizer': 'Adam', 'adam_learning_rate': 0.0006980726430214923}. Best is trial 154 with value: 0.7876920700073242.
Trial 339 finished with value: 0.5236923098564148 and parameters: {'n_layers': 2, 'weight_decay': 1.1284671464405445e-08, 'n_units_l0': 68, 'n_units_l1': 10, 'optimizer': 'Adam', 'adam_learning_rate': 0.0002717243088025148}. Best is trial 154 with value: 0.7876920700073242.
Trial 340 finished with value: 0.5206154584884644 and parameters: {'n_layers': 1, 'weight_decay': 4.205147712921986e-08, 'n_units_l0': 87, 'optimizer': 'Adam', 'adam_learning_rate': 0.00044148389854096684}. Best is trial 154 with value: 0.7876920700073242.
Trial 341 finished with value: 0.739692211151123 and parameters: {'n_layers': 3, 'weight_decay': 6.294971294630868e-08, 'n_units_l0': 98, 'n_units_l1': 12, 'n_units_l2': 67, 'optimizer': 'Adam', 'adam_learning_rate': 0.0005762207144049395}. Best is trial 154 with value: 0.7876920700073242.
Trial 342 finished with value: 0.7366153597831726 and parameters: {'n_layers': 2, 'weight_decay': 1.579054126481471e-08, 'n_units_l0': 57, 'n_units_l1': 14, 'optimizer': 'Adam', 'adam_learning_rate': 0.0015629659478154732}. Best is trial 154 with value: 0.7876920700073242.
Trial 343 finished with value: 0.7759997248649597 and parameters: {'n_layers': 2, 'weight_decay': 3.01826135552817e-08, 'n_units_l0': 74, 'n_units_l1': 16, 'optimizer': 'Adam', 'adam_learning_rate': 0.0011847114952850204}. Best is trial 154 with value: 0.7876920700073242.
Trial 344 finished with value: 0.5132308602333069 and parameters: {'n_layers': 7, 'weight_decay': 8.004716729148212e-09, 'n_units_l0': 63, 'n_units_l1': 13, 'n_units_l2': 55, 'n_units_l3': 11, 'n_units_l4': 5, 'n_units_l5': 64, 'n_units_l6': 24, 'optimizer': 'Adam', 'adam_learning_rate': 0.000731108877380771}. Best is trial 154 with value: 0.7876920700073242.
Trial 345 finished with value: 0.5132308602333069 and parameters: {'n_layers': 2, 'weight_decay': 2.026135446547462e-08, 'n_units_l0': 53, 'n_units_l1': 11, 'optimizer': 'Adam', 'adam_learning_rate': 0.000874454024859753}. Best is trial 154 with value: 0.7876920700073242.
Trial 346 finished with value: 0.7790765762329102 and parameters: {'n_layers': 2, 'weight_decay': 4.8943810566791584e-08, 'n_units_l0': 110, 'n_units_l1': 9, 'optimizer': 'Adam', 'adam_learning_rate': 0.0005003513448743483}. Best is trial 154 with value: 0.7876920700073242.
Trial 347 finished with value: 0.7292307615280151 and parameters: {'n_layers': 2, 'weight_decay': 1.2958088792154535e-08, 'n_units_l0': 80, 'n_units_l1': 15, 'optimizer': 'Adam', 'adam_learning_rate': 0.0018168372058226297}. Best is trial 154 with value: 0.7876920700073242.
Trial 348 finished with value: 0.5852305889129639 and parameters: {'n_layers': 2, 'weight_decay': 2.6785496001316144e-08, 'n_units_l0': 65, 'n_units_l1': 12, 'optimizer': 'Adam', 'adam_learning_rate': 0.00037436276403130626}. Best is trial 154 with value: 0.7876920700073242.
Trial 349 finished with value: 0.5132308602333069 and parameters: {'n_layers': 1, 'weight_decay': 3.819791440587414e-08, 'n_units_l0': 71, 'optimizer': 'Adam', 'adam_learning_rate': 0.0010173442040740436}. Best is trial 154 with value: 0.7876920700073242.
Trial 350 finished with value: 0.6646152138710022 and parameters: {'n_layers': 2, 'weight_decay': 9.793198088917724e-09, 'n_units_l0': 59, 'n_units_l1': 6, 'optimizer': 'Adam', 'adam_learning_rate': 0.0006437931911797124}. Best is trial 154 with value: 0.7876920700073242.
Trial 351 finished with value: 0.7852305769920349 and parameters: {'n_layers': 2, 'weight_decay': 5.7644198347050634e-08, 'n_units_l0': 50, 'n_units_l1': 13, 'optimizer': 'Adam', 'adam_learning_rate': 0.0007899862660566056}. Best is trial 154 with value: 0.7876920700073242.
Trial 352 finished with value: 0.7723074555397034 and parameters: {'n_layers': 2, 'weight_decay': 2.0820786844819352e-08, 'n_units_l0': 48, 'n_units_l1': 14, 'optimizer': 'Adam', 'adam_learning_rate': 0.0012280369521150418}. Best is trial 154 with value: 0.7876920700073242.
Trial 353 finished with value: 0.5132308602333069 and parameters: {'n_layers': 3, 'weight_decay': 7.92841816301107e-07, 'n_units_l0': 50, 'n_units_l1': 13, 'n_units_l2': 28, 'optimizer': 'SGD', 'sgd_opt_learning_rate': 4.0316961448681294e-05, 'sgd_opt_momentum': 0.0005152797755048361}. Best is trial 154 with value: 0.7876920700073242.
Trial 354 finished with value: 0.5132308602333069 and parameters: {'n_layers': 9, 'weight_decay': 5.9230136286760555e-08, 'n_units_l0': 52, 'n_units_l1': 12, 'n_units_l2': 33, 'n_units_l3': 6, 'n_units_l4': 10, 'n_units_l5': 23, 'n_units_l6': 38, 'n_units_l7': 33, 'n_units_l8': 39, 'optimizer': 'Adam', 'adam_learning_rate': 0.0008038824541811755}. Best is trial 154 with value: 0.7876920700073242.
Trial 355 finished with value: 0.7753843665122986 and parameters: {'n_layers': 2, 'weight_decay': 3.14412668242911e-08, 'n_units_l0': 101, 'n_units_l1': 13, 'optimizer': 'Adam', 'adam_learning_rate': 0.0009349224682675957}. Best is trial 154 with value: 0.7876920700073242.
Trial 356 finished with value: 0.7766151428222656 and parameters: {'n_layers': 2, 'weight_decay': 1.630941788554049e-08, 'n_units_l0': 55, 'n_units_l1': 24, 'optimizer': 'Adam', 'adam_learning_rate': 0.00219205388249823}. Best is trial 154 with value: 0.7876920700073242.
Trial 357 finished with value: 0.7809228897094727 and parameters: {'n_layers': 1, 'weight_decay': 5.264334671536459e-09, 'n_units_l0': 47, 'optimizer': 'Adam', 'adam_learning_rate': 0.00315134425853103}. Best is trial 154 with value: 0.7876920700073242.
Trial 358 finished with value: 0.7815382480621338 and parameters: {'n_layers': 2, 'weight_decay': 4.064239210975188e-08, 'n_units_l0': 125, 'n_units_l1': 15, 'optimizer': 'Adam', 'adam_learning_rate': 0.0007515600986450506}. Best is trial 154 with value: 0.7876920700073242.
Trial 359 finished with value: 0.7569229006767273 and parameters: {'n_layers': 2, 'weight_decay': 2.4436532139036013e-08, 'n_units_l0': 94, 'n_units_l1': 17, 'optimizer': 'Adam', 'adam_learning_rate': 0.0014536653132159046}. Best is trial 154 with value: 0.7876920700073242.
Trial 360 finished with value: 0.7753843069076538 and parameters: {'n_layers': 2, 'weight_decay': 1.1932112553093976e-08, 'n_units_l0': 52, 'n_units_l1': 14, 'optimizer': 'Adam', 'adam_learning_rate': 0.0011821475084749262}. Best is trial 154 with value: 0.7876920700073242.
Trial 361 finished with value: 0.7846150994300842 and parameters: {'n_layers': 2, 'weight_decay': 7.641053989849947e-09, 'n_units_l0': 65, 'n_units_l1': 13, 'optimizer': 'Adam', 'adam_learning_rate': 0.0010251175229151624}. Best is trial 154 with value: 0.7876920700073242.
Trial 362 finished with value: 0.7101536393165588 and parameters: {'n_layers': 2, 'weight_decay': 6.808694270396298e-09, 'n_units_l0': 68, 'n_units_l1': 13, 'optimizer': 'Adam', 'adam_learning_rate': 0.0008712737514034749}. Best is trial 154 with value: 0.7876920700073242.
Trial 363 finished with value: 0.7790768146514893 and parameters: {'n_layers': 2, 'weight_decay': 5.326470987357696e-08, 'n_units_l0': 72, 'n_units_l1': 12, 'optimizer': 'Adam', 'adam_learning_rate': 0.0006779825546234031}. Best is trial 154 with value: 0.7876920700073242.
Trial 364 finished with value: 0.5132308602333069 and parameters: {'n_layers': 4, 'weight_decay': 3.548238708703048e-08, 'n_units_l0': 63, 'n_units_l1': 11, 'n_units_l2': 43, 'n_units_l3': 12, 'optimizer': 'Adam', 'adam_learning_rate': 0.007055621089946335}. Best is trial 154 with value: 0.7876920700073242.
Trial 365 finished with value: 0.7550767660140991 and parameters: {'n_layers': 2, 'weight_decay': 1.795566081920338e-08, 'n_units_l0': 85, 'n_units_l1': 12, 'optimizer': 'Adam', 'adam_learning_rate': 0.0009150154062637073}. Best is trial 154 with value: 0.7876920700073242.
Trial 366 finished with value: 0.741538405418396 and parameters: {'n_layers': 3, 'weight_decay': 3.0733522109358404e-09, 'n_units_l0': 67, 'n_units_l1': 13, 'n_units_l2': 36, 'optimizer': 'Adam', 'adam_learning_rate': 0.0010565305007394926}. Best is trial 154 with value: 0.7876920700073242.
