Trial 133 finished with value: 0.7809229493141174 and parameters: {'n_layers': 2, 'weight_decay': 1.7438497723484013e-08, 'n_units_l0': 47, 'n_units_l1': 15, 'optimizer': 'Adam', 'adam_learning_rate': 0.001140967129350597}. Best is trial 110 with value: 0.7876920104026794.
Trial 134 finished with value: 0.7784613370895386 and parameters: {'n_layers': 2, 'weight_decay': 1.5303215443720126e-08, 'n_units_l0': 53, 'n_units_l1': 10, 'optimizer': 'Adam', 'adam_learning_rate': 0.0006487260042908888}. Best is trial 110 with value: 0.7876920104026794.
Trial 135 finished with value: 0.7796919345855713 and parameters: {'n_layers': 2, 'weight_decay': 1.538826294773007e-08, 'n_units_l0': 45, 'n_units_l1': 9, 'optimizer': 'Adam', 'adam_learning_rate': 0.0010728414390102196}. Best is trial 110 with value: 0.7876920104026794.
Trial 136 finished with value: 0.5169231295585632 and parameters: {'n_layers': 1, 'weight_decay': 2.7717903857319063e-09, 'n_units_l0': 45, 'optimizer': 'Adam', 'adam_learning_rate': 0.0011028524413158618}. Best is trial 110 with value: 0.7876920104026794.
Trial 137 finished with value: 0.5132308602333069 and parameters: {'n_layers': 2, 'weight_decay': 1.4811283668082474e-08, 'n_units_l0': 53, 'n_units_l1': 10, 'optimizer': 'RMSprop', 'rmsprop_learning_rate': 0.0038212166409866276, 'rmsprop_weight_decay': 0.9157684676154549, 'rmsprop_momentum': 0.005524094240735542}. Best is trial 110 with value: 0.7876920104026794.
Trial 138 finished with value: 0.771692156791687 and parameters: {'n_layers': 2, 'weight_decay': 9.756756239479212e-09, 'n_units_l0': 61, 'n_units_l1': 15, 'optimizer': 'Adam', 'adam_learning_rate': 0.0009123689863218006}. Best is trial 110 with value: 0.7876920104026794.
Trial 139 finished with value: 0.5132308602333069 and parameters: {'n_layers': 2, 'weight_decay': 2.05969571041272e-08, 'n_units_l0': 71, 'n_units_l1': 11, 'optimizer': 'Adam', 'adam_learning_rate': 0.002513211290892374}. Best is trial 110 with value: 0.7876920104026794.
Trial 140 finished with value: 0.742769181728363 and parameters: {'n_layers': 2, 'weight_decay': 5.716605019031796e-09, 'n_units_l0': 49, 'n_units_l1': 9, 'optimizer': 'Adam', 'adam_learning_rate': 0.0006817739800064172}. Best is trial 110 with value: 0.7876920104026794.
Trial 141 finished with value: 0.7759996652603149 and parameters: {'n_layers': 2, 'weight_decay': 2.166140669947659e-08, 'n_units_l0': 44, 'n_units_l1': 14, 'optimizer': 'Adam', 'adam_learning_rate': 0.0006568753297812702}. Best is trial 110 with value: 0.7876920104026794.
Trial 142 finished with value: 0.7796920537948608 and parameters: {'n_layers': 2, 'weight_decay': 1.2480416664646582e-08, 'n_units_l0': 57, 'n_units_l1': 13, 'optimizer': 'Adam', 'adam_learning_rate': 0.0010813799509730507}. Best is trial 110 with value: 0.7876920104026794.
Trial 143 finished with value: 0.7698459625244141 and parameters: {'n_layers': 2, 'weight_decay': 1.2251387255314794e-08, 'n_units_l0': 53, 'n_units_l1': 13, 'optimizer': 'Adam', 'adam_learning_rate': 0.0010902307559644178}. Best is trial 110 with value: 0.7876920104026794.
Trial 144 finished with value: 0.7839997410774231 and parameters: {'n_layers': 2, 'weight_decay': 8.27979399742663e-09, 'n_units_l0': 57, 'n_units_l1': 15, 'optimizer': 'Adam', 'adam_learning_rate': 0.0008699711303968331}. Best is trial 110 with value: 0.7876920104026794.
Trial 145 finished with value: 0.5212308168411255 and parameters: {'n_layers': 1, 'weight_decay': 3.827102694050935e-09, 'n_units_l0': 59, 'optimizer': 'Adam', 'adam_learning_rate': 0.0013561605564145322}. Best is trial 110 with value: 0.7876920104026794.
Trial 146 finished with value: 0.5132308602333069 and parameters: {'n_layers': 2, 'weight_decay': 7.056910374410208e-09, 'n_units_l0': 65, 'n_units_l1': 12, 'optimizer': 'Adam', 'adam_learning_rate': 0.001952787163521774}. Best is trial 110 with value: 0.7876920104026794.
Trial 147 finished with value: 0.7827690243721008 and parameters: {'n_layers': 2, 'weight_decay': 8.52280708274595e-09, 'n_units_l0': 49, 'n_units_l1': 15, 'optimizer': 'Adam', 'adam_learning_rate': 0.0015137031220872712}. Best is trial 110 with value: 0.7876920104026794.
Trial 148 finished with value: 0.7870766520500183 and parameters: {'n_layers': 2, 'weight_decay': 9.70447341839012e-09, 'n_units_l0': 75, 'n_units_l1': 16, 'optimizer': 'Adam', 'adam_learning_rate': 0.0016654121588516061}. Best is trial 110 with value: 0.7876920104026794.
Trial 149 finished with value: 0.5132308602333069 and parameters: {'n_layers': 2, 'weight_decay': 5.3227910208995225e-09, 'n_units_l0': 75, 'n_units_l1': 15, 'optimizer': 'Adam', 'adam_learning_rate': 0.003436985759795812}. Best is trial 110 with value: 0.7876920104026794.
Trial 150 finished with value: 0.6301539540290833 and parameters: {'n_layers': 1, 'weight_decay': 8.788060307454151e-09, 'n_units_l0': 48, 'optimizer': 'Adam', 'adam_learning_rate': 0.0017559461992708014}. Best is trial 110 with value: 0.7876920104026794.
Trial 151 finished with value: 0.7612305283546448 and parameters: {'n_layers': 2, 'weight_decay': 1.1770819892157863e-08, 'n_units_l0': 41, 'n_units_l1': 17, 'optimizer': 'Adam', 'adam_learning_rate': 0.001524998045067351}. Best is trial 110 with value: 0.7876920104026794.
Trial 152 finished with value: 0.7766151428222656 and parameters: {'n_layers': 2, 'weight_decay': 3.3791093638834905e-09, 'n_units_l0': 57, 'n_units_l1': 16, 'optimizer': 'Adam', 'adam_learning_rate': 0.0011494855126968006}. Best is trial 110 with value: 0.7876920104026794.
Trial 153 finished with value: 0.5132308602333069 and parameters: {'n_layers': 2, 'weight_decay': 1.7618010622373227e-08, 'n_units_l0': 82, 'n_units_l1': 11, 'optimizer': 'Adam', 'adam_learning_rate': 0.002325374158753689}. Best is trial 110 with value: 0.7876920104026794.
Trial 154 finished with value: 0.7876920700073242 and parameters: {'n_layers': 2, 'weight_decay': 8.637680502484728e-09, 'n_units_l0': 63, 'n_units_l1': 13, 'optimizer': 'Adam', 'adam_learning_rate': 0.0008672126798439568}. Best is trial 154 with value: 0.7876920700073242.
Trial 155 finished with value: 0.7753845453262329 and parameters: {'n_layers': 2, 'weight_decay': 4.598991895667868e-09, 'n_units_l0': 65, 'n_units_l1': 14, 'optimizer': 'Adam', 'adam_learning_rate': 0.0008364992064913542}. Best is trial 154 with value: 0.7876920700073242.
Trial 156 finished with value: 0.7809228301048279 and parameters: {'n_layers': 2, 'weight_decay': 8.343772954396511e-09, 'n_units_l0': 94, 'n_units_l1': 15, 'optimizer': 'Adam', 'adam_learning_rate': 0.0014425995478805432}. Best is trial 154 with value: 0.7876920700073242.
Trial 157 finished with value: 0.7809227705001831 and parameters: {'n_layers': 2, 'weight_decay': 7.578540675619562e-09, 'n_units_l0': 98, 'n_units_l1': 15, 'optimizer': 'Adam', 'adam_learning_rate': 0.0014356250990096525}. Best is trial 154 with value: 0.7876920700073242.
Trial 158 finished with value: 0.5132308602333069 and parameters: {'n_layers': 1, 'weight_decay': 7.050035951575914e-09, 'n_units_l0': 99, 'optimizer': 'SGD', 'sgd_opt_learning_rate': 8.84048414265711e-05, 'sgd_opt_momentum': 0.023570393694807047}. Best is trial 154 with value: 0.7876920700073242.
Trial 159 finished with value: 0.5132308602333069 and parameters: {'n_layers': 2, 'weight_decay': 3.74581197299433e-09, 'n_units_l0': 92, 'n_units_l1': 16, 'optimizer': 'Adam', 'adam_learning_rate': 0.002887597475290233}. Best is trial 154 with value: 0.7876920700073242.
Trial 160 finished with value: 0.7649229764938354 and parameters: {'n_layers': 2, 'weight_decay': 8.221387640936326e-09, 'n_units_l0': 121, 'n_units_l1': 14, 'optimizer': 'Adam', 'adam_learning_rate': 0.0014853002652577502}. Best is trial 154 with value: 0.7876920700073242.
Trial 161 finished with value: 0.7729228138923645 and parameters: {'n_layers': 2, 'weight_decay': 9.974278720707077e-09, 'n_units_l0': 110, 'n_units_l1': 15, 'optimizer': 'Adam', 'adam_learning_rate': 0.0012656598573704875}. Best is trial 154 with value: 0.7876920700073242.
Trial 162 finished with value: 0.7396923899650574 and parameters: {'n_layers': 2, 'weight_decay': 1.2591871891785733e-08, 'n_units_l0': 73, 'n_units_l1': 13, 'optimizer': 'Adam', 'adam_learning_rate': 0.0016885597197644588}. Best is trial 154 with value: 0.7876920700073242.
Trial 163 finished with value: 0.7815381288528442 and parameters: {'n_layers': 2, 'weight_decay': 2.431479732907607e-08, 'n_units_l0': 80, 'n_units_l1': 12, 'optimizer': 'Adam', 'adam_learning_rate': 0.0008032181389365074}. Best is trial 154 with value: 0.7876920700073242.
Trial 164 finished with value: 0.7790766358375549 and parameters: {'n_layers': 2, 'weight_decay': 4.41594630817165e-08, 'n_units_l0': 82, 'n_units_l1': 17, 'optimizer': 'Adam', 'adam_learning_rate': 0.0007856433768458561}. Best is trial 154 with value: 0.7876920700073242.
Trial 165 finished with value: 0.7790766358375549 and parameters: {'n_layers': 2, 'weight_decay': 2.4509189607017445e-08, 'n_units_l0': 86, 'n_units_l1': 15, 'optimizer': 'Adam', 'adam_learning_rate': 0.0005063214687748115}. Best is trial 154 with value: 0.7876920700073242.
Trial 166 finished with value: 0.5999999046325684 and parameters: {'n_layers': 1, 'weight_decay': 5.306124659732138e-09, 'n_units_l0': 98, 'optimizer': 'Adam', 'adam_learning_rate': 0.000859319708430427}. Best is trial 154 with value: 0.7876920700073242.
Trial 167 finished with value: 0.5132308602333069 and parameters: {'n_layers': 2, 'weight_decay': 2.229981512237976e-09, 'n_units_l0': 77, 'n_units_l1': 12, 'optimizer': 'RMSprop', 'rmsprop_learning_rate': 0.0001844501014178797, 'rmsprop_weight_decay': 0.8693145795674181, 'rmsprop_momentum': 0.0216599329847019}. Best is trial 154 with value: 0.7876920700073242.
Trial 168 finished with value: 0.7550767064094543 and parameters: {'n_layers': 2, 'weight_decay': 2.4669234673886654e-08, 'n_units_l0': 50, 'n_units_l1': 12, 'optimizer': 'Adam', 'adam_learning_rate': 0.0020723831329032827}. Best is trial 154 with value: 0.7876920700073242.
Trial 169 finished with value: 0.7384615540504456 and parameters: {'n_layers': 2, 'weight_decay': 8.294871431274125e-09, 'n_units_l0': 67, 'n_units_l1': 14, 'optimizer': 'Adam', 'adam_learning_rate': 0.001295779653740675}. Best is trial 154 with value: 0.7876920700073242.
Trial 170 finished with value: 0.7747690081596375 and parameters: {'n_layers': 2, 'weight_decay': 4.369709271708837e-08, 'n_units_l0': 61, 'n_units_l1': 11, 'optimizer': 'Adam', 'adam_learning_rate': 0.0009315671112617356}. Best is trial 154 with value: 0.7876920700073242.
Trial 171 finished with value: 0.774769127368927 and parameters: {'n_layers': 2, 'weight_decay': 1.0957268403191327e-08, 'n_units_l0': 54, 'n_units_l1': 13, 'optimizer': 'Adam', 'adam_learning_rate': 0.0011782408073866789}. Best is trial 154 with value: 0.7876920700073242.
Trial 172 finished with value: 0.7796919941902161 and parameters: {'n_layers': 2, 'weight_decay': 1.5950543199881827e-08, 'n_units_l0': 60, 'n_units_l1': 16, 'optimizer': 'Adam', 'adam_learning_rate': 0.0007245361453364864}. Best is trial 154 with value: 0.7876920700073242.
Trial 173 finished with value: 0.7692306637763977 and parameters: {'n_layers': 2, 'weight_decay': 6.578661228934284e-09, 'n_units_l0': 50, 'n_units_l1': 15, 'optimizer': 'Adam', 'adam_learning_rate': 0.0016022441643282748}. Best is trial 154 with value: 0.7876920700073242.
Trial 174 finished with value: 0.5470768213272095 and parameters: {'n_layers': 1, 'weight_decay': 2.2146356578630943e-08, 'n_units_l0': 38, 'optimizer': 'Adam', 'adam_learning_rate': 0.0010139064179326609}. Best is trial 154 with value: 0.7876920700073242.
Trial 175 finished with value: 0.5132308602333069 and parameters: {'n_layers': 2, 'weight_decay': 1.2273611477367218e-08, 'n_units_l0': 90, 'n_units_l1': 17, 'optimizer': 'Adam', 'adam_learning_rate': 0.01911300912083767}. Best is trial 154 with value: 0.7876920700073242.
Trial 176 finished with value: 0.785845935344696 and parameters: {'n_layers': 2, 'weight_decay': 8.953861385029266e-09, 'n_units_l0': 63, 'n_units_l1': 14, 'optimizer': 'Adam', 'adam_learning_rate': 0.0005839190288104438}. Best is trial 154 with value: 0.7876920700073242.
Trial 177 finished with value: 0.7766152024269104 and parameters: {'n_layers': 2, 'weight_decay': 8.202365664097195e-09, 'n_units_l0': 70, 'n_units_l1': 14, 'optimizer': 'Adam', 'adam_learning_rate': 0.0005662161990217786}. Best is trial 154 with value: 0.7876920700073242.
Trial 178 finished with value: 0.5132308602333069 and parameters: {'n_layers': 9, 'weight_decay': 5.226688065095109e-09, 'n_units_l0': 63, 'n_units_l1': 18, 'n_units_l2': 114, 'n_units_l3': 7, 'n_units_l4': 4, 'n_units_l5': 110, 'n_units_l6': 27, 'n_units_l7': 8, 'n_units_l8': 118, 'optimizer': 'Adam', 'adam_learning_rate': 0.00048412092214065777}. Best is trial 154 with value: 0.7876920700073242.
Trial 179 finished with value: 0.7796920537948608 and parameters: {'n_layers': 2, 'weight_decay': 3.5293820699455008e-09, 'n_units_l0': 47, 'n_units_l1': 16, 'optimizer': 'Adam', 'adam_learning_rate': 0.0007830522267691156}. Best is trial 154 with value: 0.7876920700073242.
Trial 180 finished with value: 0.7809227705001831 and parameters: {'n_layers': 2, 'weight_decay': 3.853952423934947e-08, 'n_units_l0': 77, 'n_units_l1': 14, 'optimizer': 'Adam', 'adam_learning_rate': 0.001378334175601717}. Best is trial 154 with value: 0.7876920700073242.
Trial 181 finished with value: 0.7569229602813721 and parameters: {'n_layers': 2, 'weight_decay': 4.016674244940709e-08, 'n_units_l0': 78, 'n_units_l1': 14, 'optimizer': 'Adam', 'adam_learning_rate': 0.0014150006333494608}. Best is trial 154 with value: 0.7876920700073242.
Trial 182 finished with value: 0.786461353302002 and parameters: {'n_layers': 2, 'weight_decay': 2.590040143531428e-08, 'n_units_l0': 101, 'n_units_l1': 12, 'optimizer': 'Adam', 'adam_learning_rate': 0.0019063923870406233}. Best is trial 154 with value: 0.7876920700073242.
Trial 183 finished with value: 0.5132308602333069 and parameters: {'n_layers': 2, 'weight_decay': 2.9541402743339513e-08, 'n_units_l0': 98, 'n_units_l1': 12, 'optimizer': 'Adam', 'adam_learning_rate': 0.0018986825579961819}. Best is trial 154 with value: 0.7876920700073242.
Trial 184 finished with value: 0.5132308602333069 and parameters: {'n_layers': 2, 'weight_decay': 4.687009935033385e-08, 'n_units_l0': 114, 'n_units_l1': 15, 'optimizer': 'Adam', 'adam_learning_rate': 0.002784082393516599}. Best is trial 154 with value: 0.7876920700073242.
Trial 185 finished with value: 0.7581537961959839 and parameters: {'n_layers': 2, 'weight_decay': 2.3787650152064432e-08, 'n_units_l0': 83, 'n_units_l1': 12, 'optimizer': 'Adam', 'adam_learning_rate': 0.00231027774171847}. Best is trial 154 with value: 0.7876920700073242.
Trial 186 finished with value: 0.7864612936973572 and parameters: {'n_layers': 1, 'weight_decay': 7.635567806634958e-08, 'n_units_l0': 102, 'optimizer': 'Adam', 'adam_learning_rate': 0.004026651464553797}. Best is trial 154 with value: 0.7876920700073242.
Trial 187 finished with value: 0.5132308602333069 and parameters: {'n_layers': 1, 'weight_decay': 6.121019803116154e-08, 'n_units_l0': 128, 'optimizer': 'Adam', 'adam_learning_rate': 0.00931095442513833}. Best is trial 154 with value: 0.7876920700073242.
Trial 188 finished with value: 0.768615186214447 and parameters: {'n_layers': 1, 'weight_decay': 7.098270016799464e-08, 'n_units_l0': 104, 'optimizer': 'Adam', 'adam_learning_rate': 0.0036506290894961963}. Best is trial 154 with value: 0.7876920700073242.
Trial 189 finished with value: 0.5132308602333069 and parameters: {'n_layers': 1, 'weight_decay': 9.274942690018658e-09, 'n_units_l0': 91, 'optimizer': 'Adam', 'adam_learning_rate': 0.006039446091922959}. Best is trial 154 with value: 0.7876920700073242.
Trial 190 finished with value: 0.5132308602333069 and parameters: {'n_layers': 2, 'weight_decay': 7.705758043753574e-08, 'n_units_l0': 101, 'n_units_l1': 18, 'optimizer': 'SGD', 'sgd_opt_learning_rate': 0.019927267777184645, 'sgd_opt_momentum': 8.298199912924586e-05}. Best is trial 154 with value: 0.7876920700073242.
Trial 191 finished with value: 0.7821535468101501 and parameters: {'n_layers': 2, 'weight_decay': 1.55514401148612e-08, 'n_units_l0': 92, 'n_units_l1': 16, 'optimizer': 'Adam', 'adam_learning_rate': 0.0014391869448957654}. Best is trial 154 with value: 0.7876920700073242.
Trial 192 finished with value: 0.7390768527984619 and parameters: {'n_layers': 2, 'weight_decay': 1.5115166534104625e-08, 'n_units_l0': 95, 'n_units_l1': 17, 'optimizer': 'Adam', 'adam_learning_rate': 0.0016202586184006515}. Best is trial 154 with value: 0.7876920700073242.
Trial 193 finished with value: 0.7692304849624634 and parameters: {'n_layers': 2, 'weight_decay': 6.594653103011463e-09, 'n_units_l0': 73, 'n_units_l1': 14, 'optimizer': 'Adam', 'adam_learning_rate': 0.001286458766772139}. Best is trial 154 with value: 0.7876920700073242.
Trial 194 finished with value: 0.7403075695037842 and parameters: {'n_layers': 2, 'weight_decay': 3.773714325978926e-08, 'n_units_l0': 87, 'n_units_l1': 16, 'optimizer': 'Adam', 'adam_learning_rate': 0.001928707859642604}. Best is trial 154 with value: 0.7876920700073242.
Trial 195 finished with value: 0.5132308602333069 and parameters: {'n_layers': 3, 'weight_decay': 1.0197837783002028e-08, 'n_units_l0': 118, 'n_units_l1': 11, 'n_units_l2': 61, 'optimizer': 'Adam', 'adam_learning_rate': 0.0043321928726281385}. Best is trial 154 with value: 0.7876920700073242.
Trial 196 finished with value: 0.6307693123817444 and parameters: {'n_layers': 1, 'weight_decay': 1.631862164678219e-08, 'n_units_l0': 106, 'optimizer': 'Adam', 'adam_learning_rate': 0.0009155328113982372}. Best is trial 154 with value: 0.7876920700073242.
Trial 197 finished with value: 0.7624613642692566 and parameters: {'n_layers': 2, 'weight_decay': 2.863215048830968e-08, 'n_units_l0': 75, 'n_units_l1': 15, 'optimizer': 'Adam', 'adam_learning_rate': 0.0013847885189281776}. Best is trial 154 with value: 0.7876920700073242.
Trial 198 finished with value: 0.76738440990448 and parameters: {'n_layers': 2, 'weight_decay': 4.533216496211236e-09, 'n_units_l0': 69, 'n_units_l1': 14, 'optimizer': 'Adam', 'adam_learning_rate': 0.0011065834998030195}. Best is trial 154 with value: 0.7876920700073242.
Trial 199 finished with value: 0.5132308602333069 and parameters: {'n_layers': 2, 'weight_decay': 1.3333782938436286e-08, 'n_units_l0': 79, 'n_units_l1': 18, 'optimizer': 'RMSprop', 'rmsprop_learning_rate': 2.1587305792552225e-05, 'rmsprop_weight_decay': 0.9300356636750503, 'rmsprop_momentum': 0.0031859422791854363}. Best is trial 154 with value: 0.7876920700073242.
Trial 200 finished with value: 0.5132308602333069 and parameters: {'n_layers': 2, 'weight_decay': 6.966193643654188e-09, 'n_units_l0': 91, 'n_units_l1': 16, 'optimizer': 'Adam', 'adam_learning_rate': 0.0023713167993477963}. Best is trial 154 with value: 0.7876920700073242.
Trial 201 finished with value: 0.7827689051628113 and parameters: {'n_layers': 2, 'weight_decay': 2.285607784864537e-08, 'n_units_l0': 55, 'n_units_l1': 13, 'optimizer': 'Adam', 'adam_learning_rate': 0.000654157309773494}. Best is trial 154 with value: 0.7876920700073242.
Trial 202 finished with value: 0.7858458161354065 and parameters: {'n_layers': 2, 'weight_decay': 5.086935390176861e-08, 'n_units_l0': 61, 'n_units_l1': 13, 'optimizer': 'Adam', 'adam_learning_rate': 0.0008730032228496992}. Best is trial 154 with value: 0.7876920700073242.
Trial 203 finished with value: 0.7636922001838684 and parameters: {'n_layers': 2, 'weight_decay': 5.539120117315053e-08, 'n_units_l0': 62, 'n_units_l1': 12, 'optimizer': 'Adam', 'adam_learning_rate': 0.0008177096485080254}. Best is trial 154 with value: 0.7876920700073242.
Trial 204 finished with value: 0.7821535468101501 and parameters: {'n_layers': 2, 'weight_decay': 1.9942371881101e-08, 'n_units_l0': 56, 'n_units_l1': 13, 'optimizer': 'Adam', 'adam_learning_rate': 0.0009636715529546242}. Best is trial 154 with value: 0.7876920700073242.
Trial 205 finished with value: 0.7833842635154724 and parameters: {'n_layers': 2, 'weight_decay': 2.3638794610577928e-08, 'n_units_l0': 53, 'n_units_l1': 11, 'optimizer': 'Adam', 'adam_learning_rate': 0.0009633844192038113}. Best is trial 154 with value: 0.7876920700073242.
Trial 206 finished with value: 0.7778458595275879 and parameters: {'n_layers': 2, 'weight_decay': 2.611928067547934e-08, 'n_units_l0': 54, 'n_units_l1': 11, 'optimizer': 'Adam', 'adam_learning_rate': 0.0009439724101470219}. Best is trial 154 with value: 0.7876920700073242.
Trial 207 finished with value: 0.762461245059967 and parameters: {'n_layers': 3, 'weight_decay': 2.11766464730497e-08, 'n_units_l0': 59, 'n_units_l1': 9, 'n_units_l2': 44, 'optimizer': 'Adam', 'adam_learning_rate': 0.0005783718545997392}. Best is trial 154 with value: 0.7876920700073242.
Trial 208 finished with value: 0.7852303981781006 and parameters: {'n_layers': 2, 'weight_decay': 1.847048611174147e-08, 'n_units_l0': 66, 'n_units_l1': 12, 'optimizer': 'Adam', 'adam_learning_rate': 0.0006967134341292842}. Best is trial 154 with value: 0.7876920700073242.
Trial 209 finished with value: 0.7833845019340515 and parameters: {'n_layers': 2, 'weight_decay': 3.3148491511133596e-08, 'n_units_l0': 66, 'n_units_l1': 12, 'optimizer': 'Adam', 'adam_learning_rate': 0.0006618988918866316}. Best is trial 154 with value: 0.7876920700073242.
Trial 210 finished with value: 0.5212308168411255 and parameters: {'n_layers': 1, 'weight_decay': 3.459585765410778e-08, 'n_units_l0': 64, 'optimizer': 'Adam', 'adam_learning_rate': 0.0006396673514374026}. Best is trial 154 with value: 0.7876920700073242.
Trial 211 finished with value: 0.7827688455581665 and parameters: {'n_layers': 2, 'weight_decay': 5.237240037059886e-08, 'n_units_l0': 56, 'n_units_l1': 12, 'optimizer': 'Adam', 'adam_learning_rate': 0.0007636287364320999}. Best is trial 154 with value: 0.7876920700073242.
