Trial 367 finished with value: 0.5132308602333069 and parameters: {'n_layers': 1, 'weight_decay': 2.5914966893156684e-08, 'n_units_l0': 77, 'optimizer': 'RMSprop', 'rmsprop_learning_rate': 0.009660848632106497, 'rmsprop_weight_decay': 0.972321960588218, 'rmsprop_momentum': 0.012002851270882044}. Best is trial 154 with value: 0.7876920700073242.
Trial 368 finished with value: 0.5132308602333069 and parameters: {'n_layers': 2, 'weight_decay': 1.391522736900796e-08, 'n_units_l0': 58, 'n_units_l1': 14, 'optimizer': 'Adam', 'adam_learning_rate': 0.0005798305656765009}. Best is trial 154 with value: 0.7876920700073242.
Trial 369 finished with value: 0.7636919617652893 and parameters: {'n_layers': 2, 'weight_decay': 9.583984012320796e-09, 'n_units_l0': 109, 'n_units_l1': 19, 'optimizer': 'Adam', 'adam_learning_rate': 0.0007903206448900662}. Best is trial 154 with value: 0.7876920700073242.
Trial 370 finished with value: 0.5132308602333069 and parameters: {'n_layers': 2, 'weight_decay': 4.724856012221538e-08, 'n_units_l0': 64, 'n_units_l1': 14, 'optimizer': 'Adam', 'adam_learning_rate': 0.0038263680794993144}. Best is trial 154 with value: 0.7876920700073242.
Trial 371 finished with value: 0.7827690243721008 and parameters: {'n_layers': 2, 'weight_decay': 4.488184090399743e-09, 'n_units_l0': 57, 'n_units_l1': 12, 'optimizer': 'Adam', 'adam_learning_rate': 0.000719067794953449}. Best is trial 154 with value: 0.7876920700073242.
Trial 372 finished with value: 0.5132308602333069 and parameters: {'n_layers': 2, 'weight_decay': 6.874017588158562e-08, 'n_units_l0': 15, 'n_units_l1': 11, 'optimizer': 'Adam', 'adam_learning_rate': 0.004604105553163976}. Best is trial 154 with value: 0.7876920700073242.
Trial 373 finished with value: 0.7569229602813721 and parameters: {'n_layers': 3, 'weight_decay': 2.7673353011784984e-08, 'n_units_l0': 62, 'n_units_l1': 16, 'n_units_l2': 90, 'optimizer': 'Adam', 'adam_learning_rate': 0.00043486780855528097}. Best is trial 154 with value: 0.7876920700073242.
Trial 374 finished with value: 0.5519999861717224 and parameters: {'n_layers': 1, 'weight_decay': 1.688819736171171e-08, 'n_units_l0': 73, 'optimizer': 'Adam', 'adam_learning_rate': 0.0010646466529880651}. Best is trial 154 with value: 0.7876920700073242.
Trial 375 finished with value: 0.5132308602333069 and parameters: {'n_layers': 2, 'weight_decay': 3.2307376450729114e-08, 'n_units_l0': 67, 'n_units_l1': 13, 'optimizer': 'SGD', 'sgd_opt_learning_rate': 0.043799891320188786, 'sgd_opt_momentum': 0.00011429077773233053}. Best is trial 154 with value: 0.7876920700073242.
Trial 376 finished with value: 0.7858458161354065 and parameters: {'n_layers': 2, 'weight_decay': 6.765307250114584e-09, 'n_units_l0': 56, 'n_units_l1': 15, 'optimizer': 'Adam', 'adam_learning_rate': 0.0006123119175484193}. Best is trial 154 with value: 0.7876920700073242.
Trial 377 finished with value: 0.783384382724762 and parameters: {'n_layers': 2, 'weight_decay': 2.5689511630009576e-09, 'n_units_l0': 55, 'n_units_l1': 18, 'optimizer': 'Adam', 'adam_learning_rate': 0.00065109831877727}. Best is trial 154 with value: 0.7876920700073242.
Trial 378 finished with value: 0.7796919345855713 and parameters: {'n_layers': 2, 'weight_decay': 7.805848199565562e-10, 'n_units_l0': 56, 'n_units_l1': 18, 'optimizer': 'Adam', 'adam_learning_rate': 0.0006236096416276022}. Best is trial 154 with value: 0.7876920700073242.
Trial 379 finished with value: 0.7796919941902161 and parameters: {'n_layers': 2, 'weight_decay': 3.789137701071551e-09, 'n_units_l0': 59, 'n_units_l1': 17, 'optimizer': 'Adam', 'adam_learning_rate': 0.0007665405222839171}. Best is trial 154 with value: 0.7876920700073242.
Trial 380 finished with value: 0.734153687953949 and parameters: {'n_layers': 3, 'weight_decay': 1.8258119501185678e-09, 'n_units_l0': 61, 'n_units_l1': 18, 'n_units_l2': 114, 'optimizer': 'Adam', 'adam_learning_rate': 0.0006029555502637168}. Best is trial 154 with value: 0.7876920700073242.
Trial 381 finished with value: 0.781538188457489 and parameters: {'n_layers': 2, 'weight_decay': 2.4648975748884213e-09, 'n_units_l0': 55, 'n_units_l1': 16, 'optimizer': 'Adam', 'adam_learning_rate': 0.0005361320841855064}. Best is trial 154 with value: 0.7876920700073242.
Trial 382 finished with value: 0.5132308602333069 and parameters: {'n_layers': 2, 'weight_decay': 2.1844658852815654e-09, 'n_units_l0': 65, 'n_units_l1': 19, 'optimizer': 'RMSprop', 'rmsprop_learning_rate': 0.002177661410511372, 'rmsprop_weight_decay': 0.9026378858049509, 'rmsprop_momentum': 2.5639657817373333e-05}. Best is trial 154 with value: 0.7876920700073242.
Trial 383 finished with value: 0.7852304577827454 and parameters: {'n_layers': 2, 'weight_decay': 6.7008775596504265e-09, 'n_units_l0': 61, 'n_units_l1': 20, 'optimizer': 'Adam', 'adam_learning_rate': 0.0024554916822018685}. Best is trial 154 with value: 0.7876920700073242.
Trial 384 finished with value: 0.5132308602333069 and parameters: {'n_layers': 10, 'weight_decay': 5.662249872172078e-09, 'n_units_l0': 61, 'n_units_l1': 21, 'n_units_l2': 70, 'n_units_l3': 5, 'n_units_l4': 11, 'n_units_l5': 126, 'n_units_l6': 10, 'n_units_l7': 79, 'n_units_l8': 9, 'n_units_l9': 117, 'optimizer': 'Adam', 'adam_learning_rate': 0.002756289235393565}. Best is trial 154 with value: 0.7876920700073242.
Trial 385 finished with value: 0.5212308168411255 and parameters: {'n_layers': 1, 'weight_decay': 4.724174393728226e-09, 'n_units_l0': 8, 'optimizer': 'Adam', 'adam_learning_rate': 0.0024862085948441364}. Best is trial 154 with value: 0.7876920700073242.
Trial 386 finished with value: 0.753230631351471 and parameters: {'n_layers': 2, 'weight_decay': 7.119893538140781e-09, 'n_units_l0': 68, 'n_units_l1': 20, 'optimizer': 'Adam', 'adam_learning_rate': 0.0017773954595004583}. Best is trial 154 with value: 0.7876920700073242.
Trial 387 finished with value: 0.5132308602333069 and parameters: {'n_layers': 2, 'weight_decay': 7.18924135018974e-09, 'n_units_l0': 56, 'n_units_l1': 22, 'optimizer': 'Adam', 'adam_learning_rate': 0.0022127153049838317}. Best is trial 154 with value: 0.7876920700073242.
Trial 388 finished with value: 0.7310768365859985 and parameters: {'n_layers': 2, 'weight_decay': 4.0090804625524415e-09, 'n_units_l0': 61, 'n_units_l1': 20, 'optimizer': 'Adam', 'adam_learning_rate': 0.0032653252208693305}. Best is trial 154 with value: 0.7876920700073242.
Trial 389 finished with value: 0.7636921405792236 and parameters: {'n_layers': 2, 'weight_decay': 1.668917051822842e-09, 'n_units_l0': 51, 'n_units_l1': 18, 'optimizer': 'Adam', 'adam_learning_rate': 0.0013507729269718106}. Best is trial 154 with value: 0.7876920700073242.
Trial 390 finished with value: 0.7839997410774231 and parameters: {'n_layers': 2, 'weight_decay': 2.8156504227542795e-09, 'n_units_l0': 72, 'n_units_l1': 19, 'optimizer': 'Adam', 'adam_learning_rate': 0.0008335741481606633}. Best is trial 154 with value: 0.7876920700073242.
Trial 391 finished with value: 0.5132308602333069 and parameters: {'n_layers': 2, 'weight_decay': 1.6280226228393057e-09, 'n_units_l0': 77, 'n_units_l1': 22, 'optimizer': 'Adam', 'adam_learning_rate': 2.9697697819083615e-05}. Best is trial 154 with value: 0.7876920700073242.
Trial 392 finished with value: 0.7759997844696045 and parameters: {'n_layers': 2, 'weight_decay': 2.8291182904316877e-09, 'n_units_l0': 6, 'n_units_l1': 19, 'optimizer': 'Adam', 'adam_learning_rate': 0.0008485147015272742}. Best is trial 154 with value: 0.7876920700073242.
Trial 393 finished with value: 0.7766150832176208 and parameters: {'n_layers': 2, 'weight_decay': 3.743496056038074e-09, 'n_units_l0': 73, 'n_units_l1': 20, 'optimizer': 'Adam', 'adam_learning_rate': 0.0007549414075784525}. Best is trial 154 with value: 0.7876920700073242.
Trial 394 finished with value: 0.716307520866394 and parameters: {'n_layers': 1, 'weight_decay': 5.873524307753867e-09, 'n_units_l0': 68, 'optimizer': 'Adam', 'adam_learning_rate': 0.0018745141744019062}. Best is trial 154 with value: 0.7876920700073242.
Trial 395 finished with value: 0.7390769124031067 and parameters: {'n_layers': 3, 'weight_decay': 2.679027813247058e-09, 'n_units_l0': 71, 'n_units_l1': 23, 'n_units_l2': 7, 'optimizer': 'Adam', 'adam_learning_rate': 0.0009982556558485092}. Best is trial 154 with value: 0.7876920700073242.
Trial 396 finished with value: 0.777230441570282 and parameters: {'n_layers': 2, 'weight_decay': 1.4321340496065612e-09, 'n_units_l0': 63, 'n_units_l1': 20, 'optimizer': 'Adam', 'adam_learning_rate': 0.00068110070765485}. Best is trial 154 with value: 0.7876920700073242.
Trial 397 finished with value: 0.7316922545433044 and parameters: {'n_layers': 2, 'weight_decay': 8.366259341186175e-09, 'n_units_l0': 58, 'n_units_l1': 17, 'optimizer': 'Adam', 'adam_learning_rate': 0.0024962241405187212}. Best is trial 154 with value: 0.7876920700073242.
Trial 398 finished with value: 0.7679998278617859 and parameters: {'n_layers': 2, 'weight_decay': 2.8381106402632587e-09, 'n_units_l0': 65, 'n_units_l1': 18, 'optimizer': 'Adam', 'adam_learning_rate': 0.0012522344116751582}. Best is trial 154 with value: 0.7876920700073242.
Trial 399 finished with value: 0.5132308602333069 and parameters: {'n_layers': 2, 'weight_decay': 5.176363541603252e-09, 'n_units_l0': 81, 'n_units_l1': 16, 'optimizer': 'SGD', 'sgd_opt_learning_rate': 0.004786365207734313, 'sgd_opt_momentum': 0.0008410456992900929}. Best is trial 154 with value: 0.7876920700073242.
Trial 400 finished with value: 0.5335384011268616 and parameters: {'n_layers': 1, 'weight_decay': 8.31285343506362e-09, 'n_units_l0': 55, 'optimizer': 'Adam', 'adam_learning_rate': 0.0008702281746962385}. Best is trial 154 with value: 0.7876920700073242.
Trial 401 finished with value: 0.7698459625244141 and parameters: {'n_layers': 2, 'weight_decay': 4.642167842195275e-09, 'n_units_l0': 60, 'n_units_l1': 21, 'optimizer': 'Adam', 'adam_learning_rate': 0.0010615277638669916}. Best is trial 154 with value: 0.7876920700073242.
Trial 402 finished with value: 0.7673844695091248 and parameters: {'n_layers': 2, 'weight_decay': 9.724673525786659e-09, 'n_units_l0': 53, 'n_units_l1': 19, 'optimizer': 'Adam', 'adam_learning_rate': 0.001571077847777594}. Best is trial 154 with value: 0.7876920700073242.
Trial 403 finished with value: 0.7661535739898682 and parameters: {'n_layers': 3, 'weight_decay': 2.3515370628252706e-09, 'n_units_l0': 69, 'n_units_l1': 15, 'n_units_l2': 4, 'optimizer': 'Adam', 'adam_learning_rate': 0.0006693744986198466}. Best is trial 154 with value: 0.7876920700073242.
Trial 404 finished with value: 0.7790768146514893 and parameters: {'n_layers': 2, 'weight_decay': 6.058676117808988e-09, 'n_units_l0': 64, 'n_units_l1': 17, 'optimizer': 'Adam', 'adam_learning_rate': 0.0008641345082583563}. Best is trial 154 with value: 0.7876920700073242.
Trial 405 finished with value: 0.5132308602333069 and parameters: {'n_layers': 2, 'weight_decay': 1.0511074421998575e-08, 'n_units_l0': 58, 'n_units_l1': 15, 'optimizer': 'RMSprop', 'rmsprop_learning_rate': 0.008174119626167653, 'rmsprop_weight_decay': 0.8853875789261956, 'rmsprop_momentum': 0.00021975445494608656}. Best is trial 154 with value: 0.7876920700073242.
Trial 406 finished with value: 0.5132308602333069 and parameters: {'n_layers': 2, 'weight_decay': 3.6548066354880404e-09, 'n_units_l0': 75, 'n_units_l1': 17, 'optimizer': 'Adam', 'adam_learning_rate': 0.002177817726946029}. Best is trial 154 with value: 0.7876920700073242.
Trial 407 finished with value: 0.7827689051628113 and parameters: {'n_layers': 2, 'weight_decay': 1.0764147969662147e-09, 'n_units_l0': 49, 'n_units_l1': 14, 'optimizer': 'Adam', 'adam_learning_rate': 0.001190773850087644}. Best is trial 154 with value: 0.7876920700073242.
Trial 408 finished with value: 0.7858460545539856 and parameters: {'n_layers': 2, 'weight_decay': 1.1374206787359285e-08, 'n_units_l0': 45, 'n_units_l1': 16, 'optimizer': 'Adam', 'adam_learning_rate': 0.000789464866460898}. Best is trial 154 with value: 0.7876920700073242.
Trial 409 finished with value: 0.5212308168411255 and parameters: {'n_layers': 1, 'weight_decay': 6.488604846411983e-09, 'n_units_l0': 40, 'optimizer': 'Adam', 'adam_learning_rate': 0.0006757550156239425}. Best is trial 154 with value: 0.7876920700073242.
Trial 410 finished with value: 0.7864612340927124 and parameters: {'n_layers': 2, 'weight_decay': 9.179034660717348e-09, 'n_units_l0': 47, 'n_units_l1': 16, 'optimizer': 'Adam', 'adam_learning_rate': 0.0005753732956458498}. Best is trial 154 with value: 0.7876920700073242.
Trial 411 finished with value: 0.7809228301048279 and parameters: {'n_layers': 2, 'weight_decay': 1.0302974804867723e-08, 'n_units_l0': 42, 'n_units_l1': 16, 'optimizer': 'Adam', 'adam_learning_rate': 0.0005442006839664953}. Best is trial 154 with value: 0.7876920700073242.
Trial 412 finished with value: 0.7833843231201172 and parameters: {'n_layers': 2, 'weight_decay': 8.16403913308224e-09, 'n_units_l0': 48, 'n_units_l1': 16, 'optimizer': 'Adam', 'adam_learning_rate': 0.0007984880732882178}. Best is trial 154 with value: 0.7876920700073242.
Trial 413 finished with value: 0.7618459463119507 and parameters: {'n_layers': 3, 'weight_decay': 1.8090722829558561e-06, 'n_units_l0': 45, 'n_units_l1': 14, 'n_units_l2': 6, 'optimizer': 'Adam', 'adam_learning_rate': 0.0005805624604373269}. Best is trial 154 with value: 0.7876920700073242.
Trial 414 finished with value: 0.5132308602333069 and parameters: {'n_layers': 2, 'weight_decay': 1.3183878753293991e-08, 'n_units_l0': 47, 'n_units_l1': 15, 'optimizer': 'Adam', 'adam_learning_rate': 0.0052721461370667634}. Best is trial 154 with value: 0.7876920700073242.
Trial 415 finished with value: 0.7409229874610901 and parameters: {'n_layers': 2, 'weight_decay': 7.571883214363664e-09, 'n_units_l0': 45, 'n_units_l1': 15, 'optimizer': 'Adam', 'adam_learning_rate': 0.0018782072742062816}. Best is trial 154 with value: 0.7876920700073242.
Trial 416 finished with value: 0.705230712890625 and parameters: {'n_layers': 2, 'weight_decay': 1.1132190077528004e-08, 'n_units_l0': 25, 'n_units_l1': 17, 'optimizer': 'Adam', 'adam_learning_rate': 0.000777453559966963}. Best is trial 154 with value: 0.7876920700073242.
Trial 417 finished with value: 0.5581536889076233 and parameters: {'n_layers': 1, 'weight_decay': 9.84519903579179e-09, 'n_units_l0': 37, 'optimizer': 'Adam', 'adam_learning_rate': 0.0030435432681883744}. Best is trial 154 with value: 0.7876920700073242.
Trial 418 finished with value: 0.5132308602333069 and parameters: {'n_layers': 2, 'weight_decay': 5.795893393464377e-09, 'n_units_l0': 71, 'n_units_l1': 39, 'optimizer': 'Adam', 'adam_learning_rate': 0.001375089654807213}. Best is trial 154 with value: 0.7876920700073242.
Trial 419 finished with value: 0.5132308602333069 and parameters: {'n_layers': 2, 'weight_decay': 3.325554671203349e-05, 'n_units_l0': 4, 'n_units_l1': 13, 'optimizer': 'Adam', 'adam_learning_rate': 0.0009202500154383215}. Best is trial 154 with value: 0.7876920700073242.
Trial 420 finished with value: 0.7415385246276855 and parameters: {'n_layers': 4, 'weight_decay': 1.4080834448674451e-08, 'n_units_l0': 65, 'n_units_l1': 16, 'n_units_l2': 5, 'n_units_l3': 9, 'optimizer': 'Adam', 'adam_learning_rate': 0.0007280377637753923}. Best is trial 154 with value: 0.7876920700073242.
Trial 421 finished with value: 0.5132308602333069 and parameters: {'n_layers': 2, 'weight_decay': 1.262056967251502e-08, 'n_units_l0': 80, 'n_units_l1': 13, 'optimizer': 'SGD', 'sgd_opt_learning_rate': 0.00028893007273328344, 'sgd_opt_momentum': 0.003594573767324576}. Best is trial 154 with value: 0.7876920700073242.
Trial 422 finished with value: 0.7723075151443481 and parameters: {'n_layers': 2, 'weight_decay': 7.850772654533079e-08, 'n_units_l0': 44, 'n_units_l1': 14, 'optimizer': 'Adam', 'adam_learning_rate': 0.0015638011277446908}. Best is trial 154 with value: 0.7876920700073242.
Trial 423 finished with value: 0.5132308602333069 and parameters: {'n_layers': 2, 'weight_decay': 7.289189380064574e-09, 'n_units_l0': 52, 'n_units_l1': 15, 'optimizer': 'Adam', 'adam_learning_rate': 0.0010859856693419283}. Best is trial 154 with value: 0.7876920700073242.
Trial 424 finished with value: 0.7673843502998352 and parameters: {'n_layers': 3, 'weight_decay': 1.6625714834778923e-08, 'n_units_l0': 62, 'n_units_l1': 14, 'n_units_l2': 8, 'optimizer': 'Adam', 'adam_learning_rate': 0.0005672828063087853}. Best is trial 154 with value: 0.7876920700073242.
Trial 425 finished with value: 0.7846152186393738 and parameters: {'n_layers': 2, 'weight_decay': 1.058996155037446e-08, 'n_units_l0': 71, 'n_units_l1': 24, 'optimizer': 'Adam', 'adam_learning_rate': 0.0008214805865781528}. Best is trial 154 with value: 0.7876920700073242.
Trial 426 finished with value: 0.7827690243721008 and parameters: {'n_layers': 2, 'weight_decay': 9.137223089297811e-09, 'n_units_l0': 74, 'n_units_l1': 28, 'optimizer': 'Adam', 'adam_learning_rate': 0.0008974109699639459}. Best is trial 154 with value: 0.7876920700073242.
Trial 427 finished with value: 0.5132308602333069 and parameters: {'n_layers': 2, 'weight_decay': 6.665773793168473e-09, 'n_units_l0': 72, 'n_units_l1': 32, 'optimizer': 'Adam', 'adam_learning_rate': 0.00384394044117097}. Best is trial 154 with value: 0.7876920700073242.
Trial 428 finished with value: 0.5132308602333069 and parameters: {'n_layers': 7, 'weight_decay': 4.5277075641462405e-09, 'n_units_l0': 67, 'n_units_l1': 21, 'n_units_l2': 45, 'n_units_l3': 127, 'n_units_l4': 16, 'n_units_l5': 10, 'n_units_l6': 36, 'optimizer': 'Adam', 'adam_learning_rate': 0.0012090584908986254}. Best is trial 154 with value: 0.7876920700073242.
Trial 429 finished with value: 0.5230769515037537 and parameters: {'n_layers': 1, 'weight_decay': 1.1465821305272917e-08, 'n_units_l0': 69, 'optimizer': 'Adam', 'adam_learning_rate': 0.002512587068991277}. Best is trial 154 with value: 0.7876920700073242.
Trial 430 finished with value: 0.5132308602333069 and parameters: {'n_layers': 2, 'weight_decay': 8.825465627773422e-09, 'n_units_l0': 62, 'n_units_l1': 28, 'optimizer': 'RMSprop', 'rmsprop_learning_rate': 0.0007980198579805226, 'rmsprop_weight_decay': 0.989605529544323, 'rmsprop_momentum': 0.0060400126114257}. Best is trial 154 with value: 0.7876920700073242.
Trial 431 finished with value: 0.740307629108429 and parameters: {'n_layers': 2, 'weight_decay': 5.175206708020878e-10, 'n_units_l0': 77, 'n_units_l1': 22, 'optimizer': 'Adam', 'adam_learning_rate': 0.0021292005994446184}. Best is trial 154 with value: 0.7876920700073242.
Trial 432 finished with value: 0.5132308602333069 and parameters: {'n_layers': 6, 'weight_decay': 1.6076135138803055e-08, 'n_units_l0': 83, 'n_units_l1': 26, 'n_units_l2': 102, 'n_units_l3': 24, 'n_units_l4': 8, 'n_units_l5': 18, 'optimizer': 'Adam', 'adam_learning_rate': 0.0009935958802003272}. Best is trial 154 with value: 0.7876920700073242.
Trial 433 finished with value: 0.7483075857162476 and parameters: {'n_layers': 3, 'weight_decay': 5.527942083286501e-09, 'n_units_l0': 66, 'n_units_l1': 23, 'n_units_l2': 11, 'optimizer': 'Adam', 'adam_learning_rate': 0.0007674808727045178}. Best is trial 154 with value: 0.7876920700073242.
Trial 434 finished with value: 0.7710767388343811 and parameters: {'n_layers': 2, 'weight_decay': 1.1483840409860277e-08, 'n_units_l0': 58, 'n_units_l1': 30, 'optimizer': 'Adam', 'adam_learning_rate': 0.001646307930294433}. Best is trial 154 with value: 0.7876920700073242.
Trial 435 finished with value: 0.7809228897094727 and parameters: {'n_layers': 2, 'weight_decay': 1.999225883227337e-08, 'n_units_l0': 71, 'n_units_l1': 24, 'optimizer': 'Adam', 'adam_learning_rate': 0.0006348285589357944}. Best is trial 154 with value: 0.7876920700073242.
Trial 436 finished with value: 0.5169230699539185 and parameters: {'n_layers': 2, 'weight_decay': 7.830454369772493e-09, 'n_units_l0': 12, 'n_units_l1': 19, 'optimizer': 'Adam', 'adam_learning_rate': 0.0005187870870547131}. Best is trial 154 with value: 0.7876920700073242.
Trial 437 finished with value: 0.7852305173873901 and parameters: {'n_layers': 2, 'weight_decay': 1.4343731228960533e-08, 'n_units_l0': 62, 'n_units_l1': 18, 'optimizer': 'Adam', 'adam_learning_rate': 0.0012646822161669897}. Best is trial 154 with value: 0.7876920700073242.
Trial 438 finished with value: 0.645538330078125 and parameters: {'n_layers': 1, 'weight_decay': 1.2940704954860982e-08, 'n_units_l0': 59, 'optimizer': 'Adam', 'adam_learning_rate': 0.0014001619627502808}. Best is trial 154 with value: 0.7876920700073242.
Trial 439 finished with value: 0.772922933101654 and parameters: {'n_layers': 2, 'weight_decay': 7.976988700721937e-09, 'n_units_l0': 54, 'n_units_l1': 18, 'optimizer': 'Adam', 'adam_learning_rate': 0.001300636580244255}. Best is trial 154 with value: 0.7876920700073242.
Trial 440 finished with value: 0.5132308602333069 and parameters: {'n_layers': 5, 'weight_decay': 1.0554624867818684e-08, 'n_units_l0': 61, 'n_units_l1': 25, 'n_units_l2': 50, 'n_units_l3': 14, 'n_units_l4': 9, 'optimizer': 'Adam', 'adam_learning_rate': 0.0018022158619982874}. Best is trial 154 with value: 0.7876920700073242.
Trial 441 finished with value: 0.7360000014305115 and parameters: {'n_layers': 3, 'weight_decay': 5.352675200242808e-09, 'n_units_l0': 56, 'n_units_l1': 19, 'n_units_l2': 78, 'optimizer': 'Adam', 'adam_learning_rate': 0.0015675264716048804}. Best is trial 154 with value: 0.7876920700073242.
Trial 442 finished with value: 0.7778459787368774 and parameters: {'n_layers': 2, 'weight_decay': 1.5599511406042876e-08, 'n_units_l0': 65, 'n_units_l1': 17, 'optimizer': 'Adam', 'adam_learning_rate': 0.0011777890362147918}. Best is trial 154 with value: 0.7876920700073242.
Trial 443 finished with value: 0.7846152186393738 and parameters: {'n_layers': 2, 'weight_decay': 1.0114121337095642e-08, 'n_units_l0': 59, 'n_units_l1': 16, 'optimizer': 'Adam', 'adam_learning_rate': 0.0010386723597020741}. Best is trial 154 with value: 0.7876920700073242.
