A new study created in memory with name: no-name-095684a5-9a29-47c8-beba-1823a599cff4
Trial 0 finished with value: 0.5132308602333069 and parameters: {'n_layers': 9, 'weight_decay': 2.2888978726596605e-08, 'n_units_l0': 4, 'n_units_l1': 18, 'n_units_l2': 51, 'n_units_l3': 4, 'n_units_l4': 5, 'n_units_l5': 23, 'n_units_l6': 37, 'n_units_l7': 17, 'n_units_l8': 7, 'optimizer': 'RMSprop', 'rmsprop_learning_rate': 1.0225157158223904e-05, 'rmsprop_weight_decay': 0.8996761294880538, 'rmsprop_momentum': 3.663287648567755e-05}. Best is trial 0 with value: 0.5132308602333069.
Trial 1 finished with value: 0.5132308602333069 and parameters: {'n_layers': 5, 'weight_decay': 3.6571510517580875e-09, 'n_units_l0': 115, 'n_units_l1': 14, 'n_units_l2': 6, 'n_units_l3': 17, 'n_units_l4': 34, 'optimizer': 'RMSprop', 'rmsprop_learning_rate': 0.0015400908077005452, 'rmsprop_weight_decay': 0.9860562826201215, 'rmsprop_momentum': 0.00012585582630672768}. Best is trial 0 with value: 0.5132308602333069.
Trial 2 finished with value: 0.5132308602333069 and parameters: {'n_layers': 2, 'weight_decay': 1.6008370656734318e-07, 'n_units_l0': 7, 'n_units_l1': 62, 'optimizer': 'Adam', 'adam_learning_rate': 0.005128281708846267}. Best is trial 0 with value: 0.5132308602333069.
Trial 3 finished with value: 0.5132308602333069 and parameters: {'n_layers': 10, 'weight_decay': 2.838010549970277e-10, 'n_units_l0': 92, 'n_units_l1': 4, 'n_units_l2': 16, 'n_units_l3': 5, 'n_units_l4': 16, 'n_units_l5': 20, 'n_units_l6': 34, 'n_units_l7': 9, 'n_units_l8': 13, 'n_units_l9': 34, 'optimizer': 'RMSprop', 'rmsprop_learning_rate': 4.794338103546576e-05, 'rmsprop_weight_decay': 0.9169291365044042, 'rmsprop_momentum': 7.884589543915038e-05}. Best is trial 0 with value: 0.5132308602333069.
Trial 4 finished with value: 0.5132308602333069 and parameters: {'n_layers': 2, 'weight_decay': 5.472449446152057e-08, 'n_units_l0': 98, 'n_units_l1': 35, 'optimizer': 'RMSprop', 'rmsprop_learning_rate': 0.0007468886724525522, 'rmsprop_weight_decay': 0.9012017049025094, 'rmsprop_momentum': 0.06260240396839589}. Best is trial 0 with value: 0.5132308602333069.
Trial 5 finished with value: 0.5132308602333069 and parameters: {'n_layers': 4, 'weight_decay': 5.064470585873124e-06, 'n_units_l0': 8, 'n_units_l1': 125, 'n_units_l2': 8, 'n_units_l3': 7, 'optimizer': 'RMSprop', 'rmsprop_learning_rate': 8.227650421270446e-05, 'rmsprop_weight_decay': 0.8941261734978435, 'rmsprop_momentum': 5.179555167667711e-05}. Best is trial 0 with value: 0.5132308602333069.
Trial 6 finished with value: 0.5132308602333069 and parameters: {'n_layers': 10, 'weight_decay': 3.511378559691797e-05, 'n_units_l0': 21, 'n_units_l1': 48, 'n_units_l2': 5, 'n_units_l3': 53, 'n_units_l4': 43, 'n_units_l5': 11, 'n_units_l6': 4, 'n_units_l7': 105, 'n_units_l8': 114, 'n_units_l9': 12, 'optimizer': 'SGD', 'sgd_opt_learning_rate': 0.0009225877219827317, 'sgd_opt_momentum': 0.011088487373812184}. Best is trial 0 with value: 0.5132308602333069.
Trial 7 finished with value: 0.5132308602333069 and parameters: {'n_layers': 9, 'weight_decay': 5.442231630420619e-09, 'n_units_l0': 5, 'n_units_l1': 6, 'n_units_l2': 22, 'n_units_l3': 6, 'n_units_l4': 45, 'n_units_l5': 57, 'n_units_l6': 4, 'n_units_l7': 34, 'n_units_l8': 5, 'optimizer': 'Adam', 'adam_learning_rate': 0.0010159833912849981}. Best is trial 0 with value: 0.5132308602333069.
Trial 8 finished with value: 0.5132308602333069 and parameters: {'n_layers': 2, 'weight_decay': 2.3912682083019964e-08, 'n_units_l0': 23, 'n_units_l1': 7, 'optimizer': 'SGD', 'sgd_opt_learning_rate': 0.0948150406577701, 'sgd_opt_momentum': 0.002179637154187471}. Best is trial 0 with value: 0.5132308602333069.
Trial 9 finished with value: 0.5132308602333069 and parameters: {'n_layers': 3, 'weight_decay': 7.311428844248267e-08, 'n_units_l0': 35, 'n_units_l1': 20, 'n_units_l2': 50, 'optimizer': 'RMSprop', 'rmsprop_learning_rate': 0.00023092602931692942, 'rmsprop_weight_decay': 0.9800647795814499, 'rmsprop_momentum': 0.00012199563339302623}. Best is trial 0 with value: 0.5132308602333069.
Trial 10 finished with value: 0.5132308602333069 and parameters: {'n_layers': 7, 'weight_decay': 0.0005648254051559677, 'n_units_l0': 4, 'n_units_l1': 11, 'n_units_l2': 127, 'n_units_l3': 104, 'n_units_l4': 7, 'n_units_l5': 4, 'n_units_l6': 115, 'optimizer': 'Adam', 'adam_learning_rate': 1.1453894535905853e-05}. Best is trial 0 with value: 0.5132308602333069.
Trial 11 finished with value: 0.5132308602333069 and parameters: {'n_layers': 6, 'weight_decay': 6.811081624802167e-10, 'n_units_l0': 49, 'n_units_l1': 16, 'n_units_l2': 48, 'n_units_l3': 19, 'n_units_l4': 5, 'n_units_l5': 89, 'optimizer': 'RMSprop', 'rmsprop_learning_rate': 0.058967991170037544, 'rmsprop_weight_decay': 0.9808954678020029, 'rmsprop_momentum': 1.2775452827052741e-05}. Best is trial 0 with value: 0.5132308602333069.
Trial 12 finished with value: 0.5132308602333069 and parameters: {'n_layers': 7, 'weight_decay': 1.9914028601791718e-09, 'n_units_l0': 13, 'n_units_l1': 12, 'n_units_l2': 4, 'n_units_l3': 17, 'n_units_l4': 122, 'n_units_l5': 33, 'n_units_l6': 26, 'optimizer': 'RMSprop', 'rmsprop_learning_rate': 0.010687071265072217, 'rmsprop_weight_decay': 0.8508404497491979, 'rmsprop_momentum': 0.0017489117566105534}. Best is trial 0 with value: 0.5132308602333069.
Trial 13 finished with value: 0.5132308602333069 and parameters: {'n_layers': 5, 'weight_decay': 6.173635171362073e-07, 'n_units_l0': 57, 'n_units_l1': 28, 'n_units_l2': 43, 'n_units_l3': 13, 'n_units_l4': 17, 'optimizer': 'RMSprop', 'rmsprop_learning_rate': 0.0041441686091209014, 'rmsprop_weight_decay': 0.9480587345534753, 'rmsprop_momentum': 0.0007576004629885949}. Best is trial 0 with value: 0.5132308602333069.
Trial 14 finished with value: 0.5132308602333069 and parameters: {'n_layers': 8, 'weight_decay': 1.1278418781036826e-10, 'n_units_l0': 13, 'n_units_l1': 10, 'n_units_l2': 12, 'n_units_l3': 36, 'n_units_l4': 41, 'n_units_l5': 10, 'n_units_l6': 86, 'n_units_l7': 4, 'optimizer': 'RMSprop', 'rmsprop_learning_rate': 1.0899111846952805e-05, 'rmsprop_weight_decay': 0.8781011873112461, 'rmsprop_momentum': 0.0008985902076886978}. Best is trial 0 with value: 0.5132308602333069.
Trial 15 finished with value: 0.5132308602333069 and parameters: {'n_layers': 5, 'weight_decay': 3.879725122836969e-09, 'n_units_l0': 128, 'n_units_l1': 22, 'n_units_l2': 116, 'n_units_l3': 10, 'n_units_l4': 9, 'optimizer': 'SGD', 'sgd_opt_learning_rate': 1.0876606059184455e-05, 'sgd_opt_momentum': 2.1805858598924562e-05}. Best is trial 0 with value: 0.5132308602333069.
Trial 16 finished with value: 0.5132308602333069 and parameters: {'n_layers': 8, 'weight_decay': 6.719057473367993e-07, 'n_units_l0': 14, 'n_units_l1': 7, 'n_units_l2': 28, 'n_units_l3': 4, 'n_units_l4': 27, 'n_units_l5': 125, 'n_units_l6': 13, 'n_units_l7': 24, 'optimizer': 'RMSprop', 'rmsprop_learning_rate': 0.0016154204870820403, 'rmsprop_weight_decay': 0.9454301548240952, 'rmsprop_momentum': 2.3716877935219757e-05}. Best is trial 0 with value: 0.5132308602333069.
Trial 17 finished with value: 0.5132308602333069 and parameters: {'n_layers': 4, 'weight_decay': 1.0975280859159444e-08, 'n_units_l0': 32, 'n_units_l1': 82, 'n_units_l2': 9, 'n_units_l3': 33, 'optimizer': 'RMSprop', 'rmsprop_learning_rate': 1.0377208980693911e-05, 'rmsprop_weight_decay': 0.9431989857094131, 'rmsprop_momentum': 0.00026911012691743937}. Best is trial 0 with value: 0.5132308602333069.
Trial 18 finished with value: 0.5132308602333069 and parameters: {'n_layers': 6, 'weight_decay': 2.9886869897901873e-06, 'n_units_l0': 60, 'n_units_l1': 39, 'n_units_l2': 75, 'n_units_l3': 10, 'n_units_l4': 4, 'n_units_l5': 27, 'optimizer': 'SGD', 'sgd_opt_learning_rate': 0.09800885590175026, 'sgd_opt_momentum': 0.0878928653104135}. Best is trial 0 with value: 0.5132308602333069.
Trial 19 finished with value: 0.5132308602333069 and parameters: {'n_layers': 1, 'weight_decay': 1.0970554109689618e-09, 'n_units_l0': 7, 'optimizer': 'Adam', 'adam_learning_rate': 1.0779016221938055e-05}. Best is trial 0 with value: 0.5132308602333069.
Trial 20 finished with value: 0.5132308602333069 and parameters: {'n_layers': 8, 'weight_decay': 2.0931559213495713e-08, 'n_units_l0': 10, 'n_units_l1': 16, 'n_units_l2': 31, 'n_units_l3': 116, 'n_units_l4': 106, 'n_units_l5': 4, 'n_units_l6': 11, 'n_units_l7': 11, 'optimizer': 'RMSprop', 'rmsprop_learning_rate': 0.0004063532577348535, 'rmsprop_weight_decay': 0.8724962804739117, 'rmsprop_momentum': 0.004411256151534371}. Best is trial 0 with value: 0.5132308602333069.
Trial 21 finished with value: 0.5132308602333069 and parameters: {'n_layers': 1, 'weight_decay': 1.8103623104137764e-07, 'n_units_l0': 5, 'optimizer': 'Adam', 'adam_learning_rate': 0.079374625329232}. Best is trial 0 with value: 0.5132308602333069.
Trial 22 finished with value: 0.5132308602333069 and parameters: {'n_layers': 3, 'weight_decay': 1.9445581646048051e-07, 'n_units_l0': 4, 'n_units_l1': 56, 'n_units_l2': 7, 'optimizer': 'Adam', 'adam_learning_rate': 0.006332096404604493}. Best is trial 0 with value: 0.5132308602333069.
Trial 23 finished with value: 0.5132308602333069 and parameters: {'n_layers': 3, 'weight_decay': 1.9661868738177434e-06, 'n_units_l0': 6, 'n_units_l1': 74, 'n_units_l2': 72, 'optimizer': 'Adam', 'adam_learning_rate': 0.008859815671861029}. Best is trial 0 with value: 0.5132308602333069.
Trial 24 finished with value: 0.7698459625244141 and parameters: {'n_layers': 4, 'weight_decay': 5.428532923775391e-08, 'n_units_l0': 18, 'n_units_l1': 28, 'n_units_l2': 15, 'n_units_l3': 27, 'optimizer': 'Adam', 'adam_learning_rate': 0.00023348586948357278}. Best is trial 24 with value: 0.7698459625244141.
Trial 25 finished with value: 0.5606151819229126 and parameters: {'n_layers': 4, 'weight_decay': 1.0090636043345305e-08, 'n_units_l0': 28, 'n_units_l1': 26, 'n_units_l2': 15, 'n_units_l3': 32, 'optimizer': 'Adam', 'adam_learning_rate': 0.00013638162485006498}. Best is trial 24 with value: 0.7698459625244141.
Trial 26 finished with value: 0.7341537475585938 and parameters: {'n_layers': 4, 'weight_decay': 3.396353922163473e-08, 'n_units_l0': 22, 'n_units_l1': 27, 'n_units_l2': 18, 'n_units_l3': 29, 'optimizer': 'Adam', 'adam_learning_rate': 0.00012440004027882437}. Best is trial 24 with value: 0.7698459625244141.
Trial 27 finished with value: 0.5132308602333069 and parameters: {'n_layers': 4, 'weight_decay': 1.4966108791730877e-05, 'n_units_l0': 22, 'n_units_l1': 25, 'n_units_l2': 14, 'n_units_l3': 34, 'optimizer': 'Adam', 'adam_learning_rate': 0.00011960417830632401}. Best is trial 24 with value: 0.7698459625244141.
Trial 28 finished with value: 0.7667689919471741 and parameters: {'n_layers': 4, 'weight_decay': 5.7136349158655364e-08, 'n_units_l0': 17, 'n_units_l1': 32, 'n_units_l2': 19, 'n_units_l3': 57, 'optimizer': 'Adam', 'adam_learning_rate': 0.00014112914422276915}. Best is trial 24 with value: 0.7698459625244141.
Trial 29 finished with value: 0.5132308602333069 and parameters: {'n_layers': 3, 'weight_decay': 6.392965140409461e-08, 'n_units_l0': 17, 'n_units_l1': 35, 'n_units_l2': 21, 'optimizer': 'Adam', 'adam_learning_rate': 0.0001260104594024428}. Best is trial 24 with value: 0.7698459625244141.
Trial 30 finished with value: 0.5132308602333069 and parameters: {'n_layers': 6, 'weight_decay': 6.028596987123261e-07, 'n_units_l0': 41, 'n_units_l1': 46, 'n_units_l2': 10, 'n_units_l3': 64, 'n_units_l4': 77, 'n_units_l5': 8, 'optimizer': 'Adam', 'adam_learning_rate': 0.00033837221589655886}. Best is trial 24 with value: 0.7698459625244141.
Trial 31 finished with value: 0.5132308602333069 and parameters: {'n_layers': 4, 'weight_decay': 1.7477452287637162e-08, 'n_units_l0': 27, 'n_units_l1': 35, 'n_units_l2': 18, 'n_units_l3': 26, 'optimizer': 'Adam', 'adam_learning_rate': 6.829536558187374e-05}. Best is trial 24 with value: 0.7698459625244141.
Trial 32 finished with value: 0.7353846430778503 and parameters: {'n_layers': 5, 'weight_decay': 8.55234527739378e-09, 'n_units_l0': 17, 'n_units_l1': 28, 'n_units_l2': 12, 'n_units_l3': 51, 'n_units_l4': 12, 'optimizer': 'Adam', 'adam_learning_rate': 0.00040340259882535646}. Best is trial 24 with value: 0.7698459625244141.
Trial 33 finished with value: 0.7870767116546631 and parameters: {'n_layers': 5, 'weight_decay': 3.778302713560824e-08, 'n_units_l0': 17, 'n_units_l1': 29, 'n_units_l2': 11, 'n_units_l3': 55, 'n_units_l4': 11, 'optimizer': 'Adam', 'adam_learning_rate': 0.0007139810272104482}. Best is trial 33 with value: 0.7870767116546631.
Trial 34 finished with value: 0.5132308602333069 and parameters: {'n_layers': 5, 'weight_decay': 6.719852893131296e-09, 'n_units_l0': 10, 'n_units_l1': 19, 'n_units_l2': 11, 'n_units_l3': 57, 'n_units_l4': 12, 'optimizer': 'Adam', 'adam_learning_rate': 0.0007581342969728328}. Best is trial 33 with value: 0.7870767116546631.
Trial 35 finished with value: 0.5132308602333069 and parameters: {'n_layers': 5, 'weight_decay': 1.1099716137274926e-07, 'n_units_l0': 17, 'n_units_l1': 30, 'n_units_l2': 29, 'n_units_l3': 81, 'n_units_l4': 10, 'optimizer': 'Adam', 'adam_learning_rate': 0.0007819134127205492}. Best is trial 33 with value: 0.7870767116546631.
Trial 36 finished with value: 0.76430743932724 and parameters: {'n_layers': 6, 'weight_decay': 1.845630636514308e-09, 'n_units_l0': 17, 'n_units_l1': 45, 'n_units_l2': 12, 'n_units_l3': 44, 'n_units_l4': 22, 'n_units_l5': 48, 'optimizer': 'Adam', 'adam_learning_rate': 0.0003127865968141893}. Best is trial 33 with value: 0.7870767116546631.
Trial 37 finished with value: 0.5132308602333069 and parameters: {'n_layers': 7, 'weight_decay': 4.559685485171214e-10, 'n_units_l0': 11, 'n_units_l1': 44, 'n_units_l2': 6, 'n_units_l3': 42, 'n_units_l4': 21, 'n_units_l5': 48, 'n_units_l6': 9, 'optimizer': 'Adam', 'adam_learning_rate': 0.0021194114034449383}. Best is trial 33 with value: 0.7870767116546631.
Trial 38 finished with value: 0.5132308602333069 and parameters: {'n_layers': 6, 'weight_decay': 1.733002249263483e-09, 'n_units_l0': 18, 'n_units_l1': 67, 'n_units_l2': 23, 'n_units_l3': 78, 'n_units_l4': 62, 'n_units_l5': 57, 'optimizer': 'Adam', 'adam_learning_rate': 3.452229219329732e-05}. Best is trial 33 with value: 0.7870767116546631.
Trial 39 finished with value: 0.5138461589813232 and parameters: {'n_layers': 2, 'weight_decay': 4.217490393284403e-08, 'n_units_l0': 9, 'n_units_l1': 93, 'optimizer': 'Adam', 'adam_learning_rate': 0.0003242786003065192}. Best is trial 33 with value: 0.7870767116546631.
Trial 40 finished with value: 0.5132308602333069 and parameters: {'n_layers': 3, 'weight_decay': 4.0335886636824233e-07, 'n_units_l0': 14, 'n_units_l1': 60, 'n_units_l2': 8, 'optimizer': 'SGD', 'sgd_opt_learning_rate': 1.4876309104821899e-05, 'sgd_opt_momentum': 2.6748605609098946e-05}. Best is trial 33 with value: 0.7870767116546631.
Trial 41 finished with value: 0.7409230470657349 and parameters: {'n_layers': 5, 'weight_decay': 2.7938151678100294e-09, 'n_units_l0': 18, 'n_units_l1': 31, 'n_units_l2': 13, 'n_units_l3': 52, 'n_units_l4': 14, 'optimizer': 'Adam', 'adam_learning_rate': 0.0003175271389885941}. Best is trial 33 with value: 0.7870767116546631.
Trial 42 finished with value: 0.7661536931991577 and parameters: {'n_layers': 6, 'weight_decay': 1.7955602189406467e-10, 'n_units_l0': 26, 'n_units_l1': 51, 'n_units_l2': 14, 'n_units_l3': 45, 'n_units_l4': 26, 'n_units_l5': 14, 'optimizer': 'Adam', 'adam_learning_rate': 0.0003274224966629657}. Best is trial 33 with value: 0.7870767116546631.
Trial 43 finished with value: 0.5132308602333069 and parameters: {'n_layers': 7, 'weight_decay': 1.3250044496796583e-10, 'n_units_l0': 25, 'n_units_l1': 51, 'n_units_l2': 17, 'n_units_l3': 42, 'n_units_l4': 24, 'n_units_l5': 15, 'n_units_l6': 72, 'optimizer': 'Adam', 'adam_learning_rate': 0.0016345565930067664}. Best is trial 33 with value: 0.7870767116546631.
Trial 44 finished with value: 0.7366153597831726 and parameters: {'n_layers': 6, 'weight_decay': 3.247102733519879e-10, 'n_units_l0': 33, 'n_units_l1': 38, 'n_units_l2': 10, 'n_units_l3': 73, 'n_units_l4': 29, 'n_units_l5': 38, 'optimizer': 'Adam', 'adam_learning_rate': 0.00024147998884251252}. Best is trial 33 with value: 0.7870767116546631.
Trial 45 finished with value: 0.5132308602333069 and parameters: {'n_layers': 6, 'weight_decay': 2.1547534526315349e-10, 'n_units_l0': 12, 'n_units_l1': 98, 'n_units_l2': 23, 'n_units_l3': 23, 'n_units_l4': 20, 'n_units_l5': 16, 'optimizer': 'Adam', 'adam_learning_rate': 3.9841427021421546e-05}. Best is trial 33 with value: 0.7870767116546631.
Trial 46 finished with value: 0.7532305717468262 and parameters: {'n_layers': 7, 'weight_decay': 1.0495621040530066e-09, 'n_units_l0': 15, 'n_units_l1': 22, 'n_units_l2': 15, 'n_units_l3': 43, 'n_units_l4': 8, 'n_units_l5': 6, 'n_units_l6': 7, 'optimizer': 'Adam', 'adam_learning_rate': 0.0005809568004953914}. Best is trial 33 with value: 0.7870767116546631.
Trial 47 finished with value: 0.7612305879592896 and parameters: {'n_layers': 5, 'weight_decay': 0.0005478818167287006, 'n_units_l0': 41, 'n_units_l1': 42, 'n_units_l2': 8, 'n_units_l3': 65, 'n_units_l4': 56, 'optimizer': 'Adam', 'adam_learning_rate': 0.0001990869792313048}. Best is trial 33 with value: 0.7870767116546631.
Trial 48 finished with value: 0.5132308602333069 and parameters: {'n_layers': 4, 'weight_decay': 8.656102606274675e-08, 'n_units_l0': 21, 'n_units_l1': 55, 'n_units_l2': 20, 'n_units_l3': 22, 'optimizer': 'SGD', 'sgd_opt_learning_rate': 0.0011780213948486965, 'sgd_opt_momentum': 0.0002690628195982367}. Best is trial 33 with value: 0.7870767116546631.
Trial 49 finished with value: 0.5132308602333069 and parameters: {'n_layers': 6, 'weight_decay': 7.688248871252092e-10, 'n_units_l0': 20, 'n_units_l1': 33, 'n_units_l2': 34, 'n_units_l3': 93, 'n_units_l4': 31, 'n_units_l5': 74, 'optimizer': 'Adam', 'adam_learning_rate': 0.0012306315812998223}. Best is trial 33 with value: 0.7870767116546631.
Trial 50 finished with value: 0.5132308602333069 and parameters: {'n_layers': 9, 'weight_decay': 1.1409433788951025e-06, 'n_units_l0': 29, 'n_units_l1': 23, 'n_units_l2': 5, 'n_units_l3': 48, 'n_units_l4': 18, 'n_units_l5': 15, 'n_units_l6': 58, 'n_units_l7': 126, 'n_units_l8': 54, 'optimizer': 'Adam', 'adam_learning_rate': 0.002511135743876188}. Best is trial 33 with value: 0.7870767116546631.
Trial 51 finished with value: 0.743384599685669 and parameters: {'n_layers': 5, 'weight_decay': 4.22419290989977e-09, 'n_units_l0': 89, 'n_units_l1': 40, 'n_units_l2': 8, 'n_units_l3': 73, 'n_units_l4': 61, 'optimizer': 'Adam', 'adam_learning_rate': 0.00020065919463426224}. Best is trial 33 with value: 0.7870767116546631.
Trial 52 finished with value: 0.5132308602333069 and parameters: {'n_layers': 5, 'weight_decay': 9.154500392552587e-05, 'n_units_l0': 42, 'n_units_l1': 45, 'n_units_l2': 11, 'n_units_l3': 61, 'n_units_l4': 6, 'optimizer': 'Adam', 'adam_learning_rate': 7.535756863274402e-05}. Best is trial 33 with value: 0.7870767116546631.
Trial 53 finished with value: 0.7396922707557678 and parameters: {'n_layers': 4, 'weight_decay': 0.00018240509147279772, 'n_units_l0': 38, 'n_units_l1': 41, 'n_units_l2': 9, 'n_units_l3': 39, 'optimizer': 'Adam', 'adam_learning_rate': 0.0005591627505288118}. Best is trial 33 with value: 0.7870767116546631.
Trial 54 finished with value: 0.7409230470657349 and parameters: {'n_layers': 5, 'weight_decay': 2.0505642301352483e-05, 'n_units_l0': 52, 'n_units_l1': 66, 'n_units_l2': 7, 'n_units_l3': 63, 'n_units_l4': 36, 'optimizer': 'Adam', 'adam_learning_rate': 0.00019913812537510108}. Best is trial 33 with value: 0.7870767116546631.
Trial 55 finished with value: 0.5132308602333069 and parameters: {'n_layers': 6, 'weight_decay': 3.165037915459525e-07, 'n_units_l0': 26, 'n_units_l1': 4, 'n_units_l2': 13, 'n_units_l3': 95, 'n_units_l4': 51, 'n_units_l5': 36, 'optimizer': 'SGD', 'sgd_opt_learning_rate': 0.002019637414932765, 'sgd_opt_momentum': 0.0003739598021520653}. Best is trial 33 with value: 0.7870767116546631.
Trial 56 finished with value: 0.5132308602333069 and parameters: {'n_layers': 4, 'weight_decay': 1.7188543416902916e-08, 'n_units_l0': 78, 'n_units_l1': 17, 'n_units_l2': 16, 'n_units_l3': 28, 'optimizer': 'Adam', 'adam_learning_rate': 4.627312102781217e-05}. Best is trial 33 with value: 0.7870767116546631.
Trial 57 finished with value: 0.5132308602333069 and parameters: {'n_layers': 7, 'weight_decay': 5.589841057591064e-06, 'n_units_l0': 31, 'n_units_l1': 51, 'n_units_l2': 5, 'n_units_l3': 45, 'n_units_l4': 15, 'n_units_l5': 6, 'n_units_l6': 17, 'optimizer': 'Adam', 'adam_learning_rate': 0.0004191926505530902}. Best is trial 33 with value: 0.7870767116546631.
Trial 58 finished with value: 0.5132308602333069 and parameters: {'n_layers': 3, 'weight_decay': 0.0006405676965666899, 'n_units_l0': 15, 'n_units_l1': 14, 'n_units_l2': 4, 'optimizer': 'Adam', 'adam_learning_rate': 0.00019270665631047733}. Best is trial 33 with value: 0.7870767116546631.
Trial 59 finished with value: 0.5132308602333069 and parameters: {'n_layers': 5, 'weight_decay': 1.3696012215508508e-07, 'n_units_l0': 25, 'n_units_l1': 32, 'n_units_l2': 9, 'n_units_l3': 127, 'n_units_l4': 89, 'optimizer': 'Adam', 'adam_learning_rate': 6.623482249538844e-05}. Best is trial 33 with value: 0.7870767116546631.
Trial 60 finished with value: 0.5132308602333069 and parameters: {'n_layers': 4, 'weight_decay': 3.545777886669634e-08, 'n_units_l0': 68, 'n_units_l1': 20, 'n_units_l2': 26, 'n_units_l3': 56, 'optimizer': 'Adam', 'adam_learning_rate': 2.0985723442054245e-05}. Best is trial 33 with value: 0.7870767116546631.
Trial 61 finished with value: 0.5132308602333069 and parameters: {'n_layers': 8, 'weight_decay': 1.7987202038389717e-09, 'n_units_l0': 15, 'n_units_l1': 24, 'n_units_l2': 15, 'n_units_l3': 40, 'n_units_l4': 10, 'n_units_l5': 6, 'n_units_l6': 7, 'n_units_l7': 52, 'optimizer': 'Adam', 'adam_learning_rate': 0.0005477171244024581}. Best is trial 33 with value: 0.7870767116546631.
