Trial 62 finished with value: 0.5132308602333069 and parameters: {'n_layers': 7, 'weight_decay': 1.0474863645778342e-09, 'n_units_l0': 12, 'n_units_l1': 21, 'n_units_l2': 14, 'n_units_l3': 36, 'n_units_l4': 7, 'n_units_l5': 6, 'n_units_l6': 6, 'optimizer': 'Adam', 'adam_learning_rate': 0.001011995983397146}. Best is trial 33 with value: 0.7870767116546631.
Trial 63 finished with value: 0.5132308602333069 and parameters: {'n_layers': 7, 'weight_decay': 1.8046024976577357e-10, 'n_units_l0': 20, 'n_units_l1': 36, 'n_units_l2': 19, 'n_units_l3': 65, 'n_units_l4': 8, 'n_units_l5': 9, 'n_units_l6': 19, 'optimizer': 'Adam', 'adam_learning_rate': 0.0005970791162895701}. Best is trial 33 with value: 0.7870767116546631.
Trial 64 finished with value: 0.5132308602333069 and parameters: {'n_layers': 6, 'weight_decay': 5.138796712799299e-10, 'n_units_l0': 15, 'n_units_l1': 28, 'n_units_l2': 11, 'n_units_l3': 47, 'n_units_l4': 24, 'n_units_l5': 12, 'optimizer': 'RMSprop', 'rmsprop_learning_rate': 0.07794812009030366, 'rmsprop_weight_decay': 0.9649550085517242, 'rmsprop_momentum': 0.043689216742617026}. Best is trial 33 with value: 0.7870767116546631.
Trial 65 finished with value: 0.5132308602333069 and parameters: {'n_layers': 7, 'weight_decay': 2.700026074925106e-10, 'n_units_l0': 19, 'n_units_l1': 14, 'n_units_l2': 13, 'n_units_l3': 14, 'n_units_l4': 5, 'n_units_l5': 20, 'n_units_l6': 5, 'optimizer': 'Adam', 'adam_learning_rate': 0.0033378307903316725}. Best is trial 33 with value: 0.7870767116546631.
Trial 66 finished with value: 0.5132308602333069 and parameters: {'n_layers': 5, 'weight_decay': 1.2560737900191507e-08, 'n_units_l0': 24, 'n_units_l1': 42, 'n_units_l2': 17, 'n_units_l3': 30, 'n_units_l4': 12, 'optimizer': 'Adam', 'adam_learning_rate': 0.040808782405081276}. Best is trial 33 with value: 0.7870767116546631.
Trial 67 finished with value: 0.5132308602333069 and parameters: {'n_layers': 8, 'weight_decay': 2.679190122771131e-09, 'n_units_l0': 16, 'n_units_l1': 24, 'n_units_l2': 7, 'n_units_l3': 25, 'n_units_l4': 49, 'n_units_l5': 25, 'n_units_l6': 8, 'n_units_l7': 4, 'optimizer': 'SGD', 'sgd_opt_learning_rate': 0.00015552568403930255, 'sgd_opt_momentum': 0.08454034665273501}. Best is trial 33 with value: 0.7870767116546631.
Trial 68 finished with value: 0.5132308602333069 and parameters: {'n_layers': 6, 'weight_decay': 1.0585803855214129e-10, 'n_units_l0': 13, 'n_units_l1': 48, 'n_units_l2': 10, 'n_units_l3': 52, 'n_units_l4': 14, 'n_units_l5': 7, 'optimizer': 'Adam', 'adam_learning_rate': 0.00012115571166256066}. Best is trial 33 with value: 0.7870767116546631.
Trial 69 finished with value: 0.5396922826766968 and parameters: {'n_layers': 2, 'weight_decay': 5.7070381561330785e-09, 'n_units_l0': 47, 'n_units_l1': 75, 'optimizer': 'Adam', 'adam_learning_rate': 0.00017910686768525497}. Best is trial 33 with value: 0.7870767116546631.
Trial 70 finished with value: 0.5132308602333069 and parameters: {'n_layers': 5, 'weight_decay': 6.195404095599873e-08, 'n_units_l0': 9, 'n_units_l1': 18, 'n_units_l2': 37, 'n_units_l3': 18, 'n_units_l4': 39, 'optimizer': 'RMSprop', 'rmsprop_learning_rate': 0.01849980800311739, 'rmsprop_weight_decay': 0.9306087023204658, 'rmsprop_momentum': 0.014146778426432605}. Best is trial 33 with value: 0.7870767116546631.
Trial 71 finished with value: 0.5132308602333069 and parameters: {'n_layers': 5, 'weight_decay': 4.272472290109135e-09, 'n_units_l0': 83, 'n_units_l1': 40, 'n_units_l2': 8, 'n_units_l3': 76, 'n_units_l4': 60, 'optimizer': 'Adam', 'adam_learning_rate': 0.0002657848548465944}. Best is trial 33 with value: 0.7870767116546631.
Trial 72 finished with value: 0.740307629108429 and parameters: {'n_layers': 4, 'weight_decay': 1.399778223150907e-09, 'n_units_l0': 107, 'n_units_l1': 30, 'n_units_l2': 12, 'n_units_l3': 66, 'optimizer': 'Adam', 'adam_learning_rate': 9.823986433222125e-05}. Best is trial 33 with value: 0.7870767116546631.
Trial 73 finished with value: 0.7587689757347107 and parameters: {'n_layers': 5, 'weight_decay': 2.6900023931279516e-08, 'n_units_l0': 23, 'n_units_l1': 5, 'n_units_l2': 6, 'n_units_l3': 88, 'n_units_l4': 59, 'optimizer': 'Adam', 'adam_learning_rate': 0.00016096696772029693}. Best is trial 33 with value: 0.7870767116546631.
Trial 74 finished with value: 0.5132308602333069 and parameters: {'n_layers': 6, 'weight_decay': 2.131442695407752e-07, 'n_units_l0': 23, 'n_units_l1': 8, 'n_units_l2': 6, 'n_units_l3': 85, 'n_units_l4': 73, 'n_units_l5': 19, 'optimizer': 'Adam', 'adam_learning_rate': 0.0004540356814985824}. Best is trial 33 with value: 0.7870767116546631.
Trial 75 finished with value: 0.7433844804763794 and parameters: {'n_layers': 4, 'weight_decay': 2.313496340308411e-08, 'n_units_l0': 36, 'n_units_l1': 12, 'n_units_l2': 15, 'n_units_l3': 111, 'optimizer': 'Adam', 'adam_learning_rate': 0.0007170132103495573}. Best is trial 33 with value: 0.7870767116546631.
Trial 76 finished with value: 0.5156922936439514 and parameters: {'n_layers': 3, 'weight_decay': 4.26378461979947e-08, 'n_units_l0': 29, 'n_units_l1': 26, 'n_units_l2': 22, 'optimizer': 'Adam', 'adam_learning_rate': 0.00015758788384068325}. Best is trial 33 with value: 0.7870767116546631.
Trial 77 finished with value: 0.7464615106582642 and parameters: {'n_layers': 6, 'weight_decay': 8.942599016411603e-08, 'n_units_l0': 19, 'n_units_l1': 36, 'n_units_l2': 9, 'n_units_l3': 37, 'n_units_l4': 34, 'n_units_l5': 5, 'optimizer': 'Adam', 'adam_learning_rate': 0.0003083141463758345}. Best is trial 33 with value: 0.7870767116546631.
Trial 78 finished with value: 0.5132308602333069 and parameters: {'n_layers': 5, 'weight_decay': 1.3937160998002214e-08, 'n_units_l0': 16, 'n_units_l1': 57, 'n_units_l2': 26, 'n_units_l3': 56, 'n_units_l4': 4, 'optimizer': 'Adam', 'adam_learning_rate': 0.0009765167181887782}. Best is trial 33 with value: 0.7870767116546631.
Trial 79 finished with value: 0.5132308602333069 and parameters: {'n_layers': 6, 'weight_decay': 8.229324262206525e-10, 'n_units_l0': 12, 'n_units_l1': 4, 'n_units_l2': 6, 'n_units_l3': 45, 'n_units_l4': 6, 'n_units_l5': 12, 'optimizer': 'Adam', 'adam_learning_rate': 8.296629693714983e-05}. Best is trial 33 with value: 0.7870767116546631.
Trial 80 finished with value: 0.5132308602333069 and parameters: {'n_layers': 10, 'weight_decay': 3.9526853156417593e-10, 'n_units_l0': 22, 'n_units_l1': 22, 'n_units_l2': 7, 'n_units_l3': 102, 'n_units_l4': 98, 'n_units_l5': 43, 'n_units_l6': 14, 'n_units_l7': 56, 'n_units_l8': 30, 'n_units_l9': 103, 'optimizer': 'Adam', 'adam_learning_rate': 0.00040403085160144316}. Best is trial 33 with value: 0.7870767116546631.
Trial 81 finished with value: 0.6713844537734985 and parameters: {'n_layers': 6, 'weight_decay': 9.023540338818642e-08, 'n_units_l0': 18, 'n_units_l1': 5, 'n_units_l2': 11, 'n_units_l3': 35, 'n_units_l4': 26, 'n_units_l5': 5, 'optimizer': 'Adam', 'adam_learning_rate': 0.0002539363026532858}. Best is trial 33 with value: 0.7870767116546631.
Trial 82 finished with value: 0.5132308602333069 and parameters: {'n_layers': 7, 'weight_decay': 2.3457880035355276e-08, 'n_units_l0': 19, 'n_units_l1': 34, 'n_units_l2': 9, 'n_units_l3': 40, 'n_units_l4': 33, 'n_units_l5': 5, 'n_units_l6': 45, 'optimizer': 'Adam', 'adam_learning_rate': 0.0003208016105632314}. Best is trial 33 with value: 0.7870767116546631.
Trial 83 finished with value: 0.7612305283546448 and parameters: {'n_layers': 6, 'weight_decay': 2.1878663106640235e-07, 'n_units_l0': 14, 'n_units_l1': 30, 'n_units_l2': 10, 'n_units_l3': 32, 'n_units_l4': 44, 'n_units_l5': 4, 'optimizer': 'Adam', 'adam_learning_rate': 0.00014060393035863737}. Best is trial 33 with value: 0.7870767116546631.
Trial 84 finished with value: 0.7606151700019836 and parameters: {'n_layers': 5, 'weight_decay': 2.3121955144746293e-07, 'n_units_l0': 14, 'n_units_l1': 29, 'n_units_l2': 14, 'n_units_l3': 48, 'n_units_l4': 48, 'optimizer': 'Adam', 'adam_learning_rate': 0.00014143422811379322}. Best is trial 33 with value: 0.7870767116546631.
Trial 85 finished with value: 0.5132308602333069 and parameters: {'n_layers': 5, 'weight_decay': 4.5593578613239957e-07, 'n_units_l0': 11, 'n_units_l1': 29, 'n_units_l2': 12, 'n_units_l3': 20, 'n_units_l4': 43, 'optimizer': 'Adam', 'adam_learning_rate': 0.0001359419053139473}. Best is trial 33 with value: 0.7870767116546631.
Trial 86 finished with value: 0.5132308602333069 and parameters: {'n_layers': 5, 'weight_decay': 1.2983124558123161e-06, 'n_units_l0': 13, 'n_units_l1': 51, 'n_units_l2': 10, 'n_units_l3': 32, 'n_units_l4': 53, 'optimizer': 'SGD', 'sgd_opt_learning_rate': 0.01316560304888731, 'sgd_opt_momentum': 0.005116082502403951}. Best is trial 33 with value: 0.7870767116546631.
Trial 87 finished with value: 0.5132308602333069 and parameters: {'n_layers': 4, 'weight_decay': 2.0856273519320102e-07, 'n_units_l0': 14, 'n_units_l1': 37, 'n_units_l2': 5, 'n_units_l3': 70, 'optimizer': 'Adam', 'adam_learning_rate': 0.00011197748845377268}. Best is trial 33 with value: 0.7870767116546631.
Trial 88 finished with value: 0.5132308602333069 and parameters: {'n_layers': 5, 'weight_decay': 7.284013988093123e-07, 'n_units_l0': 21, 'n_units_l1': 30, 'n_units_l2': 18, 'n_units_l3': 49, 'n_units_l4': 72, 'optimizer': 'RMSprop', 'rmsprop_learning_rate': 6.0270392128649854e-05, 'rmsprop_weight_decay': 0.8522655804701813, 'rmsprop_momentum': 0.011122310058868191}. Best is trial 33 with value: 0.7870767116546631.
Trial 89 finished with value: 0.5132308602333069 and parameters: {'n_layers': 6, 'weight_decay': 2.759398176531475e-07, 'n_units_l0': 11, 'n_units_l1': 43, 'n_units_l2': 13, 'n_units_l3': 58, 'n_units_l4': 47, 'n_units_l5': 29, 'optimizer': 'Adam', 'adam_learning_rate': 5.224420210035526e-05}. Best is trial 33 with value: 0.7870767116546631.
Trial 90 finished with value: 0.7686151266098022 and parameters: {'n_layers': 4, 'weight_decay': 1.427617425244275e-07, 'n_units_l0': 17, 'n_units_l1': 26, 'n_units_l2': 16, 'n_units_l3': 88, 'optimizer': 'Adam', 'adam_learning_rate': 0.00023712120695836627}. Best is trial 33 with value: 0.7870767116546631.
Trial 91 finished with value: 0.7587690353393555 and parameters: {'n_layers': 4, 'weight_decay': 1.3585640031871602e-07, 'n_units_l0': 17, 'n_units_l1': 26, 'n_units_l2': 16, 'n_units_l3': 89, 'optimizer': 'Adam', 'adam_learning_rate': 0.00015711148645394487}. Best is trial 33 with value: 0.7870767116546631.
Trial 92 finished with value: 0.7624613046646118 and parameters: {'n_layers': 4, 'weight_decay': 5.615827276920391e-08, 'n_units_l0': 17, 'n_units_l1': 27, 'n_units_l2': 16, 'n_units_l3': 70, 'optimizer': 'Adam', 'adam_learning_rate': 0.00022387603372978394}. Best is trial 33 with value: 0.7870767116546631.
Trial 93 finished with value: 0.77353835105896 and parameters: {'n_layers': 3, 'weight_decay': 5.711251555844172e-08, 'n_units_l0': 16, 'n_units_l1': 33, 'n_units_l2': 20, 'optimizer': 'Adam', 'adam_learning_rate': 0.00023812318004279095}. Best is trial 33 with value: 0.7870767116546631.
Trial 94 finished with value: 0.6387691497802734 and parameters: {'n_layers': 3, 'weight_decay': 4.2028101358044076e-08, 'n_units_l0': 16, 'n_units_l1': 32, 'n_units_l2': 21, 'optimizer': 'Adam', 'adam_learning_rate': 0.00023594713263030886}. Best is trial 33 with value: 0.7870767116546631.
Trial 95 finished with value: 0.7556923031806946 and parameters: {'n_layers': 3, 'weight_decay': 5.5177097566261615e-08, 'n_units_l0': 18, 'n_units_l1': 34, 'n_units_l2': 19, 'optimizer': 'Adam', 'adam_learning_rate': 0.00021694391457980361}. Best is trial 33 with value: 0.7870767116546631.
Trial 96 finished with value: 0.7735382318496704 and parameters: {'n_layers': 3, 'weight_decay': 1.3170897941649791e-07, 'n_units_l0': 13, 'n_units_l1': 27, 'n_units_l2': 14, 'optimizer': 'Adam', 'adam_learning_rate': 0.0003842475074930645}. Best is trial 33 with value: 0.7870767116546631.
Trial 97 finished with value: 0.7778459191322327 and parameters: {'n_layers': 3, 'weight_decay': 1.0937194637841288e-07, 'n_units_l0': 20, 'n_units_l1': 47, 'n_units_l2': 24, 'optimizer': 'Adam', 'adam_learning_rate': 0.00042668775403738557}. Best is trial 33 with value: 0.7870767116546631.
Trial 98 finished with value: 0.5489230155944824 and parameters: {'n_layers': 2, 'weight_decay': 1.263877772153005e-07, 'n_units_l0': 16, 'n_units_l1': 24, 'optimizer': 'Adam', 'adam_learning_rate': 0.00043853069084584366}. Best is trial 33 with value: 0.7870767116546631.
Trial 99 finished with value: 0.7624613642692566 and parameters: {'n_layers': 3, 'weight_decay': 7.14389393747109e-08, 'n_units_l0': 20, 'n_units_l1': 27, 'n_units_l2': 17, 'optimizer': 'Adam', 'adam_learning_rate': 0.0007504473697339477}. Best is trial 33 with value: 0.7870767116546631.
Trial 100 finished with value: 0.5132308602333069 and parameters: {'n_layers': 3, 'weight_decay': 1.1996118764499244e-07, 'n_units_l0': 20, 'n_units_l1': 63, 'n_units_l2': 25, 'optimizer': 'SGD', 'sgd_opt_learning_rate': 0.00010040690144112364, 'sgd_opt_momentum': 0.00023435680209225767}. Best is trial 33 with value: 0.7870767116546631.
Trial 101 finished with value: 0.5212308168411255 and parameters: {'n_layers': 2, 'weight_decay': 7.851506510443495e-08, 'n_units_l0': 27, 'n_units_l1': 27, 'optimizer': 'Adam', 'adam_learning_rate': 0.00034709499150769305}. Best is trial 33 with value: 0.7870767116546631.
Trial 102 finished with value: 0.778461217880249 and parameters: {'n_layers': 3, 'weight_decay': 3.150719176308426e-08, 'n_units_l0': 21, 'n_units_l1': 19, 'n_units_l2': 17, 'optimizer': 'Adam', 'adam_learning_rate': 0.0008558006822437692}. Best is trial 33 with value: 0.7870767116546631.
Trial 103 finished with value: 0.7501537203788757 and parameters: {'n_layers': 3, 'weight_decay': 3.8628014876843755e-07, 'n_units_l0': 24, 'n_units_l1': 20, 'n_units_l2': 24, 'optimizer': 'Adam', 'adam_learning_rate': 0.0013528815857602658}. Best is trial 33 with value: 0.7870767116546631.
Trial 104 finished with value: 0.7107691764831543 and parameters: {'n_layers': 2, 'weight_decay': 8.914838920284443e-09, 'n_units_l0': 21, 'n_units_l1': 16, 'optimizer': 'Adam', 'adam_learning_rate': 0.0008024987699494673}. Best is trial 33 with value: 0.7870767116546631.
Trial 105 finished with value: 0.7778459787368774 and parameters: {'n_layers': 3, 'weight_decay': 3.19665851735152e-08, 'n_units_l0': 19, 'n_units_l1': 19, 'n_units_l2': 17, 'optimizer': 'Adam', 'adam_learning_rate': 0.000618014078308615}. Best is trial 33 with value: 0.7870767116546631.
Trial 106 finished with value: 0.7766151428222656 and parameters: {'n_layers': 3, 'weight_decay': 3.1839052408687e-08, 'n_units_l0': 31, 'n_units_l1': 19, 'n_units_l2': 20, 'optimizer': 'Adam', 'adam_learning_rate': 0.0005177718343011727}. Best is trial 33 with value: 0.7870767116546631.
Trial 107 finished with value: 0.7630767226219177 and parameters: {'n_layers': 3, 'weight_decay': 3.555999004480283e-08, 'n_units_l0': 26, 'n_units_l1': 18, 'n_units_l2': 20, 'optimizer': 'Adam', 'adam_learning_rate': 0.0005117157399048164}. Best is trial 33 with value: 0.7870767116546631.
Trial 108 finished with value: 0.5132308602333069 and parameters: {'n_layers': 3, 'weight_decay': 1.7115450797541754e-08, 'n_units_l0': 23, 'n_units_l1': 15, 'n_units_l2': 30, 'optimizer': 'RMSprop', 'rmsprop_learning_rate': 0.022875687953148625, 'rmsprop_weight_decay': 0.9636868696412533, 'rmsprop_momentum': 0.00039094043927646546}. Best is trial 33 with value: 0.7870767116546631.
Trial 109 finished with value: 0.7766152620315552 and parameters: {'n_layers': 2, 'weight_decay': 3.038382593343298e-08, 'n_units_l0': 31, 'n_units_l1': 20, 'optimizer': 'Adam', 'adam_learning_rate': 0.0012942597526055088}. Best is trial 33 with value: 0.7870767116546631.
Trial 110 finished with value: 0.7876920104026794 and parameters: {'n_layers': 2, 'weight_decay': 4.678439197387562e-08, 'n_units_l0': 33, 'n_units_l1': 19, 'optimizer': 'Adam', 'adam_learning_rate': 0.0020095587776108284}. Best is trial 110 with value: 0.7876920104026794.
Trial 111 finished with value: 0.5384615659713745 and parameters: {'n_layers': 1, 'weight_decay': 2.7713571745262605e-08, 'n_units_l0': 36, 'optimizer': 'Adam', 'adam_learning_rate': 0.0016172486425182406}. Best is trial 110 with value: 0.7876920104026794.
Trial 112 finished with value: 0.7439999580383301 and parameters: {'n_layers': 2, 'weight_decay': 4.907266522598499e-08, 'n_units_l0': 32, 'n_units_l1': 19, 'optimizer': 'Adam', 'adam_learning_rate': 0.0028690082657401796}. Best is trial 110 with value: 0.7876920104026794.
Trial 113 finished with value: 0.7372305989265442 and parameters: {'n_layers': 2, 'weight_decay': 3.3179571146489765e-08, 'n_units_l0': 28, 'n_units_l1': 21, 'optimizer': 'Adam', 'adam_learning_rate': 0.0012920086118775973}. Best is trial 110 with value: 0.7876920104026794.
Trial 114 finished with value: 0.5206154584884644 and parameters: {'n_layers': 1, 'weight_decay': 1.5980432187996487e-07, 'n_units_l0': 19, 'optimizer': 'Adam', 'adam_learning_rate': 0.0021718431261696543}. Best is trial 110 with value: 0.7876920104026794.
Trial 115 finished with value: 0.7507690191268921 and parameters: {'n_layers': 3, 'weight_decay': 1.3863486198793055e-08, 'n_units_l0': 30, 'n_units_l1': 23, 'n_units_l2': 33, 'optimizer': 'Adam', 'adam_learning_rate': 0.000866620919425924}. Best is trial 110 with value: 0.7876920104026794.
Trial 116 finished with value: 0.7827688455581665 and parameters: {'n_layers': 2, 'weight_decay': 9.05603554813357e-08, 'n_units_l0': 34, 'n_units_l1': 17, 'optimizer': 'Adam', 'adam_learning_rate': 0.0006136335774561372}. Best is trial 110 with value: 0.7876920104026794.
Trial 117 finished with value: 0.7550768852233887 and parameters: {'n_layers': 2, 'weight_decay': 9.482327036824486e-08, 'n_units_l0': 34, 'n_units_l1': 17, 'optimizer': 'Adam', 'adam_learning_rate': 0.0017483056233866968}. Best is trial 110 with value: 0.7876920104026794.
Trial 118 finished with value: 0.780307412147522 and parameters: {'n_layers': 2, 'weight_decay': 1.8830408732883424e-08, 'n_units_l0': 49, 'n_units_l1': 13, 'optimizer': 'Adam', 'adam_learning_rate': 0.0006915464484352229}. Best is trial 110 with value: 0.7876920104026794.
Trial 119 finished with value: 0.7809227705001831 and parameters: {'n_layers': 2, 'weight_decay': 8.362948851037534e-09, 'n_units_l0': 48, 'n_units_l1': 13, 'optimizer': 'Adam', 'adam_learning_rate': 0.0010846539332917322}. Best is trial 110 with value: 0.7876920104026794.
Trial 120 finished with value: 0.5132308602333069 and parameters: {'n_layers': 1, 'weight_decay': 7.264091557833704e-09, 'n_units_l0': 45, 'optimizer': 'Adam', 'adam_learning_rate': 0.001119049532595463}. Best is trial 110 with value: 0.7876920104026794.
Trial 121 finished with value: 0.7803074717521667 and parameters: {'n_layers': 2, 'weight_decay': 2.114344266882596e-08, 'n_units_l0': 57, 'n_units_l1': 13, 'optimizer': 'Adam', 'adam_learning_rate': 0.0006538378260502813}. Best is trial 110 with value: 0.7876920104026794.
Trial 122 finished with value: 0.7458460330963135 and parameters: {'n_layers': 2, 'weight_decay': 2.0114851182107224e-08, 'n_units_l0': 50, 'n_units_l1': 11, 'optimizer': 'Adam', 'adam_learning_rate': 0.0005857118543368756}. Best is trial 110 with value: 0.7876920104026794.
Trial 123 finished with value: 0.5624613761901855 and parameters: {'n_layers': 2, 'weight_decay': 1.1207118501036046e-08, 'n_units_l0': 39, 'n_units_l1': 12, 'optimizer': 'Adam', 'adam_learning_rate': 0.000711214539934138}. Best is trial 110 with value: 0.7876920104026794.
Trial 124 finished with value: 0.781538188457489 and parameters: {'n_layers': 2, 'weight_decay': 2.813655536442634e-08, 'n_units_l0': 61, 'n_units_l1': 15, 'optimizer': 'Adam', 'adam_learning_rate': 0.0009621249568304405}. Best is trial 110 with value: 0.7876920104026794.
Trial 125 finished with value: 0.5132308602333069 and parameters: {'n_layers': 1, 'weight_decay': 2.9444600716776685e-08, 'n_units_l0': 62, 'optimizer': 'Adam', 'adam_learning_rate': 0.0046546234738367945}. Best is trial 110 with value: 0.7876920104026794.
Trial 126 finished with value: 0.7784613370895386 and parameters: {'n_layers': 2, 'weight_decay': 1.8871035524186103e-08, 'n_units_l0': 57, 'n_units_l1': 13, 'optimizer': 'Adam', 'adam_learning_rate': 0.0010101888455808115}. Best is trial 110 with value: 0.7876920104026794.
Trial 127 finished with value: 0.7839996814727783 and parameters: {'n_layers': 2, 'weight_decay': 1.991315463132952e-08, 'n_units_l0': 58, 'n_units_l1': 13, 'optimizer': 'Adam', 'adam_learning_rate': 0.0010628714091351452}. Best is trial 110 with value: 0.7876920104026794.
Trial 128 finished with value: 0.774153470993042 and parameters: {'n_layers': 2, 'weight_decay': 5.346053374586699e-09, 'n_units_l0': 70, 'n_units_l1': 13, 'optimizer': 'Adam', 'adam_learning_rate': 0.0009606774136842809}. Best is trial 110 with value: 0.7876920104026794.
Trial 129 finished with value: 0.5132308602333069 and parameters: {'n_layers': 1, 'weight_decay': 1.7325057632716657e-08, 'n_units_l0': 57, 'optimizer': 'SGD', 'sgd_opt_learning_rate': 0.006418418109083021, 'sgd_opt_momentum': 1.0474353337930671e-05}. Best is trial 110 with value: 0.7876920104026794.
Trial 130 finished with value: 0.7839996814727783 and parameters: {'n_layers': 2, 'weight_decay': 8.963924585644766e-09, 'n_units_l0': 55, 'n_units_l1': 13, 'optimizer': 'Adam', 'adam_learning_rate': 0.0016828487766282548}. Best is trial 110 with value: 0.7876920104026794.
Trial 131 finished with value: 0.7723073363304138 and parameters: {'n_layers': 2, 'weight_decay': 1.019646644581788e-08, 'n_units_l0': 55, 'n_units_l1': 10, 'optimizer': 'Adam', 'adam_learning_rate': 0.0014939784215826104}. Best is trial 110 with value: 0.7876920104026794.
Trial 132 finished with value: 0.7483075261116028 and parameters: {'n_layers': 2, 'weight_decay': 7.105245235621943e-09, 'n_units_l0': 65, 'n_units_l1': 13, 'optimizer': 'Adam', 'adam_learning_rate': 0.0019355665583141463}. Best is trial 110 with value: 0.7876920104026794.
