Trial 212 finished with value: 0.7846150994300842 and parameters: {'n_layers': 2, 'weight_decay': 5.708989904774411e-08, 'n_units_l0': 67, 'n_units_l1': 10, 'optimizer': 'Adam', 'adam_learning_rate': 0.0007391747439042877}. Best is trial 154 with value: 0.7876920700073242.
Trial 213 finished with value: 0.7766151428222656 and parameters: {'n_layers': 2, 'weight_decay': 8.677018934304349e-08, 'n_units_l0': 67, 'n_units_l1': 10, 'optimizer': 'Adam', 'adam_learning_rate': 0.00045966265420829616}. Best is trial 154 with value: 0.7876920700073242.
Trial 214 finished with value: 0.7809228301048279 and parameters: {'n_layers': 2, 'weight_decay': 5.263918698493205e-08, 'n_units_l0': 56, 'n_units_l1': 11, 'optimizer': 'Adam', 'adam_learning_rate': 0.0006496226122620338}. Best is trial 154 with value: 0.7876920700073242.
Trial 215 finished with value: 0.7827690243721008 and parameters: {'n_layers': 2, 'weight_decay': 6.923420970080582e-08, 'n_units_l0': 60, 'n_units_l1': 10, 'optimizer': 'Adam', 'adam_learning_rate': 0.0005483320106347014}. Best is trial 154 with value: 0.7876920700073242.
Trial 216 finished with value: 0.7815383076667786 and parameters: {'n_layers': 2, 'weight_decay': 6.123917936225075e-08, 'n_units_l0': 66, 'n_units_l1': 11, 'optimizer': 'Adam', 'adam_learning_rate': 0.0005146122132770036}. Best is trial 154 with value: 0.7876920700073242.
Trial 217 finished with value: 0.7698459625244141 and parameters: {'n_layers': 2, 'weight_decay': 4.714376762080428e-08, 'n_units_l0': 55, 'n_units_l1': 8, 'optimizer': 'Adam', 'adam_learning_rate': 0.0006880291304863404}. Best is trial 154 with value: 0.7876920700073242.
Trial 218 finished with value: 0.5421537756919861 and parameters: {'n_layers': 2, 'weight_decay': 9.374560901665241e-08, 'n_units_l0': 60, 'n_units_l1': 10, 'optimizer': 'Adam', 'adam_learning_rate': 0.00040594975187524654}. Best is trial 154 with value: 0.7876920700073242.
Trial 219 finished with value: 0.7649228572845459 and parameters: {'n_layers': 3, 'weight_decay': 7.16780951991665e-08, 'n_units_l0': 53, 'n_units_l1': 10, 'n_units_l2': 84, 'optimizer': 'Adam', 'adam_learning_rate': 0.0005553464583309784}. Best is trial 154 with value: 0.7876920700073242.
Trial 220 finished with value: 0.7803075313568115 and parameters: {'n_layers': 2, 'weight_decay': 3.910654838397162e-08, 'n_units_l0': 64, 'n_units_l1': 12, 'optimizer': 'Adam', 'adam_learning_rate': 0.0007875018100716568}. Best is trial 154 with value: 0.7876920700073242.
Trial 221 finished with value: 0.703999936580658 and parameters: {'n_layers': 2, 'weight_decay': 6.197505470594759e-08, 'n_units_l0': 67, 'n_units_l1': 11, 'optimizer': 'Adam', 'adam_learning_rate': 0.0005075752139713757}. Best is trial 154 with value: 0.7876920700073242.
Trial 222 finished with value: 0.6824613809585571 and parameters: {'n_layers': 2, 'weight_decay': 1.2128018122885137e-07, 'n_units_l0': 58, 'n_units_l1': 13, 'optimizer': 'Adam', 'adam_learning_rate': 0.00037227040003476417}. Best is trial 154 with value: 0.7876920700073242.
Trial 223 finished with value: 0.6781537532806396 and parameters: {'n_layers': 2, 'weight_decay': 6.227854685062317e-08, 'n_units_l0': 66, 'n_units_l1': 9, 'optimizer': 'Adam', 'adam_learning_rate': 0.0005949262053116941}. Best is trial 154 with value: 0.7876920700073242.
Trial 224 finished with value: 0.5132308602333069 and parameters: {'n_layers': 10, 'weight_decay': 4.4049172669610946e-08, 'n_units_l0': 52, 'n_units_l1': 11, 'n_units_l2': 53, 'n_units_l3': 9, 'n_units_l4': 18, 'n_units_l5': 84, 'n_units_l6': 120, 'n_units_l7': 69, 'n_units_l8': 16, 'n_units_l9': 4, 'optimizer': 'Adam', 'adam_learning_rate': 0.0007380596824172613}. Best is trial 154 with value: 0.7876920700073242.
Trial 225 finished with value: 0.5132308602333069 and parameters: {'n_layers': 2, 'weight_decay': 1.0463663191130026e-07, 'n_units_l0': 63, 'n_units_l1': 13, 'optimizer': 'Adam', 'adam_learning_rate': 0.00827376890149089}. Best is trial 154 with value: 0.7876920700073242.
Trial 226 finished with value: 0.5599998235702515 and parameters: {'n_layers': 2, 'weight_decay': 3.3326445008799656e-08, 'n_units_l0': 69, 'n_units_l1': 12, 'optimizer': 'Adam', 'adam_learning_rate': 0.000455656342383288}. Best is trial 154 with value: 0.7876920700073242.
Trial 227 finished with value: 0.7815381288528442 and parameters: {'n_layers': 2, 'weight_decay': 5.726280184812045e-08, 'n_units_l0': 58, 'n_units_l1': 10, 'optimizer': 'Adam', 'adam_learning_rate': 0.0009071308273095554}. Best is trial 154 with value: 0.7876920700073242.
Trial 228 finished with value: 0.7821535468101501 and parameters: {'n_layers': 2, 'weight_decay': 1.6435079398643107e-07, 'n_units_l0': 51, 'n_units_l1': 12, 'optimizer': 'Adam', 'adam_learning_rate': 0.000563741732716173}. Best is trial 154 with value: 0.7876920700073242.
Trial 229 finished with value: 0.7815381288528442 and parameters: {'n_layers': 2, 'weight_decay': 1.7047614772235396e-07, 'n_units_l0': 51, 'n_units_l1': 12, 'optimizer': 'Adam', 'adam_learning_rate': 0.0007023202817268342}. Best is trial 154 with value: 0.7876920700073242.
Trial 230 finished with value: 0.7827690243721008 and parameters: {'n_layers': 2, 'weight_decay': 9.291294056911907e-08, 'n_units_l0': 43, 'n_units_l1': 13, 'optimizer': 'Adam', 'adam_learning_rate': 0.0008753187747491984}. Best is trial 154 with value: 0.7876920700073242.
Trial 231 finished with value: 0.7815381288528442 and parameters: {'n_layers': 2, 'weight_decay': 9.588274683295606e-08, 'n_units_l0': 43, 'n_units_l1': 13, 'optimizer': 'Adam', 'adam_learning_rate': 0.000854186087666007}. Best is trial 154 with value: 0.7876920700073242.
Trial 232 finished with value: 0.7766149640083313 and parameters: {'n_layers': 2, 'weight_decay': 7.907682987730015e-08, 'n_units_l0': 55, 'n_units_l1': 13, 'optimizer': 'Adam', 'adam_learning_rate': 0.0005907584441100213}. Best is trial 154 with value: 0.7876920700073242.
Trial 233 finished with value: 0.7833843231201172 and parameters: {'n_layers': 2, 'weight_decay': 1.8972017552469198e-08, 'n_units_l0': 51, 'n_units_l1': 12, 'optimizer': 'Adam', 'adam_learning_rate': 0.0009828020495262113}. Best is trial 154 with value: 0.7876920700073242.
Trial 234 finished with value: 0.7852305769920349 and parameters: {'n_layers': 2, 'weight_decay': 1.4658429983328884e-08, 'n_units_l0': 60, 'n_units_l1': 14, 'optimizer': 'Adam', 'adam_learning_rate': 0.0010700319596803577}. Best is trial 154 with value: 0.7876920700073242.
Trial 235 finished with value: 0.5132308602333069 and parameters: {'n_layers': 2, 'weight_decay': 1.2359325063728143e-08, 'n_units_l0': 61, 'n_units_l1': 14, 'optimizer': 'SGD', 'sgd_opt_learning_rate': 0.00031421943891404906, 'sgd_opt_momentum': 0.0011862882676157043}. Best is trial 154 with value: 0.7876920700073242.
Trial 236 finished with value: 0.7550767660140991 and parameters: {'n_layers': 2, 'weight_decay': 1.8692696458710262e-08, 'n_units_l0': 71, 'n_units_l1': 121, 'optimizer': 'Adam', 'adam_learning_rate': 0.0011411623384924917}. Best is trial 154 with value: 0.7876920700073242.
Trial 237 finished with value: 0.5132308602333069 and parameters: {'n_layers': 2, 'weight_decay': 3.0233744691293435e-08, 'n_units_l0': 46, 'n_units_l1': 12, 'optimizer': 'Adam', 'adam_learning_rate': 0.08884179130067238}. Best is trial 154 with value: 0.7876920700073242.
Trial 238 finished with value: 0.5169231295585632 and parameters: {'n_layers': 1, 'weight_decay': 1.4551339717549627e-08, 'n_units_l0': 61, 'optimizer': 'Adam', 'adam_learning_rate': 0.0007842574016420843}. Best is trial 154 with value: 0.7876920700073242.
Trial 239 finished with value: 0.7815383076667786 and parameters: {'n_layers': 2, 'weight_decay': 2.5535706209987786e-08, 'n_units_l0': 51, 'n_units_l1': 14, 'optimizer': 'Adam', 'adam_learning_rate': 0.001074108417693143}. Best is trial 154 with value: 0.7876920700073242.
Trial 240 finished with value: 0.783384382724762 and parameters: {'n_layers': 2, 'weight_decay': 4.478362365176986e-08, 'n_units_l0': 41, 'n_units_l1': 11, 'optimizer': 'Adam', 'adam_learning_rate': 0.0007140404260659045}. Best is trial 154 with value: 0.7876920700073242.
Trial 241 finished with value: 0.7679998278617859 and parameters: {'n_layers': 2, 'weight_decay': 4.4620979329571715e-08, 'n_units_l0': 41, 'n_units_l1': 11, 'optimizer': 'Adam', 'adam_learning_rate': 0.0007030663936484597}. Best is trial 154 with value: 0.7876920700073242.
Trial 242 finished with value: 0.7803074717521667 and parameters: {'n_layers': 2, 'weight_decay': 1.0935396031830063e-08, 'n_units_l0': 42, 'n_units_l1': 10, 'optimizer': 'Adam', 'adam_learning_rate': 0.0009211167473433382}. Best is trial 154 with value: 0.7876920700073242.
Trial 243 finished with value: 0.5206154584884644 and parameters: {'n_layers': 2, 'weight_decay': 3.602481588746064e-08, 'n_units_l0': 58, 'n_units_l1': 11, 'optimizer': 'Adam', 'adam_learning_rate': 0.0007886394502330286}. Best is trial 154 with value: 0.7876920700073242.
Trial 244 finished with value: 0.7753844261169434 and parameters: {'n_layers': 2, 'weight_decay': 1.8249460679977554e-08, 'n_units_l0': 5, 'n_units_l1': 13, 'optimizer': 'Adam', 'adam_learning_rate': 0.0011637752582005308}. Best is trial 154 with value: 0.7876920700073242.
Trial 245 finished with value: 0.5132308602333069 and parameters: {'n_layers': 2, 'weight_decay': 5.060322748405263e-08, 'n_units_l0': 38, 'n_units_l1': 8, 'optimizer': 'Adam', 'adam_learning_rate': 0.0016989008741301014}. Best is trial 154 with value: 0.7876920700073242.
Trial 246 finished with value: 0.7766150236129761 and parameters: {'n_layers': 2, 'weight_decay': 2.8116761849333505e-08, 'n_units_l0': 54, 'n_units_l1': 12, 'optimizer': 'Adam', 'adam_learning_rate': 0.000654650121779413}. Best is trial 154 with value: 0.7876920700073242.
Trial 247 finished with value: 0.5132308602333069 and parameters: {'n_layers': 2, 'weight_decay': 8.004431880065227e-08, 'n_units_l0': 48, 'n_units_l1': 14, 'optimizer': 'RMSprop', 'rmsprop_learning_rate': 0.0038508905241287084, 'rmsprop_weight_decay': 0.8875476310309848, 'rmsprop_momentum': 1.0817240359722477e-05}. Best is trial 154 with value: 0.7876920700073242.
Trial 248 finished with value: 0.7809227108955383 and parameters: {'n_layers': 2, 'weight_decay': 1.3913785079114359e-08, 'n_units_l0': 62, 'n_units_l1': 16, 'optimizer': 'Adam', 'adam_learning_rate': 0.0009415236273413302}. Best is trial 154 with value: 0.7876920700073242.
Trial 249 finished with value: 0.7741536498069763 and parameters: {'n_layers': 3, 'weight_decay': 2.186629898645545e-08, 'n_units_l0': 45, 'n_units_l1': 12, 'n_units_l2': 4, 'optimizer': 'Adam', 'adam_learning_rate': 0.0007944071368056927}. Best is trial 154 with value: 0.7876920700073242.
Trial 250 finished with value: 0.5132308602333069 and parameters: {'n_layers': 2, 'weight_decay': 3.6391449856723374e-08, 'n_units_l0': 57, 'n_units_l1': 13, 'optimizer': 'Adam', 'adam_learning_rate': 0.0012174864269016265}. Best is trial 154 with value: 0.7876920700073242.
Trial 251 finished with value: 0.7686152458190918 and parameters: {'n_layers': 2, 'weight_decay': 1.0465487468551853e-08, 'n_units_l0': 71, 'n_units_l1': 10, 'optimizer': 'Adam', 'adam_learning_rate': 0.0006572539592078191}. Best is trial 154 with value: 0.7876920700073242.
Trial 252 finished with value: 0.5132308602333069 and parameters: {'n_layers': 2, 'weight_decay': 4.5038048149858927e-08, 'n_units_l0': 36, 'n_units_l1': 9, 'optimizer': 'Adam', 'adam_learning_rate': 1.3116580063664434e-05}. Best is trial 154 with value: 0.7876920700073242.
Trial 253 finished with value: 0.7821536660194397 and parameters: {'n_layers': 1, 'weight_decay': 1.5331723020403696e-08, 'n_units_l0': 50, 'optimizer': 'Adam', 'adam_learning_rate': 0.0019867308591679273}. Best is trial 154 with value: 0.7876920700073242.
Trial 254 finished with value: 0.7119998335838318 and parameters: {'n_layers': 1, 'weight_decay': 2.2797102013177085e-08, 'n_units_l0': 48, 'optimizer': 'Adam', 'adam_learning_rate': 0.00207393088512869}. Best is trial 154 with value: 0.7876920700073242.
Trial 255 finished with value: 0.5132308602333069 and parameters: {'n_layers': 1, 'weight_decay': 6.930157387942217e-08, 'n_units_l0': 34, 'optimizer': 'Adam', 'adam_learning_rate': 0.000971230403973385}. Best is trial 154 with value: 0.7876920700073242.
Trial 256 finished with value: 0.7064613699913025 and parameters: {'n_layers': 1, 'weight_decay': 1.1336766428732394e-07, 'n_units_l0': 52, 'optimizer': 'Adam', 'adam_learning_rate': 0.002919431443321431}. Best is trial 154 with value: 0.7876920700073242.
Trial 257 finished with value: 0.5236923098564148 and parameters: {'n_layers': 1, 'weight_decay': 3.191749960476153e-08, 'n_units_l0': 40, 'optimizer': 'Adam', 'adam_learning_rate': 0.0017556162157434747}. Best is trial 154 with value: 0.7876920700073242.
Trial 258 finished with value: 0.5175384283065796 and parameters: {'n_layers': 1, 'weight_decay': 1.7746366394042615e-08, 'n_units_l0': 54, 'optimizer': 'Adam', 'adam_learning_rate': 0.0005253095092206055}. Best is trial 154 with value: 0.7876920700073242.
Trial 259 finished with value: 0.5132308602333069 and parameters: {'n_layers': 8, 'weight_decay': 1.0883098447330359e-08, 'n_units_l0': 63, 'n_units_l1': 11, 'n_units_l2': 98, 'n_units_l3': 4, 'n_units_l4': 6, 'n_units_l5': 100, 'n_units_l6': 54, 'n_units_l7': 16, 'optimizer': 'Adam', 'adam_learning_rate': 0.000765301741679619}. Best is trial 154 with value: 0.7876920700073242.
Trial 260 finished with value: 0.7784611582756042 and parameters: {'n_layers': 2, 'weight_decay': 5.257586555377148e-08, 'n_units_l0': 59, 'n_units_l1': 12, 'optimizer': 'Adam', 'adam_learning_rate': 0.000611348388889803}. Best is trial 154 with value: 0.7876920700073242.
Trial 261 finished with value: 0.7803074717521667 and parameters: {'n_layers': 2, 'weight_decay': 2.5197685235007654e-08, 'n_units_l0': 49, 'n_units_l1': 14, 'optimizer': 'Adam', 'adam_learning_rate': 0.0009852465023856612}. Best is trial 154 with value: 0.7876920700073242.
Trial 262 finished with value: 0.5132308602333069 and parameters: {'n_layers': 2, 'weight_decay': 4.047420569056122e-08, 'n_units_l0': 57, 'n_units_l1': 11, 'optimizer': 'SGD', 'sgd_opt_learning_rate': 2.97406174568142e-05, 'sgd_opt_momentum': 6.0210234059419085e-05}. Best is trial 154 with value: 0.7876920700073242.
Trial 263 finished with value: 0.5181538462638855 and parameters: {'n_layers': 1, 'weight_decay': 1.4032122919238329e-08, 'n_units_l0': 66, 'optimizer': 'Adam', 'adam_learning_rate': 0.00043746955757844377}. Best is trial 154 with value: 0.7876920700073242.
Trial 264 finished with value: 0.7378462553024292 and parameters: {'n_layers': 3, 'weight_decay': 8.683725022532192e-09, 'n_units_l0': 43, 'n_units_l1': 13, 'n_units_l2': 39, 'optimizer': 'Adam', 'adam_learning_rate': 0.0008297687851007651}. Best is trial 154 with value: 0.7876920700073242.
Trial 265 finished with value: 0.7821536064147949 and parameters: {'n_layers': 2, 'weight_decay': 8.130606544928425e-08, 'n_units_l0': 46, 'n_units_l1': 17, 'optimizer': 'Adam', 'adam_learning_rate': 0.0024354409577653437}. Best is trial 154 with value: 0.7876920700073242.
Trial 266 finished with value: 0.7753844857215881 and parameters: {'n_layers': 2, 'weight_decay': 6.140435677303652e-09, 'n_units_l0': 52, 'n_units_l1': 21, 'optimizer': 'Adam', 'adam_learning_rate': 0.000708991210472339}. Best is trial 154 with value: 0.7876920700073242.
Trial 267 finished with value: 0.771692156791687 and parameters: {'n_layers': 2, 'weight_decay': 6.084852314549733e-08, 'n_units_l0': 60, 'n_units_l1': 15, 'optimizer': 'Adam', 'adam_learning_rate': 0.0012207501358659921}. Best is trial 154 with value: 0.7876920700073242.
Trial 268 finished with value: 0.7846152186393738 and parameters: {'n_layers': 2, 'weight_decay': 3.0935823600696006e-08, 'n_units_l0': 55, 'n_units_l1': 14, 'optimizer': 'Adam', 'adam_learning_rate': 0.002002464467112417}. Best is trial 154 with value: 0.7876920700073242.
Trial 269 finished with value: 0.5132308602333069 and parameters: {'n_layers': 2, 'weight_decay': 3.20497974932329e-08, 'n_units_l0': 55, 'n_units_l1': 14, 'optimizer': 'RMSprop', 'rmsprop_learning_rate': 0.0001372943615688422, 'rmsprop_weight_decay': 0.9618505115266203, 'rmsprop_momentum': 0.08718449304680163}. Best is trial 154 with value: 0.7876920700073242.
Trial 270 finished with value: 0.7790766358375549 and parameters: {'n_layers': 2, 'weight_decay': 4.49982588871609e-08, 'n_units_l0': 66, 'n_units_l1': 13, 'optimizer': 'Adam', 'adam_learning_rate': 0.0005731942916855836}. Best is trial 154 with value: 0.7876920700073242.
Trial 271 finished with value: 0.7458460330963135 and parameters: {'n_layers': 2, 'weight_decay': 2.5668469042237668e-08, 'n_units_l0': 70, 'n_units_l1': 15, 'optimizer': 'Adam', 'adam_learning_rate': 0.0016363257134328559}. Best is trial 154 with value: 0.7876920700073242.
Trial 272 finished with value: 0.7772305011749268 and parameters: {'n_layers': 2, 'weight_decay': 6.852584387775588e-08, 'n_units_l0': 62, 'n_units_l1': 12, 'optimizer': 'Adam', 'adam_learning_rate': 0.0008127710241063735}. Best is trial 154 with value: 0.7876920700073242.
Trial 273 finished with value: 0.7692305445671082 and parameters: {'n_layers': 2, 'weight_decay': 3.7383648219903087e-08, 'n_units_l0': 58, 'n_units_l1': 14, 'optimizer': 'Adam', 'adam_learning_rate': 0.0011615704479225292}. Best is trial 154 with value: 0.7876920700073242.
Trial 274 finished with value: 0.734769344329834 and parameters: {'n_layers': 3, 'weight_decay': 2.132278642058173e-08, 'n_units_l0': 55, 'n_units_l1': 11, 'n_units_l2': 63, 'optimizer': 'Adam', 'adam_learning_rate': 0.0009729650402511092}. Best is trial 154 with value: 0.7876920700073242.
Trial 275 finished with value: 0.7599998712539673 and parameters: {'n_layers': 2, 'weight_decay': 1.1111033612176445e-07, 'n_units_l0': 64, 'n_units_l1': 10, 'optimizer': 'Adam', 'adam_learning_rate': 0.004096460531002172}. Best is trial 154 with value: 0.7876920700073242.
Trial 276 finished with value: 0.7261537313461304 and parameters: {'n_layers': 2, 'weight_decay': 5.168510746124392e-08, 'n_units_l0': 74, 'n_units_l1': 13, 'optimizer': 'Adam', 'adam_learning_rate': 0.0004784728937901668}. Best is trial 154 with value: 0.7876920700073242.
Trial 277 finished with value: 0.7809228301048279 and parameters: {'n_layers': 2, 'weight_decay': 2.9804159103875476e-08, 'n_units_l0': 52, 'n_units_l1': 12, 'optimizer': 'Adam', 'adam_learning_rate': 0.0006731231674393848}. Best is trial 154 with value: 0.7876920700073242.
Trial 278 finished with value: 0.5132308602333069 and parameters: {'n_layers': 2, 'weight_decay': 1.9266343355356337e-08, 'n_units_l0': 59, 'n_units_l1': 14, 'optimizer': 'Adam', 'adam_learning_rate': 0.0009276375104999224}. Best is trial 154 with value: 0.7876920700073242.
Trial 279 finished with value: 0.5132308602333069 and parameters: {'n_layers': 2, 'weight_decay': 8.808568374862136e-09, 'n_units_l0': 44, 'n_units_l1': 16, 'optimizer': 'Adam', 'adam_learning_rate': 0.00127041295293092}. Best is trial 154 with value: 0.7876920700073242.
Trial 280 finished with value: 0.5132308602333069 and parameters: {'n_layers': 3, 'weight_decay': 8.675382449230914e-08, 'n_units_l0': 69, 'n_units_l1': 18, 'n_units_l2': 78, 'optimizer': 'Adam', 'adam_learning_rate': 0.001503156587969524}. Best is trial 154 with value: 0.7876920700073242.
Trial 281 finished with value: 0.5132308602333069 and parameters: {'n_layers': 2, 'weight_decay': 1.1343572745611133e-08, 'n_units_l0': 49, 'n_units_l1': 13, 'optimizer': 'Adam', 'adam_learning_rate': 0.0055246603754265395}. Best is trial 154 with value: 0.7876920700073242.
Trial 282 finished with value: 0.7790766358375549 and parameters: {'n_layers': 2, 'weight_decay': 3.6922326469724135e-08, 'n_units_l0': 62, 'n_units_l1': 11, 'optimizer': 'Adam', 'adam_learning_rate': 0.0006032830583573705}. Best is trial 154 with value: 0.7876920700073242.
Trial 283 finished with value: 0.7796920537948608 and parameters: {'n_layers': 2, 'weight_decay': 5.139006352262737e-09, 'n_units_l0': 55, 'n_units_l1': 15, 'optimizer': 'Adam', 'adam_learning_rate': 0.00072408943333274}. Best is trial 154 with value: 0.7876920700073242.
Trial 284 finished with value: 0.5132308602333069 and parameters: {'n_layers': 2, 'weight_decay': 5.1941733320145156e-08, 'n_units_l0': 37, 'n_units_l1': 12, 'optimizer': 'SGD', 'sgd_opt_learning_rate': 0.0035054503211392105, 'sgd_opt_momentum': 0.031715139462101576}. Best is trial 154 with value: 0.7876920700073242.
Trial 285 finished with value: 0.7698459625244141 and parameters: {'n_layers': 2, 'weight_decay': 2.4421690782918246e-08, 'n_units_l0': 66, 'n_units_l1': 14, 'optimizer': 'Adam', 'adam_learning_rate': 0.0010545713785592484}. Best is trial 154 with value: 0.7876920700073242.
Trial 286 finished with value: 0.7809227705001831 and parameters: {'n_layers': 2, 'weight_decay': 1.3834705320720371e-08, 'n_units_l0': 59, 'n_units_l1': 17, 'optimizer': 'Adam', 'adam_learning_rate': 0.0008362467267743408}. Best is trial 154 with value: 0.7876920700073242.
Trial 287 finished with value: 0.5132308602333069 and parameters: {'n_layers': 3, 'weight_decay': 6.63017798394582e-08, 'n_units_l0': 51, 'n_units_l1': 10, 'n_units_l2': 59, 'optimizer': 'Adam', 'adam_learning_rate': 0.0020623114557328463}. Best is trial 154 with value: 0.7876920700073242.
Trial 288 finished with value: 0.7372307181358337 and parameters: {'n_layers': 2, 'weight_decay': 2.9922127721950507e-07, 'n_units_l0': 33, 'n_units_l1': 13, 'optimizer': 'Adam', 'adam_learning_rate': 0.0028661953442306104}. Best is trial 154 with value: 0.7876920700073242.
Trial 289 finished with value: 0.5132308602333069 and parameters: {'n_layers': 2, 'weight_decay': 1.2719972436767787e-07, 'n_units_l0': 55, 'n_units_l1': 9, 'optimizer': 'Adam', 'adam_learning_rate': 0.00034766284137950225}. Best is trial 154 with value: 0.7876920700073242.
