Trial 444 finished with value: 0.7741536498069763 and parameters: {'n_layers': 2, 'weight_decay': 1.921300745277248e-08, 'n_units_l0': 62, 'n_units_l1': 18, 'optimizer': 'Adam', 'adam_learning_rate': 0.0010265095050918333}. Best is trial 154 with value: 0.7876920700073242.
Trial 445 finished with value: 0.5132308602333069 and parameters: {'n_layers': 2, 'weight_decay': 1.3569239652801653e-08, 'n_units_l0': 74, 'n_units_l1': 16, 'optimizer': 'SGD', 'sgd_opt_learning_rate': 0.0109422690201712, 'sgd_opt_momentum': 0.02709548663633139}. Best is trial 154 with value: 0.7876920700073242.
Trial 446 finished with value: 0.7409229874610901 and parameters: {'n_layers': 4, 'weight_decay': 3.972921683305718e-09, 'n_units_l0': 68, 'n_units_l1': 17, 'n_units_l2': 41, 'n_units_l3': 5, 'optimizer': 'Adam', 'adam_learning_rate': 0.0009113450391742661}. Best is trial 154 with value: 0.7876920700073242.
Trial 447 finished with value: 0.5187692642211914 and parameters: {'n_layers': 1, 'weight_decay': 6.248329997234069e-09, 'n_units_l0': 59, 'optimizer': 'Adam', 'adam_learning_rate': 0.00103579953608529}. Best is trial 154 with value: 0.7876920700073242.
Trial 448 finished with value: 0.7624613642692566 and parameters: {'n_layers': 2, 'weight_decay': 0.00033582002145081895, 'n_units_l0': 64, 'n_units_l1': 20, 'optimizer': 'Adam', 'adam_learning_rate': 0.0011708895055973063}. Best is trial 154 with value: 0.7876920700073242.
Trial 449 finished with value: 0.7883074879646301 and parameters: {'n_layers': 2, 'weight_decay': 1.0097640951516448e-08, 'n_units_l0': 57, 'n_units_l1': 16, 'optimizer': 'Adam', 'adam_learning_rate': 0.0009027231928496613}. Best is trial 449 with value: 0.7883074879646301.
Trial 450 finished with value: 0.7679998874664307 and parameters: {'n_layers': 2, 'weight_decay': 9.496402615828818e-09, 'n_units_l0': 52, 'n_units_l1': 16, 'optimizer': 'Adam', 'adam_learning_rate': 0.0007401137614715129}. Best is trial 449 with value: 0.7883074879646301.
Trial 451 finished with value: 0.5132308602333069 and parameters: {'n_layers': 8, 'weight_decay': 7.350566331433758e-09, 'n_units_l0': 57, 'n_units_l1': 18, 'n_units_l2': 22, 'n_units_l3': 16, 'n_units_l4': 7, 'n_units_l5': 50, 'n_units_l6': 5, 'n_units_l7': 36, 'optimizer': 'Adam', 'adam_learning_rate': 0.000892505951231381}. Best is trial 449 with value: 0.7883074879646301.
Trial 452 finished with value: 0.7846150994300842 and parameters: {'n_layers': 2, 'weight_decay': 1.1367464564734936e-08, 'n_units_l0': 80, 'n_units_l1': 17, 'optimizer': 'Adam', 'adam_learning_rate': 0.0008222987251415935}. Best is trial 449 with value: 0.7883074879646301.
Trial 453 finished with value: 0.5132308602333069 and parameters: {'n_layers': 2, 'weight_decay': 9.860685408051197e-09, 'n_units_l0': 86, 'n_units_l1': 17, 'optimizer': 'RMSprop', 'rmsprop_learning_rate': 0.00010620565719620095, 'rmsprop_weight_decay': 0.9524047856897363, 'rmsprop_momentum': 0.002158924237253344}. Best is trial 449 with value: 0.7883074879646301.
Trial 454 finished with value: 0.7452306151390076 and parameters: {'n_layers': 2, 'weight_decay': 1.2239364687277173e-08, 'n_units_l0': 78, 'n_units_l1': 16, 'optimizer': 'Adam', 'adam_learning_rate': 0.0008658456241999584}. Best is trial 449 with value: 0.7883074879646301.
Trial 455 finished with value: 0.7766151428222656 and parameters: {'n_layers': 2, 'weight_decay': 7.692487069269426e-09, 'n_units_l0': 81, 'n_units_l1': 15, 'optimizer': 'Adam', 'adam_learning_rate': 0.0010744158294700836}. Best is trial 449 with value: 0.7883074879646301.
Trial 456 finished with value: 0.7809228301048279 and parameters: {'n_layers': 2, 'weight_decay': 1.3210638820131608e-08, 'n_units_l0': 27, 'n_units_l1': 16, 'optimizer': 'Adam', 'adam_learning_rate': 0.0006362014362677773}. Best is trial 449 with value: 0.7883074879646301.
Trial 457 finished with value: 0.5132308602333069 and parameters: {'n_layers': 3, 'weight_decay': 6.190254711957465e-09, 'n_units_l0': 62, 'n_units_l1': 35, 'n_units_l2': 9, 'optimizer': 'Adam', 'adam_learning_rate': 0.0013305446843620793}. Best is trial 449 with value: 0.7883074879646301.
Trial 458 finished with value: 0.5132308602333069 and parameters: {'n_layers': 1, 'weight_decay': 1.055512496131954e-08, 'n_units_l0': 68, 'optimizer': 'Adam', 'adam_learning_rate': 0.024969971608891296}. Best is trial 449 with value: 0.7883074879646301.
Trial 459 finished with value: 0.7833843231201172 and parameters: {'n_layers': 2, 'weight_decay': 1.591349260536263e-08, 'n_units_l0': 22, 'n_units_l1': 15, 'optimizer': 'Adam', 'adam_learning_rate': 0.0006955672219488202}. Best is trial 449 with value: 0.7883074879646301.
Trial 460 finished with value: 0.7686150670051575 and parameters: {'n_layers': 2, 'weight_decay': 5.027953452631417e-09, 'n_units_l0': 50, 'n_units_l1': 95, 'optimizer': 'Adam', 'adam_learning_rate': 0.0007823125976920914}. Best is trial 449 with value: 0.7883074879646301.
Trial 461 finished with value: 0.7729228138923645 and parameters: {'n_layers': 2, 'weight_decay': 8.314844797915317e-09, 'n_units_l0': 10, 'n_units_l1': 17, 'optimizer': 'Adam', 'adam_learning_rate': 0.000968670015407801}. Best is trial 449 with value: 0.7883074879646301.
Trial 462 finished with value: 0.7907689809799194 and parameters: {'n_layers': 2, 'weight_decay': 1.774596893179339e-08, 'n_units_l0': 55, 'n_units_l1': 17, 'optimizer': 'Adam', 'adam_learning_rate': 0.0005318297071231913}. Best is trial 462 with value: 0.7907689809799194.
Trial 463 finished with value: 0.7778458595275879 and parameters: {'n_layers': 2, 'weight_decay': 2.0002012337131054e-08, 'n_units_l0': 54, 'n_units_l1': 18, 'optimizer': 'Adam', 'adam_learning_rate': 0.0005512657591475721}. Best is trial 462 with value: 0.7907689809799194.
Trial 464 finished with value: 0.7556921243667603 and parameters: {'n_layers': 3, 'weight_decay': 2.435814475275157e-08, 'n_units_l0': 61, 'n_units_l1': 20, 'n_units_l2': 7, 'optimizer': 'Adam', 'adam_learning_rate': 0.0004885637858836327}. Best is trial 462 with value: 0.7907689809799194.
Trial 465 finished with value: 0.7415381669998169 and parameters: {'n_layers': 2, 'weight_decay': 1.6482161058679673e-08, 'n_units_l0': 19, 'n_units_l1': 17, 'optimizer': 'Adam', 'adam_learning_rate': 0.000486426566849801}. Best is trial 462 with value: 0.7907689809799194.
Trial 466 finished with value: 0.7784613370895386 and parameters: {'n_layers': 2, 'weight_decay': 2.1915172653915718e-07, 'n_units_l0': 88, 'n_units_l1': 19, 'optimizer': 'Adam', 'adam_learning_rate': 0.0005966252789770682}. Best is trial 462 with value: 0.7907689809799194.
Trial 467 finished with value: 0.7821534872055054 and parameters: {'n_layers': 1, 'weight_decay': 1.389313533426875e-08, 'n_units_l0': 76, 'optimizer': 'Adam', 'adam_learning_rate': 0.0020342450100349014}. Best is trial 462 with value: 0.7907689809799194.
Trial 468 finished with value: 0.5132308602333069 and parameters: {'n_layers': 2, 'weight_decay': 2.148373639967993e-08, 'n_units_l0': 49, 'n_units_l1': 21, 'optimizer': 'SGD', 'sgd_opt_learning_rate': 0.0007115664413992136, 'sgd_opt_momentum': 4.132011004288144e-05}. Best is trial 462 with value: 0.7907689809799194.
Trial 469 finished with value: 0.5384615063667297 and parameters: {'n_layers': 2, 'weight_decay': 1.1202794239171245e-08, 'n_units_l0': 18, 'n_units_l1': 16, 'optimizer': 'Adam', 'adam_learning_rate': 0.000709094550134497}. Best is trial 462 with value: 0.7907689809799194.
Trial 470 finished with value: 0.7372307181358337 and parameters: {'n_layers': 2, 'weight_decay': 0.0009337059836631961, 'n_units_l0': 68, 'n_units_l1': 18, 'optimizer': 'Adam', 'adam_learning_rate': 0.0045532515178807135}. Best is trial 462 with value: 0.7907689809799194.
Trial 471 finished with value: 0.7815381288528442 and parameters: {'n_layers': 3, 'weight_decay': 1.65550329557304e-08, 'n_units_l0': 14, 'n_units_l1': 15, 'n_units_l2': 8, 'optimizer': 'Adam', 'adam_learning_rate': 0.0005731050860672794}. Best is trial 462 with value: 0.7907689809799194.
Trial 472 finished with value: 0.5132308602333069 and parameters: {'n_layers': 2, 'weight_decay': 2.4684123530934205e-08, 'n_units_l0': 57, 'n_units_l1': 25, 'optimizer': 'Adam', 'adam_learning_rate': 0.002670442046704352}. Best is trial 462 with value: 0.7907689809799194.
Trial 473 finished with value: 0.7378460764884949 and parameters: {'n_layers': 2, 'weight_decay': 4.129742044807164e-07, 'n_units_l0': 65, 'n_units_l1': 16, 'optimizer': 'Adam', 'adam_learning_rate': 0.0011961138543473925}. Best is trial 462 with value: 0.7907689809799194.
Trial 474 finished with value: 0.5796921253204346 and parameters: {'n_layers': 1, 'weight_decay': 5.822487577656365e-08, 'n_units_l0': 52, 'optimizer': 'Adam', 'adam_learning_rate': 0.0008673721317456115}. Best is trial 462 with value: 0.7907689809799194.
Trial 475 finished with value: 0.5132308602333069 and parameters: {'n_layers': 2, 'weight_decay': 1.0139393943975792e-08, 'n_units_l0': 59, 'n_units_l1': 17, 'optimizer': 'RMSprop', 'rmsprop_learning_rate': 2.4893286057404954e-05, 'rmsprop_weight_decay': 0.937768760254464, 'rmsprop_momentum': 8.866881180609282e-05}. Best is trial 462 with value: 0.7907689809799194.
Trial 476 finished with value: 0.7655382752418518 and parameters: {'n_layers': 2, 'weight_decay': 9.787483986621419e-08, 'n_units_l0': 72, 'n_units_l1': 19, 'optimizer': 'Adam', 'adam_learning_rate': 0.0014507811639058643}. Best is trial 462 with value: 0.7907689809799194.
Trial 477 finished with value: 0.5132308602333069 and parameters: {'n_layers': 2, 'weight_decay': 1.1879568451797962e-08, 'n_units_l0': 64, 'n_units_l1': 15, 'optimizer': 'Adam', 'adam_learning_rate': 0.006711704961878112}. Best is trial 462 with value: 0.7907689809799194.
Trial 478 finished with value: 0.7796920537948608 and parameters: {'n_layers': 2, 'weight_decay': 1.88871194080575e-08, 'n_units_l0': 55, 'n_units_l1': 16, 'optimizer': 'Adam', 'adam_learning_rate': 0.0007397161408202912}. Best is trial 462 with value: 0.7907689809799194.
Trial 479 finished with value: 0.7421535849571228 and parameters: {'n_layers': 2, 'weight_decay': 6.334937318792387e-09, 'n_units_l0': 61, 'n_units_l1': 14, 'optimizer': 'Adam', 'adam_learning_rate': 0.0004446788910911521}. Best is trial 462 with value: 0.7907689809799194.
Trial 480 finished with value: 0.780307412147522 and parameters: {'n_layers': 2, 'weight_decay': 2.660748475337143e-08, 'n_units_l0': 68, 'n_units_l1': 18, 'optimizer': 'Adam', 'adam_learning_rate': 0.0006217808401077234}. Best is trial 462 with value: 0.7907689809799194.
Trial 481 finished with value: 0.5181538462638855 and parameters: {'n_layers': 1, 'weight_decay': 1.3912112709974683e-08, 'n_units_l0': 80, 'optimizer': 'Adam', 'adam_learning_rate': 0.0010943688063604923}. Best is trial 462 with value: 0.7907689809799194.
Trial 482 finished with value: 0.7409229278564453 and parameters: {'n_layers': 2, 'weight_decay': 9.160962486400447e-09, 'n_units_l0': 53, 'n_units_l1': 23, 'optimizer': 'Adam', 'adam_learning_rate': 0.003276645180598689}. Best is trial 462 with value: 0.7907689809799194.
Trial 483 finished with value: 0.5132308602333069 and parameters: {'n_layers': 3, 'weight_decay': 5.581235964369387e-08, 'n_units_l0': 47, 'n_units_l1': 17, 'n_units_l2': 57, 'optimizer': 'Adam', 'adam_learning_rate': 0.001847476886626785}. Best is trial 462 with value: 0.7907689809799194.
Trial 484 finished with value: 0.778461217880249 and parameters: {'n_layers': 2, 'weight_decay': 7.870453444527856e-09, 'n_units_l0': 31, 'n_units_l1': 15, 'optimizer': 'Adam', 'adam_learning_rate': 0.0008341912812513945}. Best is trial 462 with value: 0.7907689809799194.
Trial 485 finished with value: 0.7796919941902161 and parameters: {'n_layers': 2, 'weight_decay': 1.8212067938352637e-08, 'n_units_l0': 58, 'n_units_l1': 20, 'optimizer': 'Adam', 'adam_learning_rate': 0.000530758190607701}. Best is trial 462 with value: 0.7907689809799194.
Trial 486 finished with value: 0.5132308602333069 and parameters: {'n_layers': 2, 'weight_decay': 5.179455767662362e-09, 'n_units_l0': 75, 'n_units_l1': 7, 'optimizer': 'Adam', 'adam_learning_rate': 0.0013663018727247541}. Best is trial 462 with value: 0.7907689809799194.
Trial 487 finished with value: 0.5132308602333069 and parameters: {'n_layers': 7, 'weight_decay': 4.2085579436680145e-08, 'n_units_l0': 65, 'n_units_l1': 14, 'n_units_l2': 32, 'n_units_l3': 8, 'n_units_l4': 5, 'n_units_l5': 8, 'n_units_l6': 30, 'optimizer': 'Adam', 'adam_learning_rate': 0.0009849355809305315}. Best is trial 462 with value: 0.7907689809799194.
Trial 488 finished with value: 0.780307412147522 and parameters: {'n_layers': 2, 'weight_decay': 1.2966329013481898e-08, 'n_units_l0': 70, 'n_units_l1': 16, 'optimizer': 'Adam', 'adam_learning_rate': 0.0006831882896586692}. Best is trial 462 with value: 0.7907689809799194.
Trial 489 finished with value: 0.7821536064147949 and parameters: {'n_layers': 2, 'weight_decay': 7.632647832269969e-08, 'n_units_l0': 51, 'n_units_l1': 17, 'optimizer': 'Adam', 'adam_learning_rate': 0.0008033041834530789}. Best is trial 462 with value: 0.7907689809799194.
Trial 490 finished with value: 0.5132308602333069 and parameters: {'n_layers': 2, 'weight_decay': 2.8810422559321614e-08, 'n_units_l0': 61, 'n_units_l1': 15, 'optimizer': 'Adam', 'adam_learning_rate': 0.001631567583016404}. Best is trial 462 with value: 0.7907689809799194.
Trial 491 finished with value: 0.7396921515464783 and parameters: {'n_layers': 2, 'weight_decay': 9.506723222461034e-09, 'n_units_l0': 16, 'n_units_l1': 14, 'optimizer': 'Adam', 'adam_learning_rate': 0.0023903981134115403}. Best is trial 462 with value: 0.7907689809799194.
Trial 492 finished with value: 0.5132308602333069 and parameters: {'n_layers': 1, 'weight_decay': 9.399214052515058e-06, 'n_units_l0': 57, 'optimizer': 'SGD', 'sgd_opt_learning_rate': 7.630850468300986e-05, 'sgd_opt_momentum': 1.0821458297107902e-05}. Best is trial 462 with value: 0.7907689809799194.
Trial 493 finished with value: 0.7489228844642639 and parameters: {'n_layers': 3, 'weight_decay': 2.3342409942059522e-08, 'n_units_l0': 88, 'n_units_l1': 21, 'n_units_l2': 104, 'optimizer': 'Adam', 'adam_learning_rate': 0.0010170230901997003}. Best is trial 462 with value: 0.7907689809799194.
Trial 494 finished with value: 0.7624611854553223 and parameters: {'n_layers': 5, 'weight_decay': 1.4331701334949173e-07, 'n_units_l0': 64, 'n_units_l1': 19, 'n_units_l2': 35, 'n_units_l3': 99, 'n_units_l4': 20, 'optimizer': 'Adam', 'adam_learning_rate': 0.0004618569069411971}. Best is trial 462 with value: 0.7907689809799194.
Trial 495 finished with value: 0.5132308602333069 and parameters: {'n_layers': 9, 'weight_decay': 7.040603456917184e-09, 'n_units_l0': 56, 'n_units_l1': 15, 'n_units_l2': 31, 'n_units_l3': 6, 'n_units_l4': 13, 'n_units_l5': 28, 'n_units_l6': 4, 'n_units_l7': 6, 'n_units_l8': 62, 'optimizer': 'Adam', 'adam_learning_rate': 0.0011895772476350588}. Best is trial 462 with value: 0.7907689809799194.
Trial 496 finished with value: 0.7833843231201172 and parameters: {'n_layers': 2, 'weight_decay': 1.4140121985068648e-08, 'n_units_l0': 71, 'n_units_l1': 31, 'optimizer': 'Adam', 'adam_learning_rate': 0.0006206773477187645}. Best is trial 462 with value: 0.7907689809799194.
Trial 497 finished with value: 0.5132308602333069 and parameters: {'n_layers': 2, 'weight_decay': 3.945254096479981e-08, 'n_units_l0': 60, 'n_units_l1': 18, 'optimizer': 'RMSprop', 'rmsprop_learning_rate': 0.0003190734453867875, 'rmsprop_weight_decay': 0.904566884596915, 'rmsprop_momentum': 5.0793287002532735e-05}. Best is trial 462 with value: 0.7907689809799194.
Trial 498 finished with value: 0.772922933101654 and parameters: {'n_layers': 2, 'weight_decay': 1.8744390822374565e-08, 'n_units_l0': 54, 'n_units_l1': 14, 'optimizer': 'Adam', 'adam_learning_rate': 0.0007913520802375301}. Best is trial 462 with value: 0.7907689809799194.
Trial 499 finished with value: 0.7796921133995056 and parameters: {'n_layers': 6, 'weight_decay': 4.441255025002761e-09, 'n_units_l0': 49, 'n_units_l1': 17, 'n_units_l2': 26, 'n_units_l3': 19, 'n_units_l4': 22, 'n_units_l5': 32, 'optimizer': 'Adam', 'adam_learning_rate': 0.0009199958600726155}. Best is trial 462 with value: 0.7907689809799194.
