A new study created in memory with name: no-name-7fda2af8-7405-4b7a-b706-08c4d8801aa3
Trial 0 finished with value: 1.0 and parameters: {'n_layers': 2, 'weight_decay': 6.963539500503883e-10, 'n_units_l0': 9, 'n_units_l1': 7, 'optimizer': 'Adam', 'adam_learning_rate': 5.14242850187103e-05}. Best is trial 0 with value: 1.0.
Trial 1 finished with value: 1.0 and parameters: {'n_layers': 1, 'weight_decay': 7.59172000094178e-09, 'n_units_l0': 22, 'optimizer': 'SGD', 'sgd_opt_learning_rate': 0.005047582246088806, 'sgd_opt_momentum': 8.210544691923761e-05}. Best is trial 0 with value: 1.0.
Trial 2 finished with value: 1.0 and parameters: {'n_layers': 1, 'weight_decay': 6.190567361255707e-09, 'n_units_l0': 8, 'optimizer': 'SGD', 'sgd_opt_learning_rate': 0.048687560377691, 'sgd_opt_momentum': 0.0005239565946729135}. Best is trial 0 with value: 1.0.
Trial 3 finished with value: 1.0 and parameters: {'n_layers': 2, 'weight_decay': 7.259749719079437e-08, 'n_units_l0': 14, 'n_units_l1': 13, 'optimizer': 'RMSprop', 'rmsprop_learning_rate': 0.004489795047822842, 'rmsprop_weight_decay': 0.8558186332277558, 'rmsprop_momentum': 0.00565427992854942}. Best is trial 0 with value: 1.0.
Trial 4 finished with value: 1.0 and parameters: {'n_layers': 1, 'weight_decay': 6.8024655970002715e-09, 'n_units_l0': 98, 'optimizer': 'RMSprop', 'rmsprop_learning_rate': 0.0009679279908213501, 'rmsprop_weight_decay': 0.8923195058711463, 'rmsprop_momentum': 2.5938696830500316e-05}. Best is trial 0 with value: 1.0.
Trial 5 finished with value: 1.0 and parameters: {'n_layers': 3, 'weight_decay': 7.365945728147121e-08, 'n_units_l0': 5, 'n_units_l1': 10, 'n_units_l2': 49, 'optimizer': 'SGD', 'sgd_opt_learning_rate': 0.00035101607317053333, 'sgd_opt_momentum': 1.7926444592860707e-05}. Best is trial 0 with value: 1.0.
Trial 6 finished with value: 1.0 and parameters: {'n_layers': 2, 'weight_decay': 1.6445041241530441e-09, 'n_units_l0': 62, 'n_units_l1': 7, 'optimizer': 'SGD', 'sgd_opt_learning_rate': 0.0443239625969716, 'sgd_opt_momentum': 0.0014623119165905578}. Best is trial 0 with value: 1.0.
Trial 7 finished with value: 1.0 and parameters: {'n_layers': 3, 'weight_decay': 1.6860973999944928e-05, 'n_units_l0': 34, 'n_units_l1': 25, 'n_units_l2': 8, 'optimizer': 'Adam', 'adam_learning_rate': 1.3372282519492882e-05}. Best is trial 0 with value: 1.0.
Trial 8 finished with value: 1.0 and parameters: {'n_layers': 1, 'weight_decay': 3.640069137855304e-06, 'n_units_l0': 7, 'optimizer': 'Adam', 'adam_learning_rate': 0.01135053099452778}. Best is trial 0 with value: 1.0.
Trial 9 finished with value: 1.0 and parameters: {'n_layers': 3, 'weight_decay': 2.645980250303961e-05, 'n_units_l0': 9, 'n_units_l1': 18, 'n_units_l2': 4, 'optimizer': 'RMSprop', 'rmsprop_learning_rate': 3.635713461037985e-05, 'rmsprop_weight_decay': 0.9578286559164907, 'rmsprop_momentum': 0.011186747106579319}. Best is trial 0 with value: 1.0.
Trial 10 finished with value: 1.0 and parameters: {'n_layers': 2, 'weight_decay': 1.9831651699836197e-10, 'n_units_l0': 4, 'n_units_l1': 122, 'optimizer': 'Adam', 'adam_learning_rate': 3.851691598106846e-05}. Best is trial 0 with value: 1.0.
Trial 11 finished with value: 1.0 and parameters: {'n_layers': 1, 'weight_decay': 1.035314919041335e-10, 'n_units_l0': 24, 'optimizer': 'Adam', 'adam_learning_rate': 0.0005724654082127823}. Best is trial 0 with value: 1.0.
Trial 12 finished with value: 1.0 and parameters: {'n_layers': 2, 'weight_decay': 8.248731337892021e-07, 'n_units_l0': 16, 'n_units_l1': 4, 'optimizer': 'SGD', 'sgd_opt_learning_rate': 1.909144429514226e-05, 'sgd_opt_momentum': 2.1961119593310246e-05}. Best is trial 0 with value: 1.0.
Trial 13 finished with value: 1.0 and parameters: {'n_layers': 1, 'weight_decay': 0.0003319133282885106, 'n_units_l0': 37, 'optimizer': 'Adam', 'adam_learning_rate': 0.0003722793699062875}. Best is trial 0 with value: 1.0.
Trial 14 finished with value: 1.0 and parameters: {'n_layers': 2, 'weight_decay': 8.810135271392456e-10, 'n_units_l0': 12, 'n_units_l1': 40, 'optimizer': 'SGD', 'sgd_opt_learning_rate': 0.0018239404138861053, 'sgd_opt_momentum': 0.09933580297539066}. Best is trial 0 with value: 1.0.
Trial 15 finished with value: 1.0 and parameters: {'n_layers': 1, 'weight_decay': 1.6002695731962495e-08, 'n_units_l0': 25, 'optimizer': 'SGD', 'sgd_opt_learning_rate': 0.002456697037926854, 'sgd_opt_momentum': 0.00024361810368483036}. Best is trial 0 with value: 1.0.
Trial 16 finished with value: 1.0 and parameters: {'n_layers': 3, 'weight_decay': 1.1735792595897552e-09, 'n_units_l0': 50, 'n_units_l1': 4, 'n_units_l2': 125, 'optimizer': 'Adam', 'adam_learning_rate': 0.06542233241478247}. Best is trial 0 with value: 1.0.
Trial 17 finished with value: 1.0 and parameters: {'n_layers': 2, 'weight_decay': 6.204241966522783e-08, 'n_units_l0': 19, 'n_units_l1': 68, 'optimizer': 'SGD', 'sgd_opt_learning_rate': 0.0001392918978378522, 'sgd_opt_momentum': 0.006319150794662962}. Best is trial 0 with value: 1.0.
Trial 18 finished with value: 1.0 and parameters: {'n_layers': 1, 'weight_decay': 6.023139152866725e-10, 'n_units_l0': 10, 'optimizer': 'Adam', 'adam_learning_rate': 0.00010110134473675354}. Best is trial 0 with value: 1.0.
Trial 19 finished with value: 1.0 and parameters: {'n_layers': 2, 'weight_decay': 3.338085422306181e-07, 'n_units_l0': 6, 'n_units_l1': 7, 'optimizer': 'RMSprop', 'rmsprop_learning_rate': 0.034110349717576746, 'rmsprop_weight_decay': 0.9748699642675076, 'rmsprop_momentum': 1.1265734870594472e-05}. Best is trial 0 with value: 1.0.
Trial 20 finished with value: 1.0 and parameters: {'n_layers': 3, 'weight_decay': 1.9032121632409056e-08, 'n_units_l0': 112, 'n_units_l1': 30, 'n_units_l2': 22, 'optimizer': 'SGD', 'sgd_opt_learning_rate': 0.00816865132961439, 'sgd_opt_momentum': 9.121656119193783e-05}. Best is trial 0 with value: 1.0.
Trial 21 finished with value: 1.0 and parameters: {'n_layers': 1, 'weight_decay': 3.498816855486263e-09, 'n_units_l0': 8, 'optimizer': 'SGD', 'sgd_opt_learning_rate': 0.07282548335616791, 'sgd_opt_momentum': 0.0004896016485625718}. Best is trial 0 with value: 1.0.
Trial 22 finished with value: 1.0 and parameters: {'n_layers': 1, 'weight_decay': 8.087059858083062e-09, 'n_units_l0': 4, 'optimizer': 'SGD', 'sgd_opt_learning_rate': 0.011965964394755526, 'sgd_opt_momentum': 0.001876606076367596}. Best is trial 0 with value: 1.0.
Trial 23 finished with value: 1.0 and parameters: {'n_layers': 1, 'weight_decay': 3.1821320012545395e-10, 'n_units_l0': 12, 'optimizer': 'SGD', 'sgd_opt_learning_rate': 0.013024308833638133, 'sgd_opt_momentum': 8.154758620718461e-05}. Best is trial 0 with value: 1.0.
Trial 24 finished with value: 1.0 and parameters: {'n_layers': 1, 'weight_decay': 3.2999875901007954e-09, 'n_units_l0': 20, 'optimizer': 'SGD', 'sgd_opt_learning_rate': 0.07768324360545296, 'sgd_opt_momentum': 0.009157320720394456}. Best is trial 0 with value: 1.0.
Trial 25 finished with value: 1.0 and parameters: {'n_layers': 1, 'weight_decay': 3.3409978941298244e-08, 'n_units_l0': 6, 'optimizer': 'Adam', 'adam_learning_rate': 0.003980924602850227}. Best is trial 0 with value: 1.0.
Trial 26 finished with value: 1.0 and parameters: {'n_layers': 2, 'weight_decay': 1.605990137301106e-07, 'n_units_l0': 30, 'n_units_l1': 7, 'optimizer': 'SGD', 'sgd_opt_learning_rate': 0.008444264780324194, 'sgd_opt_momentum': 0.000144921903059792}. Best is trial 0 with value: 1.0.
Trial 27 finished with value: 1.0 and parameters: {'n_layers': 1, 'weight_decay': 3.4089622897381256e-09, 'n_units_l0': 10, 'optimizer': 'SGD', 'sgd_opt_learning_rate': 0.0005538375919854351, 'sgd_opt_momentum': 0.0006636323879604793}. Best is trial 0 with value: 1.0.
Trial 28 finished with value: 1.0 and parameters: {'n_layers': 2, 'weight_decay': 8.519825457193538e-07, 'n_units_l0': 16, 'n_units_l1': 15, 'optimizer': 'RMSprop', 'rmsprop_learning_rate': 5.628231317192158e-05, 'rmsprop_weight_decay': 0.9146964248379131, 'rmsprop_momentum': 0.0003497282944480975}. Best is trial 0 with value: 1.0.
Trial 29 finished with value: 1.0 and parameters: {'n_layers': 2, 'weight_decay': 4.685222275003548e-10, 'n_units_l0': 12, 'n_units_l1': 47, 'optimizer': 'Adam', 'adam_learning_rate': 0.00010031396113895839}. Best is trial 0 with value: 1.0.
Trial 30 finished with value: 1.0 and parameters: {'n_layers': 1, 'weight_decay': 8.439966159660558e-09, 'n_units_l0': 45, 'optimizer': 'RMSprop', 'rmsprop_learning_rate': 0.057907143952444486, 'rmsprop_weight_decay': 0.8586208438593443, 'rmsprop_momentum': 0.06689130965614964}. Best is trial 0 with value: 1.0.
Trial 31 finished with value: 1.0 and parameters: {'n_layers': 2, 'weight_decay': 1.040444214752147e-07, 'n_units_l0': 16, 'n_units_l1': 12, 'optimizer': 'RMSprop', 'rmsprop_learning_rate': 0.0025946053109353814, 'rmsprop_weight_decay': 0.8521926962303592, 'rmsprop_momentum': 0.002212675796515109}. Best is trial 0 with value: 1.0.
Trial 32 finished with value: 1.0 and parameters: {'n_layers': 2, 'weight_decay': 1.6947731728036327e-08, 'n_units_l0': 14, 'n_units_l1': 10, 'optimizer': 'RMSprop', 'rmsprop_learning_rate': 0.001518609744683621, 'rmsprop_weight_decay': 0.891864682635068, 'rmsprop_momentum': 0.000900579095686507}. Best is trial 0 with value: 1.0.
Trial 33 finished with value: 1.0 and parameters: {'n_layers': 2, 'weight_decay': 4.331377127826015e-08, 'n_units_l0': 70, 'n_units_l1': 7, 'optimizer': 'RMSprop', 'rmsprop_learning_rate': 0.006823663704561901, 'rmsprop_weight_decay': 0.9413137617626617, 'rmsprop_momentum': 0.06462365048158078}. Best is trial 0 with value: 1.0.
Trial 34 finished with value: 1.0 and parameters: {'n_layers': 3, 'weight_decay': 3.81054899924561e-09, 'n_units_l0': 5, 'n_units_l1': 19, 'n_units_l2': 14, 'optimizer': 'RMSprop', 'rmsprop_learning_rate': 0.00018545816918329395, 'rmsprop_weight_decay': 0.8814760528554609, 'rmsprop_momentum': 0.00016411976566843233}. Best is trial 0 with value: 1.0.
Trial 35 finished with value: 1.0 and parameters: {'n_layers': 1, 'weight_decay': 1.6969165685878892e-09, 'n_units_l0': 7, 'optimizer': 'SGD', 'sgd_opt_learning_rate': 0.03041753501685301, 'sgd_opt_momentum': 4.617510122119658e-05}. Best is trial 0 with value: 1.0.
Trial 36 finished with value: 1.0 and parameters: {'n_layers': 2, 'weight_decay': 2.967754538611426e-07, 'n_units_l0': 9, 'n_units_l1': 5, 'optimizer': 'RMSprop', 'rmsprop_learning_rate': 0.014601449316298391, 'rmsprop_weight_decay': 0.9229942551375752, 'rmsprop_momentum': 0.006469681057150831}. Best is trial 0 with value: 1.0.
Trial 37 finished with value: 1.0 and parameters: {'n_layers': 3, 'weight_decay': 4.784863208198537e-06, 'n_units_l0': 27, 'n_units_l1': 13, 'n_units_l2': 98, 'optimizer': 'Adam', 'adam_learning_rate': 1.6160734664596808e-05}. Best is trial 0 with value: 1.0.
Trial 38 finished with value: 1.0 and parameters: {'n_layers': 1, 'weight_decay': 1.044519117278353e-10, 'n_units_l0': 20, 'optimizer': 'SGD', 'sgd_opt_learning_rate': 0.002970689179279329, 'sgd_opt_momentum': 0.004328219476704482}. Best is trial 0 with value: 1.0.
Trial 39 finished with value: 1.0 and parameters: {'n_layers': 2, 'weight_decay': 1.8041593019168878e-09, 'n_units_l0': 7, 'n_units_l1': 10, 'optimizer': 'Adam', 'adam_learning_rate': 0.0029800050853072244}. Best is trial 0 with value: 1.0.
Trial 40 finished with value: 1.0 and parameters: {'n_layers': 2, 'weight_decay': 0.0007798296922954736, 'n_units_l0': 5, 'n_units_l1': 5, 'optimizer': 'RMSprop', 'rmsprop_learning_rate': 0.0004344792376687812, 'rmsprop_weight_decay': 0.876337370198545, 'rmsprop_momentum': 0.010093927480121933}. Best is trial 0 with value: 1.0.
Trial 41 finished with value: 1.0 and parameters: {'n_layers': 1, 'weight_decay': 9.20581314907398e-09, 'n_units_l0': 118, 'optimizer': 'RMSprop', 'rmsprop_learning_rate': 0.0030360147584160674, 'rmsprop_weight_decay': 0.896942719034822, 'rmsprop_momentum': 1.6874616959975714e-05}. Best is trial 0 with value: 1.0.
Trial 42 finished with value: 1.0 and parameters: {'n_layers': 1, 'weight_decay': 3.556621135334664e-08, 'n_units_l0': 72, 'optimizer': 'RMSprop', 'rmsprop_learning_rate': 0.0006718271686418814, 'rmsprop_weight_decay': 0.8663935898279594, 'rmsprop_momentum': 6.898191064054504e-05}. Best is trial 0 with value: 1.0.
Trial 43 finished with value: 1.0 and parameters: {'n_layers': 1, 'weight_decay': 6.033685078976441e-09, 'n_units_l0': 36, 'optimizer': 'RMSprop', 'rmsprop_learning_rate': 0.00019093641406273123, 'rmsprop_weight_decay': 0.9071799850991504, 'rmsprop_momentum': 0.0020200419652188764}. Best is trial 0 with value: 1.0.
Trial 44 finished with value: 1.0 and parameters: {'n_layers': 1, 'weight_decay': 1.2765057273071005e-09, 'n_units_l0': 14, 'optimizer': 'Adam', 'adam_learning_rate': 0.0001691355144987622}. Best is trial 0 with value: 1.0.
Trial 45 finished with value: 1.0 and parameters: {'n_layers': 1, 'weight_decay': 2.3503387972536604e-10, 'n_units_l0': 87, 'optimizer': 'SGD', 'sgd_opt_learning_rate': 0.02285901893596097, 'sgd_opt_momentum': 0.029569105681187948}. Best is trial 0 with value: 1.0.
Trial 46 finished with value: 1.0 and parameters: {'n_layers': 2, 'weight_decay': 1.5805901774714658e-08, 'n_units_l0': 10, 'n_units_l1': 26, 'optimizer': 'RMSprop', 'rmsprop_learning_rate': 0.008870065909482727, 'rmsprop_weight_decay': 0.9325168118883731, 'rmsprop_momentum': 6.966928161524965e-05}. Best is trial 0 with value: 1.0.
Trial 47 finished with value: 1.0 and parameters: {'n_layers': 3, 'weight_decay': 1.1298864557980681e-07, 'n_units_l0': 47, 'n_units_l1': 127, 'n_units_l2': 36, 'optimizer': 'Adam', 'adam_learning_rate': 0.0015587135880414903}. Best is trial 0 with value: 1.0.
Trial 48 finished with value: 1.0 and parameters: {'n_layers': 1, 'weight_decay': 4.4411527455959645e-05, 'n_units_l0': 8, 'optimizer': 'SGD', 'sgd_opt_learning_rate': 0.0001560094970711315, 'sgd_opt_momentum': 0.0003313571342028418}. Best is trial 0 with value: 1.0.
Trial 49 finished with value: 1.0 and parameters: {'n_layers': 1, 'weight_decay': 8.289353456499155e-10, 'n_units_l0': 6, 'optimizer': 'SGD', 'sgd_opt_learning_rate': 0.00443721195289565, 'sgd_opt_momentum': 1.268965150237631e-05}. Best is trial 0 with value: 1.0.
Trial 50 finished with value: 1.0 and parameters: {'n_layers': 2, 'weight_decay': 1.4489629281860919e-06, 'n_units_l0': 100, 'n_units_l1': 16, 'optimizer': 'Adam', 'adam_learning_rate': 0.0871703056828509}. Best is trial 0 with value: 1.0.
Trial 51 finished with value: 1.0 and parameters: {'n_layers': 3, 'weight_decay': 2.658858710434421e-07, 'n_units_l0': 5, 'n_units_l1': 9, 'n_units_l2': 50, 'optimizer': 'SGD', 'sgd_opt_learning_rate': 0.0005981973001797986, 'sgd_opt_momentum': 3.5123153142791704e-05}. Best is trial 0 with value: 1.0.
Trial 52 finished with value: 1.0 and parameters: {'n_layers': 3, 'weight_decay': 6.3897361508312e-08, 'n_units_l0': 4, 'n_units_l1': 9, 'n_units_l2': 53, 'optimizer': 'SGD', 'sgd_opt_learning_rate': 0.00018587213723233797, 'sgd_opt_momentum': 1.0038089970082763e-05}. Best is trial 0 with value: 1.0.
Trial 53 finished with value: 1.0 and parameters: {'n_layers': 2, 'weight_decay': 1.3452520809456763e-08, 'n_units_l0': 8, 'n_units_l1': 5, 'optimizer': 'SGD', 'sgd_opt_learning_rate': 1.7795408297207667e-05, 'sgd_opt_momentum': 0.00015099713017759986}. Best is trial 0 with value: 1.0.
Trial 54 finished with value: 1.0 and parameters: {'n_layers': 3, 'weight_decay': 2.384603139914294e-08, 'n_units_l0': 23, 'n_units_l1': 12, 'n_units_l2': 22, 'optimizer': 'SGD', 'sgd_opt_learning_rate': 0.0009626206315548003, 'sgd_opt_momentum': 3.492668369929461e-05}. Best is trial 0 with value: 1.0.
Trial 55 finished with value: 1.0 and parameters: {'n_layers': 1, 'weight_decay': 2.337280716961297e-09, 'n_units_l0': 14, 'optimizer': 'SGD', 'sgd_opt_learning_rate': 3.511720212374946e-05, 'sgd_opt_momentum': 6.029892960655268e-05}. Best is trial 0 with value: 1.0.
Trial 56 finished with value: 1.0 and parameters: {'n_layers': 2, 'weight_decay': 4.5590598328861866e-10, 'n_units_l0': 11, 'n_units_l1': 24, 'optimizer': 'SGD', 'sgd_opt_learning_rate': 6.76801553323861e-05, 'sgd_opt_momentum': 1.8700890630808806e-05}. Best is trial 0 with value: 1.0.
Trial 57 finished with value: 1.0 and parameters: {'n_layers': 1, 'weight_decay': 6.239241034769906e-09, 'n_units_l0': 54, 'optimizer': 'RMSprop', 'rmsprop_learning_rate': 0.00020538699286760695, 'rmsprop_weight_decay': 0.8768449611412746, 'rmsprop_momentum': 0.0005735069873870689}. Best is trial 0 with value: 1.0.
Trial 58 finished with value: 1.0 and parameters: {'n_layers': 1, 'weight_decay': 7.859368253574553e-08, 'n_units_l0': 18, 'optimizer': 'Adam', 'adam_learning_rate': 3.3268818778286274e-05}. Best is trial 0 with value: 1.0.
Trial 59 finished with value: 1.0 and parameters: {'n_layers': 3, 'weight_decay': 5.417778758990853e-07, 'n_units_l0': 9, 'n_units_l1': 6, 'n_units_l2': 67, 'optimizer': 'SGD', 'sgd_opt_learning_rate': 0.000312177547619454, 'sgd_opt_momentum': 0.0008631011793807104}. Best is trial 0 with value: 1.0.
Trial 60 finished with value: 1.0 and parameters: {'n_layers': 2, 'weight_decay': 4.008729379557451e-08, 'n_units_l0': 7, 'n_units_l1': 8, 'optimizer': 'RMSprop', 'rmsprop_learning_rate': 1.1918641287323986e-05, 'rmsprop_weight_decay': 0.896941141319847, 'rmsprop_momentum': 0.019689432247192898}. Best is trial 0 with value: 1.0.
Trial 61 finished with value: 1.0 and parameters: {'n_layers': 2, 'weight_decay': 8.897991235634172e-10, 'n_units_l0': 67, 'n_units_l1': 6, 'optimizer': 'SGD', 'sgd_opt_learning_rate': 0.041061644405662734, 'sgd_opt_momentum': 0.0016545937019950138}. Best is trial 0 with value: 1.0.
Trial 62 finished with value: 1.0 and parameters: {'n_layers': 2, 'weight_decay': 5.049296035501376e-09, 'n_units_l0': 127, 'n_units_l1': 13, 'optimizer': 'SGD', 'sgd_opt_learning_rate': 0.041169480924341896, 'sgd_opt_momentum': 0.0019361879220053282}. Best is trial 0 with value: 1.0.
Trial 63 finished with value: 1.0 and parameters: {'n_layers': 2, 'weight_decay': 2.9792139533340876e-09, 'n_units_l0': 82, 'n_units_l1': 19, 'optimizer': 'SGD', 'sgd_opt_learning_rate': 0.020119346064184605, 'sgd_opt_momentum': 0.00023546345077173837}. Best is trial 0 with value: 1.0.
Trial 64 finished with value: 1.0 and parameters: {'n_layers': 2, 'weight_decay': 5.992364180988046e-10, 'n_units_l0': 57, 'n_units_l1': 4, 'optimizer': 'SGD', 'sgd_opt_learning_rate': 0.09954385885907403, 'sgd_opt_momentum': 2.5093667075232124e-05}. Best is trial 0 with value: 1.0.
Trial 65 finished with value: 1.0 and parameters: {'n_layers': 2, 'weight_decay': 1.769158337932446e-07, 'n_units_l0': 40, 'n_units_l1': 11, 'optimizer': 'SGD', 'sgd_opt_learning_rate': 0.0012538959399046611, 'sgd_opt_momentum': 0.00039470034889766136}. Best is trial 0 with value: 1.0.
Trial 66 finished with value: 1.0 and parameters: {'n_layers': 1, 'weight_decay': 1.305278835089452e-10, 'n_units_l0': 95, 'optimizer': 'Adam', 'adam_learning_rate': 0.009269850195554673}. Best is trial 0 with value: 1.0.
Trial 67 finished with value: 1.0 and parameters: {'n_layers': 2, 'weight_decay': 1.0794170089678834e-08, 'n_units_l0': 13, 'n_units_l1': 15, 'optimizer': 'RMSprop', 'rmsprop_learning_rate': 0.0035420643778662853, 'rmsprop_weight_decay': 0.8669310016625974, 'rmsprop_momentum': 0.003316404086177719}. Best is trial 0 with value: 1.0.
Trial 68 finished with value: 1.0 and parameters: {'n_layers': 2, 'weight_decay': 2.3868907665354882e-08, 'n_units_l0': 30, 'n_units_l1': 8, 'optimizer': 'SGD', 'sgd_opt_learning_rate': 0.003749653565785312, 'sgd_opt_momentum': 0.00010453287610195485}. Best is trial 0 with value: 1.0.
Trial 69 finished with value: 1.0 and parameters: {'n_layers': 1, 'weight_decay': 1.873592674555874e-09, 'n_units_l0': 6, 'optimizer': 'RMSprop', 'rmsprop_learning_rate': 0.0191024051464449, 'rmsprop_weight_decay': 0.8510604681148294, 'rmsprop_momentum': 2.413433149324379e-05}. Best is trial 0 with value: 1.0.
Trial 70 finished with value: 1.0 and parameters: {'n_layers': 3, 'weight_decay': 3.2504684354174436e-10, 'n_units_l0': 17, 'n_units_l1': 92, 'n_units_l2': 11, 'optimizer': 'Adam', 'adam_learning_rate': 0.00030606529290362454}. Best is trial 0 with value: 1.0.
Trial 71 finished with value: 1.0 and parameters: {'n_layers': 3, 'weight_decay': 3.733720737606716e-05, 'n_units_l0': 31, 'n_units_l1': 38, 'n_units_l2': 5, 'optimizer': 'Adam', 'adam_learning_rate': 1.1180595702583303e-05}. Best is trial 0 with value: 1.0.
Trial 72 finished with value: 1.0 and parameters: {'n_layers': 3, 'weight_decay': 1.1957371646415458e-05, 'n_units_l0': 22, 'n_units_l1': 35, 'n_units_l2': 7, 'optimizer': 'Adam', 'adam_learning_rate': 3.652554158946211e-05}. Best is trial 0 with value: 1.0.
Trial 73 finished with value: 1.0 and parameters: {'n_layers': 3, 'weight_decay': 1.2466550667673995e-06, 'n_units_l0': 26, 'n_units_l1': 22, 'n_units_l2': 11, 'optimizer': 'Adam', 'adam_learning_rate': 1.0827825148564785e-05}. Best is trial 0 with value: 1.0.
Trial 74 finished with value: 1.0 and parameters: {'n_layers': 3, 'weight_decay': 4.614029645354346e-09, 'n_units_l0': 62, 'n_units_l1': 45, 'n_units_l2': 34, 'optimizer': 'Adam', 'adam_learning_rate': 7.996174482117804e-05}. Best is trial 0 with value: 1.0.
Trial 75 finished with value: 1.0 and parameters: {'n_layers': 1, 'weight_decay': 0.00011074386116547906, 'n_units_l0': 34, 'optimizer': 'SGD', 'sgd_opt_learning_rate': 0.004994901874913356, 'sgd_opt_momentum': 0.0011311466690333517}. Best is trial 0 with value: 1.0.
Trial 76 finished with value: 1.0 and parameters: {'n_layers': 2, 'weight_decay': 5.281361631194385e-06, 'n_units_l0': 76, 'n_units_l1': 6, 'optimizer': 'RMSprop', 'rmsprop_learning_rate': 0.0012504492669883117, 'rmsprop_weight_decay': 0.884781134333909, 'rmsprop_momentum': 0.03202888004893537}. Best is trial 0 with value: 1.0.
