Trial 77 finished with value: 1.0 and parameters: {'n_layers': 3, 'weight_decay': 1.1608798177084767e-09, 'n_units_l0': 42, 'n_units_l1': 28, 'n_units_l2': 6, 'optimizer': 'Adam', 'adam_learning_rate': 2.377280031761762e-05}. Best is trial 0 with value: 1.0.
Trial 78 finished with value: 1.0 and parameters: {'n_layers': 1, 'weight_decay': 7.609143322112741e-09, 'n_units_l0': 106, 'optimizer': 'SGD', 'sgd_opt_learning_rate': 0.05498108781397483, 'sgd_opt_momentum': 0.0032487165884533546}. Best is trial 0 with value: 1.0.
Trial 79 finished with value: 1.0 and parameters: {'n_layers': 2, 'weight_decay': 1.6886125126807375e-07, 'n_units_l0': 11, 'n_units_l1': 17, 'optimizer': 'RMSprop', 'rmsprop_learning_rate': 0.08668193294433497, 'rmsprop_weight_decay': 0.908572068551903, 'rmsprop_momentum': 0.00018545897964885731}. Best is trial 0 with value: 1.0.
Trial 80 finished with value: 1.0 and parameters: {'n_layers': 1, 'weight_decay': 2.387729191161463e-06, 'n_units_l0': 4, 'optimizer': 'SGD', 'sgd_opt_learning_rate': 0.001563537970759068, 'sgd_opt_momentum': 0.013707920388721618}. Best is trial 0 with value: 1.0.
Trial 81 finished with value: 1.0 and parameters: {'n_layers': 1, 'weight_decay': 7.4918886896487e-05, 'n_units_l0': 5, 'optimizer': 'Adam', 'adam_learning_rate': 0.011373243036575217}. Best is trial 0 with value: 1.0.
Trial 82 finished with value: 1.0 and parameters: {'n_layers': 1, 'weight_decay': 1.1908763958644308e-05, 'n_units_l0': 8, 'optimizer': 'Adam', 'adam_learning_rate': 0.032802136668926285}. Best is trial 0 with value: 1.0.
Trial 83 finished with value: 1.0 and parameters: {'n_layers': 1, 'weight_decay': 1.3237416085852883e-05, 'n_units_l0': 7, 'optimizer': 'Adam', 'adam_learning_rate': 0.0010699951096031833}. Best is trial 0 with value: 1.0.
Trial 84 finished with value: 1.0 and parameters: {'n_layers': 1, 'weight_decay': 4.933042941604708e-07, 'n_units_l0': 20, 'optimizer': 'Adam', 'adam_learning_rate': 0.019358456322062435}. Best is trial 0 with value: 1.0.
Trial 85 finished with value: 1.0 and parameters: {'n_layers': 1, 'weight_decay': 5.881234840100084e-06, 'n_units_l0': 11, 'optimizer': 'Adam', 'adam_learning_rate': 6.453801508130441e-05}. Best is trial 0 with value: 1.0.
Trial 86 finished with value: 1.0 and parameters: {'n_layers': 2, 'weight_decay': 2.6416041920770178e-09, 'n_units_l0': 9, 'n_units_l1': 62, 'optimizer': 'RMSprop', 'rmsprop_learning_rate': 0.0003420737639296447, 'rmsprop_weight_decay': 0.9887345367940543, 'rmsprop_momentum': 6.141959162508458e-05}. Best is trial 0 with value: 1.0.
Trial 87 finished with value: 1.0 and parameters: {'n_layers': 1, 'weight_decay': 0.0001377840357874996, 'n_units_l0': 10, 'optimizer': 'SGD', 'sgd_opt_learning_rate': 1.055745825028891e-05, 'sgd_opt_momentum': 0.00021439935468543634}. Best is trial 0 with value: 1.0.
Trial 88 finished with value: 1.0 and parameters: {'n_layers': 2, 'weight_decay': 2.3134728771986273e-08, 'n_units_l0': 15, 'n_units_l1': 8, 'optimizer': 'SGD', 'sgd_opt_learning_rate': 0.014923052973490713, 'sgd_opt_momentum': 2.1441140872255352e-05}. Best is trial 0 with value: 1.0.
Trial 89 finished with value: 1.0 and parameters: {'n_layers': 1, 'weight_decay': 1.194556066373538e-07, 'n_units_l0': 6, 'optimizer': 'Adam', 'adam_learning_rate': 0.0042560185322969585}. Best is trial 0 with value: 1.0.
Trial 90 finished with value: 1.0 and parameters: {'n_layers': 3, 'weight_decay': 5.029439079776025e-08, 'n_units_l0': 28, 'n_units_l1': 14, 'n_units_l2': 16, 'optimizer': 'RMSprop', 'rmsprop_learning_rate': 6.700419932418695e-05, 'rmsprop_weight_decay': 0.8679887675778142, 'rmsprop_momentum': 0.0041960023481903185}. Best is trial 0 with value: 1.0.
Trial 91 finished with value: 1.0 and parameters: {'n_layers': 3, 'weight_decay': 4.180565962068955e-05, 'n_units_l0': 9, 'n_units_l1': 19, 'n_units_l2': 4, 'optimizer': 'RMSprop', 'rmsprop_learning_rate': 1.7055371404531548e-05, 'rmsprop_weight_decay': 0.9578030985986821, 'rmsprop_momentum': 0.013553805063885236}. Best is trial 0 with value: 1.0.
Trial 92 finished with value: 1.0 and parameters: {'n_layers': 3, 'weight_decay': 2.1478088892970997e-05, 'n_units_l0': 7, 'n_units_l1': 11, 'n_units_l2': 8, 'optimizer': 'RMSprop', 'rmsprop_learning_rate': 3.6057167433029176e-05, 'rmsprop_weight_decay': 0.9444882997798456, 'rmsprop_momentum': 0.025246338118402812}. Best is trial 0 with value: 1.0.
Trial 93 finished with value: 1.0 and parameters: {'n_layers': 3, 'weight_decay': 3.4216655041784987e-06, 'n_units_l0': 12, 'n_units_l1': 10, 'n_units_l2': 4, 'optimizer': 'RMSprop', 'rmsprop_learning_rate': 8.494042270441333e-05, 'rmsprop_weight_decay': 0.9641998475627268, 'rmsprop_momentum': 0.001382002524741426}. Best is trial 0 with value: 1.0.
Trial 94 finished with value: 1.0 and parameters: {'n_layers': 3, 'weight_decay': 8.773273742131592e-06, 'n_units_l0': 90, 'n_units_l1': 30, 'n_units_l2': 8, 'optimizer': 'RMSprop', 'rmsprop_learning_rate': 0.005856259341431338, 'rmsprop_weight_decay': 0.9232297118207538, 'rmsprop_momentum': 0.007101587974606525}. Best is trial 0 with value: 1.0.
Trial 95 finished with value: 1.0 and parameters: {'n_layers': 3, 'weight_decay': 1.1855208424790798e-08, 'n_units_l0': 8, 'n_units_l1': 17, 'n_units_l2': 5, 'optimizer': 'SGD', 'sgd_opt_learning_rate': 0.0003431978487178257, 'sgd_opt_momentum': 0.03572031671016651}. Best is trial 0 with value: 1.0.
Trial 96 finished with value: 1.0 and parameters: {'n_layers': 2, 'weight_decay': 7.661461799660471e-10, 'n_units_l0': 13, 'n_units_l1': 7, 'optimizer': 'RMSprop', 'rmsprop_learning_rate': 0.0007888937070362168, 'rmsprop_weight_decay': 0.9527898779691779, 'rmsprop_momentum': 0.035686970903233785}. Best is trial 0 with value: 1.0.
Trial 97 finished with value: 1.0 and parameters: {'n_layers': 1, 'weight_decay': 1.2404373383057582e-09, 'n_units_l0': 49, 'optimizer': 'SGD', 'sgd_opt_learning_rate': 0.007172449778270734, 'sgd_opt_momentum': 0.0006426978701486008}. Best is trial 0 with value: 1.0.
Trial 98 finished with value: 1.0 and parameters: {'n_layers': 3, 'weight_decay': 4.627911167975759e-09, 'n_units_l0': 10, 'n_units_l1': 20, 'n_units_l2': 34, 'optimizer': 'Adam', 'adam_learning_rate': 0.00017331336845954553}. Best is trial 0 with value: 1.0.
Trial 99 finished with value: 1.0 and parameters: {'n_layers': 2, 'weight_decay': 2.3369832207788544e-05, 'n_units_l0': 18, 'n_units_l1': 9, 'optimizer': 'SGD', 'sgd_opt_learning_rate': 8.82866540406371e-05, 'sgd_opt_momentum': 6.606962042038302e-05}. Best is trial 0 with value: 1.0.
