Trial 432 finished with value: 0.5043333172798157 and parameters: {'n_layers': 1, 'weight_decay': 1.2621029880904735e-06, 'n_units_l0': 1, 'optimizer': 'RMSprop', 'rmsprop_learning_rate': 3.1680384373380816e-05, 'rmsprop_weight_decay': 0.9176460201284106, 'rmsprop_momentum': 1.1430353930290485e-05}. Best is trial 15 with value: 0.6914615631103516.
Trial 433 finished with value: 0.5043333172798157 and parameters: {'n_layers': 1, 'weight_decay': 4.982877350703542e-05, 'n_units_l0': 1, 'optimizer': 'RMSprop', 'rmsprop_learning_rate': 1.669696429980052e-05, 'rmsprop_weight_decay': 0.9612380001427008, 'rmsprop_momentum': 2.5102985898984957e-05}. Best is trial 15 with value: 0.6914615631103516.
Trial 434 finished with value: 0.512333333492279 and parameters: {'n_layers': 1, 'weight_decay': 2.547277351212945e-06, 'n_units_l0': 1, 'optimizer': 'RMSprop', 'rmsprop_learning_rate': 4.509204580317012e-05, 'rmsprop_weight_decay': 0.9897623521280252, 'rmsprop_momentum': 0.0001265385175890118}. Best is trial 15 with value: 0.6914615631103516.
Trial 435 finished with value: 0.5043333172798157 and parameters: {'n_layers': 1, 'weight_decay': 1.7556570028426803e-06, 'n_units_l0': 1, 'optimizer': 'RMSprop', 'rmsprop_learning_rate': 4.741718078689484e-05, 'rmsprop_weight_decay': 0.981367902723909, 'rmsprop_momentum': 0.0001431351755400336}. Best is trial 15 with value: 0.6914615631103516.
Trial 436 finished with value: 0.5043333172798157 and parameters: {'n_layers': 1, 'weight_decay': 3.8239513383672434e-06, 'n_units_l0': 1, 'optimizer': 'RMSprop', 'rmsprop_learning_rate': 2.2790961224160574e-05, 'rmsprop_weight_decay': 0.9723549886218009, 'rmsprop_momentum': 0.0004265843971280145}. Best is trial 15 with value: 0.6914615631103516.
Trial 437 finished with value: 0.5043333172798157 and parameters: {'n_layers': 1, 'weight_decay': 2.5361878151529414e-06, 'n_units_l0': 1, 'optimizer': 'RMSprop', 'rmsprop_learning_rate': 2.9086489555997533e-05, 'rmsprop_weight_decay': 0.98971824729248, 'rmsprop_momentum': 4.844398791420257e-05}. Best is trial 15 with value: 0.6914615631103516.
Trial 438 finished with value: 0.5043333172798157 and parameters: {'n_layers': 1, 'weight_decay': 2.8256257373821997e-06, 'n_units_l0': 1, 'optimizer': 'RMSprop', 'rmsprop_learning_rate': 1.1704133526291811e-05, 'rmsprop_weight_decay': 0.9867895912782861, 'rmsprop_momentum': 2.0305218240744693e-05}. Best is trial 15 with value: 0.6914615631103516.
Trial 439 finished with value: 0.5043333172798157 and parameters: {'n_layers': 1, 'weight_decay': 1.612272960726869e-06, 'n_units_l0': 1, 'optimizer': 'RMSprop', 'rmsprop_learning_rate': 0.00010073827643307155, 'rmsprop_weight_decay': 0.977830212246532, 'rmsprop_momentum': 0.00012504025712358713}. Best is trial 15 with value: 0.6914615631103516.
Trial 440 finished with value: 0.5043333172798157 and parameters: {'n_layers': 1, 'weight_decay': 5.413737352749614e-07, 'n_units_l0': 1, 'optimizer': 'RMSprop', 'rmsprop_learning_rate': 4.150456442400739e-05, 'rmsprop_weight_decay': 0.9756269578794937, 'rmsprop_momentum': 7.890486895382002e-05}. Best is trial 15 with value: 0.6914615631103516.
Trial 441 finished with value: 0.5043333172798157 and parameters: {'n_layers': 1, 'weight_decay': 4.766582285712599e-08, 'n_units_l0': 1, 'optimizer': 'RMSprop', 'rmsprop_learning_rate': 1.7476232000400394e-05, 'rmsprop_weight_decay': 0.9682041731989166, 'rmsprop_momentum': 3.50968925313259e-05}. Best is trial 15 with value: 0.6914615631103516.
Trial 442 finished with value: 0.5043333172798157 and parameters: {'n_layers': 1, 'weight_decay': 2.136741876377965e-06, 'n_units_l0': 1, 'optimizer': 'RMSprop', 'rmsprop_learning_rate': 1.4331794459656905e-05, 'rmsprop_weight_decay': 0.9798880737521842, 'rmsprop_momentum': 9.448693893552967e-05}. Best is trial 15 with value: 0.6914615631103516.
Trial 443 finished with value: 0.5043333172798157 and parameters: {'n_layers': 1, 'weight_decay': 1.5906940424655405e-07, 'n_units_l0': 1, 'optimizer': 'SGD', 'sgd_opt_learning_rate': 0.00033614814848705385, 'sgd_opt_momentum': 0.00013610041300487447}. Best is trial 15 with value: 0.6914615631103516.
Trial 444 finished with value: 0.5043333172798157 and parameters: {'n_layers': 1, 'weight_decay': 0.000985883835651598, 'n_units_l0': 1, 'optimizer': 'RMSprop', 'rmsprop_learning_rate': 2.3132858006350154e-05, 'rmsprop_weight_decay': 0.9831904753101458, 'rmsprop_momentum': 6.56684026566437e-05}. Best is trial 15 with value: 0.6914615631103516.
Trial 445 finished with value: 0.5043333172798157 and parameters: {'n_layers': 1, 'weight_decay': 1.0528955574376958e-06, 'n_units_l0': 1, 'optimizer': 'SGD', 'sgd_opt_learning_rate': 8.656322231675301e-05, 'sgd_opt_momentum': 0.026680751363605815}. Best is trial 15 with value: 0.6914615631103516.
Trial 446 finished with value: 0.5043333172798157 and parameters: {'n_layers': 1, 'weight_decay': 1.0008600870934404e-07, 'n_units_l0': 1, 'optimizer': 'SGD', 'sgd_opt_learning_rate': 3.249627800570674e-05, 'sgd_opt_momentum': 0.0023136255891908824}. Best is trial 15 with value: 0.6914615631103516.
Trial 447 finished with value: 0.5086666941642761 and parameters: {'n_layers': 1, 'weight_decay': 4.084697514050093e-07, 'n_units_l0': 1, 'optimizer': 'RMSprop', 'rmsprop_learning_rate': 3.445696365964852e-05, 'rmsprop_weight_decay': 0.9557768723008148, 'rmsprop_momentum': 5.284085531212306e-05}. Best is trial 15 with value: 0.6914615631103516.
Trial 448 finished with value: 0.5043333172798157 and parameters: {'n_layers': 1, 'weight_decay': 3.1883051503467363e-07, 'n_units_l0': 1, 'optimizer': 'RMSprop', 'rmsprop_learning_rate': 3.733990768091209e-05, 'rmsprop_weight_decay': 0.9568326277416309, 'rmsprop_momentum': 3.8469901747441495e-05}. Best is trial 15 with value: 0.6914615631103516.
Trial 449 finished with value: 0.5043333172798157 and parameters: {'n_layers': 1, 'weight_decay': 4.3361571786979533e-07, 'n_units_l0': 1, 'optimizer': 'RMSprop', 'rmsprop_learning_rate': 2.763555978880832e-05, 'rmsprop_weight_decay': 0.9510324062517792, 'rmsprop_momentum': 5.2467418492201855e-05}. Best is trial 15 with value: 0.6914615631103516.
Trial 450 finished with value: 0.5043333172798157 and parameters: {'n_layers': 1, 'weight_decay': 5.590062109272842e-07, 'n_units_l0': 1, 'optimizer': 'RMSprop', 'rmsprop_learning_rate': 5.604544981208196e-05, 'rmsprop_weight_decay': 0.9543120179921565, 'rmsprop_momentum': 0.00022976061487795166}. Best is trial 15 with value: 0.6914615631103516.
Trial 451 finished with value: 0.5043333172798157 and parameters: {'n_layers': 1, 'weight_decay': 7.438275095459898e-07, 'n_units_l0': 1, 'optimizer': 'RMSprop', 'rmsprop_learning_rate': 1.9370678684201977e-05, 'rmsprop_weight_decay': 0.9457326871770841, 'rmsprop_momentum': 7.770444537909565e-05}. Best is trial 15 with value: 0.6914615631103516.
Trial 452 finished with value: 0.5043333172798157 and parameters: {'n_layers': 1, 'weight_decay': 1.9901395762172498e-07, 'n_units_l0': 1, 'optimizer': 'RMSprop', 'rmsprop_learning_rate': 3.312903277660239e-05, 'rmsprop_weight_decay': 0.965708362797607, 'rmsprop_momentum': 2.8244374256993068e-05}. Best is trial 15 with value: 0.6914615631103516.
Trial 453 finished with value: 0.5043333172798157 and parameters: {'n_layers': 1, 'weight_decay': 3.3443554256942367e-07, 'n_units_l0': 1, 'optimizer': 'RMSprop', 'rmsprop_learning_rate': 1.2546566970715805e-05, 'rmsprop_weight_decay': 0.9629054466166943, 'rmsprop_momentum': 0.00016486574520300026}. Best is trial 15 with value: 0.6914615631103516.
Trial 454 finished with value: 0.5043333172798157 and parameters: {'n_layers': 1, 'weight_decay': 4.0120230811302657e-07, 'n_units_l0': 1, 'optimizer': 'RMSprop', 'rmsprop_learning_rate': 8.103711188142867e-05, 'rmsprop_weight_decay': 0.9705710924145852, 'rmsprop_momentum': 4.2462510234844976e-05}. Best is trial 15 with value: 0.6914615631103516.
Trial 455 finished with value: 0.5043333172798157 and parameters: {'n_layers': 1, 'weight_decay': 2.524371996470204e-07, 'n_units_l0': 1, 'optimizer': 'RMSprop', 'rmsprop_learning_rate': 2.361064715436581e-05, 'rmsprop_weight_decay': 0.9847306441308346, 'rmsprop_momentum': 5.734084259191009e-05}. Best is trial 15 with value: 0.6914615631103516.
Trial 456 finished with value: 0.5043333172798157 and parameters: {'n_layers': 1, 'weight_decay': 2.9639777420867432e-06, 'n_units_l0': 1, 'optimizer': 'SGD', 'sgd_opt_learning_rate': 0.00011438006912163595, 'sgd_opt_momentum': 3.3366406039782484e-05}. Best is trial 15 with value: 0.6914615631103516.
Trial 457 finished with value: 0.5043333172798157 and parameters: {'n_layers': 1, 'weight_decay': 1.4547300068311856e-06, 'n_units_l0': 1, 'optimizer': 'RMSprop', 'rmsprop_learning_rate': 0.00013609227162426774, 'rmsprop_weight_decay': 0.9771846050538567, 'rmsprop_momentum': 0.00010766665651728567}. Best is trial 15 with value: 0.6914615631103516.
Trial 458 finished with value: 0.5043333172798157 and parameters: {'n_layers': 1, 'weight_decay': 7.322015905432144e-07, 'n_units_l0': 1, 'optimizer': 'SGD', 'sgd_opt_learning_rate': 0.0001695065144416119, 'sgd_opt_momentum': 2.6144393268463834e-05}. Best is trial 15 with value: 0.6914615631103516.
Trial 459 finished with value: 0.5043333172798157 and parameters: {'n_layers': 1, 'weight_decay': 1.056873560241428e-06, 'n_units_l0': 1, 'optimizer': 'SGD', 'sgd_opt_learning_rate': 1.1395705408147519e-05, 'sgd_opt_momentum': 0.0007877215795972314}. Best is trial 15 with value: 0.6914615631103516.
Trial 460 finished with value: 0.5043333172798157 and parameters: {'n_layers': 1, 'weight_decay': 4.876534240648222e-07, 'n_units_l0': 1, 'optimizer': 'RMSprop', 'rmsprop_learning_rate': 1.5974025964904136e-05, 'rmsprop_weight_decay': 0.986136412187748, 'rmsprop_momentum': 3.22527523497019e-05}. Best is trial 15 with value: 0.6914615631103516.
Trial 461 finished with value: 0.5024871826171875 and parameters: {'n_layers': 1, 'weight_decay': 5.779857634236814e-06, 'n_units_l0': 1, 'optimizer': 'SGD', 'sgd_opt_learning_rate': 2.8675889789655106e-05, 'sgd_opt_momentum': 0.06910337553390625}. Best is trial 15 with value: 0.6914615631103516.
Trial 462 finished with value: 0.5043333172798157 and parameters: {'n_layers': 1, 'weight_decay': 1.370520471994729e-07, 'n_units_l0': 1, 'optimizer': 'SGD', 'sgd_opt_learning_rate': 6.160466983280407e-05, 'sgd_opt_momentum': 0.0006215289439943834}. Best is trial 15 with value: 0.6914615631103516.
Trial 463 finished with value: 0.5043333172798157 and parameters: {'n_layers': 1, 'weight_decay': 2.2343315451169603e-07, 'n_units_l0': 1, 'optimizer': 'RMSprop', 'rmsprop_learning_rate': 4.6872500419702185e-05, 'rmsprop_weight_decay': 0.9596031215330009, 'rmsprop_momentum': 2.158861502698186e-05}. Best is trial 15 with value: 0.6914615631103516.
Trial 464 finished with value: 0.5043333172798157 and parameters: {'n_layers': 1, 'weight_decay': 6.9531591309518e-07, 'n_units_l0': 1, 'optimizer': 'SGD', 'sgd_opt_learning_rate': 0.00013954546277922838, 'sgd_opt_momentum': 0.015627709827508274}. Best is trial 15 with value: 0.6914615631103516.
Trial 465 finished with value: 0.5043333172798157 and parameters: {'n_layers': 1, 'weight_decay': 2.0010303962276487e-06, 'n_units_l0': 1, 'optimizer': 'RMSprop', 'rmsprop_learning_rate': 6.276734683957451e-05, 'rmsprop_weight_decay': 0.9896541915257772, 'rmsprop_momentum': 0.002034832055273036}. Best is trial 15 with value: 0.6914615631103516.
Trial 466 finished with value: 0.5043333172798157 and parameters: {'n_layers': 1, 'weight_decay': 3.5822529701387645e-07, 'n_units_l0': 1, 'optimizer': 'SGD', 'sgd_opt_learning_rate': 2.017010628865016e-05, 'sgd_opt_momentum': 0.04312577461373568}. Best is trial 15 with value: 0.6914615631103516.
Trial 467 finished with value: 0.5043333172798157 and parameters: {'n_layers': 1, 'weight_decay': 3.895728126024635e-06, 'n_units_l0': 1, 'optimizer': 'SGD', 'sgd_opt_learning_rate': 3.7536945495134484e-05, 'sgd_opt_momentum': 0.004887286562152755}. Best is trial 15 with value: 0.6914615631103516.
Trial 468 finished with value: 0.5043333172798157 and parameters: {'n_layers': 1, 'weight_decay': 1.6285643539102546e-07, 'n_units_l0': 1, 'optimizer': 'RMSprop', 'rmsprop_learning_rate': 2.945986747704078e-05, 'rmsprop_weight_decay': 0.8898715629285222, 'rmsprop_momentum': 0.0006016859473554074}. Best is trial 15 with value: 0.6914615631103516.
Trial 469 finished with value: 0.5043333172798157 and parameters: {'n_layers': 1, 'weight_decay': 1.2297718970133802e-06, 'n_units_l0': 1, 'optimizer': 'SGD', 'sgd_opt_learning_rate': 0.0005031631478253613, 'sgd_opt_momentum': 0.002864574046781987}. Best is trial 15 with value: 0.6914615631103516.
Trial 470 finished with value: 0.5043333172798157 and parameters: {'n_layers': 1, 'weight_decay': 2.4495374245861514e-07, 'n_units_l0': 1, 'optimizer': 'RMSprop', 'rmsprop_learning_rate': 3.697950720916086e-05, 'rmsprop_weight_decay': 0.973861897770407, 'rmsprop_momentum': 0.00012625160635636022}. Best is trial 15 with value: 0.6914615631103516.
Trial 471 finished with value: 0.5043333172798157 and parameters: {'n_layers': 1, 'weight_decay': 1.932157790838421e-08, 'n_units_l0': 1, 'optimizer': 'SGD', 'sgd_opt_learning_rate': 4.821695605590073e-05, 'sgd_opt_momentum': 0.0068786002644336125}. Best is trial 15 with value: 0.6914615631103516.
Trial 472 finished with value: 0.5043333172798157 and parameters: {'n_layers': 1, 'weight_decay': 3.3206094469591496e-08, 'n_units_l0': 1, 'optimizer': 'SGD', 'sgd_opt_learning_rate': 6.727584819098294e-05, 'sgd_opt_momentum': 0.0019040429107581242}. Best is trial 15 with value: 0.6914615631103516.
Trial 473 finished with value: 0.5043333172798157 and parameters: {'n_layers': 1, 'weight_decay': 8.97114904497219e-08, 'n_units_l0': 1, 'optimizer': 'RMSprop', 'rmsprop_learning_rate': 1.0375191611722023e-05, 'rmsprop_weight_decay': 0.9661311483458622, 'rmsprop_momentum': 0.0009403998725581979}. Best is trial 15 with value: 0.6914615631103516.
Trial 474 finished with value: 0.5043333172798157 and parameters: {'n_layers': 1, 'weight_decay': 2.419541429203942e-06, 'n_units_l0': 1, 'optimizer': 'SGD', 'sgd_opt_learning_rate': 0.033028993329239094, 'sgd_opt_momentum': 0.00010510192061915091}. Best is trial 15 with value: 0.6914615631103516.
Trial 475 finished with value: 0.5043333172798157 and parameters: {'n_layers': 1, 'weight_decay': 8.480420087144076e-07, 'n_units_l0': 1, 'optimizer': 'RMSprop', 'rmsprop_learning_rate': 1.9236249967813636e-05, 'rmsprop_weight_decay': 0.897729773686891, 'rmsprop_momentum': 0.00031577152495672724}. Best is trial 15 with value: 0.6914615631103516.
Trial 476 finished with value: 0.5043333172798157 and parameters: {'n_layers': 1, 'weight_decay': 1.249245660156174e-07, 'n_units_l0': 1, 'optimizer': 'SGD', 'sgd_opt_learning_rate': 0.00026163498756444885, 'sgd_opt_momentum': 7.518084380214546e-05}. Best is trial 15 with value: 0.6914615631103516.
Trial 477 finished with value: 0.5043333172798157 and parameters: {'n_layers': 1, 'weight_decay': 1.6863517218412572e-06, 'n_units_l0': 1, 'optimizer': 'SGD', 'sgd_opt_learning_rate': 1.5652732057459365e-05, 'sgd_opt_momentum': 0.0013334343111356028}. Best is trial 15 with value: 0.6914615631103516.
Trial 478 finished with value: 0.5043333172798157 and parameters: {'n_layers': 1, 'weight_decay': 5.919151139001224e-08, 'n_units_l0': 1, 'optimizer': 'RMSprop', 'rmsprop_learning_rate': 1.4624038409310642e-05, 'rmsprop_weight_decay': 0.8702651483222452, 'rmsprop_momentum': 0.0001975238302424788}. Best is trial 15 with value: 0.6914615631103516.
Trial 479 finished with value: 0.5043333172798157 and parameters: {'n_layers': 1, 'weight_decay': 5.598665173851225e-07, 'n_units_l0': 1, 'optimizer': 'SGD', 'sgd_opt_learning_rate': 9.732589905761634e-05, 'sgd_opt_momentum': 0.0031064739889155786}. Best is trial 15 with value: 0.6914615631103516.
Trial 480 finished with value: 0.5043333172798157 and parameters: {'n_layers': 1, 'weight_decay': 2.405337549882252e-08, 'n_units_l0': 1, 'optimizer': 'RMSprop', 'rmsprop_learning_rate': 2.5687835551074923e-05, 'rmsprop_weight_decay': 0.9551638245071149, 'rmsprop_momentum': 6.258921668995562e-05}. Best is trial 15 with value: 0.6914615631103516.
Trial 481 finished with value: 0.5043333172798157 and parameters: {'n_layers': 1, 'weight_decay': 2.2564190295323827e-07, 'n_units_l0': 1, 'optimizer': 'SGD', 'sgd_opt_learning_rate': 0.001765008147238712, 'sgd_opt_momentum': 1.9094939162221838e-05}. Best is trial 15 with value: 0.6914615631103516.
Trial 482 finished with value: 0.5043333172798157 and parameters: {'n_layers': 1, 'weight_decay': 8.650091078765395e-08, 'n_units_l0': 1, 'optimizer': 'SGD', 'sgd_opt_learning_rate': 0.0001877405792767579, 'sgd_opt_momentum': 0.00015313157766467907}. Best is trial 15 with value: 0.6914615631103516.
Trial 483 finished with value: 0.5043333172798157 and parameters: {'n_layers': 1, 'weight_decay': 3.843126140179631e-07, 'n_units_l0': 1, 'optimizer': 'RMSprop', 'rmsprop_learning_rate': 0.004229944043494266, 'rmsprop_weight_decay': 0.9474022872811712, 'rmsprop_momentum': 1.522436562323339e-05}. Best is trial 15 with value: 0.6914615631103516.
Trial 484 finished with value: 0.5043333172798157 and parameters: {'n_layers': 1, 'weight_decay': 2.228404779050315e-05, 'n_units_l0': 1, 'optimizer': 'SGD', 'sgd_opt_learning_rate': 0.0805509703469322, 'sgd_opt_momentum': 0.00027127945349896747}. Best is trial 15 with value: 0.6914615631103516.
Trial 485 finished with value: 0.5043333172798157 and parameters: {'n_layers': 1, 'weight_decay': 4.257844712200017e-08, 'n_units_l0': 1, 'optimizer': 'RMSprop', 'rmsprop_learning_rate': 4.890710724960054e-05, 'rmsprop_weight_decay': 0.9130162769283947, 'rmsprop_momentum': 0.005598032381735897}. Best is trial 15 with value: 0.6914615631103516.
Trial 486 finished with value: 0.5043333172798157 and parameters: {'n_layers': 1, 'weight_decay': 0.00048515261227489087, 'n_units_l0': 1, 'optimizer': 'SGD', 'sgd_opt_learning_rate': 7.616249000043604e-05, 'sgd_opt_momentum': 0.0042052221248704445}. Best is trial 15 with value: 0.6914615631103516.
Trial 487 finished with value: 0.5043333172798157 and parameters: {'n_layers': 1, 'weight_decay': 1.5285996545509769e-07, 'n_units_l0': 1, 'optimizer': 'SGD', 'sgd_opt_learning_rate': 0.00011878730254966504, 'sgd_opt_momentum': 0.08871360224548902}. Best is trial 15 with value: 0.6914615631103516.
Trial 488 finished with value: 0.5043333172798157 and parameters: {'n_layers': 1, 'weight_decay': 4.546513374906622e-06, 'n_units_l0': 1, 'optimizer': 'RMSprop', 'rmsprop_learning_rate': 1.2219098693208443e-05, 'rmsprop_weight_decay': 0.893579267303724, 'rmsprop_momentum': 9.083452527178138e-05}. Best is trial 15 with value: 0.6914615631103516.
Trial 489 finished with value: 0.5043333172798157 and parameters: {'n_layers': 1, 'weight_decay': 2.9759466558844677e-06, 'n_units_l0': 1, 'optimizer': 'SGD', 'sgd_opt_learning_rate': 2.4529080685351455e-05, 'sgd_opt_momentum': 0.005550262385928326}. Best is trial 15 with value: 0.6914615631103516.
Trial 490 finished with value: 0.5043333172798157 and parameters: {'n_layers': 1, 'weight_decay': 6.601834319463609e-08, 'n_units_l0': 1, 'optimizer': 'RMSprop', 'rmsprop_learning_rate': 0.00020311902760702954, 'rmsprop_weight_decay': 0.8564934956146337, 'rmsprop_momentum': 2.4473885855963773e-05}. Best is trial 15 with value: 0.6914615631103516.
Trial 491 finished with value: 0.5043333172798157 and parameters: {'n_layers': 1, 'weight_decay': 9.286285773380431e-07, 'n_units_l0': 1, 'optimizer': 'SGD', 'sgd_opt_learning_rate': 9.201722930121701e-05, 'sgd_opt_momentum': 0.009918705307453753}. Best is trial 15 with value: 0.6914615631103516.
Trial 492 finished with value: 0.49566662311553955 and parameters: {'n_layers': 1, 'weight_decay': 1.1772184136400318e-07, 'n_units_l0': 1, 'optimizer': 'SGD', 'sgd_opt_learning_rate': 4.511562896372023e-05, 'sgd_opt_momentum': 8.966587410239355e-05}. Best is trial 15 with value: 0.6914615631103516.
Trial 493 finished with value: 0.5628460645675659 and parameters: {'n_layers': 1, 'weight_decay': 2.993900718787724e-08, 'n_units_l0': 1, 'optimizer': 'RMSprop', 'rmsprop_learning_rate': 2.0647271903668218e-05, 'rmsprop_weight_decay': 0.9799600467573047, 'rmsprop_momentum': 4.962241912119408e-05}. Best is trial 15 with value: 0.6914615631103516.
Trial 494 finished with value: 0.5043333172798157 and parameters: {'n_layers': 1, 'weight_decay': 1.4433960161491335e-08, 'n_units_l0': 1, 'optimizer': 'RMSprop', 'rmsprop_learning_rate': 2.1696629416672296e-05, 'rmsprop_weight_decay': 0.9808644346864163, 'rmsprop_momentum': 6.91077057924774e-05}. Best is trial 15 with value: 0.6914615631103516.
Trial 495 finished with value: 0.5043333172798157 and parameters: {'n_layers': 1, 'weight_decay': 2.7977565427804225e-08, 'n_units_l0': 1, 'optimizer': 'RMSprop', 'rmsprop_learning_rate': 1.7596880757996028e-05, 'rmsprop_weight_decay': 0.971226679370184, 'rmsprop_momentum': 4.275278138789036e-05}. Best is trial 15 with value: 0.6914615631103516.
Trial 496 finished with value: 0.5043333172798157 and parameters: {'n_layers': 1, 'weight_decay': 4.572203152082813e-08, 'n_units_l0': 1, 'optimizer': 'RMSprop', 'rmsprop_learning_rate': 3.448601818450713e-05, 'rmsprop_weight_decay': 0.9767148373020272, 'rmsprop_momentum': 5.0881100206175785e-05}. Best is trial 15 with value: 0.6914615631103516.
Trial 497 finished with value: 0.5043333172798157 and parameters: {'n_layers': 1, 'weight_decay': 3.456585682294968e-08, 'n_units_l0': 1, 'optimizer': 'RMSprop', 'rmsprop_learning_rate': 1.3414749332677934e-05, 'rmsprop_weight_decay': 0.9865622481632117, 'rmsprop_momentum': 3.6830196150091075e-05}. Best is trial 15 with value: 0.6914615631103516.
