Trial 70 finished with value: 0.5043333172798157 and parameters: {'n_layers': 1, 'weight_decay': 4.920431026883899e-07, 'n_units_l0': 1, 'optimizer': 'Adam', 'adam_learning_rate': 7.800134379470614e-05}. Best is trial 15 with value: 0.6914615631103516.
Trial 71 finished with value: 0.5043333172798157 and parameters: {'n_layers': 1, 'weight_decay': 4.440409641361812e-06, 'n_units_l0': 1, 'optimizer': 'SGD', 'sgd_opt_learning_rate': 0.0006895098047826386, 'sgd_opt_momentum': 0.09821923884855559}. Best is trial 15 with value: 0.6914615631103516.
Trial 72 finished with value: 0.5043333172798157 and parameters: {'n_layers': 1, 'weight_decay': 1.0328050438950319e-05, 'n_units_l0': 1, 'optimizer': 'SGD', 'sgd_opt_learning_rate': 0.001269588486697801, 'sgd_opt_momentum': 0.033057342673357255}. Best is trial 15 with value: 0.6914615631103516.
Trial 73 finished with value: 0.5043333172798157 and parameters: {'n_layers': 1, 'weight_decay': 6.208174382108554e-05, 'n_units_l0': 1, 'optimizer': 'SGD', 'sgd_opt_learning_rate': 0.0003270993897194892, 'sgd_opt_momentum': 0.028232376880977336}. Best is trial 15 with value: 0.6914615631103516.
Trial 74 finished with value: 0.5043333172798157 and parameters: {'n_layers': 1, 'weight_decay': 1.7549425699823138e-05, 'n_units_l0': 1, 'optimizer': 'SGD', 'sgd_opt_learning_rate': 5.90797126099589e-05, 'sgd_opt_momentum': 0.017447383830047274}. Best is trial 15 with value: 0.6914615631103516.
Trial 75 finished with value: 0.5043333172798157 and parameters: {'n_layers': 1, 'weight_decay': 1.730672845482784e-07, 'n_units_l0': 1, 'optimizer': 'RMSprop', 'rmsprop_learning_rate': 1.6561295845685802e-05, 'rmsprop_weight_decay': 0.9806681153089923, 'rmsprop_momentum': 1.8767998369515835e-05}. Best is trial 15 with value: 0.6914615631103516.
Trial 76 finished with value: 0.5043333172798157 and parameters: {'n_layers': 1, 'weight_decay': 0.00029363502934488003, 'n_units_l0': 1, 'optimizer': 'SGD', 'sgd_opt_learning_rate': 0.0006577869446084015, 'sgd_opt_momentum': 0.0468474212673043}. Best is trial 15 with value: 0.6914615631103516.
Trial 77 finished with value: 0.5043333172798157 and parameters: {'n_layers': 1, 'weight_decay': 2.135860056126377e-09, 'n_units_l0': 1, 'optimizer': 'RMSprop', 'rmsprop_learning_rate': 1.7505414430123573e-05, 'rmsprop_weight_decay': 0.8645246574645914, 'rmsprop_momentum': 0.07540527351239269}. Best is trial 15 with value: 0.6914615631103516.
Trial 78 finished with value: 0.5043333172798157 and parameters: {'n_layers': 1, 'weight_decay': 6.15406220322071e-10, 'n_units_l0': 1, 'optimizer': 'SGD', 'sgd_opt_learning_rate': 0.01702075123031787, 'sgd_opt_momentum': 0.008429012673611586}. Best is trial 15 with value: 0.6914615631103516.
Trial 79 finished with value: 0.5043333172798157 and parameters: {'n_layers': 1, 'weight_decay': 6.113305046048638e-09, 'n_units_l0': 1, 'optimizer': 'RMSprop', 'rmsprop_learning_rate': 0.00012070439580475766, 'rmsprop_weight_decay': 0.9287683387357658, 'rmsprop_momentum': 0.005320519349319886}. Best is trial 15 with value: 0.6914615631103516.
Trial 80 finished with value: 0.5043333172798157 and parameters: {'n_layers': 1, 'weight_decay': 3.221546293421049e-06, 'n_units_l0': 1, 'optimizer': 'SGD', 'sgd_opt_learning_rate': 0.00021187449156608625, 'sgd_opt_momentum': 0.013360048615153636}. Best is trial 15 with value: 0.6914615631103516.
Trial 81 finished with value: 0.5043333172798157 and parameters: {'n_layers': 1, 'weight_decay': 6.635887443909599e-08, 'n_units_l0': 1, 'optimizer': 'Adam', 'adam_learning_rate': 0.003168781765702056}. Best is trial 15 with value: 0.6914615631103516.
Trial 82 finished with value: 0.5043333172798157 and parameters: {'n_layers': 1, 'weight_decay': 2.873227880759794e-08, 'n_units_l0': 1, 'optimizer': 'Adam', 'adam_learning_rate': 0.0029529955447510385}. Best is trial 15 with value: 0.6914615631103516.
Trial 83 finished with value: 0.5043333172798157 and parameters: {'n_layers': 1, 'weight_decay': 1.2384592954163906e-08, 'n_units_l0': 1, 'optimizer': 'Adam', 'adam_learning_rate': 0.005525819646426241}. Best is trial 15 with value: 0.6914615631103516.
Trial 84 finished with value: 0.5043333172798157 and parameters: {'n_layers': 1, 'weight_decay': 1.1811609292207457e-06, 'n_units_l0': 1, 'optimizer': 'Adam', 'adam_learning_rate': 0.032960341167380044}. Best is trial 15 with value: 0.6914615631103516.
Trial 85 finished with value: 0.5043333172798157 and parameters: {'n_layers': 1, 'weight_decay': 3.9335957332871507e-07, 'n_units_l0': 1, 'optimizer': 'Adam', 'adam_learning_rate': 0.0012436651466409198}. Best is trial 15 with value: 0.6914615631103516.
Trial 86 finished with value: 0.5043333172798157 and parameters: {'n_layers': 1, 'weight_decay': 4.778482859814484e-08, 'n_units_l0': 1, 'optimizer': 'RMSprop', 'rmsprop_learning_rate': 0.00029388345557405276, 'rmsprop_weight_decay': 0.9154680642329717, 'rmsprop_momentum': 0.02952095409100432}. Best is trial 15 with value: 0.6914615631103516.
Trial 87 finished with value: 0.5043333172798157 and parameters: {'n_layers': 1, 'weight_decay': 1.263185284181267e-08, 'n_units_l0': 1, 'optimizer': 'Adam', 'adam_learning_rate': 0.032676552926848956}. Best is trial 15 with value: 0.6914615631103516.
Trial 88 finished with value: 0.5184872150421143 and parameters: {'n_layers': 1, 'weight_decay': 1.267698494107746e-07, 'n_units_l0': 1, 'optimizer': 'SGD', 'sgd_opt_learning_rate': 3.443766839552753e-05, 'sgd_opt_momentum': 0.0025076826107153986}. Best is trial 15 with value: 0.6914615631103516.
Trial 89 finished with value: 0.5043333172798157 and parameters: {'n_layers': 1, 'weight_decay': 1.181428926576843e-07, 'n_units_l0': 1, 'optimizer': 'SGD', 'sgd_opt_learning_rate': 2.804033454353851e-05, 'sgd_opt_momentum': 0.002125762895694553}. Best is trial 15 with value: 0.6914615631103516.
Trial 90 finished with value: 0.5043333172798157 and parameters: {'n_layers': 1, 'weight_decay': 1.994355325947748e-07, 'n_units_l0': 1, 'optimizer': 'SGD', 'sgd_opt_learning_rate': 4.250176459783822e-05, 'sgd_opt_momentum': 0.0006419616855405455}. Best is trial 15 with value: 0.6914615631103516.
Trial 91 finished with value: 0.5043333172798157 and parameters: {'n_layers': 1, 'weight_decay': 1.984767492567723e-08, 'n_units_l0': 1, 'optimizer': 'SGD', 'sgd_opt_learning_rate': 8.406886257839067e-05, 'sgd_opt_momentum': 0.007084358966445846}. Best is trial 15 with value: 0.6914615631103516.
Trial 92 finished with value: 0.49566662311553955 and parameters: {'n_layers': 1, 'weight_decay': 8.239035308861829e-08, 'n_units_l0': 1, 'optimizer': 'SGD', 'sgd_opt_learning_rate': 1.6977690948946672e-05, 'sgd_opt_momentum': 0.0029692073673578154}. Best is trial 15 with value: 0.6914615631103516.
Trial 93 finished with value: 0.5043333172798157 and parameters: {'n_layers': 1, 'weight_decay': 7.676631577734001e-07, 'n_units_l0': 1, 'optimizer': 'SGD', 'sgd_opt_learning_rate': 4.572208767805553e-05, 'sgd_opt_momentum': 0.08670557389533719}. Best is trial 15 with value: 0.6914615631103516.
Trial 94 finished with value: 0.5043333172798157 and parameters: {'n_layers': 1, 'weight_decay': 5.244086853695012e-09, 'n_units_l0': 1, 'optimizer': 'RMSprop', 'rmsprop_learning_rate': 0.020088603444637986, 'rmsprop_weight_decay': 0.9434362976972634, 'rmsprop_momentum': 2.445652145196733e-05}. Best is trial 15 with value: 0.6914615631103516.
Trial 95 finished with value: 0.5043333172798157 and parameters: {'n_layers': 1, 'weight_decay': 3.228365600498093e-08, 'n_units_l0': 1, 'optimizer': 'SGD', 'sgd_opt_learning_rate': 0.0001354193513595419, 'sgd_opt_momentum': 0.0049548106264734664}. Best is trial 15 with value: 0.6914615631103516.
Trial 96 finished with value: 0.5043333172798157 and parameters: {'n_layers': 1, 'weight_decay': 2.6507030800007087e-07, 'n_units_l0': 1, 'optimizer': 'RMSprop', 'rmsprop_learning_rate': 0.08779109972448076, 'rmsprop_weight_decay': 0.9634715231746783, 'rmsprop_momentum': 6.582145286534611e-05}. Best is trial 15 with value: 0.6914615631103516.
Trial 97 finished with value: 0.5043333172798157 and parameters: {'n_layers': 1, 'weight_decay': 6.919843134226016e-06, 'n_units_l0': 1, 'optimizer': 'Adam', 'adam_learning_rate': 0.0013058348031432508}. Best is trial 15 with value: 0.6914615631103516.
Trial 98 finished with value: 0.5043333172798157 and parameters: {'n_layers': 1, 'weight_decay': 1.5686853582760564e-05, 'n_units_l0': 1, 'optimizer': 'SGD', 'sgd_opt_learning_rate': 0.09596959744657702, 'sgd_opt_momentum': 0.0008996393707614868}. Best is trial 15 with value: 0.6914615631103516.
Trial 99 finished with value: 0.5043333172798157 and parameters: {'n_layers': 1, 'weight_decay': 1.5914654222957755e-06, 'n_units_l0': 1, 'optimizer': 'RMSprop', 'rmsprop_learning_rate': 1.8169528287886444e-05, 'rmsprop_weight_decay': 0.9052001703718133, 'rmsprop_momentum': 0.0004805378311744633}. Best is trial 15 with value: 0.6914615631103516.
Trial 100 finished with value: 0.5424871444702148 and parameters: {'n_layers': 1, 'weight_decay': 1.4934991060408665e-07, 'n_units_l0': 1, 'optimizer': 'SGD', 'sgd_opt_learning_rate': 0.045450425950835566, 'sgd_opt_momentum': 0.00011865229642041624}. Best is trial 15 with value: 0.6914615631103516.
Trial 101 finished with value: 0.5031025409698486 and parameters: {'n_layers': 1, 'weight_decay': 5.340438634927685e-07, 'n_units_l0': 1, 'optimizer': 'SGD', 'sgd_opt_learning_rate': 1.7800632667133976e-05, 'sgd_opt_momentum': 2.0092365150936614e-05}. Best is trial 15 with value: 0.6914615631103516.
Trial 102 finished with value: 0.5043333172798157 and parameters: {'n_layers': 1, 'weight_decay': 1.47991653965681e-07, 'n_units_l0': 1, 'optimizer': 'SGD', 'sgd_opt_learning_rate': 0.015960471029642966, 'sgd_opt_momentum': 5.073088349091656e-05}. Best is trial 15 with value: 0.6914615631103516.
Trial 103 finished with value: 0.5043333172798157 and parameters: {'n_layers': 1, 'weight_decay': 2.3796934130769872e-06, 'n_units_l0': 1, 'optimizer': 'SGD', 'sgd_opt_learning_rate': 0.019051792630450204, 'sgd_opt_momentum': 0.00010169771495025975}. Best is trial 15 with value: 0.6914615631103516.
Trial 104 finished with value: 0.5043333172798157 and parameters: {'n_layers': 1, 'weight_decay': 8.886180138260722e-08, 'n_units_l0': 1, 'optimizer': 'SGD', 'sgd_opt_learning_rate': 0.006108317999452207, 'sgd_opt_momentum': 0.0004460626637906761}. Best is trial 15 with value: 0.6914615631103516.
Trial 105 finished with value: 0.5074102282524109 and parameters: {'n_layers': 1, 'weight_decay': 5.7704199478626104e-08, 'n_units_l0': 1, 'optimizer': 'SGD', 'sgd_opt_learning_rate': 0.036016362657669145, 'sgd_opt_momentum': 2.4303530167583162e-05}. Best is trial 15 with value: 0.6914615631103516.
Trial 106 finished with value: 0.5043333172798157 and parameters: {'n_layers': 1, 'weight_decay': 5.7036113056073265e-08, 'n_units_l0': 1, 'optimizer': 'SGD', 'sgd_opt_learning_rate': 0.038920937108227645, 'sgd_opt_momentum': 1.819973212199069e-05}. Best is trial 15 with value: 0.6914615631103516.
Trial 107 finished with value: 0.5043333172798157 and parameters: {'n_layers': 1, 'weight_decay': 2.5221041360122406e-07, 'n_units_l0': 1, 'optimizer': 'SGD', 'sgd_opt_learning_rate': 0.039117087870207796, 'sgd_opt_momentum': 3.306674079765677e-05}. Best is trial 15 with value: 0.6914615631103516.
Trial 108 finished with value: 0.5043333172798157 and parameters: {'n_layers': 1, 'weight_decay': 1.006919002357892e-06, 'n_units_l0': 1, 'optimizer': 'SGD', 'sgd_opt_learning_rate': 0.04653922014948981, 'sgd_opt_momentum': 3.293003903361714e-05}. Best is trial 15 with value: 0.6914615631103516.
Trial 109 finished with value: 0.49566662311553955 and parameters: {'n_layers': 1, 'weight_decay': 3.566205398559078e-07, 'n_units_l0': 1, 'optimizer': 'SGD', 'sgd_opt_learning_rate': 4.118794709687227e-05, 'sgd_opt_momentum': 1.020173932961308e-05}. Best is trial 15 with value: 0.6914615631103516.
Trial 110 finished with value: 0.5043333172798157 and parameters: {'n_layers': 1, 'weight_decay': 4.167892730639792e-06, 'n_units_l0': 1, 'optimizer': 'SGD', 'sgd_opt_learning_rate': 0.002552581645402821, 'sgd_opt_momentum': 3.162521534298042e-05}. Best is trial 15 with value: 0.6914615631103516.
Trial 111 finished with value: 0.5043333172798157 and parameters: {'n_layers': 1, 'weight_decay': 2.2695112048715593e-08, 'n_units_l0': 1, 'optimizer': 'SGD', 'sgd_opt_learning_rate': 0.06713860825808131, 'sgd_opt_momentum': 0.00015415530863639187}. Best is trial 15 with value: 0.6914615631103516.
Trial 112 finished with value: 0.5043333172798157 and parameters: {'n_layers': 1, 'weight_decay': 3.855532033404543e-08, 'n_units_l0': 1, 'optimizer': 'RMSprop', 'rmsprop_learning_rate': 0.00021637377771123646, 'rmsprop_weight_decay': 0.8549414514735794, 'rmsprop_momentum': 0.0015649475660323296}. Best is trial 15 with value: 0.6914615631103516.
Trial 113 finished with value: 0.5043333172798157 and parameters: {'n_layers': 1, 'weight_decay': 1.0420595764922447e-07, 'n_units_l0': 1, 'optimizer': 'Adam', 'adam_learning_rate': 0.007902399152315269}. Best is trial 15 with value: 0.6914615631103516.
Trial 114 finished with value: 0.5043333172798157 and parameters: {'n_layers': 1, 'weight_decay': 2.7001338202107237e-05, 'n_units_l0': 1, 'optimizer': 'SGD', 'sgd_opt_learning_rate': 0.010927287513317077, 'sgd_opt_momentum': 0.000373260944652777}. Best is trial 15 with value: 0.6914615631103516.
Trial 115 finished with value: 0.5043333172798157 and parameters: {'n_layers': 1, 'weight_decay': 1.4634031538450947e-07, 'n_units_l0': 1, 'optimizer': 'RMSprop', 'rmsprop_learning_rate': 6.549252991317915e-05, 'rmsprop_weight_decay': 0.9897387607592093, 'rmsprop_momentum': 1.0220702950710402e-05}. Best is trial 15 with value: 0.6914615631103516.
Trial 116 finished with value: 0.49566662311553955 and parameters: {'n_layers': 1, 'weight_decay': 1.5021804492313685e-08, 'n_units_l0': 1, 'optimizer': 'SGD', 'sgd_opt_learning_rate': 0.00010898073848807239, 'sgd_opt_momentum': 1.575276432668668e-05}. Best is trial 15 with value: 0.6914615631103516.
Trial 117 finished with value: 0.5043333172798157 and parameters: {'n_layers': 1, 'weight_decay': 6.558136596039645e-08, 'n_units_l0': 1, 'optimizer': 'Adam', 'adam_learning_rate': 0.03412136469605497}. Best is trial 15 with value: 0.6914615631103516.
Trial 118 finished with value: 0.5049487352371216 and parameters: {'n_layers': 1, 'weight_decay': 2.1503122261192588e-07, 'n_units_l0': 1, 'optimizer': 'SGD', 'sgd_opt_learning_rate': 6.909358035042972e-05, 'sgd_opt_momentum': 9.96426920177586e-05}. Best is trial 15 with value: 0.6914615631103516.
Trial 119 finished with value: 0.49566662311553955 and parameters: {'n_layers': 1, 'weight_decay': 5.346105816469427e-07, 'n_units_l0': 1, 'optimizer': 'SGD', 'sgd_opt_learning_rate': 6.263462055956677e-05, 'sgd_opt_momentum': 0.0001351192544286527}. Best is trial 15 with value: 0.6914615631103516.
Trial 120 finished with value: 0.5043333172798157 and parameters: {'n_layers': 1, 'weight_decay': 1.4449929940649208e-06, 'n_units_l0': 1, 'optimizer': 'SGD', 'sgd_opt_learning_rate': 0.026289755115062437, 'sgd_opt_momentum': 6.782437650504167e-05}. Best is trial 15 with value: 0.6914615631103516.
Trial 121 finished with value: 0.49566662311553955 and parameters: {'n_layers': 1, 'weight_decay': 2.1985167477096773e-07, 'n_units_l0': 1, 'optimizer': 'SGD', 'sgd_opt_learning_rate': 3.215586976798605e-05, 'sgd_opt_momentum': 0.0022184997186963677}. Best is trial 15 with value: 0.6914615631103516.
Trial 122 finished with value: 0.49566662311553955 and parameters: {'n_layers': 1, 'weight_decay': 3.585532459277791e-07, 'n_units_l0': 1, 'optimizer': 'SGD', 'sgd_opt_learning_rate': 8.786476283786092e-05, 'sgd_opt_momentum': 5.0799054269665773e-05}. Best is trial 15 with value: 0.6914615631103516.
Trial 123 finished with value: 0.5043333172798157 and parameters: {'n_layers': 1, 'weight_decay': 4.844974572616347e-08, 'n_units_l0': 1, 'optimizer': 'SGD', 'sgd_opt_learning_rate': 0.0021456083941800144, 'sgd_opt_momentum': 0.05164001883396774}. Best is trial 15 with value: 0.6914615631103516.
Trial 124 finished with value: 0.5043333172798157 and parameters: {'n_layers': 1, 'weight_decay': 2.766071408693405e-08, 'n_units_l0': 1, 'optimizer': 'RMSprop', 'rmsprop_learning_rate': 1.0072555461301413e-05, 'rmsprop_weight_decay': 0.8814649199283809, 'rmsprop_momentum': 0.00018815340377182648}. Best is trial 15 with value: 0.6914615631103516.
Trial 125 finished with value: 0.5043333172798157 and parameters: {'n_layers': 1, 'weight_decay': 1.727555400994206e-07, 'n_units_l0': 1, 'optimizer': 'SGD', 'sgd_opt_learning_rate': 0.00031100445452403265, 'sgd_opt_momentum': 2.512890097261481e-05}. Best is trial 15 with value: 0.6914615631103516.
Trial 126 finished with value: 0.5043333172798157 and parameters: {'n_layers': 1, 'weight_decay': 6.966938331808242e-08, 'n_units_l0': 1, 'optimizer': 'Adam', 'adam_learning_rate': 0.00028357855339597476}. Best is trial 15 with value: 0.6914615631103516.
Trial 127 finished with value: 0.5043333172798157 and parameters: {'n_layers': 1, 'weight_decay': 7.269546713330447e-07, 'n_units_l0': 1, 'optimizer': 'RMSprop', 'rmsprop_learning_rate': 0.008357026302085327, 'rmsprop_weight_decay': 0.951476957961787, 'rmsprop_momentum': 0.053084128053819686}. Best is trial 15 with value: 0.6914615631103516.
Trial 128 finished with value: 0.5043333172798157 and parameters: {'n_layers': 1, 'weight_decay': 9.180100203510327e-09, 'n_units_l0': 1, 'optimizer': 'SGD', 'sgd_opt_learning_rate': 0.00015539158133691107, 'sgd_opt_momentum': 1.3662699846820599e-05}. Best is trial 15 with value: 0.6914615631103516.
Trial 129 finished with value: 0.5043333172798157 and parameters: {'n_layers': 1, 'weight_decay': 1.1512445576091432e-07, 'n_units_l0': 1, 'optimizer': 'SGD', 'sgd_opt_learning_rate': 0.006290237386098186, 'sgd_opt_momentum': 0.0012817508386804232}. Best is trial 15 with value: 0.6914615631103516.
Trial 130 finished with value: 0.5043333172798157 and parameters: {'n_layers': 1, 'weight_decay': 9.905436368427743e-07, 'n_units_l0': 1, 'optimizer': 'RMSprop', 'rmsprop_learning_rate': 0.0004136072617534293, 'rmsprop_weight_decay': 0.8505942985578684, 'rmsprop_momentum': 0.0039921814973469605}. Best is trial 15 with value: 0.6914615631103516.
Trial 131 finished with value: 0.5043333172798157 and parameters: {'n_layers': 1, 'weight_decay': 0.000239475187574809, 'n_units_l0': 1, 'optimizer': 'Adam', 'adam_learning_rate': 0.0069422881141474975}. Best is trial 15 with value: 0.6914615631103516.
Trial 132 finished with value: 0.5043333172798157 and parameters: {'n_layers': 1, 'weight_decay': 0.0002277244852287207, 'n_units_l0': 1, 'optimizer': 'Adam', 'adam_learning_rate': 0.013913869173243493}. Best is trial 15 with value: 0.6914615631103516.
Trial 133 finished with value: 0.5043333172798157 and parameters: {'n_layers': 1, 'weight_decay': 3.6886224856520894e-06, 'n_units_l0': 1, 'optimizer': 'Adam', 'adam_learning_rate': 0.0018865782293409194}. Best is trial 15 with value: 0.6914615631103516.
Trial 134 finished with value: 0.5043333172798157 and parameters: {'n_layers': 1, 'weight_decay': 1.8967705871991295e-06, 'n_units_l0': 1, 'optimizer': 'Adam', 'adam_learning_rate': 0.005275618132176454}. Best is trial 15 with value: 0.6914615631103516.
Trial 135 finished with value: 0.5043333172798157 and parameters: {'n_layers': 1, 'weight_decay': 6.087485807740734e-05, 'n_units_l0': 1, 'optimizer': 'Adam', 'adam_learning_rate': 0.011908019032475941}. Best is trial 15 with value: 0.6914615631103516.
Trial 136 finished with value: 0.5043333172798157 and parameters: {'n_layers': 1, 'weight_decay': 1.3060066281777386e-05, 'n_units_l0': 1, 'optimizer': 'SGD', 'sgd_opt_learning_rate': 1.8889235061398753e-05, 'sgd_opt_momentum': 0.02087503606840182}. Best is trial 15 with value: 0.6914615631103516.
Trial 137 finished with value: 0.5043333172798157 and parameters: {'n_layers': 1, 'weight_decay': 8.813133080572487e-05, 'n_units_l0': 1, 'optimizer': 'SGD', 'sgd_opt_learning_rate': 6.694825530428991e-05, 'sgd_opt_momentum': 0.04306105429900101}. Best is trial 15 with value: 0.6914615631103516.
Trial 138 finished with value: 0.5043333172798157 and parameters: {'n_layers': 1, 'weight_decay': 0.0004057673115024288, 'n_units_l0': 1, 'optimizer': 'RMSprop', 'rmsprop_learning_rate': 4.14250800418595e-05, 'rmsprop_weight_decay': 0.8969543316113008, 'rmsprop_momentum': 0.09804041248428155}. Best is trial 15 with value: 0.6914615631103516.
Trial 139 finished with value: 0.5043333172798157 and parameters: {'n_layers': 1, 'weight_decay': 7.182032222802668e-06, 'n_units_l0': 1, 'optimizer': 'Adam', 'adam_learning_rate': 0.0005631167174366114}. Best is trial 15 with value: 0.6914615631103516.
Trial 140 finished with value: 0.5043333172798157 and parameters: {'n_layers': 1, 'weight_decay': 4.029943517207157e-08, 'n_units_l0': 1, 'optimizer': 'SGD', 'sgd_opt_learning_rate': 0.0007462450774157794, 'sgd_opt_momentum': 0.0006484445155671756}. Best is trial 15 with value: 0.6914615631103516.
Trial 141 finished with value: 0.5043333172798157 and parameters: {'n_layers': 1, 'weight_decay': 8.379106155106553e-10, 'n_units_l0': 1, 'optimizer': 'Adam', 'adam_learning_rate': 0.003201722913016982}. Best is trial 15 with value: 0.6914615631103516.
Trial 142 finished with value: 0.5043333172798157 and parameters: {'n_layers': 1, 'weight_decay': 8.073347148002254e-08, 'n_units_l0': 1, 'optimizer': 'Adam', 'adam_learning_rate': 0.0005219441152884775}. Best is trial 15 with value: 0.6914615631103516.
Trial 143 finished with value: 0.5043333172798157 and parameters: {'n_layers': 1, 'weight_decay': 1.2540669101609938e-09, 'n_units_l0': 1, 'optimizer': 'Adam', 'adam_learning_rate': 0.001854192635637941}. Best is trial 15 with value: 0.6914615631103516.
