Trial 498 finished with value: 0.5043333172798157 and parameters: {'n_layers': 1, 'weight_decay': 1.8197237591350103e-08, 'n_units_l0': 1, 'optimizer': 'RMSprop', 'rmsprop_learning_rate': 2.4646855300911883e-05, 'rmsprop_weight_decay': 0.9824519109100341, 'rmsprop_momentum': 3.0494153991807752e-05}. Best is trial 15 with value: 0.6914615631103516.
Trial 499 finished with value: 0.5043333172798157 and parameters: {'n_layers': 1, 'weight_decay': 2.6685525433769165e-08, 'n_units_l0': 1, 'optimizer': 'RMSprop', 'rmsprop_learning_rate': 4.357324905595043e-05, 'rmsprop_weight_decay': 0.9737564323426999, 'rmsprop_momentum': 1.811811632125462e-05}. Best is trial 15 with value: 0.6914615631103516.
