Trial 287 finished with value: 0.5043333172798157 and parameters: {'n_layers': 1, 'weight_decay': 3.708087980774509e-08, 'n_units_l0': 1, 'optimizer': 'SGD', 'sgd_opt_learning_rate': 8.170282024234449e-05, 'sgd_opt_momentum': 0.0014698771765792778}. Best is trial 15 with value: 0.6914615631103516.
Trial 288 finished with value: 0.5043333172798157 and parameters: {'n_layers': 1, 'weight_decay': 1.325891398915243e-06, 'n_units_l0': 1, 'optimizer': 'RMSprop', 'rmsprop_learning_rate': 3.07737248015341e-05, 'rmsprop_weight_decay': 0.9578530069866853, 'rmsprop_momentum': 0.00011554355600720644}. Best is trial 15 with value: 0.6914615631103516.
Trial 289 finished with value: 0.49566662311553955 and parameters: {'n_layers': 1, 'weight_decay': 1.9628384251243484e-07, 'n_units_l0': 1, 'optimizer': 'SGD', 'sgd_opt_learning_rate': 0.00012264520701459958, 'sgd_opt_momentum': 8.942236733494607e-05}. Best is trial 15 with value: 0.6914615631103516.
Trial 290 finished with value: 0.5043333172798157 and parameters: {'n_layers': 1, 'weight_decay': 2.864857786008222e-06, 'n_units_l0': 1, 'optimizer': 'RMSprop', 'rmsprop_learning_rate': 0.0036604924295777297, 'rmsprop_weight_decay': 0.9207648235731752, 'rmsprop_momentum': 0.0002582754867462754}. Best is trial 15 with value: 0.6914615631103516.
Trial 291 finished with value: 0.5043333172798157 and parameters: {'n_layers': 1, 'weight_decay': 6.070553722793294e-08, 'n_units_l0': 1, 'optimizer': 'Adam', 'adam_learning_rate': 0.04494652570156089}. Best is trial 15 with value: 0.6914615631103516.
Trial 292 finished with value: 0.5043333172798157 and parameters: {'n_layers': 1, 'weight_decay': 1.903853457676809e-09, 'n_units_l0': 1, 'optimizer': 'SGD', 'sgd_opt_learning_rate': 2.9529240152036215e-05, 'sgd_opt_momentum': 0.012274187438952167}. Best is trial 15 with value: 0.6914615631103516.
Trial 293 finished with value: 0.5043333172798157 and parameters: {'n_layers': 1, 'weight_decay': 2.419647648738864e-10, 'n_units_l0': 1, 'optimizer': 'SGD', 'sgd_opt_learning_rate': 0.0002688225647575875, 'sgd_opt_momentum': 2.644964784363388e-05}. Best is trial 15 with value: 0.6914615631103516.
Trial 294 finished with value: 0.5043333172798157 and parameters: {'n_layers': 1, 'weight_decay': 6.268757849978902e-06, 'n_units_l0': 1, 'optimizer': 'RMSprop', 'rmsprop_learning_rate': 2.0515899522076463e-05, 'rmsprop_weight_decay': 0.966512028811644, 'rmsprop_momentum': 0.0021323419165099645}. Best is trial 15 with value: 0.6914615631103516.
Trial 295 finished with value: 0.5043333172798157 and parameters: {'n_layers': 1, 'weight_decay': 4.2394069130381156e-08, 'n_units_l0': 1, 'optimizer': 'SGD', 'sgd_opt_learning_rate': 5.939318395275278e-05, 'sgd_opt_momentum': 0.004498770870329707}. Best is trial 15 with value: 0.6914615631103516.
Trial 296 finished with value: 0.5043333172798157 and parameters: {'n_layers': 1, 'weight_decay': 3.233605660407534e-05, 'n_units_l0': 1, 'optimizer': 'Adam', 'adam_learning_rate': 0.00013713251299616753}. Best is trial 15 with value: 0.6914615631103516.
Trial 297 finished with value: 0.5043333172798157 and parameters: {'n_layers': 1, 'weight_decay': 9.080616432537304e-08, 'n_units_l0': 1, 'optimizer': 'SGD', 'sgd_opt_learning_rate': 1.6278207703292654e-05, 'sgd_opt_momentum': 0.006012736324914451}. Best is trial 15 with value: 0.6914615631103516.
Trial 298 finished with value: 0.5043333172798157 and parameters: {'n_layers': 1, 'weight_decay': 1.4637456004689865e-08, 'n_units_l0': 1, 'optimizer': 'RMSprop', 'rmsprop_learning_rate': 0.00010441406219125243, 'rmsprop_weight_decay': 0.9834972756042328, 'rmsprop_momentum': 0.05763100778910388}. Best is trial 15 with value: 0.6914615631103516.
Trial 299 finished with value: 0.5043333172798157 and parameters: {'n_layers': 1, 'weight_decay': 3.498973676605224e-07, 'n_units_l0': 1, 'optimizer': 'SGD', 'sgd_opt_learning_rate': 5.148995419554485e-05, 'sgd_opt_momentum': 0.0020416475350884798}. Best is trial 15 with value: 0.6914615631103516.
Trial 300 finished with value: 0.5043333172798157 and parameters: {'n_layers': 1, 'weight_decay': 2.2634449130369387e-06, 'n_units_l0': 1, 'optimizer': 'Adam', 'adam_learning_rate': 0.0007133908670964199}. Best is trial 15 with value: 0.6914615631103516.
Trial 301 finished with value: 0.5043333172798157 and parameters: {'n_layers': 1, 'weight_decay': 2.843456430471437e-08, 'n_units_l0': 1, 'optimizer': 'RMSprop', 'rmsprop_learning_rate': 0.0006207906870755178, 'rmsprop_weight_decay': 0.9783959688180649, 'rmsprop_momentum': 0.022743839354783444}. Best is trial 15 with value: 0.6914615631103516.
Trial 302 finished with value: 0.5043333172798157 and parameters: {'n_layers': 1, 'weight_decay': 1.0118004936801744e-06, 'n_units_l0': 1, 'optimizer': 'SGD', 'sgd_opt_learning_rate': 3.56375027883938e-05, 'sgd_opt_momentum': 1.9330849833102435e-05}. Best is trial 15 with value: 0.6914615631103516.
Trial 303 finished with value: 0.5043333172798157 and parameters: {'n_layers': 1, 'weight_decay': 2.527035598909283e-07, 'n_units_l0': 1, 'optimizer': 'SGD', 'sgd_opt_learning_rate': 0.00010906546112124759, 'sgd_opt_momentum': 6.629302429538619e-05}. Best is trial 15 with value: 0.6914615631103516.
Trial 304 finished with value: 0.5043333172798157 and parameters: {'n_layers': 1, 'weight_decay': 1.3937949049535887e-07, 'n_units_l0': 1, 'optimizer': 'RMSprop', 'rmsprop_learning_rate': 0.00014193171767060096, 'rmsprop_weight_decay': 0.9534928252343581, 'rmsprop_momentum': 0.01069181524299814}. Best is trial 15 with value: 0.6914615631103516.
Trial 305 finished with value: 0.5043333172798157 and parameters: {'n_layers': 1, 'weight_decay': 3.1496789899485594e-09, 'n_units_l0': 1, 'optimizer': 'Adam', 'adam_learning_rate': 0.0010880619905583146}. Best is trial 15 with value: 0.6914615631103516.
Trial 306 finished with value: 0.5043333172798157 and parameters: {'n_layers': 1, 'weight_decay': 1.8570515160694385e-08, 'n_units_l0': 1, 'optimizer': 'SGD', 'sgd_opt_learning_rate': 0.0030641288739603582, 'sgd_opt_momentum': 3.717193410230972e-05}. Best is trial 15 with value: 0.6914615631103516.
Trial 307 finished with value: 0.5043333172798157 and parameters: {'n_layers': 1, 'weight_decay': 6.993467031685098e-10, 'n_units_l0': 1, 'optimizer': 'SGD', 'sgd_opt_learning_rate': 0.01658430632997205, 'sgd_opt_momentum': 0.009350679794496728}. Best is trial 15 with value: 0.6914615631103516.
Trial 308 finished with value: 0.5043333172798157 and parameters: {'n_layers': 1, 'weight_decay': 1.4277851294325165e-06, 'n_units_l0': 1, 'optimizer': 'RMSprop', 'rmsprop_learning_rate': 4.103376954142451e-05, 'rmsprop_weight_decay': 0.9684762317933923, 'rmsprop_momentum': 2.899410561138869e-05}. Best is trial 15 with value: 0.6914615631103516.
Trial 309 finished with value: 0.5043333172798157 and parameters: {'n_layers': 1, 'weight_decay': 4.778578432105856e-06, 'n_units_l0': 1, 'optimizer': 'SGD', 'sgd_opt_learning_rate': 0.000932775013015126, 'sgd_opt_momentum': 1.0034071682205027e-05}. Best is trial 15 with value: 0.6914615631103516.
Trial 310 finished with value: 0.5043333172798157 and parameters: {'n_layers': 1, 'weight_decay': 4.7048934509343303e-08, 'n_units_l0': 1, 'optimizer': 'Adam', 'adam_learning_rate': 0.016868350769147403}. Best is trial 15 with value: 0.6914615631103516.
Trial 311 finished with value: 0.5043333172798157 and parameters: {'n_layers': 1, 'weight_decay': 5.025385062618541e-07, 'n_units_l0': 1, 'optimizer': 'SGD', 'sgd_opt_learning_rate': 0.013685106992543881, 'sgd_opt_momentum': 0.0029626916267745684}. Best is trial 15 with value: 0.6914615631103516.
Trial 312 finished with value: 0.5043333172798157 and parameters: {'n_layers': 1, 'weight_decay': 1.4056051514878216e-09, 'n_units_l0': 1, 'optimizer': 'RMSprop', 'rmsprop_learning_rate': 1.190106736967711e-05, 'rmsprop_weight_decay': 0.936142538371697, 'rmsprop_momentum': 4.342965081946233e-05}. Best is trial 15 with value: 0.6914615631103516.
Trial 313 finished with value: 0.5043333172798157 and parameters: {'n_layers': 1, 'weight_decay': 1.6374262834123602e-05, 'n_units_l0': 1, 'optimizer': 'SGD', 'sgd_opt_learning_rate': 0.0001960604048042479, 'sgd_opt_momentum': 0.09841820407735398}. Best is trial 15 with value: 0.6914615631103516.
Trial 314 finished with value: 0.5043333172798157 and parameters: {'n_layers': 1, 'weight_decay': 0.0005746313495824143, 'n_units_l0': 1, 'optimizer': 'Adam', 'adam_learning_rate': 0.00850669067737264}. Best is trial 15 with value: 0.6914615631103516.
Trial 315 finished with value: 0.5043333172798157 and parameters: {'n_layers': 1, 'weight_decay': 7.09386592937274e-08, 'n_units_l0': 1, 'optimizer': 'RMSprop', 'rmsprop_learning_rate': 0.00030381416002225257, 'rmsprop_weight_decay': 0.9242193088038255, 'rmsprop_momentum': 0.00015356269988268863}. Best is trial 15 with value: 0.6914615631103516.
Trial 316 finished with value: 0.5043333172798157 and parameters: {'n_layers': 1, 'weight_decay': 1.7336878196959684e-06, 'n_units_l0': 1, 'optimizer': 'SGD', 'sgd_opt_learning_rate': 1.2312049966010647e-05, 'sgd_opt_momentum': 0.00012464193560356683}. Best is trial 15 with value: 0.6914615631103516.
Trial 317 finished with value: 0.5043333172798157 and parameters: {'n_layers': 1, 'weight_decay': 3.6897502411562387e-06, 'n_units_l0': 1, 'optimizer': 'SGD', 'sgd_opt_learning_rate': 7.134193272249773e-05, 'sgd_opt_momentum': 0.007234825251945046}. Best is trial 15 with value: 0.6914615631103516.
Trial 318 finished with value: 0.5043333172798157 and parameters: {'n_layers': 1, 'weight_decay': 7.003687812508158e-07, 'n_units_l0': 1, 'optimizer': 'Adam', 'adam_learning_rate': 0.09982880877912897}. Best is trial 15 with value: 0.6914615631103516.
Trial 319 finished with value: 0.5043333172798157 and parameters: {'n_layers': 1, 'weight_decay': 1.0640035531024336e-07, 'n_units_l0': 1, 'optimizer': 'RMSprop', 'rmsprop_learning_rate': 0.0017455380156127097, 'rmsprop_weight_decay': 0.9755981307402093, 'rmsprop_momentum': 5.796824182410389e-05}. Best is trial 15 with value: 0.6914615631103516.
Trial 320 finished with value: 0.49505123496055603 and parameters: {'n_layers': 1, 'weight_decay': 3.228738200578455e-08, 'n_units_l0': 1, 'optimizer': 'SGD', 'sgd_opt_learning_rate': 2.201073751869205e-05, 'sgd_opt_momentum': 0.05946856590546393}. Best is trial 15 with value: 0.6914615631103516.
Trial 321 finished with value: 0.5043333172798157 and parameters: {'n_layers': 1, 'weight_decay': 1.6776536245902974e-07, 'n_units_l0': 1, 'optimizer': 'SGD', 'sgd_opt_learning_rate': 4.465481034410494e-05, 'sgd_opt_momentum': 0.0003713630609664506}. Best is trial 15 with value: 0.6914615631103516.
Trial 322 finished with value: 0.5043333172798157 and parameters: {'n_layers': 1, 'weight_decay': 4.945627371992579e-08, 'n_units_l0': 1, 'optimizer': 'RMSprop', 'rmsprop_learning_rate': 1.567428082868437e-05, 'rmsprop_weight_decay': 0.9703854296466674, 'rmsprop_momentum': 7.856420355180608e-05}. Best is trial 15 with value: 0.6914615631103516.
Trial 323 finished with value: 0.5043333172798157 and parameters: {'n_layers': 1, 'weight_decay': 3.1897431287255565e-10, 'n_units_l0': 1, 'optimizer': 'Adam', 'adam_learning_rate': 0.0004944584678260603}. Best is trial 15 with value: 0.6914615631103516.
Trial 324 finished with value: 0.5043333172798157 and parameters: {'n_layers': 1, 'weight_decay': 2.0925981666428128e-08, 'n_units_l0': 1, 'optimizer': 'SGD', 'sgd_opt_learning_rate': 0.00014746512740527283, 'sgd_opt_momentum': 0.003908970215530666}. Best is trial 15 with value: 0.6914615631103516.
Trial 325 finished with value: 0.5043333172798157 and parameters: {'n_layers': 1, 'weight_decay': 1.5610326176110403e-10, 'n_units_l0': 1, 'optimizer': 'SGD', 'sgd_opt_learning_rate': 9.994149037224488e-05, 'sgd_opt_momentum': 0.00545851129019006}. Best is trial 15 with value: 0.6914615631103516.
Trial 326 finished with value: 0.5043333172798157 and parameters: {'n_layers': 1, 'weight_decay': 2.773476113725977e-06, 'n_units_l0': 1, 'optimizer': 'RMSprop', 'rmsprop_learning_rate': 2.8345362336654814e-05, 'rmsprop_weight_decay': 0.9615276821368176, 'rmsprop_momentum': 0.008636461270830844}. Best is trial 15 with value: 0.6914615631103516.
Trial 327 finished with value: 0.5043333172798157 and parameters: {'n_layers': 1, 'weight_decay': 4.764692042391651e-05, 'n_units_l0': 1, 'optimizer': 'SGD', 'sgd_opt_learning_rate': 0.00036200996123311746, 'sgd_opt_momentum': 2.9991955960781964e-05}. Best is trial 15 with value: 0.6914615631103516.
Trial 328 finished with value: 0.5043333172798157 and parameters: {'n_layers': 1, 'weight_decay': 2.2878162589273837e-07, 'n_units_l0': 1, 'optimizer': 'Adam', 'adam_learning_rate': 0.029925178728721982}. Best is trial 15 with value: 0.6914615631103516.
Trial 329 finished with value: 0.5043333172798157 and parameters: {'n_layers': 1, 'weight_decay': 3.516431905550792e-08, 'n_units_l0': 1, 'optimizer': 'RMSprop', 'rmsprop_learning_rate': 1.1298495531553695e-05, 'rmsprop_weight_decay': 0.9514956556512167, 'rmsprop_momentum': 0.013647669667278425}. Best is trial 15 with value: 0.6914615631103516.
Trial 330 finished with value: 0.5043333172798157 and parameters: {'n_layers': 1, 'weight_decay': 7.921431073139159e-08, 'n_units_l0': 1, 'optimizer': 'SGD', 'sgd_opt_learning_rate': 0.0005751102230348653, 'sgd_opt_momentum': 0.02931492814103455}. Best is trial 15 with value: 0.6914615631103516.
Trial 331 finished with value: 0.5043333172798157 and parameters: {'n_layers': 1, 'weight_decay': 8.294037157413612e-09, 'n_units_l0': 1, 'optimizer': 'SGD', 'sgd_opt_learning_rate': 0.09529588539033959, 'sgd_opt_momentum': 0.0011326363939223856}. Best is trial 15 with value: 0.6914615631103516.
Trial 332 finished with value: 0.5043333172798157 and parameters: {'n_layers': 1, 'weight_decay': 1.0397709857111803e-07, 'n_units_l0': 1, 'optimizer': 'Adam', 'adam_learning_rate': 0.012529913621641683}. Best is trial 15 with value: 0.6914615631103516.
Trial 333 finished with value: 0.5043333172798157 and parameters: {'n_layers': 1, 'weight_decay': 5.265919269117889e-08, 'n_units_l0': 1, 'optimizer': 'RMSprop', 'rmsprop_learning_rate': 6.0245570483212214e-05, 'rmsprop_weight_decay': 0.9880075594706411, 'rmsprop_momentum': 0.03357284887293729}. Best is trial 15 with value: 0.6914615631103516.
Trial 334 finished with value: 0.5043333172798157 and parameters: {'n_layers': 1, 'weight_decay': 1.1525923331192983e-06, 'n_units_l0': 1, 'optimizer': 'SGD', 'sgd_opt_learning_rate': 0.027524350404079103, 'sgd_opt_momentum': 0.07499754871304708}. Best is trial 15 with value: 0.6914615631103516.
Trial 335 finished with value: 0.5043333172798157 and parameters: {'n_layers': 1, 'weight_decay': 3.528873237145051e-07, 'n_units_l0': 1, 'optimizer': 'SGD', 'sgd_opt_learning_rate': 2.7120154270141652e-05, 'sgd_opt_momentum': 0.00020861399178476395}. Best is trial 15 with value: 0.6914615631103516.
Trial 336 finished with value: 0.5043333172798157 and parameters: {'n_layers': 1, 'weight_decay': 1.2301702110944806e-08, 'n_units_l0': 1, 'optimizer': 'RMSprop', 'rmsprop_learning_rate': 4.906858509292622e-05, 'rmsprop_weight_decay': 0.944977463465024, 'rmsprop_momentum': 0.04362904717472468}. Best is trial 15 with value: 0.6914615631103516.
Trial 337 finished with value: 0.5043333172798157 and parameters: {'n_layers': 1, 'weight_decay': 2.0518274120232285e-06, 'n_units_l0': 1, 'optimizer': 'Adam', 'adam_learning_rate': 0.002523434069483878}. Best is trial 15 with value: 0.6914615631103516.
Trial 338 finished with value: 0.5043333172798157 and parameters: {'n_layers': 1, 'weight_decay': 2.5206483058302855e-08, 'n_units_l0': 1, 'optimizer': 'SGD', 'sgd_opt_learning_rate': 0.03805238770090624, 'sgd_opt_momentum': 0.0184311277361818}. Best is trial 15 with value: 0.6914615631103516.
Trial 339 finished with value: 0.5043333172798157 and parameters: {'n_layers': 1, 'weight_decay': 0.00010720487374100034, 'n_units_l0': 1, 'optimizer': 'RMSprop', 'rmsprop_learning_rate': 0.009474571055470183, 'rmsprop_weight_decay': 0.9726625490558761, 'rmsprop_momentum': 0.0035922833336184375}. Best is trial 15 with value: 0.6914615631103516.
Trial 340 finished with value: 0.5043333172798157 and parameters: {'n_layers': 1, 'weight_decay': 8.273772134829414e-06, 'n_units_l0': 1, 'optimizer': 'SGD', 'sgd_opt_learning_rate': 0.05403869299716357, 'sgd_opt_momentum': 0.011869069877629522}. Best is trial 15 with value: 0.6914615631103516.
Trial 341 finished with value: 0.5043333172798157 and parameters: {'n_layers': 1, 'weight_decay': 6.643344289717294e-08, 'n_units_l0': 1, 'optimizer': 'Adam', 'adam_learning_rate': 0.006138778852212064}. Best is trial 15 with value: 0.6914615631103516.
Trial 342 finished with value: 0.5043333172798157 and parameters: {'n_layers': 1, 'weight_decay': 1.316369635378214e-07, 'n_units_l0': 1, 'optimizer': 'SGD', 'sgd_opt_learning_rate': 3.3564935951251004e-05, 'sgd_opt_momentum': 1.4906421186173787e-05}. Best is trial 15 with value: 0.6914615631103516.
Trial 343 finished with value: 0.5043333172798157 and parameters: {'n_layers': 1, 'weight_decay': 3.529612635915946e-08, 'n_units_l0': 1, 'optimizer': 'RMSprop', 'rmsprop_learning_rate': 7.412541195455818e-05, 'rmsprop_weight_decay': 0.8786373177855147, 'rmsprop_momentum': 0.0008868138943834784}. Best is trial 15 with value: 0.6914615631103516.
Trial 344 finished with value: 0.5043333172798157 and parameters: {'n_layers': 1, 'weight_decay': 8.36904562005638e-07, 'n_units_l0': 1, 'optimizer': 'SGD', 'sgd_opt_learning_rate': 8.247497408705236e-05, 'sgd_opt_momentum': 0.04885739969496065}. Best is trial 15 with value: 0.6914615631103516.
Trial 345 finished with value: 0.5043333172798157 and parameters: {'n_layers': 1, 'weight_decay': 2.3003507072417915e-07, 'n_units_l0': 1, 'optimizer': 'SGD', 'sgd_opt_learning_rate': 0.00041723057348463303, 'sgd_opt_momentum': 0.0023018222552121438}. Best is trial 15 with value: 0.6914615631103516.
Trial 346 finished with value: 0.5043333172798157 and parameters: {'n_layers': 1, 'weight_decay': 1.565036777851467e-06, 'n_units_l0': 1, 'optimizer': 'Adam', 'adam_learning_rate': 0.0016979616244592404}. Best is trial 15 with value: 0.6914615631103516.
Trial 347 finished with value: 0.5043333172798157 and parameters: {'n_layers': 1, 'weight_decay': 4.592705020070829e-06, 'n_units_l0': 1, 'optimizer': 'RMSprop', 'rmsprop_learning_rate': 3.8661058483343834e-05, 'rmsprop_weight_decay': 0.9569905912659672, 'rmsprop_momentum': 0.0770155597600187}. Best is trial 15 with value: 0.6914615631103516.
Trial 348 finished with value: 0.430410236120224 and parameters: {'n_layers': 1, 'weight_decay': 4.9668833876258684e-08, 'n_units_l0': 1, 'optimizer': 'SGD', 'sgd_opt_learning_rate': 6.523560162234177e-05, 'sgd_opt_momentum': 0.004888895735783846}. Best is trial 15 with value: 0.6914615631103516.
Trial 349 finished with value: 0.5043333172798157 and parameters: {'n_layers': 1, 'weight_decay': 1.6685820370300333e-07, 'n_units_l0': 1, 'optimizer': 'SGD', 'sgd_opt_learning_rate': 3.952918080105309e-05, 'sgd_opt_momentum': 0.007509183120031122}. Best is trial 15 with value: 0.6914615631103516.
Trial 350 finished with value: 0.5043333172798157 and parameters: {'n_layers': 1, 'weight_decay': 5.649630589931268e-07, 'n_units_l0': 1, 'optimizer': 'RMSprop', 'rmsprop_learning_rate': 2.12806453622805e-05, 'rmsprop_weight_decay': 0.9652121848586654, 'rmsprop_momentum': 0.0004172677118510167}. Best is trial 15 with value: 0.6914615631103516.
Trial 351 finished with value: 0.5043333172798157 and parameters: {'n_layers': 1, 'weight_decay': 8.043855218214438e-08, 'n_units_l0': 1, 'optimizer': 'Adam', 'adam_learning_rate': 0.00391891064632666}. Best is trial 15 with value: 0.6914615631103516.
Trial 352 finished with value: 0.5043333172798157 and parameters: {'n_layers': 1, 'weight_decay': 1.2262571334369076e-05, 'n_units_l0': 1, 'optimizer': 'SGD', 'sgd_opt_learning_rate': 0.00023712158438108041, 'sgd_opt_momentum': 4.95794423748221e-05}. Best is trial 15 with value: 0.6914615631103516.
Trial 353 finished with value: 0.5043333172798157 and parameters: {'n_layers': 1, 'weight_decay': 4.461591943240449e-10, 'n_units_l0': 1, 'optimizer': 'RMSprop', 'rmsprop_learning_rate': 1.4347295991201255e-05, 'rmsprop_weight_decay': 0.9855946512408287, 'rmsprop_momentum': 0.00011288144406299596}. Best is trial 15 with value: 0.6914615631103516.
Trial 354 finished with value: 0.4711281955242157 and parameters: {'n_layers': 1, 'weight_decay': 2.8347240602178816e-08, 'n_units_l0': 1, 'optimizer': 'SGD', 'sgd_opt_learning_rate': 5.0280122268826784e-05, 'sgd_opt_momentum': 0.0032906044797808274}. Best is trial 15 with value: 0.6914615631103516.
Trial 355 finished with value: 0.5043333172798157 and parameters: {'n_layers': 1, 'weight_decay': 1.7135658839500332e-08, 'n_units_l0': 1, 'optimizer': 'Adam', 'adam_learning_rate': 0.005491699043169124}. Best is trial 15 with value: 0.6914615631103516.
Trial 356 finished with value: 0.49566662311553955 and parameters: {'n_layers': 1, 'weight_decay': 1.2497465741550358e-10, 'n_units_l0': 1, 'optimizer': 'SGD', 'sgd_opt_learning_rate': 1.782054790659668e-05, 'sgd_opt_momentum': 0.00179924994313981}. Best is trial 15 with value: 0.6914615631103516.
Trial 357 finished with value: 0.5043333172798157 and parameters: {'n_layers': 1, 'weight_decay': 3.050099657971093e-06, 'n_units_l0': 1, 'optimizer': 'RMSprop', 'rmsprop_learning_rate': 2.7564534262021917e-05, 'rmsprop_weight_decay': 0.9306182814735697, 'rmsprop_momentum': 1.7895715075937866e-05}. Best is trial 15 with value: 0.6914615631103516.
Trial 358 finished with value: 0.5043333172798157 and parameters: {'n_layers': 1, 'weight_decay': 2.193047061887493e-06, 'n_units_l0': 1, 'optimizer': 'SGD', 'sgd_opt_learning_rate': 0.002139775757182139, 'sgd_opt_momentum': 0.014498306692230145}. Best is trial 15 with value: 0.6914615631103516.
