Trial 215 finished with value: 0.5043333172798157 and parameters: {'n_layers': 1, 'weight_decay': 5.127348766510386e-06, 'n_units_l0': 1, 'optimizer': 'RMSprop', 'rmsprop_learning_rate': 2.586467387814717e-05, 'rmsprop_weight_decay': 0.9630330483054893, 'rmsprop_momentum': 0.006552275420193335}. Best is trial 15 with value: 0.6914615631103516.
Trial 216 finished with value: 0.5043333172798157 and parameters: {'n_layers': 1, 'weight_decay': 1.311889520652822e-10, 'n_units_l0': 1, 'optimizer': 'SGD', 'sgd_opt_learning_rate': 4.932937038867317e-05, 'sgd_opt_momentum': 0.0011238620656264177}. Best is trial 15 with value: 0.6914615631103516.
Trial 217 finished with value: 0.5043333172798157 and parameters: {'n_layers': 1, 'weight_decay': 0.0004723836917594317, 'n_units_l0': 1, 'optimizer': 'RMSprop', 'rmsprop_learning_rate': 0.05506261635780421, 'rmsprop_weight_decay': 0.9097073954492042, 'rmsprop_momentum': 0.00021464081537547248}. Best is trial 15 with value: 0.6914615631103516.
Trial 218 finished with value: 0.5043333172798157 and parameters: {'n_layers': 1, 'weight_decay': 3.128006513786392e-08, 'n_units_l0': 1, 'optimizer': 'Adam', 'adam_learning_rate': 0.00793608027380963}. Best is trial 15 with value: 0.6914615631103516.
Trial 219 finished with value: 0.5043333172798157 and parameters: {'n_layers': 1, 'weight_decay': 1.9212290803080615e-10, 'n_units_l0': 1, 'optimizer': 'SGD', 'sgd_opt_learning_rate': 8.064498482686637e-05, 'sgd_opt_momentum': 0.017794569025143207}. Best is trial 15 with value: 0.6914615631103516.
Trial 220 finished with value: 0.5043333172798157 and parameters: {'n_layers': 1, 'weight_decay': 6.975802104492423e-07, 'n_units_l0': 1, 'optimizer': 'SGD', 'sgd_opt_learning_rate': 2.987643886704898e-05, 'sgd_opt_momentum': 0.03098333076722137}. Best is trial 15 with value: 0.6914615631103516.
Trial 221 finished with value: 0.5043333172798157 and parameters: {'n_layers': 1, 'weight_decay': 7.161677755780894e-08, 'n_units_l0': 1, 'optimizer': 'RMSprop', 'rmsprop_learning_rate': 1.5436804195346054e-05, 'rmsprop_weight_decay': 0.860542699773893, 'rmsprop_momentum': 1.5054605361873751e-05}. Best is trial 15 with value: 0.6914615631103516.
Trial 222 finished with value: 0.5043333172798157 and parameters: {'n_layers': 1, 'weight_decay': 4.5748856214232826e-08, 'n_units_l0': 1, 'optimizer': 'RMSprop', 'rmsprop_learning_rate': 3.556664220940746e-05, 'rmsprop_weight_decay': 0.8559623303322644, 'rmsprop_momentum': 0.0007643620124179942}. Best is trial 15 with value: 0.6914615631103516.
Trial 223 finished with value: 0.5043333172798157 and parameters: {'n_layers': 1, 'weight_decay': 1.4287670978000317e-07, 'n_units_l0': 1, 'optimizer': 'RMSprop', 'rmsprop_learning_rate': 1.8313957584030627e-05, 'rmsprop_weight_decay': 0.8619127261190882, 'rmsprop_momentum': 2.2617409978511782e-05}. Best is trial 15 with value: 0.6914615631103516.
Trial 224 finished with value: 0.5043333172798157 and parameters: {'n_layers': 1, 'weight_decay': 5.109290626277041e-10, 'n_units_l0': 1, 'optimizer': 'RMSprop', 'rmsprop_learning_rate': 1.3104253997239291e-05, 'rmsprop_weight_decay': 0.868510401288997, 'rmsprop_momentum': 0.0029045844405929744}. Best is trial 15 with value: 0.6914615631103516.
Trial 225 finished with value: 0.5043333172798157 and parameters: {'n_layers': 1, 'weight_decay': 8.261218043863717e-08, 'n_units_l0': 1, 'optimizer': 'RMSprop', 'rmsprop_learning_rate': 2.111878890280795e-05, 'rmsprop_weight_decay': 0.8758646416738077, 'rmsprop_momentum': 1.0800245061206462e-05}. Best is trial 15 with value: 0.6914615631103516.
Trial 226 finished with value: 0.5031026005744934 and parameters: {'n_layers': 1, 'weight_decay': 2.2446655600897296e-07, 'n_units_l0': 1, 'optimizer': 'Adam', 'adam_learning_rate': 1.061198479610662e-05}. Best is trial 15 with value: 0.6914615631103516.
Trial 227 finished with value: 0.5733333230018616 and parameters: {'n_layers': 1, 'weight_decay': 6.362410600805806e-08, 'n_units_l0': 1, 'optimizer': 'SGD', 'sgd_opt_learning_rate': 0.0001886213057830655, 'sgd_opt_momentum': 0.006294424530565275}. Best is trial 15 with value: 0.6914615631103516.
Trial 228 finished with value: 0.5419231653213501 and parameters: {'n_layers': 1, 'weight_decay': 5.99143019561805e-08, 'n_units_l0': 1, 'optimizer': 'SGD', 'sgd_opt_learning_rate': 0.0001364900567889163, 'sgd_opt_momentum': 0.006369026045732277}. Best is trial 15 with value: 0.6914615631103516.
Trial 229 finished with value: 0.5043333172798157 and parameters: {'n_layers': 1, 'weight_decay': 6.353392758186962e-08, 'n_units_l0': 1, 'optimizer': 'SGD', 'sgd_opt_learning_rate': 0.00017670480152861238, 'sgd_opt_momentum': 0.006243208342157402}. Best is trial 15 with value: 0.6914615631103516.
Trial 230 finished with value: 0.5043333172798157 and parameters: {'n_layers': 1, 'weight_decay': 3.553063177351237e-08, 'n_units_l0': 1, 'optimizer': 'SGD', 'sgd_opt_learning_rate': 0.00020998371557225584, 'sgd_opt_momentum': 0.004277775068922723}. Best is trial 15 with value: 0.6914615631103516.
Trial 231 finished with value: 0.5043333172798157 and parameters: {'n_layers': 1, 'weight_decay': 1.0320880866939048e-07, 'n_units_l0': 1, 'optimizer': 'SGD', 'sgd_opt_learning_rate': 0.00013618493935359827, 'sgd_opt_momentum': 0.002986325606230756}. Best is trial 15 with value: 0.6914615631103516.
Trial 232 finished with value: 0.5043333172798157 and parameters: {'n_layers': 1, 'weight_decay': 5.119392995044759e-08, 'n_units_l0': 1, 'optimizer': 'SGD', 'sgd_opt_learning_rate': 0.00028678444936991253, 'sgd_opt_momentum': 1.6651813444527933e-05}. Best is trial 15 with value: 0.6914615631103516.
Trial 233 finished with value: 0.5043333172798157 and parameters: {'n_layers': 1, 'weight_decay': 3.1917317793690156e-07, 'n_units_l0': 1, 'optimizer': 'SGD', 'sgd_opt_learning_rate': 0.0005114639675230968, 'sgd_opt_momentum': 0.010755343886088106}. Best is trial 15 with value: 0.6914615631103516.
Trial 234 finished with value: 0.5043333172798157 and parameters: {'n_layers': 1, 'weight_decay': 9.072815435804014e-10, 'n_units_l0': 1, 'optimizer': 'SGD', 'sgd_opt_learning_rate': 9.22640075513923e-05, 'sgd_opt_momentum': 0.006658539984896489}. Best is trial 15 with value: 0.6914615631103516.
Trial 235 finished with value: 0.5043333172798157 and parameters: {'n_layers': 1, 'weight_decay': 3.6771722140682714e-08, 'n_units_l0': 1, 'optimizer': 'SGD', 'sgd_opt_learning_rate': 0.00011172650116819567, 'sgd_opt_momentum': 0.002584811929456091}. Best is trial 15 with value: 0.6914615631103516.
Trial 236 finished with value: 0.5043333172798157 and parameters: {'n_layers': 1, 'weight_decay': 1.2055648969818538e-06, 'n_units_l0': 1, 'optimizer': 'SGD', 'sgd_opt_learning_rate': 5.4390104465711424e-05, 'sgd_opt_momentum': 0.005314163069073404}. Best is trial 15 with value: 0.6914615631103516.
Trial 237 finished with value: 0.457589715719223 and parameters: {'n_layers': 1, 'weight_decay': 5.7004085323826636e-05, 'n_units_l0': 1, 'optimizer': 'SGD', 'sgd_opt_learning_rate': 4.01758666243541e-05, 'sgd_opt_momentum': 0.0034615485819555186}. Best is trial 15 with value: 0.6914615631103516.
Trial 238 finished with value: 0.5043333172798157 and parameters: {'n_layers': 1, 'weight_decay': 2.3617147750539304e-08, 'n_units_l0': 1, 'optimizer': 'SGD', 'sgd_opt_learning_rate': 0.00016382570368359272, 'sgd_opt_momentum': 0.014504046695988503}. Best is trial 15 with value: 0.6914615631103516.
Trial 239 finished with value: 0.5043333172798157 and parameters: {'n_layers': 1, 'weight_decay': 1.1968616132184124e-05, 'n_units_l0': 1, 'optimizer': 'SGD', 'sgd_opt_learning_rate': 6.488634818739674e-05, 'sgd_opt_momentum': 0.008843951267437599}. Best is trial 15 with value: 0.6914615631103516.
Trial 240 finished with value: 0.5043333172798157 and parameters: {'n_layers': 1, 'weight_decay': 6.846963344936626e-08, 'n_units_l0': 1, 'optimizer': 'Adam', 'adam_learning_rate': 0.001421738535599338}. Best is trial 15 with value: 0.6914615631103516.
Trial 241 finished with value: 0.5043333172798157 and parameters: {'n_layers': 1, 'weight_decay': 1.2736822202476843e-07, 'n_units_l0': 1, 'optimizer': 'RMSprop', 'rmsprop_learning_rate': 4.6251460078519425e-05, 'rmsprop_weight_decay': 0.9295765296774388, 'rmsprop_momentum': 0.0004123386522041102}. Best is trial 15 with value: 0.6914615631103516.
Trial 242 finished with value: 0.5043333172798157 and parameters: {'n_layers': 1, 'weight_decay': 5.872809021727723e-08, 'n_units_l0': 1, 'optimizer': 'SGD', 'sgd_opt_learning_rate': 0.04070135552063759, 'sgd_opt_momentum': 0.004716636039412779}. Best is trial 15 with value: 0.6914615631103516.
Trial 243 finished with value: 0.5043333172798157 and parameters: {'n_layers': 1, 'weight_decay': 9.577708209901023e-08, 'n_units_l0': 1, 'optimizer': 'RMSprop', 'rmsprop_learning_rate': 6.524914811120998e-05, 'rmsprop_weight_decay': 0.8674772337059333, 'rmsprop_momentum': 8.843154215585601e-05}. Best is trial 15 with value: 0.6914615631103516.
Trial 244 finished with value: 0.5043333172798157 and parameters: {'n_layers': 1, 'weight_decay': 4.6989289048641086e-08, 'n_units_l0': 1, 'optimizer': 'Adam', 'adam_learning_rate': 0.00038092996959078923}. Best is trial 15 with value: 0.6914615631103516.
Trial 245 finished with value: 0.5043333172798157 and parameters: {'n_layers': 1, 'weight_decay': 2.0076331004848367e-05, 'n_units_l0': 1, 'optimizer': 'SGD', 'sgd_opt_learning_rate': 0.00036926370461738906, 'sgd_opt_momentum': 2.2013390661782137e-05}. Best is trial 15 with value: 0.6914615631103516.
Trial 246 finished with value: 0.5043333172798157 and parameters: {'n_layers': 1, 'weight_decay': 1.641331772132524e-07, 'n_units_l0': 1, 'optimizer': 'RMSprop', 'rmsprop_learning_rate': 2.5327099065396846e-05, 'rmsprop_weight_decay': 0.8509492697385123, 'rmsprop_momentum': 5.627784724912111e-05}. Best is trial 15 with value: 0.6914615631103516.
Trial 247 finished with value: 0.5449743270874023 and parameters: {'n_layers': 1, 'weight_decay': 2.044760649726776e-06, 'n_units_l0': 1, 'optimizer': 'SGD', 'sgd_opt_learning_rate': 2.1725730950308313e-05, 'sgd_opt_momentum': 0.00017594111936500566}. Best is trial 15 with value: 0.6914615631103516.
Trial 248 finished with value: 0.5043333172798157 and parameters: {'n_layers': 1, 'weight_decay': 1.8356271367579755e-06, 'n_units_l0': 1, 'optimizer': 'SGD', 'sgd_opt_learning_rate': 2.294663260093121e-05, 'sgd_opt_momentum': 0.00018306987503273958}. Best is trial 15 with value: 0.6914615631103516.
Trial 249 finished with value: 0.5043333172798157 and parameters: {'n_layers': 1, 'weight_decay': 3.072010143513766e-06, 'n_units_l0': 1, 'optimizer': 'SGD', 'sgd_opt_learning_rate': 1.577790909830205e-05, 'sgd_opt_momentum': 4.1643637212146005e-05}. Best is trial 15 with value: 0.6914615631103516.
Trial 250 finished with value: 0.5043333172798157 and parameters: {'n_layers': 1, 'weight_decay': 1.9327834135749006e-06, 'n_units_l0': 1, 'optimizer': 'SGD', 'sgd_opt_learning_rate': 1.9434523999066235e-05, 'sgd_opt_momentum': 0.0002491594154649814}. Best is trial 15 with value: 0.6914615631103516.
Trial 251 finished with value: 0.5043333172798157 and parameters: {'n_layers': 1, 'weight_decay': 1.3747075802346151e-06, 'n_units_l0': 1, 'optimizer': 'SGD', 'sgd_opt_learning_rate': 3.813326760351319e-05, 'sgd_opt_momentum': 0.00011015085436464517}. Best is trial 15 with value: 0.6914615631103516.
Trial 252 finished with value: 0.5043333172798157 and parameters: {'n_layers': 1, 'weight_decay': 2.6029816622061226e-06, 'n_units_l0': 1, 'optimizer': 'SGD', 'sgd_opt_learning_rate': 0.00024606579897860085, 'sgd_opt_momentum': 5.812568270364999e-05}. Best is trial 15 with value: 0.6914615631103516.
Trial 253 finished with value: 0.5043333172798157 and parameters: {'n_layers': 1, 'weight_decay': 2.1897199304294533e-10, 'n_units_l0': 1, 'optimizer': 'SGD', 'sgd_opt_learning_rate': 0.0005164279403345051, 'sgd_opt_momentum': 0.0001483458184005538}. Best is trial 15 with value: 0.6914615631103516.
Trial 254 finished with value: 0.5043333172798157 and parameters: {'n_layers': 1, 'weight_decay': 4.3037226193052825e-06, 'n_units_l0': 1, 'optimizer': 'Adam', 'adam_learning_rate': 0.021144840768400345}. Best is trial 15 with value: 0.6914615631103516.
Trial 255 finished with value: 0.5043333172798157 and parameters: {'n_layers': 1, 'weight_decay': 8.579324898343596e-07, 'n_units_l0': 1, 'optimizer': 'SGD', 'sgd_opt_learning_rate': 0.0008008718597387301, 'sgd_opt_momentum': 0.08313848175052503}. Best is trial 15 with value: 0.6914615631103516.
Trial 256 finished with value: 0.5043333172798157 and parameters: {'n_layers': 1, 'weight_decay': 2.9249942366908503e-08, 'n_units_l0': 1, 'optimizer': 'SGD', 'sgd_opt_learning_rate': 0.08307413403250462, 'sgd_opt_momentum': 0.05605785380660774}. Best is trial 15 with value: 0.6914615631103516.
Trial 257 finished with value: 0.5043333172798157 and parameters: {'n_layers': 1, 'weight_decay': 6.701614859993865e-06, 'n_units_l0': 1, 'optimizer': 'Adam', 'adam_learning_rate': 0.006070890796833995}. Best is trial 15 with value: 0.6914615631103516.
Trial 258 finished with value: 0.5043333172798157 and parameters: {'n_layers': 1, 'weight_decay': 1.4780739944523297e-10, 'n_units_l0': 1, 'optimizer': 'SGD', 'sgd_opt_learning_rate': 3.171223546437912e-05, 'sgd_opt_momentum': 0.0018273414022551661}. Best is trial 15 with value: 0.6914615631103516.
Trial 259 finished with value: 0.5043333172798157 and parameters: {'n_layers': 1, 'weight_decay': 4.417516038862518e-07, 'n_units_l0': 1, 'optimizer': 'SGD', 'sgd_opt_learning_rate': 7.405440661216911e-05, 'sgd_opt_momentum': 0.00011729175325614498}. Best is trial 15 with value: 0.6914615631103516.
Trial 260 finished with value: 0.5043333172798157 and parameters: {'n_layers': 1, 'weight_decay': 2.11377933551813e-07, 'n_units_l0': 1, 'optimizer': 'Adam', 'adam_learning_rate': 0.010777926869205963}. Best is trial 15 with value: 0.6914615631103516.
Trial 261 finished with value: 0.5043333172798157 and parameters: {'n_layers': 1, 'weight_decay': 3.7822119299794826e-08, 'n_units_l0': 1, 'optimizer': 'SGD', 'sgd_opt_learning_rate': 9.578125752540658e-05, 'sgd_opt_momentum': 0.0005092219149135814}. Best is trial 15 with value: 0.6914615631103516.
Trial 262 finished with value: 0.5043333172798157 and parameters: {'n_layers': 1, 'weight_decay': 1.5803441720329247e-08, 'n_units_l0': 1, 'optimizer': 'SGD', 'sgd_opt_learning_rate': 2.5253795952523892e-05, 'sgd_opt_momentum': 8.177741772779008e-05}. Best is trial 15 with value: 0.6914615631103516.
Trial 263 finished with value: 0.5043333172798157 and parameters: {'n_layers': 1, 'weight_decay': 3.8800684464787474e-10, 'n_units_l0': 1, 'optimizer': 'Adam', 'adam_learning_rate': 0.0022588486161703217}. Best is trial 15 with value: 0.6914615631103516.
Trial 264 finished with value: 0.5043333172798157 and parameters: {'n_layers': 1, 'weight_decay': 2.230399872404398e-06, 'n_units_l0': 1, 'optimizer': 'RMSprop', 'rmsprop_learning_rate': 0.00018195352224315695, 'rmsprop_weight_decay': 0.9728157383809108, 'rmsprop_momentum': 0.00016399923078098936}. Best is trial 15 with value: 0.6914615631103516.
Trial 265 finished with value: 0.49566662311553955 and parameters: {'n_layers': 1, 'weight_decay': 2.3501739067382577e-08, 'n_units_l0': 1, 'optimizer': 'SGD', 'sgd_opt_learning_rate': 1.0050928177805181e-05, 'sgd_opt_momentum': 0.024707818611564562}. Best is trial 15 with value: 0.6914615631103516.
Trial 266 finished with value: 0.5043333172798157 and parameters: {'n_layers': 1, 'weight_decay': 1.0800647540048616e-08, 'n_units_l0': 1, 'optimizer': 'SGD', 'sgd_opt_learning_rate': 5.916672138637649e-05, 'sgd_opt_momentum': 0.038930965818500016}. Best is trial 15 with value: 0.6914615631103516.
Trial 267 finished with value: 0.5043333172798157 and parameters: {'n_layers': 1, 'weight_decay': 7.747769525230657e-08, 'n_units_l0': 1, 'optimizer': 'RMSprop', 'rmsprop_learning_rate': 7.66137310948439e-05, 'rmsprop_weight_decay': 0.9795300787501123, 'rmsprop_momentum': 0.0002685052509762139}. Best is trial 15 with value: 0.6914615631103516.
Trial 268 finished with value: 0.5043333172798157 and parameters: {'n_layers': 1, 'weight_decay': 1.0645070503751148e-06, 'n_units_l0': 1, 'optimizer': 'Adam', 'adam_learning_rate': 5.74883412821682e-05}. Best is trial 15 with value: 0.6914615631103516.
Trial 269 finished with value: 0.5043333172798157 and parameters: {'n_layers': 1, 'weight_decay': 1.5823722545548926e-06, 'n_units_l0': 1, 'optimizer': 'SGD', 'sgd_opt_learning_rate': 0.03292756311132227, 'sgd_opt_momentum': 1.4088395228704668e-05}. Best is trial 15 with value: 0.6914615631103516.
Trial 270 finished with value: 0.5043333172798157 and parameters: {'n_layers': 1, 'weight_decay': 1.0178268831634129e-10, 'n_units_l0': 1, 'optimizer': 'RMSprop', 'rmsprop_learning_rate': 1.2019335005303185e-05, 'rmsprop_weight_decay': 0.8993289734062238, 'rmsprop_momentum': 0.0006559779304633899}. Best is trial 15 with value: 0.6914615631103516.
Trial 271 finished with value: 0.5043333172798157 and parameters: {'n_layers': 1, 'weight_decay': 1.0815776609239887e-07, 'n_units_l0': 1, 'optimizer': 'SGD', 'sgd_opt_learning_rate': 0.051598867004669945, 'sgd_opt_momentum': 0.00029649204653170935}. Best is trial 15 with value: 0.6914615631103516.
Trial 272 finished with value: 0.5043333172798157 and parameters: {'n_layers': 1, 'weight_decay': 8.393420308415865e-05, 'n_units_l0': 1, 'optimizer': 'Adam', 'adam_learning_rate': 0.0010426987270478955}. Best is trial 15 with value: 0.6914615631103516.
Trial 273 finished with value: 0.5043333172798157 and parameters: {'n_layers': 1, 'weight_decay': 4.4722311940398515e-08, 'n_units_l0': 1, 'optimizer': 'SGD', 'sgd_opt_learning_rate': 0.021353009144394187, 'sgd_opt_momentum': 0.0001771973332733562}. Best is trial 15 with value: 0.6914615631103516.
Trial 274 finished with value: 0.5043333172798157 and parameters: {'n_layers': 1, 'weight_decay': 5.779836318477356e-07, 'n_units_l0': 1, 'optimizer': 'RMSprop', 'rmsprop_learning_rate': 0.00011545726662389636, 'rmsprop_weight_decay': 0.9486608549310562, 'rmsprop_momentum': 0.004711776276610783}. Best is trial 15 with value: 0.6914615631103516.
Trial 275 finished with value: 0.5043333172798157 and parameters: {'n_layers': 1, 'weight_decay': 5.7671028919273485e-08, 'n_units_l0': 1, 'optimizer': 'SGD', 'sgd_opt_learning_rate': 4.489354185652586e-05, 'sgd_opt_momentum': 0.007606561962333643}. Best is trial 15 with value: 0.6914615631103516.
Trial 276 finished with value: 0.5043333172798157 and parameters: {'n_layers': 1, 'weight_decay': 3.0332042162626343e-07, 'n_units_l0': 1, 'optimizer': 'SGD', 'sgd_opt_learning_rate': 0.00013756520481087413, 'sgd_opt_momentum': 0.0034469671261672316}. Best is trial 15 with value: 0.6914615631103516.
Trial 277 finished with value: 0.5043333172798157 and parameters: {'n_layers': 1, 'weight_decay': 9.463163660292335e-06, 'n_units_l0': 1, 'optimizer': 'RMSprop', 'rmsprop_learning_rate': 3.5040879329613365e-05, 'rmsprop_weight_decay': 0.9418643777875365, 'rmsprop_momentum': 3.3674418702026104e-05}. Best is trial 15 with value: 0.6914615631103516.
Trial 278 finished with value: 0.5043333172798157 and parameters: {'n_layers': 1, 'weight_decay': 3.6469636971360766e-06, 'n_units_l0': 1, 'optimizer': 'Adam', 'adam_learning_rate': 0.00023739166767486447}. Best is trial 15 with value: 0.6914615631103516.
Trial 279 finished with value: 0.5043333172798157 and parameters: {'n_layers': 1, 'weight_decay': 1.5229075545046746e-07, 'n_units_l0': 1, 'optimizer': 'SGD', 'sgd_opt_learning_rate': 1.9701987358748777e-05, 'sgd_opt_momentum': 0.0008680739177315791}. Best is trial 15 with value: 0.6914615631103516.
Trial 280 finished with value: 0.5043333172798157 and parameters: {'n_layers': 1, 'weight_decay': 2.8879167982236323e-08, 'n_units_l0': 1, 'optimizer': 'RMSprop', 'rmsprop_learning_rate': 5.3018571304107916e-05, 'rmsprop_weight_decay': 0.9136327226161118, 'rmsprop_momentum': 8.732360800313551e-05}. Best is trial 15 with value: 0.6914615631103516.
Trial 281 finished with value: 0.5043333172798157 and parameters: {'n_layers': 1, 'weight_decay': 2.1163918571105884e-08, 'n_units_l0': 1, 'optimizer': 'SGD', 'sgd_opt_learning_rate': 0.0014473877305327995, 'sgd_opt_momentum': 0.0025342700979920137}. Best is trial 15 with value: 0.6914615631103516.
Trial 282 finished with value: 0.5043333172798157 and parameters: {'n_layers': 1, 'weight_decay': 8.06003610903831e-07, 'n_units_l0': 1, 'optimizer': 'Adam', 'adam_learning_rate': 0.004428416022643111}. Best is trial 15 with value: 0.6914615631103516.
Trial 283 finished with value: 0.5043333172798157 and parameters: {'n_layers': 1, 'weight_decay': 0.00016759645792233127, 'n_units_l0': 1, 'optimizer': 'SGD', 'sgd_opt_learning_rate': 0.007803212751362166, 'sgd_opt_momentum': 0.016789711577125332}. Best is trial 15 with value: 0.6914615631103516.
Trial 284 finished with value: 0.5043333172798157 and parameters: {'n_layers': 1, 'weight_decay': 7.17900058445322e-08, 'n_units_l0': 1, 'optimizer': 'RMSprop', 'rmsprop_learning_rate': 1.634696034173437e-05, 'rmsprop_weight_decay': 0.890557617244412, 'rmsprop_momentum': 0.0012552531399965046}. Best is trial 15 with value: 0.6914615631103516.
Trial 285 finished with value: 0.5043333172798157 and parameters: {'n_layers': 1, 'weight_decay': 5.824061222902953e-09, 'n_units_l0': 1, 'optimizer': 'SGD', 'sgd_opt_learning_rate': 0.00017519373666171706, 'sgd_opt_momentum': 1.162369189327176e-05}. Best is trial 15 with value: 0.6914615631103516.
Trial 286 finished with value: 0.5043333172798157 and parameters: {'n_layers': 1, 'weight_decay': 1.153162813014714e-07, 'n_units_l0': 1, 'optimizer': 'Adam', 'adam_learning_rate': 0.003487611163073924}. Best is trial 15 with value: 0.6914615631103516.
