A new study created in memory with name: no-name-cd150b9e-48d2-4535-a6fe-6afab6e0cb20
Trial 0 finished with value: 0.5043333172798157 and parameters: {'n_layers': 1, 'weight_decay': 1.5569123503240935e-07, 'n_units_l0': 1, 'optimizer': 'RMSprop', 'rmsprop_learning_rate': 7.126974295381236e-05, 'rmsprop_weight_decay': 0.8629554540588039, 'rmsprop_momentum': 4.8700847308337416e-05}. Best is trial 0 with value: 0.5043333172798157.
Trial 1 finished with value: 0.5043333172798157 and parameters: {'n_layers': 1, 'weight_decay': 3.897056823590243e-06, 'n_units_l0': 1, 'optimizer': 'SGD', 'sgd_opt_learning_rate': 0.00010243273999090197, 'sgd_opt_momentum': 1.4845539455062983e-05}. Best is trial 0 with value: 0.5043333172798157.
Trial 2 finished with value: 0.5043333172798157 and parameters: {'n_layers': 1, 'weight_decay': 9.823794398975576e-07, 'n_units_l0': 1, 'optimizer': 'Adam', 'adam_learning_rate': 0.007333575149762345}. Best is trial 0 with value: 0.5043333172798157.
Trial 3 finished with value: 0.5043333172798157 and parameters: {'n_layers': 1, 'weight_decay': 1.4542310178496983e-05, 'n_units_l0': 1, 'optimizer': 'SGD', 'sgd_opt_learning_rate': 0.0005369751590154943, 'sgd_opt_momentum': 0.02600634743404972}. Best is trial 0 with value: 0.5043333172798157.
Trial 4 finished with value: 0.5043333172798157 and parameters: {'n_layers': 1, 'weight_decay': 5.4163167175400946e-08, 'n_units_l0': 1, 'optimizer': 'Adam', 'adam_learning_rate': 0.003074133752683868}. Best is trial 0 with value: 0.5043333172798157.
Trial 5 finished with value: 0.5043333172798157 and parameters: {'n_layers': 1, 'weight_decay': 8.92938533180433e-05, 'n_units_l0': 1, 'optimizer': 'Adam', 'adam_learning_rate': 0.010728831532592523}. Best is trial 0 with value: 0.5043333172798157.
Trial 6 finished with value: 0.5043333172798157 and parameters: {'n_layers': 1, 'weight_decay': 2.346773473526531e-09, 'n_units_l0': 1, 'optimizer': 'Adam', 'adam_learning_rate': 0.0006592904103945148}. Best is trial 0 with value: 0.5043333172798157.
Trial 7 finished with value: 0.6792305707931519 and parameters: {'n_layers': 1, 'weight_decay': 2.1934121439053684e-08, 'n_units_l0': 1, 'optimizer': 'RMSprop', 'rmsprop_learning_rate': 1.1034887433646796e-05, 'rmsprop_weight_decay': 0.9555557728636863, 'rmsprop_momentum': 0.008563957463197243}. Best is trial 7 with value: 0.6792305707931519.
Trial 8 finished with value: 0.5043333172798157 and parameters: {'n_layers': 1, 'weight_decay': 3.4822770691187865e-08, 'n_units_l0': 1, 'optimizer': 'Adam', 'adam_learning_rate': 0.002687023837803085}. Best is trial 7 with value: 0.6792305707931519.
Trial 9 finished with value: 0.5043333172798157 and parameters: {'n_layers': 1, 'weight_decay': 4.921616091151599e-06, 'n_units_l0': 1, 'optimizer': 'SGD', 'sgd_opt_learning_rate': 0.007758929290913614, 'sgd_opt_momentum': 0.008693934044091836}. Best is trial 7 with value: 0.6792305707931519.
Trial 10 finished with value: 0.5043333172798157 and parameters: {'n_layers': 1, 'weight_decay': 1.5841524156842223e-10, 'n_units_l0': 1, 'optimizer': 'RMSprop', 'rmsprop_learning_rate': 1.2591523304335681e-05, 'rmsprop_weight_decay': 0.9857146419556363, 'rmsprop_momentum': 0.061709026947110474}. Best is trial 7 with value: 0.6792305707931519.
Trial 11 finished with value: 0.5043333172798157 and parameters: {'n_layers': 1, 'weight_decay': 7.648969416694591e-08, 'n_units_l0': 1, 'optimizer': 'RMSprop', 'rmsprop_learning_rate': 1.92986448939666e-05, 'rmsprop_weight_decay': 0.8556136167561773, 'rmsprop_momentum': 1.4991339148238314e-05}. Best is trial 7 with value: 0.6792305707931519.
Trial 12 finished with value: 0.5043333172798157 and parameters: {'n_layers': 1, 'weight_decay': 3.333593506120338e-09, 'n_units_l0': 1, 'optimizer': 'RMSprop', 'rmsprop_learning_rate': 0.0001603891735923097, 'rmsprop_weight_decay': 0.9429394163923115, 'rmsprop_momentum': 0.0031687478178537114}. Best is trial 7 with value: 0.6792305707931519.
Trial 13 finished with value: 0.5043333172798157 and parameters: {'n_layers': 1, 'weight_decay': 0.0007972283944420982, 'n_units_l0': 1, 'optimizer': 'RMSprop', 'rmsprop_learning_rate': 0.08063653224091484, 'rmsprop_weight_decay': 0.853220007514873, 'rmsprop_momentum': 2.646035011891499e-05}. Best is trial 7 with value: 0.6792305707931519.
Trial 14 finished with value: 0.5043333172798157 and parameters: {'n_layers': 1, 'weight_decay': 4.08863124566526e-09, 'n_units_l0': 1, 'optimizer': 'RMSprop', 'rmsprop_learning_rate': 0.00027180907479036024, 'rmsprop_weight_decay': 0.9205180299110713, 'rmsprop_momentum': 0.0029499955722758933}. Best is trial 7 with value: 0.6792305707931519.
Trial 15 finished with value: 0.6914615631103516 and parameters: {'n_layers': 1, 'weight_decay': 6.203462090049855e-07, 'n_units_l0': 1, 'optimizer': 'RMSprop', 'rmsprop_learning_rate': 1.1968649845347318e-05, 'rmsprop_weight_decay': 0.9626475069820223, 'rmsprop_momentum': 0.00016506414969270425}. Best is trial 15 with value: 0.6914615631103516.
Trial 16 finished with value: 0.5043333172798157 and parameters: {'n_layers': 1, 'weight_decay': 6.940718973172447e-07, 'n_units_l0': 1, 'optimizer': 'RMSprop', 'rmsprop_learning_rate': 0.003764579354724018, 'rmsprop_weight_decay': 0.9675344521540907, 'rmsprop_momentum': 0.0003456867817528206}. Best is trial 15 with value: 0.6914615631103516.
Trial 17 finished with value: 0.5043333172798157 and parameters: {'n_layers': 1, 'weight_decay': 4.0571424388252736e-10, 'n_units_l0': 1, 'optimizer': 'RMSprop', 'rmsprop_learning_rate': 0.003964322462018432, 'rmsprop_weight_decay': 0.9505923470922679, 'rmsprop_momentum': 0.04987474831095251}. Best is trial 15 with value: 0.6914615631103516.
Trial 18 finished with value: 0.5043333172798157 and parameters: {'n_layers': 1, 'weight_decay': 2.4113310533492765e-08, 'n_units_l0': 1, 'optimizer': 'RMSprop', 'rmsprop_learning_rate': 1.4044564611767157e-05, 'rmsprop_weight_decay': 0.9164463665550576, 'rmsprop_momentum': 0.000340829808451813}. Best is trial 15 with value: 0.6914615631103516.
Trial 19 finished with value: 0.5043333172798157 and parameters: {'n_layers': 1, 'weight_decay': 4.483410908043842e-07, 'n_units_l0': 1, 'optimizer': 'RMSprop', 'rmsprop_learning_rate': 5.3530361866558254e-05, 'rmsprop_weight_decay': 0.9883066436462316, 'rmsprop_momentum': 0.010715658192737955}. Best is trial 15 with value: 0.6914615631103516.
Trial 20 finished with value: 0.5043333172798157 and parameters: {'n_layers': 1, 'weight_decay': 3.66964778172417e-05, 'n_units_l0': 1, 'optimizer': 'SGD', 'sgd_opt_learning_rate': 0.08803028946267714, 'sgd_opt_momentum': 7.363244229417739e-05}. Best is trial 15 with value: 0.6914615631103516.
Trial 21 finished with value: 0.5043333172798157 and parameters: {'n_layers': 1, 'weight_decay': 2.0192496125135228e-07, 'n_units_l0': 1, 'optimizer': 'RMSprop', 'rmsprop_learning_rate': 6.560161947989927e-05, 'rmsprop_weight_decay': 0.8897336958080748, 'rmsprop_momentum': 0.00010512096343360618}. Best is trial 15 with value: 0.6914615631103516.
Trial 22 finished with value: 0.5043333172798157 and parameters: {'n_layers': 1, 'weight_decay': 1.752309427754976e-08, 'n_units_l0': 1, 'optimizer': 'RMSprop', 'rmsprop_learning_rate': 1.0727313353464694e-05, 'rmsprop_weight_decay': 0.9527765617023745, 'rmsprop_momentum': 7.509463924496398e-05}. Best is trial 15 with value: 0.6914615631103516.
Trial 23 finished with value: 0.5043333172798157 and parameters: {'n_layers': 1, 'weight_decay': 1.905123227189782e-07, 'n_units_l0': 1, 'optimizer': 'RMSprop', 'rmsprop_learning_rate': 5.544362682755329e-05, 'rmsprop_weight_decay': 0.9245737666277115, 'rmsprop_momentum': 0.00010381352659257894}. Best is trial 15 with value: 0.6914615631103516.
Trial 24 finished with value: 0.5043333172798157 and parameters: {'n_layers': 1, 'weight_decay': 2.807757538547628e-06, 'n_units_l0': 1, 'optimizer': 'RMSprop', 'rmsprop_learning_rate': 0.0005148452841110888, 'rmsprop_weight_decay': 0.8853896389497204, 'rmsprop_momentum': 0.0007573892044341721}. Best is trial 15 with value: 0.6914615631103516.
Trial 25 finished with value: 0.5043333172798157 and parameters: {'n_layers': 1, 'weight_decay': 8.754208018528553e-09, 'n_units_l0': 1, 'optimizer': 'RMSprop', 'rmsprop_learning_rate': 3.653579870252215e-05, 'rmsprop_weight_decay': 0.9674850129318479, 'rmsprop_momentum': 4.0567590962298885e-05}. Best is trial 15 with value: 0.6914615631103516.
Trial 26 finished with value: 0.5043333172798157 and parameters: {'n_layers': 1, 'weight_decay': 9.298458641496575e-10, 'n_units_l0': 1, 'optimizer': 'RMSprop', 'rmsprop_learning_rate': 0.0018648397869010674, 'rmsprop_weight_decay': 0.8932601605237998, 'rmsprop_momentum': 0.016550748765474455}. Best is trial 15 with value: 0.6914615631103516.
Trial 27 finished with value: 0.5043333172798157 and parameters: {'n_layers': 1, 'weight_decay': 1.7847628196150607e-07, 'n_units_l0': 1, 'optimizer': 'RMSprop', 'rmsprop_learning_rate': 0.00013714129182871483, 'rmsprop_weight_decay': 0.9388558618817602, 'rmsprop_momentum': 0.0002696893312896737}. Best is trial 15 with value: 0.6914615631103516.
Trial 28 finished with value: 0.5043333172798157 and parameters: {'n_layers': 1, 'weight_decay': 1.130273926274534e-06, 'n_units_l0': 1, 'optimizer': 'SGD', 'sgd_opt_learning_rate': 4.7722699355586986e-05, 'sgd_opt_momentum': 0.00083233815596591}. Best is trial 15 with value: 0.6914615631103516.
Trial 29 finished with value: 0.5043333172798157 and parameters: {'n_layers': 1, 'weight_decay': 3.330196469784601e-06, 'n_units_l0': 1, 'optimizer': 'RMSprop', 'rmsprop_learning_rate': 2.7912945095882813e-05, 'rmsprop_weight_decay': 0.9705734597000562, 'rmsprop_momentum': 0.002584455602034994}. Best is trial 15 with value: 0.6914615631103516.
Trial 30 finished with value: 0.5043333172798157 and parameters: {'n_layers': 1, 'weight_decay': 9.175545557898512e-08, 'n_units_l0': 1, 'optimizer': 'RMSprop', 'rmsprop_learning_rate': 9.286133038571601e-05, 'rmsprop_weight_decay': 0.8706933573225607, 'rmsprop_momentum': 1.2406614202848002e-05}. Best is trial 15 with value: 0.6914615631103516.
Trial 31 finished with value: 0.5043333172798157 and parameters: {'n_layers': 1, 'weight_decay': 1.3424169210062106e-06, 'n_units_l0': 1, 'optimizer': 'SGD', 'sgd_opt_learning_rate': 1.3403769825848015e-05, 'sgd_opt_momentum': 1.3620496421423626e-05}. Best is trial 15 with value: 0.6914615631103516.
Trial 32 finished with value: 0.5043333172798157 and parameters: {'n_layers': 1, 'weight_decay': 1.90418984888479e-05, 'n_units_l0': 1, 'optimizer': 'SGD', 'sgd_opt_learning_rate': 0.0003136481368098401, 'sgd_opt_momentum': 0.00023898390608786664}. Best is trial 15 with value: 0.6914615631103516.
Trial 33 finished with value: 0.49566662311553955 and parameters: {'n_layers': 1, 'weight_decay': 9.301172025434406e-06, 'n_units_l0': 1, 'optimizer': 'SGD', 'sgd_opt_learning_rate': 0.00010354338973030821, 'sgd_opt_momentum': 1.0932490598149346e-05}. Best is trial 15 with value: 0.6914615631103516.
Trial 34 finished with value: 0.5043333172798157 and parameters: {'n_layers': 1, 'weight_decay': 0.00013314307980996193, 'n_units_l0': 1, 'optimizer': 'SGD', 'sgd_opt_learning_rate': 0.0032765761692269578, 'sgd_opt_momentum': 0.003017546129406772}. Best is trial 15 with value: 0.6914615631103516.
Trial 35 finished with value: 0.5043333172798157 and parameters: {'n_layers': 1, 'weight_decay': 4.906752284906393e-07, 'n_units_l0': 1, 'optimizer': 'Adam', 'adam_learning_rate': 1.4066178265384292e-05}. Best is trial 15 with value: 0.6914615631103516.
Trial 36 finished with value: 0.5043333172798157 and parameters: {'n_layers': 1, 'weight_decay': 7.50136142553929e-09, 'n_units_l0': 1, 'optimizer': 'Adam', 'adam_learning_rate': 0.0853621426458179}. Best is trial 15 with value: 0.6914615631103516.
Trial 37 finished with value: 0.5006154179573059 and parameters: {'n_layers': 1, 'weight_decay': 5.946163666170963e-08, 'n_units_l0': 1, 'optimizer': 'SGD', 'sgd_opt_learning_rate': 1.331104670414302e-05, 'sgd_opt_momentum': 8.068905087210766e-05}. Best is trial 15 with value: 0.6914615631103516.
Trial 38 finished with value: 0.5043333172798157 and parameters: {'n_layers': 1, 'weight_decay': 2.0668385830545004e-06, 'n_units_l0': 1, 'optimizer': 'Adam', 'adam_learning_rate': 1.795112755210069e-05}. Best is trial 15 with value: 0.6914615631103516.
Trial 39 finished with value: 0.5043333172798157 and parameters: {'n_layers': 1, 'weight_decay': 7.653928890280188e-06, 'n_units_l0': 1, 'optimizer': 'SGD', 'sgd_opt_learning_rate': 0.0034260916941559554, 'sgd_opt_momentum': 0.000527282785037066}. Best is trial 15 with value: 0.6914615631103516.
Trial 40 finished with value: 0.5068203806877136 and parameters: {'n_layers': 1, 'weight_decay': 1.397337883858316e-08, 'n_units_l0': 1, 'optimizer': 'SGD', 'sgd_opt_learning_rate': 7.581486404880271e-05, 'sgd_opt_momentum': 0.09782923302634504}. Best is trial 15 with value: 0.6914615631103516.
Trial 41 finished with value: 0.5043333172798157 and parameters: {'n_layers': 1, 'weight_decay': 1.3347774812385904e-08, 'n_units_l0': 1, 'optimizer': 'SGD', 'sgd_opt_learning_rate': 9.88237373070231e-05, 'sgd_opt_momentum': 0.06643937563280211}. Best is trial 15 with value: 0.6914615631103516.
Trial 42 finished with value: 0.5043333172798157 and parameters: {'n_layers': 1, 'weight_decay': 3.290848867487937e-08, 'n_units_l0': 1, 'optimizer': 'SGD', 'sgd_opt_learning_rate': 4.9933015973046e-05, 'sgd_opt_momentum': 0.003789615792263663}. Best is trial 15 with value: 0.6914615631103516.
Trial 43 finished with value: 0.5043333172798157 and parameters: {'n_layers': 1, 'weight_decay': 1.5220863097748253e-09, 'n_units_l0': 1, 'optimizer': 'SGD', 'sgd_opt_learning_rate': 0.00045730964032051144, 'sgd_opt_momentum': 0.06422048259393588}. Best is trial 15 with value: 0.6914615631103516.
Trial 44 finished with value: 0.5043333172798157 and parameters: {'n_layers': 1, 'weight_decay': 1.3302422290963305e-07, 'n_units_l0': 1, 'optimizer': 'SGD', 'sgd_opt_learning_rate': 0.00017372622818611358, 'sgd_opt_momentum': 5.3651153050510645e-05}. Best is trial 15 with value: 0.6914615631103516.
Trial 45 finished with value: 0.5043333172798157 and parameters: {'n_layers': 1, 'weight_decay': 3.3476211968723767e-07, 'n_units_l0': 1, 'optimizer': 'Adam', 'adam_learning_rate': 0.000147055674560013}. Best is trial 15 with value: 0.6914615631103516.
Trial 46 finished with value: 0.5043333172798157 and parameters: {'n_layers': 1, 'weight_decay': 4.051031329174612e-08, 'n_units_l0': 1, 'optimizer': 'RMSprop', 'rmsprop_learning_rate': 1.0255199773938866e-05, 'rmsprop_weight_decay': 0.9068382249730851, 'rmsprop_momentum': 0.0010277628956010814}. Best is trial 15 with value: 0.6914615631103516.
Trial 47 finished with value: 0.5043333172798157 and parameters: {'n_layers': 1, 'weight_decay': 3.868927560038669e-09, 'n_units_l0': 1, 'optimizer': 'RMSprop', 'rmsprop_learning_rate': 0.00048800808076234934, 'rmsprop_weight_decay': 0.9347964501751237, 'rmsprop_momentum': 0.007703546220583928}. Best is trial 15 with value: 0.6914615631103516.
Trial 48 finished with value: 0.5043333172798157 and parameters: {'n_layers': 1, 'weight_decay': 6.16801511852242e-07, 'n_units_l0': 1, 'optimizer': 'SGD', 'sgd_opt_learning_rate': 0.001380002959511406, 'sgd_opt_momentum': 0.014646942528138609}. Best is trial 15 with value: 0.6914615631103516.
Trial 49 finished with value: 0.5043333172798157 and parameters: {'n_layers': 1, 'weight_decay': 8.557683340878367e-08, 'n_units_l0': 1, 'optimizer': 'RMSprop', 'rmsprop_learning_rate': 2.9835347106877222e-05, 'rmsprop_weight_decay': 0.9571019631226414, 'rmsprop_momentum': 0.00019696930812989418}. Best is trial 15 with value: 0.6914615631103516.
Trial 50 finished with value: 0.5043333172798157 and parameters: {'n_layers': 1, 'weight_decay': 8.18575219356562e-09, 'n_units_l0': 1, 'optimizer': 'RMSprop', 'rmsprop_learning_rate': 2.6823158272332086e-05, 'rmsprop_weight_decay': 0.9775577274930753, 'rmsprop_momentum': 0.0008717116064908414}. Best is trial 15 with value: 0.6914615631103516.
Trial 51 finished with value: 0.5043333172798157 and parameters: {'n_layers': 1, 'weight_decay': 1.1762906138864858e-06, 'n_units_l0': 1, 'optimizer': 'Adam', 'adam_learning_rate': 0.07227231875490513}. Best is trial 15 with value: 0.6914615631103516.
Trial 52 finished with value: 0.5043333172798157 and parameters: {'n_layers': 1, 'weight_decay': 5.097144589544167e-06, 'n_units_l0': 1, 'optimizer': 'RMSprop', 'rmsprop_learning_rate': 0.01969393002859369, 'rmsprop_weight_decay': 0.9037070966051145, 'rmsprop_momentum': 4.270171655287745e-05}. Best is trial 15 with value: 0.6914615631103516.
Trial 53 finished with value: 0.5043333172798157 and parameters: {'n_layers': 1, 'weight_decay': 2.947107225847191e-07, 'n_units_l0': 1, 'optimizer': 'Adam', 'adam_learning_rate': 0.014668508113044801}. Best is trial 15 with value: 0.6914615631103516.
Trial 54 finished with value: 0.5043333172798157 and parameters: {'n_layers': 1, 'weight_decay': 2.476932403687539e-05, 'n_units_l0': 1, 'optimizer': 'Adam', 'adam_learning_rate': 0.00019680481649929861}. Best is trial 15 with value: 0.6914615631103516.
Trial 55 finished with value: 0.5043333172798157 and parameters: {'n_layers': 1, 'weight_decay': 1.1985119419996366e-10, 'n_units_l0': 1, 'optimizer': 'Adam', 'adam_learning_rate': 0.015282506157863581}. Best is trial 15 with value: 0.6914615631103516.
Trial 56 finished with value: 0.5043333172798157 and parameters: {'n_layers': 1, 'weight_decay': 0.00010694663211513933, 'n_units_l0': 1, 'optimizer': 'RMSprop', 'rmsprop_learning_rate': 0.00022101296047068758, 'rmsprop_weight_decay': 0.9605350678023675, 'rmsprop_momentum': 0.02411576376095759}. Best is trial 15 with value: 0.6914615631103516.
Trial 57 finished with value: 0.5043333172798157 and parameters: {'n_layers': 1, 'weight_decay': 1.9692326521270855e-08, 'n_units_l0': 1, 'optimizer': 'Adam', 'adam_learning_rate': 0.0006325983589400187}. Best is trial 15 with value: 0.6914615631103516.
Trial 58 finished with value: 0.5043333172798157 and parameters: {'n_layers': 1, 'weight_decay': 8.632897535138741e-07, 'n_units_l0': 1, 'optimizer': 'RMSprop', 'rmsprop_learning_rate': 8.711983100577608e-05, 'rmsprop_weight_decay': 0.8730525140276717, 'rmsprop_momentum': 0.0001379982000233328}. Best is trial 15 with value: 0.6914615631103516.
Trial 59 finished with value: 0.5836922526359558 and parameters: {'n_layers': 1, 'weight_decay': 2.106225066601594e-06, 'n_units_l0': 1, 'optimizer': 'SGD', 'sgd_opt_learning_rate': 3.2982887963058636e-05, 'sgd_opt_momentum': 0.0023199421349887764}. Best is trial 15 with value: 0.6914615631103516.
Trial 60 finished with value: 0.5043333172798157 and parameters: {'n_layers': 1, 'weight_decay': 2.0184583821101387e-06, 'n_units_l0': 1, 'optimizer': 'SGD', 'sgd_opt_learning_rate': 3.258887136215913e-05, 'sgd_opt_momentum': 0.001694458804179219}. Best is trial 15 with value: 0.6914615631103516.
Trial 61 finished with value: 0.5043333172798157 and parameters: {'n_layers': 1, 'weight_decay': 5.65204999868365e-06, 'n_units_l0': 1, 'optimizer': 'SGD', 'sgd_opt_learning_rate': 2.339116283415168e-05, 'sgd_opt_momentum': 0.00022123923213416893}. Best is trial 15 with value: 0.6914615631103516.
Trial 62 finished with value: 0.5043333172798157 and parameters: {'n_layers': 1, 'weight_decay': 1.1463298082270644e-05, 'n_units_l0': 1, 'optimizer': 'SGD', 'sgd_opt_learning_rate': 0.0001328760407391142, 'sgd_opt_momentum': 0.005523967624649171}. Best is trial 15 with value: 0.6914615631103516.
Trial 63 finished with value: 0.5043333172798157 and parameters: {'n_layers': 1, 'weight_decay': 2.772960695256759e-06, 'n_units_l0': 1, 'optimizer': 'SGD', 'sgd_opt_learning_rate': 7.246820289768068e-05, 'sgd_opt_momentum': 0.02581060102445461}. Best is trial 15 with value: 0.6914615631103516.
Trial 64 finished with value: 0.5043333172798157 and parameters: {'n_layers': 1, 'weight_decay': 4.4673454251916475e-05, 'n_units_l0': 1, 'optimizer': 'RMSprop', 'rmsprop_learning_rate': 2.0833389100507218e-05, 'rmsprop_weight_decay': 0.9328948095339546, 'rmsprop_momentum': 4.599333071001583e-05}. Best is trial 15 with value: 0.6914615631103516.
Trial 65 finished with value: 0.5043333172798157 and parameters: {'n_layers': 1, 'weight_decay': 2.707168127342892e-07, 'n_units_l0': 1, 'optimizer': 'SGD', 'sgd_opt_learning_rate': 2.422856814853183e-05, 'sgd_opt_momentum': 2.167533248454531e-05}. Best is trial 15 with value: 0.6914615631103516.
Trial 66 finished with value: 0.5043333172798157 and parameters: {'n_layers': 1, 'weight_decay': 1.1681099677622169e-07, 'n_units_l0': 1, 'optimizer': 'RMSprop', 'rmsprop_learning_rate': 0.0009876834538107544, 'rmsprop_weight_decay': 0.9770126486594892, 'rmsprop_momentum': 0.0005386049047595235}. Best is trial 15 with value: 0.6914615631103516.
Trial 67 finished with value: 0.5043333172798157 and parameters: {'n_layers': 1, 'weight_decay': 4.479867876163558e-08, 'n_units_l0': 1, 'optimizer': 'SGD', 'sgd_opt_learning_rate': 0.0002137451499462638, 'sgd_opt_momentum': 0.001307179516878023}. Best is trial 15 with value: 0.6914615631103516.
Trial 68 finished with value: 0.5043333172798157 and parameters: {'n_layers': 1, 'weight_decay': 1.7376725550549447e-06, 'n_units_l0': 1, 'optimizer': 'RMSprop', 'rmsprop_learning_rate': 4.2987859806730046e-05, 'rmsprop_weight_decay': 0.9466664499188202, 'rmsprop_momentum': 0.0015671029750278088}. Best is trial 15 with value: 0.6914615631103516.
Trial 69 finished with value: 0.5043333172798157 and parameters: {'n_layers': 1, 'weight_decay': 7.341437599031804e-07, 'n_units_l0': 1, 'optimizer': 'SGD', 'sgd_opt_learning_rate': 1.0051922004338362e-05, 'sgd_opt_momentum': 0.00026212006000463133}. Best is trial 15 with value: 0.6914615631103516.
