Trial 144 finished with value: 0.5043333172798157 and parameters: {'n_layers': 1, 'weight_decay': 4.497525961392894e-07, 'n_units_l0': 1, 'optimizer': 'Adam', 'adam_learning_rate': 2.882129798135826e-05}. Best is trial 15 with value: 0.6914615631103516.
Trial 145 finished with value: 0.5043333172798157 and parameters: {'n_layers': 1, 'weight_decay': 3.482804755979526e-10, 'n_units_l0': 1, 'optimizer': 'RMSprop', 'rmsprop_learning_rate': 0.0009041978759325446, 'rmsprop_weight_decay': 0.9205311189308786, 'rmsprop_momentum': 8.88314191013293e-05}. Best is trial 15 with value: 0.6914615631103516.
Trial 146 finished with value: 0.5043333172798157 and parameters: {'n_layers': 1, 'weight_decay': 2.331945458687158e-09, 'n_units_l0': 1, 'optimizer': 'SGD', 'sgd_opt_learning_rate': 0.00039908112731562616, 'sgd_opt_momentum': 0.00020900281578096008}. Best is trial 15 with value: 0.6914615631103516.
Trial 147 finished with value: 0.5043333172798157 and parameters: {'n_layers': 1, 'weight_decay': 0.0008007233011815729, 'n_units_l0': 1, 'optimizer': 'Adam', 'adam_learning_rate': 0.004531258598287835}. Best is trial 15 with value: 0.6914615631103516.
Trial 148 finished with value: 0.5043333172798157 and parameters: {'n_layers': 1, 'weight_decay': 2.8093469962963094e-07, 'n_units_l0': 1, 'optimizer': 'SGD', 'sgd_opt_learning_rate': 3.592012788007536e-05, 'sgd_opt_momentum': 0.0003254899005481403}. Best is trial 15 with value: 0.6914615631103516.
Trial 149 finished with value: 0.5043333172798157 and parameters: {'n_layers': 1, 'weight_decay': 1.4468167467538165e-07, 'n_units_l0': 1, 'optimizer': 'SGD', 'sgd_opt_learning_rate': 0.0002186926676789524, 'sgd_opt_momentum': 0.012974951858107545}. Best is trial 15 with value: 0.6914615631103516.
Trial 150 finished with value: 0.5043333172798157 and parameters: {'n_layers': 1, 'weight_decay': 2.73553347271301e-09, 'n_units_l0': 1, 'optimizer': 'RMSprop', 'rmsprop_learning_rate': 9.112153118201127e-05, 'rmsprop_weight_decay': 0.9591347860915574, 'rmsprop_momentum': 0.010078039798775924}. Best is trial 15 with value: 0.6914615631103516.
Trial 151 finished with value: 0.5043333172798157 and parameters: {'n_layers': 1, 'weight_decay': 2.6308233394638872e-08, 'n_units_l0': 1, 'optimizer': 'Adam', 'adam_learning_rate': 0.0008015109069364662}. Best is trial 15 with value: 0.6914615631103516.
Trial 152 finished with value: 0.5043333172798157 and parameters: {'n_layers': 1, 'weight_decay': 1.881611728857543e-08, 'n_units_l0': 1, 'optimizer': 'Adam', 'adam_learning_rate': 0.0016867512136720037}. Best is trial 15 with value: 0.6914615631103516.
Trial 153 finished with value: 0.5043333172798157 and parameters: {'n_layers': 1, 'weight_decay': 5.1880246996930354e-08, 'n_units_l0': 1, 'optimizer': 'Adam', 'adam_learning_rate': 0.009468446719702492}. Best is trial 15 with value: 0.6914615631103516.
Trial 154 finished with value: 0.5043333172798157 and parameters: {'n_layers': 1, 'weight_decay': 4.570077929358189e-09, 'n_units_l0': 1, 'optimizer': 'Adam', 'adam_learning_rate': 0.0030133071965996907}. Best is trial 15 with value: 0.6914615631103516.
Trial 155 finished with value: 0.5043333172798157 and parameters: {'n_layers': 1, 'weight_decay': 2.1120565295036464e-07, 'n_units_l0': 1, 'optimizer': 'Adam', 'adam_learning_rate': 0.0003522495626221981}. Best is trial 15 with value: 0.6914615631103516.
Trial 156 finished with value: 0.5043333172798157 and parameters: {'n_layers': 1, 'weight_decay': 1.009248413675077e-07, 'n_units_l0': 1, 'optimizer': 'SGD', 'sgd_opt_learning_rate': 5.457723443919585e-05, 'sgd_opt_momentum': 0.0033103936609380743}. Best is trial 15 with value: 0.6914615631103516.
Trial 157 finished with value: 0.5043333172798157 and parameters: {'n_layers': 1, 'weight_decay': 9.503823556632618e-09, 'n_units_l0': 1, 'optimizer': 'SGD', 'sgd_opt_learning_rate': 1.1564806757912214e-05, 'sgd_opt_momentum': 0.0012778631662679}. Best is trial 15 with value: 0.6914615631103516.
Trial 158 finished with value: 0.6742563843727112 and parameters: {'n_layers': 1, 'weight_decay': 3.440341115490697e-08, 'n_units_l0': 1, 'optimizer': 'RMSprop', 'rmsprop_learning_rate': 1.5564578143024156e-05, 'rmsprop_weight_decay': 0.9700848439331291, 'rmsprop_momentum': 3.1759565243307325e-05}. Best is trial 15 with value: 0.6914615631103516.
Trial 159 finished with value: 0.5043333172798157 and parameters: {'n_layers': 1, 'weight_decay': 2.382075550276374e-06, 'n_units_l0': 1, 'optimizer': 'RMSprop', 'rmsprop_learning_rate': 1.3845559517636858e-05, 'rmsprop_weight_decay': 0.9714042019813587, 'rmsprop_momentum': 2.5639581994806524e-05}. Best is trial 15 with value: 0.6914615631103516.
Trial 160 finished with value: 0.55046147108078 and parameters: {'n_layers': 1, 'weight_decay': 3.36360204646441e-08, 'n_units_l0': 1, 'optimizer': 'RMSprop', 'rmsprop_learning_rate': 2.470416155785586e-05, 'rmsprop_weight_decay': 0.980066444438812, 'rmsprop_momentum': 5.283671430599904e-05}. Best is trial 15 with value: 0.6914615631103516.
Trial 161 finished with value: 0.5043333172798157 and parameters: {'n_layers': 1, 'weight_decay': 3.777496346683697e-08, 'n_units_l0': 1, 'optimizer': 'RMSprop', 'rmsprop_learning_rate': 2.37358927618394e-05, 'rmsprop_weight_decay': 0.9826736369855834, 'rmsprop_momentum': 3.497395081059487e-05}. Best is trial 15 with value: 0.6914615631103516.
Trial 162 finished with value: 0.5043333172798157 and parameters: {'n_layers': 1, 'weight_decay': 5.593138864729853e-08, 'n_units_l0': 1, 'optimizer': 'RMSprop', 'rmsprop_learning_rate': 4.278135887684533e-05, 'rmsprop_weight_decay': 0.9703720744681155, 'rmsprop_momentum': 6.710264678249897e-05}. Best is trial 15 with value: 0.6914615631103516.
Trial 163 finished with value: 0.5043333172798157 and parameters: {'n_layers': 1, 'weight_decay': 1.4610792101146789e-08, 'n_units_l0': 1, 'optimizer': 'RMSprop', 'rmsprop_learning_rate': 1.3978683200280126e-05, 'rmsprop_weight_decay': 0.9850866579126805, 'rmsprop_momentum': 1.759100173761449e-05}. Best is trial 15 with value: 0.6914615631103516.
Trial 164 finished with value: 0.5043333172798157 and parameters: {'n_layers': 1, 'weight_decay': 3.174835053101659e-08, 'n_units_l0': 1, 'optimizer': 'RMSprop', 'rmsprop_learning_rate': 3.2117203311262666e-05, 'rmsprop_weight_decay': 0.9748705115972613, 'rmsprop_momentum': 0.00013811588263541413}. Best is trial 15 with value: 0.6914615631103516.
Trial 165 finished with value: 0.5043333172798157 and parameters: {'n_layers': 1, 'weight_decay': 6.447218071525853e-07, 'n_units_l0': 1, 'optimizer': 'RMSprop', 'rmsprop_learning_rate': 5.8033012776622504e-05, 'rmsprop_weight_decay': 0.9663946247232135, 'rmsprop_momentum': 4.965217625124675e-05}. Best is trial 15 with value: 0.6914615631103516.
Trial 166 finished with value: 0.5043333172798157 and parameters: {'n_layers': 1, 'weight_decay': 2.179179332120417e-08, 'n_units_l0': 1, 'optimizer': 'RMSprop', 'rmsprop_learning_rate': 2.2427249902856154e-05, 'rmsprop_weight_decay': 0.9549436835439659, 'rmsprop_momentum': 0.0001086090679779222}. Best is trial 15 with value: 0.6914615631103516.
Trial 167 finished with value: 0.5043333172798157 and parameters: {'n_layers': 1, 'weight_decay': 2.5590430521621348e-05, 'n_units_l0': 1, 'optimizer': 'RMSprop', 'rmsprop_learning_rate': 1.0021992973940256e-05, 'rmsprop_weight_decay': 0.9474700603082847, 'rmsprop_momentum': 0.00020208460791066638}. Best is trial 15 with value: 0.6914615631103516.
Trial 168 finished with value: 0.5043333172798157 and parameters: {'n_layers': 1, 'weight_decay': 6.857991549426763e-08, 'n_units_l0': 1, 'optimizer': 'RMSprop', 'rmsprop_learning_rate': 1.4333626858652271e-05, 'rmsprop_weight_decay': 0.9737271717376904, 'rmsprop_momentum': 0.00032546649996676575}. Best is trial 15 with value: 0.6914615631103516.
Trial 169 finished with value: 0.5295383930206299 and parameters: {'n_layers': 1, 'weight_decay': 1.2503018428281878e-06, 'n_units_l0': 1, 'optimizer': 'SGD', 'sgd_opt_learning_rate': 2.6151659910741534e-05, 'sgd_opt_momentum': 0.004514151645067684}. Best is trial 15 with value: 0.6914615631103516.
Trial 170 finished with value: 0.49566662311553955 and parameters: {'n_layers': 1, 'weight_decay': 1.7500975633539566e-06, 'n_units_l0': 1, 'optimizer': 'SGD', 'sgd_opt_learning_rate': 2.528800752328271e-05, 'sgd_opt_momentum': 0.005081596608680512}. Best is trial 15 with value: 0.6914615631103516.
Trial 171 finished with value: 0.5043333172798157 and parameters: {'n_layers': 1, 'weight_decay': 1.1360400940464267e-06, 'n_units_l0': 1, 'optimizer': 'SGD', 'sgd_opt_learning_rate': 2.12915759727493e-05, 'sgd_opt_momentum': 0.0017949282321278882}. Best is trial 15 with value: 0.6914615631103516.
Trial 172 finished with value: 0.5043333172798157 and parameters: {'n_layers': 1, 'weight_decay': 3.195454265957489e-06, 'n_units_l0': 1, 'optimizer': 'SGD', 'sgd_opt_learning_rate': 1.350605604090471e-05, 'sgd_opt_momentum': 0.07046489395077042}. Best is trial 15 with value: 0.6914615631103516.
Trial 173 finished with value: 0.5043333172798157 and parameters: {'n_layers': 1, 'weight_decay': 1.2942352004938865e-07, 'n_units_l0': 1, 'optimizer': 'SGD', 'sgd_opt_learning_rate': 0.070992246931496, 'sgd_opt_momentum': 0.004060063433356704}. Best is trial 15 with value: 0.6914615631103516.
Trial 174 finished with value: 0.5043333172798157 and parameters: {'n_layers': 1, 'weight_decay': 8.498744729546467e-07, 'n_units_l0': 1, 'optimizer': 'SGD', 'sgd_opt_learning_rate': 0.00010212001427641672, 'sgd_opt_momentum': 0.01032411393299037}. Best is trial 15 with value: 0.6914615631103516.
Trial 175 finished with value: 0.5043333172798157 and parameters: {'n_layers': 1, 'weight_decay': 9.310710406533728e-08, 'n_units_l0': 1, 'optimizer': 'SGD', 'sgd_opt_learning_rate': 7.357738504861377e-05, 'sgd_opt_momentum': 0.002251697456242413}. Best is trial 15 with value: 0.6914615631103516.
Trial 176 finished with value: 0.5043333172798157 and parameters: {'n_layers': 1, 'weight_decay': 3.8462812035753714e-07, 'n_units_l0': 1, 'optimizer': 'RMSprop', 'rmsprop_learning_rate': 3.1813866422467126e-05, 'rmsprop_weight_decay': 0.9647437934626079, 'rmsprop_momentum': 3.0544627631074856e-05}. Best is trial 15 with value: 0.6914615631103516.
Trial 177 finished with value: 0.5043333172798157 and parameters: {'n_layers': 1, 'weight_decay': 1.7992152863825512e-07, 'n_units_l0': 1, 'optimizer': 'SGD', 'sgd_opt_learning_rate': 4.658890753525457e-05, 'sgd_opt_momentum': 0.03682341188529655}. Best is trial 15 with value: 0.6914615631103516.
Trial 178 finished with value: 0.5043333172798157 and parameters: {'n_layers': 1, 'weight_decay': 4.008461619170772e-08, 'n_units_l0': 1, 'optimizer': 'SGD', 'sgd_opt_learning_rate': 2.7571006543485386e-05, 'sgd_opt_momentum': 0.007468141077525489}. Best is trial 15 with value: 0.6914615631103516.
Trial 179 finished with value: 0.5043333172798157 and parameters: {'n_layers': 1, 'weight_decay': 5.753366531276955e-06, 'n_units_l0': 1, 'optimizer': 'RMSprop', 'rmsprop_learning_rate': 0.00012270711601499509, 'rmsprop_weight_decay': 0.9391148971233426, 'rmsprop_momentum': 2.0023968557815803e-05}. Best is trial 15 with value: 0.6914615631103516.
Trial 180 finished with value: 0.5043333172798157 and parameters: {'n_layers': 1, 'weight_decay': 3.8016622209715835e-05, 'n_units_l0': 1, 'optimizer': 'SGD', 'sgd_opt_learning_rate': 0.00012246555651107395, 'sgd_opt_momentum': 7.389939504582962e-05}. Best is trial 15 with value: 0.6914615631103516.
Trial 181 finished with value: 0.5043333172798157 and parameters: {'n_layers': 1, 'weight_decay': 2.610077800723625e-10, 'n_units_l0': 1, 'optimizer': 'Adam', 'adam_learning_rate': 0.022000304967850524}. Best is trial 15 with value: 0.6914615631103516.
Trial 182 finished with value: 0.5043333172798157 and parameters: {'n_layers': 1, 'weight_decay': 2.766989752541919e-08, 'n_units_l0': 1, 'optimizer': 'Adam', 'adam_learning_rate': 0.0784362168284642}. Best is trial 15 with value: 0.6914615631103516.
Trial 183 finished with value: 0.5043333172798157 and parameters: {'n_layers': 1, 'weight_decay': 1.3265059658226999e-06, 'n_units_l0': 1, 'optimizer': 'Adam', 'adam_learning_rate': 0.00012957350203320953}. Best is trial 15 with value: 0.6914615631103516.
Trial 184 finished with value: 0.5043333172798157 and parameters: {'n_layers': 1, 'weight_decay': 1.2402966410834267e-08, 'n_units_l0': 1, 'optimizer': 'RMSprop', 'rmsprop_learning_rate': 0.0022002633223790653, 'rmsprop_weight_decay': 0.9819065608456198, 'rmsprop_momentum': 6.870813868556667e-05}. Best is trial 15 with value: 0.6914615631103516.
Trial 185 finished with value: 0.5043333172798157 and parameters: {'n_layers': 1, 'weight_decay': 5.393628588461004e-08, 'n_units_l0': 1, 'optimizer': 'SGD', 'sgd_opt_learning_rate': 3.551049478544768e-05, 'sgd_opt_momentum': 0.0007024281702193925}. Best is trial 15 with value: 0.6914615631103516.
Trial 186 finished with value: 0.5043333172798157 and parameters: {'n_layers': 1, 'weight_decay': 0.00014727243490618192, 'n_units_l0': 1, 'optimizer': 'Adam', 'adam_learning_rate': 0.019971656526445364}. Best is trial 15 with value: 0.6914615631103516.
Trial 187 finished with value: 0.5043333172798157 and parameters: {'n_layers': 1, 'weight_decay': 1.9263830004000902e-08, 'n_units_l0': 1, 'optimizer': 'SGD', 'sgd_opt_learning_rate': 0.0010469379252851312, 'sgd_opt_momentum': 0.02215869346626435}. Best is trial 15 with value: 0.6914615631103516.
Trial 188 finished with value: 0.5043333172798157 and parameters: {'n_layers': 1, 'weight_decay': 7.78992056305039e-08, 'n_units_l0': 1, 'optimizer': 'RMSprop', 'rmsprop_learning_rate': 2.0176992783833944e-05, 'rmsprop_weight_decay': 0.9610402440001398, 'rmsprop_momentum': 1.3202682530693598e-05}. Best is trial 15 with value: 0.6914615631103516.
Trial 189 finished with value: 0.5043333172798157 and parameters: {'n_layers': 1, 'weight_decay': 2.6264859549765057e-07, 'n_units_l0': 1, 'optimizer': 'SGD', 'sgd_opt_learning_rate': 1.426849975931472e-05, 'sgd_opt_momentum': 4.328526598899308e-05}. Best is trial 15 with value: 0.6914615631103516.
Trial 190 finished with value: 0.5043333172798157 and parameters: {'n_layers': 1, 'weight_decay': 5.344234177606844e-07, 'n_units_l0': 1, 'optimizer': 'Adam', 'adam_learning_rate': 0.0041276697104719595}. Best is trial 15 with value: 0.6914615631103516.
Trial 191 finished with value: 0.5043333172798157 and parameters: {'n_layers': 1, 'weight_decay': 4.447931703087343e-06, 'n_units_l0': 1, 'optimizer': 'SGD', 'sgd_opt_learning_rate': 0.03040558252697912, 'sgd_opt_momentum': 0.0026615642341873513}. Best is trial 15 with value: 0.6914615631103516.
Trial 192 finished with value: 0.5043333172798157 and parameters: {'n_layers': 1, 'weight_decay': 8.720524594894208e-06, 'n_units_l0': 1, 'optimizer': 'SGD', 'sgd_opt_learning_rate': 0.010733411879042563, 'sgd_opt_momentum': 0.00869974135220999}. Best is trial 15 with value: 0.6914615631103516.
Trial 193 finished with value: 0.5043333172798157 and parameters: {'n_layers': 1, 'weight_decay': 2.092148291783084e-06, 'n_units_l0': 1, 'optimizer': 'SGD', 'sgd_opt_learning_rate': 0.06809909337371008, 'sgd_opt_momentum': 0.003987537265582239}. Best is trial 15 with value: 0.6914615631103516.
Trial 194 finished with value: 0.5043333172798157 and parameters: {'n_layers': 1, 'weight_decay': 2.6293584871534117e-06, 'n_units_l0': 1, 'optimizer': 'SGD', 'sgd_opt_learning_rate': 0.005305553845588081, 'sgd_opt_momentum': 1.2117377811133594e-05}. Best is trial 15 with value: 0.6914615631103516.
Trial 195 finished with value: 0.5043333172798157 and parameters: {'n_layers': 1, 'weight_decay': 4.191406128662773e-08, 'n_units_l0': 1, 'optimizer': 'SGD', 'sgd_opt_learning_rate': 0.05515439576567374, 'sgd_opt_momentum': 2.575594845951204e-05}. Best is trial 15 with value: 0.6914615631103516.
Trial 196 finished with value: 0.5043333172798157 and parameters: {'n_layers': 1, 'weight_decay': 1.278813643503267e-07, 'n_units_l0': 1, 'optimizer': 'RMSprop', 'rmsprop_learning_rate': 7.88193573843484e-05, 'rmsprop_weight_decay': 0.9549172099057266, 'rmsprop_momentum': 5.323339927739923e-05}. Best is trial 15 with value: 0.6914615631103516.
Trial 197 finished with value: 0.5043333172798157 and parameters: {'n_layers': 1, 'weight_decay': 1.5264495231988906e-06, 'n_units_l0': 1, 'optimizer': 'Adam', 'adam_learning_rate': 0.0009368565579368906}. Best is trial 15 with value: 0.6914615631103516.
Trial 198 finished with value: 0.5043333172798157 and parameters: {'n_layers': 1, 'weight_decay': 7.138870136744312e-09, 'n_units_l0': 1, 'optimizer': 'SGD', 'sgd_opt_learning_rate': 0.0017775763648352465, 'sgd_opt_momentum': 9.803817792238539e-05}. Best is trial 15 with value: 0.6914615631103516.
Trial 199 finished with value: 0.5043333172798157 and parameters: {'n_layers': 1, 'weight_decay': 3.036103476277533e-08, 'n_units_l0': 1, 'optimizer': 'SGD', 'sgd_opt_learning_rate': 0.024252116082282442, 'sgd_opt_momentum': 0.005804112011282507}. Best is trial 15 with value: 0.6914615631103516.
Trial 200 finished with value: 0.5043333172798157 and parameters: {'n_layers': 1, 'weight_decay': 3.2538984777317867e-06, 'n_units_l0': 1, 'optimizer': 'RMSprop', 'rmsprop_learning_rate': 4.499130312803765e-05, 'rmsprop_weight_decay': 0.9798718301618506, 'rmsprop_momentum': 0.00013225219982409674}. Best is trial 15 with value: 0.6914615631103516.
Trial 201 finished with value: 0.5043333172798157 and parameters: {'n_layers': 1, 'weight_decay': 1.5790423635285584e-09, 'n_units_l0': 1, 'optimizer': 'RMSprop', 'rmsprop_learning_rate': 1.2877747480903848e-05, 'rmsprop_weight_decay': 0.8597598791692426, 'rmsprop_momentum': 0.018438641074423386}. Best is trial 15 with value: 0.6914615631103516.
Trial 202 finished with value: 0.5043333172798157 and parameters: {'n_layers': 1, 'weight_decay': 2.957155294237082e-10, 'n_units_l0': 1, 'optimizer': 'RMSprop', 'rmsprop_learning_rate': 2.6581103726889388e-05, 'rmsprop_weight_decay': 0.986633676215727, 'rmsprop_momentum': 0.04900053524034401}. Best is trial 15 with value: 0.6914615631103516.
Trial 203 finished with value: 0.5043333172798157 and parameters: {'n_layers': 1, 'weight_decay': 1.073452995968136e-10, 'n_units_l0': 1, 'optimizer': 'RMSprop', 'rmsprop_learning_rate': 1.8589592209901043e-05, 'rmsprop_weight_decay': 0.9687613860282147, 'rmsprop_momentum': 0.034318583633418165}. Best is trial 15 with value: 0.6914615631103516.
Trial 204 finished with value: 0.5043333172798157 and parameters: {'n_layers': 1, 'weight_decay': 9.691996601642086e-07, 'n_units_l0': 1, 'optimizer': 'RMSprop', 'rmsprop_learning_rate': 1.2286619445964907e-05, 'rmsprop_weight_decay': 0.976011463880398, 'rmsprop_momentum': 0.013837312400288343}. Best is trial 15 with value: 0.6914615631103516.
Trial 205 finished with value: 0.5043333172798157 and parameters: {'n_layers': 1, 'weight_decay': 2.3363767523680312e-08, 'n_units_l0': 1, 'optimizer': 'Adam', 'adam_learning_rate': 0.00232780120769262}. Best is trial 15 with value: 0.6914615631103516.
Trial 206 finished with value: 0.5043333172798157 and parameters: {'n_layers': 1, 'weight_decay': 5.3584960555061114e-08, 'n_units_l0': 1, 'optimizer': 'SGD', 'sgd_opt_learning_rate': 0.004189886228055178, 'sgd_opt_momentum': 0.010619618176840605}. Best is trial 15 with value: 0.6914615631103516.
Trial 207 finished with value: 0.5055640935897827 and parameters: {'n_layers': 1, 'weight_decay': 1.9438142768935222e-10, 'n_units_l0': 1, 'optimizer': 'RMSprop', 'rmsprop_learning_rate': 2.9509801351200046e-05, 'rmsprop_weight_decay': 0.9125367903256218, 'rmsprop_momentum': 0.0005236477976949373}. Best is trial 15 with value: 0.6914615631103516.
Trial 208 finished with value: 0.5043333172798157 and parameters: {'n_layers': 1, 'weight_decay': 1.7710069673759698e-07, 'n_units_l0': 1, 'optimizer': 'RMSprop', 'rmsprop_learning_rate': 5.2912498726157713e-05, 'rmsprop_weight_decay': 0.884301397073214, 'rmsprop_momentum': 0.0005314743161348298}. Best is trial 15 with value: 0.6914615631103516.
Trial 209 finished with value: 0.5043333172798157 and parameters: {'n_layers': 1, 'weight_decay': 9.409446367623043e-08, 'n_units_l0': 1, 'optimizer': 'SGD', 'sgd_opt_learning_rate': 0.011438750493935102, 'sgd_opt_momentum': 0.0015873285706557547}. Best is trial 15 with value: 0.6914615631103516.
Trial 210 finished with value: 0.5043333172798157 and parameters: {'n_layers': 1, 'weight_decay': 3.6185343833717495e-09, 'n_units_l0': 1, 'optimizer': 'Adam', 'adam_learning_rate': 0.05245783310366484}. Best is trial 15 with value: 0.6914615631103516.
Trial 211 finished with value: 0.5043333172798157 and parameters: {'n_layers': 1, 'weight_decay': 1.869835450680793e-10, 'n_units_l0': 1, 'optimizer': 'RMSprop', 'rmsprop_learning_rate': 3.3455600091717465e-05, 'rmsprop_weight_decay': 0.8745980396206229, 'rmsprop_momentum': 0.00193193067853049}. Best is trial 15 with value: 0.6914615631103516.
Trial 212 finished with value: 0.5043333172798157 and parameters: {'n_layers': 1, 'weight_decay': 1.6683788096028843e-10, 'n_units_l0': 1, 'optimizer': 'RMSprop', 'rmsprop_learning_rate': 2.3539163037628353e-05, 'rmsprop_weight_decay': 0.9896067766201811, 'rmsprop_momentum': 0.0003405955556467063}. Best is trial 15 with value: 0.6914615631103516.
Trial 213 finished with value: 0.5043333172798157 and parameters: {'n_layers': 1, 'weight_decay': 1.697175980498256e-08, 'n_units_l0': 1, 'optimizer': 'RMSprop', 'rmsprop_learning_rate': 1.6392441336810845e-05, 'rmsprop_weight_decay': 0.8947766970477491, 'rmsprop_momentum': 3.80106182810137e-05}. Best is trial 15 with value: 0.6914615631103516.
Trial 214 finished with value: 0.5043333172798157 and parameters: {'n_layers': 1, 'weight_decay': 5.258406149787285e-10, 'n_units_l0': 1, 'optimizer': 'RMSprop', 'rmsprop_learning_rate': 1.0087245775510045e-05, 'rmsprop_weight_decay': 0.9851562238475302, 'rmsprop_momentum': 0.0011469597083292294}. Best is trial 15 with value: 0.6914615631103516.
