Trial 359 finished with value: 0.5043333172798157 and parameters: {'n_layers': 1, 'weight_decay': 3.780394026709416e-08, 'n_units_l0': 1, 'optimizer': 'SGD', 'sgd_opt_learning_rate': 0.00799992316873824, 'sgd_opt_momentum': 0.009542942486750102}. Best is trial 15 with value: 0.6914615631103516.
Trial 360 finished with value: 0.5043333172798157 and parameters: {'n_layers': 1, 'weight_decay': 1.0897587456555982e-07, 'n_units_l0': 1, 'optimizer': 'Adam', 'adam_learning_rate': 0.0013720119771488647}. Best is trial 15 with value: 0.6914615631103516.
Trial 361 finished with value: 0.5043333172798157 and parameters: {'n_layers': 1, 'weight_decay': 6.123887009046294e-08, 'n_units_l0': 1, 'optimizer': 'RMSprop', 'rmsprop_learning_rate': 1.9854936620377946e-05, 'rmsprop_weight_decay': 0.9778706028079518, 'rmsprop_momentum': 2.250038427596675e-05}. Best is trial 15 with value: 0.6914615631103516.
Trial 362 finished with value: 0.5104102492332458 and parameters: {'n_layers': 1, 'weight_decay': 1.9766299944038987e-05, 'n_units_l0': 1, 'optimizer': 'SGD', 'sgd_opt_learning_rate': 0.00012591577504805334, 'sgd_opt_momentum': 0.006344634022610213}. Best is trial 15 with value: 0.6914615631103516.
Trial 363 finished with value: 0.5043333172798157 and parameters: {'n_layers': 1, 'weight_decay': 5.58324196894677e-06, 'n_units_l0': 1, 'optimizer': 'SGD', 'sgd_opt_learning_rate': 0.00012154806998761993, 'sgd_opt_momentum': 0.005627857707075799}. Best is trial 15 with value: 0.6914615631103516.
Trial 364 finished with value: 0.5043333172798157 and parameters: {'n_layers': 1, 'weight_decay': 9.504739892399526e-06, 'n_units_l0': 1, 'optimizer': 'SGD', 'sgd_opt_learning_rate': 0.00015660169623969722, 'sgd_opt_momentum': 0.004128202185543754}. Best is trial 15 with value: 0.6914615631103516.
Trial 365 finished with value: 0.5043333172798157 and parameters: {'n_layers': 1, 'weight_decay': 2.174129157439851e-05, 'n_units_l0': 1, 'optimizer': 'SGD', 'sgd_opt_learning_rate': 8.93328687661998e-05, 'sgd_opt_momentum': 0.006539588783689988}. Best is trial 15 with value: 0.6914615631103516.
Trial 366 finished with value: 0.5043333172798157 and parameters: {'n_layers': 1, 'weight_decay': 1.6844630673645865e-05, 'n_units_l0': 1, 'optimizer': 'SGD', 'sgd_opt_learning_rate': 0.00020354476067586044, 'sgd_opt_momentum': 0.008503410861772986}. Best is trial 15 with value: 0.6914615631103516.
Trial 367 finished with value: 0.5012564063072205 and parameters: {'n_layers': 1, 'weight_decay': 4.303016378190256e-07, 'n_units_l0': 1, 'optimizer': 'SGD', 'sgd_opt_learning_rate': 2.5363412379869572e-05, 'sgd_opt_momentum': 0.001432875398701874}. Best is trial 15 with value: 0.6914615631103516.
Trial 368 finished with value: 0.5043333172798157 and parameters: {'n_layers': 1, 'weight_decay': 1.248849782310071e-06, 'n_units_l0': 1, 'optimizer': 'SGD', 'sgd_opt_learning_rate': 0.06490537051722398, 'sgd_opt_momentum': 2.1945268498342392e-05}. Best is trial 15 with value: 0.6914615631103516.
Trial 369 finished with value: 0.5043333172798157 and parameters: {'n_layers': 1, 'weight_decay': 3.9013389642509664e-05, 'n_units_l0': 1, 'optimizer': 'SGD', 'sgd_opt_learning_rate': 0.00013053540577638725, 'sgd_opt_momentum': 0.00015172638912794935}. Best is trial 15 with value: 0.6914615631103516.
Trial 370 finished with value: 0.5043333172798157 and parameters: {'n_layers': 1, 'weight_decay': 0.0002159565095987129, 'n_units_l0': 1, 'optimizer': 'SGD', 'sgd_opt_learning_rate': 0.00029988444012259667, 'sgd_opt_momentum': 0.004704957718459116}. Best is trial 15 with value: 0.6914615631103516.
Trial 371 finished with value: 0.5043333172798157 and parameters: {'n_layers': 1, 'weight_decay': 3.701583355084823e-06, 'n_units_l0': 1, 'optimizer': 'Adam', 'adam_learning_rate': 0.02626123683611314}. Best is trial 15 with value: 0.6914615631103516.
Trial 372 finished with value: 0.5043333172798157 and parameters: {'n_layers': 1, 'weight_decay': 1.1992386824201613e-09, 'n_units_l0': 1, 'optimizer': 'SGD', 'sgd_opt_learning_rate': 0.0012704695675047571, 'sgd_opt_momentum': 0.00276189043029983}. Best is trial 15 with value: 0.6914615631103516.
Trial 373 finished with value: 0.5043333172798157 and parameters: {'n_layers': 1, 'weight_decay': 2.2891365932299383e-08, 'n_units_l0': 1, 'optimizer': 'SGD', 'sgd_opt_learning_rate': 0.00010624724620722636, 'sgd_opt_momentum': 0.0007508494332242798}. Best is trial 15 with value: 0.6914615631103516.
Trial 374 finished with value: 0.5043333172798157 and parameters: {'n_layers': 1, 'weight_decay': 8.467734219794541e-05, 'n_units_l0': 1, 'optimizer': 'Adam', 'adam_learning_rate': 0.055571263461613805}. Best is trial 15 with value: 0.6914615631103516.
Trial 375 finished with value: 0.5043333172798157 and parameters: {'n_layers': 1, 'weight_decay': 2.7458953531959128e-05, 'n_units_l0': 1, 'optimizer': 'SGD', 'sgd_opt_learning_rate': 0.004736318913490142, 'sgd_opt_momentum': 6.905135327408798e-05}. Best is trial 15 with value: 0.6914615631103516.
Trial 376 finished with value: 0.5043333172798157 and parameters: {'n_layers': 1, 'weight_decay': 9.031196392697656e-08, 'n_units_l0': 1, 'optimizer': 'SGD', 'sgd_opt_learning_rate': 7.290378848674252e-05, 'sgd_opt_momentum': 0.0036037939959654712}. Best is trial 15 with value: 0.6914615631103516.
Trial 377 finished with value: 0.5043333172798157 and parameters: {'n_layers': 1, 'weight_decay': 1.729706634123078e-07, 'n_units_l0': 1, 'optimizer': 'SGD', 'sgd_opt_learning_rate': 0.021427933412860756, 'sgd_opt_momentum': 0.021191712473075164}. Best is trial 15 with value: 0.6914615631103516.
Trial 378 finished with value: 0.5043333172798157 and parameters: {'n_layers': 1, 'weight_decay': 9.113772760736802e-07, 'n_units_l0': 1, 'optimizer': 'Adam', 'adam_learning_rate': 9.446118322600268e-05}. Best is trial 15 with value: 0.6914615631103516.
Trial 379 finished with value: 0.5043333172798157 and parameters: {'n_layers': 1, 'weight_decay': 3.927376617079232e-09, 'n_units_l0': 1, 'optimizer': 'SGD', 'sgd_opt_learning_rate': 5.778061815813985e-05, 'sgd_opt_momentum': 0.011496965489783588}. Best is trial 15 with value: 0.6914615631103516.
Trial 380 finished with value: 0.5043333172798157 and parameters: {'n_layers': 1, 'weight_decay': 7.534506765807345e-06, 'n_units_l0': 1, 'optimizer': 'SGD', 'sgd_opt_learning_rate': 0.04395116191292416, 'sgd_opt_momentum': 0.0061852639958488095}. Best is trial 15 with value: 0.6914615631103516.
Trial 381 finished with value: 0.5043333172798157 and parameters: {'n_layers': 1, 'weight_decay': 4.519229214832587e-08, 'n_units_l0': 1, 'optimizer': 'Adam', 'adam_learning_rate': 0.014612415530542648}. Best is trial 15 with value: 0.6914615631103516.
Trial 382 finished with value: 0.5043333172798157 and parameters: {'n_layers': 1, 'weight_decay': 2.56836942145794e-07, 'n_units_l0': 1, 'optimizer': 'SGD', 'sgd_opt_learning_rate': 1.4000358255967701e-05, 'sgd_opt_momentum': 8.474519686167752e-05}. Best is trial 15 with value: 0.6914615631103516.
Trial 383 finished with value: 0.5043333172798157 and parameters: {'n_layers': 1, 'weight_decay': 5.847040132917249e-08, 'n_units_l0': 1, 'optimizer': 'SGD', 'sgd_opt_learning_rate': 0.00017557710414510595, 'sgd_opt_momentum': 0.00820817428977565}. Best is trial 15 with value: 0.6914615631103516.
Trial 384 finished with value: 0.49566662311553955 and parameters: {'n_layers': 1, 'weight_decay': 1.747762760148335e-06, 'n_units_l0': 1, 'optimizer': 'SGD', 'sgd_opt_learning_rate': 4.31559129880866e-05, 'sgd_opt_momentum': 0.0005839770535015535}. Best is trial 15 with value: 0.6914615631103516.
Trial 385 finished with value: 0.5043333172798157 and parameters: {'n_layers': 1, 'weight_decay': 2.8482340588945187e-08, 'n_units_l0': 1, 'optimizer': 'Adam', 'adam_learning_rate': 0.000848722863526174}. Best is trial 15 with value: 0.6914615631103516.
Trial 386 finished with value: 0.5043333172798157 and parameters: {'n_layers': 1, 'weight_decay': 7.927683665023136e-08, 'n_units_l0': 1, 'optimizer': 'SGD', 'sgd_opt_learning_rate': 3.078418493226373e-05, 'sgd_opt_momentum': 0.0021585048050328523}. Best is trial 15 with value: 0.6914615631103516.
Trial 387 finished with value: 0.5061794519424438 and parameters: {'n_layers': 1, 'weight_decay': 1.3325931181536356e-07, 'n_units_l0': 1, 'optimizer': 'SGD', 'sgd_opt_learning_rate': 8.725311624709919e-05, 'sgd_opt_momentum': 0.00042341575493629963}. Best is trial 15 with value: 0.6914615631103516.
Trial 388 finished with value: 0.49566662311553955 and parameters: {'n_layers': 1, 'weight_decay': 1.1347403175535966e-07, 'n_units_l0': 1, 'optimizer': 'SGD', 'sgd_opt_learning_rate': 8.098116718161545e-05, 'sgd_opt_momentum': 0.00029719368667207045}. Best is trial 15 with value: 0.6914615631103516.
Trial 389 finished with value: 0.5043333172798157 and parameters: {'n_layers': 1, 'weight_decay': 1.36265636996036e-07, 'n_units_l0': 1, 'optimizer': 'Adam', 'adam_learning_rate': 0.002758737554598894}. Best is trial 15 with value: 0.6914615631103516.
Trial 390 finished with value: 0.5043333172798157 and parameters: {'n_layers': 1, 'weight_decay': 3.0620110094581705e-07, 'n_units_l0': 1, 'optimizer': 'RMSprop', 'rmsprop_learning_rate': 0.00017417730138626495, 'rmsprop_weight_decay': 0.9021878667148968, 'rmsprop_momentum': 0.00017748214571695968}. Best is trial 15 with value: 0.6914615631103516.
Trial 391 finished with value: 0.5043333172798157 and parameters: {'n_layers': 1, 'weight_decay': 1.9752489769593676e-07, 'n_units_l0': 1, 'optimizer': 'SGD', 'sgd_opt_learning_rate': 9.933464760070361e-05, 'sgd_opt_momentum': 0.00041087455504328616}. Best is trial 15 with value: 0.6914615631103516.
Trial 392 finished with value: 0.5043333172798157 and parameters: {'n_layers': 1, 'weight_decay': 1.373207083285863e-07, 'n_units_l0': 1, 'optimizer': 'SGD', 'sgd_opt_learning_rate': 0.0001552381572104792, 'sgd_opt_momentum': 0.00022179309441290381}. Best is trial 15 with value: 0.6914615631103516.
Trial 393 finished with value: 0.5043333172798157 and parameters: {'n_layers': 1, 'weight_decay': 6.775068294365576e-07, 'n_units_l0': 1, 'optimizer': 'RMSprop', 'rmsprop_learning_rate': 9.081814495961206e-05, 'rmsprop_weight_decay': 0.9415358769863982, 'rmsprop_momentum': 0.0006441403586627683}. Best is trial 15 with value: 0.6914615631103516.
Trial 394 finished with value: 0.5043333172798157 and parameters: {'n_layers': 1, 'weight_decay': 1.5167665415020733e-08, 'n_units_l0': 1, 'optimizer': 'Adam', 'adam_learning_rate': 0.00018567718309435476}. Best is trial 15 with value: 0.6914615631103516.
Trial 395 finished with value: 0.42551282048225403 and parameters: {'n_layers': 1, 'weight_decay': 6.435120080333473e-05, 'n_units_l0': 1, 'optimizer': 'SGD', 'sgd_opt_learning_rate': 6.828049209233178e-05, 'sgd_opt_momentum': 0.000977394608718474}. Best is trial 15 with value: 0.6914615631103516.
Trial 396 finished with value: 0.5043333172798157 and parameters: {'n_layers': 1, 'weight_decay': 8.638278902092521e-08, 'n_units_l0': 1, 'optimizer': 'SGD', 'sgd_opt_learning_rate': 2.132886200167032e-05, 'sgd_opt_momentum': 0.000525404645302257}. Best is trial 15 with value: 0.6914615631103516.
Trial 397 finished with value: 0.5043333172798157 and parameters: {'n_layers': 1, 'weight_decay': 4.0567067430742326e-08, 'n_units_l0': 1, 'optimizer': 'RMSprop', 'rmsprop_learning_rate': 0.0003595955641842927, 'rmsprop_weight_decay': 0.8861101481562076, 'rmsprop_momentum': 4.028304286520859e-05}. Best is trial 15 with value: 0.6914615631103516.
Trial 398 finished with value: 0.5043333172798157 and parameters: {'n_layers': 1, 'weight_decay': 5.6743806021472225e-08, 'n_units_l0': 1, 'optimizer': 'SGD', 'sgd_opt_learning_rate': 5.158125598093723e-05, 'sgd_opt_momentum': 0.035847413502860276}. Best is trial 15 with value: 0.6914615631103516.
Trial 399 finished with value: 0.5289487242698669 and parameters: {'n_layers': 1, 'weight_decay': 1.8953843904462325e-07, 'n_units_l0': 1, 'optimizer': 'Adam', 'adam_learning_rate': 0.0004060375493550108}. Best is trial 15 with value: 0.6914615631103516.
Trial 400 finished with value: 0.5043333172798157 and parameters: {'n_layers': 1, 'weight_decay': 1.7519189421489531e-07, 'n_units_l0': 1, 'optimizer': 'Adam', 'adam_learning_rate': 5.145135340839435e-05}. Best is trial 15 with value: 0.6914615631103516.
Trial 401 finished with value: 0.5043333172798157 and parameters: {'n_layers': 1, 'weight_decay': 3.003802785411363e-07, 'n_units_l0': 1, 'optimizer': 'SGD', 'sgd_opt_learning_rate': 0.00012021913472926135, 'sgd_opt_momentum': 0.0003482596337143359}. Best is trial 15 with value: 0.6914615631103516.
Trial 402 finished with value: 0.5043333172798157 and parameters: {'n_layers': 1, 'weight_decay': 1.9748077333970983e-07, 'n_units_l0': 1, 'optimizer': 'RMSprop', 'rmsprop_learning_rate': 0.00025282754585689583, 'rmsprop_weight_decay': 0.9494049418829068, 'rmsprop_momentum': 0.00022563790610006395}. Best is trial 15 with value: 0.6914615631103516.
Trial 403 finished with value: 0.5043333172798157 and parameters: {'n_layers': 1, 'weight_decay': 1.2325998125492477e-07, 'n_units_l0': 1, 'optimizer': 'SGD', 'sgd_opt_learning_rate': 8.279842417608361e-05, 'sgd_opt_momentum': 0.0001723442609661217}. Best is trial 15 with value: 0.6914615631103516.
Trial 404 finished with value: 0.5043333172798157 and parameters: {'n_layers': 1, 'weight_decay': 4.099590035837798e-07, 'n_units_l0': 1, 'optimizer': 'Adam', 'adam_learning_rate': 0.0003711860294229938}. Best is trial 15 with value: 0.6914615631103516.
Trial 405 finished with value: 0.5043333172798157 and parameters: {'n_layers': 1, 'weight_decay': 2.345012072207158e-07, 'n_units_l0': 1, 'optimizer': 'SGD', 'sgd_opt_learning_rate': 3.643370471938461e-05, 'sgd_opt_momentum': 0.00012296755143631797}. Best is trial 15 with value: 0.6914615631103516.
Trial 406 finished with value: 0.5043333172798157 and parameters: {'n_layers': 1, 'weight_decay': 1.1918062110505375e-07, 'n_units_l0': 1, 'optimizer': 'RMSprop', 'rmsprop_learning_rate': 1.015736011636505e-05, 'rmsprop_weight_decay': 0.9253480873463554, 'rmsprop_momentum': 6.041055434193652e-05}. Best is trial 15 with value: 0.6914615631103516.
Trial 407 finished with value: 0.5043333172798157 and parameters: {'n_layers': 1, 'weight_decay': 1.8986226776845706e-07, 'n_units_l0': 1, 'optimizer': 'SGD', 'sgd_opt_learning_rate': 0.00024137803478507908, 'sgd_opt_momentum': 1.6936522478142065e-05}. Best is trial 15 with value: 0.6914615631103516.
Trial 408 finished with value: 0.5043333172798157 and parameters: {'n_layers': 1, 'weight_decay': 1.0051879567097809e-06, 'n_units_l0': 1, 'optimizer': 'SGD', 'sgd_opt_learning_rate': 0.0006736154173712573, 'sgd_opt_momentum': 0.0002565555444659161}. Best is trial 15 with value: 0.6914615631103516.
Trial 409 finished with value: 0.5043333172798157 and parameters: {'n_layers': 1, 'weight_decay': 2.2260797454952643e-09, 'n_units_l0': 1, 'optimizer': 'Adam', 'adam_learning_rate': 2.1243003525319545e-05}. Best is trial 15 with value: 0.6914615631103516.
Trial 410 finished with value: 0.5043333172798157 and parameters: {'n_layers': 1, 'weight_decay': 9.227872984531503e-08, 'n_units_l0': 1, 'optimizer': 'RMSprop', 'rmsprop_learning_rate': 0.049474218590263554, 'rmsprop_weight_decay': 0.9333736247196246, 'rmsprop_momentum': 0.0003076523468716797}. Best is trial 15 with value: 0.6914615631103516.
Trial 411 finished with value: 0.5043333172798157 and parameters: {'n_layers': 1, 'weight_decay': 6.349134233966051e-07, 'n_units_l0': 1, 'optimizer': 'SGD', 'sgd_opt_learning_rate': 6.359440709896217e-05, 'sgd_opt_momentum': 0.0016482752764493949}. Best is trial 15 with value: 0.6914615631103516.
Trial 412 finished with value: 0.5043333172798157 and parameters: {'n_layers': 1, 'weight_decay': 4.528894890176527e-07, 'n_units_l0': 1, 'optimizer': 'SGD', 'sgd_opt_learning_rate': 0.00010258019066813156, 'sgd_opt_momentum': 0.00010412008231599847}. Best is trial 15 with value: 0.6914615631103516.
Trial 413 finished with value: 0.5043333172798157 and parameters: {'n_layers': 1, 'weight_decay': 1.376774535506219e-06, 'n_units_l0': 1, 'optimizer': 'Adam', 'adam_learning_rate': 0.0006311932180492433}. Best is trial 15 with value: 0.6914615631103516.
Trial 414 finished with value: 0.5043333172798157 and parameters: {'n_layers': 1, 'weight_decay': 2.6833357649403887e-07, 'n_units_l0': 1, 'optimizer': 'RMSprop', 'rmsprop_learning_rate': 0.0008095206666107025, 'rmsprop_weight_decay': 0.938264504265382, 'rmsprop_momentum': 1.3988425514497214e-05}. Best is trial 15 with value: 0.6914615631103516.
Trial 415 finished with value: 0.5043333172798157 and parameters: {'n_layers': 1, 'weight_decay': 7.209586386832875e-08, 'n_units_l0': 1, 'optimizer': 'SGD', 'sgd_opt_learning_rate': 0.00019770504294308838, 'sgd_opt_momentum': 1.2365951763580174e-05}. Best is trial 15 with value: 0.6914615631103516.
Trial 416 finished with value: 0.5043333172798157 and parameters: {'n_layers': 1, 'weight_decay': 1.8552499809938807e-07, 'n_units_l0': 1, 'optimizer': 'SGD', 'sgd_opt_learning_rate': 2.43111096200441e-05, 'sgd_opt_momentum': 0.00046697675306397665}. Best is trial 15 with value: 0.6914615631103516.
Trial 417 finished with value: 0.5043333172798157 and parameters: {'n_layers': 1, 'weight_decay': 1.438262437797704e-07, 'n_units_l0': 1, 'optimizer': 'RMSprop', 'rmsprop_learning_rate': 3.683592748350606e-05, 'rmsprop_weight_decay': 0.9097751222325492, 'rmsprop_momentum': 7.256157473220651e-05}. Best is trial 15 with value: 0.6914615631103516.
Trial 418 finished with value: 0.5043333172798157 and parameters: {'n_layers': 1, 'weight_decay': 9.901709666951718e-09, 'n_units_l0': 1, 'optimizer': 'Adam', 'adam_learning_rate': 0.00027006263471985}. Best is trial 15 with value: 0.6914615631103516.
Trial 419 finished with value: 0.5043333172798157 and parameters: {'n_layers': 1, 'weight_decay': 9.467062087839488e-08, 'n_units_l0': 1, 'optimizer': 'SGD', 'sgd_opt_learning_rate': 0.0009891811468625083, 'sgd_opt_momentum': 5.8077879329546975e-05}. Best is trial 15 with value: 0.6914615631103516.
Trial 420 finished with value: 0.5043333172798157 and parameters: {'n_layers': 1, 'weight_decay': 0.0001393784311420972, 'n_units_l0': 1, 'optimizer': 'SGD', 'sgd_opt_learning_rate': 0.00013973571227394603, 'sgd_opt_momentum': 0.0011415997048977204}. Best is trial 15 with value: 0.6914615631103516.
Trial 421 finished with value: 0.5043333172798157 and parameters: {'n_layers': 1, 'weight_decay': 1.3067517872695367e-05, 'n_units_l0': 1, 'optimizer': 'RMSprop', 'rmsprop_learning_rate': 0.001286185637108214, 'rmsprop_weight_decay': 0.9591509554385226, 'rmsprop_momentum': 0.001393426487935385}. Best is trial 15 with value: 0.6914615631103516.
Trial 422 finished with value: 0.5043333172798157 and parameters: {'n_layers': 1, 'weight_decay': 2.164679995340033e-06, 'n_units_l0': 1, 'optimizer': 'SGD', 'sgd_opt_learning_rate': 4.264675949893073e-05, 'sgd_opt_momentum': 0.003811863993909264}. Best is trial 15 with value: 0.6914615631103516.
Trial 423 finished with value: 0.5043333172798157 and parameters: {'n_layers': 1, 'weight_decay': 0.0003064416727446467, 'n_units_l0': 1, 'optimizer': 'Adam', 'adam_learning_rate': 0.0001987701016768932}. Best is trial 15 with value: 0.6914615631103516.
Trial 424 finished with value: 0.5043333172798157 and parameters: {'n_layers': 1, 'weight_decay': 6.425746478901117e-08, 'n_units_l0': 1, 'optimizer': 'SGD', 'sgd_opt_learning_rate': 1.7174798948870964e-05, 'sgd_opt_momentum': 4.3354477479177296e-05}. Best is trial 15 with value: 0.6914615631103516.
Trial 425 finished with value: 0.5043333172798157 and parameters: {'n_layers': 1, 'weight_decay': 1.3314274245769548e-07, 'n_units_l0': 1, 'optimizer': 'SGD', 'sgd_opt_learning_rate': 5.3490037298885556e-05, 'sgd_opt_momentum': 0.00019310540941592545}. Best is trial 15 with value: 0.6914615631103516.
Trial 426 finished with value: 0.5098717212677002 and parameters: {'n_layers': 1, 'weight_decay': 0.0009229378072064179, 'n_units_l0': 1, 'optimizer': 'RMSprop', 'rmsprop_learning_rate': 2.3472496384194977e-05, 'rmsprop_weight_decay': 0.9819185508907939, 'rmsprop_momentum': 2.9646825992612107e-05}. Best is trial 15 with value: 0.6914615631103516.
Trial 427 finished with value: 0.5043333172798157 and parameters: {'n_layers': 1, 'weight_decay': 0.0007854226841247606, 'n_units_l0': 1, 'optimizer': 'RMSprop', 'rmsprop_learning_rate': 2.451434142838948e-05, 'rmsprop_weight_decay': 0.96960138651463, 'rmsprop_momentum': 2.820161843557836e-05}. Best is trial 15 with value: 0.6914615631103516.
Trial 428 finished with value: 0.5043333172798157 and parameters: {'n_layers': 1, 'weight_decay': 0.0003312388890426801, 'n_units_l0': 1, 'optimizer': 'RMSprop', 'rmsprop_learning_rate': 1.8245281178117674e-05, 'rmsprop_weight_decay': 0.9812361838804501, 'rmsprop_momentum': 4.675204228132267e-05}. Best is trial 15 with value: 0.6914615631103516.
Trial 429 finished with value: 0.5043333172798157 and parameters: {'n_layers': 1, 'weight_decay': 8.871164622194384e-07, 'n_units_l0': 1, 'optimizer': 'RMSprop', 'rmsprop_learning_rate': 1.3838175069231576e-05, 'rmsprop_weight_decay': 0.9640689616787176, 'rmsprop_momentum': 3.3714895057300164e-05}. Best is trial 15 with value: 0.6914615631103516.
Trial 430 finished with value: 0.5043333172798157 and parameters: {'n_layers': 1, 'weight_decay': 0.0002037321865371826, 'n_units_l0': 1, 'optimizer': 'RMSprop', 'rmsprop_learning_rate': 6.807113310386775e-05, 'rmsprop_weight_decay': 0.9743122218732964, 'rmsprop_momentum': 1.6402334982084555e-05}. Best is trial 15 with value: 0.6914615631103516.
Trial 431 finished with value: 0.5043333172798157 and parameters: {'n_layers': 1, 'weight_decay': 2.9603555591721055e-07, 'n_units_l0': 1, 'optimizer': 'RMSprop', 'rmsprop_learning_rate': 5.6116504594260164e-05, 'rmsprop_weight_decay': 0.9836397953156633, 'rmsprop_momentum': 9.861693818214893e-05}. Best is trial 15 with value: 0.6914615631103516.
