Trial 229 finished with value: 0.8149373531341553 and parameters: {'n_layers': 6, 'weight_decay': 1.672365195334921e-08, 'n_units_l0': 20, 'n_units_l1': 45, 'n_units_l2': 9, 'n_units_l3': 32, 'n_units_l4': 17, 'n_units_l5': 42, 'optimizer': 'Adam', 'adam_learning_rate': 0.0004636384297486391}. Best is trial 89 with value: 0.8458108901977539.
Trial 230 finished with value: 0.824919581413269 and parameters: {'n_layers': 3, 'weight_decay': 4.2468223709378054e-06, 'n_units_l0': 7, 'n_units_l1': 28, 'n_units_l2': 11, 'optimizer': 'Adam', 'adam_learning_rate': 1.750653453475113e-05}. Best is trial 89 with value: 0.8458108901977539.
Trial 231 finished with value: 0.8330478668212891 and parameters: {'n_layers': 4, 'weight_decay': 1.5423331734121742e-10, 'n_units_l0': 27, 'n_units_l1': 31, 'n_units_l2': 127, 'n_units_l3': 22, 'optimizer': 'Adam', 'adam_learning_rate': 0.01589832396760283}. Best is trial 89 with value: 0.8458108901977539.
Trial 232 finished with value: 0.8263812065124512 and parameters: {'n_layers': 4, 'weight_decay': 2.4935885688207513e-10, 'n_units_l0': 26, 'n_units_l1': 34, 'n_units_l2': 128, 'n_units_l3': 23, 'optimizer': 'Adam', 'adam_learning_rate': 0.025245301493630853}. Best is trial 89 with value: 0.8458108901977539.
Trial 233 finished with value: 0.8267019391059875 and parameters: {'n_layers': 4, 'weight_decay': 1.9205102791593133e-10, 'n_units_l0': 24, 'n_units_l1': 31, 'n_units_l2': 105, 'n_units_l3': 22, 'optimizer': 'Adam', 'adam_learning_rate': 0.013803464855828255}. Best is trial 89 with value: 0.8458108901977539.
Trial 234 finished with value: 0.8240281939506531 and parameters: {'n_layers': 5, 'weight_decay': 3.5365761249899044e-10, 'n_units_l0': 27, 'n_units_l1': 40, 'n_units_l2': 115, 'n_units_l3': 24, 'n_units_l4': 29, 'optimizer': 'Adam', 'adam_learning_rate': 0.020983882951689427}. Best is trial 89 with value: 0.8458108901977539.
Trial 235 finished with value: 0.8231016397476196 and parameters: {'n_layers': 3, 'weight_decay': 1.4912164807428299e-09, 'n_units_l0': 45, 'n_units_l1': 25, 'n_units_l2': 14, 'optimizer': 'Adam', 'adam_learning_rate': 1.0394498006559768e-05}. Best is trial 89 with value: 0.8458108901977539.
Trial 236 finished with value: 0.829126238822937 and parameters: {'n_layers': 5, 'weight_decay': 7.060602494287688e-10, 'n_units_l0': 30, 'n_units_l1': 28, 'n_units_l2': 13, 'n_units_l3': 21, 'n_units_l4': 19, 'optimizer': 'Adam', 'adam_learning_rate': 3.5875477328588816e-05}. Best is trial 89 with value: 0.8458108901977539.
Trial 237 finished with value: 0.8121564984321594 and parameters: {'n_layers': 6, 'weight_decay': 1.008938755343411e-09, 'n_units_l0': 22, 'n_units_l1': 8, 'n_units_l2': 128, 'n_units_l3': 13, 'n_units_l4': 26, 'n_units_l5': 6, 'optimizer': 'Adam', 'adam_learning_rate': 0.015820174993663356}. Best is trial 89 with value: 0.8458108901977539.
Trial 238 finished with value: 0.821568489074707 and parameters: {'n_layers': 21, 'weight_decay': 5.21066860259884e-08, 'n_units_l0': 40, 'n_units_l1': 35, 'n_units_l2': 17, 'n_units_l3': 25, 'n_units_l4': 10, 'n_units_l5': 16, 'n_units_l6': 123, 'n_units_l7': 17, 'n_units_l8': 68, 'n_units_l9': 7, 'n_units_l10': 8, 'n_units_l11': 96, 'n_units_l12': 6, 'n_units_l13': 30, 'n_units_l14': 128, 'n_units_l15': 28, 'n_units_l16': 16, 'n_units_l17': 9, 'n_units_l18': 124, 'n_units_l19': 51, 'n_units_l20': 5, 'optimizer': 'RMSprop', 'rmsprop_learning_rate': 6.188347924132038e-05, 'rmsprop_weight_decay': 0.855415495089923, 'rmsprop_momentum': 0.0008503471073213974}. Best is trial 89 with value: 0.8458108901977539.
Trial 239 finished with value: 0.8212476968765259 and parameters: {'n_layers': 4, 'weight_decay': 1.555728517137738e-10, 'n_units_l0': 32, 'n_units_l1': 7, 'n_units_l2': 16, 'n_units_l3': 27, 'optimizer': 'Adam', 'adam_learning_rate': 1.3136354979658252e-05}. Best is trial 89 with value: 0.8458108901977539.
Trial 240 finished with value: 0.8170050382614136 and parameters: {'n_layers': 7, 'weight_decay': 4.5338562781857283e-10, 'n_units_l0': 36, 'n_units_l1': 31, 'n_units_l2': 11, 'n_units_l3': 16, 'n_units_l4': 14, 'n_units_l5': 21, 'n_units_l6': 81, 'optimizer': 'SGD', 'sgd_opt_learning_rate': 0.019243469678989704, 'sgd_opt_momentum': 0.007419472317337269}. Best is trial 89 with value: 0.8458108901977539.
Trial 241 finished with value: 0.8121567964553833 and parameters: {'n_layers': 8, 'weight_decay': 1.2906543365299185e-10, 'n_units_l0': 27, 'n_units_l1': 29, 'n_units_l2': 19, 'n_units_l3': 20, 'n_units_l4': 13, 'n_units_l5': 49, 'n_units_l6': 39, 'n_units_l7': 28, 'optimizer': 'Adam', 'adam_learning_rate': 0.0012615865649594135}. Best is trial 89 with value: 0.8458108901977539.
Trial 242 finished with value: 0.8277003765106201 and parameters: {'n_layers': 6, 'weight_decay': 2.445768446449843e-10, 'n_units_l0': 28, 'n_units_l1': 27, 'n_units_l2': 15, 'n_units_l3': 18, 'n_units_l4': 11, 'n_units_l5': 67, 'optimizer': 'Adam', 'adam_learning_rate': 1.001735780317037e-05}. Best is trial 89 with value: 0.8458108901977539.
Trial 243 finished with value: 0.8291263580322266 and parameters: {'n_layers': 7, 'weight_decay': 1.066647698988957e-10, 'n_units_l0': 31, 'n_units_l1': 33, 'n_units_l2': 12, 'n_units_l3': 19, 'n_units_l4': 9, 'n_units_l5': 82, 'n_units_l6': 53, 'optimizer': 'Adam', 'adam_learning_rate': 0.0009134154818516109}. Best is trial 89 with value: 0.8458108901977539.
Trial 244 finished with value: 0.8151869773864746 and parameters: {'n_layers': 5, 'weight_decay': 1.8278550143412613e-10, 'n_units_l0': 25, 'n_units_l1': 24, 'n_units_l2': 78, 'n_units_l3': 15, 'n_units_l4': 4, 'optimizer': 'Adam', 'adam_learning_rate': 0.0007560634949103026}. Best is trial 89 with value: 0.8458108901977539.
Trial 245 finished with value: 0.8124418258666992 and parameters: {'n_layers': 6, 'weight_decay': 3.1935189142136084e-08, 'n_units_l0': 29, 'n_units_l1': 5, 'n_units_l2': 21, 'n_units_l3': 16, 'n_units_l4': 8, 'n_units_l5': 38, 'optimizer': 'Adam', 'adam_learning_rate': 0.02705456745525491}. Best is trial 89 with value: 0.8458108901977539.
Trial 246 finished with value: 0.8158287405967712 and parameters: {'n_layers': 3, 'weight_decay': 3.188830789509628e-10, 'n_units_l0': 50, 'n_units_l1': 25, 'n_units_l2': 108, 'optimizer': 'Adam', 'adam_learning_rate': 0.003081048643925709}. Best is trial 89 with value: 0.8458108901977539.
Trial 247 finished with value: 0.8045988082885742 and parameters: {'n_layers': 8, 'weight_decay': 3.0171962638664396e-09, 'n_units_l0': 33, 'n_units_l1': 19, 'n_units_l2': 119, 'n_units_l3': 22, 'n_units_l4': 39, 'n_units_l5': 98, 'n_units_l6': 91, 'n_units_l7': 85, 'optimizer': 'Adam', 'adam_learning_rate': 2.2455142114908777e-05}. Best is trial 89 with value: 0.8458108901977539.
Trial 248 finished with value: 0.8309801816940308 and parameters: {'n_layers': 5, 'weight_decay': 5.947834284848371e-10, 'n_units_l0': 42, 'n_units_l1': 27, 'n_units_l2': 16, 'n_units_l3': 30, 'n_units_l4': 16, 'optimizer': 'Adam', 'adam_learning_rate': 0.009861650851957292}. Best is trial 89 with value: 0.8458108901977539.
Trial 249 finished with value: 0.8324774503707886 and parameters: {'n_layers': 4, 'weight_decay': 8.51897335623649e-09, 'n_units_l0': 18, 'n_units_l1': 30, 'n_units_l2': 19, 'n_units_l3': 25, 'optimizer': 'Adam', 'adam_learning_rate': 0.0016697371525210842}. Best is trial 89 with value: 0.8458108901977539.
