A new study created in memory with name: no-name-807ada6d-4402-43e8-9a88-162c36be6996
Trial 0 finished with value: 0.8119072318077087 and parameters: {'n_layers': 17, 'weight_decay': 2.429681331847191e-05, 'n_units_l0': 13, 'n_units_l1': 18, 'n_units_l2': 12, 'n_units_l3': 111, 'n_units_l4': 18, 'n_units_l5': 30, 'n_units_l6': 10, 'n_units_l7': 44, 'n_units_l8': 25, 'n_units_l9': 79, 'n_units_l10': 8, 'n_units_l11': 28, 'n_units_l12': 18, 'n_units_l13': 21, 'n_units_l14': 19, 'n_units_l15': 103, 'n_units_l16': 6, 'optimizer': 'SGD', 'sgd_opt_learning_rate': 0.023175291457336742, 'sgd_opt_momentum': 0.005899858167521423}. Best is trial 0 with value: 0.8119072318077087.
Trial 1 finished with value: 0.801925003528595 and parameters: {'n_layers': 20, 'weight_decay': 4.573668771550912e-08, 'n_units_l0': 41, 'n_units_l1': 39, 'n_units_l2': 61, 'n_units_l3': 15, 'n_units_l4': 5, 'n_units_l5': 9, 'n_units_l6': 78, 'n_units_l7': 62, 'n_units_l8': 100, 'n_units_l9': 9, 'n_units_l10': 30, 'n_units_l11': 11, 'n_units_l12': 18, 'n_units_l13': 9, 'n_units_l14': 107, 'n_units_l15': 5, 'n_units_l16': 27, 'n_units_l17': 124, 'n_units_l18': 112, 'n_units_l19': 6, 'optimizer': 'SGD', 'sgd_opt_learning_rate': 0.0029255232024621514, 'sgd_opt_momentum': 1.896343682567607e-05}. Best is trial 0 with value: 0.8119072318077087.
Trial 2 finished with value: 0.816363513469696 and parameters: {'n_layers': 12, 'weight_decay': 5.597591934350523e-06, 'n_units_l0': 11, 'n_units_l1': 5, 'n_units_l2': 55, 'n_units_l3': 12, 'n_units_l4': 4, 'n_units_l5': 6, 'n_units_l6': 72, 'n_units_l7': 90, 'n_units_l8': 12, 'n_units_l9': 26, 'n_units_l10': 13, 'n_units_l11': 60, 'optimizer': 'RMSprop', 'rmsprop_learning_rate': 7.300652292236335e-05, 'rmsprop_weight_decay': 0.8662239912255973, 'rmsprop_momentum': 0.0013001383558769125}. Best is trial 2 with value: 0.816363513469696.
Trial 3 finished with value: 0.8306593298912048 and parameters: {'n_layers': 4, 'weight_decay': 2.710734796133124e-10, 'n_units_l0': 45, 'n_units_l1': 36, 'n_units_l2': 5, 'n_units_l3': 61, 'optimizer': 'SGD', 'sgd_opt_learning_rate': 3.722430213627839e-05, 'sgd_opt_momentum': 0.043262740788242916}. Best is trial 3 with value: 0.8306593298912048.
Trial 4 finished with value: 0.8212474584579468 and parameters: {'n_layers': 17, 'weight_decay': 2.4967695411403687e-10, 'n_units_l0': 22, 'n_units_l1': 7, 'n_units_l2': 22, 'n_units_l3': 47, 'n_units_l4': 4, 'n_units_l5': 34, 'n_units_l6': 36, 'n_units_l7': 29, 'n_units_l8': 45, 'n_units_l9': 29, 'n_units_l10': 12, 'n_units_l11': 6, 'n_units_l12': 33, 'n_units_l13': 80, 'n_units_l14': 29, 'n_units_l15': 21, 'n_units_l16': 9, 'optimizer': 'SGD', 'sgd_opt_learning_rate': 0.05734371196432763, 'sgd_opt_momentum': 0.0005059982492089281}. Best is trial 3 with value: 0.8306593298912048.
Trial 5 finished with value: 0.82609623670578 and parameters: {'n_layers': 10, 'weight_decay': 2.3118791404794893e-09, 'n_units_l0': 17, 'n_units_l1': 4, 'n_units_l2': 4, 'n_units_l3': 11, 'n_units_l4': 108, 'n_units_l5': 12, 'n_units_l6': 13, 'n_units_l7': 4, 'n_units_l8': 5, 'n_units_l9': 7, 'optimizer': 'RMSprop', 'rmsprop_learning_rate': 0.0017623651972551928, 'rmsprop_weight_decay': 0.9773124869103662, 'rmsprop_momentum': 0.0020186656200689426}. Best is trial 3 with value: 0.8306593298912048.
Trial 6 finished with value: 0.8324421048164368 and parameters: {'n_layers': 3, 'weight_decay': 4.7102270551170585e-09, 'n_units_l0': 4, 'n_units_l1': 35, 'n_units_l2': 12, 'optimizer': 'Adam', 'adam_learning_rate': 0.002127528469952279}. Best is trial 6 with value: 0.8324421048164368.
Trial 7 finished with value: 0.8203561305999756 and parameters: {'n_layers': 15, 'weight_decay': 1.2115331540949643e-09, 'n_units_l0': 4, 'n_units_l1': 12, 'n_units_l2': 27, 'n_units_l3': 19, 'n_units_l4': 4, 'n_units_l5': 18, 'n_units_l6': 50, 'n_units_l7': 92, 'n_units_l8': 8, 'n_units_l9': 8, 'n_units_l10': 15, 'n_units_l11': 28, 'n_units_l12': 22, 'n_units_l13': 21, 'n_units_l14': 8, 'optimizer': 'RMSprop', 'rmsprop_learning_rate': 0.022257418538484085, 'rmsprop_weight_decay': 0.9285144922201047, 'rmsprop_momentum': 0.004375577671096811}. Best is trial 6 with value: 0.8324421048164368.
Trial 8 finished with value: 0.8172903060913086 and parameters: {'n_layers': 7, 'weight_decay': 3.486717508869314e-05, 'n_units_l0': 23, 'n_units_l1': 43, 'n_units_l2': 7, 'n_units_l3': 20, 'n_units_l4': 26, 'n_units_l5': 7, 'n_units_l6': 71, 'optimizer': 'Adam', 'adam_learning_rate': 0.005315387498362091}. Best is trial 6 with value: 0.8324421048164368.
Trial 9 finished with value: 0.8297324180603027 and parameters: {'n_layers': 19, 'weight_decay': 2.067108732385587e-05, 'n_units_l0': 26, 'n_units_l1': 15, 'n_units_l2': 9, 'n_units_l3': 9, 'n_units_l4': 5, 'n_units_l5': 32, 'n_units_l6': 24, 'n_units_l7': 27, 'n_units_l8': 99, 'n_units_l9': 128, 'n_units_l10': 31, 'n_units_l11': 61, 'n_units_l12': 17, 'n_units_l13': 69, 'n_units_l14': 17, 'n_units_l15': 15, 'n_units_l16': 30, 'n_units_l17': 20, 'n_units_l18': 41, 'optimizer': 'SGD', 'sgd_opt_learning_rate': 1.5247985967336767e-05, 'sgd_opt_momentum': 0.02467529380300525}. Best is trial 6 with value: 0.8324421048164368.
Trial 10 finished with value: 0.8076646327972412 and parameters: {'n_layers': 2, 'weight_decay': 1.0421082325005282e-07, 'n_units_l0': 4, 'n_units_l1': 92, 'optimizer': 'Adam', 'adam_learning_rate': 2.5377512854673664e-05}. Best is trial 6 with value: 0.8324421048164368.
Trial 11 finished with value: 0.8119072318077087 and parameters: {'n_layers': 1, 'weight_decay': 7.796228330930385e-09, 'n_units_l0': 127, 'optimizer': 'Adam', 'adam_learning_rate': 0.05524830045523488}. Best is trial 6 with value: 0.8324421048164368.
Trial 12 finished with value: 0.8272727131843567 and parameters: {'n_layers': 25, 'weight_decay': 1.567089359834479e-10, 'n_units_l0': 58, 'n_units_l1': 39, 'n_units_l2': 5, 'n_units_l3': 53, 'n_units_l4': 115, 'n_units_l5': 107, 'n_units_l6': 6, 'n_units_l7': 8, 'n_units_l8': 4, 'n_units_l9': 4, 'n_units_l10': 107, 'n_units_l11': 111, 'n_units_l12': 123, 'n_units_l13': 4, 'n_units_l14': 106, 'n_units_l15': 108, 'n_units_l16': 128, 'n_units_l17': 4, 'n_units_l18': 5, 'n_units_l19': 125, 'n_units_l20': 17, 'n_units_l21': 21, 'n_units_l22': 9, 'n_units_l23': 64, 'n_units_l24': 44, 'optimizer': 'Adam', 'adam_learning_rate': 0.0002576770049025678}. Best is trial 6 with value: 0.8324421048164368.
Trial 13 finished with value: 0.8242779970169067 and parameters: {'n_layers': 6, 'weight_decay': 0.0006528661537000709, 'n_units_l0': 7, 'n_units_l1': 89, 'n_units_l2': 13, 'n_units_l3': 4, 'n_units_l4': 40, 'n_units_l5': 128, 'optimizer': 'SGD', 'sgd_opt_learning_rate': 1.945672408154622e-05, 'sgd_opt_momentum': 0.09185378498431924}. Best is trial 6 with value: 0.8324421048164368.
Trial 14 finished with value: 0.8085203170776367 and parameters: {'n_layers': 5, 'weight_decay': 1.1288281831979314e-08, 'n_units_l0': 68, 'n_units_l1': 29, 'n_units_l2': 121, 'n_units_l3': 126, 'n_units_l4': 13, 'optimizer': 'Adam', 'adam_learning_rate': 0.0018873197821478638}. Best is trial 6 with value: 0.8324421048164368.
Trial 15 finished with value: 0.8176469206809998 and parameters: {'n_layers': 9, 'weight_decay': 4.0481472691600734e-07, 'n_units_l0': 43, 'n_units_l1': 61, 'n_units_l2': 6, 'n_units_l3': 40, 'n_units_l4': 52, 'n_units_l5': 4, 'n_units_l6': 4, 'n_units_l7': 11, 'n_units_l8': 39, 'optimizer': 'SGD', 'sgd_opt_learning_rate': 0.0002271256369530275, 'sgd_opt_momentum': 0.0009690097714888719}. Best is trial 6 with value: 0.8324421048164368.
Trial 16 finished with value: 0.8109802007675171 and parameters: {'n_layers': 3, 'weight_decay': 8.208033107081279e-10, 'n_units_l0': 8, 'n_units_l1': 128, 'n_units_l2': 15, 'optimizer': 'Adam', 'adam_learning_rate': 0.03413600647817354}. Best is trial 6 with value: 0.8324421048164368.
Trial 17 finished with value: 0.8103741407394409 and parameters: {'n_layers': 4, 'weight_decay': 1.0417769696623017e-10, 'n_units_l0': 92, 'n_units_l1': 25, 'n_units_l2': 4, 'n_units_l3': 77, 'optimizer': 'Adam', 'adam_learning_rate': 0.00016125567234176236}. Best is trial 6 with value: 0.8324421048164368.
Trial 18 finished with value: 0.8218892216682434 and parameters: {'n_layers': 11, 'weight_decay': 8.543783965041069e-07, 'n_units_l0': 33, 'n_units_l1': 10, 'n_units_l2': 9, 'n_units_l3': 30, 'n_units_l4': 9, 'n_units_l5': 71, 'n_units_l6': 15, 'n_units_l7': 15, 'n_units_l8': 15, 'n_units_l9': 48, 'n_units_l10': 4, 'optimizer': 'SGD', 'sgd_opt_learning_rate': 0.00019839687759720537, 'sgd_opt_momentum': 3.830980713013152e-05}. Best is trial 6 with value: 0.8324421048164368.
Trial 19 finished with value: 0.8224952816963196 and parameters: {'n_layers': 8, 'weight_decay': 1.1167623019409533e-08, 'n_units_l0': 8, 'n_units_l1': 57, 'n_units_l2': 32, 'n_units_l3': 5, 'n_units_l4': 65, 'n_units_l5': 52, 'n_units_l6': 124, 'n_units_l7': 4, 'optimizer': 'RMSprop', 'rmsprop_learning_rate': 1.7805958269404908e-05, 'rmsprop_weight_decay': 0.851713051867506, 'rmsprop_momentum': 1.0416314198373324e-05}. Best is trial 6 with value: 0.8324421048164368.
Trial 20 finished with value: 0.8197503089904785 and parameters: {'n_layers': 1, 'weight_decay': 3.2439947903938713e-09, 'n_units_l0': 6, 'optimizer': 'SGD', 'sgd_opt_learning_rate': 0.00014212454109356466, 'sgd_opt_momentum': 0.005828622484445632}. Best is trial 6 with value: 0.8324421048164368.
Trial 21 finished with value: 0.8207127451896667 and parameters: {'n_layers': 21, 'weight_decay': 0.0006507465010824067, 'n_units_l0': 27, 'n_units_l1': 15, 'n_units_l2': 9, 'n_units_l3': 7, 'n_units_l4': 9, 'n_units_l5': 20, 'n_units_l6': 26, 'n_units_l7': 26, 'n_units_l8': 101, 'n_units_l9': 124, 'n_units_l10': 45, 'n_units_l11': 71, 'n_units_l12': 4, 'n_units_l13': 96, 'n_units_l14': 4, 'n_units_l15': 15, 'n_units_l16': 39, 'n_units_l17': 20, 'n_units_l18': 45, 'n_units_l19': 52, 'n_units_l20': 119, 'optimizer': 'SGD', 'sgd_opt_learning_rate': 1.0682681924945154e-05, 'sgd_opt_momentum': 0.08573603995190222}. Best is trial 6 with value: 0.8324421048164368.
Trial 22 finished with value: 0.8203562498092651 and parameters: {'n_layers': 14, 'weight_decay': 1.3833091781036116e-06, 'n_units_l0': 56, 'n_units_l1': 23, 'n_units_l2': 8, 'n_units_l3': 8, 'n_units_l4': 7, 'n_units_l5': 43, 'n_units_l6': 22, 'n_units_l7': 39, 'n_units_l8': 54, 'n_units_l9': 55, 'n_units_l10': 72, 'n_units_l11': 53, 'n_units_l12': 6, 'n_units_l13': 49, 'optimizer': 'SGD', 'sgd_opt_learning_rate': 4.650761264493096e-05, 'sgd_opt_momentum': 0.010621419481685292}. Best is trial 6 with value: 0.8324421048164368.
Trial 23 finished with value: 0.8115507960319519 and parameters: {'n_layers': 24, 'weight_decay': 6.110223577230372e-05, 'n_units_l0': 15, 'n_units_l1': 9, 'n_units_l2': 17, 'n_units_l3': 28, 'n_units_l4': 24, 'n_units_l5': 15, 'n_units_l6': 8, 'n_units_l7': 18, 'n_units_l8': 128, 'n_units_l9': 15, 'n_units_l10': 31, 'n_units_l11': 13, 'n_units_l12': 51, 'n_units_l13': 42, 'n_units_l14': 25, 'n_units_l15': 5, 'n_units_l16': 74, 'n_units_l17': 23, 'n_units_l18': 15, 'n_units_l19': 4, 'n_units_l20': 4, 'n_units_l21': 4, 'n_units_l22': 116, 'n_units_l23': 4, 'optimizer': 'SGD', 'sgd_opt_learning_rate': 0.001361417157909986, 'sgd_opt_momentum': 0.019745092772467904}. Best is trial 6 with value: 0.8324421048164368.
Trial 24 finished with value: 0.8185381293296814 and parameters: {'n_layers': 21, 'weight_decay': 3.716782448197432e-08, 'n_units_l0': 30, 'n_units_l1': 31, 'n_units_l2': 11, 'n_units_l3': 7, 'n_units_l4': 14, 'n_units_l5': 27, 'n_units_l6': 36, 'n_units_l7': 7, 'n_units_l8': 64, 'n_units_l9': 105, 'n_units_l10': 56, 'n_units_l11': 4, 'n_units_l12': 9, 'n_units_l13': 119, 'n_units_l14': 12, 'n_units_l15': 42, 'n_units_l16': 14, 'n_units_l17': 20, 'n_units_l18': 31, 'n_units_l19': 18, 'n_units_l20': 109, 'optimizer': 'SGD', 'sgd_opt_learning_rate': 5.6142499245031355e-05, 'sgd_opt_momentum': 0.027521877132105636}. Best is trial 6 with value: 0.8324421048164368.
Trial 25 finished with value: 0.8173259496688843 and parameters: {'n_layers': 4, 'weight_decay': 5.811895673040799e-10, 'n_units_l0': 41, 'n_units_l1': 20, 'n_units_l2': 6, 'n_units_l3': 74, 'optimizer': 'Adam', 'adam_learning_rate': 0.008137126245770857}. Best is trial 6 with value: 0.8324421048164368.
Trial 26 finished with value: 0.8197503685951233 and parameters: {'n_layers': 18, 'weight_decay': 4.554840722542734e-06, 'n_units_l0': 11, 'n_units_l1': 54, 'n_units_l2': 5, 'n_units_l3': 26, 'n_units_l4': 7, 'n_units_l5': 57, 'n_units_l6': 17, 'n_units_l7': 125, 'n_units_l8': 28, 'n_units_l9': 53, 'n_units_l10': 6, 'n_units_l11': 119, 'n_units_l12': 75, 'n_units_l13': 43, 'n_units_l14': 41, 'n_units_l15': 11, 'n_units_l16': 4, 'n_units_l17': 7, 'optimizer': 'SGD', 'sgd_opt_learning_rate': 1.0592866937121147e-05, 'sgd_opt_momentum': 0.0002869797472043578}. Best is trial 6 with value: 0.8324421048164368.
Trial 27 finished with value: 0.8055969476699829 and parameters: {'n_layers': 13, 'weight_decay': 0.0001746180844341031, 'n_units_l0': 69, 'n_units_l1': 15, 'n_units_l2': 17, 'n_units_l3': 77, 'n_units_l4': 33, 'n_units_l5': 86, 'n_units_l6': 4, 'n_units_l7': 49, 'n_units_l8': 74, 'n_units_l9': 17, 'n_units_l10': 23, 'n_units_l11': 38, 'n_units_l12': 10, 'optimizer': 'SGD', 'sgd_opt_learning_rate': 0.0006532701848171874, 'sgd_opt_momentum': 0.0026734640643592393}. Best is trial 6 with value: 0.8324421048164368.
Trial 28 finished with value: 0.8318715691566467 and parameters: {'n_layers': 6, 'weight_decay': 9.958352542516087e-08, 'n_units_l0': 18, 'n_units_l1': 33, 'n_units_l2': 10, 'n_units_l3': 10, 'n_units_l4': 13, 'n_units_l5': 4, 'optimizer': 'RMSprop', 'rmsprop_learning_rate': 0.07531157699265831, 'rmsprop_weight_decay': 0.9800598094130242, 'rmsprop_momentum': 0.08570131113684135}. Best is trial 6 with value: 0.8324421048164368.
Trial 29 finished with value: 0.8300532698631287 and parameters: {'n_layers': 6, 'weight_decay': 1.1520124774726223e-07, 'n_units_l0': 5, 'n_units_l1': 32, 'n_units_l2': 32, 'n_units_l3': 5, 'n_units_l4': 70, 'n_units_l5': 4, 'optimizer': 'RMSprop', 'rmsprop_learning_rate': 0.04898692329032574, 'rmsprop_weight_decay': 0.9852848742551454, 'rmsprop_momentum': 0.097290461290056}. Best is trial 6 with value: 0.8324421048164368.
Trial 30 finished with value: 0.8264527916908264 and parameters: {'n_layers': 3, 'weight_decay': 4.410912352452576e-09, 'n_units_l0': 18, 'n_units_l1': 48, 'n_units_l2': 11, 'optimizer': 'RMSprop', 'rmsprop_learning_rate': 0.002451162269478044, 'rmsprop_weight_decay': 0.9374170185334959, 'rmsprop_momentum': 0.05949621577454452}. Best is trial 6 with value: 0.8324421048164368.
Trial 31 finished with value: 0.813404381275177 and parameters: {'n_layers': 6, 'weight_decay': 9.747254261865531e-08, 'n_units_l0': 5, 'n_units_l1': 33, 'n_units_l2': 38, 'n_units_l3': 5, 'n_units_l4': 75, 'n_units_l5': 4, 'optimizer': 'RMSprop', 'rmsprop_learning_rate': 0.09896587476637196, 'rmsprop_weight_decay': 0.9873063203263351, 'rmsprop_momentum': 0.08477921982171566}. Best is trial 6 with value: 0.8324421048164368.
Trial 32 finished with value: 0.8061318397521973 and parameters: {'n_layers': 8, 'weight_decay': 3.3576599238821057e-08, 'n_units_l0': 5, 'n_units_l1': 69, 'n_units_l2': 23, 'n_units_l3': 4, 'n_units_l4': 17, 'n_units_l5': 6, 'n_units_l6': 124, 'n_units_l7': 6, 'optimizer': 'RMSprop', 'rmsprop_learning_rate': 0.09777966840454869, 'rmsprop_weight_decay': 0.9606502755234607, 'rmsprop_momentum': 0.018946347631098204}. Best is trial 6 with value: 0.8324421048164368.
Trial 33 finished with value: 0.8103386163711548 and parameters: {'n_layers': 5, 'weight_decay': 1.8019666781798778e-07, 'n_units_l0': 11, 'n_units_l1': 25, 'n_units_l2': 41, 'n_units_l3': 6, 'n_units_l4': 41, 'optimizer': 'RMSprop', 'rmsprop_learning_rate': 0.010597204659102655, 'rmsprop_weight_decay': 0.9560743497226554, 'rmsprop_momentum': 0.00010417314131741424}. Best is trial 6 with value: 0.8324421048164368.
Trial 34 finished with value: 0.8215327858924866 and parameters: {'n_layers': 7, 'weight_decay': 2.36786295647951e-08, 'n_units_l0': 5, 'n_units_l1': 37, 'n_units_l2': 19, 'n_units_l3': 11, 'n_units_l4': 79, 'n_units_l5': 9, 'n_units_l6': 6, 'optimizer': 'RMSprop', 'rmsprop_learning_rate': 0.00977270611018864, 'rmsprop_weight_decay': 0.893767204305431, 'rmsprop_momentum': 0.012085536986497024}. Best is trial 6 with value: 0.8324421048164368.
Trial 35 finished with value: 0.8224954009056091 and parameters: {'n_layers': 10, 'weight_decay': 3.4945222286300805e-10, 'n_units_l0': 9, 'n_units_l1': 18, 'n_units_l2': 12, 'n_units_l3': 17, 'n_units_l4': 31, 'n_units_l5': 5, 'n_units_l6': 11, 'n_units_l7': 12, 'n_units_l8': 7, 'n_units_l9': 4, 'optimizer': 'RMSprop', 'rmsprop_learning_rate': 0.0002476348946450669, 'rmsprop_weight_decay': 0.988660794069933, 'rmsprop_momentum': 0.09477922761341376}. Best is trial 6 with value: 0.8324421048164368.
Trial 36 finished with value: 0.8222101926803589 and parameters: {'n_layers': 3, 'weight_decay': 4.199546459545208e-07, 'n_units_l0': 13, 'n_units_l1': 30, 'n_units_l2': 61, 'optimizer': 'RMSprop', 'rmsprop_learning_rate': 0.027523418602285393, 'rmsprop_weight_decay': 0.9593378776516807, 'rmsprop_momentum': 0.0002345632325356757}. Best is trial 6 with value: 0.8324421048164368.
Trial 37 finished with value: 0.8158289194107056 and parameters: {'n_layers': 5, 'weight_decay': 1.5798756018420055e-09, 'n_units_l0': 4, 'n_units_l1': 44, 'n_units_l2': 84, 'n_units_l3': 13, 'n_units_l4': 54, 'optimizer': 'RMSprop', 'rmsprop_learning_rate': 0.00431728910337964, 'rmsprop_weight_decay': 0.9041505584926274, 'rmsprop_momentum': 0.017419679135379493}. Best is trial 6 with value: 0.8324421048164368.
Trial 38 finished with value: 0.8158642649650574 and parameters: {'n_layers': 2, 'weight_decay': 8.518579944821163e-08, 'n_units_l0': 6, 'n_units_l1': 71, 'optimizer': 'RMSprop', 'rmsprop_learning_rate': 0.00047921356533652855, 'rmsprop_weight_decay': 0.9408613715423113, 'rmsprop_momentum': 0.006584997277780891}. Best is trial 6 with value: 0.8324421048164368.
Trial 39 finished with value: 0.8191441893577576 and parameters: {'n_layers': 7, 'weight_decay': 2.5261687521604507e-06, 'n_units_l0': 19, 'n_units_l1': 36, 'n_units_l2': 25, 'n_units_l3': 9, 'n_units_l4': 19, 'n_units_l5': 11, 'n_units_l6': 32, 'optimizer': 'RMSprop', 'rmsprop_learning_rate': 0.03586922883053125, 'rmsprop_weight_decay': 0.9655440185773804, 'rmsprop_momentum': 0.033538537593502823}. Best is trial 6 with value: 0.8324421048164368.
Trial 40 finished with value: 0.8318357467651367 and parameters: {'n_layers': 9, 'weight_decay': 3.145260713193774e-10, 'n_units_l0': 37, 'n_units_l1': 19, 'n_units_l2': 14, 'n_units_l3': 5, 'n_units_l4': 11, 'n_units_l5': 5, 'n_units_l6': 55, 'n_units_l7': 69, 'n_units_l8': 17, 'optimizer': 'Adam', 'adam_learning_rate': 1.0153038591302442e-05}. Best is trial 6 with value: 0.8324421048164368.
Trial 41 finished with value: 0.8273083567619324 and parameters: {'n_layers': 10, 'weight_decay': 3.2304746192068034e-10, 'n_units_l0': 38, 'n_units_l1': 28, 'n_units_l2': 14, 'n_units_l3': 5, 'n_units_l4': 12, 'n_units_l5': 4, 'n_units_l6': 49, 'n_units_l7': 68, 'n_units_l8': 16, 'n_units_l9': 12, 'optimizer': 'Adam', 'adam_learning_rate': 1.2463940402449623e-05}. Best is trial 6 with value: 0.8324421048164368.
Trial 42 finished with value: 0.8185738921165466 and parameters: {'n_layers': 8, 'weight_decay': 1.9162896084265068e-09, 'n_units_l0': 52, 'n_units_l1': 18, 'n_units_l2': 7, 'n_units_l3': 6, 'n_units_l4': 11, 'n_units_l5': 5, 'n_units_l6': 93, 'n_units_l7': 115, 'optimizer': 'Adam', 'adam_learning_rate': 0.0003732777350704765}. Best is trial 6 with value: 0.8324421048164368.
Trial 43 finished with value: 0.8330833315849304 and parameters: {'n_layers': 6, 'weight_decay': 4.739731886204945e-10, 'n_units_l0': 23, 'n_units_l1': 24, 'n_units_l2': 20, 'n_units_l3': 14, 'n_units_l4': 16, 'n_units_l5': 8, 'optimizer': 'Adam', 'adam_learning_rate': 4.0840011346669564e-05}. Best is trial 43 with value: 0.8330833315849304.
Trial 44 finished with value: 0.8233508467674255 and parameters: {'n_layers': 4, 'weight_decay': 5.941137269889396e-10, 'n_units_l0': 24, 'n_units_l1': 22, 'n_units_l2': 20, 'n_units_l3': 13, 'optimizer': 'Adam', 'adam_learning_rate': 5.1757593618315445e-05}. Best is trial 43 with value: 0.8330833315849304.
Trial 45 finished with value: 0.8191797733306885 and parameters: {'n_layers': 9, 'weight_decay': 1.8911111781903487e-10, 'n_units_l0': 35, 'n_units_l1': 45, 'n_units_l2': 10, 'n_units_l3': 16, 'n_units_l4': 16, 'n_units_l5': 8, 'n_units_l6': 52, 'n_units_l7': 67, 'n_units_l8': 31, 'optimizer': 'Adam', 'adam_learning_rate': 1.0081551677943053e-05}. Best is trial 43 with value: 0.8330833315849304.
Trial 46 finished with value: 0.8267022967338562 and parameters: {'n_layers': 2, 'weight_decay': 4.391199458464659e-09, 'n_units_l0': 88, 'n_units_l1': 18, 'optimizer': 'Adam', 'adam_learning_rate': 7.592398631530029e-05}. Best is trial 43 with value: 0.8330833315849304.
Trial 47 finished with value: 0.8379319310188293 and parameters: {'n_layers': 6, 'weight_decay': 9.10106850483301e-10, 'n_units_l0': 46, 'n_units_l1': 5, 'n_units_l2': 15, 'n_units_l3': 23, 'n_units_l4': 21, 'n_units_l5': 11, 'optimizer': 'Adam', 'adam_learning_rate': 0.0013294769861192167}. Best is trial 47 with value: 0.8379319310188293.
Trial 48 finished with value: 0.8176112771034241 and parameters: {'n_layers': 12, 'weight_decay': 1.2433599794828182e-09, 'n_units_l0': 30, 'n_units_l1': 4, 'n_units_l2': 15, 'n_units_l3': 23, 'n_units_l4': 22, 'n_units_l5': 11, 'n_units_l6': 95, 'n_units_l7': 35, 'n_units_l8': 10, 'n_units_l9': 31, 'n_units_l10': 109, 'n_units_l11': 15, 'optimizer': 'Adam', 'adam_learning_rate': 0.0012569854483071622}. Best is trial 47 with value: 0.8379319310188293.
