Trial 49 finished with value: 0.8376113176345825 and parameters: {'n_layers': 6, 'weight_decay': 1.602815468356132e-08, 'n_units_l0': 47, 'n_units_l1': 6, 'n_units_l2': 17, 'n_units_l3': 37, 'n_units_l4': 9, 'n_units_l5': 6, 'optimizer': 'Adam', 'adam_learning_rate': 0.0045464663418960174}. Best is trial 47 with value: 0.8379319310188293.
Trial 50 finished with value: 0.8082707524299622 and parameters: {'n_layers': 6, 'weight_decay': 1.8123630644931305e-08, 'n_units_l0': 49, 'n_units_l1': 6, 'n_units_l2': 18, 'n_units_l3': 34, 'n_units_l4': 8, 'n_units_l5': 7, 'optimizer': 'Adam', 'adam_learning_rate': 0.0037416488895245016}. Best is trial 47 with value: 0.8379319310188293.
Trial 51 finished with value: 0.8236718773841858 and parameters: {'n_layers': 5, 'weight_decay': 6.245812435911483e-09, 'n_units_l0': 61, 'n_units_l1': 5, 'n_units_l2': 13, 'n_units_l3': 41, 'n_units_l4': 11, 'optimizer': 'Adam', 'adam_learning_rate': 0.0007058216907219434}. Best is trial 47 with value: 0.8379319310188293.
Trial 52 finished with value: 0.8121923208236694 and parameters: {'n_layers': 9, 'weight_decay': 8.147619402696265e-10, 'n_units_l0': 20, 'n_units_l1': 5, 'n_units_l2': 15, 'n_units_l3': 21, 'n_units_l4': 15, 'n_units_l5': 5, 'n_units_l6': 47, 'n_units_l7': 21, 'n_units_l8': 22, 'optimizer': 'Adam', 'adam_learning_rate': 0.0136559789423422}. Best is trial 47 with value: 0.8379319310188293.
Trial 53 finished with value: 0.8191442489624023 and parameters: {'n_layers': 7, 'weight_decay': 1.1145612631560667e-10, 'n_units_l0': 45, 'n_units_l1': 7, 'n_units_l2': 21, 'n_units_l3': 10, 'n_units_l4': 6, 'n_units_l5': 6, 'n_units_l6': 8, 'optimizer': 'Adam', 'adam_learning_rate': 0.0023514272158775217}. Best is trial 47 with value: 0.8379319310188293.
Trial 54 finished with value: 0.819429337978363 and parameters: {'n_layers': 4, 'weight_decay': 2.6609618047260617e-09, 'n_units_l0': 22, 'n_units_l1': 8, 'n_units_l2': 28, 'n_units_l3': 18, 'optimizer': 'Adam', 'adam_learning_rate': 0.0007417328675314894}. Best is trial 47 with value: 0.8379319310188293.
Trial 55 finished with value: 0.8085204362869263 and parameters: {'n_layers': 11, 'weight_decay': 1.280246309751665e-08, 'n_units_l0': 77, 'n_units_l1': 12, 'n_units_l2': 11, 'n_units_l3': 23, 'n_units_l4': 20, 'n_units_l5': 15, 'n_units_l6': 19, 'n_units_l7': 54, 'n_units_l8': 17, 'n_units_l9': 6, 'n_units_l10': 4, 'optimizer': 'Adam', 'adam_learning_rate': 3.0916773575497984e-05}. Best is trial 47 with value: 0.8379319310188293.
Trial 56 finished with value: 0.831265389919281 and parameters: {'n_layers': 7, 'weight_decay': 4.3186600902120384e-10, 'n_units_l0': 28, 'n_units_l1': 4, 'n_units_l2': 16, 'n_units_l3': 14, 'n_units_l4': 10, 'n_units_l5': 9, 'n_units_l6': 64, 'optimizer': 'Adam', 'adam_learning_rate': 0.014804594096593003}. Best is trial 47 with value: 0.8379319310188293.
Trial 57 finished with value: 0.8015683889389038 and parameters: {'n_layers': 2, 'weight_decay': 7.022989627498699e-09, 'n_units_l0': 16, 'n_units_l1': 12, 'optimizer': 'Adam', 'adam_learning_rate': 0.0029850271342311456}. Best is trial 47 with value: 0.8379319310188293.
Trial 58 finished with value: 0.8112654089927673 and parameters: {'n_layers': 8, 'weight_decay': 9.290146303026466e-10, 'n_units_l0': 34, 'n_units_l1': 6, 'n_units_l2': 13, 'n_units_l3': 33, 'n_units_l4': 5, 'n_units_l5': 7, 'n_units_l6': 30, 'n_units_l7': 82, 'optimizer': 'Adam', 'adam_learning_rate': 0.0007734880185058426}. Best is trial 47 with value: 0.8379319310188293.
Trial 59 finished with value: 0.8248838782310486 and parameters: {'n_layers': 16, 'weight_decay': 5.127537478216165e-08, 'n_units_l0': 14, 'n_units_l1': 5, 'n_units_l2': 10, 'n_units_l3': 56, 'n_units_l4': 28, 'n_units_l5': 6, 'n_units_l6': 90, 'n_units_l7': 16, 'n_units_l8': 6, 'n_units_l9': 37, 'n_units_l10': 7, 'n_units_l11': 8, 'n_units_l12': 121, 'n_units_l13': 4, 'n_units_l14': 55, 'n_units_l15': 46, 'optimizer': 'Adam', 'adam_learning_rate': 1.954072395396696e-05}. Best is trial 47 with value: 0.8379319310188293.
Trial 60 finished with value: 0.8137254118919373 and parameters: {'n_layers': 6, 'weight_decay': 2.312132605717398e-09, 'n_units_l0': 47, 'n_units_l1': 24, 'n_units_l2': 22, 'n_units_l3': 44, 'n_units_l4': 14, 'n_units_l5': 5, 'optimizer': 'Adam', 'adam_learning_rate': 0.00011716645362858261}. Best is trial 47 with value: 0.8379319310188293.
Trial 61 finished with value: 0.8136540055274963 and parameters: {'n_layers': 7, 'weight_decay': 5.173786715875825e-10, 'n_units_l0': 27, 'n_units_l1': 4, 'n_units_l2': 17, 'n_units_l3': 15, 'n_units_l4': 10, 'n_units_l5': 9, 'n_units_l6': 64, 'optimizer': 'Adam', 'adam_learning_rate': 0.015548804908170571}. Best is trial 47 with value: 0.8379319310188293.
Trial 62 finished with value: 0.8248841762542725 and parameters: {'n_layers': 5, 'weight_decay': 2.5399098496368647e-10, 'n_units_l0': 30, 'n_units_l1': 6, 'n_units_l2': 8, 'n_units_l3': 14, 'n_units_l4': 9, 'optimizer': 'Adam', 'adam_learning_rate': 0.007190841740354618}. Best is trial 47 with value: 0.8379319310188293.
Trial 63 finished with value: 0.8357929587364197 and parameters: {'n_layers': 3, 'weight_decay': 3.8168597473681777e-10, 'n_units_l0': 41, 'n_units_l1': 7, 'n_units_l2': 15, 'optimizer': 'Adam', 'adam_learning_rate': 0.005287078051128251}. Best is trial 47 with value: 0.8379319310188293.
Trial 64 finished with value: 0.8178966641426086 and parameters: {'n_layers': 3, 'weight_decay': 1.7919374930254132e-10, 'n_units_l0': 39, 'n_units_l1': 10, 'n_units_l2': 13, 'optimizer': 'Adam', 'adam_learning_rate': 0.004052513186088186}. Best is trial 47 with value: 0.8379319310188293.
Trial 65 finished with value: 0.8057751655578613 and parameters: {'n_layers': 1, 'weight_decay': 1.3749312122612164e-09, 'n_units_l0': 71, 'optimizer': 'Adam', 'adam_learning_rate': 0.0015510596936463743}. Best is trial 47 with value: 0.8379319310188293.
Trial 66 finished with value: 0.8254899978637695 and parameters: {'n_layers': 3, 'weight_decay': 2.4429318617858783e-07, 'n_units_l0': 57, 'n_units_l1': 7, 'n_units_l2': 12, 'optimizer': 'Adam', 'adam_learning_rate': 0.005004314980267536}. Best is trial 47 with value: 0.8379319310188293.
Trial 67 finished with value: 0.8297325968742371 and parameters: {'n_layers': 4, 'weight_decay': 3.823382887948114e-09, 'n_units_l0': 108, 'n_units_l1': 14, 'n_units_l2': 19, 'n_units_l3': 37, 'optimizer': 'Adam', 'adam_learning_rate': 0.0003686781211939161}. Best is trial 47 with value: 0.8379319310188293.
Trial 68 finished with value: 0.8185737729072571 and parameters: {'n_layers': 9, 'weight_decay': 9.154465235404749e-10, 'n_units_l0': 24, 'n_units_l1': 27, 'n_units_l2': 8, 'n_units_l3': 26, 'n_units_l4': 17, 'n_units_l5': 14, 'n_units_l6': 42, 'n_units_l7': 37, 'n_units_l8': 34, 'optimizer': 'Adam', 'adam_learning_rate': 0.0021767633035458538}. Best is trial 47 with value: 0.8379319310188293.
Trial 69 finished with value: 0.8236718773841858 and parameters: {'n_layers': 6, 'weight_decay': 1.0896666686951742e-10, 'n_units_l0': 42, 'n_units_l1': 39, 'n_units_l2': 10, 'n_units_l3': 9, 'n_units_l4': 6, 'n_units_l5': 7, 'optimizer': 'Adam', 'adam_learning_rate': 3.50333690979971e-05}. Best is trial 47 with value: 0.8379319310188293.
Trial 70 finished with value: 0.8206772804260254 and parameters: {'n_layers': 1, 'weight_decay': 1.015873517205749e-08, 'n_units_l0': 37, 'optimizer': 'Adam', 'adam_learning_rate': 0.010153561832000526}. Best is trial 47 with value: 0.8379319310188293.
Trial 71 finished with value: 0.8306591510772705 and parameters: {'n_layers': 7, 'weight_decay': 5.176722103446493e-10, 'n_units_l0': 32, 'n_units_l1': 4, 'n_units_l2': 16, 'n_units_l3': 11, 'n_units_l4': 12, 'n_units_l5': 8, 'n_units_l6': 60, 'optimizer': 'Adam', 'adam_learning_rate': 0.03473494686646793}. Best is trial 47 with value: 0.8379319310188293.
Trial 72 finished with value: 0.8221744894981384 and parameters: {'n_layers': 8, 'weight_decay': 4.52133362022356e-10, 'n_units_l0': 27, 'n_units_l1': 8, 'n_units_l2': 15, 'n_units_l3': 19, 'n_units_l4': 8, 'n_units_l5': 12, 'n_units_l6': 78, 'n_units_l7': 52, 'optimizer': 'Adam', 'adam_learning_rate': 0.024455435839730495}. Best is trial 47 with value: 0.8379319310188293.
Trial 73 finished with value: 0.8239569664001465 and parameters: {'n_layers': 5, 'weight_decay': 2.576505801780325e-10, 'n_units_l0': 51, 'n_units_l1': 21, 'n_units_l2': 25, 'n_units_l3': 12, 'n_units_l4': 10, 'optimizer': 'Adam', 'adam_learning_rate': 0.0070637799916844655}. Best is trial 47 with value: 0.8379319310188293.
Trial 74 finished with value: 0.8200711607933044 and parameters: {'n_layers': 4, 'weight_decay': 3.485803940950798e-10, 'n_units_l0': 63, 'n_units_l1': 5, 'n_units_l2': 14, 'n_units_l3': 50, 'optimizer': 'Adam', 'adam_learning_rate': 0.0011093214810302364}. Best is trial 47 with value: 0.8379319310188293.
Trial 75 finished with value: 0.8260603547096252 and parameters: {'n_layers': 6, 'weight_decay': 6.562354841088306e-08, 'n_units_l0': 40, 'n_units_l1': 34, 'n_units_l2': 17, 'n_units_l3': 8, 'n_units_l4': 22, 'n_units_l5': 10, 'optimizer': 'Adam', 'adam_learning_rate': 0.005222711465679021}. Best is trial 47 with value: 0.8379319310188293.
Trial 76 finished with value: 0.8130833506584167 and parameters: {'n_layers': 11, 'weight_decay': 7.786215115387953e-10, 'n_units_l0': 17, 'n_units_l1': 6, 'n_units_l2': 12, 'n_units_l3': 7, 'n_units_l4': 13, 'n_units_l5': 5, 'n_units_l6': 37, 'n_units_l7': 78, 'n_units_l8': 10, 'n_units_l9': 20, 'n_units_l10': 18, 'optimizer': 'Adam', 'adam_learning_rate': 0.018426481063066914}. Best is trial 47 with value: 0.8379319310188293.
Trial 77 finished with value: 0.8157930970191956 and parameters: {'n_layers': 3, 'weight_decay': 2.4954202173449274e-08, 'n_units_l0': 10, 'n_units_l1': 7, 'n_units_l2': 20, 'optimizer': 'Adam', 'adam_learning_rate': 0.05526222084655141}. Best is trial 47 with value: 0.8379319310188293.
Trial 78 finished with value: 0.8309802412986755 and parameters: {'n_layers': 5, 'weight_decay': 1.7947149999113366e-09, 'n_units_l0': 44, 'n_units_l1': 27, 'n_units_l2': 30, 'n_units_l3': 30, 'n_units_l4': 7, 'optimizer': 'Adam', 'adam_learning_rate': 1.5507135549756717e-05}. Best is trial 47 with value: 0.8379319310188293.
Trial 79 finished with value: 0.8215683102607727 and parameters: {'n_layers': 10, 'weight_decay': 1.770163664680159e-10, 'n_units_l0': 32, 'n_units_l1': 8, 'n_units_l2': 24, 'n_units_l3': 15, 'n_units_l4': 15, 'n_units_l5': 8, 'n_units_l6': 103, 'n_units_l7': 10, 'n_units_l8': 4, 'n_units_l9': 78, 'optimizer': 'RMSprop', 'rmsprop_learning_rate': 0.00012140530066888352, 'rmsprop_weight_decay': 0.8965354599375158, 'rmsprop_momentum': 0.00040054792845838945}. Best is trial 47 with value: 0.8379319310188293.
Trial 80 finished with value: 0.8185381889343262 and parameters: {'n_layers': 9, 'weight_decay': 7.758947940248886e-07, 'n_units_l0': 21, 'n_units_l1': 50, 'n_units_l2': 9, 'n_units_l3': 23, 'n_units_l4': 19, 'n_units_l5': 13, 'n_units_l6': 28, 'n_units_l7': 106, 'n_units_l8': 21, 'optimizer': 'Adam', 'adam_learning_rate': 0.002980291634203529}. Best is trial 47 with value: 0.8379319310188293.
Trial 81 finished with value: 0.8151870369911194 and parameters: {'n_layers': 5, 'weight_decay': 1.4038929436465894e-09, 'n_units_l0': 44, 'n_units_l1': 27, 'n_units_l2': 31, 'n_units_l3': 28, 'n_units_l4': 6, 'optimizer': 'Adam', 'adam_learning_rate': 1.7281728191476417e-05}. Best is trial 47 with value: 0.8379319310188293.
Trial 82 finished with value: 0.8339748382568359 and parameters: {'n_layers': 6, 'weight_decay': 2.1784626370337495e-09, 'n_units_l0': 37, 'n_units_l1': 42, 'n_units_l2': 27, 'n_units_l3': 31, 'n_units_l4': 7, 'n_units_l5': 18, 'optimizer': 'Adam', 'adam_learning_rate': 1.3595363033199774e-05}. Best is trial 47 with value: 0.8379319310188293.
Trial 83 finished with value: 0.8067377805709839 and parameters: {'n_layers': 7, 'weight_decay': 5.310879229028959e-09, 'n_units_l0': 30, 'n_units_l1': 42, 'n_units_l2': 16, 'n_units_l3': 64, 'n_units_l4': 8, 'n_units_l5': 17, 'n_units_l6': 78, 'optimizer': 'Adam', 'adam_learning_rate': 1.1287308353363304e-05}. Best is trial 47 with value: 0.8379319310188293.
Trial 84 finished with value: 0.8024597764015198 and parameters: {'n_layers': 6, 'weight_decay': 2.6842619790966697e-09, 'n_units_l0': 36, 'n_units_l1': 61, 'n_units_l2': 43, 'n_units_l3': 20, 'n_units_l4': 10, 'n_units_l5': 10, 'optimizer': 'Adam', 'adam_learning_rate': 0.09940822595409643}. Best is trial 47 with value: 0.8379319310188293.
Trial 85 finished with value: 0.8392153382301331 and parameters: {'n_layers': 8, 'weight_decay': 3.3129274981310235e-09, 'n_units_l0': 25, 'n_units_l1': 33, 'n_units_l2': 14, 'n_units_l3': 25, 'n_units_l4': 5, 'n_units_l5': 18, 'n_units_l6': 58, 'n_units_l7': 31, 'optimizer': 'SGD', 'sgd_opt_learning_rate': 0.011171636198223684, 'sgd_opt_momentum': 0.00016943039146295952}. Best is trial 85 with value: 0.8392153382301331.
Trial 86 finished with value: 0.8224954009056091 and parameters: {'n_layers': 8, 'weight_decay': 1.7868009109025284e-08, 'n_units_l0': 23, 'n_units_l1': 36, 'n_units_l2': 36, 'n_units_l3': 34, 'n_units_l4': 5, 'n_units_l5': 17, 'n_units_l6': 12, 'n_units_l7': 30, 'optimizer': 'SGD', 'sgd_opt_learning_rate': 0.010007561560072866, 'sgd_opt_momentum': 0.00010257080579617512}. Best is trial 85 with value: 0.8392153382301331.
Trial 87 finished with value: 0.8218535780906677 and parameters: {'n_layers': 2, 'weight_decay': 7.87297506860151e-09, 'n_units_l0': 54, 'n_units_l1': 40, 'optimizer': 'SGD', 'sgd_opt_learning_rate': 0.09442473433182126, 'sgd_opt_momentum': 9.479252761073425e-05}. Best is trial 85 with value: 0.8392153382301331.
Trial 88 finished with value: 0.8154723644256592 and parameters: {'n_layers': 14, 'weight_decay': 3.834896911041624e-09, 'n_units_l0': 24, 'n_units_l1': 33, 'n_units_l2': 14, 'n_units_l3': 30, 'n_units_l4': 4, 'n_units_l5': 22, 'n_units_l6': 14, 'n_units_l7': 21, 'n_units_l8': 11, 'n_units_l9': 11, 'n_units_l10': 10, 'n_units_l11': 4, 'n_units_l12': 44, 'n_units_l13': 10, 'optimizer': 'SGD', 'sgd_opt_learning_rate': 0.005619272158556561, 'sgd_opt_momentum': 1.45762444019704e-05}. Best is trial 85 with value: 0.8392153382301331.
Trial 89 finished with value: 0.8458108901977539 and parameters: {'n_layers': 4, 'weight_decay': 9.790878485250628e-10, 'n_units_l0': 48, 'n_units_l1': 20, 'n_units_l2': 11, 'n_units_l3': 25, 'optimizer': 'SGD', 'sgd_opt_learning_rate': 0.02152287944420438, 'sgd_opt_momentum': 0.00026125115066032135}. Best is trial 89 with value: 0.8458108901977539.
Trial 90 finished with value: 0.8064525723457336 and parameters: {'n_layers': 4, 'weight_decay': 1.9999545688307382e-09, 'n_units_l0': 48, 'n_units_l1': 30, 'n_units_l2': 7, 'n_units_l3': 25, 'optimizer': 'SGD', 'sgd_opt_learning_rate': 0.03300482990852163, 'sgd_opt_momentum': 0.00019087050454992026}. Best is trial 89 with value: 0.8458108901977539.
Trial 91 finished with value: 0.8100176453590393 and parameters: {'n_layers': 6, 'weight_decay': 3.3590529017919346e-09, 'n_units_l0': 64, 'n_units_l1': 19, 'n_units_l2': 18, 'n_units_l3': 38, 'n_units_l4': 13, 'n_units_l5': 25, 'optimizer': 'SGD', 'sgd_opt_learning_rate': 0.0110654369847045, 'sgd_opt_momentum': 0.0015465111779278482}. Best is trial 89 with value: 0.8458108901977539.
Trial 92 finished with value: 0.8106949925422668 and parameters: {'n_layers': 4, 'weight_decay': 1.025719109949014e-09, 'n_units_l0': 38, 'n_units_l1': 16, 'n_units_l2': 11, 'n_units_l3': 25, 'optimizer': 'SGD', 'sgd_opt_learning_rate': 0.0026782480456424423, 'sgd_opt_momentum': 5.755727369578661e-05}. Best is trial 89 with value: 0.8458108901977539.
Trial 93 finished with value: 0.8248481750488281 and parameters: {'n_layers': 5, 'weight_decay': 6.71767237112341e-10, 'n_units_l0': 55, 'n_units_l1': 23, 'n_units_l2': 13, 'n_units_l3': 17, 'n_units_l4': 25, 'optimizer': 'SGD', 'sgd_opt_learning_rate': 0.020996064888407374, 'sgd_opt_momentum': 0.000579821618440073}. Best is trial 89 with value: 0.8458108901977539.
Trial 94 finished with value: 0.830374002456665 and parameters: {'n_layers': 8, 'weight_decay': 1.3724218137827502e-07, 'n_units_l0': 34, 'n_units_l1': 47, 'n_units_l2': 10, 'n_units_l3': 22, 'n_units_l4': 4, 'n_units_l5': 21, 'n_units_l6': 21, 'n_units_l7': 44, 'optimizer': 'SGD', 'sgd_opt_learning_rate': 0.0063117429898088585, 'sgd_opt_momentum': 0.00019755531773652554}. Best is trial 89 with value: 0.8458108901977539.
Trial 95 finished with value: 0.816078245639801 and parameters: {'n_layers': 3, 'weight_decay': 3.8813315163231635e-10, 'n_units_l0': 7, 'n_units_l1': 25, 'n_units_l2': 12, 'optimizer': 'RMSprop', 'rmsprop_learning_rate': 1.1231848148334317e-05, 'rmsprop_weight_decay': 0.9142536569428651, 'rmsprop_momentum': 4.097787304409168e-05}. Best is trial 89 with value: 0.8458108901977539.
Trial 96 finished with value: 0.8298038244247437 and parameters: {'n_layers': 2, 'weight_decay': 1.3139702326309358e-09, 'n_units_l0': 80, 'n_units_l1': 31, 'optimizer': 'SGD', 'sgd_opt_learning_rate': 0.0005502934614435829, 'sgd_opt_momentum': 3.368731204653611e-05}. Best is trial 89 with value: 0.8458108901977539.
Trial 97 finished with value: 0.8121209144592285 and parameters: {'n_layers': 6, 'weight_decay': 1.155173652709652e-08, 'n_units_l0': 41, 'n_units_l1': 53, 'n_units_l2': 14, 'n_units_l3': 45, 'n_units_l4': 7, 'n_units_l5': 32, 'optimizer': 'RMSprop', 'rmsprop_learning_rate': 0.0006801995010261704, 'rmsprop_weight_decay': 0.8731543792687579, 'rmsprop_momentum': 0.00042028612945766206}. Best is trial 89 with value: 0.8458108901977539.
Trial 98 finished with value: 0.8300533294677734 and parameters: {'n_layers': 7, 'weight_decay': 2.3584714047588253e-10, 'n_units_l0': 49, 'n_units_l1': 20, 'n_units_l2': 9, 'n_units_l3': 6, 'n_units_l4': 17, 'n_units_l5': 27, 'n_units_l6': 56, 'optimizer': 'SGD', 'sgd_opt_learning_rate': 0.04401816163961033, 'sgd_opt_momentum': 0.002063755190082173}. Best is trial 89 with value: 0.8458108901977539.
Trial 99 finished with value: 0.8191083073616028 and parameters: {'n_layers': 5, 'weight_decay': 1.7125003842134316e-05, 'n_units_l0': 26, 'n_units_l1': 107, 'n_units_l2': 27, 'n_units_l3': 99, 'n_units_l4': 8, 'optimizer': 'Adam', 'adam_learning_rate': 2.5410696499218742e-05}. Best is trial 89 with value: 0.8458108901977539.
Trial 100 finished with value: 0.8134401440620422 and parameters: {'n_layers': 4, 'weight_decay': 5.297518355995726e-09, 'n_units_l0': 19, 'n_units_l1': 13, 'n_units_l2': 21, 'n_units_l3': 28, 'optimizer': 'RMSprop', 'rmsprop_learning_rate': 0.005505778517899927, 'rmsprop_weight_decay': 0.9489973793968725, 'rmsprop_momentum': 0.004437867861104603}. Best is trial 89 with value: 0.8458108901977539.
Trial 101 finished with value: 0.820605993270874 and parameters: {'n_layers': 7, 'weight_decay': 5.999662509529859e-10, 'n_units_l0': 26, 'n_units_l1': 39, 'n_units_l2': 16, 'n_units_l3': 20, 'n_units_l4': 11, 'n_units_l5': 6, 'n_units_l6': 42, 'optimizer': 'Adam', 'adam_learning_rate': 4.2886109049310295e-05}. Best is trial 89 with value: 0.8458108901977539.
Trial 102 finished with value: 0.8339747786521912 and parameters: {'n_layers': 8, 'weight_decay': 1.2866562684294722e-10, 'n_units_l0': 30, 'n_units_l1': 10, 'n_units_l2': 19, 'n_units_l3': 32, 'n_units_l4': 9, 'n_units_l5': 39, 'n_units_l6': 72, 'n_units_l7': 97, 'optimizer': 'Adam', 'adam_learning_rate': 6.642005615488698e-05}. Best is trial 89 with value: 0.8458108901977539.
Trial 103 finished with value: 0.827629029750824 and parameters: {'n_layers': 9, 'weight_decay': 1.5734608263029548e-10, 'n_units_l0': 32, 'n_units_l1': 10, 'n_units_l2': 19, 'n_units_l3': 32, 'n_units_l4': 9, 'n_units_l5': 40, 'n_units_l6': 72, 'n_units_l7': 96, 'n_units_l8': 22, 'optimizer': 'Adam', 'adam_learning_rate': 6.826694394179528e-05}. Best is trial 89 with value: 0.8458108901977539.
Trial 104 finished with value: 0.8125133514404297 and parameters: {'n_layers': 8, 'weight_decay': 1.0758694604889692e-10, 'n_units_l0': 36, 'n_units_l1': 16, 'n_units_l2': 11, 'n_units_l3': 36, 'n_units_l4': 5, 'n_units_l5': 40, 'n_units_l6': 110, 'n_units_l7': 73, 'optimizer': 'Adam', 'adam_learning_rate': 0.00010646812995490586}. Best is trial 89 with value: 0.8458108901977539.
Trial 105 finished with value: 0.8221744894981384 and parameters: {'n_layers': 3, 'weight_decay': 2.7331675390765316e-09, 'n_units_l0': 13, 'n_units_l1': 9, 'n_units_l2': 23, 'optimizer': 'Adam', 'adam_learning_rate': 0.00022698348983092253}. Best is trial 89 with value: 0.8458108901977539.
Trial 106 finished with value: 0.819429337978363 and parameters: {'n_layers': 5, 'weight_decay': 2.9929227307368444e-10, 'n_units_l0': 46, 'n_units_l1': 35, 'n_units_l2': 18, 'n_units_l3': 27, 'n_units_l4': 6, 'optimizer': 'Adam', 'adam_learning_rate': 2.3386629118508854e-05}. Best is trial 89 with value: 0.8458108901977539.
Trial 107 finished with value: 0.8188231587409973 and parameters: {'n_layers': 6, 'weight_decay': 1.0718720268614194e-09, 'n_units_l0': 21, 'n_units_l1': 11, 'n_units_l2': 15, 'n_units_l3': 42, 'n_units_l4': 12, 'n_units_l5': 19, 'optimizer': 'Adam', 'adam_learning_rate': 1.3010474749401877e-05}. Best is trial 89 with value: 0.8458108901977539.
Trial 108 finished with value: 0.8218535780906677 and parameters: {'n_layers': 10, 'weight_decay': 1.8416587632655964e-09, 'n_units_l0': 42, 'n_units_l1': 17, 'n_units_l2': 13, 'n_units_l3': 24, 'n_units_l4': 15, 'n_units_l5': 24, 'n_units_l6': 42, 'n_units_l7': 95, 'n_units_l8': 13, 'n_units_l9': 5, 'optimizer': 'SGD', 'sgd_opt_learning_rate': 0.09910557328996143, 'sgd_opt_momentum': 0.00038285411303538955}. Best is trial 89 with value: 0.8458108901977539.
