Trial 109 finished with value: 0.8312298655509949 and parameters: {'n_layers': 12, 'weight_decay': 1.3777822986600092e-10, 'n_units_l0': 29, 'n_units_l1': 29, 'n_units_l2': 20, 'n_units_l3': 18, 'n_units_l4': 95, 'n_units_l5': 58, 'n_units_l6': 24, 'n_units_l7': 57, 'n_units_l8': 8, 'n_units_l9': 78, 'n_units_l10': 77, 'n_units_l11': 19, 'optimizer': 'Adam', 'adam_learning_rate': 0.0016421981212584502}. Best is trial 89 with value: 0.8458108901977539.
Trial 110 finished with value: 0.8118715882301331 and parameters: {'n_layers': 8, 'weight_decay': 2.1789164372964638e-10, 'n_units_l0': 25, 'n_units_l1': 21, 'n_units_l2': 27, 'n_units_l3': 21, 'n_units_l4': 38, 'n_units_l5': 4, 'n_units_l6': 83, 'n_units_l7': 31, 'optimizer': 'Adam', 'adam_learning_rate': 0.0004391622288378382}. Best is trial 89 with value: 0.8458108901977539.
Trial 111 finished with value: 0.8209623098373413 and parameters: {'n_layers': 7, 'weight_decay': 3.8772490471537595e-10, 'n_units_l0': 29, 'n_units_l1': 4, 'n_units_l2': 16, 'n_units_l3': 13, 'n_units_l4': 10, 'n_units_l5': 10, 'n_units_l6': 68, 'optimizer': 'Adam', 'adam_learning_rate': 0.009693448546228342}. Best is trial 89 with value: 0.8458108901977539.
Trial 112 finished with value: 0.8203564882278442 and parameters: {'n_layers': 7, 'weight_decay': 7.181644095124849e-10, 'n_units_l0': 28, 'n_units_l1': 5, 'n_units_l2': 12, 'n_units_l3': 10, 'n_units_l4': 9, 'n_units_l5': 7, 'n_units_l6': 57, 'optimizer': 'Adam', 'adam_learning_rate': 0.0033911014938988945}. Best is trial 89 with value: 0.8458108901977539.
Trial 113 finished with value: 0.8188233375549316 and parameters: {'n_layers': 6, 'weight_decay': 4.465432852801127e-10, 'n_units_l0': 34, 'n_units_l1': 6, 'n_units_l2': 17, 'n_units_l3': 31, 'n_units_l4': 13, 'n_units_l5': 8, 'optimizer': 'Adam', 'adam_learning_rate': 0.0022512998089245385}. Best is trial 89 with value: 0.8458108901977539.
Trial 114 finished with value: 0.8276289701461792 and parameters: {'n_layers': 9, 'weight_decay': 3.0191171908986946e-10, 'n_units_l0': 38, 'n_units_l1': 38, 'n_units_l2': 18, 'n_units_l3': 39, 'n_units_l4': 11, 'n_units_l5': 15, 'n_units_l6': 34, 'n_units_l7': 44, 'n_units_l8': 43, 'optimizer': 'Adam', 'adam_learning_rate': 4.98006324409656e-05}. Best is trial 89 with value: 0.8458108901977539.
Trial 115 finished with value: 0.8185380101203918 and parameters: {'n_layers': 7, 'weight_decay': 8.322069841263613e-09, 'n_units_l0': 59, 'n_units_l1': 42, 'n_units_l2': 14, 'n_units_l3': 14, 'n_units_l4': 7, 'n_units_l5': 9, 'n_units_l6': 113, 'optimizer': 'Adam', 'adam_learning_rate': 0.0008511661153646244}. Best is trial 89 with value: 0.8458108901977539.
Trial 116 finished with value: 0.836399257183075 and parameters: {'n_layers': 4, 'weight_decay': 1.0009562737821913e-09, 'n_units_l0': 32, 'n_units_l1': 26, 'n_units_l2': 23, 'n_units_l3': 17, 'optimizer': 'Adam', 'adam_learning_rate': 0.0005426775911380382}. Best is trial 89 with value: 0.8458108901977539.
Trial 117 finished with value: 0.8106949329376221 and parameters: {'n_layers': 4, 'weight_decay': 9.914133681257555e-10, 'n_units_l0': 41, 'n_units_l1': 25, 'n_units_l2': 22, 'n_units_l3': 35, 'optimizer': 'RMSprop', 'rmsprop_learning_rate': 3.8759982933240334e-05, 'rmsprop_weight_decay': 0.972562194703693, 'rmsprop_momentum': 1.4796835195214827e-05}. Best is trial 89 with value: 0.8458108901977539.
Trial 118 finished with value: 0.8337253928184509 and parameters: {'n_layers': 5, 'weight_decay': 3.889048461221756e-08, 'n_units_l0': 32, 'n_units_l1': 23, 'n_units_l2': 124, 'n_units_l3': 12, 'n_units_l4': 29, 'optimizer': 'Adam', 'adam_learning_rate': 0.0014341234304672916}. Best is trial 89 with value: 0.8458108901977539.
Trial 119 finished with value: 0.8197503089904785 and parameters: {'n_layers': 2, 'weight_decay': 3.7091542314397486e-08, 'n_units_l0': 31, 'n_units_l1': 23, 'optimizer': 'Adam', 'adam_learning_rate': 0.0006261048388577552}. Best is trial 89 with value: 0.8458108901977539.
Trial 120 finished with value: 0.8264527320861816 and parameters: {'n_layers': 3, 'weight_decay': 1.6489283988062832e-08, 'n_units_l0': 22, 'n_units_l1': 32, 'n_units_l2': 49, 'optimizer': 'Adam', 'adam_learning_rate': 0.0005454729793331921}. Best is trial 89 with value: 0.8458108901977539.
Trial 121 finished with value: 0.8149375319480896 and parameters: {'n_layers': 5, 'weight_decay': 6.89634640892144e-08, 'n_units_l0': 34, 'n_units_l1': 27, 'n_units_l2': 119, 'n_units_l3': 12, 'n_units_l4': 27, 'optimizer': 'Adam', 'adam_learning_rate': 0.0013169269767409747}. Best is trial 89 with value: 0.8458108901977539.
Trial 122 finished with value: 0.8191442489624023 and parameters: {'n_layers': 4, 'weight_decay': 2.030892314357778e-07, 'n_units_l0': 50, 'n_units_l1': 22, 'n_units_l2': 11, 'n_units_l3': 17, 'optimizer': 'Adam', 'adam_learning_rate': 0.0026196579029390023}. Best is trial 89 with value: 0.8458108901977539.
Trial 123 finished with value: 0.8239927291870117 and parameters: {'n_layers': 6, 'weight_decay': 1.5076592345331984e-09, 'n_units_l0': 45, 'n_units_l1': 19, 'n_units_l2': 65, 'n_units_l3': 16, 'n_units_l4': 34, 'n_units_l5': 17, 'optimizer': 'Adam', 'adam_learning_rate': 0.004311421901511445}. Best is trial 89 with value: 0.8458108901977539.
Trial 124 finished with value: 0.8269873857498169 and parameters: {'n_layers': 4, 'weight_decay': 5.6886635943502765e-08, 'n_units_l0': 36, 'n_units_l1': 26, 'n_units_l2': 15, 'n_units_l3': 10, 'optimizer': 'Adam', 'adam_learning_rate': 0.0009854909712065344}. Best is trial 89 with value: 0.8458108901977539.
Trial 125 finished with value: 0.8273082971572876 and parameters: {'n_layers': 5, 'weight_decay': 2.3928499482710783e-08, 'n_units_l0': 12, 'n_units_l1': 30, 'n_units_l2': 105, 'n_units_l3': 11, 'n_units_l4': 29, 'optimizer': 'Adam', 'adam_learning_rate': 0.00018533098349155308}. Best is trial 89 with value: 0.8458108901977539.
Trial 126 finished with value: 0.8267021179199219 and parameters: {'n_layers': 3, 'weight_decay': 3.07951727743435e-08, 'n_units_l0': 53, 'n_units_l1': 23, 'n_units_l2': 10, 'optimizer': 'SGD', 'sgd_opt_learning_rate': 0.022398076698492416, 'sgd_opt_momentum': 0.00010790636129999957}. Best is trial 89 with value: 0.8458108901977539.
Trial 127 finished with value: 0.8206771016120911 and parameters: {'n_layers': 5, 'weight_decay': 1.3165838502960038e-07, 'n_units_l0': 39, 'n_units_l1': 9, 'n_units_l2': 91, 'n_units_l3': 22, 'n_units_l4': 24, 'optimizer': 'Adam', 'adam_learning_rate': 7.474985941089565e-05}. Best is trial 89 with value: 0.8458108901977539.
Trial 128 finished with value: 0.8179323077201843 and parameters: {'n_layers': 24, 'weight_decay': 6.480268073046717e-10, 'n_units_l0': 32, 'n_units_l1': 33, 'n_units_l2': 24, 'n_units_l3': 29, 'n_units_l4': 19, 'n_units_l5': 12, 'n_units_l6': 16, 'n_units_l7': 25, 'n_units_l8': 52, 'n_units_l9': 22, 'n_units_l10': 5, 'n_units_l11': 8, 'n_units_l12': 4, 'n_units_l13': 10, 'n_units_l14': 4, 'n_units_l15': 45, 'n_units_l16': 14, 'n_units_l17': 123, 'n_units_l18': 4, 'n_units_l19': 16, 'n_units_l20': 16, 'n_units_l21': 123, 'n_units_l22': 4, 'n_units_l23': 9, 'optimizer': 'Adam', 'adam_learning_rate': 0.0016255128141022925}. Best is trial 89 with value: 0.8458108901977539.
Trial 129 finished with value: 0.8115861415863037 and parameters: {'n_layers': 6, 'weight_decay': 3.8805350543812006e-07, 'n_units_l0': 6, 'n_units_l1': 29, 'n_units_l2': 19, 'n_units_l3': 19, 'n_units_l4': 14, 'n_units_l5': 6, 'optimizer': 'RMSprop', 'rmsprop_learning_rate': 0.0013266664736183837, 'rmsprop_weight_decay': 0.9164500924371359, 'rmsprop_momentum': 6.91637936928201e-05}. Best is trial 89 with value: 0.8458108901977539.
Trial 130 finished with value: 0.821568489074707 and parameters: {'n_layers': 4, 'weight_decay': 2.708517167114501e-09, 'n_units_l0': 17, 'n_units_l1': 36, 'n_units_l2': 68, 'n_units_l3': 8, 'optimizer': 'Adam', 'adam_learning_rate': 0.00012076315301215409}. Best is trial 89 with value: 0.8458108901977539.
Trial 131 finished with value: 0.8318714499473572 and parameters: {'n_layers': 7, 'weight_decay': 4.844633117429512e-10, 'n_units_l0': 25, 'n_units_l1': 7, 'n_units_l2': 13, 'n_units_l3': 4, 'n_units_l4': 9, 'n_units_l5': 4, 'n_units_l6': 48, 'optimizer': 'Adam', 'adam_learning_rate': 1.037518740868198e-05}. Best is trial 89 with value: 0.8458108901977539.
Trial 132 finished with value: 0.8155080080032349 and parameters: {'n_layers': 6, 'weight_decay': 5.092041983995944e-10, 'n_units_l0': 25, 'n_units_l1': 6, 'n_units_l2': 12, 'n_units_l3': 4, 'n_units_l4': 46, 'n_units_l5': 4, 'optimizer': 'Adam', 'adam_learning_rate': 1.0042384657333395e-05}. Best is trial 89 with value: 0.8458108901977539.
Trial 133 finished with value: 0.8152583837509155 and parameters: {'n_layers': 8, 'weight_decay': 7.975728136668532e-10, 'n_units_l0': 23, 'n_units_l1': 8, 'n_units_l2': 8, 'n_units_l3': 5, 'n_units_l4': 22, 'n_units_l5': 5, 'n_units_l6': 46, 'n_units_l7': 59, 'optimizer': 'Adam', 'adam_learning_rate': 1.5531552803760376e-05}. Best is trial 89 with value: 0.8458108901977539.
Trial 134 finished with value: 0.8409267067909241 and parameters: {'n_layers': 7, 'weight_decay': 0.000987132555496517, 'n_units_l0': 20, 'n_units_l1': 7, 'n_units_l2': 13, 'n_units_l3': 15, 'n_units_l4': 8, 'n_units_l5': 73, 'n_units_l6': 54, 'optimizer': 'Adam', 'adam_learning_rate': 3.357609703592483e-05}. Best is trial 89 with value: 0.8458108901977539.
Trial 135 finished with value: 0.8242778182029724 and parameters: {'n_layers': 7, 'weight_decay': 0.00010557457823643827, 'n_units_l0': 19, 'n_units_l1': 7, 'n_units_l2': 13, 'n_units_l3': 26, 'n_units_l4': 8, 'n_units_l5': 70, 'n_units_l6': 128, 'optimizer': 'Adam', 'adam_learning_rate': 3.0467878325674976e-05}. Best is trial 89 with value: 0.8458108901977539.
Trial 136 finished with value: 0.8170409202575684 and parameters: {'n_layers': 1, 'weight_decay': 7.408792195567441e-06, 'n_units_l0': 15, 'optimizer': 'SGD', 'sgd_opt_learning_rate': 0.002106916962337627, 'sgd_opt_momentum': 0.0035646365379998933}. Best is trial 89 with value: 0.8458108901977539.
Trial 137 finished with value: 0.8082707524299622 and parameters: {'n_layers': 6, 'weight_decay': 0.0006741200429028116, 'n_units_l0': 20, 'n_units_l1': 7, 'n_units_l2': 6, 'n_units_l3': 12, 'n_units_l4': 6, 'n_units_l5': 50, 'optimizer': 'Adam', 'adam_learning_rate': 2.214843483686266e-05}. Best is trial 89 with value: 0.8458108901977539.
Trial 138 finished with value: 0.8118358254432678 and parameters: {'n_layers': 5, 'weight_decay': 0.00041922173966032626, 'n_units_l0': 27, 'n_units_l1': 45, 'n_units_l2': 11, 'n_units_l3': 16, 'n_units_l4': 16, 'optimizer': 'Adam', 'adam_learning_rate': 3.789328038080192e-05}. Best is trial 89 with value: 0.8458108901977539.
Trial 139 finished with value: 0.8136542439460754 and parameters: {'n_layers': 2, 'weight_decay': 4.090397811699132e-09, 'n_units_l0': 18, 'n_units_l1': 9, 'optimizer': 'Adam', 'adam_learning_rate': 0.006558008098671807}. Best is trial 89 with value: 0.8458108901977539.
Trial 140 finished with value: 0.8130835294723511 and parameters: {'n_layers': 8, 'weight_decay': 8.526619245389219e-08, 'n_units_l0': 22, 'n_units_l1': 5, 'n_units_l2': 14, 'n_units_l3': 18, 'n_units_l4': 20, 'n_units_l5': 118, 'n_units_l6': 27, 'n_units_l7': 13, 'optimizer': 'SGD', 'sgd_opt_learning_rate': 0.01427102728653551, 'sgd_opt_momentum': 0.0007267835649412673}. Best is trial 89 with value: 0.8458108901977539.
Trial 141 finished with value: 0.8143669366836548 and parameters: {'n_layers': 7, 'weight_decay': 1.161726987025177e-09, 'n_units_l0': 31, 'n_units_l1': 8, 'n_units_l2': 9, 'n_units_l3': 15, 'n_units_l4': 9, 'n_units_l5': 77, 'n_units_l6': 38, 'optimizer': 'Adam', 'adam_learning_rate': 1.2727018395659143e-05}. Best is trial 89 with value: 0.8458108901977539.
Trial 142 finished with value: 0.8397502303123474 and parameters: {'n_layers': 6, 'weight_decay': 1.496782829752807e-10, 'n_units_l0': 43, 'n_units_l1': 25, 'n_units_l2': 17, 'n_units_l3': 14, 'n_units_l4': 12, 'n_units_l5': 106, 'optimizer': 'Adam', 'adam_learning_rate': 5.593856032120769e-05}. Best is trial 89 with value: 0.8458108901977539.
Trial 143 finished with value: 0.8237074613571167 and parameters: {'n_layers': 5, 'weight_decay': 1.4170561568946223e-10, 'n_units_l0': 47, 'n_units_l1': 25, 'n_units_l2': 16, 'n_units_l3': 14, 'n_units_l4': 8, 'optimizer': 'Adam', 'adam_learning_rate': 5.767006037498706e-05}. Best is trial 89 with value: 0.8458108901977539.
Trial 144 finished with value: 0.8137252330780029 and parameters: {'n_layers': 6, 'weight_decay': 2.1470411429454912e-10, 'n_units_l0': 25, 'n_units_l1': 28, 'n_units_l2': 17, 'n_units_l3': 13, 'n_units_l4': 12, 'n_units_l5': 81, 'optimizer': 'Adam', 'adam_learning_rate': 9.268223914589077e-05}. Best is trial 89 with value: 0.8458108901977539.
Trial 145 finished with value: 0.8061316609382629 and parameters: {'n_layers': 5, 'weight_decay': 2.224408516809246e-09, 'n_units_l0': 43, 'n_units_l1': 21, 'n_units_l2': 15, 'n_units_l3': 33, 'n_units_l4': 10, 'optimizer': 'Adam', 'adam_learning_rate': 0.0018224124381152652}. Best is trial 89 with value: 0.8458108901977539.
Trial 146 finished with value: 0.8282352685928345 and parameters: {'n_layers': 4, 'weight_decay': 1.8107840534724762e-09, 'n_units_l0': 8, 'n_units_l1': 34, 'n_units_l2': 21, 'n_units_l3': 19, 'optimizer': 'Adam', 'adam_learning_rate': 2.926855110888964e-05}. Best is trial 89 with value: 0.8458108901977539.
Trial 147 finished with value: 0.8200352787971497 and parameters: {'n_layers': 6, 'weight_decay': 4.152715683194134e-08, 'n_units_l0': 28, 'n_units_l1': 7, 'n_units_l2': 13, 'n_units_l3': 24, 'n_units_l4': 7, 'n_units_l5': 92, 'optimizer': 'RMSprop', 'rmsprop_learning_rate': 0.007034995195282249, 'rmsprop_weight_decay': 0.9277156821614053, 'rmsprop_momentum': 0.0007006238276850761}. Best is trial 89 with value: 0.8458108901977539.
Trial 148 finished with value: 0.8091263175010681 and parameters: {'n_layers': 7, 'weight_decay': 5.345857158307867e-09, 'n_units_l0': 39, 'n_units_l1': 6, 'n_units_l2': 4, 'n_units_l3': 16, 'n_units_l4': 5, 'n_units_l5': 108, 'n_units_l6': 87, 'optimizer': 'Adam', 'adam_learning_rate': 1.913270556504091e-05}. Best is trial 89 with value: 0.8458108901977539.
Trial 149 finished with value: 0.8227449655532837 and parameters: {'n_layers': 3, 'weight_decay': 3.0987404095194596e-10, 'n_units_l0': 35, 'n_units_l1': 31, 'n_units_l2': 19, 'optimizer': 'Adam', 'adam_learning_rate': 0.0012812602589878938}. Best is trial 89 with value: 0.8458108901977539.
Trial 150 finished with value: 0.8039925694465637 and parameters: {'n_layers': 7, 'weight_decay': 1.0070305555746066e-10, 'n_units_l0': 50, 'n_units_l1': 51, 'n_units_l2': 25, 'n_units_l3': 12, 'n_units_l4': 9, 'n_units_l5': 97, 'n_units_l6': 32, 'optimizer': 'SGD', 'sgd_opt_learning_rate': 0.006568240219813296, 'sgd_opt_momentum': 1.1039383945086559e-05}. Best is trial 89 with value: 0.8458108901977539.
Trial 151 finished with value: 0.817326009273529 and parameters: {'n_layers': 8, 'weight_decay': 4.6556897600439176e-10, 'n_units_l0': 43, 'n_units_l1': 19, 'n_units_l2': 14, 'n_units_l3': 21, 'n_units_l4': 11, 'n_units_l5': 59, 'n_units_l6': 53, 'n_units_l7': 5, 'optimizer': 'Adam', 'adam_learning_rate': 1.4047888586945603e-05}. Best is trial 89 with value: 0.8458108901977539.
Trial 152 finished with value: 0.8306593894958496 and parameters: {'n_layers': 9, 'weight_decay': 1.5355597984198104e-10, 'n_units_l0': 33, 'n_units_l1': 17, 'n_units_l2': 10, 'n_units_l3': 4, 'n_units_l4': 16, 'n_units_l5': 68, 'n_units_l6': 62, 'n_units_l7': 108, 'n_units_l8': 5, 'optimizer': 'Adam', 'adam_learning_rate': 4.245753183247056e-05}. Best is trial 89 with value: 0.8458108901977539.
Trial 153 finished with value: 0.8193938136100769 and parameters: {'n_layers': 6, 'weight_decay': 1.992739128700569e-10, 'n_units_l0': 37, 'n_units_l1': 24, 'n_units_l2': 12, 'n_units_l3': 15, 'n_units_l4': 14, 'n_units_l5': 37, 'optimizer': 'Adam', 'adam_learning_rate': 1.03280399092994e-05}. Best is trial 89 with value: 0.8458108901977539.
Trial 154 finished with value: 0.8224596977233887 and parameters: {'n_layers': 8, 'weight_decay': 2.8808506430567827e-10, 'n_units_l0': 30, 'n_units_l1': 20, 'n_units_l2': 16, 'n_units_l3': 11, 'n_units_l4': 12, 'n_units_l5': 51, 'n_units_l6': 99, 'n_units_l7': 126, 'optimizer': 'Adam', 'adam_learning_rate': 1.770083834680215e-05}. Best is trial 89 with value: 0.8458108901977539.
Trial 155 finished with value: 0.8082707524299622 and parameters: {'n_layers': 19, 'weight_decay': 1.5347677076980104e-08, 'n_units_l0': 40, 'n_units_l1': 14, 'n_units_l2': 14, 'n_units_l3': 9, 'n_units_l4': 11, 'n_units_l5': 13, 'n_units_l6': 70, 'n_units_l7': 85, 'n_units_l8': 18, 'n_units_l9': 65, 'n_units_l10': 43, 'n_units_l11': 33, 'n_units_l12': 11, 'n_units_l13': 7, 'n_units_l14': 8, 'n_units_l15': 7, 'n_units_l16': 56, 'n_units_l17': 58, 'n_units_l18': 11, 'optimizer': 'Adam', 'adam_learning_rate': 5.259560356418581e-05}. Best is trial 89 with value: 0.8458108901977539.
Trial 156 finished with value: 0.8154721260070801 and parameters: {'n_layers': 6, 'weight_decay': 8.155304853460842e-10, 'n_units_l0': 23, 'n_units_l1': 26, 'n_units_l2': 12, 'n_units_l3': 27, 'n_units_l4': 18, 'n_units_l5': 47, 'optimizer': 'Adam', 'adam_learning_rate': 0.0034688149156965014}. Best is trial 89 with value: 0.8458108901977539.
Trial 157 finished with value: 0.8273796439170837 and parameters: {'n_layers': 7, 'weight_decay': 5.655694315368852e-10, 'n_units_l0': 56, 'n_units_l1': 38, 'n_units_l2': 17, 'n_units_l3': 17, 'n_units_l4': 13, 'n_units_l5': 20, 'n_units_l6': 45, 'optimizer': 'Adam', 'adam_learning_rate': 2.604580816847918e-05}. Best is trial 89 with value: 0.8458108901977539.
Trial 158 finished with value: 0.8288055658340454 and parameters: {'n_layers': 5, 'weight_decay': 1.2711335357626962e-09, 'n_units_l0': 46, 'n_units_l1': 6, 'n_units_l2': 18, 'n_units_l3': 30, 'n_units_l4': 10, 'optimizer': 'Adam', 'adam_learning_rate': 6.254106957565208e-05}. Best is trial 89 with value: 0.8458108901977539.
Trial 159 finished with value: 0.8272724747657776 and parameters: {'n_layers': 4, 'weight_decay': 3.79735897157161e-10, 'n_units_l0': 36, 'n_units_l1': 11, 'n_units_l2': 20, 'n_units_l3': 6, 'optimizer': 'RMSprop', 'rmsprop_learning_rate': 0.00030091796605229067, 'rmsprop_weight_decay': 0.8831537015324189, 'rmsprop_momentum': 0.002228172460194512}. Best is trial 89 with value: 0.8458108901977539.
Trial 160 finished with value: 0.8197145462036133 and parameters: {'n_layers': 7, 'weight_decay': 2.57386158333298e-10, 'n_units_l0': 20, 'n_units_l1': 22, 'n_units_l2': 13, 'n_units_l3': 14, 'n_units_l4': 8, 'n_units_l5': 123, 'n_units_l6': 50, 'optimizer': 'Adam', 'adam_learning_rate': 0.002761398336504332}. Best is trial 89 with value: 0.8458108901977539.
Trial 161 finished with value: 0.810089111328125 and parameters: {'n_layers': 7, 'weight_decay': 4.3327859728506036e-10, 'n_units_l0': 29, 'n_units_l1': 42, 'n_units_l2': 15, 'n_units_l3': 13, 'n_units_l4': 9, 'n_units_l5': 107, 'n_units_l6': 67, 'optimizer': 'Adam', 'adam_learning_rate': 0.012524945135726174}. Best is trial 89 with value: 0.8458108901977539.
Trial 162 finished with value: 0.8300533294677734 and parameters: {'n_layers': 8, 'weight_decay': 7.172570364493679e-10, 'n_units_l0': 27, 'n_units_l1': 5, 'n_units_l2': 16, 'n_units_l3': 14, 'n_units_l4': 10, 'n_units_l5': 28, 'n_units_l6': 77, 'n_units_l7': 24, 'optimizer': 'Adam', 'adam_learning_rate': 0.002135688675379993}. Best is trial 89 with value: 0.8458108901977539.
Trial 163 finished with value: 0.8109803199768066 and parameters: {'n_layers': 6, 'weight_decay': 9.346141446642899e-10, 'n_units_l0': 24, 'n_units_l1': 4, 'n_units_l2': 15, 'n_units_l3': 13, 'n_units_l4': 11, 'n_units_l5': 9, 'optimizer': 'Adam', 'adam_learning_rate': 0.005312281412364197}. Best is trial 89 with value: 0.8458108901977539.
Trial 164 finished with value: 0.8221745491027832 and parameters: {'n_layers': 8, 'weight_decay': 1.6309863871825252e-10, 'n_units_l0': 33, 'n_units_l1': 24, 'n_units_l2': 22, 'n_units_l3': 36, 'n_units_l4': 14, 'n_units_l5': 11, 'n_units_l6': 60, 'n_units_l7': 9, 'optimizer': 'Adam', 'adam_learning_rate': 0.0009708030045214355}. Best is trial 89 with value: 0.8458108901977539.
Trial 165 finished with value: 0.8212831616401672 and parameters: {'n_layers': 3, 'weight_decay': 3.4993006998053255e-05, 'n_units_l0': 26, 'n_units_l1': 28, 'n_units_l2': 18, 'optimizer': 'SGD', 'sgd_opt_learning_rate': 0.004029183125273711, 'sgd_opt_momentum': 2.430964612871506e-05}. Best is trial 89 with value: 0.8458108901977539.
Trial 166 finished with value: 0.8157930374145508 and parameters: {'n_layers': 5, 'weight_decay': 9.603196586244913e-09, 'n_units_l0': 41, 'n_units_l1': 7, 'n_units_l2': 11, 'n_units_l3': 24, 'n_units_l4': 12, 'optimizer': 'Adam', 'adam_learning_rate': 0.04053731911295585}. Best is trial 89 with value: 0.8458108901977539.
Trial 167 finished with value: 0.8240283727645874 and parameters: {'n_layers': 6, 'weight_decay': 3.67047872926792e-10, 'n_units_l0': 21, 'n_units_l1': 20, 'n_units_l2': 13, 'n_units_l3': 15, 'n_units_l4': 7, 'n_units_l5': 6, 'optimizer': 'Adam', 'adam_learning_rate': 0.01925819519301763}. Best is trial 89 with value: 0.8458108901977539.
Trial 168 finished with value: 0.8188589811325073 and parameters: {'n_layers': 9, 'weight_decay': 1.6465391403885977e-09, 'n_units_l0': 28, 'n_units_l1': 36, 'n_units_l2': 14, 'n_units_l3': 48, 'n_units_l4': 15, 'n_units_l5': 23, 'n_units_l6': 53, 'n_units_l7': 64, 'n_units_l8': 25, 'optimizer': 'Adam', 'adam_learning_rate': 2.1061273998600004e-05}. Best is trial 89 with value: 0.8458108901977539.
