Trial 169 finished with value: 0.8097325563430786 and parameters: {'n_layers': 7, 'weight_decay': 5.686589616869013e-10, 'n_units_l0': 38, 'n_units_l1': 32, 'n_units_l2': 55, 'n_units_l3': 32, 'n_units_l4': 21, 'n_units_l5': 5, 'n_units_l6': 85, 'optimizer': 'Adam', 'adam_learning_rate': 0.00035440760529612594}. Best is trial 89 with value: 0.8458108901977539.
Trial 170 finished with value: 0.8048840165138245 and parameters: {'n_layers': 4, 'weight_decay': 2.8516808277517074e-09, 'n_units_l0': 9, 'n_units_l1': 23, 'n_units_l2': 17, 'n_units_l3': 10, 'optimizer': 'Adam', 'adam_learning_rate': 0.0013679780434400915}. Best is trial 89 with value: 0.8458108901977539.
Trial 171 finished with value: 0.8106950521469116 and parameters: {'n_layers': 12, 'weight_decay': 1.3275806067189018e-10, 'n_units_l0': 28, 'n_units_l1': 30, 'n_units_l2': 20, 'n_units_l3': 18, 'n_units_l4': 127, 'n_units_l5': 61, 'n_units_l6': 25, 'n_units_l7': 57, 'n_units_l8': 9, 'n_units_l9': 89, 'n_units_l10': 78, 'n_units_l11': 18, 'optimizer': 'Adam', 'adam_learning_rate': 3.4318464681634635e-05}. Best is trial 89 with value: 0.8458108901977539.
Trial 172 finished with value: 0.8264169096946716 and parameters: {'n_layers': 11, 'weight_decay': 2.2171763758086966e-10, 'n_units_l0': 30, 'n_units_l1': 29, 'n_units_l2': 21, 'n_units_l3': 22, 'n_units_l4': 11, 'n_units_l5': 16, 'n_units_l6': 40, 'n_units_l7': 44, 'n_units_l8': 13, 'n_units_l9': 38, 'n_units_l10': 80, 'optimizer': 'Adam', 'adam_learning_rate': 0.0015129657195045614}. Best is trial 89 with value: 0.8458108901977539.
Trial 173 finished with value: 0.8297325372695923 and parameters: {'n_layers': 14, 'weight_decay': 1.2724046277878973e-10, 'n_units_l0': 31, 'n_units_l1': 27, 'n_units_l2': 19, 'n_units_l3': 12, 'n_units_l4': 60, 'n_units_l5': 7, 'n_units_l6': 9, 'n_units_l7': 34, 'n_units_l8': 7, 'n_units_l9': 82, 'n_units_l10': 122, 'n_units_l11': 21, 'n_units_l12': 72, 'n_units_l13': 29, 'optimizer': 'Adam', 'adam_learning_rate': 0.008612171584645724}. Best is trial 89 with value: 0.8458108901977539.
Trial 174 finished with value: 0.8212475776672363 and parameters: {'n_layers': 7, 'weight_decay': 1.847214907925259e-10, 'n_units_l0': 25, 'n_units_l1': 25, 'n_units_l2': 23, 'n_units_l3': 20, 'n_units_l4': 78, 'n_units_l5': 56, 'n_units_l6': 23, 'optimizer': 'Adam', 'adam_learning_rate': 0.0010954695453413515}. Best is trial 89 with value: 0.8458108901977539.
Trial 175 finished with value: 0.8237075209617615 and parameters: {'n_layers': 13, 'weight_decay': 2.8338249900217743e-10, 'n_units_l0': 34, 'n_units_l1': 35, 'n_units_l2': 15, 'n_units_l3': 16, 'n_units_l4': 107, 'n_units_l5': 64, 'n_units_l6': 56, 'n_units_l7': 40, 'n_units_l8': 5, 'n_units_l9': 41, 'n_units_l10': 57, 'n_units_l11': 43, 'n_units_l12': 27, 'optimizer': 'Adam', 'adam_learning_rate': 1.2580216201172635e-05}. Best is trial 89 with value: 0.8458108901977539.
Trial 176 finished with value: 0.8224952816963196 and parameters: {'n_layers': 9, 'weight_decay': 6.224682043442688e-07, 'n_units_l0': 52, 'n_units_l1': 40, 'n_units_l2': 20, 'n_units_l3': 18, 'n_units_l4': 13, 'n_units_l5': 78, 'n_units_l6': 48, 'n_units_l7': 76, 'n_units_l8': 8, 'optimizer': 'SGD', 'sgd_opt_learning_rate': 0.0012401292826055101, 'sgd_opt_momentum': 0.0013581228788424563}. Best is trial 89 with value: 0.8458108901977539.
Trial 177 finished with value: 0.827308177947998 and parameters: {'n_layers': 5, 'weight_decay': 1.8602528328306765e-06, 'n_units_l0': 45, 'n_units_l1': 33, 'n_units_l2': 75, 'n_units_l3': 28, 'n_units_l4': 10, 'optimizer': 'RMSprop', 'rmsprop_learning_rate': 0.012965144473972224, 'rmsprop_weight_decay': 0.944053548129143, 'rmsprop_momentum': 0.03697212136242975}. Best is trial 89 with value: 0.8458108901977539.
Trial 178 finished with value: 0.8197147250175476 and parameters: {'n_layers': 10, 'weight_decay': 1.1688824877124896e-09, 'n_units_l0': 23, 'n_units_l1': 22, 'n_units_l2': 17, 'n_units_l3': 39, 'n_units_l4': 88, 'n_units_l5': 33, 'n_units_l6': 30, 'n_units_l7': 49, 'n_units_l8': 14, 'n_units_l9': 70, 'optimizer': 'Adam', 'adam_learning_rate': 0.006358693403244158}. Best is trial 89 with value: 0.8458108901977539.
Trial 179 finished with value: 0.8088769912719727 and parameters: {'n_layers': 6, 'weight_decay': 4.286727854892855e-10, 'n_units_l0': 29, 'n_units_l1': 29, 'n_units_l2': 13, 'n_units_l3': 5, 'n_units_l4': 9, 'n_units_l5': 46, 'optimizer': 'Adam', 'adam_learning_rate': 0.001805955325666962}. Best is trial 89 with value: 0.8458108901977539.
Trial 180 finished with value: 0.8221744894981384 and parameters: {'n_layers': 6, 'weight_decay': 6.227611275311671e-09, 'n_units_l0': 32, 'n_units_l1': 26, 'n_units_l2': 12, 'n_units_l3': 17, 'n_units_l4': 92, 'n_units_l5': 92, 'optimizer': 'Adam', 'adam_learning_rate': 1.5998668896352307e-05}. Best is trial 89 with value: 0.8458108901977539.
Trial 181 finished with value: 0.8151870369911194 and parameters: {'n_layers': 5, 'weight_decay': 1.897839525830843e-09, 'n_units_l0': 43, 'n_units_l1': 27, 'n_units_l2': 27, 'n_units_l3': 30, 'n_units_l4': 8, 'optimizer': 'Adam', 'adam_learning_rate': 1.4478074393238215e-05}. Best is trial 89 with value: 0.8458108901977539.
Trial 182 finished with value: 0.805561363697052 and parameters: {'n_layers': 15, 'weight_decay': 3.6905297854064363e-09, 'n_units_l0': 48, 'n_units_l1': 31, 'n_units_l2': 31, 'n_units_l3': 34, 'n_units_l4': 7, 'n_units_l5': 8, 'n_units_l6': 5, 'n_units_l7': 61, 'n_units_l8': 6, 'n_units_l9': 24, 'n_units_l10': 23, 'n_units_l11': 85, 'n_units_l12': 7, 'n_units_l13': 18, 'n_units_l14': 66, 'optimizer': 'Adam', 'adam_learning_rate': 0.004531530758994809}. Best is trial 89 with value: 0.8458108901977539.
Trial 183 finished with value: 0.8379321098327637 and parameters: {'n_layers': 4, 'weight_decay': 6.550818356182458e-10, 'n_units_l0': 36, 'n_units_l1': 24, 'n_units_l2': 26, 'n_units_l3': 25, 'optimizer': 'Adam', 'adam_learning_rate': 1.0659036660285007e-05}. Best is trial 89 with value: 0.8458108901977539.
Trial 184 finished with value: 0.8145809769630432 and parameters: {'n_layers': 3, 'weight_decay': 7.281032884700045e-10, 'n_units_l0': 36, 'n_units_l1': 24, 'n_units_l2': 24, 'optimizer': 'Adam', 'adam_learning_rate': 9.513303600366318e-05}. Best is trial 89 with value: 0.8458108901977539.
Trial 185 finished with value: 0.8218536376953125 and parameters: {'n_layers': 4, 'weight_decay': 5.63153713471987e-10, 'n_units_l0': 39, 'n_units_l1': 21, 'n_units_l2': 34, 'n_units_l3': 25, 'optimizer': 'Adam', 'adam_learning_rate': 1.1356800379155289e-05}. Best is trial 89 with value: 0.8458108901977539.
Trial 186 finished with value: 0.8275933265686035 and parameters: {'n_layers': 7, 'weight_decay': 1.0245999550215339e-09, 'n_units_l0': 26, 'n_units_l1': 22, 'n_units_l2': 29, 'n_units_l3': 23, 'n_units_l4': 51, 'n_units_l5': 4, 'n_units_l6': 76, 'optimizer': 'Adam', 'adam_learning_rate': 4.238220621343158e-05}. Best is trial 89 with value: 0.8458108901977539.
Trial 187 finished with value: 0.8142956495285034 and parameters: {'n_layers': 5, 'weight_decay': 3.3005918258215193e-10, 'n_units_l0': 34, 'n_units_l1': 18, 'n_units_l2': 25, 'n_units_l3': 26, 'n_units_l4': 9, 'optimizer': 'SGD', 'sgd_opt_learning_rate': 0.06168500987318379, 'sgd_opt_momentum': 6.349189478166015e-05}. Best is trial 89 with value: 0.8458108901977539.
Trial 188 finished with value: 0.833939254283905 and parameters: {'n_layers': 4, 'weight_decay': 2.290152643323201e-08, 'n_units_l0': 42, 'n_units_l1': 8, 'n_units_l2': 16, 'n_units_l3': 19, 'optimizer': 'Adam', 'adam_learning_rate': 0.0008263962044610177}. Best is trial 89 with value: 0.8458108901977539.
Trial 189 finished with value: 0.8227447867393494 and parameters: {'n_layers': 4, 'weight_decay': 2.546814016034952e-08, 'n_units_l0': 113, 'n_units_l1': 8, 'n_units_l2': 16, 'n_units_l3': 14, 'optimizer': 'Adam', 'adam_learning_rate': 0.0007661764256425863}. Best is trial 89 with value: 0.8458108901977539.
Trial 190 finished with value: 0.8139750957489014 and parameters: {'n_layers': 3, 'weight_decay': 1.2037679590786954e-08, 'n_units_l0': 40, 'n_units_l1': 8, 'n_units_l2': 10, 'optimizer': 'Adam', 'adam_learning_rate': 0.0005667226535294725}. Best is trial 89 with value: 0.8458108901977539.
Trial 191 finished with value: 0.8161494731903076 and parameters: {'n_layers': 3, 'weight_decay': 2.0731494945221652e-08, 'n_units_l0': 43, 'n_units_l1': 7, 'n_units_l2': 5, 'optimizer': 'Adam', 'adam_learning_rate': 0.00014426670732762965}. Best is trial 89 with value: 0.8458108901977539.
Trial 192 finished with value: 0.8121924996376038 and parameters: {'n_layers': 2, 'weight_decay': 6.500608188874736e-08, 'n_units_l0': 36, 'n_units_l1': 9, 'optimizer': 'Adam', 'adam_learning_rate': 0.0008724146849665838}. Best is trial 89 with value: 0.8458108901977539.
Trial 193 finished with value: 0.8185024261474609 and parameters: {'n_layers': 5, 'weight_decay': 2.2328280827925873e-10, 'n_units_l0': 47, 'n_units_l1': 6, 'n_units_l2': 14, 'n_units_l3': 19, 'n_units_l4': 10, 'optimizer': 'Adam', 'adam_learning_rate': 0.0022398112566904506}. Best is trial 89 with value: 0.8458108901977539.
Trial 194 finished with value: 0.8060961365699768 and parameters: {'n_layers': 8, 'weight_decay': 4.742426015768969e-10, 'n_units_l0': 4, 'n_units_l1': 10, 'n_units_l2': 18, 'n_units_l3': 21, 'n_units_l4': 12, 'n_units_l5': 19, 'n_units_l6': 64, 'n_units_l7': 92, 'optimizer': 'Adam', 'adam_learning_rate': 0.0010661510346160318}. Best is trial 89 with value: 0.8458108901977539.
Trial 195 finished with value: 0.801568329334259 and parameters: {'n_layers': 4, 'weight_decay': 4.418071893688099e-08, 'n_units_l0': 30, 'n_units_l1': 24, 'n_units_l2': 16, 'n_units_l3': 15, 'optimizer': 'Adam', 'adam_learning_rate': 1.0201102271171808e-05}. Best is trial 89 with value: 0.8458108901977539.
Trial 196 finished with value: 0.818217396736145 and parameters: {'n_layers': 17, 'weight_decay': 3.043852917004832e-08, 'n_units_l0': 38, 'n_units_l1': 29, 'n_units_l2': 11, 'n_units_l3': 17, 'n_units_l4': 6, 'n_units_l5': 5, 'n_units_l6': 45, 'n_units_l7': 19, 'n_units_l8': 19, 'n_units_l9': 30, 'n_units_l10': 41, 'n_units_l11': 6, 'n_units_l12': 14, 'n_units_l13': 6, 'n_units_l14': 7, 'n_units_l15': 67, 'n_units_l16': 117, 'optimizer': 'RMSprop', 'rmsprop_learning_rate': 0.0030090517772035637, 'rmsprop_weight_decay': 0.973481435628432, 'rmsprop_momentum': 0.009155975255947918}. Best is trial 89 with value: 0.8458108901977539.
Trial 197 finished with value: 0.8236719369888306 and parameters: {'n_layers': 6, 'weight_decay': 1.4645985841289895e-10, 'n_units_l0': 51, 'n_units_l1': 57, 'n_units_l2': 15, 'n_units_l3': 20, 'n_units_l4': 24, 'n_units_l5': 14, 'optimizer': 'Adam', 'adam_learning_rate': 0.011320723855666884}. Best is trial 89 with value: 0.8458108901977539.
Trial 198 finished with value: 0.8448840975761414 and parameters: {'n_layers': 7, 'weight_decay': 2.586391445715533e-07, 'n_units_l0': 32, 'n_units_l1': 6, 'n_units_l2': 19, 'n_units_l3': 23, 'n_units_l4': 17, 'n_units_l5': 35, 'n_units_l6': 110, 'optimizer': 'Adam', 'adam_learning_rate': 0.0018423077794478214}. Best is trial 89 with value: 0.8458108901977539.
Trial 199 finished with value: 0.8222102522850037 and parameters: {'n_layers': 7, 'weight_decay': 1.6809572467011215e-07, 'n_units_l0': 32, 'n_units_l1': 6, 'n_units_l2': 17, 'n_units_l3': 23, 'n_units_l4': 17, 'n_units_l5': 25, 'n_units_l6': 112, 'optimizer': 'SGD', 'sgd_opt_learning_rate': 0.0005049381549500789, 'sgd_opt_momentum': 0.00025190594956480485}. Best is trial 89 with value: 0.8458108901977539.
Trial 200 finished with value: 0.8212475776672363 and parameters: {'n_layers': 6, 'weight_decay': 1.44846018971187e-09, 'n_units_l0': 41, 'n_units_l1': 7, 'n_units_l2': 14, 'n_units_l3': 27, 'n_units_l4': 33, 'n_units_l5': 18, 'optimizer': 'Adam', 'adam_learning_rate': 0.00029075190493003207}. Best is trial 89 with value: 0.8458108901977539.
Trial 201 finished with value: 0.8255257606506348 and parameters: {'n_layers': 8, 'weight_decay': 2.4065864238482304e-07, 'n_units_l0': 34, 'n_units_l1': 26, 'n_units_l2': 20, 'n_units_l3': 13, 'n_units_l4': 16, 'n_units_l5': 37, 'n_units_l6': 19, 'n_units_l7': 51, 'optimizer': 'Adam', 'adam_learning_rate': 0.001724829568582544}. Best is trial 89 with value: 0.8458108901977539.
Trial 202 finished with value: 0.8233510255813599 and parameters: {'n_layers': 7, 'weight_decay': 8.451358400173962e-10, 'n_units_l0': 27, 'n_units_l1': 6, 'n_units_l2': 22, 'n_units_l3': 18, 'n_units_l4': 18, 'n_units_l5': 54, 'n_units_l6': 97, 'optimizer': 'Adam', 'adam_learning_rate': 0.0021029791616832996}. Best is trial 89 with value: 0.8458108901977539.
Trial 203 finished with value: 0.8183241486549377 and parameters: {'n_layers': 7, 'weight_decay': 9.711637081627167e-08, 'n_units_l0': 29, 'n_units_l1': 7, 'n_units_l2': 19, 'n_units_l3': 25, 'n_units_l4': 14, 'n_units_l5': 29, 'n_units_l6': 58, 'optimizer': 'Adam', 'adam_learning_rate': 0.0013879003701853013}. Best is trial 89 with value: 0.8458108901977539.
Trial 204 finished with value: 0.8254900574684143 and parameters: {'n_layers': 4, 'weight_decay': 1.045688180450634e-10, 'n_units_l0': 24, 'n_units_l1': 5, 'n_units_l2': 18, 'n_units_l3': 7, 'optimizer': 'Adam', 'adam_learning_rate': 0.003620657007719486}. Best is trial 89 with value: 0.8458108901977539.
Trial 205 finished with value: 0.8255256414413452 and parameters: {'n_layers': 6, 'weight_decay': 3.509341835758533e-10, 'n_units_l0': 31, 'n_units_l1': 48, 'n_units_l2': 16, 'n_units_l3': 22, 'n_units_l4': 8, 'n_units_l5': 44, 'optimizer': 'Adam', 'adam_learning_rate': 0.001187322162114193}. Best is trial 89 with value: 0.8458108901977539.
Trial 206 finished with value: 0.8140460252761841 and parameters: {'n_layers': 5, 'weight_decay': 3.0765258579002137e-07, 'n_units_l0': 45, 'n_units_l1': 33, 'n_units_l2': 13, 'n_units_l3': 20, 'n_units_l4': 23, 'optimizer': 'Adam', 'adam_learning_rate': 0.0026719300804197584}. Best is trial 89 with value: 0.8458108901977539.
Trial 207 finished with value: 0.821568489074707 and parameters: {'n_layers': 6, 'weight_decay': 5.63207803883978e-10, 'n_units_l0': 37, 'n_units_l1': 37, 'n_units_l2': 15, 'n_units_l3': 4, 'n_units_l4': 11, 'n_units_l5': 31, 'optimizer': 'Adam', 'adam_learning_rate': 0.0006818540597372805}. Best is trial 89 with value: 0.8458108901977539.
Trial 208 finished with value: 0.8254899978637695 and parameters: {'n_layers': 8, 'weight_decay': 1.334195076409978e-07, 'n_units_l0': 33, 'n_units_l1': 20, 'n_units_l2': 23, 'n_units_l3': 24, 'n_units_l4': 20, 'n_units_l5': 36, 'n_units_l6': 35, 'n_units_l7': 70, 'optimizer': 'Adam', 'adam_learning_rate': 1.3036335906669018e-05}. Best is trial 89 with value: 0.8458108901977539.
Trial 209 finished with value: 0.8221745491027832 and parameters: {'n_layers': 12, 'weight_decay': 1.9872735430630287e-10, 'n_units_l0': 21, 'n_units_l1': 23, 'n_units_l2': 20, 'n_units_l3': 16, 'n_units_l4': 18, 'n_units_l5': 11, 'n_units_l6': 84, 'n_units_l7': 109, 'n_units_l8': 35, 'n_units_l9': 10, 'n_units_l10': 59, 'n_units_l11': 11, 'optimizer': 'Adam', 'adam_learning_rate': 2.59398542807471e-05}. Best is trial 89 with value: 0.8458108901977539.
Trial 210 finished with value: 0.8242779970169067 and parameters: {'n_layers': 7, 'weight_decay': 5.870896020824457e-10, 'n_units_l0': 42, 'n_units_l1': 4, 'n_units_l2': 12, 'n_units_l3': 11, 'n_units_l4': 9, 'n_units_l5': 10, 'n_units_l6': 104, 'optimizer': 'Adam', 'adam_learning_rate': 7.193502197581792e-05}. Best is trial 89 with value: 0.8458108901977539.
Trial 211 finished with value: 0.8394650220870972 and parameters: {'n_layers': 5, 'weight_decay': 2.4118903101459535e-09, 'n_units_l0': 49, 'n_units_l1': 26, 'n_units_l2': 41, 'n_units_l3': 29, 'n_units_l4': 13, 'optimizer': 'Adam', 'adam_learning_rate': 1.697500243224018e-05}. Best is trial 89 with value: 0.8458108901977539.
Trial 212 finished with value: 0.8245630860328674 and parameters: {'n_layers': 4, 'weight_decay': 2.492692701681365e-09, 'n_units_l0': 54, 'n_units_l1': 25, 'n_units_l2': 40, 'n_units_l3': 28, 'optimizer': 'Adam', 'adam_learning_rate': 1.55790606313593e-05}. Best is trial 89 with value: 0.8458108901977539.
Trial 213 finished with value: 0.8146164417266846 and parameters: {'n_layers': 5, 'weight_decay': 4.6486155030201115e-09, 'n_units_l0': 48, 'n_units_l1': 31, 'n_units_l2': 26, 'n_units_l3': 32, 'n_units_l4': 13, 'optimizer': 'Adam', 'adam_learning_rate': 4.984848565737964e-05}. Best is trial 89 with value: 0.8458108901977539.
Trial 214 finished with value: 0.8136895895004272 and parameters: {'n_layers': 6, 'weight_decay': 3.1611368360387914e-09, 'n_units_l0': 57, 'n_units_l1': 26, 'n_units_l2': 17, 'n_units_l3': 27, 'n_units_l4': 15, 'n_units_l5': 9, 'optimizer': 'Adam', 'adam_learning_rate': 1.9464337732251252e-05}. Best is trial 89 with value: 0.8458108901977539.
Trial 215 finished with value: 0.8233511447906494 and parameters: {'n_layers': 4, 'weight_decay': 1.0602511798878488e-06, 'n_units_l0': 44, 'n_units_l1': 27, 'n_units_l2': 48, 'n_units_l3': 30, 'optimizer': 'Adam', 'adam_learning_rate': 1.2250781453846326e-05}. Best is trial 89 with value: 0.8458108901977539.
Trial 216 finished with value: 0.8378965258598328 and parameters: {'n_layers': 5, 'weight_decay': 2.2088609931623187e-09, 'n_units_l0': 26, 'n_units_l1': 8, 'n_units_l2': 128, 'n_units_l3': 15, 'n_units_l4': 12, 'optimizer': 'SGD', 'sgd_opt_learning_rate': 0.015437398241123668, 'sgd_opt_momentum': 0.00015988431278490868}. Best is trial 89 with value: 0.8458108901977539.
Trial 217 finished with value: 0.8203206062316895 and parameters: {'n_layers': 5, 'weight_decay': 2.170701749295731e-09, 'n_units_l0': 22, 'n_units_l1': 8, 'n_units_l2': 123, 'n_units_l3': 15, 'n_units_l4': 13, 'optimizer': 'SGD', 'sgd_opt_learning_rate': 0.015143056307746755, 'sgd_opt_momentum': 0.00014749765113688553}. Best is trial 89 with value: 0.8458108901977539.
Trial 218 finished with value: 0.8306594491004944 and parameters: {'n_layers': 5, 'weight_decay': 5.423226069779242e-07, 'n_units_l0': 25, 'n_units_l1': 11, 'n_units_l2': 99, 'n_units_l3': 42, 'n_units_l4': 12, 'optimizer': 'SGD', 'sgd_opt_learning_rate': 0.03227673813458846, 'sgd_opt_momentum': 0.00043061337474533724}. Best is trial 89 with value: 0.8458108901977539.
Trial 219 finished with value: 0.8042779564857483 and parameters: {'n_layers': 6, 'weight_decay': 1.4325873106577295e-09, 'n_units_l0': 49, 'n_units_l1': 9, 'n_units_l2': 124, 'n_units_l3': 14, 'n_units_l4': 12, 'n_units_l5': 7, 'optimizer': 'SGD', 'sgd_opt_learning_rate': 0.007626047057504856, 'sgd_opt_momentum': 5.687816609989149e-05}. Best is trial 89 with value: 0.8458108901977539.
Trial 220 finished with value: 0.8221745491027832 and parameters: {'n_layers': 3, 'weight_decay': 6.594173708124094e-09, 'n_units_l0': 19, 'n_units_l1': 8, 'n_units_l2': 14, 'optimizer': 'SGD', 'sgd_opt_learning_rate': 0.0032750043295090106, 'sgd_opt_momentum': 0.0008029710883715514}. Best is trial 89 with value: 0.8458108901977539.
Trial 221 finished with value: 0.8267019391059875 and parameters: {'n_layers': 5, 'weight_decay': 1.1162204299706903e-09, 'n_units_l0': 27, 'n_units_l1': 7, 'n_units_l2': 21, 'n_units_l3': 14, 'n_units_l4': 14, 'optimizer': 'SGD', 'sgd_opt_learning_rate': 0.039373806806692745, 'sgd_opt_momentum': 3.0548598039446035e-05}. Best is trial 89 with value: 0.8458108901977539.
Trial 222 finished with value: 0.8304098844528198 and parameters: {'n_layers': 6, 'weight_decay': 7.85475784029675e-10, 'n_units_l0': 29, 'n_units_l1': 24, 'n_units_l2': 18, 'n_units_l3': 17, 'n_units_l4': 10, 'n_units_l5': 72, 'optimizer': 'RMSprop', 'rmsprop_learning_rate': 0.05909998582850005, 'rmsprop_weight_decay': 0.9108409599880043, 'rmsprop_momentum': 2.837718681444286e-05}. Best is trial 89 with value: 0.8458108901977539.
Trial 223 finished with value: 0.8279498219490051 and parameters: {'n_layers': 4, 'weight_decay': 3.7211232783266957e-09, 'n_units_l0': 35, 'n_units_l1': 22, 'n_units_l2': 12, 'n_units_l3': 12, 'optimizer': 'Adam', 'adam_learning_rate': 0.0015215186135992106}. Best is trial 89 with value: 0.8458108901977539.
Trial 224 finished with value: 0.7976110577583313 and parameters: {'n_layers': 7, 'weight_decay': 2.1875408175893314e-09, 'n_units_l0': 39, 'n_units_l1': 29, 'n_units_l2': 114, 'n_units_l3': 37, 'n_units_l4': 11, 'n_units_l5': 4, 'n_units_l6': 67, 'optimizer': 'Adam', 'adam_learning_rate': 0.0019550584364348314}. Best is trial 89 with value: 0.8458108901977539.
Trial 225 finished with value: 0.8312655687332153 and parameters: {'n_layers': 6, 'weight_decay': 2.810553825973336e-10, 'n_units_l0': 23, 'n_units_l1': 28, 'n_units_l2': 13, 'n_units_l3': 25, 'n_units_l4': 16, 'n_units_l5': 42, 'optimizer': 'Adam', 'adam_learning_rate': 0.00044256443119554357}. Best is trial 89 with value: 0.8458108901977539.
Trial 226 finished with value: 0.8043134808540344 and parameters: {'n_layers': 6, 'weight_decay': 0.0002871237942279126, 'n_units_l0': 23, 'n_units_l1': 21, 'n_units_l2': 112, 'n_units_l3': 26, 'n_units_l4': 15, 'n_units_l5': 12, 'optimizer': 'Adam', 'adam_learning_rate': 0.0005774345486995526}. Best is trial 89 with value: 0.8458108901977539.
Trial 227 finished with value: 0.8227450251579285 and parameters: {'n_layers': 5, 'weight_decay': 2.928402658622185e-10, 'n_units_l0': 25, 'n_units_l1': 6, 'n_units_l2': 13, 'n_units_l3': 29, 'n_units_l4': 16, 'optimizer': 'SGD', 'sgd_opt_learning_rate': 0.0017951679755506442, 'sgd_opt_momentum': 0.0003810460807430261}. Best is trial 89 with value: 0.8458108901977539.
Trial 228 finished with value: 0.8218535780906677 and parameters: {'n_layers': 7, 'weight_decay': 4.1768918600726085e-10, 'n_units_l0': 23, 'n_units_l1': 23, 'n_units_l2': 15, 'n_units_l3': 24, 'n_units_l4': 21, 'n_units_l5': 34, 'n_units_l6': 74, 'optimizer': 'Adam', 'adam_learning_rate': 0.0004391465703697145}. Best is trial 89 with value: 0.8458108901977539.
