Trial 270 finished with value: 0.5888888835906982 and parameters: {'n_layers': 4, 'weight_decay': 2.751846698384981e-06, 'n_units_l0': 31, 'n_units_l1': 6, 'n_units_l2': 11, 'n_units_l3': 62, 'optimizer': 'Adam', 'adam_learning_rate': 0.004397216064285468}. Best is trial 241 with value: 0.7777778506278992.
Trial 271 finished with value: 0.4888889491558075 and parameters: {'n_layers': 8, 'weight_decay': 5.431777893569084e-06, 'n_units_l0': 29, 'n_units_l1': 8, 'n_units_l2': 87, 'n_units_l3': 71, 'n_units_l4': 19, 'n_units_l5': 22, 'n_units_l6': 57, 'n_units_l7': 45, 'optimizer': 'Adam', 'adam_learning_rate': 0.0007517286902875147}. Best is trial 241 with value: 0.7777778506278992.
Trial 272 finished with value: 0.644444465637207 and parameters: {'n_layers': 7, 'weight_decay': 8.749690718090737e-06, 'n_units_l0': 36, 'n_units_l1': 6, 'n_units_l2': 63, 'n_units_l3': 57, 'n_units_l4': 24, 'n_units_l5': 26, 'n_units_l6': 18, 'optimizer': 'SGD', 'sgd_opt_learning_rate': 0.0003042002602310662, 'sgd_opt_momentum': 9.367769643057741e-05}. Best is trial 241 with value: 0.7777778506278992.
Trial 273 finished with value: 0.644444465637207 and parameters: {'n_layers': 5, 'weight_decay': 9.076367273797476e-08, 'n_units_l0': 32, 'n_units_l1': 7, 'n_units_l2': 81, 'n_units_l3': 102, 'n_units_l4': 16, 'optimizer': 'Adam', 'adam_learning_rate': 0.03923511857028537}. Best is trial 241 with value: 0.7777778506278992.
Trial 274 finished with value: 0.644444465637207 and parameters: {'n_layers': 15, 'weight_decay': 3.5857923884637323e-06, 'n_units_l0': 37, 'n_units_l1': 8, 'n_units_l2': 34, 'n_units_l3': 78, 'n_units_l4': 5, 'n_units_l5': 29, 'n_units_l6': 42, 'n_units_l7': 26, 'n_units_l8': 106, 'n_units_l9': 8, 'n_units_l10': 46, 'n_units_l11': 18, 'n_units_l12': 34, 'n_units_l13': 93, 'n_units_l14': 114, 'optimizer': 'SGD', 'sgd_opt_learning_rate': 0.00016834721857269066, 'sgd_opt_momentum': 0.0007379729177180839}. Best is trial 241 with value: 0.7777778506278992.
Trial 275 finished with value: 0.6777777671813965 and parameters: {'n_layers': 5, 'weight_decay': 6.744861882729482e-06, 'n_units_l0': 26, 'n_units_l1': 8, 'n_units_l2': 10, 'n_units_l3': 92, 'n_units_l4': 19, 'optimizer': 'SGD', 'sgd_opt_learning_rate': 0.0005297573572179072, 'sgd_opt_momentum': 0.015611288938686125}. Best is trial 241 with value: 0.7777778506278992.
Trial 276 finished with value: 0.4888888895511627 and parameters: {'n_layers': 9, 'weight_decay': 0.00012668361424566428, 'n_units_l0': 34, 'n_units_l1': 6, 'n_units_l2': 23, 'n_units_l3': 81, 'n_units_l4': 15, 'n_units_l5': 25, 'n_units_l6': 49, 'n_units_l7': 34, 'n_units_l8': 38, 'optimizer': 'SGD', 'sgd_opt_learning_rate': 9.732938364814063e-05, 'sgd_opt_momentum': 0.0015240095152882}. Best is trial 241 with value: 0.7777778506278992.
Trial 277 finished with value: 0.644444465637207 and parameters: {'n_layers': 8, 'weight_decay': 5.64373234710775e-05, 'n_units_l0': 28, 'n_units_l1': 7, 'n_units_l2': 37, 'n_units_l3': 69, 'n_units_l4': 14, 'n_units_l5': 27, 'n_units_l6': 29, 'n_units_l7': 22, 'optimizer': 'SGD', 'sgd_opt_learning_rate': 6.767891287604816e-05, 'sgd_opt_momentum': 0.0005308465630788434}. Best is trial 241 with value: 0.7777778506278992.
Trial 278 finished with value: 0.3333333432674408 and parameters: {'n_layers': 4, 'weight_decay': 4.5688556324124375e-05, 'n_units_l0': 50, 'n_units_l1': 10, 'n_units_l2': 54, 'n_units_l3': 25, 'optimizer': 'Adam', 'adam_learning_rate': 0.010390131330438323}. Best is trial 241 with value: 0.7777778506278992.
Trial 279 finished with value: 0.5222222208976746 and parameters: {'n_layers': 14, 'weight_decay': 2.5247354398124963e-07, 'n_units_l0': 44, 'n_units_l1': 45, 'n_units_l2': 102, 'n_units_l3': 119, 'n_units_l4': 18, 'n_units_l5': 19, 'n_units_l6': 45, 'n_units_l7': 40, 'n_units_l8': 65, 'n_units_l9': 11, 'n_units_l10': 26, 'n_units_l11': 10, 'n_units_l12': 8, 'n_units_l13': 69, 'optimizer': 'SGD', 'sgd_opt_learning_rate': 0.0001444359716395347, 'sgd_opt_momentum': 0.0036940488325734764}. Best is trial 241 with value: 0.7777778506278992.
Trial 280 finished with value: 0.5222222208976746 and parameters: {'n_layers': 5, 'weight_decay': 4.675648357681374e-06, 'n_units_l0': 14, 'n_units_l1': 9, 'n_units_l2': 42, 'n_units_l3': 11, 'n_units_l4': 22, 'optimizer': 'SGD', 'sgd_opt_learning_rate': 0.008264622016541956, 'sgd_opt_momentum': 0.00036247162000369173}. Best is trial 241 with value: 0.7777778506278992.
Trial 281 finished with value: 0.699999988079071 and parameters: {'n_layers': 11, 'weight_decay': 3.002437657890304e-05, 'n_units_l0': 31, 'n_units_l1': 22, 'n_units_l2': 14, 'n_units_l3': 9, 'n_units_l4': 20, 'n_units_l5': 24, 'n_units_l6': 16, 'n_units_l7': 24, 'n_units_l8': 91, 'n_units_l9': 9, 'n_units_l10': 34, 'optimizer': 'SGD', 'sgd_opt_learning_rate': 0.00039728254321070807, 'sgd_opt_momentum': 0.007360619516456749}. Best is trial 241 with value: 0.7777778506278992.
Trial 282 finished with value: 0.6555555462837219 and parameters: {'n_layers': 13, 'weight_decay': 2.245745649639167e-06, 'n_units_l0': 24, 'n_units_l1': 8, 'n_units_l2': 100, 'n_units_l3': 100, 'n_units_l4': 12, 'n_units_l5': 30, 'n_units_l6': 14, 'n_units_l7': 20, 'n_units_l8': 48, 'n_units_l9': 7, 'n_units_l10': 51, 'n_units_l11': 6, 'n_units_l12': 11, 'optimizer': 'SGD', 'sgd_opt_learning_rate': 0.0026586380828272174, 'sgd_opt_momentum': 0.005219023789128609}. Best is trial 241 with value: 0.7777778506278992.
Trial 283 finished with value: 0.6111111640930176 and parameters: {'n_layers': 7, 'weight_decay': 4.316401036154869e-05, 'n_units_l0': 36, 'n_units_l1': 38, 'n_units_l2': 12, 'n_units_l3': 74, 'n_units_l4': 17, 'n_units_l5': 21, 'n_units_l6': 19, 'optimizer': 'Adam', 'adam_learning_rate': 0.06174405376649907}. Best is trial 241 with value: 0.7777778506278992.
Trial 284 finished with value: 0.6111111640930176 and parameters: {'n_layers': 9, 'weight_decay': 7.860006392294383e-06, 'n_units_l0': 57, 'n_units_l1': 7, 'n_units_l2': 65, 'n_units_l3': 90, 'n_units_l4': 10, 'n_units_l5': 22, 'n_units_l6': 23, 'n_units_l7': 10, 'n_units_l8': 96, 'optimizer': 'SGD', 'sgd_opt_learning_rate': 0.0019211619302009913, 'sgd_opt_momentum': 0.012042244964882735}. Best is trial 241 with value: 0.7777778506278992.
Trial 285 finished with value: 0.5777778029441833 and parameters: {'n_layers': 6, 'weight_decay': 6.392671598021737e-05, 'n_units_l0': 40, 'n_units_l1': 8, 'n_units_l2': 14, 'n_units_l3': 55, 'n_units_l4': 57, 'n_units_l5': 28, 'optimizer': 'RMSprop', 'rmsprop_learning_rate': 0.00016584093786717436, 'rmsprop_weight_decay': 0.9018661614134785, 'rmsprop_momentum': 0.0029344645704112117}. Best is trial 241 with value: 0.7777778506278992.
Trial 286 finished with value: 0.5222222208976746 and parameters: {'n_layers': 8, 'weight_decay': 1.1043749933948551e-05, 'n_units_l0': 34, 'n_units_l1': 6, 'n_units_l2': 11, 'n_units_l3': 85, 'n_units_l4': 16, 'n_units_l5': 33, 'n_units_l6': 27, 'n_units_l7': 4, 'optimizer': 'SGD', 'sgd_opt_learning_rate': 0.0002310486416556033, 'sgd_opt_momentum': 0.0022239788864462013}. Best is trial 241 with value: 0.7777778506278992.
Trial 287 finished with value: 0.5888888835906982 and parameters: {'n_layers': 11, 'weight_decay': 9.479957749822619e-05, 'n_units_l0': 30, 'n_units_l1': 9, 'n_units_l2': 16, 'n_units_l3': 108, 'n_units_l4': 25, 'n_units_l5': 24, 'n_units_l6': 12, 'n_units_l7': 47, 'n_units_l8': 121, 'n_units_l9': 17, 'n_units_l10': 11, 'optimizer': 'RMSprop', 'rmsprop_learning_rate': 0.016049797365264722, 'rmsprop_weight_decay': 0.895769929190944, 'rmsprop_momentum': 0.0026606372475605957}. Best is trial 241 with value: 0.7777778506278992.
Trial 288 finished with value: 0.4555555582046509 and parameters: {'n_layers': 16, 'weight_decay': 0.00020704509779230653, 'n_units_l0': 41, 'n_units_l1': 6, 'n_units_l2': 9, 'n_units_l3': 96, 'n_units_l4': 20, 'n_units_l5': 26, 'n_units_l6': 15, 'n_units_l7': 16, 'n_units_l8': 111, 'n_units_l9': 47, 'n_units_l10': 36, 'n_units_l11': 24, 'n_units_l12': 18, 'n_units_l13': 44, 'n_units_l14': 67, 'n_units_l15': 11, 'optimizer': 'SGD', 'sgd_opt_learning_rate': 0.004771341721067634, 'sgd_opt_momentum': 0.0017152287410933604}. Best is trial 241 with value: 0.7777778506278992.
Trial 289 finished with value: 0.7222222685813904 and parameters: {'n_layers': 9, 'weight_decay': 3.6780782445040454e-06, 'n_units_l0': 38, 'n_units_l1': 7, 'n_units_l2': 16, 'n_units_l3': 61, 'n_units_l4': 27, 'n_units_l5': 20, 'n_units_l6': 38, 'n_units_l7': 14, 'n_units_l8': 35, 'optimizer': 'SGD', 'sgd_opt_learning_rate': 0.0033423355459414683, 'sgd_opt_momentum': 0.00451121766068387}. Best is trial 241 with value: 0.7777778506278992.
Trial 290 finished with value: 0.5111111402511597 and parameters: {'n_layers': 9, 'weight_decay': 3.3463922212344806e-06, 'n_units_l0': 45, 'n_units_l1': 7, 'n_units_l2': 52, 'n_units_l3': 61, 'n_units_l4': 26, 'n_units_l5': 18, 'n_units_l6': 38, 'n_units_l7': 14, 'n_units_l8': 35, 'optimizer': 'RMSprop', 'rmsprop_learning_rate': 0.01193183006026034, 'rmsprop_weight_decay': 0.9276086531367049, 'rmsprop_momentum': 0.0018775594991172237}. Best is trial 241 with value: 0.7777778506278992.
Trial 291 finished with value: 0.6777777671813965 and parameters: {'n_layers': 8, 'weight_decay': 2.752789312976031e-05, 'n_units_l0': 65, 'n_units_l1': 10, 'n_units_l2': 17, 'n_units_l3': 61, 'n_units_l4': 27, 'n_units_l5': 20, 'n_units_l6': 42, 'n_units_l7': 13, 'optimizer': 'Adam', 'adam_learning_rate': 0.0020611747748572043}. Best is trial 241 with value: 0.7777778506278992.
Trial 292 finished with value: 0.6777777671813965 and parameters: {'n_layers': 10, 'weight_decay': 0.00014623403596503883, 'n_units_l0': 38, 'n_units_l1': 18, 'n_units_l2': 15, 'n_units_l3': 68, 'n_units_l4': 23, 'n_units_l5': 31, 'n_units_l6': 31, 'n_units_l7': 15, 'n_units_l8': 29, 'n_units_l9': 51, 'optimizer': 'SGD', 'sgd_opt_learning_rate': 0.0035351360216305697, 'sgd_opt_momentum': 0.0035517755436509832}. Best is trial 241 with value: 0.7777778506278992.
Trial 293 finished with value: 0.7666666507720947 and parameters: {'n_layers': 9, 'weight_decay': 2.075865154349353e-06, 'n_units_l0': 41, 'n_units_l1': 8, 'n_units_l2': 46, 'n_units_l3': 63, 'n_units_l4': 14, 'n_units_l5': 28, 'n_units_l6': 39, 'n_units_l7': 19, 'n_units_l8': 44, 'optimizer': 'RMSprop', 'rmsprop_learning_rate': 0.00010730732064639464, 'rmsprop_weight_decay': 0.9225487314329057, 'rmsprop_momentum': 0.00010483489050246664}. Best is trial 241 with value: 0.7777778506278992.
Trial 294 finished with value: 0.3888889253139496 and parameters: {'n_layers': 9, 'weight_decay': 1.7697244595936213e-06, 'n_units_l0': 38, 'n_units_l1': 9, 'n_units_l2': 59, 'n_units_l3': 63, 'n_units_l4': 29, 'n_units_l5': 29, 'n_units_l6': 37, 'n_units_l7': 8, 'n_units_l8': 44, 'optimizer': 'RMSprop', 'rmsprop_learning_rate': 8.33640176469707e-05, 'rmsprop_weight_decay': 0.9205077342789392, 'rmsprop_momentum': 0.00011357175385318416}. Best is trial 241 with value: 0.7777778506278992.
Trial 295 finished with value: 0.6111111640930176 and parameters: {'n_layers': 10, 'weight_decay': 1.2943965815946762e-06, 'n_units_l0': 42, 'n_units_l1': 8, 'n_units_l2': 55, 'n_units_l3': 55, 'n_units_l4': 14, 'n_units_l5': 35, 'n_units_l6': 33, 'n_units_l7': 19, 'n_units_l8': 33, 'n_units_l9': 22, 'optimizer': 'RMSprop', 'rmsprop_learning_rate': 5.251589660484195e-05, 'rmsprop_weight_decay': 0.908973353432973, 'rmsprop_momentum': 4.594565282723817e-05}. Best is trial 241 with value: 0.7777778506278992.
Trial 296 finished with value: 0.6222222447395325 and parameters: {'n_layers': 9, 'weight_decay': 2.8037934798840393e-06, 'n_units_l0': 36, 'n_units_l1': 124, 'n_units_l2': 59, 'n_units_l3': 66, 'n_units_l4': 14, 'n_units_l5': 27, 'n_units_l6': 25, 'n_units_l7': 17, 'n_units_l8': 36, 'optimizer': 'RMSprop', 'rmsprop_learning_rate': 0.00018774849620938324, 'rmsprop_weight_decay': 0.9138578023380256, 'rmsprop_momentum': 0.00010929395811669469}. Best is trial 241 with value: 0.7777778506278992.
Trial 297 finished with value: 0.7222222685813904 and parameters: {'n_layers': 10, 'weight_decay': 2.321721987147217e-06, 'n_units_l0': 26, 'n_units_l1': 5, 'n_units_l2': 56, 'n_units_l3': 51, 'n_units_l4': 34, 'n_units_l5': 38, 'n_units_l6': 35, 'n_units_l7': 21, 'n_units_l8': 31, 'n_units_l9': 20, 'optimizer': 'RMSprop', 'rmsprop_learning_rate': 1.3709716548229357e-05, 'rmsprop_weight_decay': 0.936640298224288, 'rmsprop_momentum': 2.7763808577796798e-05}. Best is trial 241 with value: 0.7777778506278992.
Trial 298 finished with value: 0.5999999642372131 and parameters: {'n_layers': 10, 'weight_decay': 2.5497419886464206e-06, 'n_units_l0': 25, 'n_units_l1': 5, 'n_units_l2': 51, 'n_units_l3': 57, 'n_units_l4': 35, 'n_units_l5': 43, 'n_units_l6': 34, 'n_units_l7': 21, 'n_units_l8': 26, 'n_units_l9': 19, 'optimizer': 'RMSprop', 'rmsprop_learning_rate': 1.621602941542927e-05, 'rmsprop_weight_decay': 0.9315970397293493, 'rmsprop_momentum': 6.137412139618942e-05}. Best is trial 241 with value: 0.7777778506278992.
Trial 299 finished with value: 0.5000000596046448 and parameters: {'n_layers': 11, 'weight_decay': 1.80521014857555e-06, 'n_units_l0': 24, 'n_units_l1': 5, 'n_units_l2': 47, 'n_units_l3': 51, 'n_units_l4': 33, 'n_units_l5': 36, 'n_units_l6': 36, 'n_units_l7': 19, 'n_units_l8': 30, 'n_units_l9': 13, 'n_units_l10': 9, 'optimizer': 'RMSprop', 'rmsprop_learning_rate': 2.3962370231371797e-05, 'rmsprop_weight_decay': 0.9174090878504964, 'rmsprop_momentum': 8.057797225166664e-05}. Best is trial 241 with value: 0.7777778506278992.
Trial 300 finished with value: 0.644444465637207 and parameters: {'n_layers': 10, 'weight_decay': 2.08490053280905e-06, 'n_units_l0': 29, 'n_units_l1': 5, 'n_units_l2': 55, 'n_units_l3': 57, 'n_units_l4': 29, 'n_units_l5': 37, 'n_units_l6': 86, 'n_units_l7': 24, 'n_units_l8': 42, 'n_units_l9': 12, 'optimizer': 'RMSprop', 'rmsprop_learning_rate': 1.2070309989682525e-05, 'rmsprop_weight_decay': 0.9243103635828465, 'rmsprop_momentum': 1.5701774556416968e-05}. Best is trial 241 with value: 0.7777778506278992.
Trial 301 finished with value: 0.5777778029441833 and parameters: {'n_layers': 9, 'weight_decay': 3.830593986825919e-06, 'n_units_l0': 26, 'n_units_l1': 9, 'n_units_l2': 51, 'n_units_l3': 46, 'n_units_l4': 31, 'n_units_l5': 47, 'n_units_l6': 31, 'n_units_l7': 22, 'n_units_l8': 38, 'optimizer': 'RMSprop', 'rmsprop_learning_rate': 0.00012049718709601154, 'rmsprop_weight_decay': 0.9208140379451744, 'rmsprop_momentum': 0.00018980704534541222}. Best is trial 241 with value: 0.7777778506278992.
Trial 302 finished with value: 0.5555555820465088 and parameters: {'n_layers': 11, 'weight_decay': 1.572876968119666e-06, 'n_units_l0': 28, 'n_units_l1': 4, 'n_units_l2': 60, 'n_units_l3': 60, 'n_units_l4': 15, 'n_units_l5': 33, 'n_units_l6': 22, 'n_units_l7': 14, 'n_units_l8': 32, 'n_units_l9': 16, 'n_units_l10': 102, 'optimizer': 'RMSprop', 'rmsprop_learning_rate': 6.325824825182086e-05, 'rmsprop_weight_decay': 0.9373998261815177, 'rmsprop_momentum': 7.65266609686629e-05}. Best is trial 241 with value: 0.7777778506278992.
Trial 303 finished with value: 0.6222222447395325 and parameters: {'n_layers': 10, 'weight_decay': 3.157098259347125e-06, 'n_units_l0': 33, 'n_units_l1': 8, 'n_units_l2': 48, 'n_units_l3': 65, 'n_units_l4': 31, 'n_units_l5': 23, 'n_units_l6': 10, 'n_units_l7': 20, 'n_units_l8': 50, 'n_units_l9': 21, 'optimizer': 'RMSprop', 'rmsprop_learning_rate': 0.0002846826256157422, 'rmsprop_weight_decay': 0.9343353994995368, 'rmsprop_momentum': 2.09405734406849e-05}. Best is trial 241 with value: 0.7777778506278992.
Trial 304 finished with value: 0.644444465637207 and parameters: {'n_layers': 10, 'weight_decay': 4.2540709020050485e-05, 'n_units_l0': 35, 'n_units_l1': 6, 'n_units_l2': 58, 'n_units_l3': 53, 'n_units_l4': 12, 'n_units_l5': 40, 'n_units_l6': 28, 'n_units_l7': 16, 'n_units_l8': 54, 'n_units_l9': 25, 'optimizer': 'RMSprop', 'rmsprop_learning_rate': 1.581865986492633e-05, 'rmsprop_weight_decay': 0.9058919464293653, 'rmsprop_momentum': 3.679246078228041e-05}. Best is trial 241 with value: 0.7777778506278992.
Trial 305 finished with value: 0.6333333849906921 and parameters: {'n_layers': 9, 'weight_decay': 6.587649932986637e-05, 'n_units_l0': 23, 'n_units_l1': 9, 'n_units_l2': 16, 'n_units_l3': 4, 'n_units_l4': 38, 'n_units_l5': 41, 'n_units_l6': 37, 'n_units_l7': 18, 'n_units_l8': 47, 'optimizer': 'RMSprop', 'rmsprop_learning_rate': 3.120252448849794e-05, 'rmsprop_weight_decay': 0.927989096557081, 'rmsprop_momentum': 2.6849368397704578e-05}. Best is trial 241 with value: 0.7777778506278992.
Trial 306 finished with value: 0.3888889253139496 and parameters: {'n_layers': 12, 'weight_decay': 2.5234200980046503e-06, 'n_units_l0': 27, 'n_units_l1': 27, 'n_units_l2': 13, 'n_units_l3': 49, 'n_units_l4': 13, 'n_units_l5': 19, 'n_units_l6': 39, 'n_units_l7': 9, 'n_units_l8': 27, 'n_units_l9': 39, 'n_units_l10': 6, 'n_units_l11': 42, 'optimizer': 'RMSprop', 'rmsprop_learning_rate': 4.362789613400914e-05, 'rmsprop_weight_decay': 0.9152718187606104, 'rmsprop_momentum': 0.00013828013862658692}. Best is trial 241 with value: 0.7777778506278992.
Trial 307 finished with value: 0.5999999642372131 and parameters: {'n_layers': 11, 'weight_decay': 4.702981325442416e-06, 'n_units_l0': 100, 'n_units_l1': 10, 'n_units_l2': 43, 'n_units_l3': 20, 'n_units_l4': 35, 'n_units_l5': 54, 'n_units_l6': 21, 'n_units_l7': 21, 'n_units_l8': 33, 'n_units_l9': 83, 'n_units_l10': 5, 'optimizer': 'RMSprop', 'rmsprop_learning_rate': 0.028157451741289103, 'rmsprop_weight_decay': 0.9224169791769349, 'rmsprop_momentum': 0.0012702464286377072}. Best is trial 241 with value: 0.7777778506278992.
Trial 308 finished with value: 0.7888889312744141 and parameters: {'n_layers': 5, 'weight_decay': 8.683645057025272e-05, 'n_units_l0': 38, 'n_units_l1': 7, 'n_units_l2': 56, 'n_units_l3': 73, 'n_units_l4': 16, 'optimizer': 'Adam', 'adam_learning_rate': 0.004922310868415339}. Best is trial 308 with value: 0.7888889312744141.
Trial 309 finished with value: 0.5111111402511597 and parameters: {'n_layers': 6, 'weight_decay': 8.812654128877491e-05, 'n_units_l0': 39, 'n_units_l1': 6, 'n_units_l2': 56, 'n_units_l3': 5, 'n_units_l4': 16, 'n_units_l5': 32, 'optimizer': 'Adam', 'adam_learning_rate': 0.004539465910271231}. Best is trial 308 with value: 0.7888889312744141.
Trial 310 finished with value: 0.5999999642372131 and parameters: {'n_layers': 5, 'weight_decay': 0.00013682168697986438, 'n_units_l0': 31, 'n_units_l1': 7, 'n_units_l2': 66, 'n_units_l3': 76, 'n_units_l4': 52, 'optimizer': 'Adam', 'adam_learning_rate': 0.009725490935765274}. Best is trial 308 with value: 0.7888889312744141.
Trial 311 finished with value: 0.6333333849906921 and parameters: {'n_layers': 4, 'weight_decay': 7.247345888046677e-05, 'n_units_l0': 25, 'n_units_l1': 5, 'n_units_l2': 50, 'n_units_l3': 53, 'optimizer': 'Adam', 'adam_learning_rate': 0.020277590808642318}. Best is trial 308 with value: 0.7888889312744141.
Trial 312 finished with value: 0.6333333849906921 and parameters: {'n_layers': 5, 'weight_decay': 0.00010671277325551259, 'n_units_l0': 34, 'n_units_l1': 7, 'n_units_l2': 58, 'n_units_l3': 4, 'n_units_l4': 17, 'optimizer': 'Adam', 'adam_learning_rate': 0.0044260290131834835}. Best is trial 308 with value: 0.7888889312744141.
Trial 313 finished with value: 0.5111111402511597 and parameters: {'n_layers': 4, 'weight_decay': 0.0001907057942288139, 'n_units_l0': 27, 'n_units_l1': 7, 'n_units_l2': 63, 'n_units_l3': 12, 'optimizer': 'Adam', 'adam_learning_rate': 0.011451167887859293}. Best is trial 308 with value: 0.7888889312744141.
Trial 314 finished with value: 0.6000000834465027 and parameters: {'n_layers': 6, 'weight_decay': 1.1174462599318945e-06, 'n_units_l0': 116, 'n_units_l1': 11, 'n_units_l2': 48, 'n_units_l3': 49, 'n_units_l4': 15, 'n_units_l5': 28, 'optimizer': 'Adam', 'adam_learning_rate': 0.0009175089213045314}. Best is trial 308 with value: 0.7888889312744141.
Trial 315 finished with value: 0.5222222208976746 and parameters: {'n_layers': 13, 'weight_decay': 4.9357224506686986e-05, 'n_units_l0': 23, 'n_units_l1': 6, 'n_units_l2': 14, 'n_units_l3': 5, 'n_units_l4': 17, 'n_units_l5': 34, 'n_units_l6': 33, 'n_units_l7': 11, 'n_units_l8': 40, 'n_units_l9': 28, 'n_units_l10': 8, 'n_units_l11': 20, 'n_units_l12': 5, 'optimizer': 'RMSprop', 'rmsprop_learning_rate': 0.0002086612551545412, 'rmsprop_weight_decay': 0.9101717446075293, 'rmsprop_momentum': 0.002236639019152983}. Best is trial 308 with value: 0.7888889312744141.
Trial 316 finished with value: 0.46666669845581055 and parameters: {'n_layers': 7, 'weight_decay': 7.162136964118991e-06, 'n_units_l0': 40, 'n_units_l1': 8, 'n_units_l2': 54, 'n_units_l3': 72, 'n_units_l4': 27, 'n_units_l5': 39, 'n_units_l6': 18, 'optimizer': 'RMSprop', 'rmsprop_learning_rate': 8.516803398834277e-05, 'rmsprop_weight_decay': 0.9264545999471736, 'rmsprop_momentum': 4.68363094951885e-05}. Best is trial 308 with value: 0.7888889312744141.
Trial 317 finished with value: 0.7444444298744202 and parameters: {'n_layers': 12, 'weight_decay': 8.329782660965613e-05, 'n_units_l0': 29, 'n_units_l1': 6, 'n_units_l2': 8, 'n_units_l3': 63, 'n_units_l4': 16, 'n_units_l5': 31, 'n_units_l6': 35, 'n_units_l7': 6, 'n_units_l8': 35, 'n_units_l9': 18, 'n_units_l10': 16, 'n_units_l11': 31, 'optimizer': 'Adam', 'adam_learning_rate': 0.0002753266502057389}. Best is trial 308 with value: 0.7888889312744141.
Trial 318 finished with value: 0.644444465637207 and parameters: {'n_layers': 5, 'weight_decay': 0.0001037890218538957, 'n_units_l0': 29, 'n_units_l1': 6, 'n_units_l2': 8, 'n_units_l3': 61, 'n_units_l4': 13, 'optimizer': 'Adam', 'adam_learning_rate': 0.00031098032915881406}. Best is trial 308 with value: 0.7888889312744141.
