Trial 471 finished with value: 0.46666669845581055 and parameters: {'n_layers': 5, 'weight_decay': 1.0072234362291744e-05, 'n_units_l0': 32, 'n_units_l1': 6, 'n_units_l2': 51, 'n_units_l3': 11, 'n_units_l4': 13, 'optimizer': 'Adam', 'adam_learning_rate': 6.71670858188333e-05}. Best is trial 308 with value: 0.7888889312744141.
Trial 472 finished with value: 0.4777778089046478 and parameters: {'n_layers': 5, 'weight_decay': 7.921849484860507e-06, 'n_units_l0': 37, 'n_units_l1': 8, 'n_units_l2': 57, 'n_units_l3': 12, 'n_units_l4': 74, 'optimizer': 'SGD', 'sgd_opt_learning_rate': 0.0020359256309166853, 'sgd_opt_momentum': 0.0018690213554199704}. Best is trial 308 with value: 0.7888889312744141.
Trial 473 finished with value: 0.644444465637207 and parameters: {'n_layers': 6, 'weight_decay': 0.00011631722780866263, 'n_units_l0': 31, 'n_units_l1': 18, 'n_units_l2': 55, 'n_units_l3': 6, 'n_units_l4': 15, 'n_units_l5': 19, 'optimizer': 'Adam', 'adam_learning_rate': 0.002733127054806691}. Best is trial 308 with value: 0.7888889312744141.
Trial 474 finished with value: 0.4888888895511627 and parameters: {'n_layers': 2, 'weight_decay': 3.3035390620481177e-06, 'n_units_l0': 34, 'n_units_l1': 7, 'optimizer': 'SGD', 'sgd_opt_learning_rate': 0.006870260203655994, 'sgd_opt_momentum': 0.001035904049203414}. Best is trial 308 with value: 0.7888889312744141.
Trial 475 finished with value: 0.4000000059604645 and parameters: {'n_layers': 6, 'weight_decay': 2.1744344989598206e-05, 'n_units_l0': 28, 'n_units_l1': 8, 'n_units_l2': 47, 'n_units_l3': 13, 'n_units_l4': 16, 'n_units_l5': 22, 'optimizer': 'Adam', 'adam_learning_rate': 0.00022253691237506063}. Best is trial 308 with value: 0.7888889312744141.
Trial 476 finished with value: 0.5999999642372131 and parameters: {'n_layers': 12, 'weight_decay': 2.844655874148863e-05, 'n_units_l0': 40, 'n_units_l1': 6, 'n_units_l2': 6, 'n_units_l3': 96, 'n_units_l4': 7, 'n_units_l5': 22, 'n_units_l6': 25, 'n_units_l7': 14, 'n_units_l8': 37, 'n_units_l9': 22, 'n_units_l10': 31, 'n_units_l11': 18, 'optimizer': 'SGD', 'sgd_opt_learning_rate': 0.0003973812024777369, 'sgd_opt_momentum': 0.012483828776970652}. Best is trial 308 with value: 0.7888889312744141.
Trial 477 finished with value: 0.5111111402511597 and parameters: {'n_layers': 4, 'weight_decay': 6.134874452858155e-06, 'n_units_l0': 26, 'n_units_l1': 5, 'n_units_l2': 65, 'n_units_l3': 15, 'optimizer': 'Adam', 'adam_learning_rate': 4.9562597653803716e-05}. Best is trial 308 with value: 0.7888889312744141.
Trial 478 finished with value: 0.7555555701255798 and parameters: {'n_layers': 11, 'weight_decay': 5.766944452939448e-05, 'n_units_l0': 30, 'n_units_l1': 8, 'n_units_l2': 8, 'n_units_l3': 10, 'n_units_l4': 12, 'n_units_l5': 21, 'n_units_l6': 29, 'n_units_l7': 74, 'n_units_l8': 106, 'n_units_l9': 18, 'n_units_l10': 13, 'optimizer': 'SGD', 'sgd_opt_learning_rate': 0.0006029914214343261, 'sgd_opt_momentum': 0.007388905062857111}. Best is trial 308 with value: 0.7888889312744141.
Trial 479 finished with value: 0.42222222685813904 and parameters: {'n_layers': 11, 'weight_decay': 6.867969306321154e-05, 'n_units_l0': 30, 'n_units_l1': 8, 'n_units_l2': 79, 'n_units_l3': 10, 'n_units_l4': 12, 'n_units_l5': 19, 'n_units_l6': 27, 'n_units_l7': 84, 'n_units_l8': 119, 'n_units_l9': 19, 'n_units_l10': 13, 'optimizer': 'SGD', 'sgd_opt_learning_rate': 0.00026799792263230835, 'sgd_opt_momentum': 0.008192809763815196}. Best is trial 308 with value: 0.7888889312744141.
Trial 480 finished with value: 0.6666666865348816 and parameters: {'n_layers': 11, 'weight_decay': 0.00017672755985871741, 'n_units_l0': 30, 'n_units_l1': 8, 'n_units_l2': 8, 'n_units_l3': 9, 'n_units_l4': 12, 'n_units_l5': 21, 'n_units_l6': 26, 'n_units_l7': 10, 'n_units_l8': 11, 'n_units_l9': 7, 'n_units_l10': 19, 'optimizer': 'Adam', 'adam_learning_rate': 0.00013576849961311984}. Best is trial 308 with value: 0.7888889312744141.
Trial 481 finished with value: 0.6666666865348816 and parameters: {'n_layers': 11, 'weight_decay': 7.931395160507799e-05, 'n_units_l0': 28, 'n_units_l1': 7, 'n_units_l2': 8, 'n_units_l3': 10, 'n_units_l4': 14, 'n_units_l5': 18, 'n_units_l6': 29, 'n_units_l7': 12, 'n_units_l8': 104, 'n_units_l9': 14, 'n_units_l10': 17, 'optimizer': 'SGD', 'sgd_opt_learning_rate': 0.0006036814909884125, 'sgd_opt_momentum': 0.019114692325200862}. Best is trial 308 with value: 0.7888889312744141.
Trial 482 finished with value: 0.644444465637207 and parameters: {'n_layers': 10, 'weight_decay': 4.644668360132016e-06, 'n_units_l0': 32, 'n_units_l1': 8, 'n_units_l2': 9, 'n_units_l3': 12, 'n_units_l4': 10, 'n_units_l5': 20, 'n_units_l6': 30, 'n_units_l7': 15, 'n_units_l8': 114, 'n_units_l9': 13, 'optimizer': 'Adam', 'adam_learning_rate': 0.0001870967526134913}. Best is trial 308 with value: 0.7888889312744141.
Trial 483 finished with value: 0.5888888835906982 and parameters: {'n_layers': 3, 'weight_decay': 4.9847341846836766e-05, 'n_units_l0': 26, 'n_units_l1': 8, 'n_units_l2': 54, 'optimizer': 'SGD', 'sgd_opt_learning_rate': 0.0001935656807865875, 'sgd_opt_momentum': 0.010922064413923628}. Best is trial 308 with value: 0.7888889312744141.
Trial 484 finished with value: 0.699999988079071 and parameters: {'n_layers': 11, 'weight_decay': 1.4939508693323395e-05, 'n_units_l0': 29, 'n_units_l1': 7, 'n_units_l2': 7, 'n_units_l3': 11, 'n_units_l4': 11, 'n_units_l5': 14, 'n_units_l6': 23, 'n_units_l7': 4, 'n_units_l8': 108, 'n_units_l9': 16, 'n_units_l10': 11, 'optimizer': 'Adam', 'adam_learning_rate': 9.616767462604194e-05}. Best is trial 308 with value: 0.7888889312744141.
Trial 485 finished with value: 0.5444444417953491 and parameters: {'n_layers': 10, 'weight_decay': 0.00011258462040226761, 'n_units_l0': 33, 'n_units_l1': 7, 'n_units_l2': 8, 'n_units_l3': 9, 'n_units_l4': 13, 'n_units_l5': 13, 'n_units_l6': 25, 'n_units_l7': 17, 'n_units_l8': 41, 'n_units_l9': 122, 'optimizer': 'SGD', 'sgd_opt_learning_rate': 0.0011132040285518892, 'sgd_opt_momentum': 0.006016100689035592}. Best is trial 308 with value: 0.7888889312744141.
Trial 486 finished with value: 0.6777777671813965 and parameters: {'n_layers': 5, 'weight_decay': 7.4708627477870295e-06, 'n_units_l0': 27, 'n_units_l1': 9, 'n_units_l2': 9, 'n_units_l3': 10, 'n_units_l4': 11, 'optimizer': 'Adam', 'adam_learning_rate': 0.03323985016553038}. Best is trial 308 with value: 0.7888889312744141.
Trial 487 finished with value: 0.7444444298744202 and parameters: {'n_layers': 11, 'weight_decay': 3.2200794241107955e-06, 'n_units_l0': 30, 'n_units_l1': 8, 'n_units_l2': 60, 'n_units_l3': 18, 'n_units_l4': 29, 'n_units_l5': 21, 'n_units_l6': 28, 'n_units_l7': 76, 'n_units_l8': 124, 'n_units_l9': 18, 'n_units_l10': 9, 'optimizer': 'SGD', 'sgd_opt_learning_rate': 0.010556412647346382, 'sgd_opt_momentum': 0.004717890615028813}. Best is trial 308 with value: 0.7888889312744141.
Trial 488 finished with value: 0.7222222685813904 and parameters: {'n_layers': 17, 'weight_decay': 3.515366042845009e-06, 'n_units_l0': 31, 'n_units_l1': 8, 'n_units_l2': 71, 'n_units_l3': 17, 'n_units_l4': 30, 'n_units_l5': 16, 'n_units_l6': 28, 'n_units_l7': 75, 'n_units_l8': 119, 'n_units_l9': 18, 'n_units_l10': 14, 'n_units_l11': 61, 'n_units_l12': 96, 'n_units_l13': 9, 'n_units_l14': 40, 'n_units_l15': 76, 'n_units_l16': 7, 'optimizer': 'Adam', 'adam_learning_rate': 2.2826197313233465e-05}. Best is trial 308 with value: 0.7888889312744141.
Trial 489 finished with value: 0.5888888835906982 and parameters: {'n_layers': 22, 'weight_decay': 3.014304533526815e-06, 'n_units_l0': 29, 'n_units_l1': 8, 'n_units_l2': 50, 'n_units_l3': 18, 'n_units_l4': 29, 'n_units_l5': 19, 'n_units_l6': 30, 'n_units_l7': 88, 'n_units_l8': 111, 'n_units_l9': 20, 'n_units_l10': 10, 'n_units_l11': 79, 'n_units_l12': 74, 'n_units_l13': 33, 'n_units_l14': 85, 'n_units_l15': 4, 'n_units_l16': 5, 'n_units_l17': 16, 'n_units_l18': 124, 'n_units_l19': 30, 'n_units_l20': 8, 'n_units_l21': 53, 'optimizer': 'SGD', 'sgd_opt_learning_rate': 0.01066888227422158, 'sgd_opt_momentum': 0.03488050318110948}. Best is trial 308 with value: 0.7888889312744141.
Trial 490 finished with value: 0.6777777671813965 and parameters: {'n_layers': 12, 'weight_decay': 3.846768355385625e-05, 'n_units_l0': 27, 'n_units_l1': 7, 'n_units_l2': 62, 'n_units_l3': 23, 'n_units_l4': 28, 'n_units_l5': 21, 'n_units_l6': 27, 'n_units_l7': 100, 'n_units_l8': 102, 'n_units_l9': 17, 'n_units_l10': 9, 'n_units_l11': 71, 'optimizer': 'Adam', 'adam_learning_rate': 0.005034762023493846}. Best is trial 308 with value: 0.7888889312744141.
Trial 491 finished with value: 0.3888888657093048 and parameters: {'n_layers': 6, 'weight_decay': 2.202908001243102e-06, 'n_units_l0': 34, 'n_units_l1': 7, 'n_units_l2': 61, 'n_units_l3': 17, 'n_units_l4': 26, 'n_units_l5': 46, 'optimizer': 'SGD', 'sgd_opt_learning_rate': 0.046998213188333415, 'sgd_opt_momentum': 0.004633614473745304}. Best is trial 308 with value: 0.7888889312744141.
Trial 492 finished with value: 0.6000000834465027 and parameters: {'n_layers': 11, 'weight_decay': 5.794693035565023e-05, 'n_units_l0': 25, 'n_units_l1': 8, 'n_units_l2': 58, 'n_units_l3': 19, 'n_units_l4': 23, 'n_units_l5': 5, 'n_units_l6': 32, 'n_units_l7': 78, 'n_units_l8': 123, 'n_units_l9': 15, 'n_units_l10': 12, 'optimizer': 'SGD', 'sgd_opt_learning_rate': 0.030557355192377764, 'sgd_opt_momentum': 0.025060836511450423}. Best is trial 308 with value: 0.7888889312744141.
Trial 493 finished with value: 0.5555555820465088 and parameters: {'n_layers': 12, 'weight_decay': 8.818256201003609e-05, 'n_units_l0': 31, 'n_units_l1': 8, 'n_units_l2': 64, 'n_units_l3': 15, 'n_units_l4': 28, 'n_units_l5': 23, 'n_units_l6': 30, 'n_units_l7': 71, 'n_units_l8': 124, 'n_units_l9': 11, 'n_units_l10': 16, 'n_units_l11': 105, 'optimizer': 'Adam', 'adam_learning_rate': 3.237090864373405e-05}. Best is trial 308 with value: 0.7888889312744141.
Trial 494 finished with value: 0.6666666865348816 and parameters: {'n_layers': 5, 'weight_decay': 1.185619481504645e-09, 'n_units_l0': 29, 'n_units_l1': 7, 'n_units_l2': 68, 'n_units_l3': 14, 'n_units_l4': 37, 'optimizer': 'SGD', 'sgd_opt_learning_rate': 0.01617370201459181, 'sgd_opt_momentum': 0.007211922488788725}. Best is trial 308 with value: 0.7888889312744141.
Trial 495 finished with value: 0.6111111640930176 and parameters: {'n_layers': 10, 'weight_decay': 2.8031615871824215e-05, 'n_units_l0': 27, 'n_units_l1': 8, 'n_units_l2': 58, 'n_units_l3': 11, 'n_units_l4': 25, 'n_units_l5': 21, 'n_units_l6': 25, 'n_units_l7': 81, 'n_units_l8': 126, 'n_units_l9': 21, 'optimizer': 'Adam', 'adam_learning_rate': 0.0037177141937206116}. Best is trial 308 with value: 0.7888889312744141.
Trial 496 finished with value: 0.6111111640930176 and parameters: {'n_layers': 4, 'weight_decay': 2.6979467477351512e-06, 'n_units_l0': 33, 'n_units_l1': 7, 'n_units_l2': 53, 'n_units_l3': 13, 'optimizer': 'SGD', 'sgd_opt_learning_rate': 0.02096832593621235, 'sgd_opt_momentum': 0.07815543902091944}. Best is trial 308 with value: 0.7888889312744141.
Trial 497 finished with value: 0.5777778029441833 and parameters: {'n_layers': 6, 'weight_decay': 0.00013624270624655737, 'n_units_l0': 31, 'n_units_l1': 7, 'n_units_l2': 21, 'n_units_l3': 9, 'n_units_l4': 32, 'n_units_l5': 24, 'optimizer': 'Adam', 'adam_learning_rate': 0.0003324545255836286}. Best is trial 308 with value: 0.7888889312744141.
Trial 498 finished with value: 0.6777777671813965 and parameters: {'n_layers': 11, 'weight_decay': 7.631600243107474e-05, 'n_units_l0': 36, 'n_units_l1': 7, 'n_units_l2': 8, 'n_units_l3': 8, 'n_units_l4': 19, 'n_units_l5': 19, 'n_units_l6': 28, 'n_units_l7': 88, 'n_units_l8': 95, 'n_units_l9': 12, 'n_units_l10': 22, 'optimizer': 'SGD', 'sgd_opt_learning_rate': 0.0001507768173378331, 'sgd_opt_momentum': 0.016847304931027922}. Best is trial 308 with value: 0.7888889312744141.
Trial 499 finished with value: 0.36666667461395264 and parameters: {'n_layers': 1, 'weight_decay': 5.228766965486237e-05, 'n_units_l0': 28, 'optimizer': 'Adam', 'adam_learning_rate': 0.010068818933794852}. Best is trial 308 with value: 0.7888889312744141.
