A new study created in memory with name: no-name-0737269b-9347-4437-986e-5c999f004ddc
Trial 0 finished with value: 0.5111111402511597 and parameters: {'n_layers': 17, 'weight_decay': 1.452104370585815e-08, 'n_units_l0': 19, 'n_units_l1': 115, 'n_units_l2': 39, 'n_units_l3': 4, 'n_units_l4': 11, 'n_units_l5': 20, 'n_units_l6': 5, 'n_units_l7': 28, 'n_units_l8': 44, 'n_units_l9': 7, 'n_units_l10': 121, 'n_units_l11': 13, 'n_units_l12': 40, 'n_units_l13': 19, 'n_units_l14': 54, 'n_units_l15': 5, 'n_units_l16': 74, 'optimizer': 'RMSprop', 'rmsprop_learning_rate': 0.028499366992827666, 'rmsprop_weight_decay': 0.9007074548002404, 'rmsprop_momentum': 0.0005695730334062628}. Best is trial 0 with value: 0.5111111402511597.
Trial 1 finished with value: 0.36666667461395264 and parameters: {'n_layers': 7, 'weight_decay': 1.0476409934104106e-08, 'n_units_l0': 37, 'n_units_l1': 10, 'n_units_l2': 96, 'n_units_l3': 10, 'n_units_l4': 82, 'n_units_l5': 6, 'n_units_l6': 4, 'optimizer': 'Adam', 'adam_learning_rate': 0.0006033604087041389}. Best is trial 0 with value: 0.5111111402511597.
Trial 2 finished with value: 0.5333333611488342 and parameters: {'n_layers': 25, 'weight_decay': 1.957947067727667e-09, 'n_units_l0': 34, 'n_units_l1': 7, 'n_units_l2': 16, 'n_units_l3': 9, 'n_units_l4': 6, 'n_units_l5': 8, 'n_units_l6': 69, 'n_units_l7': 15, 'n_units_l8': 12, 'n_units_l9': 9, 'n_units_l10': 6, 'n_units_l11': 10, 'n_units_l12': 9, 'n_units_l13': 86, 'n_units_l14': 23, 'n_units_l15': 20, 'n_units_l16': 46, 'n_units_l17': 6, 'n_units_l18': 79, 'n_units_l19': 48, 'n_units_l20': 16, 'n_units_l21': 78, 'n_units_l22': 12, 'n_units_l23': 78, 'n_units_l24': 87, 'optimizer': 'RMSprop', 'rmsprop_learning_rate': 6.683841954231351e-05, 'rmsprop_weight_decay': 0.9829163786230366, 'rmsprop_momentum': 0.02104354775575247}. Best is trial 2 with value: 0.5333333611488342.
Trial 3 finished with value: 0.5333333611488342 and parameters: {'n_layers': 12, 'weight_decay': 7.972210131033163e-08, 'n_units_l0': 98, 'n_units_l1': 33, 'n_units_l2': 86, 'n_units_l3': 4, 'n_units_l4': 4, 'n_units_l5': 6, 'n_units_l6': 90, 'n_units_l7': 4, 'n_units_l8': 31, 'n_units_l9': 8, 'n_units_l10': 81, 'n_units_l11': 109, 'optimizer': 'Adam', 'adam_learning_rate': 0.0008908313726362059}. Best is trial 2 with value: 0.5333333611488342.
Trial 4 finished with value: 0.6666666865348816 and parameters: {'n_layers': 20, 'weight_decay': 3.5255077446751507e-10, 'n_units_l0': 5, 'n_units_l1': 31, 'n_units_l2': 16, 'n_units_l3': 52, 'n_units_l4': 26, 'n_units_l5': 13, 'n_units_l6': 4, 'n_units_l7': 114, 'n_units_l8': 72, 'n_units_l9': 67, 'n_units_l10': 18, 'n_units_l11': 39, 'n_units_l12': 104, 'n_units_l13': 6, 'n_units_l14': 7, 'n_units_l15': 50, 'n_units_l16': 29, 'n_units_l17': 37, 'n_units_l18': 6, 'n_units_l19': 75, 'optimizer': 'RMSprop', 'rmsprop_learning_rate': 0.010024792353142872, 'rmsprop_weight_decay': 0.9499150962774319, 'rmsprop_momentum': 0.00033815105282798035}. Best is trial 4 with value: 0.6666666865348816.
Trial 5 finished with value: 0.43333330750465393 and parameters: {'n_layers': 22, 'weight_decay': 1.7344602725946647e-06, 'n_units_l0': 40, 'n_units_l1': 48, 'n_units_l2': 18, 'n_units_l3': 12, 'n_units_l4': 5, 'n_units_l5': 33, 'n_units_l6': 4, 'n_units_l7': 6, 'n_units_l8': 61, 'n_units_l9': 22, 'n_units_l10': 62, 'n_units_l11': 12, 'n_units_l12': 14, 'n_units_l13': 4, 'n_units_l14': 99, 'n_units_l15': 57, 'n_units_l16': 105, 'n_units_l17': 9, 'n_units_l18': 24, 'n_units_l19': 50, 'n_units_l20': 9, 'n_units_l21': 33, 'optimizer': 'SGD', 'sgd_opt_learning_rate': 0.0010910921827835369, 'sgd_opt_momentum': 0.08702302881881158}. Best is trial 4 with value: 0.6666666865348816.
Trial 6 finished with value: 0.6111111044883728 and parameters: {'n_layers': 22, 'weight_decay': 2.1279460907006172e-05, 'n_units_l0': 10, 'n_units_l1': 6, 'n_units_l2': 18, 'n_units_l3': 105, 'n_units_l4': 33, 'n_units_l5': 23, 'n_units_l6': 15, 'n_units_l7': 26, 'n_units_l8': 11, 'n_units_l9': 63, 'n_units_l10': 76, 'n_units_l11': 17, 'n_units_l12': 23, 'n_units_l13': 15, 'n_units_l14': 40, 'n_units_l15': 13, 'n_units_l16': 47, 'n_units_l17': 52, 'n_units_l18': 18, 'n_units_l19': 126, 'n_units_l20': 4, 'n_units_l21': 17, 'optimizer': 'SGD', 'sgd_opt_learning_rate': 0.001136938984047149, 'sgd_opt_momentum': 0.0038273920458601353}. Best is trial 4 with value: 0.6666666865348816.
Trial 7 finished with value: 0.7555555701255798 and parameters: {'n_layers': 12, 'weight_decay': 2.16565787700403e-06, 'n_units_l0': 29, 'n_units_l1': 9, 'n_units_l2': 53, 'n_units_l3': 14, 'n_units_l4': 33, 'n_units_l5': 30, 'n_units_l6': 16, 'n_units_l7': 18, 'n_units_l8': 27, 'n_units_l9': 13, 'n_units_l10': 98, 'n_units_l11': 69, 'optimizer': 'RMSprop', 'rmsprop_learning_rate': 0.002317423672777013, 'rmsprop_weight_decay': 0.9401250548188398, 'rmsprop_momentum': 0.0004103102936446636}. Best is trial 7 with value: 0.7555555701255798.
Trial 8 finished with value: 0.5222222208976746 and parameters: {'n_layers': 20, 'weight_decay': 1.2768288504995416e-07, 'n_units_l0': 5, 'n_units_l1': 5, 'n_units_l2': 95, 'n_units_l3': 9, 'n_units_l4': 29, 'n_units_l5': 34, 'n_units_l6': 96, 'n_units_l7': 25, 'n_units_l8': 6, 'n_units_l9': 6, 'n_units_l10': 10, 'n_units_l11': 113, 'n_units_l12': 31, 'n_units_l13': 102, 'n_units_l14': 97, 'n_units_l15': 9, 'n_units_l16': 31, 'n_units_l17': 26, 'n_units_l18': 4, 'n_units_l19': 44, 'optimizer': 'Adam', 'adam_learning_rate': 0.0028499787055211393}. Best is trial 7 with value: 0.7555555701255798.
Trial 9 finished with value: 0.4444444477558136 and parameters: {'n_layers': 21, 'weight_decay': 1.4694450980040258e-10, 'n_units_l0': 65, 'n_units_l1': 26, 'n_units_l2': 11, 'n_units_l3': 15, 'n_units_l4': 12, 'n_units_l5': 97, 'n_units_l6': 4, 'n_units_l7': 58, 'n_units_l8': 24, 'n_units_l9': 9, 'n_units_l10': 4, 'n_units_l11': 46, 'n_units_l12': 46, 'n_units_l13': 17, 'n_units_l14': 4, 'n_units_l15': 35, 'n_units_l16': 27, 'n_units_l17': 33, 'n_units_l18': 27, 'n_units_l19': 116, 'n_units_l20': 27, 'optimizer': 'SGD', 'sgd_opt_learning_rate': 0.0011067698100058888, 'sgd_opt_momentum': 0.05228429531072374}. Best is trial 7 with value: 0.7555555701255798.
Trial 10 finished with value: 0.6666666865348816 and parameters: {'n_layers': 1, 'weight_decay': 0.0005045228512918408, 'n_units_l0': 13, 'optimizer': 'RMSprop', 'rmsprop_learning_rate': 0.0004579336118960785, 'rmsprop_weight_decay': 0.8606107200656193, 'rmsprop_momentum': 1.4487967007354073e-05}. Best is trial 7 with value: 0.7555555701255798.
Trial 11 finished with value: 0.4888889491558075 and parameters: {'n_layers': 13, 'weight_decay': 7.102221532897223e-06, 'n_units_l0': 4, 'n_units_l1': 14, 'n_units_l2': 5, 'n_units_l3': 52, 'n_units_l4': 66, 'n_units_l5': 12, 'n_units_l6': 13, 'n_units_l7': 116, 'n_units_l8': 108, 'n_units_l9': 125, 'n_units_l10': 28, 'n_units_l11': 43, 'n_units_l12': 102, 'optimizer': 'RMSprop', 'rmsprop_learning_rate': 0.014234853542991087, 'rmsprop_weight_decay': 0.9545087228194252, 'rmsprop_momentum': 0.0003268056961011899}. Best is trial 7 with value: 0.7555555701255798.
Trial 12 finished with value: 0.5555555820465088 and parameters: {'n_layers': 10, 'weight_decay': 2.4415448343488805e-10, 'n_units_l0': 10, 'n_units_l1': 15, 'n_units_l2': 40, 'n_units_l3': 34, 'n_units_l4': 37, 'n_units_l5': 68, 'n_units_l6': 44, 'n_units_l7': 9, 'n_units_l8': 96, 'n_units_l9': 26, 'optimizer': 'RMSprop', 'rmsprop_learning_rate': 0.002417341408876611, 'rmsprop_weight_decay': 0.9413231023049956, 'rmsprop_momentum': 0.0001257396833103066}. Best is trial 7 with value: 0.7555555701255798.
Trial 13 finished with value: 0.41111111640930176 and parameters: {'n_layers': 16, 'weight_decay': 6.789971197641119e-05, 'n_units_l0': 7, 'n_units_l1': 64, 'n_units_l2': 40, 'n_units_l3': 28, 'n_units_l4': 16, 'n_units_l5': 16, 'n_units_l6': 8, 'n_units_l7': 61, 'n_units_l8': 49, 'n_units_l9': 46, 'n_units_l10': 23, 'n_units_l11': 4, 'n_units_l12': 4, 'n_units_l13': 4, 'n_units_l14': 6, 'n_units_l15': 121, 'optimizer': 'RMSprop', 'rmsprop_learning_rate': 0.0021527215931446985, 'rmsprop_weight_decay': 0.9053979220318299, 'rmsprop_momentum': 0.004408256221926705}. Best is trial 7 with value: 0.7555555701255798.
Trial 14 finished with value: 0.6111111640930176 and parameters: {'n_layers': 6, 'weight_decay': 9.407786879317353e-07, 'n_units_l0': 20, 'n_units_l1': 19, 'n_units_l2': 8, 'n_units_l3': 69, 'n_units_l4': 20, 'n_units_l5': 44, 'optimizer': 'RMSprop', 'rmsprop_learning_rate': 0.0616324360356437, 'rmsprop_weight_decay': 0.946308939074889, 'rmsprop_momentum': 6.448002746802063e-05}. Best is trial 7 with value: 0.7555555701255798.
Trial 15 finished with value: 0.5777778029441833 and parameters: {'n_layers': 17, 'weight_decay': 4.4989739518517954e-09, 'n_units_l0': 63, 'n_units_l1': 4, 'n_units_l2': 29, 'n_units_l3': 23, 'n_units_l4': 42, 'n_units_l5': 4, 'n_units_l6': 32, 'n_units_l7': 12, 'n_units_l8': 17, 'n_units_l9': 15, 'n_units_l10': 13, 'n_units_l11': 46, 'n_units_l12': 112, 'n_units_l13': 9, 'n_units_l14': 12, 'n_units_l15': 83, 'n_units_l16': 7, 'optimizer': 'RMSprop', 'rmsprop_learning_rate': 0.005891555022615723, 'rmsprop_weight_decay': 0.9831224941354131, 'rmsprop_momentum': 0.0023917547973659396}. Best is trial 7 with value: 0.7555555701255798.
Trial 16 finished with value: 0.3777777850627899 and parameters: {'n_layers': 10, 'weight_decay': 5.351295364336197e-07, 'n_units_l0': 24, 'n_units_l1': 10, 'n_units_l2': 4, 'n_units_l3': 46, 'n_units_l4': 126, 'n_units_l5': 11, 'n_units_l6': 9, 'n_units_l7': 55, 'n_units_l8': 127, 'n_units_l9': 4, 'optimizer': 'RMSprop', 'rmsprop_learning_rate': 0.00034335091003242173, 'rmsprop_weight_decay': 0.9242910446416427, 'rmsprop_momentum': 0.0012132228451605233}. Best is trial 7 with value: 0.7555555701255798.
Trial 17 finished with value: 0.5111111402511597 and parameters: {'n_layers': 15, 'weight_decay': 6.679530953621632e-10, 'n_units_l0': 6, 'n_units_l1': 37, 'n_units_l2': 60, 'n_units_l3': 111, 'n_units_l4': 68, 'n_units_l5': 56, 'n_units_l6': 26, 'n_units_l7': 95, 'n_units_l8': 68, 'n_units_l9': 38, 'n_units_l10': 36, 'n_units_l11': 29, 'n_units_l12': 66, 'n_units_l13': 47, 'n_units_l14': 10, 'optimizer': 'RMSprop', 'rmsprop_learning_rate': 3.865587167948357e-05, 'rmsprop_weight_decay': 0.9631898699936912, 'rmsprop_momentum': 5.5215944408178884e-05}. Best is trial 7 with value: 0.7555555701255798.
Trial 18 finished with value: 0.5777778029441833 and parameters: {'n_layers': 25, 'weight_decay': 8.587535128464985e-08, 'n_units_l0': 14, 'n_units_l1': 83, 'n_units_l2': 11, 'n_units_l3': 6, 'n_units_l4': 8, 'n_units_l5': 127, 'n_units_l6': 7, 'n_units_l7': 38, 'n_units_l8': 35, 'n_units_l9': 92, 'n_units_l10': 40, 'n_units_l11': 77, 'n_units_l12': 11, 'n_units_l13': 8, 'n_units_l14': 11, 'n_units_l15': 38, 'n_units_l16': 10, 'n_units_l17': 103, 'n_units_l18': 4, 'n_units_l19': 4, 'n_units_l20': 111, 'n_units_l21': 4, 'n_units_l22': 121, 'n_units_l23': 4, 'n_units_l24': 4, 'optimizer': 'Adam', 'adam_learning_rate': 0.08607552919565704}. Best is trial 7 with value: 0.7555555701255798.
Trial 19 finished with value: 0.644444465637207 and parameters: {'n_layers': 19, 'weight_decay': 4.306200402820477e-06, 'n_units_l0': 27, 'n_units_l1': 10, 'n_units_l2': 58, 'n_units_l3': 15, 'n_units_l4': 23, 'n_units_l5': 27, 'n_units_l6': 15, 'n_units_l7': 13, 'n_units_l8': 4, 'n_units_l9': 14, 'n_units_l10': 17, 'n_units_l11': 26, 'n_units_l12': 4, 'n_units_l13': 39, 'n_units_l14': 4, 'n_units_l15': 33, 'n_units_l16': 13, 'n_units_l17': 12, 'n_units_l18': 10, 'optimizer': 'SGD', 'sgd_opt_learning_rate': 1.1277110646442763e-05, 'sgd_opt_momentum': 1.1152821803718593e-05}. Best is trial 7 with value: 0.7555555701255798.
Trial 20 finished with value: 0.35555553436279297 and parameters: {'n_layers': 6, 'weight_decay': 0.00022354932574140577, 'n_units_l0': 56, 'n_units_l1': 23, 'n_units_l2': 28, 'n_units_l3': 69, 'n_units_l4': 55, 'n_units_l5': 14, 'optimizer': 'RMSprop', 'rmsprop_learning_rate': 0.006434600848190003, 'rmsprop_weight_decay': 0.9256705222254694, 'rmsprop_momentum': 0.010017001619434744}. Best is trial 7 with value: 0.7555555701255798.
Trial 21 finished with value: 0.5888888835906982 and parameters: {'n_layers': 1, 'weight_decay': 0.0009099126231313871, 'n_units_l0': 13, 'optimizer': 'RMSprop', 'rmsprop_learning_rate': 0.0002507678301800494, 'rmsprop_weight_decay': 0.8550318307960635, 'rmsprop_momentum': 1.162630135412785e-05}. Best is trial 7 with value: 0.7555555701255798.
Trial 22 finished with value: 0.4888888895511627 and parameters: {'n_layers': 1, 'weight_decay': 9.491916347815597e-05, 'n_units_l0': 8, 'optimizer': 'RMSprop', 'rmsprop_learning_rate': 0.0006038378941229913, 'rmsprop_weight_decay': 0.8559301403994891, 'rmsprop_momentum': 1.6502750915305812e-05}. Best is trial 7 with value: 0.7555555701255798.
Trial 23 finished with value: 0.6222222447395325 and parameters: {'n_layers': 4, 'weight_decay': 0.0007990396081419616, 'n_units_l0': 4, 'n_units_l1': 16, 'n_units_l2': 7, 'n_units_l3': 18, 'optimizer': 'RMSprop', 'rmsprop_learning_rate': 0.001372274702402733, 'rmsprop_weight_decay': 0.8740880821675524, 'rmsprop_momentum': 0.0002683628026038614}. Best is trial 7 with value: 0.7555555701255798.
Trial 24 finished with value: 0.30000001192092896 and parameters: {'n_layers': 9, 'weight_decay': 1.0607194508998853e-05, 'n_units_l0': 14, 'n_units_l1': 49, 'n_units_l2': 28, 'n_units_l3': 34, 'n_units_l4': 16, 'n_units_l5': 9, 'n_units_l6': 46, 'n_units_l7': 8, 'n_units_l8': 19, 'optimizer': 'RMSprop', 'rmsprop_learning_rate': 0.00019671280169053924, 'rmsprop_weight_decay': 0.8856588721350022, 'rmsprop_momentum': 0.059015603137589585}. Best is trial 7 with value: 0.7555555701255798.
Trial 25 finished with value: 0.5777778029441833 and parameters: {'n_layers': 4, 'weight_decay': 3.008759072541736e-08, 'n_units_l0': 9, 'n_units_l1': 29, 'n_units_l2': 61, 'n_units_l3': 24, 'optimizer': 'RMSprop', 'rmsprop_learning_rate': 0.007639239871969944, 'rmsprop_weight_decay': 0.9347990892249547, 'rmsprop_momentum': 4.0997087231185295e-05}. Best is trial 7 with value: 0.7555555701255798.
Trial 26 finished with value: 0.6666666865348816 and parameters: {'n_layers': 12, 'weight_decay': 2.387908763755373e-05, 'n_units_l0': 17, 'n_units_l1': 8, 'n_units_l2': 11, 'n_units_l3': 6, 'n_units_l4': 49, 'n_units_l5': 18, 'n_units_l6': 21, 'n_units_l7': 19, 'n_units_l8': 70, 'n_units_l9': 35, 'n_units_l10': 8, 'n_units_l11': 74, 'optimizer': 'RMSprop', 'rmsprop_learning_rate': 0.0009709966935902162, 'rmsprop_weight_decay': 0.9662435793659058, 'rmsprop_momentum': 0.001065522828690525}. Best is trial 7 with value: 0.7555555701255798.
Trial 27 finished with value: 0.46666669845581055 and parameters: {'n_layers': 14, 'weight_decay': 2.7219561245706404e-07, 'n_units_l0': 6, 'n_units_l1': 4, 'n_units_l2': 126, 'n_units_l3': 50, 'n_units_l4': 26, 'n_units_l5': 50, 'n_units_l6': 11, 'n_units_l7': 36, 'n_units_l8': 11, 'n_units_l9': 14, 'n_units_l10': 46, 'n_units_l11': 64, 'n_units_l12': 65, 'n_units_l13': 7, 'optimizer': 'RMSprop', 'rmsprop_learning_rate': 1.2505573378647782e-05, 'rmsprop_weight_decay': 0.9092933042901573, 'rmsprop_momentum': 0.00016740175170366025}. Best is trial 7 with value: 0.7555555701255798.
Trial 28 finished with value: 0.5444444417953491 and parameters: {'n_layers': 3, 'weight_decay': 2.556211193573487e-06, 'n_units_l0': 46, 'n_units_l1': 12, 'n_units_l2': 14, 'optimizer': 'Adam', 'adam_learning_rate': 1.179502098079023e-05}. Best is trial 7 with value: 0.7555555701255798.
Trial 29 finished with value: 0.5222222208976746 and parameters: {'n_layers': 18, 'weight_decay': 2.2797445778210285e-08, 'n_units_l0': 28, 'n_units_l1': 21, 'n_units_l2': 24, 'n_units_l3': 36, 'n_units_l4': 95, 'n_units_l5': 74, 'n_units_l6': 20, 'n_units_l7': 72, 'n_units_l8': 27, 'n_units_l9': 58, 'n_units_l10': 17, 'n_units_l11': 33, 'n_units_l12': 7, 'n_units_l13': 32, 'n_units_l14': 20, 'n_units_l15': 4, 'n_units_l16': 4, 'n_units_l17': 108, 'optimizer': 'SGD', 'sgd_opt_learning_rate': 0.056094125040645246, 'sgd_opt_momentum': 1.1434998211629687e-05}. Best is trial 7 with value: 0.7555555701255798.
Trial 30 finished with value: 0.5888888835906982 and parameters: {'n_layers': 9, 'weight_decay': 0.0002556550088170235, 'n_units_l0': 104, 'n_units_l1': 42, 'n_units_l2': 8, 'n_units_l3': 77, 'n_units_l4': 11, 'n_units_l5': 33, 'n_units_l6': 6, 'n_units_l7': 39, 'n_units_l8': 43, 'optimizer': 'RMSprop', 'rmsprop_learning_rate': 0.0033375632877259477, 'rmsprop_weight_decay': 0.9617318201153082, 'rmsprop_momentum': 2.461417057125386e-05}. Best is trial 7 with value: 0.7555555701255798.
Trial 31 finished with value: 0.7111111283302307 and parameters: {'n_layers': 11, 'weight_decay': 4.1676308943676704e-05, 'n_units_l0': 16, 'n_units_l1': 7, 'n_units_l2': 10, 'n_units_l3': 6, 'n_units_l4': 46, 'n_units_l5': 18, 'n_units_l6': 20, 'n_units_l7': 18, 'n_units_l8': 83, 'n_units_l9': 34, 'n_units_l10': 8, 'optimizer': 'RMSprop', 'rmsprop_learning_rate': 0.0006729258101235447, 'rmsprop_weight_decay': 0.971189141569094, 'rmsprop_momentum': 0.001003402239863179}. Best is trial 7 with value: 0.7555555701255798.
Trial 32 finished with value: 0.6777777671813965 and parameters: {'n_layers': 8, 'weight_decay': 4.20263673978807e-05, 'n_units_l0': 19, 'n_units_l1': 6, 'n_units_l2': 6, 'n_units_l3': 6, 'n_units_l4': 41, 'n_units_l5': 23, 'n_units_l6': 35, 'n_units_l7': 19, 'optimizer': 'RMSprop', 'rmsprop_learning_rate': 0.0005985598204135443, 'rmsprop_weight_decay': 0.9697843968544481, 'rmsprop_momentum': 0.0007699379214040297}. Best is trial 7 with value: 0.7555555701255798.
Trial 33 finished with value: 0.6888889670372009 and parameters: {'n_layers': 11, 'weight_decay': 5.53396501875817e-05, 'n_units_l0': 18, 'n_units_l1': 5, 'n_units_l2': 6, 'n_units_l3': 6, 'n_units_l4': 40, 'n_units_l5': 23, 'n_units_l6': 38, 'n_units_l7': 18, 'n_units_l8': 90, 'n_units_l9': 28, 'n_units_l10': 4, 'optimizer': 'RMSprop', 'rmsprop_learning_rate': 0.0009732577677603418, 'rmsprop_weight_decay': 0.9731258629439536, 'rmsprop_momentum': 0.0005019708720637271}. Best is trial 7 with value: 0.7555555701255798.
Trial 34 finished with value: 0.5999999642372131 and parameters: {'n_layers': 8, 'weight_decay': 2.465205254760299e-05, 'n_units_l0': 17, 'n_units_l1': 5, 'n_units_l2': 5, 'n_units_l3': 6, 'n_units_l4': 44, 'n_units_l5': 24, 'n_units_l6': 40, 'n_units_l7': 18, 'optimizer': 'RMSprop', 'rmsprop_learning_rate': 0.0001255557988200327, 'rmsprop_weight_decay': 0.9718896350977589, 'rmsprop_momentum': 0.0025068732595696364}. Best is trial 7 with value: 0.7555555701255798.
Trial 35 finished with value: 0.5111111402511597 and parameters: {'n_layers': 11, 'weight_decay': 7.041117233485086e-05, 'n_units_l0': 33, 'n_units_l1': 6, 'n_units_l2': 6, 'n_units_l3': 4, 'n_units_l4': 36, 'n_units_l5': 41, 'n_units_l6': 29, 'n_units_l7': 10, 'n_units_l8': 92, 'n_units_l9': 27, 'n_units_l10': 4, 'optimizer': 'Adam', 'adam_learning_rate': 1.2487084891753462e-05}. Best is trial 7 with value: 0.7555555701255798.
Trial 36 finished with value: 0.5555555820465088 and parameters: {'n_layers': 13, 'weight_decay': 1.0182360038448765e-05, 'n_units_l0': 22, 'n_units_l1': 8, 'n_units_l2': 4, 'n_units_l3': 7, 'n_units_l4': 60, 'n_units_l5': 20, 'n_units_l6': 61, 'n_units_l7': 16, 'n_units_l8': 55, 'n_units_l9': 17, 'n_units_l10': 6, 'n_units_l11': 6, 'n_units_l12': 18, 'optimizer': 'RMSprop', 'rmsprop_learning_rate': 0.0009278385572907341, 'rmsprop_weight_decay': 0.9877942024506443, 'rmsprop_momentum': 0.0006930498010382633}. Best is trial 7 with value: 0.7555555701255798.
Trial 37 finished with value: 0.7444444298744202 and parameters: {'n_layers': 7, 'weight_decay': 0.0001666478225402972, 'n_units_l0': 31, 'n_units_l1': 7, 'n_units_l2': 9, 'n_units_l3': 5, 'n_units_l4': 18, 'n_units_l5': 28, 'n_units_l6': 19, 'optimizer': 'RMSprop', 'rmsprop_learning_rate': 0.0014072740719756694, 'rmsprop_weight_decay': 0.9701258376319692, 'rmsprop_momentum': 0.0017665852278216736}. Best is trial 7 with value: 0.7555555701255798.
Trial 38 finished with value: 0.4555555582046509 and parameters: {'n_layers': 11, 'weight_decay': 0.00021524280486957028, 'n_units_l0': 30, 'n_units_l1': 8, 'n_units_l2': 9, 'n_units_l3': 4, 'n_units_l4': 18, 'n_units_l5': 29, 'n_units_l6': 18, 'n_units_l7': 7, 'n_units_l8': 88, 'n_units_l9': 32, 'n_units_l10': 6, 'optimizer': 'RMSprop', 'rmsprop_learning_rate': 0.0015602386681003936, 'rmsprop_weight_decay': 0.9744450973450085, 'rmsprop_momentum': 0.0019329596928699879}. Best is trial 7 with value: 0.7555555701255798.
Trial 39 finished with value: 0.644444465637207 and parameters: {'n_layers': 7, 'weight_decay': 0.00012840725489634422, 'n_units_l0': 41, 'n_units_l1': 5, 'n_units_l2': 13, 'n_units_l3': 8, 'n_units_l4': 94, 'n_units_l5': 17, 'n_units_l6': 26, 'optimizer': 'SGD', 'sgd_opt_learning_rate': 1.5869162576528632e-05, 'sgd_opt_momentum': 0.00028802944701053317}. Best is trial 7 with value: 0.7555555701255798.
Trial 40 finished with value: 0.5666666626930237 and parameters: {'n_layers': 15, 'weight_decay': 1.2752368667428085e-06, 'n_units_l0': 49, 'n_units_l1': 11, 'n_units_l2': 10, 'n_units_l3': 5, 'n_units_l4': 31, 'n_units_l5': 37, 'n_units_l6': 17, 'n_units_l7': 28, 'n_units_l8': 37, 'n_units_l9': 20, 'n_units_l10': 10, 'n_units_l11': 19, 'n_units_l12': 6, 'n_units_l13': 54, 'n_units_l14': 47, 'optimizer': 'Adam', 'adam_learning_rate': 0.06206014981449877}. Best is trial 7 with value: 0.7555555701255798.
Trial 41 finished with value: 0.6666666865348816 and parameters: {'n_layers': 6, 'weight_decay': 3.770066358153832e-05, 'n_units_l0': 18, 'n_units_l1': 7, 'n_units_l2': 6, 'n_units_l3': 11, 'n_units_l4': 44, 'n_units_l5': 24, 'optimizer': 'RMSprop', 'rmsprop_learning_rate': 0.0006446168850827027, 'rmsprop_weight_decay': 0.9741789296908119, 'rmsprop_momentum': 0.000631440201580226}. Best is trial 7 with value: 0.7555555701255798.
