Trial 415 finished with value: 0.5888888835906982 and parameters: {'n_layers': 12, 'weight_decay': 8.961970330021849e-05, 'n_units_l0': 36, 'n_units_l1': 8, 'n_units_l2': 54, 'n_units_l3': 86, 'n_units_l4': 18, 'n_units_l5': 44, 'n_units_l6': 20, 'n_units_l7': 20, 'n_units_l8': 50, 'n_units_l9': 13, 'n_units_l10': 23, 'n_units_l11': 128, 'optimizer': 'SGD', 'sgd_opt_learning_rate': 2.6436928098558464e-05, 'sgd_opt_momentum': 0.00017494528833936253}. Best is trial 308 with value: 0.7888889312744141.
Trial 416 finished with value: 0.5333333611488342 and parameters: {'n_layers': 13, 'weight_decay': 4.396320779785966e-06, 'n_units_l0': 27, 'n_units_l1': 9, 'n_units_l2': 60, 'n_units_l3': 58, 'n_units_l4': 124, 'n_units_l5': 83, 'n_units_l6': 42, 'n_units_l7': 16, 'n_units_l8': 40, 'n_units_l9': 10, 'n_units_l10': 16, 'n_units_l11': 55, 'n_units_l12': 47, 'optimizer': 'RMSprop', 'rmsprop_learning_rate': 0.004147174794040003, 'rmsprop_weight_decay': 0.9044120598354803, 'rmsprop_momentum': 5.060852634526268e-05}. Best is trial 308 with value: 0.7888889312744141.
Trial 417 finished with value: 0.7555555701255798 and parameters: {'n_layers': 2, 'weight_decay': 1.9348308043203042e-05, 'n_units_l0': 32, 'n_units_l1': 7, 'optimizer': 'SGD', 'sgd_opt_learning_rate': 0.0003361651046228932, 'sgd_opt_momentum': 0.05731704630744366}. Best is trial 308 with value: 0.7888889312744141.
Trial 418 finished with value: 0.6666666865348816 and parameters: {'n_layers': 11, 'weight_decay': 1.6164248888454317e-05, 'n_units_l0': 32, 'n_units_l1': 7, 'n_units_l2': 58, 'n_units_l3': 15, 'n_units_l4': 14, 'n_units_l5': 35, 'n_units_l6': 31, 'n_units_l7': 18, 'n_units_l8': 65, 'n_units_l9': 58, 'n_units_l10': 63, 'optimizer': 'SGD', 'sgd_opt_learning_rate': 0.000337418625098717, 'sgd_opt_momentum': 0.0926042436949871}. Best is trial 308 with value: 0.7888889312744141.
Trial 419 finished with value: 0.3777777850627899 and parameters: {'n_layers': 3, 'weight_decay': 2.135182528963476e-05, 'n_units_l0': 35, 'n_units_l1': 6, 'n_units_l2': 49, 'optimizer': 'SGD', 'sgd_opt_learning_rate': 0.0010533560281870335, 'sgd_opt_momentum': 0.0463396202936916}. Best is trial 308 with value: 0.7888889312744141.
Trial 420 finished with value: 0.7333333492279053 and parameters: {'n_layers': 12, 'weight_decay': 1.538466922732836e-05, 'n_units_l0': 32, 'n_units_l1': 7, 'n_units_l2': 22, 'n_units_l3': 48, 'n_units_l4': 13, 'n_units_l5': 46, 'n_units_l6': 17, 'n_units_l7': 84, 'n_units_l8': 16, 'n_units_l9': 14, 'n_units_l10': 103, 'n_units_l11': 64, 'optimizer': 'SGD', 'sgd_opt_learning_rate': 0.000862559993419239, 'sgd_opt_momentum': 0.05420591893546315}. Best is trial 308 with value: 0.7888889312744141.
Trial 421 finished with value: 0.3888889253139496 and parameters: {'n_layers': 2, 'weight_decay': 1.0600143853971316e-05, 'n_units_l0': 29, 'n_units_l1': 7, 'optimizer': 'SGD', 'sgd_opt_learning_rate': 0.0006721468395356851, 'sgd_opt_momentum': 0.06877044726362434}. Best is trial 308 with value: 0.7888889312744141.
Trial 422 finished with value: 0.6333333849906921 and parameters: {'n_layers': 3, 'weight_decay': 2.846313686005917e-05, 'n_units_l0': 34, 'n_units_l1': 6, 'n_units_l2': 57, 'optimizer': 'SGD', 'sgd_opt_learning_rate': 0.00029114609261237924, 'sgd_opt_momentum': 0.029127173968696265}. Best is trial 308 with value: 0.7888889312744141.
Trial 423 finished with value: 0.4777778089046478 and parameters: {'n_layers': 10, 'weight_decay': 3.9076039345655115e-05, 'n_units_l0': 30, 'n_units_l1': 8, 'n_units_l2': 64, 'n_units_l3': 53, 'n_units_l4': 16, 'n_units_l5': 33, 'n_units_l6': 28, 'n_units_l7': 17, 'n_units_l8': 70, 'n_units_l9': 26, 'optimizer': 'SGD', 'sgd_opt_learning_rate': 0.00020142904449435323, 'sgd_opt_momentum': 0.019616083167586392}. Best is trial 308 with value: 0.7888889312744141.
Trial 424 finished with value: 0.6333333849906921 and parameters: {'n_layers': 2, 'weight_decay': 8.403561674893769e-06, 'n_units_l0': 38, 'n_units_l1': 16, 'optimizer': 'SGD', 'sgd_opt_learning_rate': 0.0005428962394343745, 'sgd_opt_momentum': 0.028021202230390587}. Best is trial 308 with value: 0.7888889312744141.
Trial 425 finished with value: 0.5888888835906982 and parameters: {'n_layers': 3, 'weight_decay': 5.1705017437665875e-05, 'n_units_l0': 32, 'n_units_l1': 7, 'n_units_l2': 18, 'optimizer': 'SGD', 'sgd_opt_learning_rate': 0.0003623142590130994, 'sgd_opt_momentum': 0.032991145772278546}. Best is trial 308 with value: 0.7888889312744141.
Trial 426 finished with value: 0.5000000596046448 and parameters: {'n_layers': 1, 'weight_decay': 1.7575178331913923e-05, 'n_units_l0': 27, 'optimizer': 'Adam', 'adam_learning_rate': 0.008062197159827643}. Best is trial 308 with value: 0.7888889312744141.
Trial 427 finished with value: 0.6333333849906921 and parameters: {'n_layers': 13, 'weight_decay': 2.4407367054487067e-05, 'n_units_l0': 18, 'n_units_l1': 7, 'n_units_l2': 9, 'n_units_l3': 91, 'n_units_l4': 17, 'n_units_l5': 30, 'n_units_l6': 19, 'n_units_l7': 15, 'n_units_l8': 59, 'n_units_l9': 17, 'n_units_l10': 75, 'n_units_l11': 37, 'n_units_l12': 28, 'optimizer': 'SGD', 'sgd_opt_learning_rate': 0.0012297096986373735, 'sgd_opt_momentum': 4.261223522500403e-05}. Best is trial 308 with value: 0.7888889312744141.
Trial 428 finished with value: 0.5444444417953491 and parameters: {'n_layers': 14, 'weight_decay': 5.779213540708716e-06, 'n_units_l0': 35, 'n_units_l1': 8, 'n_units_l2': 49, 'n_units_l3': 61, 'n_units_l4': 15, 'n_units_l5': 28, 'n_units_l6': 22, 'n_units_l7': 12, 'n_units_l8': 46, 'n_units_l9': 31, 'n_units_l10': 14, 'n_units_l11': 86, 'n_units_l12': 8, 'n_units_l13': 18, 'optimizer': 'Adam', 'adam_learning_rate': 0.017826520603337278}. Best is trial 308 with value: 0.7888889312744141.
Trial 429 finished with value: 0.5111111402511597 and parameters: {'n_layers': 2, 'weight_decay': 7.305165520638156e-05, 'n_units_l0': 29, 'n_units_l1': 20, 'optimizer': 'SGD', 'sgd_opt_learning_rate': 0.0008240184961841881, 'sgd_opt_momentum': 0.015177132039617992}. Best is trial 308 with value: 0.7888889312744141.
Trial 430 finished with value: 0.5222222208976746 and parameters: {'n_layers': 11, 'weight_decay': 4.995337429196852e-05, 'n_units_l0': 25, 'n_units_l1': 24, 'n_units_l2': 16, 'n_units_l3': 14, 'n_units_l4': 14, 'n_units_l5': 36, 'n_units_l6': 30, 'n_units_l7': 15, 'n_units_l8': 52, 'n_units_l9': 76, 'n_units_l10': 12, 'optimizer': 'Adam', 'adam_learning_rate': 0.001492291241667205}. Best is trial 308 with value: 0.7888889312744141.
Trial 431 finished with value: 0.6666666865348816 and parameters: {'n_layers': 1, 'weight_decay': 1.0538687005907563e-05, 'n_units_l0': 40, 'optimizer': 'SGD', 'sgd_opt_learning_rate': 0.00044465316354558147, 'sgd_opt_momentum': 0.00013965240833466847}. Best is trial 308 with value: 0.7888889312744141.
Trial 432 finished with value: 0.6222222447395325 and parameters: {'n_layers': 7, 'weight_decay': 2.8802167162603608e-09, 'n_units_l0': 32, 'n_units_l1': 6, 'n_units_l2': 53, 'n_units_l3': 79, 'n_units_l4': 17, 'n_units_l5': 51, 'n_units_l6': 24, 'optimizer': 'SGD', 'sgd_opt_learning_rate': 4.875777983288403e-05, 'sgd_opt_momentum': 9.096443878622486e-05}. Best is trial 308 with value: 0.7888889312744141.
Trial 433 finished with value: 0.5111111402511597 and parameters: {'n_layers': 4, 'weight_decay': 3.374514306593215e-05, 'n_units_l0': 38, 'n_units_l1': 7, 'n_units_l2': 20, 'n_units_l3': 18, 'optimizer': 'Adam', 'adam_learning_rate': 0.011749825874168356}. Best is trial 308 with value: 0.7888889312744141.
Trial 434 finished with value: 0.6888888478279114 and parameters: {'n_layers': 6, 'weight_decay': 9.736730386691453e-05, 'n_units_l0': 26, 'n_units_l1': 8, 'n_units_l2': 17, 'n_units_l3': 107, 'n_units_l4': 19, 'n_units_l5': 42, 'optimizer': 'SGD', 'sgd_opt_learning_rate': 0.00026286777220680486, 'sgd_opt_momentum': 0.0002835223256251728}. Best is trial 308 with value: 0.7888889312744141.
Trial 435 finished with value: 0.644444465637207 and parameters: {'n_layers': 12, 'weight_decay': 1.4124980971708153e-05, 'n_units_l0': 42, 'n_units_l1': 14, 'n_units_l2': 10, 'n_units_l3': 4, 'n_units_l4': 16, 'n_units_l5': 30, 'n_units_l6': 21, 'n_units_l7': 19, 'n_units_l8': 98, 'n_units_l9': 98, 'n_units_l10': 67, 'n_units_l11': 13, 'optimizer': 'Adam', 'adam_learning_rate': 0.004696523573643272}. Best is trial 308 with value: 0.7888889312744141.
Trial 436 finished with value: 0.5000000596046448 and parameters: {'n_layers': 10, 'weight_decay': 3.966323146844291e-06, 'n_units_l0': 28, 'n_units_l1': 6, 'n_units_l2': 11, 'n_units_l3': 27, 'n_units_l4': 16, 'n_units_l5': 21, 'n_units_l6': 38, 'n_units_l7': 5, 'n_units_l8': 79, 'n_units_l9': 11, 'optimizer': 'SGD', 'sgd_opt_learning_rate': 8.075500041353105e-05, 'sgd_opt_momentum': 0.0031155488171335254}. Best is trial 308 with value: 0.7888889312744141.
Trial 437 finished with value: 0.5666666626930237 and parameters: {'n_layers': 12, 'weight_decay': 0.00013652155993190677, 'n_units_l0': 30, 'n_units_l1': 7, 'n_units_l2': 15, 'n_units_l3': 56, 'n_units_l4': 18, 'n_units_l5': 26, 'n_units_l6': 33, 'n_units_l7': 9, 'n_units_l8': 72, 'n_units_l9': 9, 'n_units_l10': 58, 'n_units_l11': 75, 'optimizer': 'RMSprop', 'rmsprop_learning_rate': 0.003083205170332527, 'rmsprop_weight_decay': 0.9172585180909003, 'rmsprop_momentum': 8.690244842711127e-05}. Best is trial 308 with value: 0.7888889312744141.
Trial 438 finished with value: 0.6666666865348816 and parameters: {'n_layers': 11, 'weight_decay': 6.694944708717086e-06, 'n_units_l0': 34, 'n_units_l1': 15, 'n_units_l2': 8, 'n_units_l3': 93, 'n_units_l4': 13, 'n_units_l5': 32, 'n_units_l6': 126, 'n_units_l7': 42, 'n_units_l8': 57, 'n_units_l9': 15, 'n_units_l10': 15, 'optimizer': 'Adam', 'adam_learning_rate': 0.008789701867586968}. Best is trial 308 with value: 0.7888889312744141.
Trial 439 finished with value: 0.5555555820465088 and parameters: {'n_layers': 6, 'weight_decay': 4.5899462970850535e-05, 'n_units_l0': 23, 'n_units_l1': 8, 'n_units_l2': 6, 'n_units_l3': 86, 'n_units_l4': 15, 'n_units_l5': 27, 'optimizer': 'SGD', 'sgd_opt_learning_rate': 0.00012168876403184245, 'sgd_opt_momentum': 5.5110610588898316e-05}. Best is trial 308 with value: 0.7888889312744141.
Trial 440 finished with value: 0.5888888835906982 and parameters: {'n_layers': 7, 'weight_decay': 6.825144220305067e-05, 'n_units_l0': 37, 'n_units_l1': 7, 'n_units_l2': 57, 'n_units_l3': 65, 'n_units_l4': 19, 'n_units_l5': 22, 'n_units_l6': 34, 'optimizer': 'RMSprop', 'rmsprop_learning_rate': 0.0011023492913486903, 'rmsprop_weight_decay': 0.92076651055655, 'rmsprop_momentum': 3.3216928361461546e-05}. Best is trial 308 with value: 0.7888889312744141.
Trial 441 finished with value: 0.5777778029441833 and parameters: {'n_layers': 8, 'weight_decay': 0.0001723583266324221, 'n_units_l0': 24, 'n_units_l1': 8, 'n_units_l2': 7, 'n_units_l3': 7, 'n_units_l4': 20, 'n_units_l5': 29, 'n_units_l6': 18, 'n_units_l7': 113, 'optimizer': 'RMSprop', 'rmsprop_learning_rate': 0.0014380438616810264, 'rmsprop_weight_decay': 0.88892629471667, 'rmsprop_momentum': 0.005899727666363097}. Best is trial 308 with value: 0.7888889312744141.
Trial 442 finished with value: 0.5444445013999939 and parameters: {'n_layers': 9, 'weight_decay': 2.417948460475426e-05, 'n_units_l0': 69, 'n_units_l1': 6, 'n_units_l2': 52, 'n_units_l3': 11, 'n_units_l4': 14, 'n_units_l5': 25, 'n_units_l6': 16, 'n_units_l7': 36, 'n_units_l8': 93, 'optimizer': 'Adam', 'adam_learning_rate': 0.08088846209576234}. Best is trial 308 with value: 0.7888889312744141.
Trial 443 finished with value: 0.5555555820465088 and parameters: {'n_layers': 13, 'weight_decay': 8.636874619724814e-06, 'n_units_l0': 31, 'n_units_l1': 8, 'n_units_l2': 68, 'n_units_l3': 75, 'n_units_l4': 18, 'n_units_l5': 4, 'n_units_l6': 15, 'n_units_l7': 7, 'n_units_l8': 20, 'n_units_l9': 57, 'n_units_l10': 36, 'n_units_l11': 20, 'n_units_l12': 13, 'optimizer': 'SGD', 'sgd_opt_learning_rate': 0.0006801748157487158, 'sgd_opt_momentum': 0.0023301435555450442}. Best is trial 308 with value: 0.7888889312744141.
Trial 444 finished with value: 0.7111110687255859 and parameters: {'n_layers': 1, 'weight_decay': 8.14197126646819e-05, 'n_units_l0': 112, 'optimizer': 'RMSprop', 'rmsprop_learning_rate': 0.0017862963426163408, 'rmsprop_weight_decay': 0.9253587967978045, 'rmsprop_momentum': 0.00017588682486560582}. Best is trial 308 with value: 0.7888889312744141.
Trial 445 finished with value: 0.699999988079071 and parameters: {'n_layers': 14, 'weight_decay': 3.402971881804255e-05, 'n_units_l0': 43, 'n_units_l1': 7, 'n_units_l2': 15, 'n_units_l3': 52, 'n_units_l4': 15, 'n_units_l5': 39, 'n_units_l6': 26, 'n_units_l7': 17, 'n_units_l8': 63, 'n_units_l9': 51, 'n_units_l10': 10, 'n_units_l11': 15, 'n_units_l12': 26, 'n_units_l13': 13, 'optimizer': 'SGD', 'sgd_opt_learning_rate': 0.0005174196740268148, 'sgd_opt_momentum': 0.002982688101154321}. Best is trial 308 with value: 0.7888889312744141.
Trial 446 finished with value: 0.4888889491558075 and parameters: {'n_layers': 10, 'weight_decay': 5.824717250819481e-06, 'n_units_l0': 26, 'n_units_l1': 6, 'n_units_l2': 4, 'n_units_l3': 61, 'n_units_l4': 17, 'n_units_l5': 33, 'n_units_l6': 40, 'n_units_l7': 11, 'n_units_l8': 14, 'n_units_l9': 63, 'optimizer': 'Adam', 'adam_learning_rate': 0.02225912482758779}. Best is trial 308 with value: 0.7888889312744141.
Trial 447 finished with value: 0.5222222208976746 and parameters: {'n_layers': 11, 'weight_decay': 5.937022684797061e-05, 'n_units_l0': 35, 'n_units_l1': 4, 'n_units_l2': 9, 'n_units_l3': 116, 'n_units_l4': 16, 'n_units_l5': 26, 'n_units_l6': 37, 'n_units_l7': 21, 'n_units_l8': 38, 'n_units_l9': 44, 'n_units_l10': 4, 'optimizer': 'RMSprop', 'rmsprop_learning_rate': 0.08354190292516821, 'rmsprop_weight_decay': 0.8932679498651226, 'rmsprop_momentum': 0.00011361741892351601}. Best is trial 308 with value: 0.7888889312744141.
Trial 448 finished with value: 0.6333333849906921 and parameters: {'n_layers': 12, 'weight_decay': 3.92058518493835e-06, 'n_units_l0': 22, 'n_units_l1': 9, 'n_units_l2': 12, 'n_units_l3': 102, 'n_units_l4': 14, 'n_units_l5': 30, 'n_units_l6': 31, 'n_units_l7': 16, 'n_units_l8': 42, 'n_units_l9': 28, 'n_units_l10': 121, 'n_units_l11': 44, 'optimizer': 'RMSprop', 'rmsprop_learning_rate': 0.0009818838461773125, 'rmsprop_weight_decay': 0.91068553707978, 'rmsprop_momentum': 0.003147323883486965}. Best is trial 308 with value: 0.7888889312744141.
Trial 449 finished with value: 0.6333333849906921 and parameters: {'n_layers': 5, 'weight_decay': 4.214491170788477e-08, 'n_units_l0': 19, 'n_units_l1': 8, 'n_units_l2': 17, 'n_units_l3': 81, 'n_units_l4': 25, 'optimizer': 'SGD', 'sgd_opt_learning_rate': 0.0009736652675689539, 'sgd_opt_momentum': 0.0631924349170632}. Best is trial 308 with value: 0.7888889312744141.
Trial 450 finished with value: 0.36666667461395264 and parameters: {'n_layers': 8, 'weight_decay': 1.277306747189698e-05, 'n_units_l0': 39, 'n_units_l1': 7, 'n_units_l2': 10, 'n_units_l3': 71, 'n_units_l4': 13, 'n_units_l5': 23, 'n_units_l6': 23, 'n_units_l7': 14, 'optimizer': 'Adam', 'adam_learning_rate': 0.006682296095988351}. Best is trial 308 with value: 0.7888889312744141.
Trial 451 finished with value: 0.6222222447395325 and parameters: {'n_layers': 9, 'weight_decay': 0.00010307080447423396, 'n_units_l0': 91, 'n_units_l1': 9, 'n_units_l2': 7, 'n_units_l3': 57, 'n_units_l4': 21, 'n_units_l5': 36, 'n_units_l6': 20, 'n_units_l7': 20, 'n_units_l8': 117, 'optimizer': 'RMSprop', 'rmsprop_learning_rate': 0.0007978729563731706, 'rmsprop_weight_decay': 0.8507266644396914, 'rmsprop_momentum': 0.00046126237060884596}. Best is trial 308 with value: 0.7888889312744141.
Trial 452 finished with value: 0.5777778029441833 and parameters: {'n_layers': 6, 'weight_decay': 7.288542595795521e-09, 'n_units_l0': 29, 'n_units_l1': 6, 'n_units_l2': 14, 'n_units_l3': 20, 'n_units_l4': 17, 'n_units_l5': 28, 'optimizer': 'SGD', 'sgd_opt_learning_rate': 0.0015455374893621494, 'sgd_opt_momentum': 0.005533243466804697}. Best is trial 308 with value: 0.7888889312744141.
Trial 453 finished with value: 0.4888888895511627 and parameters: {'n_layers': 7, 'weight_decay': 4.577435456633432e-05, 'n_units_l0': 33, 'n_units_l1': 8, 'n_units_l2': 16, 'n_units_l3': 48, 'n_units_l4': 18, 'n_units_l5': 25, 'n_units_l6': 34, 'optimizer': 'RMSprop', 'rmsprop_learning_rate': 0.027685132796691117, 'rmsprop_weight_decay': 0.9324986008891754, 'rmsprop_momentum': 0.00010093744417559454}. Best is trial 308 with value: 0.7888889312744141.
Trial 454 finished with value: 0.7666666507720947 and parameters: {'n_layers': 4, 'weight_decay': 2.210000977214842e-05, 'n_units_l0': 28, 'n_units_l1': 7, 'n_units_l2': 60, 'n_units_l3': 10, 'optimizer': 'Adam', 'adam_learning_rate': 0.00011093007171122083}. Best is trial 308 with value: 0.7888889312744141.
Trial 455 finished with value: 0.5333333611488342 and parameters: {'n_layers': 2, 'weight_decay': 3.283523365954265e-05, 'n_units_l0': 27, 'n_units_l1': 7, 'optimizer': 'Adam', 'adam_learning_rate': 0.0005786317964910967}. Best is trial 308 with value: 0.7888889312744141.
Trial 456 finished with value: 0.6333333849906921 and parameters: {'n_layers': 4, 'weight_decay': 1.8137757054356063e-05, 'n_units_l0': 28, 'n_units_l1': 7, 'n_units_l2': 61, 'n_units_l3': 16, 'optimizer': 'Adam', 'adam_learning_rate': 0.0001048906997329284}. Best is trial 308 with value: 0.7888889312744141.
Trial 457 finished with value: 0.6777777671813965 and parameters: {'n_layers': 5, 'weight_decay': 3.2048559711492244e-05, 'n_units_l0': 25, 'n_units_l1': 6, 'n_units_l2': 66, 'n_units_l3': 14, 'n_units_l4': 15, 'optimizer': 'Adam', 'adam_learning_rate': 0.0002672117266400736}. Best is trial 308 with value: 0.7888889312744141.
Trial 458 finished with value: 0.5000000596046448 and parameters: {'n_layers': 13, 'weight_decay': 1.130267571086183e-05, 'n_units_l0': 30, 'n_units_l1': 7, 'n_units_l2': 55, 'n_units_l3': 10, 'n_units_l4': 16, 'n_units_l5': 20, 'n_units_l6': 28, 'n_units_l7': 16, 'n_units_l8': 49, 'n_units_l9': 16, 'n_units_l10': 53, 'n_units_l11': 93, 'n_units_l12': 5, 'optimizer': 'Adam', 'adam_learning_rate': 0.0008846003739643586}. Best is trial 308 with value: 0.7888889312744141.
Trial 459 finished with value: 0.6333333849906921 and parameters: {'n_layers': 5, 'weight_decay': 2.0083655094987056e-05, 'n_units_l0': 32, 'n_units_l1': 7, 'n_units_l2': 71, 'n_units_l3': 13, 'n_units_l4': 19, 'optimizer': 'Adam', 'adam_learning_rate': 0.00013226873831984848}. Best is trial 308 with value: 0.7888889312744141.
Trial 460 finished with value: 0.5333333611488342 and parameters: {'n_layers': 3, 'weight_decay': 2.245001400209929e-05, 'n_units_l0': 27, 'n_units_l1': 6, 'n_units_l2': 61, 'optimizer': 'Adam', 'adam_learning_rate': 0.0004430797992765383}. Best is trial 308 with value: 0.7888889312744141.
Trial 461 finished with value: 0.4555555582046509 and parameters: {'n_layers': 4, 'weight_decay': 4.1432464889178476e-05, 'n_units_l0': 25, 'n_units_l1': 8, 'n_units_l2': 62, 'n_units_l3': 12, 'optimizer': 'Adam', 'adam_learning_rate': 7.9519738041309e-05}. Best is trial 308 with value: 0.7888889312744141.
Trial 462 finished with value: 0.6333333849906921 and parameters: {'n_layers': 5, 'weight_decay': 6.408592044875876e-05, 'n_units_l0': 23, 'n_units_l1': 7, 'n_units_l2': 57, 'n_units_l3': 4, 'n_units_l4': 114, 'optimizer': 'Adam', 'adam_learning_rate': 5.683416681992556e-05}. Best is trial 308 with value: 0.7888889312744141.
Trial 463 finished with value: 0.7444444298744202 and parameters: {'n_layers': 4, 'weight_decay': 7.949211167171282e-06, 'n_units_l0': 30, 'n_units_l1': 7, 'n_units_l2': 52, 'n_units_l3': 9, 'optimizer': 'Adam', 'adam_learning_rate': 4.1386448598496904e-05}. Best is trial 308 with value: 0.7888889312744141.
Trial 464 finished with value: 0.4777778089046478 and parameters: {'n_layers': 4, 'weight_decay': 8.365309472356008e-06, 'n_units_l0': 31, 'n_units_l1': 7, 'n_units_l2': 41, 'n_units_l3': 10, 'optimizer': 'Adam', 'adam_learning_rate': 2.090497870428358e-05}. Best is trial 308 with value: 0.7888889312744141.
Trial 465 finished with value: 0.4555555582046509 and parameters: {'n_layers': 5, 'weight_decay': 5.66722732199362e-06, 'n_units_l0': 29, 'n_units_l1': 6, 'n_units_l2': 46, 'n_units_l3': 8, 'n_units_l4': 14, 'optimizer': 'Adam', 'adam_learning_rate': 4.2996691504568314e-05}. Best is trial 308 with value: 0.7888889312744141.
Trial 466 finished with value: 0.6333333849906921 and parameters: {'n_layers': 3, 'weight_decay': 1.0924097534995079e-05, 'n_units_l0': 36, 'n_units_l1': 7, 'n_units_l2': 51, 'optimizer': 'Adam', 'adam_learning_rate': 1.0944735691637773e-05}. Best is trial 308 with value: 0.7888889312744141.
Trial 467 finished with value: 0.6333333849906921 and parameters: {'n_layers': 4, 'weight_decay': 6.884203228830963e-06, 'n_units_l0': 33, 'n_units_l1': 7, 'n_units_l2': 49, 'n_units_l3': 11, 'optimizer': 'Adam', 'adam_learning_rate': 1.2814470154215037e-05}. Best is trial 308 with value: 0.7888889312744141.
Trial 468 finished with value: 0.6222222447395325 and parameters: {'n_layers': 3, 'weight_decay': 1.6342767189404484e-05, 'n_units_l0': 30, 'n_units_l1': 6, 'n_units_l2': 58, 'optimizer': 'Adam', 'adam_learning_rate': 2.2903631056569387e-05}. Best is trial 308 with value: 0.7888889312744141.
Trial 469 finished with value: 0.5777778029441833 and parameters: {'n_layers': 4, 'weight_decay': 4.636304495131282e-06, 'n_units_l0': 35, 'n_units_l1': 8, 'n_units_l2': 53, 'n_units_l3': 7, 'optimizer': 'Adam', 'adam_learning_rate': 3.5107683887851265e-05}. Best is trial 308 with value: 0.7888889312744141.
Trial 470 finished with value: 0.644444465637207 and parameters: {'n_layers': 4, 'weight_decay': 1.3109578029395969e-05, 'n_units_l0': 28, 'n_units_l1': 7, 'n_units_l2': 44, 'n_units_l3': 9, 'optimizer': 'Adam', 'adam_learning_rate': 1.5121662908021854e-05}. Best is trial 308 with value: 0.7888889312744141.
