Trial 368 finished with value: 0.6888888478279114 and parameters: {'n_layers': 5, 'weight_decay': 5.336290093615815e-05, 'n_units_l0': 67, 'n_units_l1': 14, 'n_units_l2': 12, 'n_units_l3': 73, 'n_units_l4': 17, 'optimizer': 'RMSprop', 'rmsprop_learning_rate': 0.002919807390590761, 'rmsprop_weight_decay': 0.8745098184901072, 'rmsprop_momentum': 0.0016010358412996363}. Best is trial 308 with value: 0.7888889312744141.
Trial 369 finished with value: 0.5444445013999939 and parameters: {'n_layers': 8, 'weight_decay': 7.630202220263206e-05, 'n_units_l0': 58, 'n_units_l1': 8, 'n_units_l2': 38, 'n_units_l3': 82, 'n_units_l4': 19, 'n_units_l5': 66, 'n_units_l6': 39, 'n_units_l7': 20, 'optimizer': 'RMSprop', 'rmsprop_learning_rate': 0.0038931044574215985, 'rmsprop_weight_decay': 0.8644920526149171, 'rmsprop_momentum': 0.00024031104663350126}. Best is trial 308 with value: 0.7888889312744141.
Trial 370 finished with value: 0.5222222208976746 and parameters: {'n_layers': 9, 'weight_decay': 0.00011399912337394035, 'n_units_l0': 42, 'n_units_l1': 9, 'n_units_l2': 14, 'n_units_l3': 64, 'n_units_l4': 21, 'n_units_l5': 33, 'n_units_l6': 44, 'n_units_l7': 21, 'n_units_l8': 68, 'optimizer': 'RMSprop', 'rmsprop_learning_rate': 0.0023911051772887494, 'rmsprop_weight_decay': 0.8906656338303649, 'rmsprop_momentum': 0.00017253569167639381}. Best is trial 308 with value: 0.7888889312744141.
Trial 371 finished with value: 0.42222222685813904 and parameters: {'n_layers': 6, 'weight_decay': 6.19683099278454e-06, 'n_units_l0': 51, 'n_units_l1': 8, 'n_units_l2': 13, 'n_units_l3': 73, 'n_units_l4': 24, 'n_units_l5': 30, 'optimizer': 'RMSprop', 'rmsprop_learning_rate': 0.008956535321553213, 'rmsprop_weight_decay': 0.8588155327602996, 'rmsprop_momentum': 0.00010369147060618803}. Best is trial 308 with value: 0.7888889312744141.
Trial 372 finished with value: 0.7111111283302307 and parameters: {'n_layers': 8, 'weight_decay': 4.327634126215427e-09, 'n_units_l0': 21, 'n_units_l1': 10, 'n_units_l2': 15, 'n_units_l3': 19, 'n_units_l4': 17, 'n_units_l5': 31, 'n_units_l6': 12, 'n_units_l7': 26, 'optimizer': 'RMSprop', 'rmsprop_learning_rate': 0.004588905196889174, 'rmsprop_weight_decay': 0.8687599843516634, 'rmsprop_momentum': 0.00042788503258565924}. Best is trial 308 with value: 0.7888889312744141.
Trial 373 finished with value: 0.6888888478279114 and parameters: {'n_layers': 9, 'weight_decay': 1.5353771977026125e-06, 'n_units_l0': 44, 'n_units_l1': 9, 'n_units_l2': 13, 'n_units_l3': 58, 'n_units_l4': 22, 'n_units_l5': 55, 'n_units_l6': 65, 'n_units_l7': 23, 'n_units_l8': 76, 'optimizer': 'RMSprop', 'rmsprop_learning_rate': 0.006252324079129548, 'rmsprop_weight_decay': 0.8619260905063456, 'rmsprop_momentum': 0.0006792964621281787}. Best is trial 308 with value: 0.7888889312744141.
Trial 374 finished with value: 0.41111111640930176 and parameters: {'n_layers': 5, 'weight_decay': 4.610392907957894e-05, 'n_units_l0': 23, 'n_units_l1': 10, 'n_units_l2': 11, 'n_units_l3': 7, 'n_units_l4': 18, 'optimizer': 'RMSprop', 'rmsprop_learning_rate': 0.003362013256328225, 'rmsprop_weight_decay': 0.8875481602090103, 'rmsprop_momentum': 0.00029350081470830774}. Best is trial 308 with value: 0.7888889312744141.
Trial 375 finished with value: 0.5888888835906982 and parameters: {'n_layers': 4, 'weight_decay': 6.337221223587098e-05, 'n_units_l0': 61, 'n_units_l1': 11, 'n_units_l2': 7, 'n_units_l3': 10, 'optimizer': 'RMSprop', 'rmsprop_learning_rate': 0.0012999852715631583, 'rmsprop_weight_decay': 0.8774469918779514, 'rmsprop_momentum': 0.0005355557602369755}. Best is trial 308 with value: 0.7888889312744141.
Trial 376 finished with value: 0.699999988079071 and parameters: {'n_layers': 7, 'weight_decay': 0.00012583507637662668, 'n_units_l0': 20, 'n_units_l1': 8, 'n_units_l2': 10, 'n_units_l3': 38, 'n_units_l4': 19, 'n_units_l5': 28, 'n_units_l6': 33, 'optimizer': 'RMSprop', 'rmsprop_learning_rate': 0.002630043228674745, 'rmsprop_weight_decay': 0.8544481933338435, 'rmsprop_momentum': 0.0001294730728425021}. Best is trial 308 with value: 0.7888889312744141.
Trial 377 finished with value: 0.7777778506278992 and parameters: {'n_layers': 8, 'weight_decay': 4.235669082013475e-07, 'n_units_l0': 24, 'n_units_l1': 7, 'n_units_l2': 5, 'n_units_l3': 23, 'n_units_l4': 14, 'n_units_l5': 25, 'n_units_l6': 36, 'n_units_l7': 19, 'optimizer': 'RMSprop', 'rmsprop_learning_rate': 0.012273377001396255, 'rmsprop_weight_decay': 0.8710830586151498, 'rmsprop_momentum': 0.0014189464780283922}. Best is trial 308 with value: 0.7888889312744141.
Trial 378 finished with value: 0.7333333492279053 and parameters: {'n_layers': 9, 'weight_decay': 3.5518712653374886e-07, 'n_units_l0': 24, 'n_units_l1': 7, 'n_units_l2': 5, 'n_units_l3': 66, 'n_units_l4': 12, 'n_units_l5': 24, 'n_units_l6': 36, 'n_units_l7': 19, 'n_units_l8': 85, 'optimizer': 'RMSprop', 'rmsprop_learning_rate': 0.010583070700146276, 'rmsprop_weight_decay': 0.8720606275242719, 'rmsprop_momentum': 0.0014153467195159258}. Best is trial 308 with value: 0.7888889312744141.
Trial 379 finished with value: 0.4555555582046509 and parameters: {'n_layers': 9, 'weight_decay': 4.068166037596032e-07, 'n_units_l0': 22, 'n_units_l1': 7, 'n_units_l2': 15, 'n_units_l3': 66, 'n_units_l4': 11, 'n_units_l5': 25, 'n_units_l6': 29, 'n_units_l7': 19, 'n_units_l8': 82, 'optimizer': 'Adam', 'adam_learning_rate': 0.003617593680817787}. Best is trial 308 with value: 0.7888889312744141.
Trial 380 finished with value: 0.644444465637207 and parameters: {'n_layers': 9, 'weight_decay': 4.0587819213300046e-07, 'n_units_l0': 74, 'n_units_l1': 7, 'n_units_l2': 5, 'n_units_l3': 61, 'n_units_l4': 12, 'n_units_l5': 24, 'n_units_l6': 39, 'n_units_l7': 17, 'n_units_l8': 87, 'optimizer': 'RMSprop', 'rmsprop_learning_rate': 0.03741430800377632, 'rmsprop_weight_decay': 0.8808007746517295, 'rmsprop_momentum': 0.0010803664527760906}. Best is trial 308 with value: 0.7888889312744141.
Trial 381 finished with value: 0.5000000596046448 and parameters: {'n_layers': 6, 'weight_decay': 5.596880161485801e-07, 'n_units_l0': 23, 'n_units_l1': 7, 'n_units_l2': 14, 'n_units_l3': 70, 'n_units_l4': 13, 'n_units_l5': 28, 'optimizer': 'RMSprop', 'rmsprop_learning_rate': 0.01727353902767859, 'rmsprop_weight_decay': 0.8722607229772243, 'rmsprop_momentum': 0.001888259461184923}. Best is trial 308 with value: 0.7888889312744141.
Trial 382 finished with value: 0.4444444179534912 and parameters: {'n_layers': 10, 'weight_decay': 3.636085870852889e-07, 'n_units_l0': 25, 'n_units_l1': 7, 'n_units_l2': 5, 'n_units_l3': 29, 'n_units_l4': 9, 'n_units_l5': 93, 'n_units_l6': 34, 'n_units_l7': 19, 'n_units_l8': 71, 'n_units_l9': 11, 'optimizer': 'Adam', 'adam_learning_rate': 0.0019085758109594212}. Best is trial 308 with value: 0.7888889312744141.
Trial 383 finished with value: 0.555555522441864 and parameters: {'n_layers': 9, 'weight_decay': 5.713413010222854e-07, 'n_units_l0': 24, 'n_units_l1': 8, 'n_units_l2': 11, 'n_units_l3': 84, 'n_units_l4': 14, 'n_units_l5': 25, 'n_units_l6': 36, 'n_units_l7': 28, 'n_units_l8': 63, 'optimizer': 'RMSprop', 'rmsprop_learning_rate': 0.022381796822985304, 'rmsprop_weight_decay': 0.8657579183132459, 'rmsprop_momentum': 0.0013845163308204773}. Best is trial 308 with value: 0.7888889312744141.
Trial 384 finished with value: 0.5999999642372131 and parameters: {'n_layers': 9, 'weight_decay': 7.969031758183911e-07, 'n_units_l0': 48, 'n_units_l1': 7, 'n_units_l2': 13, 'n_units_l3': 66, 'n_units_l4': 15, 'n_units_l5': 23, 'n_units_l6': 44, 'n_units_l7': 22, 'n_units_l8': 86, 'optimizer': 'RMSprop', 'rmsprop_learning_rate': 0.0140812686658628, 'rmsprop_weight_decay': 0.8764207844696557, 'rmsprop_momentum': 0.0025637264789301695}. Best is trial 308 with value: 0.7888889312744141.
Trial 385 finished with value: 0.6111111640930176 and parameters: {'n_layers': 8, 'weight_decay': 2.8884179200856506e-07, 'n_units_l0': 41, 'n_units_l1': 8, 'n_units_l2': 14, 'n_units_l3': 59, 'n_units_l4': 13, 'n_units_l5': 26, 'n_units_l6': 27, 'n_units_l7': 20, 'optimizer': 'Adam', 'adam_learning_rate': 0.0011296799323687486}. Best is trial 308 with value: 0.7888889312744141.
Trial 386 finished with value: 0.6222222447395325 and parameters: {'n_layers': 13, 'weight_decay': 5.060207979862168e-07, 'n_units_l0': 24, 'n_units_l1': 6, 'n_units_l2': 12, 'n_units_l3': 23, 'n_units_l4': 11, 'n_units_l5': 29, 'n_units_l6': 30, 'n_units_l7': 17, 'n_units_l8': 52, 'n_units_l9': 85, 'n_units_l10': 60, 'n_units_l11': 59, 'n_units_l12': 70, 'optimizer': 'RMSprop', 'rmsprop_learning_rate': 0.01158060884999399, 'rmsprop_weight_decay': 0.8702043204478166, 'rmsprop_momentum': 0.0015057897772888886}. Best is trial 308 with value: 0.7888889312744141.
Trial 387 finished with value: 0.5777778029441833 and parameters: {'n_layers': 6, 'weight_decay': 1.144038617402685e-06, 'n_units_l0': 54, 'n_units_l1': 7, 'n_units_l2': 6, 'n_units_l3': 16, 'n_units_l4': 12, 'n_units_l5': 22, 'optimizer': 'Adam', 'adam_learning_rate': 0.0001769443468778653}. Best is trial 308 with value: 0.7888889312744141.
Trial 388 finished with value: 0.5777778029441833 and parameters: {'n_layers': 9, 'weight_decay': 7.088150844675995e-07, 'n_units_l0': 27, 'n_units_l1': 8, 'n_units_l2': 15, 'n_units_l3': 77, 'n_units_l4': 68, 'n_units_l5': 28, 'n_units_l6': 41, 'n_units_l7': 18, 'n_units_l8': 74, 'optimizer': 'RMSprop', 'rmsprop_learning_rate': 0.010271871979945932, 'rmsprop_weight_decay': 0.9064799634960241, 'rmsprop_momentum': 0.0009709814799585765}. Best is trial 308 with value: 0.7888889312744141.
Trial 389 finished with value: 0.5888888835906982 and parameters: {'n_layers': 8, 'weight_decay': 3.3814905954459583e-07, 'n_units_l0': 45, 'n_units_l1': 6, 'n_units_l2': 10, 'n_units_l3': 55, 'n_units_l4': 10, 'n_units_l5': 24, 'n_units_l6': 35, 'n_units_l7': 21, 'optimizer': 'RMSprop', 'rmsprop_learning_rate': 0.019013261247896426, 'rmsprop_weight_decay': 0.8662710114965864, 'rmsprop_momentum': 0.00019199695122678977}. Best is trial 308 with value: 0.7888889312744141.
Trial 390 finished with value: 0.5000000596046448 and parameters: {'n_layers': 5, 'weight_decay': 1.0553305152543398e-06, 'n_units_l0': 20, 'n_units_l1': 8, 'n_units_l2': 16, 'n_units_l3': 64, 'n_units_l4': 12, 'optimizer': 'Adam', 'adam_learning_rate': 0.04298604658876782}. Best is trial 308 with value: 0.7888889312744141.
Trial 391 finished with value: 0.7333333492279053 and parameters: {'n_layers': 7, 'weight_decay': 2.0364134965114414e-06, 'n_units_l0': 25, 'n_units_l1': 7, 'n_units_l2': 46, 'n_units_l3': 71, 'n_units_l4': 16, 'n_units_l5': 27, 'n_units_l6': 32, 'optimizer': 'RMSprop', 'rmsprop_learning_rate': 0.012424891290783365, 'rmsprop_weight_decay': 0.8624021434960862, 'rmsprop_momentum': 0.001181092392694423}. Best is trial 308 with value: 0.7888889312744141.
Trial 392 finished with value: 0.5111111402511597 and parameters: {'n_layers': 10, 'weight_decay': 8.346211303184981e-07, 'n_units_l0': 40, 'n_units_l1': 12, 'n_units_l2': 50, 'n_units_l3': 25, 'n_units_l4': 15, 'n_units_l5': 70, 'n_units_l6': 38, 'n_units_l7': 33, 'n_units_l8': 57, 'n_units_l9': 71, 'optimizer': 'RMSprop', 'rmsprop_learning_rate': 0.00831227537546964, 'rmsprop_weight_decay': 0.8721381462735394, 'rmsprop_momentum': 0.00232275250596595}. Best is trial 308 with value: 0.7888889312744141.
Trial 393 finished with value: 0.5666666626930237 and parameters: {'n_layers': 9, 'weight_decay': 0.0001469647474664541, 'n_units_l0': 28, 'n_units_l1': 7, 'n_units_l2': 14, 'n_units_l3': 75, 'n_units_l4': 14, 'n_units_l5': 26, 'n_units_l6': 43, 'n_units_l7': 25, 'n_units_l8': 78, 'optimizer': 'Adam', 'adam_learning_rate': 0.06462542541951799}. Best is trial 308 with value: 0.7888889312744141.
Trial 394 finished with value: 0.41111111640930176 and parameters: {'n_layers': 13, 'weight_decay': 1.5438873441732743e-06, 'n_units_l0': 21, 'n_units_l1': 9, 'n_units_l2': 13, 'n_units_l3': 81, 'n_units_l4': 13, 'n_units_l5': 76, 'n_units_l6': 37, 'n_units_l7': 20, 'n_units_l8': 5, 'n_units_l9': 97, 'n_units_l10': 16, 'n_units_l11': 35, 'n_units_l12': 9, 'optimizer': 'RMSprop', 'rmsprop_learning_rate': 0.00725677301816804, 'rmsprop_weight_decay': 0.8838900258630202, 'rmsprop_momentum': 0.0003482651228213254}. Best is trial 308 with value: 0.7888889312744141.
Trial 395 finished with value: 0.6111111640930176 and parameters: {'n_layers': 8, 'weight_decay': 8.40449539355398e-05, 'n_units_l0': 43, 'n_units_l1': 13, 'n_units_l2': 5, 'n_units_l3': 21, 'n_units_l4': 17, 'n_units_l5': 32, 'n_units_l6': 49, 'n_units_l7': 19, 'optimizer': 'RMSprop', 'rmsprop_learning_rate': 0.03148557160307238, 'rmsprop_weight_decay': 0.8599769165447815, 'rmsprop_momentum': 0.0008136025896332465}. Best is trial 308 with value: 0.7888889312744141.
Trial 396 finished with value: 0.6222222447395325 and parameters: {'n_layers': 4, 'weight_decay': 4.138053458898692e-07, 'n_units_l0': 50, 'n_units_l1': 6, 'n_units_l2': 17, 'n_units_l3': 69, 'optimizer': 'Adam', 'adam_learning_rate': 0.02598697994446158}. Best is trial 308 with value: 0.7888889312744141.
Trial 397 finished with value: 0.5111111402511597 and parameters: {'n_layers': 10, 'weight_decay': 1.907353831657575e-06, 'n_units_l0': 26, 'n_units_l1': 8, 'n_units_l2': 11, 'n_units_l3': 60, 'n_units_l4': 17, 'n_units_l5': 22, 'n_units_l6': 19, 'n_units_l7': 16, 'n_units_l8': 91, 'n_units_l9': 17, 'optimizer': 'RMSprop', 'rmsprop_learning_rate': 0.05771200478384554, 'rmsprop_weight_decay': 0.9014567739620101, 'rmsprop_momentum': 0.0001423145566994375}. Best is trial 308 with value: 0.7888889312744141.
Trial 398 finished with value: 0.5777778029441833 and parameters: {'n_layers': 7, 'weight_decay': 6.502894825712233e-07, 'n_units_l0': 38, 'n_units_l1': 30, 'n_units_l2': 12, 'n_units_l3': 64, 'n_units_l4': 14, 'n_units_l5': 29, 'n_units_l6': 40, 'optimizer': 'Adam', 'adam_learning_rate': 0.013604593960640714}. Best is trial 308 with value: 0.7888889312744141.
Trial 399 finished with value: 0.6888888478279114 and parameters: {'n_layers': 8, 'weight_decay': 6.509281416680874e-05, 'n_units_l0': 24, 'n_units_l1': 7, 'n_units_l2': 15, 'n_units_l3': 17, 'n_units_l4': 15, 'n_units_l5': 106, 'n_units_l6': 60, 'n_units_l7': 24, 'optimizer': 'RMSprop', 'rmsprop_learning_rate': 0.005221395374476505, 'rmsprop_weight_decay': 0.8670170103908434, 'rmsprop_momentum': 0.0018206776999537605}. Best is trial 308 with value: 0.7888889312744141.
Trial 400 finished with value: 0.4333333671092987 and parameters: {'n_layers': 6, 'weight_decay': 0.0001121915184602158, 'n_units_l0': 28, 'n_units_l1': 9, 'n_units_l2': 9, 'n_units_l3': 55, 'n_units_l4': 16, 'n_units_l5': 24, 'optimizer': 'RMSprop', 'rmsprop_learning_rate': 0.01473490435837204, 'rmsprop_weight_decay': 0.8805611791107173, 'rmsprop_momentum': 0.0002460693039002789}. Best is trial 308 with value: 0.7888889312744141.
Trial 401 finished with value: 0.5333333611488342 and parameters: {'n_layers': 14, 'weight_decay': 2.55190063168285e-06, 'n_units_l0': 46, 'n_units_l1': 7, 'n_units_l2': 68, 'n_units_l3': 80, 'n_units_l4': 18, 'n_units_l5': 25, 'n_units_l6': 35, 'n_units_l7': 18, 'n_units_l8': 107, 'n_units_l9': 10, 'n_units_l10': 18, 'n_units_l11': 102, 'n_units_l12': 103, 'n_units_l13': 4, 'optimizer': 'Adam', 'adam_learning_rate': 0.0023240546003478195}. Best is trial 308 with value: 0.7888889312744141.
Trial 402 finished with value: 0.6666666865348816 and parameters: {'n_layers': 5, 'weight_decay': 1.2421127647167313e-05, 'n_units_l0': 41, 'n_units_l1': 8, 'n_units_l2': 19, 'n_units_l3': 87, 'n_units_l4': 14, 'optimizer': 'RMSprop', 'rmsprop_learning_rate': 0.009756365330640277, 'rmsprop_weight_decay': 0.8748950591837403, 'rmsprop_momentum': 0.036795026194692056}. Best is trial 308 with value: 0.7888889312744141.
Trial 403 finished with value: 0.5111111402511597 and parameters: {'n_layers': 7, 'weight_decay': 1.1184810437191618e-06, 'n_units_l0': 21, 'n_units_l1': 6, 'n_units_l2': 13, 'n_units_l3': 74, 'n_units_l4': 16, 'n_units_l5': 31, 'n_units_l6': 32, 'optimizer': 'RMSprop', 'rmsprop_learning_rate': 0.0056846627386942985, 'rmsprop_weight_decay': 0.8707735299142209, 'rmsprop_momentum': 0.0046137147067737815}. Best is trial 308 with value: 0.7888889312744141.
Trial 404 finished with value: 0.5000000596046448 and parameters: {'n_layers': 21, 'weight_decay': 0.00021830872293575305, 'n_units_l0': 36, 'n_units_l1': 8, 'n_units_l2': 8, 'n_units_l3': 58, 'n_units_l4': 20, 'n_units_l5': 27, 'n_units_l6': 46, 'n_units_l7': 22, 'n_units_l8': 67, 'n_units_l9': 12, 'n_units_l10': 20, 'n_units_l11': 50, 'n_units_l12': 23, 'n_units_l13': 26, 'n_units_l14': 126, 'n_units_l15': 7, 'n_units_l16': 81, 'n_units_l17': 4, 'n_units_l18': 55, 'n_units_l19': 6, 'n_units_l20': 4, 'optimizer': 'Adam', 'adam_learning_rate': 0.00042111219157203126}. Best is trial 308 with value: 0.7888889312744141.
Trial 405 finished with value: 0.4333333671092987 and parameters: {'n_layers': 9, 'weight_decay': 5.458984021695934e-05, 'n_units_l0': 22, 'n_units_l1': 10, 'n_units_l2': 16, 'n_units_l3': 32, 'n_units_l4': 15, 'n_units_l5': 23, 'n_units_l6': 17, 'n_units_l7': 30, 'n_units_l8': 60, 'optimizer': 'RMSprop', 'rmsprop_learning_rate': 0.025235291699732695, 'rmsprop_weight_decay': 0.8552297085718075, 'rmsprop_momentum': 0.0007366462016436526}. Best is trial 308 with value: 0.7888889312744141.
Trial 406 finished with value: 0.7444444298744202 and parameters: {'n_layers': 12, 'weight_decay': 8.809774802017527e-06, 'n_units_l0': 27, 'n_units_l1': 8, 'n_units_l2': 55, 'n_units_l3': 67, 'n_units_l4': 17, 'n_units_l5': 50, 'n_units_l6': 26, 'n_units_l7': 21, 'n_units_l8': 48, 'n_units_l9': 64, 'n_units_l10': 46, 'n_units_l11': 24, 'optimizer': 'RMSprop', 'rmsprop_learning_rate': 0.01828816242952447, 'rmsprop_weight_decay': 0.9129068763822826, 'rmsprop_momentum': 4.638997891395729e-05}. Best is trial 308 with value: 0.7888889312744141.
Trial 407 finished with value: 0.6555555462837219 and parameters: {'n_layers': 12, 'weight_decay': 9.283872631483895e-06, 'n_units_l0': 63, 'n_units_l1': 9, 'n_units_l2': 55, 'n_units_l3': 71, 'n_units_l4': 17, 'n_units_l5': 58, 'n_units_l6': 25, 'n_units_l7': 94, 'n_units_l8': 44, 'n_units_l9': 62, 'n_units_l10': 48, 'n_units_l11': 17, 'optimizer': 'Adam', 'adam_learning_rate': 0.00021630335709232494}. Best is trial 308 with value: 0.7888889312744141.
Trial 408 finished with value: 0.699999988079071 and parameters: {'n_layers': 12, 'weight_decay': 7.540116152081115e-06, 'n_units_l0': 81, 'n_units_l1': 8, 'n_units_l2': 75, 'n_units_l3': 84, 'n_units_l4': 18, 'n_units_l5': 48, 'n_units_l6': 26, 'n_units_l7': 27, 'n_units_l8': 49, 'n_units_l9': 68, 'n_units_l10': 38, 'n_units_l11': 25, 'optimizer': 'RMSprop', 'rmsprop_learning_rate': 0.043480297102142934, 'rmsprop_weight_decay': 0.8978445948696634, 'rmsprop_momentum': 7.098546808822813e-05}. Best is trial 308 with value: 0.7888889312744141.
Trial 409 finished with value: 0.4777778089046478 and parameters: {'n_layers': 12, 'weight_decay': 1.2659564235189787e-05, 'n_units_l0': 28, 'n_units_l1': 9, 'n_units_l2': 25, 'n_units_l3': 9, 'n_units_l4': 19, 'n_units_l5': 48, 'n_units_l6': 20, 'n_units_l7': 21, 'n_units_l8': 54, 'n_units_l9': 110, 'n_units_l10': 45, 'n_units_l11': 20, 'optimizer': 'RMSprop', 'rmsprop_learning_rate': 0.020976370786244335, 'rmsprop_weight_decay': 0.9151901442986107, 'rmsprop_momentum': 4.046081146047075e-05}. Best is trial 308 with value: 0.7888889312744141.
Trial 410 finished with value: 0.5888888835906982 and parameters: {'n_layers': 13, 'weight_decay': 5.359237984429164e-06, 'n_units_l0': 26, 'n_units_l1': 8, 'n_units_l2': 51, 'n_units_l3': 62, 'n_units_l4': 17, 'n_units_l5': 42, 'n_units_l6': 29, 'n_units_l7': 23, 'n_units_l8': 48, 'n_units_l9': 65, 'n_units_l10': 43, 'n_units_l11': 23, 'n_units_l12': 35, 'optimizer': 'Adam', 'adam_learning_rate': 0.005890837198380874}. Best is trial 308 with value: 0.7888889312744141.
Trial 411 finished with value: 0.46666666865348816 and parameters: {'n_layers': 11, 'weight_decay': 6.712688254573048e-06, 'n_units_l0': 39, 'n_units_l1': 9, 'n_units_l2': 45, 'n_units_l3': 77, 'n_units_l4': 88, 'n_units_l5': 56, 'n_units_l6': 22, 'n_units_l7': 24, 'n_units_l8': 42, 'n_units_l9': 79, 'n_units_l10': 29, 'optimizer': 'SGD', 'sgd_opt_learning_rate': 0.0014561892464421795, 'sgd_opt_momentum': 2.679943394857534e-05}. Best is trial 308 with value: 0.7888889312744141.
Trial 412 finished with value: 0.6555555462837219 and parameters: {'n_layers': 11, 'weight_decay': 9.415213303469994e-06, 'n_units_l0': 30, 'n_units_l1': 10, 'n_units_l2': 63, 'n_units_l3': 69, 'n_units_l4': 15, 'n_units_l5': 61, 'n_units_l6': 24, 'n_units_l7': 22, 'n_units_l8': 45, 'n_units_l9': 73, 'n_units_l10': 55, 'optimizer': 'RMSprop', 'rmsprop_learning_rate': 0.017531193361078137, 'rmsprop_weight_decay': 0.9127518580396299, 'rmsprop_momentum': 6.203785757226105e-05}. Best is trial 308 with value: 0.7888889312744141.
Trial 413 finished with value: 0.3444444239139557 and parameters: {'n_layers': 12, 'weight_decay': 2.8440623874174717e-06, 'n_units_l0': 45, 'n_units_l1': 8, 'n_units_l2': 14, 'n_units_l3': 53, 'n_units_l4': 16, 'n_units_l5': 51, 'n_units_l6': 54, 'n_units_l7': 18, 'n_units_l8': 54, 'n_units_l9': 54, 'n_units_l10': 27, 'n_units_l11': 33, 'optimizer': 'Adam', 'adam_learning_rate': 0.0036117275872781735}. Best is trial 308 with value: 0.7888889312744141.
Trial 414 finished with value: 0.5000000596046448 and parameters: {'n_layers': 13, 'weight_decay': 3.597178628251453e-05, 'n_units_l0': 55, 'n_units_l1': 7, 'n_units_l2': 31, 'n_units_l3': 8, 'n_units_l4': 20, 'n_units_l5': 53, 'n_units_l6': 27, 'n_units_l7': 6, 'n_units_l8': 62, 'n_units_l9': 88, 'n_units_l10': 81, 'n_units_l11': 41, 'n_units_l12': 112, 'optimizer': 'RMSprop', 'rmsprop_learning_rate': 0.00217456310981414, 'rmsprop_weight_decay': 0.9085328843685919, 'rmsprop_momentum': 4.580518726228177e-05}. Best is trial 308 with value: 0.7888889312744141.
