Trial 222 finished with value: 0.5333333611488342 and parameters: {'n_layers': 9, 'weight_decay': 1.117950978335795e-07, 'n_units_l0': 46, 'n_units_l1': 8, 'n_units_l2': 4, 'n_units_l3': 108, 'n_units_l4': 78, 'n_units_l5': 27, 'n_units_l6': 44, 'n_units_l7': 62, 'n_units_l8': 53, 'optimizer': 'SGD', 'sgd_opt_learning_rate': 0.0016639716064174638, 'sgd_opt_momentum': 0.0006933705698704799}. Best is trial 204 with value: 0.7666666507720947.
Trial 223 finished with value: 0.3777777850627899 and parameters: {'n_layers': 8, 'weight_decay': 1.4134876461172833e-07, 'n_units_l0': 43, 'n_units_l1': 8, 'n_units_l2': 4, 'n_units_l3': 90, 'n_units_l4': 21, 'n_units_l5': 31, 'n_units_l6': 41, 'n_units_l7': 57, 'optimizer': 'SGD', 'sgd_opt_learning_rate': 0.0028927564162079355, 'sgd_opt_momentum': 0.0009126806438020813}. Best is trial 204 with value: 0.7666666507720947.
Trial 224 finished with value: 0.4888888895511627 and parameters: {'n_layers': 8, 'weight_decay': 1.016154031803324e-05, 'n_units_l0': 50, 'n_units_l1': 7, 'n_units_l2': 4, 'n_units_l3': 82, 'n_units_l4': 22, 'n_units_l5': 27, 'n_units_l6': 37, 'n_units_l7': 53, 'optimizer': 'SGD', 'sgd_opt_learning_rate': 0.004281903990756076, 'sgd_opt_momentum': 0.0003946144314301875}. Best is trial 204 with value: 0.7666666507720947.
Trial 225 finished with value: 0.5222222208976746 and parameters: {'n_layers': 9, 'weight_decay': 1.578303234964698e-05, 'n_units_l0': 39, 'n_units_l1': 9, 'n_units_l2': 17, 'n_units_l3': 125, 'n_units_l4': 17, 'n_units_l5': 26, 'n_units_l6': 48, 'n_units_l7': 63, 'n_units_l8': 24, 'optimizer': 'SGD', 'sgd_opt_learning_rate': 0.001205551798477939, 'sgd_opt_momentum': 0.001838111127072913}. Best is trial 204 with value: 0.7666666507720947.
Trial 226 finished with value: 0.4888888895511627 and parameters: {'n_layers': 8, 'weight_decay': 3.1412883038502863e-07, 'n_units_l0': 45, 'n_units_l1': 7, 'n_units_l2': 10, 'n_units_l3': 96, 'n_units_l4': 19, 'n_units_l5': 29, 'n_units_l6': 34, 'n_units_l7': 50, 'optimizer': 'SGD', 'sgd_opt_learning_rate': 0.0019114990682465311, 'sgd_opt_momentum': 0.002497286385620984}. Best is trial 204 with value: 0.7666666507720947.
Trial 227 finished with value: 0.5666666626930237 and parameters: {'n_layers': 7, 'weight_decay': 1.8908494979065708e-07, 'n_units_l0': 35, 'n_units_l1': 12, 'n_units_l2': 19, 'n_units_l3': 91, 'n_units_l4': 24, 'n_units_l5': 24, 'n_units_l6': 40, 'optimizer': 'SGD', 'sgd_opt_learning_rate': 0.00045871867532515316, 'sgd_opt_momentum': 0.001381167309418343}. Best is trial 204 with value: 0.7666666507720947.
Trial 228 finished with value: 0.5999999642372131 and parameters: {'n_layers': 9, 'weight_decay': 3.2894970437693673e-07, 'n_units_l0': 31, 'n_units_l1': 8, 'n_units_l2': 15, 'n_units_l3': 102, 'n_units_l4': 18, 'n_units_l5': 23, 'n_units_l6': 22, 'n_units_l7': 72, 'n_units_l8': 42, 'optimizer': 'SGD', 'sgd_opt_learning_rate': 1.7808973028718992e-05, 'sgd_opt_momentum': 0.00503411402303634}. Best is trial 204 with value: 0.7666666507720947.
Trial 229 finished with value: 0.41111111640930176 and parameters: {'n_layers': 8, 'weight_decay': 2.352526151189191e-07, 'n_units_l0': 38, 'n_units_l1': 10, 'n_units_l2': 4, 'n_units_l3': 86, 'n_units_l4': 15, 'n_units_l5': 17, 'n_units_l6': 18, 'n_units_l7': 58, 'optimizer': 'SGD', 'sgd_opt_learning_rate': 0.003116553569402549, 'sgd_opt_momentum': 0.0005511126846568841}. Best is trial 204 with value: 0.7666666507720947.
Trial 230 finished with value: 0.4888888895511627 and parameters: {'n_layers': 12, 'weight_decay': 5.3672469873686946e-05, 'n_units_l0': 42, 'n_units_l1': 9, 'n_units_l2': 16, 'n_units_l3': 73, 'n_units_l4': 16, 'n_units_l5': 29, 'n_units_l6': 44, 'n_units_l7': 23, 'n_units_l8': 27, 'n_units_l9': 54, 'n_units_l10': 9, 'n_units_l11': 48, 'optimizer': 'SGD', 'sgd_opt_learning_rate': 0.006201748511572367, 'sgd_opt_momentum': 1.62514624512487e-05}. Best is trial 204 with value: 0.7666666507720947.
Trial 231 finished with value: 0.3777778148651123 and parameters: {'n_layers': 10, 'weight_decay': 2.8177102526735157e-05, 'n_units_l0': 47, 'n_units_l1': 7, 'n_units_l2': 5, 'n_units_l3': 107, 'n_units_l4': 48, 'n_units_l5': 25, 'n_units_l6': 35, 'n_units_l7': 17, 'n_units_l8': 115, 'n_units_l9': 72, 'optimizer': 'Adam', 'adam_learning_rate': 0.014803733184616882}. Best is trial 204 with value: 0.7666666507720947.
Trial 232 finished with value: 0.5111111402511597 and parameters: {'n_layers': 11, 'weight_decay': 7.218937288044749e-05, 'n_units_l0': 29, 'n_units_l1': 8, 'n_units_l2': 14, 'n_units_l3': 92, 'n_units_l4': 22, 'n_units_l5': 20, 'n_units_l6': 39, 'n_units_l7': 81, 'n_units_l8': 33, 'n_units_l9': 26, 'n_units_l10': 7, 'optimizer': 'SGD', 'sgd_opt_learning_rate': 0.0010590853757789537, 'sgd_opt_momentum': 0.0029403839677028523}. Best is trial 204 with value: 0.7666666507720947.
Trial 233 finished with value: 0.5888888835906982 and parameters: {'n_layers': 11, 'weight_decay': 2.2997945233269455e-07, 'n_units_l0': 35, 'n_units_l1': 5, 'n_units_l2': 16, 'n_units_l3': 22, 'n_units_l4': 18, 'n_units_l5': 22, 'n_units_l6': 30, 'n_units_l7': 21, 'n_units_l8': 59, 'n_units_l9': 33, 'n_units_l10': 58, 'optimizer': 'SGD', 'sgd_opt_learning_rate': 0.07384877445290225, 'sgd_opt_momentum': 0.00033180817607171537}. Best is trial 204 with value: 0.7666666507720947.
Trial 234 finished with value: 0.7333333492279053 and parameters: {'n_layers': 13, 'weight_decay': 4.6776759937655956e-05, 'n_units_l0': 39, 'n_units_l1': 6, 'n_units_l2': 15, 'n_units_l3': 82, 'n_units_l4': 15, 'n_units_l5': 26, 'n_units_l6': 37, 'n_units_l7': 65, 'n_units_l8': 80, 'n_units_l9': 28, 'n_units_l10': 70, 'n_units_l11': 22, 'n_units_l12': 16, 'optimizer': 'SGD', 'sgd_opt_learning_rate': 0.0006938442594796256, 'sgd_opt_momentum': 0.00100544139938669}. Best is trial 204 with value: 0.7666666507720947.
Trial 235 finished with value: 0.6222222447395325 and parameters: {'n_layers': 12, 'weight_decay': 4.128345564066241e-05, 'n_units_l0': 39, 'n_units_l1': 6, 'n_units_l2': 15, 'n_units_l3': 80, 'n_units_l4': 15, 'n_units_l5': 26, 'n_units_l6': 37, 'n_units_l7': 66, 'n_units_l8': 77, 'n_units_l9': 23, 'n_units_l10': 50, 'n_units_l11': 9, 'optimizer': 'SGD', 'sgd_opt_learning_rate': 0.0006143905485667483, 'sgd_opt_momentum': 0.0009010880654880499}. Best is trial 204 with value: 0.7666666507720947.
Trial 236 finished with value: 0.5666666626930237 and parameters: {'n_layers': 13, 'weight_decay': 2.4004712384255436e-05, 'n_units_l0': 43, 'n_units_l1': 7, 'n_units_l2': 68, 'n_units_l3': 87, 'n_units_l4': 14, 'n_units_l5': 28, 'n_units_l6': 20, 'n_units_l7': 60, 'n_units_l8': 19, 'n_units_l9': 28, 'n_units_l10': 84, 'n_units_l11': 4, 'n_units_l12': 16, 'optimizer': 'SGD', 'sgd_opt_learning_rate': 0.00020314375412314466, 'sgd_opt_momentum': 0.0010836208689906036}. Best is trial 204 with value: 0.7666666507720947.
Trial 237 finished with value: 0.5000000596046448 and parameters: {'n_layers': 14, 'weight_decay': 6.309203645732117e-06, 'n_units_l0': 37, 'n_units_l1': 8, 'n_units_l2': 15, 'n_units_l3': 81, 'n_units_l4': 17, 'n_units_l5': 61, 'n_units_l6': 32, 'n_units_l7': 66, 'n_units_l8': 62, 'n_units_l9': 36, 'n_units_l10': 97, 'n_units_l11': 22, 'n_units_l12': 7, 'n_units_l13': 128, 'optimizer': 'SGD', 'sgd_opt_learning_rate': 0.0008524228954028177, 'sgd_opt_momentum': 0.001872687941835035}. Best is trial 204 with value: 0.7666666507720947.
Trial 238 finished with value: 0.4333333671092987 and parameters: {'n_layers': 13, 'weight_decay': 5.29225079716421e-05, 'n_units_l0': 32, 'n_units_l1': 9, 'n_units_l2': 13, 'n_units_l3': 68, 'n_units_l4': 20, 'n_units_l5': 31, 'n_units_l6': 42, 'n_units_l7': 76, 'n_units_l8': 81, 'n_units_l9': 43, 'n_units_l10': 74, 'n_units_l11': 29, 'n_units_l12': 25, 'optimizer': 'SGD', 'sgd_opt_learning_rate': 0.0016771750994858995, 'sgd_opt_momentum': 0.004167476377468959}. Best is trial 204 with value: 0.7666666507720947.
Trial 239 finished with value: 0.6777777671813965 and parameters: {'n_layers': 8, 'weight_decay': 3.505205017349497e-05, 'n_units_l0': 40, 'n_units_l1': 6, 'n_units_l2': 17, 'n_units_l3': 76, 'n_units_l4': 16, 'n_units_l5': 50, 'n_units_l6': 21, 'n_units_l7': 57, 'optimizer': 'SGD', 'sgd_opt_learning_rate': 0.00010772633261682507, 'sgd_opt_momentum': 0.0007890788482665761}. Best is trial 204 with value: 0.7666666507720947.
Trial 240 finished with value: 0.5999999642372131 and parameters: {'n_layers': 7, 'weight_decay': 1.878933377923567e-05, 'n_units_l0': 28, 'n_units_l1': 8, 'n_units_l2': 14, 'n_units_l3': 54, 'n_units_l4': 13, 'n_units_l5': 24, 'n_units_l6': 36, 'optimizer': 'Adam', 'adam_learning_rate': 0.0005271288399039773}. Best is trial 204 with value: 0.7666666507720947.
Trial 241 finished with value: 0.7777778506278992 and parameters: {'n_layers': 12, 'weight_decay': 6.398950969396291e-05, 'n_units_l0': 36, 'n_units_l1': 5, 'n_units_l2': 16, 'n_units_l3': 94, 'n_units_l4': 15, 'n_units_l5': 26, 'n_units_l6': 38, 'n_units_l7': 18, 'n_units_l8': 90, 'n_units_l9': 24, 'n_units_l10': 6, 'n_units_l11': 110, 'optimizer': 'SGD', 'sgd_opt_learning_rate': 0.0004617370466613913, 'sgd_opt_momentum': 0.006576764178507234}. Best is trial 241 with value: 0.7777778506278992.
Trial 242 finished with value: 0.5000000596046448 and parameters: {'n_layers': 12, 'weight_decay': 8.027532284815679e-05, 'n_units_l0': 36, 'n_units_l1': 7, 'n_units_l2': 16, 'n_units_l3': 99, 'n_units_l4': 15, 'n_units_l5': 26, 'n_units_l6': 40, 'n_units_l7': 17, 'n_units_l8': 105, 'n_units_l9': 30, 'n_units_l10': 67, 'n_units_l11': 77, 'optimizer': 'SGD', 'sgd_opt_learning_rate': 0.0007219673781418519, 'sgd_opt_momentum': 0.006539696161823527}. Best is trial 241 with value: 0.7777778506278992.
Trial 243 finished with value: 0.4000000059604645 and parameters: {'n_layers': 13, 'weight_decay': 6.019455508585035e-05, 'n_units_l0': 34, 'n_units_l1': 5, 'n_units_l2': 18, 'n_units_l3': 117, 'n_units_l4': 14, 'n_units_l5': 28, 'n_units_l6': 33, 'n_units_l7': 18, 'n_units_l8': 72, 'n_units_l9': 20, 'n_units_l10': 62, 'n_units_l11': 109, 'n_units_l12': 5, 'optimizer': 'SGD', 'sgd_opt_learning_rate': 0.000478179680677797, 'sgd_opt_momentum': 0.009540705150194267}. Best is trial 241 with value: 0.7777778506278992.
Trial 244 finished with value: 0.6111111640930176 and parameters: {'n_layers': 13, 'weight_decay': 5.030983613650844e-05, 'n_units_l0': 39, 'n_units_l1': 8, 'n_units_l2': 86, 'n_units_l3': 90, 'n_units_l4': 17, 'n_units_l5': 23, 'n_units_l6': 45, 'n_units_l7': 20, 'n_units_l8': 95, 'n_units_l9': 24, 'n_units_l10': 113, 'n_units_l11': 89, 'n_units_l12': 15, 'optimizer': 'SGD', 'sgd_opt_learning_rate': 0.00036567675533329174, 'sgd_opt_momentum': 0.0015078259492889649}. Best is trial 241 with value: 0.7777778506278992.
Trial 245 finished with value: 0.6111111640930176 and parameters: {'n_layers': 12, 'weight_decay': 0.0001026003742881377, 'n_units_l0': 44, 'n_units_l1': 9, 'n_units_l2': 14, 'n_units_l3': 85, 'n_units_l4': 16, 'n_units_l5': 25, 'n_units_l6': 38, 'n_units_l7': 70, 'n_units_l8': 55, 'n_units_l9': 6, 'n_units_l10': 79, 'n_units_l11': 65, 'optimizer': 'SGD', 'sgd_opt_learning_rate': 0.001283816525441738, 'sgd_opt_momentum': 0.004119730226893594}. Best is trial 241 with value: 0.7777778506278992.
Trial 246 finished with value: 0.6888888478279114 and parameters: {'n_layers': 10, 'weight_decay': 5.272604327271321e-07, 'n_units_l0': 31, 'n_units_l1': 6, 'n_units_l2': 16, 'n_units_l3': 96, 'n_units_l4': 24, 'n_units_l5': 27, 'n_units_l6': 19, 'n_units_l7': 42, 'n_units_l8': 84, 'n_units_l9': 26, 'optimizer': 'SGD', 'sgd_opt_learning_rate': 0.0025294819253359013, 'sgd_opt_momentum': 0.002153363976518684}. Best is trial 241 with value: 0.7777778506278992.
Trial 247 finished with value: 0.5777778029441833 and parameters: {'n_layers': 8, 'weight_decay': 3.396080433767019e-05, 'n_units_l0': 36, 'n_units_l1': 7, 'n_units_l2': 15, 'n_units_l3': 107, 'n_units_l4': 21, 'n_units_l5': 24, 'n_units_l6': 51, 'n_units_l7': 15, 'optimizer': 'SGD', 'sgd_opt_learning_rate': 0.0038913899381079883, 'sgd_opt_momentum': 0.0065331093195319405}. Best is trial 241 with value: 0.7777778506278992.
Trial 248 finished with value: 0.5000000596046448 and parameters: {'n_layers': 12, 'weight_decay': 7.551742998306078e-05, 'n_units_l0': 12, 'n_units_l1': 9, 'n_units_l2': 17, 'n_units_l3': 88, 'n_units_l4': 15, 'n_units_l5': 33, 'n_units_l6': 18, 'n_units_l7': 18, 'n_units_l8': 17, 'n_units_l9': 49, 'n_units_l10': 128, 'n_units_l11': 16, 'optimizer': 'SGD', 'sgd_opt_learning_rate': 0.0007668251356998038, 'sgd_opt_momentum': 0.000633193285796076}. Best is trial 241 with value: 0.7777778506278992.
Trial 249 finished with value: 0.7444444298744202 and parameters: {'n_layers': 9, 'weight_decay': 8.798086419951025e-06, 'n_units_l0': 41, 'n_units_l1': 7, 'n_units_l2': 10, 'n_units_l3': 79, 'n_units_l4': 19, 'n_units_l5': 30, 'n_units_l6': 35, 'n_units_l7': 16, 'n_units_l8': 90, 'optimizer': 'SGD', 'sgd_opt_learning_rate': 0.00028232970422196124, 'sgd_opt_momentum': 0.002941715933680074}. Best is trial 241 with value: 0.7777778506278992.
Trial 250 finished with value: 0.6666666865348816 and parameters: {'n_layers': 9, 'weight_decay': 8.67306973013275e-06, 'n_units_l0': 41, 'n_units_l1': 7, 'n_units_l2': 10, 'n_units_l3': 80, 'n_units_l4': 19, 'n_units_l5': 31, 'n_units_l6': 23, 'n_units_l7': 16, 'n_units_l8': 90, 'optimizer': 'SGD', 'sgd_opt_learning_rate': 0.00031315166967554745, 'sgd_opt_momentum': 0.0030732390907248987}. Best is trial 241 with value: 0.7777778506278992.
Trial 251 finished with value: 0.5333333611488342 and parameters: {'n_layers': 9, 'weight_decay': 1.0582840099220104e-05, 'n_units_l0': 39, 'n_units_l1': 8, 'n_units_l2': 9, 'n_units_l3': 72, 'n_units_l4': 18, 'n_units_l5': 30, 'n_units_l6': 41, 'n_units_l7': 22, 'n_units_l8': 112, 'optimizer': 'SGD', 'sgd_opt_learning_rate': 0.0004570142417134549, 'sgd_opt_momentum': 0.0011805063482562572}. Best is trial 241 with value: 0.7777778506278992.
Trial 252 finished with value: 0.4888888895511627 and parameters: {'n_layers': 8, 'weight_decay': 5.640826856271683e-06, 'n_units_l0': 48, 'n_units_l1': 7, 'n_units_l2': 19, 'n_units_l3': 77, 'n_units_l4': 22, 'n_units_l5': 21, 'n_units_l6': 36, 'n_units_l7': 19, 'optimizer': 'SGD', 'sgd_opt_learning_rate': 0.00023782710262732615, 'sgd_opt_momentum': 0.0004634286055820712}. Best is trial 241 with value: 0.7777778506278992.
Trial 253 finished with value: 0.5777778029441833 and parameters: {'n_layers': 10, 'weight_decay': 1.3597772611335566e-05, 'n_units_l0': 33, 'n_units_l1': 10, 'n_units_l2': 12, 'n_units_l3': 66, 'n_units_l4': 17, 'n_units_l5': 34, 'n_units_l6': 20, 'n_units_l7': 20, 'n_units_l8': 101, 'n_units_l9': 40, 'optimizer': 'SGD', 'sgd_opt_learning_rate': 8.781495584940346e-05, 'sgd_opt_momentum': 0.004165943644461304}. Best is trial 241 with value: 0.7777778506278992.
Trial 254 finished with value: 0.42222222685813904 and parameters: {'n_layers': 7, 'weight_decay': 3.968170689737713e-06, 'n_units_l0': 43, 'n_units_l1': 6, 'n_units_l2': 11, 'n_units_l3': 84, 'n_units_l4': 20, 'n_units_l5': 18, 'n_units_l6': 46, 'optimizer': 'SGD', 'sgd_opt_learning_rate': 0.0005659433084872415, 'sgd_opt_momentum': 0.0027436299403874468}. Best is trial 241 with value: 0.7777778506278992.
Trial 255 finished with value: 0.6333333849906921 and parameters: {'n_layers': 9, 'weight_decay': 1.8616706983589855e-07, 'n_units_l0': 36, 'n_units_l1': 13, 'n_units_l2': 13, 'n_units_l3': 95, 'n_units_l4': 14, 'n_units_l5': 28, 'n_units_l6': 21, 'n_units_l7': 64, 'n_units_l8': 75, 'optimizer': 'Adam', 'adam_learning_rate': 0.001193154440636382}. Best is trial 241 with value: 0.7777778506278992.
Trial 256 finished with value: 0.6222222447395325 and parameters: {'n_layers': 11, 'weight_decay': 7.365380602048174e-06, 'n_units_l0': 30, 'n_units_l1': 7, 'n_units_l2': 15, 'n_units_l3': 103, 'n_units_l4': 19, 'n_units_l5': 75, 'n_units_l6': 17, 'n_units_l7': 17, 'n_units_l8': 13, 'n_units_l9': 14, 'n_units_l10': 6, 'optimizer': 'SGD', 'sgd_opt_learning_rate': 0.00013949011064841522, 'sgd_opt_momentum': 0.0020723984554603227}. Best is trial 241 with value: 0.7777778506278992.
Trial 257 finished with value: 0.5333333611488342 and parameters: {'n_layers': 8, 'weight_decay': 2.2496581472140043e-05, 'n_units_l0': 34, 'n_units_l1': 11, 'n_units_l2': 9, 'n_units_l3': 71, 'n_units_l4': 16, 'n_units_l5': 25, 'n_units_l6': 39, 'n_units_l7': 51, 'optimizer': 'SGD', 'sgd_opt_learning_rate': 0.00041256486376657566, 'sgd_opt_momentum': 0.0013266502053908675}. Best is trial 241 with value: 0.7777778506278992.
Trial 258 finished with value: 0.5666666626930237 and parameters: {'n_layers': 9, 'weight_decay': 1.653488130272659e-06, 'n_units_l0': 27, 'n_units_l1': 8, 'n_units_l2': 17, 'n_units_l3': 87, 'n_units_l4': 18, 'n_units_l5': 23, 'n_units_l6': 22, 'n_units_l7': 89, 'n_units_l8': 79, 'optimizer': 'SGD', 'sgd_opt_learning_rate': 0.0006761312974013756, 'sgd_opt_momentum': 0.00023678931980691817}. Best is trial 241 with value: 0.7777778506278992.
Trial 259 finished with value: 0.5666666626930237 and parameters: {'n_layers': 10, 'weight_decay': 1.6448648627119354e-05, 'n_units_l0': 38, 'n_units_l1': 10, 'n_units_l2': 15, 'n_units_l3': 50, 'n_units_l4': 21, 'n_units_l5': 26, 'n_units_l6': 25, 'n_units_l7': 18, 'n_units_l8': 22, 'n_units_l9': 60, 'optimizer': 'SGD', 'sgd_opt_learning_rate': 0.02831232544212615, 'sgd_opt_momentum': 0.005774430593763826}. Best is trial 241 with value: 0.7777778506278992.
Trial 260 finished with value: 0.6333333849906921 and parameters: {'n_layers': 7, 'weight_decay': 3.696759089971793e-05, 'n_units_l0': 46, 'n_units_l1': 9, 'n_units_l2': 10, 'n_units_l3': 78, 'n_units_l4': 17, 'n_units_l5': 29, 'n_units_l6': 35, 'optimizer': 'Adam', 'adam_learning_rate': 0.0078937578049806}. Best is trial 241 with value: 0.7777778506278992.
Trial 261 finished with value: 0.6111111640930176 and parameters: {'n_layers': 8, 'weight_decay': 2.3022696053039808e-06, 'n_units_l0': 41, 'n_units_l1': 8, 'n_units_l2': 29, 'n_units_l3': 93, 'n_units_l4': 23, 'n_units_l5': 84, 'n_units_l6': 11, 'n_units_l7': 58, 'optimizer': 'SGD', 'sgd_opt_learning_rate': 0.0009810422679542028, 'sgd_opt_momentum': 0.020932697305813583}. Best is trial 241 with value: 0.7777778506278992.
Trial 262 finished with value: 0.699999988079071 and parameters: {'n_layers': 6, 'weight_decay': 1.0144749261914998e-05, 'n_units_l0': 10, 'n_units_l1': 9, 'n_units_l2': 20, 'n_units_l3': 84, 'n_units_l4': 25, 'n_units_l5': 20, 'optimizer': 'SGD', 'sgd_opt_learning_rate': 0.014096874908983162, 'sgd_opt_momentum': 0.0009899416310227276}. Best is trial 241 with value: 0.7777778506278992.
Trial 263 finished with value: 0.7111110687255859 and parameters: {'n_layers': 14, 'weight_decay': 5.246084324058861e-06, 'n_units_l0': 32, 'n_units_l1': 7, 'n_units_l2': 108, 'n_units_l3': 98, 'n_units_l4': 19, 'n_units_l5': 21, 'n_units_l6': 16, 'n_units_l7': 36, 'n_units_l8': 99, 'n_units_l9': 8, 'n_units_l10': 33, 'n_units_l11': 6, 'n_units_l12': 20, 'n_units_l13': 74, 'optimizer': 'SGD', 'sgd_opt_learning_rate': 0.00016447780896559067, 'sgd_opt_momentum': 0.009398006308003009}. Best is trial 241 with value: 0.7777778506278992.
Trial 264 finished with value: 0.6333333849906921 and parameters: {'n_layers': 14, 'weight_decay': 5.017100472102893e-06, 'n_units_l0': 31, 'n_units_l1': 6, 'n_units_l2': 13, 'n_units_l3': 100, 'n_units_l4': 15, 'n_units_l5': 16, 'n_units_l6': 14, 'n_units_l7': 38, 'n_units_l8': 98, 'n_units_l9': 10, 'n_units_l10': 31, 'n_units_l11': 5, 'n_units_l12': 20, 'n_units_l13': 73, 'optimizer': 'SGD', 'sgd_opt_learning_rate': 0.0001706670681624518, 'sgd_opt_momentum': 0.008141670536790602}. Best is trial 241 with value: 0.7777778506278992.
Trial 265 finished with value: 0.5888888835906982 and parameters: {'n_layers': 14, 'weight_decay': 6.559458592933403e-06, 'n_units_l0': 29, 'n_units_l1': 7, 'n_units_l2': 8, 'n_units_l3': 110, 'n_units_l4': 13, 'n_units_l5': 44, 'n_units_l6': 16, 'n_units_l7': 28, 'n_units_l8': 70, 'n_units_l9': 8, 'n_units_l10': 17, 'n_units_l11': 12, 'n_units_l12': 14, 'n_units_l13': 56, 'optimizer': 'SGD', 'sgd_opt_learning_rate': 0.00023779873991650304, 'sgd_opt_momentum': 0.010405189233498069}. Best is trial 241 with value: 0.7777778506278992.
Trial 266 finished with value: 0.7444444298744202 and parameters: {'n_layers': 5, 'weight_decay': 3.642624279330218e-06, 'n_units_l0': 32, 'n_units_l1': 7, 'n_units_l2': 55, 'n_units_l3': 59, 'n_units_l4': 19, 'optimizer': 'Adam', 'adam_learning_rate': 0.003960454209296796}. Best is trial 241 with value: 0.7777778506278992.
Trial 267 finished with value: 0.699999988079071 and parameters: {'n_layers': 7, 'weight_decay': 3.1354848464892773e-06, 'n_units_l0': 33, 'n_units_l1': 7, 'n_units_l2': 122, 'n_units_l3': 65, 'n_units_l4': 21, 'n_units_l5': 32, 'n_units_l6': 17, 'optimizer': 'Adam', 'adam_learning_rate': 0.003210355633562604}. Best is trial 241 with value: 0.7777778506278992.
Trial 268 finished with value: 0.4777778089046478 and parameters: {'n_layers': 15, 'weight_decay': 3.8285737868305984e-06, 'n_units_l0': 27, 'n_units_l1': 7, 'n_units_l2': 117, 'n_units_l3': 58, 'n_units_l4': 20, 'n_units_l5': 23, 'n_units_l6': 15, 'n_units_l7': 32, 'n_units_l8': 126, 'n_units_l9': 13, 'n_units_l10': 40, 'n_units_l11': 7, 'n_units_l12': 23, 'n_units_l13': 39, 'n_units_l14': 68, 'optimizer': 'Adam', 'adam_learning_rate': 0.023747635071166076}. Best is trial 241 with value: 0.7777778506278992.
Trial 269 finished with value: 0.5111111402511597 and parameters: {'n_layers': 6, 'weight_decay': 4.675329197772584e-06, 'n_units_l0': 34, 'n_units_l1': 7, 'n_units_l2': 52, 'n_units_l3': 95, 'n_units_l4': 22, 'n_units_l5': 36, 'optimizer': 'Adam', 'adam_learning_rate': 0.0017882579166895902}. Best is trial 241 with value: 0.7777778506278992.
