Trial 319 finished with value: 0.3444444239139557 and parameters: {'n_layers': 11, 'weight_decay': 7.567403966388675e-05, 'n_units_l0': 30, 'n_units_l1': 6, 'n_units_l2': 7, 'n_units_l3': 64, 'n_units_l4': 6, 'n_units_l5': 31, 'n_units_l6': 34, 'n_units_l7': 6, 'n_units_l8': 36, 'n_units_l9': 18, 'n_units_l10': 22, 'optimizer': 'Adam', 'adam_learning_rate': 6.967668163764836e-05}. Best is trial 308 with value: 0.7888889312744141.
Trial 320 finished with value: 0.46666666865348816 and parameters: {'n_layers': 12, 'weight_decay': 0.00013145787263260528, 'n_units_l0': 26, 'n_units_l1': 7, 'n_units_l2': 44, 'n_units_l3': 60, 'n_units_l4': 16, 'n_units_l5': 31, 'n_units_l6': 39, 'n_units_l7': 17, 'n_units_l8': 25, 'n_units_l9': 16, 'n_units_l10': 19, 'n_units_l11': 35, 'optimizer': 'Adam', 'adam_learning_rate': 0.000346872913187913}. Best is trial 308 with value: 0.7888889312744141.
Trial 321 finished with value: 0.699999988079071 and parameters: {'n_layers': 12, 'weight_decay': 6.146093622544469e-05, 'n_units_l0': 32, 'n_units_l1': 7, 'n_units_l2': 10, 'n_units_l3': 67, 'n_units_l4': 14, 'n_units_l5': 38, 'n_units_l6': 31, 'n_units_l7': 23, 'n_units_l8': 31, 'n_units_l9': 15, 'n_units_l10': 13, 'n_units_l11': 31, 'optimizer': 'Adam', 'adam_learning_rate': 0.00016302244072242798}. Best is trial 308 with value: 0.7888889312744141.
Trial 322 finished with value: 0.5444445013999939 and parameters: {'n_layers': 13, 'weight_decay': 9.51357033626219e-05, 'n_units_l0': 27, 'n_units_l1': 8, 'n_units_l2': 8, 'n_units_l3': 74, 'n_units_l4': 18, 'n_units_l5': 34, 'n_units_l6': 47, 'n_units_l7': 16, 'n_units_l8': 43, 'n_units_l9': 18, 'n_units_l10': 15, 'n_units_l11': 52, 'n_units_l12': 40, 'optimizer': 'Adam', 'adam_learning_rate': 0.002678079209364093}. Best is trial 308 with value: 0.7888889312744141.
Trial 323 finished with value: 0.7222222685813904 and parameters: {'n_layers': 12, 'weight_decay': 0.0003360220818401503, 'n_units_l0': 30, 'n_units_l1': 5, 'n_units_l2': 8, 'n_units_l3': 55, 'n_units_l4': 16, 'n_units_l5': 17, 'n_units_l6': 36, 'n_units_l7': 13, 'n_units_l8': 29, 'n_units_l9': 23, 'n_units_l10': 90, 'n_units_l11': 27, 'optimizer': 'Adam', 'adam_learning_rate': 2.7534033282301785e-05}. Best is trial 308 with value: 0.7888889312744141.
Trial 324 finished with value: 0.5777778029441833 and parameters: {'n_layers': 12, 'weight_decay': 0.0002172126449476503, 'n_units_l0': 29, 'n_units_l1': 5, 'n_units_l2': 8, 'n_units_l3': 56, 'n_units_l4': 93, 'n_units_l5': 17, 'n_units_l6': 35, 'n_units_l7': 15, 'n_units_l8': 28, 'n_units_l9': 20, 'n_units_l10': 91, 'n_units_l11': 25, 'optimizer': 'Adam', 'adam_learning_rate': 1.8174331297078454e-05}. Best is trial 308 with value: 0.7888889312744141.
Trial 325 finished with value: 0.644444465637207 and parameters: {'n_layers': 13, 'weight_decay': 0.00033144580996102466, 'n_units_l0': 28, 'n_units_l1': 5, 'n_units_l2': 9, 'n_units_l3': 51, 'n_units_l4': 61, 'n_units_l5': 15, 'n_units_l6': 37, 'n_units_l7': 13, 'n_units_l8': 35, 'n_units_l9': 24, 'n_units_l10': 115, 'n_units_l11': 28, 'n_units_l12': 45, 'optimizer': 'Adam', 'adam_learning_rate': 2.792495203753632e-05}. Best is trial 308 with value: 0.7888889312744141.
Trial 326 finished with value: 0.5999999642372131 and parameters: {'n_layers': 12, 'weight_decay': 0.00025770984458599853, 'n_units_l0': 25, 'n_units_l1': 6, 'n_units_l2': 9, 'n_units_l3': 8, 'n_units_l4': 11, 'n_units_l5': 17, 'n_units_l6': 43, 'n_units_l7': 14, 'n_units_l8': 24, 'n_units_l9': 23, 'n_units_l10': 17, 'n_units_l11': 39, 'optimizer': 'Adam', 'adam_learning_rate': 8.518897743948963e-05}. Best is trial 308 with value: 0.7888889312744141.
Trial 327 finished with value: 0.5666666626930237 and parameters: {'n_layers': 6, 'weight_decay': 0.0001725583589638181, 'n_units_l0': 31, 'n_units_l1': 5, 'n_units_l2': 7, 'n_units_l3': 57, 'n_units_l4': 17, 'n_units_l5': 18, 'optimizer': 'Adam', 'adam_learning_rate': 0.0014772958810232398}. Best is trial 308 with value: 0.7888889312744141.
Trial 328 finished with value: 0.7555555701255798 and parameters: {'n_layers': 5, 'weight_decay': 8.289823523467751e-07, 'n_units_l0': 22, 'n_units_l1': 6, 'n_units_l2': 7, 'n_units_l3': 44, 'n_units_l4': 15, 'optimizer': 'Adam', 'adam_learning_rate': 1.6170390914147528e-05}. Best is trial 308 with value: 0.7888889312744141.
Trial 329 finished with value: 0.5666666626930237 and parameters: {'n_layers': 5, 'weight_decay': 0.0006439497836907451, 'n_units_l0': 24, 'n_units_l1': 6, 'n_units_l2': 7, 'n_units_l3': 46, 'n_units_l4': 15, 'optimizer': 'Adam', 'adam_learning_rate': 1.0270682489255438e-05}. Best is trial 308 with value: 0.7888889312744141.
Trial 330 finished with value: 0.6555555462837219 and parameters: {'n_layers': 4, 'weight_decay': 0.0004645174964214069, 'n_units_l0': 22, 'n_units_l1': 6, 'n_units_l2': 7, 'n_units_l3': 44, 'optimizer': 'Adam', 'adam_learning_rate': 1.8073003596414305e-05}. Best is trial 308 with value: 0.7888889312744141.
Trial 331 finished with value: 0.46666666865348816 and parameters: {'n_layers': 5, 'weight_decay': 6.274286629299659e-07, 'n_units_l0': 21, 'n_units_l1': 4, 'n_units_l2': 56, 'n_units_l3': 48, 'n_units_l4': 14, 'optimizer': 'Adam', 'adam_learning_rate': 2.7465149966306153e-05}. Best is trial 308 with value: 0.7888889312744141.
Trial 332 finished with value: 0.6333333849906921 and parameters: {'n_layers': 5, 'weight_decay': 0.0009606184281763135, 'n_units_l0': 23, 'n_units_l1': 5, 'n_units_l2': 8, 'n_units_l3': 53, 'n_units_l4': 16, 'optimizer': 'Adam', 'adam_learning_rate': 1.6197697980933685e-05}. Best is trial 308 with value: 0.7888889312744141.
Trial 333 finished with value: 0.4000000059604645 and parameters: {'n_layers': 6, 'weight_decay': 1.18921148262441e-06, 'n_units_l0': 33, 'n_units_l1': 7, 'n_units_l2': 71, 'n_units_l3': 61, 'n_units_l4': 15, 'n_units_l5': 30, 'optimizer': 'Adam', 'adam_learning_rate': 3.0363975810392946e-05}. Best is trial 308 with value: 0.7888889312744141.
Trial 334 finished with value: 0.6000000834465027 and parameters: {'n_layers': 13, 'weight_decay': 8.740097509481141e-07, 'n_units_l0': 27, 'n_units_l1': 6, 'n_units_l2': 8, 'n_units_l3': 40, 'n_units_l4': 18, 'n_units_l5': 35, 'n_units_l6': 116, 'n_units_l7': 25, 'n_units_l8': 22, 'n_units_l9': 21, 'n_units_l10': 71, 'n_units_l11': 22, 'n_units_l12': 60, 'optimizer': 'Adam', 'adam_learning_rate': 5.7522497147480324e-05}. Best is trial 308 with value: 0.7888889312744141.
Trial 335 finished with value: 0.6888889670372009 and parameters: {'n_layers': 3, 'weight_decay': 1.6180660836436452e-06, 'n_units_l0': 29, 'n_units_l1': 5, 'n_units_l2': 27, 'optimizer': 'Adam', 'adam_learning_rate': 0.007903623090513389}. Best is trial 308 with value: 0.7888889312744141.
Trial 336 finished with value: 0.4888889491558075 and parameters: {'n_layers': 9, 'weight_decay': 0.00039658525906562743, 'n_units_l0': 22, 'n_units_l1': 7, 'n_units_l2': 61, 'n_units_l3': 52, 'n_units_l4': 13, 'n_units_l5': 32, 'n_units_l6': 29, 'n_units_l7': 12, 'n_units_l8': 20, 'optimizer': 'Adam', 'adam_learning_rate': 0.00562029007913688}. Best is trial 308 with value: 0.7888889312744141.
Trial 337 finished with value: 0.7000000476837158 and parameters: {'n_layers': 6, 'weight_decay': 1.9738018667904163e-06, 'n_units_l0': 25, 'n_units_l1': 5, 'n_units_l2': 7, 'n_units_l3': 56, 'n_units_l4': 16, 'n_units_l5': 28, 'optimizer': 'Adam', 'adam_learning_rate': 3.9567516354427846e-05}. Best is trial 308 with value: 0.7888889312744141.
Trial 338 finished with value: 0.6222222447395325 and parameters: {'n_layers': 12, 'weight_decay': 3.0818649284232364e-06, 'n_units_l0': 20, 'n_units_l1': 7, 'n_units_l2': 9, 'n_units_l3': 68, 'n_units_l4': 17, 'n_units_l5': 30, 'n_units_l6': 40, 'n_units_l7': 29, 'n_units_l8': 51, 'n_units_l9': 14, 'n_units_l10': 88, 'n_units_l11': 30, 'optimizer': 'Adam', 'adam_learning_rate': 0.00010787998492266602}. Best is trial 308 with value: 0.7888889312744141.
Trial 339 finished with value: 0.6000000834465027 and parameters: {'n_layers': 9, 'weight_decay': 8.456480149559645e-07, 'n_units_l0': 31, 'n_units_l1': 6, 'n_units_l2': 47, 'n_units_l3': 42, 'n_units_l4': 14, 'n_units_l5': 14, 'n_units_l6': 31, 'n_units_l7': 15, 'n_units_l8': 39, 'optimizer': 'RMSprop', 'rmsprop_learning_rate': 0.00011715928486101853, 'rmsprop_weight_decay': 0.9414306943548967, 'rmsprop_momentum': 1.2252934373149962e-05}. Best is trial 308 with value: 0.7888889312744141.
Trial 340 finished with value: 0.6222222447395325 and parameters: {'n_layers': 5, 'weight_decay': 2.1370352560222617e-06, 'n_units_l0': 34, 'n_units_l1': 8, 'n_units_l2': 8, 'n_units_l3': 63, 'n_units_l4': 15, 'optimizer': 'Adam', 'adam_learning_rate': 0.017180016427195015}. Best is trial 308 with value: 0.7888889312744141.
Trial 341 finished with value: 0.5666666626930237 and parameters: {'n_layers': 13, 'weight_decay': 3.52835634119291e-06, 'n_units_l0': 26, 'n_units_l1': 7, 'n_units_l2': 12, 'n_units_l3': 46, 'n_units_l4': 18, 'n_units_l5': 38, 'n_units_l6': 33, 'n_units_l7': 20, 'n_units_l8': 46, 'n_units_l9': 19, 'n_units_l10': 25, 'n_units_l11': 14, 'n_units_l12': 30, 'optimizer': 'RMSprop', 'rmsprop_learning_rate': 0.0001486036726116789, 'rmsprop_weight_decay': 0.9307097921255263, 'rmsprop_momentum': 1.837209545294822e-05}. Best is trial 308 with value: 0.7888889312744141.
Trial 342 finished with value: 0.5555555820465088 and parameters: {'n_layers': 7, 'weight_decay': 1.3642945890113085e-06, 'n_units_l0': 36, 'n_units_l1': 6, 'n_units_l2': 61, 'n_units_l3': 49, 'n_units_l4': 25, 'n_units_l5': 20, 'n_units_l6': 35, 'optimizer': 'Adam', 'adam_learning_rate': 0.0296372194497925}. Best is trial 308 with value: 0.7888889312744141.
Trial 343 finished with value: 0.6777777671813965 and parameters: {'n_layers': 8, 'weight_decay': 4.344824624002829e-06, 'n_units_l0': 48, 'n_units_l1': 8, 'n_units_l2': 6, 'n_units_l3': 59, 'n_units_l4': 19, 'n_units_l5': 49, 'n_units_l6': 45, 'n_units_l7': 13, 'optimizer': 'RMSprop', 'rmsprop_learning_rate': 0.008327202265519227, 'rmsprop_weight_decay': 0.8980690914446453, 'rmsprop_momentum': 0.0002463803007740942}. Best is trial 308 with value: 0.7888889312744141.
Trial 344 finished with value: 0.5000000596046448 and parameters: {'n_layers': 4, 'weight_decay': 0.00015156160719733295, 'n_units_l0': 30, 'n_units_l1': 9, 'n_units_l2': 52, 'n_units_l3': 80, 'optimizer': 'Adam', 'adam_learning_rate': 0.000694325274636873}. Best is trial 308 with value: 0.7888889312744141.
Trial 345 finished with value: 0.699999988079071 and parameters: {'n_layers': 7, 'weight_decay': 2.585577780552241e-06, 'n_units_l0': 33, 'n_units_l1': 10, 'n_units_l2': 9, 'n_units_l3': 70, 'n_units_l4': 16, 'n_units_l5': 26, 'n_units_l6': 54, 'optimizer': 'RMSprop', 'rmsprop_learning_rate': 0.0003815577630242382, 'rmsprop_weight_decay': 0.9184565637459343, 'rmsprop_momentum': 0.003275665862995256}. Best is trial 308 with value: 0.7888889312744141.
Trial 346 finished with value: 0.7444444298744202 and parameters: {'n_layers': 9, 'weight_decay': 5.8908595198478554e-06, 'n_units_l0': 70, 'n_units_l1': 8, 'n_units_l2': 7, 'n_units_l3': 53, 'n_units_l4': 23, 'n_units_l5': 44, 'n_units_l6': 40, 'n_units_l7': 17, 'n_units_l8': 59, 'optimizer': 'RMSprop', 'rmsprop_learning_rate': 0.005859303951950051, 'rmsprop_weight_decay': 0.8834029354437507, 'rmsprop_momentum': 0.00010239034573156102}. Best is trial 308 with value: 0.7888889312744141.
Trial 347 finished with value: 0.5777778029441833 and parameters: {'n_layers': 9, 'weight_decay': 4.68141207648348e-06, 'n_units_l0': 66, 'n_units_l1': 8, 'n_units_l2': 7, 'n_units_l3': 43, 'n_units_l4': 23, 'n_units_l5': 43, 'n_units_l6': 43, 'n_units_l7': 7, 'n_units_l8': 59, 'optimizer': 'RMSprop', 'rmsprop_learning_rate': 0.01102599627767154, 'rmsprop_weight_decay': 0.9367399663367055, 'rmsprop_momentum': 9.705011048457277e-05}. Best is trial 308 with value: 0.7888889312744141.
Trial 348 finished with value: 0.5888888835906982 and parameters: {'n_layers': 9, 'weight_decay': 6.7834963073077345e-06, 'n_units_l0': 72, 'n_units_l1': 8, 'n_units_l2': 6, 'n_units_l3': 51, 'n_units_l4': 24, 'n_units_l5': 44, 'n_units_l6': 50, 'n_units_l7': 18, 'n_units_l8': 63, 'optimizer': 'RMSprop', 'rmsprop_learning_rate': 1.9685899454096773e-05, 'rmsprop_weight_decay': 0.8858033667892308, 'rmsprop_momentum': 5.836600831359295e-05}. Best is trial 308 with value: 0.7888889312744141.
Trial 349 finished with value: 0.6555555462837219 and parameters: {'n_layers': 8, 'weight_decay': 5.265275550091692e-06, 'n_units_l0': 42, 'n_units_l1': 9, 'n_units_l2': 14, 'n_units_l3': 77, 'n_units_l4': 26, 'n_units_l5': 46, 'n_units_l6': 38, 'n_units_l7': 106, 'optimizer': 'RMSprop', 'rmsprop_learning_rate': 0.009632598299329621, 'rmsprop_weight_decay': 0.8570240637844362, 'rmsprop_momentum': 3.182114505054891e-05}. Best is trial 308 with value: 0.7888889312744141.
Trial 350 finished with value: 0.4555555582046509 and parameters: {'n_layers': 19, 'weight_decay': 3.362059720440446e-06, 'n_units_l0': 92, 'n_units_l1': 7, 'n_units_l2': 18, 'n_units_l3': 66, 'n_units_l4': 20, 'n_units_l5': 39, 'n_units_l6': 40, 'n_units_l7': 18, 'n_units_l8': 56, 'n_units_l9': 15, 'n_units_l10': 21, 'n_units_l11': 46, 'n_units_l12': 4, 'n_units_l13': 16, 'n_units_l14': 27, 'n_units_l15': 5, 'n_units_l16': 125, 'n_units_l17': 7, 'n_units_l18': 40, 'optimizer': 'RMSprop', 'rmsprop_learning_rate': 0.006174932677984839, 'rmsprop_weight_decay': 0.8746166480595324, 'rmsprop_momentum': 0.00019876675444328068}. Best is trial 308 with value: 0.7888889312744141.
Trial 351 finished with value: 0.5777778029441833 and parameters: {'n_layers': 10, 'weight_decay': 9.134564252026364e-05, 'n_units_l0': 80, 'n_units_l1': 8, 'n_units_l2': 7, 'n_units_l3': 74, 'n_units_l4': 23, 'n_units_l5': 27, 'n_units_l6': 47, 'n_units_l7': 16, 'n_units_l8': 73, 'n_units_l9': 12, 'optimizer': 'RMSprop', 'rmsprop_learning_rate': 0.00023797329375306137, 'rmsprop_weight_decay': 0.8820994219217132, 'rmsprop_momentum': 7.06279779130643e-05}. Best is trial 308 with value: 0.7888889312744141.
Trial 352 finished with value: 0.7333333492279053 and parameters: {'n_layers': 9, 'weight_decay': 1.4003535455437305e-06, 'n_units_l0': 24, 'n_units_l1': 9, 'n_units_l2': 13, 'n_units_l3': 60, 'n_units_l4': 21, 'n_units_l5': 34, 'n_units_l6': 40, 'n_units_l7': 23, 'n_units_l8': 68, 'optimizer': 'RMSprop', 'rmsprop_learning_rate': 0.005519948385628453, 'rmsprop_weight_decay': 0.8650821369368553, 'rmsprop_momentum': 0.00027073694268127965}. Best is trial 308 with value: 0.7888889312744141.
Trial 353 finished with value: 0.5666666626930237 and parameters: {'n_layers': 9, 'weight_decay': 9.981987227664162e-07, 'n_units_l0': 22, 'n_units_l1': 9, 'n_units_l2': 13, 'n_units_l3': 62, 'n_units_l4': 21, 'n_units_l5': 52, 'n_units_l6': 41, 'n_units_l7': 26, 'n_units_l8': 66, 'optimizer': 'RMSprop', 'rmsprop_learning_rate': 0.005835668158158908, 'rmsprop_weight_decay': 0.8779922602225453, 'rmsprop_momentum': 0.00014346882996426182}. Best is trial 308 with value: 0.7888889312744141.
Trial 354 finished with value: 0.7333333492279053 and parameters: {'n_layers': 8, 'weight_decay': 6.332624981817683e-07, 'n_units_l0': 51, 'n_units_l1': 11, 'n_units_l2': 13, 'n_units_l3': 66, 'n_units_l4': 22, 'n_units_l5': 63, 'n_units_l6': 43, 'n_units_l7': 23, 'optimizer': 'RMSprop', 'rmsprop_learning_rate': 0.006889021405612147, 'rmsprop_weight_decay': 0.8678318008165796, 'rmsprop_momentum': 0.00027803970152368577}. Best is trial 308 with value: 0.7888889312744141.
Trial 355 finished with value: 0.7333333492279053 and parameters: {'n_layers': 8, 'weight_decay': 1.4997475740959464e-06, 'n_units_l0': 50, 'n_units_l1': 10, 'n_units_l2': 13, 'n_units_l3': 69, 'n_units_l4': 21, 'n_units_l5': 73, 'n_units_l6': 44, 'n_units_l7': 23, 'optimizer': 'RMSprop', 'rmsprop_learning_rate': 0.007497863335576247, 'rmsprop_weight_decay': 0.8676719927153365, 'rmsprop_momentum': 0.00028243317784462375}. Best is trial 308 with value: 0.7888889312744141.
Trial 356 finished with value: 0.699999988079071 and parameters: {'n_layers': 8, 'weight_decay': 8.507296539094436e-07, 'n_units_l0': 60, 'n_units_l1': 11, 'n_units_l2': 12, 'n_units_l3': 67, 'n_units_l4': 21, 'n_units_l5': 62, 'n_units_l6': 51, 'n_units_l7': 23, 'optimizer': 'RMSprop', 'rmsprop_learning_rate': 0.023133133070368222, 'rmsprop_weight_decay': 0.8628284120936728, 'rmsprop_momentum': 0.00029734740141149497}. Best is trial 308 with value: 0.7888889312744141.
Trial 357 finished with value: 0.5222222208976746 and parameters: {'n_layers': 8, 'weight_decay': 1.4020729780781347e-06, 'n_units_l0': 53, 'n_units_l1': 10, 'n_units_l2': 12, 'n_units_l3': 73, 'n_units_l4': 22, 'n_units_l5': 87, 'n_units_l6': 13, 'n_units_l7': 30, 'optimizer': 'RMSprop', 'rmsprop_learning_rate': 0.007273487016851049, 'rmsprop_weight_decay': 0.8690034280438182, 'rmsprop_momentum': 0.00017163732923889958}. Best is trial 308 with value: 0.7888889312744141.
Trial 358 finished with value: 0.4888889491558075 and parameters: {'n_layers': 8, 'weight_decay': 5.700075092365066e-07, 'n_units_l0': 87, 'n_units_l1': 12, 'n_units_l2': 11, 'n_units_l3': 69, 'n_units_l4': 20, 'n_units_l5': 66, 'n_units_l6': 46, 'n_units_l7': 27, 'optimizer': 'RMSprop', 'rmsprop_learning_rate': 0.015878475148009462, 'rmsprop_weight_decay': 0.8677122042853098, 'rmsprop_momentum': 0.0002473125397776696}. Best is trial 308 with value: 0.7888889312744141.
Trial 359 finished with value: 0.4777778089046478 and parameters: {'n_layers': 7, 'weight_decay': 5.068873429817509e-07, 'n_units_l0': 50, 'n_units_l1': 12, 'n_units_l2': 13, 'n_units_l3': 63, 'n_units_l4': 21, 'n_units_l5': 71, 'n_units_l6': 44, 'optimizer': 'RMSprop', 'rmsprop_learning_rate': 0.005248618760576843, 'rmsprop_weight_decay': 0.8582149045647378, 'rmsprop_momentum': 0.0003574212029173927}. Best is trial 308 with value: 0.7888889312744141.
Trial 360 finished with value: 0.5999999642372131 and parameters: {'n_layers': 7, 'weight_decay': 1.352190003394995e-06, 'n_units_l0': 56, 'n_units_l1': 11, 'n_units_l2': 13, 'n_units_l3': 80, 'n_units_l4': 19, 'n_units_l5': 89, 'n_units_l6': 54, 'optimizer': 'RMSprop', 'rmsprop_learning_rate': 0.009923051365584046, 'rmsprop_weight_decay': 0.853436249647133, 'rmsprop_momentum': 0.0001241619743053585}. Best is trial 308 with value: 0.7888889312744141.
Trial 361 finished with value: 0.7222222685813904 and parameters: {'n_layers': 8, 'weight_decay': 7.311933891889362e-07, 'n_units_l0': 49, 'n_units_l1': 10, 'n_units_l2': 11, 'n_units_l3': 34, 'n_units_l4': 18, 'n_units_l5': 79, 'n_units_l6': 47, 'n_units_l7': 25, 'optimizer': 'RMSprop', 'rmsprop_learning_rate': 0.004226280540895254, 'rmsprop_weight_decay': 0.8706236287185758, 'rmsprop_momentum': 0.00015482326734300698}. Best is trial 308 with value: 0.7888889312744141.
Trial 362 finished with value: 0.4777778089046478 and parameters: {'n_layers': 8, 'weight_decay': 6.124457574209518e-05, 'n_units_l0': 56, 'n_units_l1': 9, 'n_units_l2': 13, 'n_units_l3': 6, 'n_units_l4': 24, 'n_units_l5': 57, 'n_units_l6': 40, 'n_units_l7': 23, 'optimizer': 'RMSprop', 'rmsprop_learning_rate': 0.00801827264334626, 'rmsprop_weight_decay': 0.8652625968924059, 'rmsprop_momentum': 0.0004287853371500602}. Best is trial 308 with value: 0.7888889312744141.
Trial 363 finished with value: 0.6555555462837219 and parameters: {'n_layers': 8, 'weight_decay': 1.7383229979088511e-06, 'n_units_l0': 46, 'n_units_l1': 11, 'n_units_l2': 12, 'n_units_l3': 70, 'n_units_l4': 22, 'n_units_l5': 72, 'n_units_l6': 42, 'n_units_l7': 24, 'optimizer': 'RMSprop', 'rmsprop_learning_rate': 0.013266228229984538, 'rmsprop_weight_decay': 0.8730668112330315, 'rmsprop_momentum': 0.00027280362004356706}. Best is trial 308 with value: 0.7888889312744141.
Trial 364 finished with value: 0.5333333611488342 and parameters: {'n_layers': 7, 'weight_decay': 8.991577514641552e-05, 'n_units_l0': 52, 'n_units_l1': 9, 'n_units_l2': 14, 'n_units_l3': 58, 'n_units_l4': 19, 'n_units_l5': 60, 'n_units_l6': 49, 'optimizer': 'RMSprop', 'rmsprop_learning_rate': 0.006179849750192225, 'rmsprop_weight_decay': 0.85117012445601, 'rmsprop_momentum': 0.0002068806939618145}. Best is trial 308 with value: 0.7888889312744141.
Trial 365 finished with value: 0.5777778029441833 and parameters: {'n_layers': 6, 'weight_decay': 8.51884743499344e-06, 'n_units_l0': 47, 'n_units_l1': 10, 'n_units_l2': 14, 'n_units_l3': 66, 'n_units_l4': 23, 'n_units_l5': 35, 'optimizer': 'RMSprop', 'rmsprop_learning_rate': 0.004822346557143896, 'rmsprop_weight_decay': 0.8608289814320198, 'rmsprop_momentum': 0.0003445233539284061}. Best is trial 308 with value: 0.7888889312744141.
Trial 366 finished with value: 0.6111111640930176 and parameters: {'n_layers': 7, 'weight_decay': 6.880155342965946e-07, 'n_units_l0': 19, 'n_units_l1': 9, 'n_units_l2': 10, 'n_units_l3': 77, 'n_units_l4': 20, 'n_units_l5': 66, 'n_units_l6': 37, 'optimizer': 'RMSprop', 'rmsprop_learning_rate': 0.0034646580399893294, 'rmsprop_weight_decay': 0.8788893323562508, 'rmsprop_momentum': 9.201899909149336e-05}. Best is trial 308 with value: 0.7888889312744141.
Trial 367 finished with value: 0.6111111640930176 and parameters: {'n_layers': 9, 'weight_decay': 1.1136119362862763e-06, 'n_units_l0': 23, 'n_units_l1': 11, 'n_units_l2': 12, 'n_units_l3': 27, 'n_units_l4': 18, 'n_units_l5': 79, 'n_units_l6': 32, 'n_units_l7': 22, 'n_units_l8': 81, 'optimizer': 'RMSprop', 'rmsprop_learning_rate': 0.007254000406588194, 'rmsprop_weight_decay': 0.8917347412791974, 'rmsprop_momentum': 0.000873792736631719}. Best is trial 308 with value: 0.7888889312744141.
