Trial 175 finished with value: 0.4444444477558136 and parameters: {'n_layers': 6, 'weight_decay': 0.00010800489439749958, 'n_units_l0': 31, 'n_units_l1': 9, 'n_units_l2': 6, 'n_units_l3': 4, 'n_units_l4': 19, 'n_units_l5': 15, 'optimizer': 'Adam', 'adam_learning_rate': 0.0503914304570083}. Best is trial 7 with value: 0.7555555701255798.
Trial 176 finished with value: 0.7444444298744202 and parameters: {'n_layers': 7, 'weight_decay': 4.06188052818104e-05, 'n_units_l0': 33, 'n_units_l1': 7, 'n_units_l2': 16, 'n_units_l3': 61, 'n_units_l4': 15, 'n_units_l5': 27, 'n_units_l6': 40, 'optimizer': 'RMSprop', 'rmsprop_learning_rate': 0.0032551941117121928, 'rmsprop_weight_decay': 0.9144680591665177, 'rmsprop_momentum': 0.0025432490156112753}. Best is trial 7 with value: 0.7555555701255798.
Trial 177 finished with value: 0.5999999642372131 and parameters: {'n_layers': 7, 'weight_decay': 1.3658021196806726e-05, 'n_units_l0': 33, 'n_units_l1': 8, 'n_units_l2': 16, 'n_units_l3': 59, 'n_units_l4': 15, 'n_units_l5': 28, 'n_units_l6': 25, 'optimizer': 'RMSprop', 'rmsprop_learning_rate': 0.0034052401579605924, 'rmsprop_weight_decay': 0.9117367021682216, 'rmsprop_momentum': 0.003826174203265594}. Best is trial 7 with value: 0.7555555701255798.
Trial 178 finished with value: 0.7444444298744202 and parameters: {'n_layers': 6, 'weight_decay': 6.118208668569455e-05, 'n_units_l0': 37, 'n_units_l1': 7, 'n_units_l2': 17, 'n_units_l3': 75, 'n_units_l4': 16, 'n_units_l5': 27, 'optimizer': 'SGD', 'sgd_opt_learning_rate': 0.0032628822666643013, 'sgd_opt_momentum': 0.00024614670352849467}. Best is trial 7 with value: 0.7555555701255798.
Trial 179 finished with value: 0.5666666626930237 and parameters: {'n_layers': 7, 'weight_decay': 2.2827020761243212e-05, 'n_units_l0': 38, 'n_units_l1': 7, 'n_units_l2': 14, 'n_units_l3': 69, 'n_units_l4': 13, 'n_units_l5': 26, 'n_units_l6': 52, 'optimizer': 'SGD', 'sgd_opt_learning_rate': 0.0034241902828679592, 'sgd_opt_momentum': 0.00029926369786014627}. Best is trial 7 with value: 0.7555555701255798.
Trial 180 finished with value: 0.7111111283302307 and parameters: {'n_layers': 11, 'weight_decay': 3.9116168028921746e-05, 'n_units_l0': 37, 'n_units_l1': 9, 'n_units_l2': 15, 'n_units_l3': 90, 'n_units_l4': 16, 'n_units_l5': 24, 'n_units_l6': 18, 'n_units_l7': 53, 'n_units_l8': 31, 'n_units_l9': 41, 'n_units_l10': 11, 'optimizer': 'SGD', 'sgd_opt_learning_rate': 0.0004638199059637744, 'sgd_opt_momentum': 0.0007957893953652023}. Best is trial 7 with value: 0.7555555701255798.
Trial 181 finished with value: 0.5999999642372131 and parameters: {'n_layers': 11, 'weight_decay': 4.505194260044669e-05, 'n_units_l0': 35, 'n_units_l1': 9, 'n_units_l2': 19, 'n_units_l3': 75, 'n_units_l4': 14, 'n_units_l5': 24, 'n_units_l6': 17, 'n_units_l7': 14, 'n_units_l8': 29, 'n_units_l9': 41, 'n_units_l10': 9, 'optimizer': 'SGD', 'sgd_opt_learning_rate': 0.0003471485984658139, 'sgd_opt_momentum': 0.0008702542442885059}. Best is trial 7 with value: 0.7555555701255798.
Trial 182 finished with value: 0.4555555582046509 and parameters: {'n_layers': 12, 'weight_decay': 3.684461715165631e-05, 'n_units_l0': 49, 'n_units_l1': 7, 'n_units_l2': 17, 'n_units_l3': 103, 'n_units_l4': 16, 'n_units_l5': 28, 'n_units_l6': 18, 'n_units_l7': 17, 'n_units_l8': 25, 'n_units_l9': 25, 'n_units_l10': 11, 'n_units_l11': 59, 'optimizer': 'SGD', 'sgd_opt_learning_rate': 0.004099378704731534, 'sgd_opt_momentum': 0.00016747087730209023}. Best is trial 7 with value: 0.7555555701255798.
Trial 183 finished with value: 0.7333333492279053 and parameters: {'n_layers': 11, 'weight_decay': 6.405054377778411e-05, 'n_units_l0': 41, 'n_units_l1': 8, 'n_units_l2': 15, 'n_units_l3': 88, 'n_units_l4': 17, 'n_units_l5': 25, 'n_units_l6': 19, 'n_units_l7': 40, 'n_units_l8': 51, 'n_units_l9': 46, 'n_units_l10': 14, 'optimizer': 'SGD', 'sgd_opt_learning_rate': 0.0004798304803631691, 'sgd_opt_momentum': 0.0024481311640090543}. Best is trial 7 with value: 0.7555555701255798.
Trial 184 finished with value: 0.5666666626930237 and parameters: {'n_layers': 11, 'weight_decay': 6.168609393569502e-05, 'n_units_l0': 45, 'n_units_l1': 8, 'n_units_l2': 15, 'n_units_l3': 91, 'n_units_l4': 17, 'n_units_l5': 19, 'n_units_l6': 19, 'n_units_l7': 55, 'n_units_l8': 50, 'n_units_l9': 33, 'n_units_l10': 14, 'optimizer': 'SGD', 'sgd_opt_learning_rate': 0.0005743609944767428, 'sgd_opt_momentum': 0.002521934501881683}. Best is trial 7 with value: 0.7555555701255798.
Trial 185 finished with value: 0.7111110687255859 and parameters: {'n_layers': 10, 'weight_decay': 2.7500513052252542e-05, 'n_units_l0': 37, 'n_units_l1': 8, 'n_units_l2': 16, 'n_units_l3': 69, 'n_units_l4': 15, 'n_units_l5': 23, 'n_units_l6': 23, 'n_units_l7': 19, 'n_units_l8': 56, 'n_units_l9': 46, 'optimizer': 'SGD', 'sgd_opt_learning_rate': 0.0024302326038104375, 'sgd_opt_momentum': 0.0005565299927102083}. Best is trial 7 with value: 0.7555555701255798.
Trial 186 finished with value: 0.6111111640930176 and parameters: {'n_layers': 10, 'weight_decay': 1.80033673638939e-05, 'n_units_l0': 41, 'n_units_l1': 8, 'n_units_l2': 16, 'n_units_l3': 86, 'n_units_l4': 12, 'n_units_l5': 22, 'n_units_l6': 22, 'n_units_l7': 89, 'n_units_l8': 55, 'n_units_l9': 44, 'optimizer': 'SGD', 'sgd_opt_learning_rate': 0.002202528038099534, 'sgd_opt_momentum': 0.0006257714912776245}. Best is trial 7 with value: 0.7555555701255798.
Trial 187 finished with value: 0.6111111640930176 and parameters: {'n_layers': 10, 'weight_decay': 2.8987140469458723e-05, 'n_units_l0': 37, 'n_units_l1': 8, 'n_units_l2': 18, 'n_units_l3': 77, 'n_units_l4': 15, 'n_units_l5': 25, 'n_units_l6': 21, 'n_units_l7': 39, 'n_units_l8': 59, 'n_units_l9': 48, 'optimizer': 'SGD', 'sgd_opt_learning_rate': 0.002051248949165622, 'sgd_opt_momentum': 0.0014970646624094621}. Best is trial 7 with value: 0.7555555701255798.
Trial 188 finished with value: 0.6888889670372009 and parameters: {'n_layers': 11, 'weight_decay': 1.154681656572453e-06, 'n_units_l0': 52, 'n_units_l1': 9, 'n_units_l2': 15, 'n_units_l3': 84, 'n_units_l4': 16, 'n_units_l5': 23, 'n_units_l6': 24, 'n_units_l7': 19, 'n_units_l8': 67, 'n_units_l9': 31, 'n_units_l10': 12, 'optimizer': 'SGD', 'sgd_opt_learning_rate': 0.0006159935811511201, 'sgd_opt_momentum': 0.0037631712501108097}. Best is trial 7 with value: 0.7555555701255798.
Trial 189 finished with value: 0.7333333492279053 and parameters: {'n_layers': 11, 'weight_decay': 5.552041494803123e-06, 'n_units_l0': 54, 'n_units_l1': 9, 'n_units_l2': 14, 'n_units_l3': 95, 'n_units_l4': 16, 'n_units_l5': 23, 'n_units_l6': 20, 'n_units_l7': 19, 'n_units_l8': 18, 'n_units_l9': 56, 'n_units_l10': 12, 'optimizer': 'SGD', 'sgd_opt_learning_rate': 0.0005880829976484956, 'sgd_opt_momentum': 0.004387109982449372}. Best is trial 7 with value: 0.7555555701255798.
Trial 190 finished with value: 0.5111111402511597 and parameters: {'n_layers': 11, 'weight_decay': 6.817493565909773e-06, 'n_units_l0': 76, 'n_units_l1': 10, 'n_units_l2': 13, 'n_units_l3': 95, 'n_units_l4': 13, 'n_units_l5': 18, 'n_units_l6': 16, 'n_units_l7': 53, 'n_units_l8': 19, 'n_units_l9': 57, 'n_units_l10': 11, 'optimizer': 'SGD', 'sgd_opt_learning_rate': 0.0001853799702035017, 'sgd_opt_momentum': 0.00046130374365142856}. Best is trial 7 with value: 0.7555555701255798.
Trial 191 finished with value: 0.30000001192092896 and parameters: {'n_layers': 11, 'weight_decay': 1.1657626327768945e-06, 'n_units_l0': 48, 'n_units_l1': 9, 'n_units_l2': 14, 'n_units_l3': 64, 'n_units_l4': 16, 'n_units_l5': 23, 'n_units_l6': 24, 'n_units_l7': 19, 'n_units_l8': 23, 'n_units_l9': 53, 'n_units_l10': 12, 'optimizer': 'SGD', 'sgd_opt_learning_rate': 0.0005490605875013391, 'sgd_opt_momentum': 0.003350688426976377}. Best is trial 7 with value: 0.7555555701255798.
Trial 192 finished with value: 0.6888888478279114 and parameters: {'n_layers': 12, 'weight_decay': 1.8241748323444542e-06, 'n_units_l0': 54, 'n_units_l1': 9, 'n_units_l2': 15, 'n_units_l3': 81, 'n_units_l4': 18, 'n_units_l5': 21, 'n_units_l6': 18, 'n_units_l7': 19, 'n_units_l8': 16, 'n_units_l9': 37, 'n_units_l10': 15, 'n_units_l11': 82, 'optimizer': 'SGD', 'sgd_opt_learning_rate': 0.0006184725681298386, 'sgd_opt_momentum': 0.005061917575627185}. Best is trial 7 with value: 0.7555555701255798.
Trial 193 finished with value: 0.6555555462837219 and parameters: {'n_layers': 10, 'weight_decay': 2.61959515418458e-06, 'n_units_l0': 53, 'n_units_l1': 8, 'n_units_l2': 15, 'n_units_l3': 70, 'n_units_l4': 14, 'n_units_l5': 24, 'n_units_l6': 20, 'n_units_l7': 16, 'n_units_l8': 69, 'n_units_l9': 29, 'optimizer': 'SGD', 'sgd_opt_learning_rate': 0.0015608366965312555, 'sgd_opt_momentum': 0.001986167407639222}. Best is trial 7 with value: 0.7555555701255798.
Trial 194 finished with value: 0.5444444417953491 and parameters: {'n_layers': 11, 'weight_decay': 8.873418797053639e-06, 'n_units_l0': 60, 'n_units_l1': 7, 'n_units_l2': 14, 'n_units_l3': 113, 'n_units_l4': 15, 'n_units_l5': 20, 'n_units_l6': 23, 'n_units_l7': 48, 'n_units_l8': 17, 'n_units_l9': 46, 'n_units_l10': 10, 'optimizer': 'SGD', 'sgd_opt_learning_rate': 0.0008653423803696894, 'sgd_opt_momentum': 0.0011320149602789173}. Best is trial 7 with value: 0.7555555701255798.
Trial 195 finished with value: 0.5111111402511597 and parameters: {'n_layers': 13, 'weight_decay': 4.428459039877478e-06, 'n_units_l0': 43, 'n_units_l1': 9, 'n_units_l2': 13, 'n_units_l3': 84, 'n_units_l4': 17, 'n_units_l5': 17, 'n_units_l6': 19, 'n_units_l7': 18, 'n_units_l8': 52, 'n_units_l9': 41, 'n_units_l10': 8, 'n_units_l11': 8, 'n_units_l12': 12, 'optimizer': 'SGD', 'sgd_opt_learning_rate': 0.0002011139539608415, 'sgd_opt_momentum': 0.004988499286170454}. Best is trial 7 with value: 0.7555555701255798.
Trial 196 finished with value: 0.5111111402511597 and parameters: {'n_layers': 12, 'weight_decay': 3.980238463341241e-05, 'n_units_l0': 40, 'n_units_l1': 8, 'n_units_l2': 15, 'n_units_l3': 95, 'n_units_l4': 15, 'n_units_l5': 26, 'n_units_l6': 21, 'n_units_l7': 20, 'n_units_l8': 21, 'n_units_l9': 31, 'n_units_l10': 12, 'n_units_l11': 27, 'optimizer': 'SGD', 'sgd_opt_learning_rate': 0.0009403003963153464, 'sgd_opt_momentum': 0.0016282229051245425}. Best is trial 7 with value: 0.7555555701255798.
Trial 197 finished with value: 0.4777778089046478 and parameters: {'n_layers': 10, 'weight_decay': 1.3849502376885998e-05, 'n_units_l0': 36, 'n_units_l1': 10, 'n_units_l2': 17, 'n_units_l3': 108, 'n_units_l4': 16, 'n_units_l5': 22, 'n_units_l6': 26, 'n_units_l7': 17, 'n_units_l8': 32, 'n_units_l9': 66, 'optimizer': 'SGD', 'sgd_opt_learning_rate': 0.007866281528592084, 'sgd_opt_momentum': 0.0035350013958849466}. Best is trial 7 with value: 0.7555555701255798.
Trial 198 finished with value: 0.5999999642372131 and parameters: {'n_layers': 11, 'weight_decay': 2.3633435390265876e-05, 'n_units_l0': 57, 'n_units_l1': 7, 'n_units_l2': 16, 'n_units_l3': 71, 'n_units_l4': 12, 'n_units_l5': 19, 'n_units_l6': 23, 'n_units_l7': 21, 'n_units_l8': 45, 'n_units_l9': 40, 'n_units_l10': 19, 'optimizer': 'SGD', 'sgd_opt_learning_rate': 0.0013781768022444352, 'sgd_opt_momentum': 0.0005991940077654624}. Best is trial 7 with value: 0.7555555701255798.
Trial 199 finished with value: 0.4555555582046509 and parameters: {'n_layers': 9, 'weight_decay': 3.6550460610610614e-07, 'n_units_l0': 52, 'n_units_l1': 6, 'n_units_l2': 17, 'n_units_l3': 76, 'n_units_l4': 18, 'n_units_l5': 23, 'n_units_l6': 17, 'n_units_l7': 15, 'n_units_l8': 67, 'optimizer': 'SGD', 'sgd_opt_learning_rate': 0.0002627348659037402, 'sgd_opt_momentum': 0.00019697197588911777}. Best is trial 7 with value: 0.7555555701255798.
Trial 200 finished with value: 0.4888888895511627 and parameters: {'n_layers': 12, 'weight_decay': 4.5948239530314896e-05, 'n_units_l0': 61, 'n_units_l1': 7, 'n_units_l2': 13, 'n_units_l3': 95, 'n_units_l4': 14, 'n_units_l5': 25, 'n_units_l6': 27, 'n_units_l7': 18, 'n_units_l8': 56, 'n_units_l9': 35, 'n_units_l10': 14, 'n_units_l11': 124, 'optimizer': 'SGD', 'sgd_opt_learning_rate': 0.0007395939926071773, 'sgd_opt_momentum': 0.008139747246006855}. Best is trial 7 with value: 0.7555555701255798.
Trial 201 finished with value: 0.46666669845581055 and parameters: {'n_layers': 12, 'weight_decay': 5.699640975641919e-06, 'n_units_l0': 35, 'n_units_l1': 15, 'n_units_l2': 19, 'n_units_l3': 84, 'n_units_l4': 20, 'n_units_l5': 27, 'n_units_l6': 39, 'n_units_l7': 19, 'n_units_l8': 64, 'n_units_l9': 54, 'n_units_l10': 14, 'n_units_l11': 92, 'optimizer': 'SGD', 'sgd_opt_learning_rate': 0.0029770406180408574, 'sgd_opt_momentum': 0.0011109427458763277}. Best is trial 7 with value: 0.7555555701255798.
Trial 202 finished with value: 0.5888888835906982 and parameters: {'n_layers': 11, 'weight_decay': 1.5143911833380417e-06, 'n_units_l0': 70, 'n_units_l1': 9, 'n_units_l2': 16, 'n_units_l3': 64, 'n_units_l4': 17, 'n_units_l5': 24, 'n_units_l6': 24, 'n_units_l7': 74, 'n_units_l8': 70, 'n_units_l9': 22, 'n_units_l10': 10, 'optimizer': 'SGD', 'sgd_opt_learning_rate': 5.9738222420104425e-05, 'sgd_opt_momentum': 0.0053609452583922405}. Best is trial 7 with value: 0.7555555701255798.
Trial 203 finished with value: 0.7000000476837158 and parameters: {'n_layers': 10, 'weight_decay': 9.677187702986892e-07, 'n_units_l0': 39, 'n_units_l1': 8, 'n_units_l2': 18, 'n_units_l3': 88, 'n_units_l4': 18, 'n_units_l5': 21, 'n_units_l6': 20, 'n_units_l7': 66, 'n_units_l8': 87, 'n_units_l9': 33, 'optimizer': 'SGD', 'sgd_opt_learning_rate': 0.0012793332417777423, 'sgd_opt_momentum': 0.0025929396747078823}. Best is trial 7 with value: 0.7555555701255798.
Trial 204 finished with value: 0.7666666507720947 and parameters: {'n_layers': 10, 'weight_decay': 1.0313457410848447e-06, 'n_units_l0': 43, 'n_units_l1': 8, 'n_units_l2': 14, 'n_units_l3': 89, 'n_units_l4': 18, 'n_units_l5': 20, 'n_units_l6': 20, 'n_units_l7': 62, 'n_units_l8': 90, 'n_units_l9': 29, 'optimizer': 'SGD', 'sgd_opt_learning_rate': 0.0012469531193693125, 'sgd_opt_momentum': 0.0030972793418232686}. Best is trial 204 with value: 0.7666666507720947.
Trial 205 finished with value: 0.42222222685813904 and parameters: {'n_layers': 10, 'weight_decay': 8.323575524436547e-05, 'n_units_l0': 38, 'n_units_l1': 8, 'n_units_l2': 16, 'n_units_l3': 99, 'n_units_l4': 18, 'n_units_l5': 21, 'n_units_l6': 20, 'n_units_l7': 71, 'n_units_l8': 95, 'n_units_l9': 27, 'optimizer': 'SGD', 'sgd_opt_learning_rate': 0.0013927223716426436, 'sgd_opt_momentum': 0.0025791011979672857}. Best is trial 204 with value: 0.7666666507720947.
Trial 206 finished with value: 0.46666669845581055 and parameters: {'n_layers': 9, 'weight_decay': 6.613841755642984e-07, 'n_units_l0': 41, 'n_units_l1': 8, 'n_units_l2': 18, 'n_units_l3': 88, 'n_units_l4': 19, 'n_units_l5': 20, 'n_units_l6': 21, 'n_units_l7': 43, 'n_units_l8': 83, 'optimizer': 'SGD', 'sgd_opt_learning_rate': 0.0021379927034176137, 'sgd_opt_momentum': 0.0008457258408203888}. Best is trial 204 with value: 0.7666666507720947.
Trial 207 finished with value: 0.46666666865348816 and parameters: {'n_layers': 10, 'weight_decay': 2.0264274366198407e-06, 'n_units_l0': 46, 'n_units_l1': 6, 'n_units_l2': 14, 'n_units_l3': 115, 'n_units_l4': 14, 'n_units_l5': 15, 'n_units_l6': 15, 'n_units_l7': 54, 'n_units_l8': 90, 'n_units_l9': 33, 'optimizer': 'SGD', 'sgd_opt_learning_rate': 0.005578153829221451, 'sgd_opt_momentum': 0.0017335116512818506}. Best is trial 204 with value: 0.7666666507720947.
Trial 208 finished with value: 0.5444444417953491 and parameters: {'n_layers': 9, 'weight_decay': 2.9036597973642682e-06, 'n_units_l0': 43, 'n_units_l1': 4, 'n_units_l2': 14, 'n_units_l3': 74, 'n_units_l4': 4, 'n_units_l5': 18, 'n_units_l6': 18, 'n_units_l7': 67, 'n_units_l8': 101, 'optimizer': 'SGD', 'sgd_opt_learning_rate': 0.00109609738641212, 'sgd_opt_momentum': 0.013484136641397857}. Best is trial 204 with value: 0.7666666507720947.
Trial 209 finished with value: 0.4333333671092987 and parameters: {'n_layers': 10, 'weight_decay': 3.794241543242235e-07, 'n_units_l0': 34, 'n_units_l1': 8, 'n_units_l2': 21, 'n_units_l3': 81, 'n_units_l4': 17, 'n_units_l5': 16, 'n_units_l6': 19, 'n_units_l7': 59, 'n_units_l8': 29, 'n_units_l9': 45, 'optimizer': 'SGD', 'sgd_opt_learning_rate': 0.0023677363499129914, 'sgd_opt_momentum': 0.000480897030171905}. Best is trial 204 with value: 0.7666666507720947.
Trial 210 finished with value: 0.5000000596046448 and parameters: {'n_layers': 13, 'weight_decay': 3.392094873248752e-05, 'n_units_l0': 40, 'n_units_l1': 7, 'n_units_l2': 11, 'n_units_l3': 90, 'n_units_l4': 20, 'n_units_l5': 113, 'n_units_l6': 17, 'n_units_l7': 6, 'n_units_l8': 18, 'n_units_l9': 60, 'n_units_l10': 24, 'n_units_l11': 19, 'n_units_l12': 10, 'optimizer': 'SGD', 'sgd_opt_learning_rate': 0.0004434650280828625, 'sgd_opt_momentum': 0.00024279111170592664}. Best is trial 204 with value: 0.7666666507720947.
Trial 211 finished with value: 0.5666666626930237 and parameters: {'n_layers': 11, 'weight_decay': 1.0864234235171547e-06, 'n_units_l0': 38, 'n_units_l1': 9, 'n_units_l2': 16, 'n_units_l3': 80, 'n_units_l4': 16, 'n_units_l5': 22, 'n_units_l6': 22, 'n_units_l7': 50, 'n_units_l8': 74, 'n_units_l9': 30, 'n_units_l10': 8, 'optimizer': 'SGD', 'sgd_opt_learning_rate': 0.0008444441988189575, 'sgd_opt_momentum': 0.0034383574103069815}. Best is trial 204 with value: 0.7666666507720947.
Trial 212 finished with value: 0.7222222685813904 and parameters: {'n_layers': 11, 'weight_decay': 9.72495622848595e-07, 'n_units_l0': 33, 'n_units_l1': 10, 'n_units_l2': 15, 'n_units_l3': 98, 'n_units_l4': 15, 'n_units_l5': 26, 'n_units_l6': 42, 'n_units_l7': 66, 'n_units_l8': 60, 'n_units_l9': 36, 'n_units_l10': 6, 'optimizer': 'SGD', 'sgd_opt_learning_rate': 0.018509231878063078, 'sgd_opt_momentum': 0.0064957314691935445}. Best is trial 204 with value: 0.7666666507720947.
Trial 213 finished with value: 0.5888888835906982 and parameters: {'n_layers': 10, 'weight_decay': 8.80546148494108e-07, 'n_units_l0': 33, 'n_units_l1': 11, 'n_units_l2': 17, 'n_units_l3': 100, 'n_units_l4': 15, 'n_units_l5': 27, 'n_units_l6': 47, 'n_units_l7': 66, 'n_units_l8': 40, 'n_units_l9': 38, 'optimizer': 'SGD', 'sgd_opt_learning_rate': 0.017497234349270075, 'sgd_opt_momentum': 0.006865652565595655}. Best is trial 204 with value: 0.7666666507720947.
Trial 214 finished with value: 0.6333333849906921 and parameters: {'n_layers': 11, 'weight_decay': 4.768356234617891e-07, 'n_units_l0': 37, 'n_units_l1': 10, 'n_units_l2': 13, 'n_units_l3': 67, 'n_units_l4': 18, 'n_units_l5': 25, 'n_units_l6': 38, 'n_units_l7': 61, 'n_units_l8': 61, 'n_units_l9': 34, 'n_units_l10': 7, 'optimizer': 'SGD', 'sgd_opt_learning_rate': 0.010509650927967426, 'sgd_opt_momentum': 0.011799289161962837}. Best is trial 204 with value: 0.7666666507720947.
Trial 215 finished with value: 0.4888889491558075 and parameters: {'n_layers': 12, 'weight_decay': 8.501832400919504e-07, 'n_units_l0': 33, 'n_units_l1': 10, 'n_units_l2': 14, 'n_units_l3': 101, 'n_units_l4': 44, 'n_units_l5': 30, 'n_units_l6': 43, 'n_units_l7': 63, 'n_units_l8': 50, 'n_units_l9': 47, 'n_units_l10': 5, 'n_units_l11': 36, 'optimizer': 'SGD', 'sgd_opt_learning_rate': 0.022664669971569212, 'sgd_opt_momentum': 0.0024725848765650084}. Best is trial 204 with value: 0.7666666507720947.
Trial 216 finished with value: 0.6111111640930176 and parameters: {'n_layers': 9, 'weight_decay': 3.863737747318146e-06, 'n_units_l0': 30, 'n_units_l1': 11, 'n_units_l2': 15, 'n_units_l3': 61, 'n_units_l4': 16, 'n_units_l5': 21, 'n_units_l6': 41, 'n_units_l7': 69, 'n_units_l8': 15, 'optimizer': 'SGD', 'sgd_opt_learning_rate': 0.0002899664196342502, 'sgd_opt_momentum': 0.04348804354799349}. Best is trial 204 with value: 0.7666666507720947.
Trial 217 finished with value: 0.43333330750465393 and parameters: {'n_layers': 10, 'weight_decay': 7.291543036587473e-07, 'n_units_l0': 33, 'n_units_l1': 8, 'n_units_l2': 18, 'n_units_l3': 95, 'n_units_l4': 19, 'n_units_l5': 25, 'n_units_l6': 19, 'n_units_l7': 16, 'n_units_l8': 85, 'n_units_l9': 42, 'optimizer': 'SGD', 'sgd_opt_learning_rate': 0.03815782966382293, 'sgd_opt_momentum': 0.00012392674158639622}. Best is trial 204 with value: 0.7666666507720947.
Trial 218 finished with value: 0.6111111640930176 and parameters: {'n_layers': 11, 'weight_decay': 1.3768134072428093e-06, 'n_units_l0': 36, 'n_units_l1': 9, 'n_units_l2': 12, 'n_units_l3': 75, 'n_units_l4': 13, 'n_units_l5': 19, 'n_units_l6': 16, 'n_units_l7': 76, 'n_units_l8': 47, 'n_units_l9': 37, 'n_units_l10': 6, 'optimizer': 'Adam', 'adam_learning_rate': 0.09993269670424396}. Best is trial 204 with value: 0.7666666507720947.
Trial 219 finished with value: 0.7111110687255859 and parameters: {'n_layers': 8, 'weight_decay': 2.2839817232442317e-07, 'n_units_l0': 43, 'n_units_l1': 7, 'n_units_l2': 4, 'n_units_l3': 89, 'n_units_l4': 21, 'n_units_l5': 29, 'n_units_l6': 41, 'n_units_l7': 58, 'optimizer': 'SGD', 'sgd_opt_learning_rate': 0.005552296079949583, 'sgd_opt_momentum': 0.0012163387029256157}. Best is trial 204 with value: 0.7666666507720947.
Trial 220 finished with value: 0.6111111640930176 and parameters: {'n_layers': 8, 'weight_decay': 4.517650280851318e-07, 'n_units_l0': 41, 'n_units_l1': 7, 'n_units_l2': 4, 'n_units_l3': 90, 'n_units_l4': 20, 'n_units_l5': 29, 'n_units_l6': 20, 'n_units_l7': 81, 'optimizer': 'SGD', 'sgd_opt_learning_rate': 0.005815305447740962, 'sgd_opt_momentum': 0.0012691808148327253}. Best is trial 204 with value: 0.7666666507720947.
Trial 221 finished with value: 0.7111110687255859 and parameters: {'n_layers': 8, 'weight_decay': 2.590424839376353e-07, 'n_units_l0': 45, 'n_units_l1': 8, 'n_units_l2': 4, 'n_units_l3': 91, 'n_units_l4': 22, 'n_units_l5': 26, 'n_units_l6': 42, 'n_units_l7': 65, 'optimizer': 'SGD', 'sgd_opt_learning_rate': 0.001809286762005093, 'sgd_opt_momentum': 0.0007415897627761828}. Best is trial 204 with value: 0.7666666507720947.
