Trial 129 finished with value: 0.6888888478279114 and parameters: {'n_layers': 6, 'weight_decay': 7.056022126133013e-05, 'n_units_l0': 25, 'n_units_l1': 69, 'n_units_l2': 17, 'n_units_l3': 13, 'n_units_l4': 27, 'n_units_l5': 32, 'optimizer': 'RMSprop', 'rmsprop_learning_rate': 0.0028539154531848575, 'rmsprop_weight_decay': 0.9640241479063988, 'rmsprop_momentum': 0.02485214006003894}. Best is trial 7 with value: 0.7555555701255798.
Trial 130 finished with value: 0.4888888895511627 and parameters: {'n_layers': 5, 'weight_decay': 0.00011947899533888054, 'n_units_l0': 24, 'n_units_l1': 48, 'n_units_l2': 17, 'n_units_l3': 19, 'n_units_l4': 27, 'optimizer': 'RMSprop', 'rmsprop_learning_rate': 0.005425346370522462, 'rmsprop_weight_decay': 0.9673226180655903, 'rmsprop_momentum': 0.025748611061401225}. Best is trial 7 with value: 0.7555555701255798.
Trial 131 finished with value: 0.4888888895511627 and parameters: {'n_layers': 6, 'weight_decay': 7.213100371916764e-05, 'n_units_l0': 20, 'n_units_l1': 17, 'n_units_l2': 20, 'n_units_l3': 14, 'n_units_l4': 21, 'n_units_l5': 32, 'optimizer': 'RMSprop', 'rmsprop_learning_rate': 0.003276670677880338, 'rmsprop_weight_decay': 0.9618931390457865, 'rmsprop_momentum': 0.03239818258412543}. Best is trial 7 with value: 0.7555555701255798.
Trial 132 finished with value: 0.5666666626930237 and parameters: {'n_layers': 7, 'weight_decay': 8.772236236575998e-05, 'n_units_l0': 22, 'n_units_l1': 9, 'n_units_l2': 18, 'n_units_l3': 11, 'n_units_l4': 31, 'n_units_l5': 27, 'n_units_l6': 23, 'optimizer': 'RMSprop', 'rmsprop_learning_rate': 0.006779082677122095, 'rmsprop_weight_decay': 0.9644290045785612, 'rmsprop_momentum': 0.007031945767844728}. Best is trial 7 with value: 0.7555555701255798.
Trial 133 finished with value: 0.4555555582046509 and parameters: {'n_layers': 4, 'weight_decay': 3.630671480760264e-05, 'n_units_l0': 25, 'n_units_l1': 89, 'n_units_l2': 15, 'n_units_l3': 6, 'optimizer': 'RMSprop', 'rmsprop_learning_rate': 0.0047065248717953435, 'rmsprop_weight_decay': 0.9838740466607598, 'rmsprop_momentum': 0.012104858468898697}. Best is trial 7 with value: 0.7555555701255798.
Trial 134 finished with value: 0.6333333849906921 and parameters: {'n_layers': 8, 'weight_decay': 0.0001591712880421865, 'n_units_l0': 29, 'n_units_l1': 7, 'n_units_l2': 13, 'n_units_l3': 8, 'n_units_l4': 42, 'n_units_l5': 36, 'n_units_l6': 40, 'n_units_l7': 27, 'optimizer': 'RMSprop', 'rmsprop_learning_rate': 0.002735242559641811, 'rmsprop_weight_decay': 0.9715723571120853, 'rmsprop_momentum': 0.051997558348308895}. Best is trial 7 with value: 0.7555555701255798.
Trial 135 finished with value: 0.4333333671092987 and parameters: {'n_layers': 7, 'weight_decay': 6.391764730188854e-05, 'n_units_l0': 18, 'n_units_l1': 67, 'n_units_l2': 53, 'n_units_l3': 47, 'n_units_l4': 23, 'n_units_l5': 30, 'n_units_l6': 35, 'optimizer': 'RMSprop', 'rmsprop_learning_rate': 0.0037117551096453685, 'rmsprop_weight_decay': 0.9527601036292546, 'rmsprop_momentum': 0.0008065663358202597}. Best is trial 7 with value: 0.7555555701255798.
Trial 136 finished with value: 0.7111110687255859 and parameters: {'n_layers': 8, 'weight_decay': 1.2643465944016052e-05, 'n_units_l0': 37, 'n_units_l1': 75, 'n_units_l2': 16, 'n_units_l3': 12, 'n_units_l4': 33, 'n_units_l5': 25, 'n_units_l6': 24, 'n_units_l7': 8, 'optimizer': 'SGD', 'sgd_opt_learning_rate': 0.00011906605869107609, 'sgd_opt_momentum': 0.00153062760335553}. Best is trial 7 with value: 0.7555555701255798.
Trial 137 finished with value: 0.43333330750465393 and parameters: {'n_layers': 13, 'weight_decay': 1.0804412226667181e-05, 'n_units_l0': 37, 'n_units_l1': 81, 'n_units_l2': 16, 'n_units_l3': 12, 'n_units_l4': 33, 'n_units_l5': 25, 'n_units_l6': 25, 'n_units_l7': 9, 'n_units_l8': 51, 'n_units_l9': 12, 'n_units_l10': 4, 'n_units_l11': 103, 'n_units_l12': 27, 'optimizer': 'SGD', 'sgd_opt_learning_rate': 0.00012568258465885543, 'sgd_opt_momentum': 0.002256366667596103}. Best is trial 7 with value: 0.7555555701255798.
Trial 138 finished with value: 0.6111111640930176 and parameters: {'n_layers': 6, 'weight_decay': 1.8735834634162887e-06, 'n_units_l0': 31, 'n_units_l1': 89, 'n_units_l2': 22, 'n_units_l3': 14, 'n_units_l4': 28, 'n_units_l5': 60, 'optimizer': 'SGD', 'sgd_opt_learning_rate': 6.587527555578815e-05, 'sgd_opt_momentum': 0.021902983528023626}. Best is trial 7 with value: 0.7555555701255798.
Trial 139 finished with value: 0.6111111044883728 and parameters: {'n_layers': 12, 'weight_decay': 4.838329877596996e-06, 'n_units_l0': 35, 'n_units_l1': 66, 'n_units_l2': 16, 'n_units_l3': 13, 'n_units_l4': 26, 'n_units_l5': 34, 'n_units_l6': 20, 'n_units_l7': 5, 'n_units_l8': 85, 'n_units_l9': 15, 'n_units_l10': 9, 'n_units_l11': 14, 'optimizer': 'SGD', 'sgd_opt_learning_rate': 0.00037171436965618667, 'sgd_opt_momentum': 0.0012803219866171168}. Best is trial 7 with value: 0.7555555701255798.
Trial 140 finished with value: 0.5222222208976746 and parameters: {'n_layers': 8, 'weight_decay': 2.844378458467368e-05, 'n_units_l0': 45, 'n_units_l1': 70, 'n_units_l2': 19, 'n_units_l3': 9, 'n_units_l4': 38, 'n_units_l5': 28, 'n_units_l6': 29, 'n_units_l7': 32, 'optimizer': 'SGD', 'sgd_opt_learning_rate': 0.00430023252774089, 'sgd_opt_momentum': 0.0003764894075278562}. Best is trial 7 with value: 0.7555555701255798.
Trial 141 finished with value: 0.6222222447395325 and parameters: {'n_layers': 9, 'weight_decay': 4.653755302847182e-05, 'n_units_l0': 27, 'n_units_l1': 60, 'n_units_l2': 14, 'n_units_l3': 10, 'n_units_l4': 50, 'n_units_l5': 23, 'n_units_l6': 24, 'n_units_l7': 7, 'n_units_l8': 35, 'optimizer': 'SGD', 'sgd_opt_learning_rate': 3.708367362969108e-05, 'sgd_opt_momentum': 6.143084960436894e-05}. Best is trial 7 with value: 0.7555555701255798.
Trial 142 finished with value: 0.5222222208976746 and parameters: {'n_layers': 6, 'weight_decay': 1.4677521348937737e-05, 'n_units_l0': 24, 'n_units_l1': 76, 'n_units_l2': 17, 'n_units_l3': 17, 'n_units_l4': 35, 'n_units_l5': 20, 'optimizer': 'RMSprop', 'rmsprop_learning_rate': 0.0014242536418381593, 'rmsprop_weight_decay': 0.9230182784517518, 'rmsprop_momentum': 0.025564866764542737}. Best is trial 7 with value: 0.7555555701255798.
Trial 143 finished with value: 0.5333333611488342 and parameters: {'n_layers': 8, 'weight_decay': 7.657935833793462e-06, 'n_units_l0': 39, 'n_units_l1': 115, 'n_units_l2': 12, 'n_units_l3': 127, 'n_units_l4': 21, 'n_units_l5': 24, 'n_units_l6': 31, 'n_units_l7': 5, 'optimizer': 'RMSprop', 'rmsprop_learning_rate': 0.0010863582727127145, 'rmsprop_weight_decay': 0.9742943752413711, 'rmsprop_momentum': 0.008143197873227863}. Best is trial 7 with value: 0.7555555701255798.
Trial 144 finished with value: 0.644444465637207 and parameters: {'n_layers': 7, 'weight_decay': 2.9488822094036796e-05, 'n_units_l0': 29, 'n_units_l1': 10, 'n_units_l2': 18, 'n_units_l3': 5, 'n_units_l4': 24, 'n_units_l5': 46, 'n_units_l6': 39, 'optimizer': 'Adam', 'adam_learning_rate': 0.0005045443220661009}. Best is trial 7 with value: 0.7555555701255798.
Trial 145 finished with value: 0.5444444417953491 and parameters: {'n_layers': 9, 'weight_decay': 1.929090617144727e-05, 'n_units_l0': 15, 'n_units_l1': 103, 'n_units_l2': 4, 'n_units_l3': 52, 'n_units_l4': 30, 'n_units_l5': 21, 'n_units_l6': 18, 'n_units_l7': 4, 'n_units_l8': 127, 'optimizer': 'RMSprop', 'rmsprop_learning_rate': 0.00044657929091354315, 'rmsprop_weight_decay': 0.9567263939746375, 'rmsprop_momentum': 0.0006271651206364601}. Best is trial 7 with value: 0.7555555701255798.
Trial 146 finished with value: 0.699999988079071 and parameters: {'n_layers': 12, 'weight_decay': 7.390965953981858e-05, 'n_units_l0': 21, 'n_units_l1': 5, 'n_units_l2': 5, 'n_units_l3': 15, 'n_units_l4': 46, 'n_units_l5': 27, 'n_units_l6': 33, 'n_units_l7': 15, 'n_units_l8': 59, 'n_units_l9': 4, 'n_units_l10': 68, 'n_units_l11': 68, 'optimizer': 'RMSprop', 'rmsprop_learning_rate': 0.0019971691397530885, 'rmsprop_weight_decay': 0.9796743295977518, 'rmsprop_momentum': 0.008728519758450102}. Best is trial 7 with value: 0.7555555701255798.
Trial 147 finished with value: 0.644444465637207 and parameters: {'n_layers': 14, 'weight_decay': 0.00011112837544064453, 'n_units_l0': 22, 'n_units_l1': 74, 'n_units_l2': 4, 'n_units_l3': 12, 'n_units_l4': 45, 'n_units_l5': 31, 'n_units_l6': 44, 'n_units_l7': 14, 'n_units_l8': 88, 'n_units_l9': 4, 'n_units_l10': 99, 'n_units_l11': 68, 'n_units_l12': 9, 'n_units_l13': 23, 'optimizer': 'RMSprop', 'rmsprop_learning_rate': 0.001933292029543821, 'rmsprop_weight_decay': 0.9813647356747829, 'rmsprop_momentum': 0.009348398844141207}. Best is trial 7 with value: 0.7555555701255798.
Trial 148 finished with value: 0.5111111402511597 and parameters: {'n_layers': 12, 'weight_decay': 7.586202444708559e-05, 'n_units_l0': 26, 'n_units_l1': 54, 'n_units_l2': 11, 'n_units_l3': 14, 'n_units_l4': 19, 'n_units_l5': 27, 'n_units_l6': 28, 'n_units_l7': 13, 'n_units_l8': 66, 'n_units_l9': 5, 'n_units_l10': 72, 'n_units_l11': 81, 'optimizer': 'RMSprop', 'rmsprop_learning_rate': 0.0025309258577601488, 'rmsprop_weight_decay': 0.9416207565786625, 'rmsprop_momentum': 0.02127593352173579}. Best is trial 7 with value: 0.7555555701255798.
Trial 149 finished with value: 0.46666666865348816 and parameters: {'n_layers': 11, 'weight_decay': 3.690490556094819e-06, 'n_units_l0': 32, 'n_units_l1': 11, 'n_units_l2': 5, 'n_units_l3': 15, 'n_units_l4': 22, 'n_units_l5': 128, 'n_units_l6': 47, 'n_units_l7': 17, 'n_units_l8': 48, 'n_units_l9': 5, 'n_units_l10': 64, 'optimizer': 'RMSprop', 'rmsprop_learning_rate': 0.007550906297060899, 'rmsprop_weight_decay': 0.9849905428772683, 'rmsprop_momentum': 0.004269341493884156}. Best is trial 7 with value: 0.7555555701255798.
Trial 150 finished with value: 0.5555555820465088 and parameters: {'n_layers': 10, 'weight_decay': 6.575328290817568e-07, 'n_units_l0': 21, 'n_units_l1': 5, 'n_units_l2': 71, 'n_units_l3': 12, 'n_units_l4': 28, 'n_units_l5': 26, 'n_units_l6': 22, 'n_units_l7': 15, 'n_units_l8': 59, 'n_units_l9': 29, 'optimizer': 'SGD', 'sgd_opt_learning_rate': 0.00035313872888923854, 'sgd_opt_momentum': 0.016026519988141877}. Best is trial 7 with value: 0.7555555701255798.
Trial 151 finished with value: 0.6111111640930176 and parameters: {'n_layers': 11, 'weight_decay': 5.0807539205120234e-05, 'n_units_l0': 17, 'n_units_l1': 6, 'n_units_l2': 6, 'n_units_l3': 17, 'n_units_l4': 40, 'n_units_l5': 19, 'n_units_l6': 32, 'n_units_l7': 20, 'n_units_l8': 72, 'n_units_l9': 6, 'n_units_l10': 110, 'optimizer': 'RMSprop', 'rmsprop_learning_rate': 0.0006138486430903872, 'rmsprop_weight_decay': 0.9890658917708748, 'rmsprop_momentum': 0.00037899471403085317}. Best is trial 7 with value: 0.7555555701255798.
Trial 152 finished with value: 0.6777777671813965 and parameters: {'n_layers': 8, 'weight_decay': 3.478169782032236e-05, 'n_units_l0': 19, 'n_units_l1': 5, 'n_units_l2': 5, 'n_units_l3': 6, 'n_units_l4': 43, 'n_units_l5': 29, 'n_units_l6': 34, 'n_units_l7': 30, 'optimizer': 'RMSprop', 'rmsprop_learning_rate': 0.0017204352063779828, 'rmsprop_weight_decay': 0.9786820093136135, 'rmsprop_momentum': 0.005475220292276757}. Best is trial 7 with value: 0.7555555701255798.
Trial 153 finished with value: 0.41111111640930176 and parameters: {'n_layers': 12, 'weight_decay': 0.0001817682349067906, 'n_units_l0': 23, 'n_units_l1': 7, 'n_units_l2': 9, 'n_units_l3': 15, 'n_units_l4': 17, 'n_units_l5': 22, 'n_units_l6': 38, 'n_units_l7': 16, 'n_units_l8': 21, 'n_units_l9': 21, 'n_units_l10': 92, 'n_units_l11': 57, 'optimizer': 'RMSprop', 'rmsprop_learning_rate': 0.0007912691886339571, 'rmsprop_weight_decay': 0.9671859803625645, 'rmsprop_momentum': 0.01255670801496744}. Best is trial 7 with value: 0.7555555701255798.
Trial 154 finished with value: 0.7555555701255798 and parameters: {'n_layers': 13, 'weight_decay': 6.338781133293265e-05, 'n_units_l0': 25, 'n_units_l1': 8, 'n_units_l2': 6, 'n_units_l3': 13, 'n_units_l4': 50, 'n_units_l5': 25, 'n_units_l6': 35, 'n_units_l7': 19, 'n_units_l8': 58, 'n_units_l9': 10, 'n_units_l10': 50, 'n_units_l11': 48, 'n_units_l12': 47, 'optimizer': 'RMSprop', 'rmsprop_learning_rate': 0.0011182649418734398, 'rmsprop_weight_decay': 0.9701452246184562, 'rmsprop_momentum': 0.00031662807076726136}. Best is trial 7 with value: 0.7555555701255798.
Trial 155 finished with value: 0.5888888835906982 and parameters: {'n_layers': 13, 'weight_decay': 0.00010079360232543159, 'n_units_l0': 28, 'n_units_l1': 42, 'n_units_l2': 13, 'n_units_l3': 11, 'n_units_l4': 54, 'n_units_l5': 25, 'n_units_l6': 26, 'n_units_l7': 18, 'n_units_l8': 58, 'n_units_l9': 8, 'n_units_l10': 45, 'n_units_l11': 48, 'n_units_l12': 47, 'optimizer': 'RMSprop', 'rmsprop_learning_rate': 0.001103067950299364, 'rmsprop_weight_decay': 0.950042649111709, 'rmsprop_momentum': 0.0003041587954849405}. Best is trial 7 with value: 0.7555555701255798.
Trial 156 finished with value: 0.4777778089046478 and parameters: {'n_layers': 13, 'weight_decay': 6.75546667517291e-05, 'n_units_l0': 35, 'n_units_l1': 8, 'n_units_l2': 6, 'n_units_l3': 13, 'n_units_l4': 47, 'n_units_l5': 32, 'n_units_l6': 16, 'n_units_l7': 23, 'n_units_l8': 77, 'n_units_l9': 7, 'n_units_l10': 77, 'n_units_l11': 68, 'n_units_l12': 56, 'optimizer': 'RMSprop', 'rmsprop_learning_rate': 0.00219406739437117, 'rmsprop_weight_decay': 0.9713903153728095, 'rmsprop_momentum': 0.0004887584710244029}. Best is trial 7 with value: 0.7555555701255798.
Trial 157 finished with value: 0.6111111640930176 and parameters: {'n_layers': 14, 'weight_decay': 0.00013756066357032605, 'n_units_l0': 25, 'n_units_l1': 8, 'n_units_l2': 20, 'n_units_l3': 41, 'n_units_l4': 63, 'n_units_l5': 5, 'n_units_l6': 35, 'n_units_l7': 21, 'n_units_l8': 107, 'n_units_l9': 9, 'n_units_l10': 53, 'n_units_l11': 32, 'n_units_l12': 40, 'n_units_l13': 113, 'optimizer': 'RMSprop', 'rmsprop_learning_rate': 0.001432639958196631, 'rmsprop_weight_decay': 0.944808956149063, 'rmsprop_momentum': 0.00017316389984732596}. Best is trial 7 with value: 0.7555555701255798.
Trial 158 finished with value: 0.5333333611488342 and parameters: {'n_layers': 13, 'weight_decay': 2.309736157678658e-05, 'n_units_l0': 30, 'n_units_l1': 58, 'n_units_l2': 15, 'n_units_l3': 14, 'n_units_l4': 57, 'n_units_l5': 39, 'n_units_l6': 30, 'n_units_l7': 8, 'n_units_l8': 117, 'n_units_l9': 26, 'n_units_l10': 67, 'n_units_l11': 41, 'n_units_l12': 76, 'optimizer': 'Adam', 'adam_learning_rate': 5.0918408324876646e-05}. Best is trial 7 with value: 0.7555555701255798.
Trial 159 finished with value: 0.5222222208976746 and parameters: {'n_layers': 10, 'weight_decay': 7.09365873977019e-08, 'n_units_l0': 27, 'n_units_l1': 4, 'n_units_l2': 11, 'n_units_l3': 16, 'n_units_l4': 25, 'n_units_l5': 8, 'n_units_l6': 7, 'n_units_l7': 12, 'n_units_l8': 74, 'n_units_l9': 11, 'optimizer': 'RMSprop', 'rmsprop_learning_rate': 0.0038828292753260696, 'rmsprop_weight_decay': 0.9636826967133115, 'rmsprop_momentum': 0.00022770828793271746}. Best is trial 7 with value: 0.7555555701255798.
Trial 160 finished with value: 0.6111111640930176 and parameters: {'n_layers': 15, 'weight_decay': 1.2719983057489848e-05, 'n_units_l0': 20, 'n_units_l1': 12, 'n_units_l2': 10, 'n_units_l3': 46, 'n_units_l4': 37, 'n_units_l5': 29, 'n_units_l6': 19, 'n_units_l7': 35, 'n_units_l8': 92, 'n_units_l9': 18, 'n_units_l10': 56, 'n_units_l11': 97, 'n_units_l12': 20, 'n_units_l13': 85, 'n_units_l14': 31, 'optimizer': 'RMSprop', 'rmsprop_learning_rate': 0.0012538855690311962, 'rmsprop_weight_decay': 0.9749894639498211, 'rmsprop_momentum': 0.007691219924103753}. Best is trial 7 with value: 0.7555555701255798.
Trial 161 finished with value: 0.5666666626930237 and parameters: {'n_layers': 7, 'weight_decay': 5.04291188599165e-05, 'n_units_l0': 24, 'n_units_l1': 6, 'n_units_l2': 6, 'n_units_l3': 5, 'n_units_l4': 52, 'n_units_l5': 24, 'n_units_l6': 41, 'optimizer': 'RMSprop', 'rmsprop_learning_rate': 0.002901032958519423, 'rmsprop_weight_decay': 0.9696028320747708, 'rmsprop_momentum': 0.00042452967057027627}. Best is trial 7 with value: 0.7555555701255798.
Trial 162 finished with value: 0.4333333671092987 and parameters: {'n_layers': 12, 'weight_decay': 0.00029904290876456573, 'n_units_l0': 21, 'n_units_l1': 9, 'n_units_l2': 42, 'n_units_l3': 54, 'n_units_l4': 32, 'n_units_l5': 17, 'n_units_l6': 36, 'n_units_l7': 19, 'n_units_l8': 39, 'n_units_l9': 50, 'n_units_l10': 41, 'n_units_l11': 117, 'optimizer': 'RMSprop', 'rmsprop_learning_rate': 0.000632727323203135, 'rmsprop_weight_decay': 0.9757829935279656, 'rmsprop_momentum': 0.0006772954910367332}. Best is trial 7 with value: 0.7555555701255798.
Trial 163 finished with value: 0.5777778029441833 and parameters: {'n_layers': 8, 'weight_decay': 3.728161012505695e-05, 'n_units_l0': 18, 'n_units_l1': 7, 'n_units_l2': 5, 'n_units_l3': 12, 'n_units_l4': 41, 'n_units_l5': 27, 'n_units_l6': 33, 'n_units_l7': 17, 'optimizer': 'RMSprop', 'rmsprop_learning_rate': 0.0003168763759361061, 'rmsprop_weight_decay': 0.9657900377285326, 'rmsprop_momentum': 0.00031522370797414285}. Best is trial 7 with value: 0.7555555701255798.
Trial 164 finished with value: 0.5000000596046448 and parameters: {'n_layers': 6, 'weight_decay': 8.011887905422588e-05, 'n_units_l0': 32, 'n_units_l1': 6, 'n_units_l2': 7, 'n_units_l3': 7, 'n_units_l4': 47, 'n_units_l5': 21, 'optimizer': 'RMSprop', 'rmsprop_learning_rate': 0.0005107349076180937, 'rmsprop_weight_decay': 0.9545720322696165, 'rmsprop_momentum': 0.0015082574558906968}. Best is trial 7 with value: 0.7555555701255798.
Trial 165 finished with value: 0.4888888895511627 and parameters: {'n_layers': 9, 'weight_decay': 1.5236056470684403e-08, 'n_units_l0': 25, 'n_units_l1': 13, 'n_units_l2': 115, 'n_units_l3': 10, 'n_units_l4': 23, 'n_units_l5': 23, 'n_units_l6': 44, 'n_units_l7': 16, 'n_units_l8': 45, 'optimizer': 'RMSprop', 'rmsprop_learning_rate': 0.0009779326299414193, 'rmsprop_weight_decay': 0.9611454728519371, 'rmsprop_momentum': 0.0011052285318995003}. Best is trial 7 with value: 0.7555555701255798.
Trial 166 finished with value: 0.4888888895511627 and parameters: {'n_layers': 8, 'weight_decay': 5.343781300730454e-05, 'n_units_l0': 22, 'n_units_l1': 10, 'n_units_l2': 8, 'n_units_l3': 13, 'n_units_l4': 20, 'n_units_l5': 25, 'n_units_l6': 37, 'n_units_l7': 22, 'optimizer': 'RMSprop', 'rmsprop_learning_rate': 0.0017114141897001504, 'rmsprop_weight_decay': 0.9799768120418516, 'rmsprop_momentum': 0.0005894329882573954}. Best is trial 7 with value: 0.7555555701255798.
Trial 167 finished with value: 0.6222222447395325 and parameters: {'n_layers': 11, 'weight_decay': 1.898102711266688e-05, 'n_units_l0': 29, 'n_units_l1': 8, 'n_units_l2': 9, 'n_units_l3': 4, 'n_units_l4': 49, 'n_units_l5': 36, 'n_units_l6': 28, 'n_units_l7': 15, 'n_units_l8': 35, 'n_units_l9': 36, 'n_units_l10': 108, 'optimizer': 'RMSprop', 'rmsprop_learning_rate': 0.0023068075397542844, 'rmsprop_weight_decay': 0.9572327570914575, 'rmsprop_momentum': 0.0020261049502470975}. Best is trial 7 with value: 0.7555555701255798.
Trial 168 finished with value: 0.6111111640930176 and parameters: {'n_layers': 12, 'weight_decay': 2.9385534269977584e-05, 'n_units_l0': 20, 'n_units_l1': 7, 'n_units_l2': 21, 'n_units_l3': 18, 'n_units_l4': 68, 'n_units_l5': 30, 'n_units_l6': 13, 'n_units_l7': 20, 'n_units_l8': 64, 'n_units_l9': 10, 'n_units_l10': 84, 'n_units_l11': 71, 'optimizer': 'RMSprop', 'rmsprop_learning_rate': 0.005120092895753074, 'rmsprop_weight_decay': 0.9701756978059883, 'rmsprop_momentum': 0.015698942500619702}. Best is trial 7 with value: 0.7555555701255798.
Trial 169 finished with value: 0.4444444477558136 and parameters: {'n_layers': 7, 'weight_decay': 6.705232487495217e-06, 'n_units_l0': 41, 'n_units_l1': 11, 'n_units_l2': 6, 'n_units_l3': 38, 'n_units_l4': 26, 'n_units_l5': 33, 'n_units_l6': 15, 'optimizer': 'RMSprop', 'rmsprop_learning_rate': 0.0007472788761488333, 'rmsprop_weight_decay': 0.9726159096605037, 'rmsprop_momentum': 0.000526748639880295}. Best is trial 7 with value: 0.7555555701255798.
Trial 170 finished with value: 0.7333333492279053 and parameters: {'n_layers': 8, 'weight_decay': 9.347887596352894e-06, 'n_units_l0': 26, 'n_units_l1': 5, 'n_units_l2': 4, 'n_units_l3': 5, 'n_units_l4': 18, 'n_units_l5': 18, 'n_units_l6': 21, 'n_units_l7': 18, 'optimizer': 'Adam', 'adam_learning_rate': 0.032920190338485984}. Best is trial 7 with value: 0.7555555701255798.
Trial 171 finished with value: 0.46666669845581055 and parameters: {'n_layers': 8, 'weight_decay': 1.0547429231478818e-05, 'n_units_l0': 26, 'n_units_l1': 5, 'n_units_l2': 4, 'n_units_l3': 44, 'n_units_l4': 18, 'n_units_l5': 16, 'n_units_l6': 23, 'n_units_l7': 18, 'optimizer': 'Adam', 'adam_learning_rate': 0.0361824841519447}. Best is trial 7 with value: 0.7555555701255798.
Trial 172 finished with value: 0.5777778029441833 and parameters: {'n_layers': 9, 'weight_decay': 4.51726817510088e-06, 'n_units_l0': 23, 'n_units_l1': 20, 'n_units_l2': 4, 'n_units_l3': 5, 'n_units_l4': 16, 'n_units_l5': 18, 'n_units_l6': 20, 'n_units_l7': 25, 'n_units_l8': 80, 'optimizer': 'Adam', 'adam_learning_rate': 0.020195066038490434}. Best is trial 7 with value: 0.7555555701255798.
Trial 173 finished with value: 0.6000000834465027 and parameters: {'n_layers': 8, 'weight_decay': 2.979200065049038e-06, 'n_units_l0': 28, 'n_units_l1': 5, 'n_units_l2': 5, 'n_units_l3': 5, 'n_units_l4': 124, 'n_units_l5': 20, 'n_units_l6': 32, 'n_units_l7': 21, 'optimizer': 'Adam', 'adam_learning_rate': 0.001442385863702226}. Best is trial 7 with value: 0.7555555701255798.
Trial 174 finished with value: 0.6555555462837219 and parameters: {'n_layers': 7, 'weight_decay': 8.179107415839213e-06, 'n_units_l0': 16, 'n_units_l1': 6, 'n_units_l2': 12, 'n_units_l3': 6, 'n_units_l4': 21, 'n_units_l5': 22, 'n_units_l6': 21, 'optimizer': 'Adam', 'adam_learning_rate': 0.006426340509222619}. Best is trial 7 with value: 0.7555555701255798.
