Trial 84 finished with value: 0.6333333849906921 and parameters: {'n_layers': 24, 'weight_decay': 1.8727547664099606e-10, 'n_units_l0': 35, 'n_units_l1': 42, 'n_units_l2': 19, 'n_units_l3': 78, 'n_units_l4': 42, 'n_units_l5': 9, 'n_units_l6': 5, 'n_units_l7': 102, 'n_units_l8': 113, 'n_units_l9': 17, 'n_units_l10': 10, 'n_units_l11': 98, 'n_units_l12': 86, 'n_units_l13': 6, 'n_units_l14': 8, 'n_units_l15': 94, 'n_units_l16': 57, 'n_units_l17': 74, 'n_units_l18': 6, 'n_units_l19': 4, 'n_units_l20': 28, 'n_units_l21': 117, 'n_units_l22': 12, 'n_units_l23': 15, 'optimizer': 'RMSprop', 'rmsprop_learning_rate': 0.0007450136961914259, 'rmsprop_weight_decay': 0.9247353047702588, 'rmsprop_momentum': 0.0006199596084121872}. Best is trial 7 with value: 0.7555555701255798.
Trial 85 finished with value: 0.5333333611488342 and parameters: {'n_layers': 11, 'weight_decay': 3.565563575995948e-10, 'n_units_l0': 10, 'n_units_l1': 37, 'n_units_l2': 15, 'n_units_l3': 52, 'n_units_l4': 16, 'n_units_l5': 7, 'n_units_l6': 4, 'n_units_l7': 126, 'n_units_l8': 42, 'n_units_l9': 50, 'n_units_l10': 21, 'optimizer': 'RMSprop', 'rmsprop_learning_rate': 0.09901566462999721, 'rmsprop_weight_decay': 0.9774409663803139, 'rmsprop_momentum': 0.00021184132983753632}. Best is trial 7 with value: 0.7555555701255798.
Trial 86 finished with value: 0.644444465637207 and parameters: {'n_layers': 18, 'weight_decay': 1.0280282980832663e-10, 'n_units_l0': 55, 'n_units_l1': 7, 'n_units_l2': 9, 'n_units_l3': 33, 'n_units_l4': 22, 'n_units_l5': 18, 'n_units_l6': 31, 'n_units_l7': 111, 'n_units_l8': 84, 'n_units_l9': 64, 'n_units_l10': 29, 'n_units_l11': 73, 'n_units_l12': 100, 'n_units_l13': 14, 'n_units_l14': 5, 'n_units_l15': 26, 'n_units_l16': 19, 'n_units_l17': 34, 'optimizer': 'RMSprop', 'rmsprop_learning_rate': 0.0015143199987172587, 'rmsprop_weight_decay': 0.8944646989253601, 'rmsprop_momentum': 0.00223851522645415}. Best is trial 7 with value: 0.7555555701255798.
Trial 87 finished with value: 0.5333333611488342 and parameters: {'n_layers': 7, 'weight_decay': 3.233387752380635e-05, 'n_units_l0': 6, 'n_units_l1': 18, 'n_units_l2': 74, 'n_units_l3': 4, 'n_units_l4': 32, 'n_units_l5': 12, 'n_units_l6': 19, 'optimizer': 'RMSprop', 'rmsprop_learning_rate': 0.0038310505226762485, 'rmsprop_weight_decay': 0.951064770623161, 'rmsprop_momentum': 8.406881199845363e-05}. Best is trial 7 with value: 0.7555555701255798.
Trial 88 finished with value: 0.6222222447395325 and parameters: {'n_layers': 8, 'weight_decay': 1.6719631776870493e-09, 'n_units_l0': 23, 'n_units_l1': 25, 'n_units_l2': 13, 'n_units_l3': 64, 'n_units_l4': 36, 'n_units_l5': 31, 'n_units_l6': 66, 'n_units_l7': 24, 'optimizer': 'SGD', 'sgd_opt_learning_rate': 0.008913855573699668, 'sgd_opt_momentum': 5.52862228176904e-05}. Best is trial 7 with value: 0.7555555701255798.
Trial 89 finished with value: 0.6000000834465027 and parameters: {'n_layers': 12, 'weight_decay': 8.17439116924285e-09, 'n_units_l0': 28, 'n_units_l1': 32, 'n_units_l2': 6, 'n_units_l3': 5, 'n_units_l4': 51, 'n_units_l5': 36, 'n_units_l6': 48, 'n_units_l7': 81, 'n_units_l8': 62, 'n_units_l9': 38, 'n_units_l10': 12, 'n_units_l11': 53, 'optimizer': 'RMSprop', 'rmsprop_learning_rate': 0.00896178250763042, 'rmsprop_weight_decay': 0.9719743347776789, 'rmsprop_momentum': 0.006245164095709349}. Best is trial 7 with value: 0.7555555701255798.
Trial 90 finished with value: 0.42222222685813904 and parameters: {'n_layers': 6, 'weight_decay': 0.00028193023866582376, 'n_units_l0': 25, 'n_units_l1': 29, 'n_units_l2': 8, 'n_units_l3': 37, 'n_units_l4': 29, 'n_units_l5': 78, 'optimizer': 'Adam', 'adam_learning_rate': 0.02967631358995744}. Best is trial 7 with value: 0.7555555701255798.
Trial 91 finished with value: 0.6111111640930176 and parameters: {'n_layers': 15, 'weight_decay': 0.0005847073600102899, 'n_units_l0': 12, 'n_units_l1': 13, 'n_units_l2': 11, 'n_units_l3': 11, 'n_units_l4': 42, 'n_units_l5': 9, 'n_units_l6': 22, 'n_units_l7': 20, 'n_units_l8': 20, 'n_units_l9': 94, 'n_units_l10': 32, 'n_units_l11': 11, 'n_units_l12': 128, 'n_units_l13': 8, 'n_units_l14': 15, 'optimizer': 'RMSprop', 'rmsprop_learning_rate': 0.00044441637234927814, 'rmsprop_weight_decay': 0.929679163340571, 'rmsprop_momentum': 3.333385800437115e-05}. Best is trial 7 with value: 0.7555555701255798.
Trial 92 finished with value: 0.5777778029441833 and parameters: {'n_layers': 3, 'weight_decay': 8.341078542079932e-05, 'n_units_l0': 16, 'n_units_l1': 5, 'n_units_l2': 25, 'optimizer': 'RMSprop', 'rmsprop_learning_rate': 0.0005319504789375915, 'rmsprop_weight_decay': 0.8652976967711354, 'rmsprop_momentum': 0.0003643803919719613}. Best is trial 7 with value: 0.7555555701255798.
Trial 93 finished with value: 0.5000000596046448 and parameters: {'n_layers': 2, 'weight_decay': 0.00038911482698948354, 'n_units_l0': 19, 'n_units_l1': 7, 'optimizer': 'RMSprop', 'rmsprop_learning_rate': 0.00021231309340824286, 'rmsprop_weight_decay': 0.883012399085722, 'rmsprop_momentum': 1.0190833092137436e-05}. Best is trial 7 with value: 0.7555555701255798.
Trial 94 finished with value: 0.6777777671813965 and parameters: {'n_layers': 9, 'weight_decay': 4.6800346767429474e-05, 'n_units_l0': 9, 'n_units_l1': 10, 'n_units_l2': 7, 'n_units_l3': 30, 'n_units_l4': 19, 'n_units_l5': 26, 'n_units_l6': 14, 'n_units_l7': 44, 'n_units_l8': 9, 'optimizer': 'RMSprop', 'rmsprop_learning_rate': 0.0008511578812011825, 'rmsprop_weight_decay': 0.9599777476737751, 'rmsprop_momentum': 0.003581650648960863}. Best is trial 7 with value: 0.7555555701255798.
Trial 95 finished with value: 0.6333333849906921 and parameters: {'n_layers': 9, 'weight_decay': 5.5374111714754806e-05, 'n_units_l0': 5, 'n_units_l1': 10, 'n_units_l2': 7, 'n_units_l3': 27, 'n_units_l4': 19, 'n_units_l5': 26, 'n_units_l6': 14, 'n_units_l7': 45, 'n_units_l8': 10, 'optimizer': 'RMSprop', 'rmsprop_learning_rate': 0.000856048834253609, 'rmsprop_weight_decay': 0.9617054619528222, 'rmsprop_momentum': 0.003900684882945844}. Best is trial 7 with value: 0.7555555701255798.
Trial 96 finished with value: 0.6666666865348816 and parameters: {'n_layers': 10, 'weight_decay': 9.596592153611041e-06, 'n_units_l0': 14, 'n_units_l1': 6, 'n_units_l2': 6, 'n_units_l3': 31, 'n_units_l4': 24, 'n_units_l5': 21, 'n_units_l6': 16, 'n_units_l7': 61, 'n_units_l8': 4, 'n_units_l9': 13, 'optimizer': 'RMSprop', 'rmsprop_learning_rate': 0.005852240701051869, 'rmsprop_weight_decay': 0.9547323020950339, 'rmsprop_momentum': 0.0013192516336837502}. Best is trial 7 with value: 0.7555555701255798.
Trial 97 finished with value: 0.6222222447395325 and parameters: {'n_layers': 7, 'weight_decay': 3.984574536552723e-05, 'n_units_l0': 4, 'n_units_l1': 8, 'n_units_l2': 8, 'n_units_l3': 23, 'n_units_l4': 13, 'n_units_l5': 47, 'n_units_l6': 9, 'optimizer': 'RMSprop', 'rmsprop_learning_rate': 0.001278621083223572, 'rmsprop_weight_decay': 0.9650521385890387, 'rmsprop_momentum': 0.002236626517887105}. Best is trial 7 with value: 0.7555555701255798.
Trial 98 finished with value: 0.6555555462837219 and parameters: {'n_layers': 8, 'weight_decay': 0.00013382296173904235, 'n_units_l0': 21, 'n_units_l1': 9, 'n_units_l2': 10, 'n_units_l3': 38, 'n_units_l4': 18, 'n_units_l5': 19, 'n_units_l6': 26, 'n_units_l7': 16, 'optimizer': 'RMSprop', 'rmsprop_learning_rate': 0.0031042428987767515, 'rmsprop_weight_decay': 0.9735551250464725, 'rmsprop_momentum': 0.0030004442460771297}. Best is trial 7 with value: 0.7555555701255798.
Trial 99 finished with value: 0.6222222447395325 and parameters: {'n_layers': 11, 'weight_decay': 1.6010585497159085e-07, 'n_units_l0': 7, 'n_units_l1': 6, 'n_units_l2': 14, 'n_units_l3': 45, 'n_units_l4': 26, 'n_units_l5': 23, 'n_units_l6': 11, 'n_units_l7': 66, 'n_units_l8': 5, 'n_units_l9': 77, 'n_units_l10': 20, 'optimizer': 'Adam', 'adam_learning_rate': 4.077189777640686e-05}. Best is trial 7 with value: 0.7555555701255798.
Trial 100 finished with value: 0.7000000476837158 and parameters: {'n_layers': 12, 'weight_decay': 1.8091566192349603e-05, 'n_units_l0': 9, 'n_units_l1': 12, 'n_units_l2': 4, 'n_units_l3': 48, 'n_units_l4': 17, 'n_units_l5': 16, 'n_units_l6': 35, 'n_units_l7': 17, 'n_units_l8': 17, 'n_units_l9': 30, 'n_units_l10': 7, 'n_units_l11': 112, 'optimizer': 'RMSprop', 'rmsprop_learning_rate': 0.0017231880597799612, 'rmsprop_weight_decay': 0.9477694098563377, 'rmsprop_momentum': 0.07841549400365776}. Best is trial 7 with value: 0.7555555701255798.
Trial 101 finished with value: 0.6555555462837219 and parameters: {'n_layers': 12, 'weight_decay': 1.6253026163984294e-05, 'n_units_l0': 9, 'n_units_l1': 12, 'n_units_l2': 4, 'n_units_l3': 49, 'n_units_l4': 20, 'n_units_l5': 16, 'n_units_l6': 53, 'n_units_l7': 17, 'n_units_l8': 9, 'n_units_l9': 31, 'n_units_l10': 9, 'n_units_l11': 106, 'optimizer': 'RMSprop', 'rmsprop_learning_rate': 0.0024425269690495095, 'rmsprop_weight_decay': 0.9476126445050236, 'rmsprop_momentum': 0.07840626922382617}. Best is trial 7 with value: 0.7555555701255798.
Trial 102 finished with value: 0.5999999642372131 and parameters: {'n_layers': 10, 'weight_decay': 2.6880261256363257e-05, 'n_units_l0': 9, 'n_units_l1': 10, 'n_units_l2': 5, 'n_units_l3': 54, 'n_units_l4': 17, 'n_units_l5': 14, 'n_units_l6': 37, 'n_units_l7': 28, 'n_units_l8': 14, 'n_units_l9': 16, 'optimizer': 'RMSprop', 'rmsprop_learning_rate': 0.0017136443322557926, 'rmsprop_weight_decay': 0.9587742984501801, 'rmsprop_momentum': 0.03456120156714712}. Best is trial 7 with value: 0.7555555701255798.
Trial 103 finished with value: 0.5111111402511597 and parameters: {'n_layers': 9, 'weight_decay': 4.806506203156836e-10, 'n_units_l0': 7, 'n_units_l1': 7, 'n_units_l2': 32, 'n_units_l3': 31, 'n_units_l4': 15, 'n_units_l5': 28, 'n_units_l6': 34, 'n_units_l7': 14, 'n_units_l8': 23, 'optimizer': 'RMSprop', 'rmsprop_learning_rate': 0.0010139896279888828, 'rmsprop_weight_decay': 0.9392147424873486, 'rmsprop_momentum': 0.0007311860069378215}. Best is trial 7 with value: 0.7555555701255798.
Trial 104 finished with value: 0.5666666626930237 and parameters: {'n_layers': 13, 'weight_decay': 0.00010228624500297824, 'n_units_l0': 11, 'n_units_l1': 23, 'n_units_l2': 4, 'n_units_l3': 40, 'n_units_l4': 11, 'n_units_l5': 17, 'n_units_l6': 43, 'n_units_l7': 22, 'n_units_l8': 13, 'n_units_l9': 24, 'n_units_l10': 7, 'n_units_l11': 119, 'n_units_l12': 13, 'optimizer': 'RMSprop', 'rmsprop_learning_rate': 0.0012839604864917987, 'rmsprop_weight_decay': 0.9437227749617544, 'rmsprop_momentum': 0.017003266928815357}. Best is trial 7 with value: 0.7555555701255798.
Trial 105 finished with value: 0.41111111640930176 and parameters: {'n_layers': 14, 'weight_decay': 1.1493024555195662e-05, 'n_units_l0': 24, 'n_units_l1': 12, 'n_units_l2': 6, 'n_units_l3': 49, 'n_units_l4': 58, 'n_units_l5': 25, 'n_units_l6': 17, 'n_units_l7': 19, 'n_units_l8': 18, 'n_units_l9': 39, 'n_units_l10': 16, 'n_units_l11': 83, 'n_units_l12': 34, 'n_units_l13': 21, 'optimizer': 'RMSprop', 'rmsprop_learning_rate': 0.0007412853348435337, 'rmsprop_weight_decay': 0.9679166531752748, 'rmsprop_momentum': 0.0456225143287758}. Best is trial 7 with value: 0.7555555701255798.
Trial 106 finished with value: 0.6333333849906921 and parameters: {'n_layers': 12, 'weight_decay': 4.443101806944752e-05, 'n_units_l0': 8, 'n_units_l1': 11, 'n_units_l2': 5, 'n_units_l3': 25, 'n_units_l4': 28, 'n_units_l5': 19, 'n_units_l6': 5, 'n_units_l7': 15, 'n_units_l8': 16, 'n_units_l9': 34, 'n_units_l10': 7, 'n_units_l11': 44, 'optimizer': 'RMSprop', 'rmsprop_learning_rate': 0.003243739622469339, 'rmsprop_weight_decay': 0.9532157545372912, 'rmsprop_momentum': 0.0009866638068064773}. Best is trial 7 with value: 0.7555555701255798.
Trial 107 finished with value: 0.7222222685813904 and parameters: {'n_layers': 8, 'weight_decay': 5.562758976929197e-06, 'n_units_l0': 33, 'n_units_l1': 9, 'n_units_l2': 7, 'n_units_l3': 41, 'n_units_l4': 22, 'n_units_l5': 34, 'n_units_l6': 13, 'n_units_l7': 17, 'optimizer': 'RMSprop', 'rmsprop_learning_rate': 0.0004967068330037127, 'rmsprop_weight_decay': 0.983996923327731, 'rmsprop_momentum': 0.000544203640704501}. Best is trial 7 with value: 0.7555555701255798.
Trial 108 finished with value: 0.46666666865348816 and parameters: {'n_layers': 8, 'weight_decay': 5.649657023884342e-06, 'n_units_l0': 33, 'n_units_l1': 9, 'n_units_l2': 7, 'n_units_l3': 40, 'n_units_l4': 19, 'n_units_l5': 53, 'n_units_l6': 12, 'n_units_l7': 13, 'optimizer': 'RMSprop', 'rmsprop_learning_rate': 0.0005390970761085825, 'rmsprop_weight_decay': 0.9821603276121167, 'rmsprop_momentum': 0.00047662251813005747}. Best is trial 7 with value: 0.7555555701255798.
Trial 109 finished with value: 0.6000000834465027 and parameters: {'n_layers': 11, 'weight_decay': 3.4478322907437338e-06, 'n_units_l0': 39, 'n_units_l1': 8, 'n_units_l2': 48, 'n_units_l3': 32, 'n_units_l4': 22, 'n_units_l5': 34, 'n_units_l6': 15, 'n_units_l7': 17, 'n_units_l8': 12, 'n_units_l9': 23, 'n_units_l10': 5, 'optimizer': 'SGD', 'sgd_opt_learning_rate': 0.00012660476807275668, 'sgd_opt_momentum': 0.008606351064957232}. Best is trial 7 with value: 0.7555555701255798.
Trial 110 finished with value: 0.6333333849906921 and parameters: {'n_layers': 9, 'weight_decay': 2.323250472666757e-06, 'n_units_l0': 30, 'n_units_l1': 10, 'n_units_l2': 9, 'n_units_l3': 21, 'n_units_l4': 46, 'n_units_l5': 43, 'n_units_l6': 19, 'n_units_l7': 21, 'n_units_l8': 31, 'optimizer': 'RMSprop', 'rmsprop_learning_rate': 0.0008800231796368408, 'rmsprop_weight_decay': 0.9773038321446981, 'rmsprop_momentum': 0.0002691660317212673}. Best is trial 7 with value: 0.7555555701255798.
Trial 111 finished with value: 0.6666666865348816 and parameters: {'n_layers': 6, 'weight_decay': 1.8049991623225227e-05, 'n_units_l0': 28, 'n_units_l1': 8, 'n_units_l2': 8, 'n_units_l3': 63, 'n_units_l4': 23, 'n_units_l5': 5, 'optimizer': 'RMSprop', 'rmsprop_learning_rate': 0.002165688489440751, 'rmsprop_weight_decay': 0.9860165622247534, 'rmsprop_momentum': 0.0005709091334390731}. Best is trial 7 with value: 0.7555555701255798.
Trial 112 finished with value: 0.6888888478279114 and parameters: {'n_layers': 8, 'weight_decay': 6.3471722429057e-05, 'n_units_l0': 26, 'n_units_l1': 7, 'n_units_l2': 12, 'n_units_l3': 42, 'n_units_l4': 17, 'n_units_l5': 29, 'n_units_l6': 13, 'n_units_l7': 23, 'optimizer': 'RMSprop', 'rmsprop_learning_rate': 0.0016548976763210378, 'rmsprop_weight_decay': 0.9501649137117643, 'rmsprop_momentum': 0.0007886092164671367}. Best is trial 7 with value: 0.7555555701255798.
Trial 113 finished with value: 0.4777778089046478 and parameters: {'n_layers': 7, 'weight_decay': 7.801062134478005e-05, 'n_units_l0': 23, 'n_units_l1': 9, 'n_units_l2': 12, 'n_units_l3': 35, 'n_units_l4': 16, 'n_units_l5': 39, 'n_units_l6': 14, 'optimizer': 'RMSprop', 'rmsprop_learning_rate': 0.0017456616187824668, 'rmsprop_weight_decay': 0.9592877423303026, 'rmsprop_momentum': 0.0007740817328096155}. Best is trial 7 with value: 0.7555555701255798.
Trial 114 finished with value: 0.5666666626930237 and parameters: {'n_layers': 8, 'weight_decay': 5.755913234159726e-06, 'n_units_l0': 26, 'n_units_l1': 6, 'n_units_l2': 10, 'n_units_l3': 43, 'n_units_l4': 13, 'n_units_l5': 30, 'n_units_l6': 12, 'n_units_l7': 24, 'optimizer': 'RMSprop', 'rmsprop_learning_rate': 0.0003630032080802201, 'rmsprop_weight_decay': 0.9789004531715185, 'rmsprop_momentum': 0.001679426771788423}. Best is trial 7 with value: 0.7555555701255798.
Trial 115 finished with value: 0.4777778089046478 and parameters: {'n_layers': 9, 'weight_decay': 0.00016622570995165022, 'n_units_l0': 17, 'n_units_l1': 7, 'n_units_l2': 11, 'n_units_l3': 35, 'n_units_l4': 17, 'n_units_l5': 35, 'n_units_l6': 10, 'n_units_l7': 20, 'n_units_l8': 7, 'optimizer': 'RMSprop', 'rmsprop_learning_rate': 0.00025914012049224453, 'rmsprop_weight_decay': 0.9697330551459057, 'rmsprop_momentum': 0.00037041288262263907}. Best is trial 7 with value: 0.7555555701255798.
Trial 116 finished with value: 0.5555555820465088 and parameters: {'n_layers': 10, 'weight_decay': 5.637816261163079e-05, 'n_units_l0': 34, 'n_units_l1': 5, 'n_units_l2': 7, 'n_units_l3': 42, 'n_units_l4': 14, 'n_units_l5': 28, 'n_units_l6': 21, 'n_units_l7': 16, 'n_units_l8': 26, 'n_units_l9': 28, 'optimizer': 'Adam', 'adam_learning_rate': 0.003190849867110193}. Best is trial 7 with value: 0.7555555701255798.
Trial 117 finished with value: 0.6222222447395325 and parameters: {'n_layers': 7, 'weight_decay': 2.86216983070249e-05, 'n_units_l0': 37, 'n_units_l1': 11, 'n_units_l2': 5, 'n_units_l3': 49, 'n_units_l4': 39, 'n_units_l5': 23, 'n_units_l6': 13, 'optimizer': 'RMSprop', 'rmsprop_learning_rate': 0.0012162703374890957, 'rmsprop_weight_decay': 0.9558169857008973, 'rmsprop_momentum': 0.001186051691001235}. Best is trial 7 with value: 0.7555555701255798.
Trial 118 finished with value: 0.4888889491558075 and parameters: {'n_layers': 9, 'weight_decay': 1.1408691497516445e-05, 'n_units_l0': 29, 'n_units_l1': 8, 'n_units_l2': 8, 'n_units_l3': 6, 'n_units_l4': 20, 'n_units_l5': 31, 'n_units_l6': 8, 'n_units_l7': 26, 'n_units_l8': 6, 'optimizer': 'RMSprop', 'rmsprop_learning_rate': 0.0005521779331358071, 'rmsprop_weight_decay': 0.9465839073415037, 'rmsprop_momentum': 0.0005366963884021265}. Best is trial 7 with value: 0.7555555701255798.
Trial 119 finished with value: 0.5999999642372131 and parameters: {'n_layers': 6, 'weight_decay': 7.637896756300803e-06, 'n_units_l0': 26, 'n_units_l1': 7, 'n_units_l2': 7, 'n_units_l3': 29, 'n_units_l4': 15, 'n_units_l5': 21, 'optimizer': 'RMSprop', 'rmsprop_learning_rate': 3.113823005735536e-05, 'rmsprop_weight_decay': 0.9743439441534081, 'rmsprop_momentum': 0.09884644982060423}. Best is trial 7 with value: 0.7555555701255798.
Trial 120 finished with value: 0.7444444298744202 and parameters: {'n_layers': 8, 'weight_decay': 6.139201120231535e-05, 'n_units_l0': 21, 'n_units_l1': 12, 'n_units_l2': 11, 'n_units_l3': 47, 'n_units_l4': 24, 'n_units_l5': 26, 'n_units_l6': 27, 'n_units_l7': 23, 'optimizer': 'RMSprop', 'rmsprop_learning_rate': 0.0007253779562410976, 'rmsprop_weight_decay': 0.9196884285842936, 'rmsprop_momentum': 0.013610222068110873}. Best is trial 7 with value: 0.7555555701255798.
Trial 121 finished with value: 0.5666666626930237 and parameters: {'n_layers': 8, 'weight_decay': 2.2021464056477332e-05, 'n_units_l0': 21, 'n_units_l1': 14, 'n_units_l2': 14, 'n_units_l3': 46, 'n_units_l4': 21, 'n_units_l5': 26, 'n_units_l6': 27, 'n_units_l7': 19, 'optimizer': 'RMSprop', 'rmsprop_learning_rate': 0.0007146292093760206, 'rmsprop_weight_decay': 0.9188856570388635, 'rmsprop_momentum': 0.01019980398108172}. Best is trial 7 with value: 0.7555555701255798.
Trial 122 finished with value: 0.42222222685813904 and parameters: {'n_layers': 10, 'weight_decay': 5.933065520750047e-05, 'n_units_l0': 23, 'n_units_l1': 12, 'n_units_l2': 9, 'n_units_l3': 58, 'n_units_l4': 25, 'n_units_l5': 33, 'n_units_l6': 30, 'n_units_l7': 23, 'n_units_l8': 41, 'n_units_l9': 19, 'optimizer': 'RMSprop', 'rmsprop_learning_rate': 0.0009683500051734769, 'rmsprop_weight_decay': 0.9134526164619341, 'rmsprop_momentum': 0.005070969765687935}. Best is trial 7 with value: 0.7555555701255798.
Trial 123 finished with value: 0.6222222447395325 and parameters: {'n_layers': 8, 'weight_decay': 3.704186779158444e-05, 'n_units_l0': 19, 'n_units_l1': 16, 'n_units_l2': 95, 'n_units_l3': 37, 'n_units_l4': 18, 'n_units_l5': 24, 'n_units_l6': 17, 'n_units_l7': 18, 'optimizer': 'RMSprop', 'rmsprop_learning_rate': 0.0015260273261811822, 'rmsprop_weight_decay': 0.9497269442120254, 'rmsprop_momentum': 0.0009704130208337934}. Best is trial 7 with value: 0.7555555701255798.
Trial 124 finished with value: 0.6888888478279114 and parameters: {'n_layers': 7, 'weight_decay': 0.00010824311635219681, 'n_units_l0': 31, 'n_units_l1': 10, 'n_units_l2': 6, 'n_units_l3': 5, 'n_units_l4': 23, 'n_units_l5': 27, 'n_units_l6': 35, 'optimizer': 'RMSprop', 'rmsprop_learning_rate': 0.004278595813823256, 'rmsprop_weight_decay': 0.9611120212446629, 'rmsprop_momentum': 0.007546929140904609}. Best is trial 7 with value: 0.7555555701255798.
Trial 125 finished with value: 0.6222222447395325 and parameters: {'n_layers': 5, 'weight_decay': 0.00010349801159121123, 'n_units_l0': 31, 'n_units_l1': 9, 'n_units_l2': 12, 'n_units_l3': 5, 'n_units_l4': 35, 'optimizer': 'RMSprop', 'rmsprop_learning_rate': 0.004109106482616242, 'rmsprop_weight_decay': 0.9301692799991015, 'rmsprop_momentum': 0.006487777819376124}. Best is trial 7 with value: 0.7555555701255798.
Trial 126 finished with value: 0.644444465637207 and parameters: {'n_layers': 7, 'weight_decay': 0.00019768334274497374, 'n_units_l0': 43, 'n_units_l1': 6, 'n_units_l2': 10, 'n_units_l3': 7, 'n_units_l4': 30, 'n_units_l5': 29, 'n_units_l6': 36, 'optimizer': 'Adam', 'adam_learning_rate': 0.005947862384616581}. Best is trial 7 with value: 0.7555555701255798.
Trial 127 finished with value: 0.5333333611488342 and parameters: {'n_layers': 11, 'weight_decay': 0.0002691466139527048, 'n_units_l0': 27, 'n_units_l1': 14, 'n_units_l2': 6, 'n_units_l3': 16, 'n_units_l4': 23, 'n_units_l5': 22, 'n_units_l6': 41, 'n_units_l7': 11, 'n_units_l8': 99, 'n_units_l9': 9, 'n_units_l10': 6, 'optimizer': 'RMSprop', 'rmsprop_learning_rate': 0.0026837920585204224, 'rmsprop_weight_decay': 0.9046169535670846, 'rmsprop_momentum': 0.012751230746651885}. Best is trial 7 with value: 0.7555555701255798.
Trial 128 finished with value: 0.6111111640930176 and parameters: {'n_layers': 7, 'weight_decay': 1.956087829677247e-05, 'n_units_l0': 33, 'n_units_l1': 13, 'n_units_l2': 11, 'n_units_l3': 4, 'n_units_l4': 25, 'n_units_l5': 40, 'n_units_l6': 32, 'optimizer': 'RMSprop', 'rmsprop_learning_rate': 0.0020487090103557624, 'rmsprop_weight_decay': 0.9358860022444706, 'rmsprop_momentum': 0.01467947525625906}. Best is trial 7 with value: 0.7555555701255798.
