Trial 42 finished with value: 0.7222222685813904 and parameters: {'n_layers': 8, 'weight_decay': 3.7909624348394144e-05, 'n_units_l0': 24, 'n_units_l1': 6, 'n_units_l2': 5, 'n_units_l3': 5, 'n_units_l4': 23, 'n_units_l5': 21, 'n_units_l6': 37, 'n_units_l7': 21, 'optimizer': 'RMSprop', 'rmsprop_learning_rate': 0.004092677198091682, 'rmsprop_weight_decay': 0.9561896974523739, 'rmsprop_momentum': 0.004176510389661966}. Best is trial 7 with value: 0.7555555701255798.
Trial 43 finished with value: 0.5555555820465088 and parameters: {'n_layers': 12, 'weight_decay': 3.977210887917906e-06, 'n_units_l0': 25, 'n_units_l1': 4, 'n_units_l2': 5, 'n_units_l3': 5, 'n_units_l4': 23, 'n_units_l5': 19, 'n_units_l6': 58, 'n_units_l7': 22, 'n_units_l8': 7, 'n_units_l9': 12, 'n_units_l10': 4, 'n_units_l11': 8, 'optimizer': 'RMSprop', 'rmsprop_learning_rate': 0.003013526683798214, 'rmsprop_weight_decay': 0.9540463346738962, 'rmsprop_momentum': 0.0052533658816122}. Best is trial 7 with value: 0.7555555701255798.
Trial 44 finished with value: 0.5555555820465088 and parameters: {'n_layers': 10, 'weight_decay': 1.594069304838566e-05, 'n_units_l0': 36, 'n_units_l1': 5, 'n_units_l2': 7, 'n_units_l3': 8, 'n_units_l4': 12, 'n_units_l5': 15, 'n_units_l6': 23, 'n_units_l7': 13, 'n_units_l8': 126, 'n_units_l9': 43, 'optimizer': 'RMSprop', 'rmsprop_learning_rate': 0.004829188345332026, 'rmsprop_weight_decay': 0.957870129119015, 'rmsprop_momentum': 0.001458322935931729}. Best is trial 7 with value: 0.7555555701255798.
Trial 45 finished with value: 0.5111111402511597 and parameters: {'n_layers': 8, 'weight_decay': 0.00040532280259149674, 'n_units_l0': 12, 'n_units_l1': 7, 'n_units_l2': 4, 'n_units_l3': 5, 'n_units_l4': 14, 'n_units_l5': 29, 'n_units_l6': 11, 'n_units_l7': 32, 'optimizer': 'RMSprop', 'rmsprop_learning_rate': 0.0014333886063925903, 'rmsprop_weight_decay': 0.9336051715888273, 'rmsprop_momentum': 0.010293348213022064}. Best is trial 7 with value: 0.7555555701255798.
Trial 46 finished with value: 0.4888888895511627 and parameters: {'n_layers': 13, 'weight_decay': 0.00012856686251856014, 'n_units_l0': 84, 'n_units_l1': 7, 'n_units_l2': 13, 'n_units_l3': 13, 'n_units_l4': 8, 'n_units_l5': 21, 'n_units_l6': 76, 'n_units_l7': 22, 'n_units_l8': 15, 'n_units_l9': 21, 'n_units_l10': 8, 'n_units_l11': 61, 'n_units_l12': 23, 'optimizer': 'RMSprop', 'rmsprop_learning_rate': 0.018420112187290012, 'rmsprop_weight_decay': 0.9771829887201332, 'rmsprop_momentum': 0.0004696309233003005}. Best is trial 7 with value: 0.7555555701255798.
Trial 47 finished with value: 0.46666666865348816 and parameters: {'n_layers': 11, 'weight_decay': 4.469252377785246e-05, 'n_units_l0': 22, 'n_units_l1': 6, 'n_units_l2': 18, 'n_units_l3': 10, 'n_units_l4': 28, 'n_units_l5': 11, 'n_units_l6': 50, 'n_units_l7': 15, 'n_units_l8': 47, 'n_units_l9': 11, 'n_units_l10': 13, 'optimizer': 'SGD', 'sgd_opt_learning_rate': 0.09708514500960068, 'sgd_opt_momentum': 0.0007601756866397898}. Best is trial 7 with value: 0.7555555701255798.
Trial 48 finished with value: 0.6333333849906921 and parameters: {'n_layers': 5, 'weight_decay': 4.572502739189577e-06, 'n_units_l0': 32, 'n_units_l1': 9, 'n_units_l2': 5, 'n_units_l3': 4, 'n_units_l4': 21, 'optimizer': 'RMSprop', 'rmsprop_learning_rate': 0.003713529722597366, 'rmsprop_weight_decay': 0.9431074185148426, 'rmsprop_momentum': 0.004722824723120043}. Best is trial 7 with value: 0.7555555701255798.
Trial 49 finished with value: 0.5666666626930237 and parameters: {'n_layers': 9, 'weight_decay': 5.849270797996406e-07, 'n_units_l0': 16, 'n_units_l1': 5, 'n_units_l2': 9, 'n_units_l3': 7, 'n_units_l4': 34, 'n_units_l5': 28, 'n_units_l6': 37, 'n_units_l7': 5, 'n_units_l8': 8, 'optimizer': 'RMSprop', 'rmsprop_learning_rate': 0.0019222815628727116, 'rmsprop_weight_decay': 0.9809979241245843, 'rmsprop_momentum': 0.00012983289663061695}. Best is trial 7 with value: 0.7555555701255798.
Trial 50 finished with value: 0.36666667461395264 and parameters: {'n_layers': 7, 'weight_decay': 1.565939865754077e-05, 'n_units_l0': 41, 'n_units_l1': 124, 'n_units_l2': 7, 'n_units_l3': 5, 'n_units_l4': 53, 'n_units_l5': 38, 'n_units_l6': 25, 'optimizer': 'RMSprop', 'rmsprop_learning_rate': 0.0009011272355965468, 'rmsprop_weight_decay': 0.9898515560934174, 'rmsprop_momentum': 0.003281984588342564}. Best is trial 7 with value: 0.7555555701255798.
Trial 51 finished with value: 0.5222222208976746 and parameters: {'n_layers': 8, 'weight_decay': 4.0854390662637865e-05, 'n_units_l0': 20, 'n_units_l1': 6, 'n_units_l2': 6, 'n_units_l3': 7, 'n_units_l4': 39, 'n_units_l5': 23, 'n_units_l6': 34, 'n_units_l7': 19, 'optimizer': 'RMSprop', 'rmsprop_learning_rate': 0.00040139517321100324, 'rmsprop_weight_decay': 0.9685437264923165, 'rmsprop_momentum': 0.0008512900716419017}. Best is trial 7 with value: 0.7555555701255798.
Trial 52 finished with value: 0.3888889253139496 and parameters: {'n_layers': 11, 'weight_decay': 5.757753345404885e-05, 'n_units_l0': 11, 'n_units_l1': 13, 'n_units_l2': 6, 'n_units_l3': 9, 'n_units_l4': 27, 'n_units_l5': 25, 'n_units_l6': 30, 'n_units_l7': 11, 'n_units_l8': 82, 'n_units_l9': 6, 'n_units_l10': 120, 'optimizer': 'RMSprop', 'rmsprop_learning_rate': 0.000653825672881931, 'rmsprop_weight_decay': 0.9520190123946556, 'rmsprop_momentum': 0.00033582143734717126}. Best is trial 7 with value: 0.7555555701255798.
Trial 53 finished with value: 0.5888888835906982 and parameters: {'n_layers': 10, 'weight_decay': 0.00013753284543052468, 'n_units_l0': 15, 'n_units_l1': 9, 'n_units_l2': 76, 'n_units_l3': 6, 'n_units_l4': 33, 'n_units_l5': 32, 'n_units_l6': 14, 'n_units_l7': 14, 'n_units_l8': 28, 'n_units_l9': 27, 'optimizer': 'RMSprop', 'rmsprop_learning_rate': 0.00016221593627939319, 'rmsprop_weight_decay': 0.9614664550304363, 'rmsprop_momentum': 0.0002123712666943789}. Best is trial 7 with value: 0.7555555701255798.
Trial 54 finished with value: 0.644444465637207 and parameters: {'n_layers': 7, 'weight_decay': 0.0003812541459161764, 'n_units_l0': 24, 'n_units_l1': 6, 'n_units_l2': 47, 'n_units_l3': 5, 'n_units_l4': 73, 'n_units_l5': 20, 'n_units_l6': 18, 'optimizer': 'RMSprop', 'rmsprop_learning_rate': 0.010740486827195436, 'rmsprop_weight_decay': 0.948549705616079, 'rmsprop_momentum': 0.0004463410747926236}. Best is trial 7 with value: 0.7555555701255798.
Trial 55 finished with value: 0.4888889491558075 and parameters: {'n_layers': 14, 'weight_decay': 3.1409681938400555e-05, 'n_units_l0': 20, 'n_units_l1': 4, 'n_units_l2': 8, 'n_units_l3': 8, 'n_units_l4': 47, 'n_units_l5': 13, 'n_units_l6': 22, 'n_units_l7': 26, 'n_units_l8': 38, 'n_units_l9': 51, 'n_units_l10': 5, 'n_units_l11': 127, 'n_units_l12': 67, 'n_units_l13': 12, 'optimizer': 'RMSprop', 'rmsprop_learning_rate': 0.0027003957920485105, 'rmsprop_weight_decay': 0.966717231364023, 'rmsprop_momentum': 0.0016548628244786006}. Best is trial 7 with value: 0.7555555701255798.
Trial 56 finished with value: 0.7333333492279053 and parameters: {'n_layers': 9, 'weight_decay': 6.423971222500081e-06, 'n_units_l0': 27, 'n_units_l1': 7, 'n_units_l2': 4, 'n_units_l3': 4, 'n_units_l4': 24, 'n_units_l5': 46, 'n_units_l6': 39, 'n_units_l7': 17, 'n_units_l8': 59, 'optimizer': 'Adam', 'adam_learning_rate': 0.007283600630530022}. Best is trial 7 with value: 0.7555555701255798.
Trial 57 finished with value: 0.5222222208976746 and parameters: {'n_layers': 9, 'weight_decay': 8.534221109606005e-06, 'n_units_l0': 27, 'n_units_l1': 16, 'n_units_l2': 4, 'n_units_l3': 4, 'n_units_l4': 18, 'n_units_l5': 48, 'n_units_l6': 12, 'n_units_l7': 16, 'n_units_l8': 62, 'optimizer': 'Adam', 'adam_learning_rate': 0.007444779306572704}. Best is trial 7 with value: 0.7555555701255798.
Trial 58 finished with value: 0.5000000596046448 and parameters: {'n_layers': 12, 'weight_decay': 2.336155195160797e-06, 'n_units_l0': 35, 'n_units_l1': 9, 'n_units_l2': 5, 'n_units_l3': 13, 'n_units_l4': 24, 'n_units_l5': 67, 'n_units_l6': 52, 'n_units_l7': 30, 'n_units_l8': 76, 'n_units_l9': 81, 'n_units_l10': 128, 'n_units_l11': 88, 'optimizer': 'Adam', 'adam_learning_rate': 0.00016092036149357216}. Best is trial 7 with value: 0.7555555701255798.
Trial 59 finished with value: 0.5777778029441833 and parameters: {'n_layers': 5, 'weight_decay': 2.3675383846706813e-07, 'n_units_l0': 23, 'n_units_l1': 7, 'n_units_l2': 20, 'n_units_l3': 16, 'n_units_l4': 15, 'optimizer': 'Adam', 'adam_learning_rate': 0.01345290447588129}. Best is trial 7 with value: 0.7555555701255798.
Trial 60 finished with value: 0.6555555462837219 and parameters: {'n_layers': 10, 'weight_decay': 5.620779572917279e-06, 'n_units_l0': 30, 'n_units_l1': 11, 'n_units_l2': 34, 'n_units_l3': 10, 'n_units_l4': 30, 'n_units_l5': 6, 'n_units_l6': 74, 'n_units_l7': 25, 'n_units_l8': 55, 'n_units_l9': 19, 'optimizer': 'Adam', 'adam_learning_rate': 0.00012250280761456564}. Best is trial 7 with value: 0.7555555701255798.
Trial 61 finished with value: 0.5000000596046448 and parameters: {'n_layers': 8, 'weight_decay': 1.4866036935935292e-05, 'n_units_l0': 18, 'n_units_l1': 5, 'n_units_l2': 6, 'n_units_l3': 6, 'n_units_l4': 39, 'n_units_l5': 33, 'n_units_l6': 41, 'n_units_l7': 21, 'optimizer': 'RMSprop', 'rmsprop_learning_rate': 0.0010856031456522922, 'rmsprop_weight_decay': 0.9810969248483561, 'rmsprop_momentum': 0.0008954656377833757}. Best is trial 7 with value: 0.7555555701255798.
Trial 62 finished with value: 0.4888888895511627 and parameters: {'n_layers': 6, 'weight_decay': 5.632990699776802e-05, 'n_units_l0': 127, 'n_units_l1': 8, 'n_units_l2': 7, 'n_units_l3': 7, 'n_units_l4': 25, 'n_units_l5': 16, 'optimizer': 'Adam', 'adam_learning_rate': 0.015593496427246884}. Best is trial 7 with value: 0.7555555701255798.
Trial 63 finished with value: 0.6111111640930176 and parameters: {'n_layers': 9, 'weight_decay': 7.979590952275113e-05, 'n_units_l0': 26, 'n_units_l1': 7, 'n_units_l2': 5, 'n_units_l3': 5, 'n_units_l4': 19, 'n_units_l5': 56, 'n_units_l6': 34, 'n_units_l7': 17, 'n_units_l8': 106, 'optimizer': 'RMSprop', 'rmsprop_learning_rate': 0.00044018758937617084, 'rmsprop_weight_decay': 0.9567483884502337, 'rmsprop_momentum': 0.008133274389060348}. Best is trial 7 with value: 0.7555555701255798.
Trial 64 finished with value: 0.6000000834465027 and parameters: {'n_layers': 14, 'weight_decay': 3.0339523291105046e-06, 'n_units_l0': 15, 'n_units_l1': 6, 'n_units_l2': 10, 'n_units_l3': 4, 'n_units_l4': 54, 'n_units_l5': 22, 'n_units_l6': 16, 'n_units_l7': 22, 'n_units_l8': 23, 'n_units_l9': 10, 'n_units_l10': 8, 'n_units_l11': 25, 'n_units_l12': 6, 'n_units_l13': 66, 'optimizer': 'SGD', 'sgd_opt_learning_rate': 0.01351185227743554, 'sgd_opt_momentum': 0.00811760967645009}. Best is trial 7 with value: 0.7555555701255798.
Trial 65 finished with value: 0.555555522441864 and parameters: {'n_layers': 7, 'weight_decay': 9.888171770081323e-07, 'n_units_l0': 20, 'n_units_l1': 5, 'n_units_l2': 8, 'n_units_l3': 6, 'n_units_l4': 21, 'n_units_l5': 27, 'n_units_l6': 28, 'optimizer': 'RMSprop', 'rmsprop_learning_rate': 0.0021124277314698028, 'rmsprop_weight_decay': 0.9390282200012301, 'rmsprop_momentum': 0.000555837325294577}. Best is trial 7 with value: 0.7555555701255798.
Trial 66 finished with value: 0.5555555820465088 and parameters: {'n_layers': 12, 'weight_decay': 7.25933981525036e-06, 'n_units_l0': 48, 'n_units_l1': 9, 'n_units_l2': 125, 'n_units_l3': 8, 'n_units_l4': 39, 'n_units_l5': 37, 'n_units_l6': 112, 'n_units_l7': 10, 'n_units_l8': 55, 'n_units_l9': 31, 'n_units_l10': 5, 'n_units_l11': 5, 'optimizer': 'RMSprop', 'rmsprop_learning_rate': 0.00010098911451334379, 'rmsprop_weight_decay': 0.968766857224912, 'rmsprop_momentum': 0.0028711933802744107}. Best is trial 7 with value: 0.7555555701255798.
Trial 67 finished with value: 0.36666667461395264 and parameters: {'n_layers': 8, 'weight_decay': 0.00022013322811027407, 'n_units_l0': 13, 'n_units_l1': 6, 'n_units_l2': 4, 'n_units_l3': 18, 'n_units_l4': 62, 'n_units_l5': 17, 'n_units_l6': 38, 'n_units_l7': 12, 'optimizer': 'Adam', 'adam_learning_rate': 0.0025148331706172987}. Best is trial 7 with value: 0.7555555701255798.
Trial 68 finished with value: 0.5555555820465088 and parameters: {'n_layers': 10, 'weight_decay': 2.241551701510294e-05, 'n_units_l0': 29, 'n_units_l1': 4, 'n_units_l2': 15, 'n_units_l3': 28, 'n_units_l4': 31, 'n_units_l5': 42, 'n_units_l6': 46, 'n_units_l7': 20, 'n_units_l8': 103, 'n_units_l9': 7, 'optimizer': 'RMSprop', 'rmsprop_learning_rate': 0.00033918937479411593, 'rmsprop_weight_decay': 0.9473688050501734, 'rmsprop_momentum': 0.018813357658977865}. Best is trial 7 with value: 0.7555555701255798.
Trial 69 finished with value: 0.4555555582046509 and parameters: {'n_layers': 3, 'weight_decay': 0.0005640733283603986, 'n_units_l0': 38, 'n_units_l1': 11, 'n_units_l2': 9, 'optimizer': 'RMSprop', 'rmsprop_learning_rate': 0.041944891088179136, 'rmsprop_weight_decay': 0.916668712027026, 'rmsprop_momentum': 0.0013146266846058535}. Best is trial 7 with value: 0.7555555701255798.
Trial 70 finished with value: 0.4888888895511627 and parameters: {'n_layers': 11, 'weight_decay': 9.617753733718583e-05, 'n_units_l0': 22, 'n_units_l1': 8, 'n_units_l2': 7, 'n_units_l3': 5, 'n_units_l4': 9, 'n_units_l5': 14, 'n_units_l6': 20, 'n_units_l7': 15, 'n_units_l8': 14, 'n_units_l9': 5, 'n_units_l10': 55, 'optimizer': 'RMSprop', 'rmsprop_learning_rate': 0.0006490814288631373, 'rmsprop_weight_decay': 0.9595301576744798, 'rmsprop_momentum': 0.00032275697080334234}. Best is trial 7 with value: 0.7555555701255798.
Trial 71 finished with value: 0.6555555462837219 and parameters: {'n_layers': 13, 'weight_decay': 1.92660659385277e-09, 'n_units_l0': 5, 'n_units_l1': 52, 'n_units_l2': 12, 'n_units_l3': 102, 'n_units_l4': 27, 'n_units_l5': 12, 'n_units_l6': 6, 'n_units_l7': 18, 'n_units_l8': 63, 'n_units_l9': 77, 'n_units_l10': 23, 'n_units_l11': 38, 'n_units_l12': 126, 'optimizer': 'RMSprop', 'rmsprop_learning_rate': 0.009104398619874422, 'rmsprop_weight_decay': 0.9771958742167598, 'rmsprop_momentum': 9.034479633012775e-05}. Best is trial 7 with value: 0.7555555701255798.
Trial 72 finished with value: 0.6888888478279114 and parameters: {'n_layers': 24, 'weight_decay': 3.0991199332820446e-10, 'n_units_l0': 25, 'n_units_l1': 26, 'n_units_l2': 18, 'n_units_l3': 39, 'n_units_l4': 23, 'n_units_l5': 9, 'n_units_l6': 4, 'n_units_l7': 127, 'n_units_l8': 79, 'n_units_l9': 115, 'n_units_l10': 13, 'n_units_l11': 55, 'n_units_l12': 87, 'n_units_l13': 6, 'n_units_l14': 7, 'n_units_l15': 18, 'n_units_l16': 17, 'n_units_l17': 44, 'n_units_l18': 9, 'n_units_l19': 10, 'n_units_l20': 121, 'n_units_l21': 5, 'n_units_l22': 4, 'n_units_l23': 9, 'optimizer': 'RMSprop', 'rmsprop_learning_rate': 0.004788798572484627, 'rmsprop_weight_decay': 0.9513414502397325, 'rmsprop_momentum': 0.0003961841777543056}. Best is trial 7 with value: 0.7555555701255798.
Trial 73 finished with value: 0.5777778029441833 and parameters: {'n_layers': 25, 'weight_decay': 4.159615810806181e-09, 'n_units_l0': 25, 'n_units_l1': 26, 'n_units_l2': 47, 'n_units_l3': 44, 'n_units_l4': 17, 'n_units_l5': 7, 'n_units_l6': 5, 'n_units_l7': 24, 'n_units_l8': 78, 'n_units_l9': 93, 'n_units_l10': 13, 'n_units_l11': 52, 'n_units_l12': 34, 'n_units_l13': 30, 'n_units_l14': 20, 'n_units_l15': 9, 'n_units_l16': 13, 'n_units_l17': 15, 'n_units_l18': 116, 'n_units_l19': 9, 'n_units_l20': 126, 'n_units_l21': 5, 'n_units_l22': 4, 'n_units_l23': 7, 'n_units_l24': 12, 'optimizer': 'RMSprop', 'rmsprop_learning_rate': 0.004958476679889348, 'rmsprop_weight_decay': 0.9513413746869354, 'rmsprop_momentum': 0.00022176658293821333}. Best is trial 7 with value: 0.7555555701255798.
Trial 74 finished with value: 0.5555555820465088 and parameters: {'n_layers': 23, 'weight_decay': 7.381277336654138e-10, 'n_units_l0': 32, 'n_units_l1': 19, 'n_units_l2': 23, 'n_units_l3': 20, 'n_units_l4': 22, 'n_units_l5': 10, 'n_units_l6': 33, 'n_units_l7': 47, 'n_units_l8': 31, 'n_units_l9': 115, 'n_units_l10': 11, 'n_units_l11': 91, 'n_units_l12': 53, 'n_units_l13': 5, 'n_units_l14': 7, 'n_units_l15': 15, 'n_units_l16': 4, 'n_units_l17': 4, 'n_units_l18': 11, 'n_units_l19': 16, 'n_units_l20': 46, 'n_units_l21': 12, 'n_units_l22': 4, 'optimizer': 'RMSprop', 'rmsprop_learning_rate': 0.0018230328570512451, 'rmsprop_weight_decay': 0.9329124138472404, 'rmsprop_momentum': 0.00046943270197562996}. Best is trial 7 with value: 0.7555555701255798.
Trial 75 finished with value: 0.5000000596046448 and parameters: {'n_layers': 16, 'weight_decay': 4.977725512164256e-08, 'n_units_l0': 18, 'n_units_l1': 34, 'n_units_l2': 10, 'n_units_l3': 27, 'n_units_l4': 14, 'n_units_l5': 4, 'n_units_l6': 9, 'n_units_l7': 91, 'n_units_l8': 116, 'n_units_l9': 24, 'n_units_l10': 7, 'n_units_l11': 15, 'n_units_l12': 81, 'n_units_l13': 11, 'n_units_l14': 32, 'n_units_l15': 7, 'optimizer': 'RMSprop', 'rmsprop_learning_rate': 0.020682104042053624, 'rmsprop_weight_decay': 0.9640729029650165, 'rmsprop_momentum': 0.0007134776691253138}. Best is trial 7 with value: 0.7555555701255798.
Trial 76 finished with value: 0.4888889491558075 and parameters: {'n_layers': 21, 'weight_decay': 5.215052724754113e-07, 'n_units_l0': 27, 'n_units_l1': 24, 'n_units_l2': 16, 'n_units_l3': 57, 'n_units_l4': 36, 'n_units_l5': 30, 'n_units_l6': 24, 'n_units_l7': 14, 'n_units_l8': 92, 'n_units_l9': 8, 'n_units_l10': 90, 'n_units_l11': 62, 'n_units_l12': 17, 'n_units_l13': 28, 'n_units_l14': 68, 'n_units_l15': 25, 'n_units_l16': 17, 'n_units_l17': 57, 'n_units_l18': 47, 'n_units_l19': 7, 'n_units_l20': 54, 'optimizer': 'RMSprop', 'rmsprop_learning_rate': 0.004427711112504543, 'rmsprop_weight_decay': 0.9706509593920848, 'rmsprop_momentum': 0.001126034596079169}. Best is trial 7 with value: 0.7555555701255798.
Trial 77 finished with value: 0.6333333849906921 and parameters: {'n_layers': 9, 'weight_decay': 1.4011719338900242e-05, 'n_units_l0': 16, 'n_units_l1': 10, 'n_units_l2': 34, 'n_units_l3': 39, 'n_units_l4': 5, 'n_units_l5': 26, 'n_units_l6': 57, 'n_units_l7': 18, 'n_units_l8': 45, 'optimizer': 'SGD', 'sgd_opt_learning_rate': 0.00012367113956905906, 'sgd_opt_momentum': 0.00011113956047312759}. Best is trial 7 with value: 0.7555555701255798.
Trial 78 finished with value: 0.5888888835906982 and parameters: {'n_layers': 5, 'weight_decay': 2.4025690431797104e-05, 'n_units_l0': 43, 'n_units_l1': 8, 'n_units_l2': 5, 'n_units_l3': 9, 'n_units_l4': 47, 'optimizer': 'RMSprop', 'rmsprop_learning_rate': 0.0011681497139448514, 'rmsprop_weight_decay': 0.9859268995171481, 'rmsprop_momentum': 0.0017389230120326642}. Best is trial 7 with value: 0.7555555701255798.
Trial 79 finished with value: 0.6333333849906921 and parameters: {'n_layers': 10, 'weight_decay': 1.5651621343561711e-06, 'n_units_l0': 19, 'n_units_l1': 99, 'n_units_l2': 12, 'n_units_l3': 7, 'n_units_l4': 33, 'n_units_l5': 18, 'n_units_l6': 28, 'n_units_l7': 32, 'n_units_l8': 70, 'n_units_l9': 57, 'optimizer': 'Adam', 'adam_learning_rate': 0.00023871031462163975}. Best is trial 7 with value: 0.7555555701255798.
Trial 80 finished with value: 0.4333333671092987 and parameters: {'n_layers': 13, 'weight_decay': 0.00016273073771755348, 'n_units_l0': 21, 'n_units_l1': 15, 'n_units_l2': 26, 'n_units_l3': 6, 'n_units_l4': 20, 'n_units_l5': 20, 'n_units_l6': 38, 'n_units_l7': 12, 'n_units_l8': 53, 'n_units_l9': 43, 'n_units_l10': 5, 'n_units_l11': 22, 'n_units_l12': 29, 'optimizer': 'RMSprop', 'rmsprop_learning_rate': 0.00029897182774234643, 'rmsprop_weight_decay': 0.9441783393491263, 'rmsprop_momentum': 0.0004185863847496084}. Best is trial 7 with value: 0.7555555701255798.
Trial 81 finished with value: 0.6111111640930176 and parameters: {'n_layers': 24, 'weight_decay': 1.3549187174069155e-10, 'n_units_l0': 8, 'n_units_l1': 32, 'n_units_l2': 17, 'n_units_l3': 87, 'n_units_l4': 24, 'n_units_l5': 15, 'n_units_l6': 4, 'n_units_l7': 128, 'n_units_l8': 77, 'n_units_l9': 69, 'n_units_l10': 18, 'n_units_l11': 38, 'n_units_l12': 88, 'n_units_l13': 6, 'n_units_l14': 6, 'n_units_l15': 60, 'n_units_l16': 22, 'n_units_l17': 47, 'n_units_l18': 8, 'n_units_l19': 21, 'n_units_l20': 58, 'n_units_l21': 8, 'n_units_l22': 35, 'n_units_l23': 23, 'optimizer': 'RMSprop', 'rmsprop_learning_rate': 0.006857866283179482, 'rmsprop_weight_decay': 0.9566472242801783, 'rmsprop_momentum': 0.00015195138686952407}. Best is trial 7 with value: 0.7555555701255798.
Trial 82 finished with value: 0.4777778089046478 and parameters: {'n_layers': 20, 'weight_decay': 8.664951004001444e-10, 'n_units_l0': 5, 'n_units_l1': 21, 'n_units_l2': 22, 'n_units_l3': 43, 'n_units_l4': 29, 'n_units_l5': 24, 'n_units_l6': 6, 'n_units_l7': 99, 'n_units_l8': 97, 'n_units_l9': 128, 'n_units_l10': 28, 'n_units_l11': 53, 'n_units_l12': 41, 'n_units_l13': 5, 'n_units_l14': 15, 'n_units_l15': 51, 'n_units_l16': 36, 'n_units_l17': 20, 'n_units_l18': 6, 'n_units_l19': 11, 'optimizer': 'RMSprop', 'rmsprop_learning_rate': 0.013154332493988036, 'rmsprop_weight_decay': 0.9391772181786874, 'rmsprop_momentum': 0.000269852445677469}. Best is trial 7 with value: 0.7555555701255798.
Trial 83 finished with value: 0.5555555820465088 and parameters: {'n_layers': 22, 'weight_decay': 3.233220829068072e-10, 'n_units_l0': 31, 'n_units_l1': 28, 'n_units_l2': 20, 'n_units_l3': 58, 'n_units_l4': 26, 'n_units_l5': 22, 'n_units_l6': 43, 'n_units_l7': 78, 'n_units_l8': 68, 'n_units_l9': 104, 'n_units_l10': 15, 'n_units_l11': 33, 'n_units_l12': 54, 'n_units_l13': 11, 'n_units_l14': 7, 'n_units_l15': 16, 'n_units_l16': 7, 'n_units_l17': 34, 'n_units_l18': 15, 'n_units_l19': 29, 'n_units_l20': 11, 'n_units_l21': 35, 'optimizer': 'RMSprop', 'rmsprop_learning_rate': 0.002347618001426607, 'rmsprop_weight_decay': 0.9639377927952493, 'rmsprop_momentum': 0.0009181049989026005}. Best is trial 7 with value: 0.7555555701255798.
