Trial 327 finished with value: 0.6984127163887024 and parameters: {'n_layers': 17, 'weight_decay': 2.1168509467813442e-10, 'n_units_l0': 86, 'n_units_l1': 7, 'n_units_l2': 30, 'n_units_l3': 128, 'n_units_l4': 71, 'n_units_l5': 47, 'n_units_l6': 81, 'n_units_l7': 12, 'n_units_l8': 22, 'n_units_l9': 8, 'n_units_l10': 97, 'n_units_l11': 7, 'n_units_l12': 10, 'n_units_l13': 20, 'n_units_l14': 15, 'n_units_l15': 5, 'n_units_l16': 105, 'optimizer': 'RMSprop', 'rmsprop_learning_rate': 0.061225176171467104, 'rmsprop_weight_decay': 0.9574254765197859, 'rmsprop_momentum': 0.00012692228039219247}. Best is trial 306 with value: 0.761904776096344.
Trial 328 finished with value: 0.523809552192688 and parameters: {'n_layers': 17, 'weight_decay': 1.8650308696887186e-10, 'n_units_l0': 72, 'n_units_l1': 20, 'n_units_l2': 33, 'n_units_l3': 117, 'n_units_l4': 76, 'n_units_l5': 48, 'n_units_l6': 72, 'n_units_l7': 12, 'n_units_l8': 22, 'n_units_l9': 7, 'n_units_l10': 98, 'n_units_l11': 7, 'n_units_l12': 9, 'n_units_l13': 19, 'n_units_l14': 18, 'n_units_l15': 5, 'n_units_l16': 108, 'optimizer': 'RMSprop', 'rmsprop_learning_rate': 0.06526428653576019, 'rmsprop_weight_decay': 0.9874099993724917, 'rmsprop_momentum': 0.00012604742126105673}. Best is trial 306 with value: 0.761904776096344.
Trial 329 finished with value: 0.5714285969734192 and parameters: {'n_layers': 12, 'weight_decay': 2.3190351592951272e-10, 'n_units_l0': 104, 'n_units_l1': 7, 'n_units_l2': 27, 'n_units_l3': 126, 'n_units_l4': 128, 'n_units_l5': 54, 'n_units_l6': 104, 'n_units_l7': 11, 'n_units_l8': 23, 'n_units_l9': 43, 'n_units_l10': 8, 'n_units_l11': 8, 'optimizer': 'RMSprop', 'rmsprop_learning_rate': 0.05734255165822884, 'rmsprop_weight_decay': 0.919269764293198, 'rmsprop_momentum': 0.00018239802279704624}. Best is trial 306 with value: 0.761904776096344.
Trial 330 finished with value: 0.5555555820465088 and parameters: {'n_layers': 18, 'weight_decay': 3.319756153172838e-10, 'n_units_l0': 83, 'n_units_l1': 33, 'n_units_l2': 24, 'n_units_l3': 128, 'n_units_l4': 64, 'n_units_l5': 44, 'n_units_l6': 92, 'n_units_l7': 13, 'n_units_l8': 19, 'n_units_l9': 7, 'n_units_l10': 62, 'n_units_l11': 10, 'n_units_l12': 10, 'n_units_l13': 13, 'n_units_l14': 15, 'n_units_l15': 4, 'n_units_l16': 75, 'n_units_l17': 20, 'optimizer': 'RMSprop', 'rmsprop_learning_rate': 0.049972032824384484, 'rmsprop_weight_decay': 0.9274393866534614, 'rmsprop_momentum': 0.00014859059674297552}. Best is trial 306 with value: 0.761904776096344.
Trial 331 finished with value: 0.5396825671195984 and parameters: {'n_layers': 18, 'weight_decay': 1.6163884285815937e-10, 'n_units_l0': 18, 'n_units_l1': 7, 'n_units_l2': 30, 'n_units_l3': 108, 'n_units_l4': 71, 'n_units_l5': 50, 'n_units_l6': 67, 'n_units_l7': 20, 'n_units_l8': 21, 'n_units_l9': 8, 'n_units_l10': 32, 'n_units_l11': 7, 'n_units_l12': 10, 'n_units_l13': 21, 'n_units_l14': 35, 'n_units_l15': 7, 'n_units_l16': 95, 'n_units_l17': 44, 'optimizer': 'RMSprop', 'rmsprop_learning_rate': 0.06325629708453301, 'rmsprop_weight_decay': 0.9759094124954381, 'rmsprop_momentum': 0.0002345015052922735}. Best is trial 306 with value: 0.761904776096344.
Trial 332 finished with value: 0.523809552192688 and parameters: {'n_layers': 17, 'weight_decay': 8.257598836802708e-09, 'n_units_l0': 122, 'n_units_l1': 8, 'n_units_l2': 29, 'n_units_l3': 94, 'n_units_l4': 61, 'n_units_l5': 39, 'n_units_l6': 86, 'n_units_l7': 21, 'n_units_l8': 25, 'n_units_l9': 8, 'n_units_l10': 11, 'n_units_l11': 13, 'n_units_l12': 28, 'n_units_l13': 20, 'n_units_l14': 12, 'n_units_l15': 6, 'n_units_l16': 58, 'optimizer': 'RMSprop', 'rmsprop_learning_rate': 0.07607919997360212, 'rmsprop_weight_decay': 0.8911588284830885, 'rmsprop_momentum': 2.23450079451123e-05}. Best is trial 306 with value: 0.761904776096344.
Trial 333 finished with value: 0.682539701461792 and parameters: {'n_layers': 7, 'weight_decay': 4.164319865596839e-10, 'n_units_l0': 60, 'n_units_l1': 6, 'n_units_l2': 26, 'n_units_l3': 9, 'n_units_l4': 88, 'n_units_l5': 42, 'n_units_l6': 12, 'optimizer': 'SGD', 'sgd_opt_learning_rate': 0.0023007017845796817, 'sgd_opt_momentum': 0.0013731666124390052}. Best is trial 306 with value: 0.761904776096344.
Trial 334 finished with value: 0.60317462682724 and parameters: {'n_layers': 7, 'weight_decay': 3.9467394517698867e-10, 'n_units_l0': 60, 'n_units_l1': 22, 'n_units_l2': 26, 'n_units_l3': 11, 'n_units_l4': 95, 'n_units_l5': 42, 'n_units_l6': 79, 'optimizer': 'SGD', 'sgd_opt_learning_rate': 0.002234020008404154, 'sgd_opt_momentum': 0.0015260210748767834}. Best is trial 306 with value: 0.761904776096344.
Trial 335 finished with value: 0.5555555820465088 and parameters: {'n_layers': 6, 'weight_decay': 2.638447579758184e-10, 'n_units_l0': 66, 'n_units_l1': 6, 'n_units_l2': 27, 'n_units_l3': 115, 'n_units_l4': 104, 'n_units_l5': 46, 'optimizer': 'SGD', 'sgd_opt_learning_rate': 0.0064874961767411934, 'sgd_opt_momentum': 0.004078103964929896}. Best is trial 306 with value: 0.761904776096344.
Trial 336 finished with value: 0.6349206566810608 and parameters: {'n_layers': 18, 'weight_decay': 2.1482524262014434e-10, 'n_units_l0': 50, 'n_units_l1': 6, 'n_units_l2': 23, 'n_units_l3': 9, 'n_units_l4': 91, 'n_units_l5': 40, 'n_units_l6': 77, 'n_units_l7': 14, 'n_units_l8': 28, 'n_units_l9': 13, 'n_units_l10': 17, 'n_units_l11': 10, 'n_units_l12': 24, 'n_units_l13': 16, 'n_units_l14': 14, 'n_units_l15': 8, 'n_units_l16': 6, 'n_units_l17': 113, 'optimizer': 'SGD', 'sgd_opt_learning_rate': 0.001058711838532683, 'sgd_opt_momentum': 0.0012012288184049629}. Best is trial 306 with value: 0.761904776096344.
Trial 337 finished with value: 0.6190476417541504 and parameters: {'n_layers': 17, 'weight_decay': 1.289941015113435e-06, 'n_units_l0': 58, 'n_units_l1': 30, 'n_units_l2': 13, 'n_units_l3': 105, 'n_units_l4': 100, 'n_units_l5': 38, 'n_units_l6': 87, 'n_units_l7': 11, 'n_units_l8': 15, 'n_units_l9': 9, 'n_units_l10': 76, 'n_units_l11': 9, 'n_units_l12': 42, 'n_units_l13': 18, 'n_units_l14': 13, 'n_units_l15': 6, 'n_units_l16': 51, 'optimizer': 'SGD', 'sgd_opt_learning_rate': 0.002966165201194899, 'sgd_opt_momentum': 0.000629184169550038}. Best is trial 306 with value: 0.761904776096344.
Trial 338 finished with value: 0.5714285969734192 and parameters: {'n_layers': 7, 'weight_decay': 4.117858575253905e-10, 'n_units_l0': 55, 'n_units_l1': 6, 'n_units_l2': 31, 'n_units_l3': 10, 'n_units_l4': 82, 'n_units_l5': 44, 'n_units_l6': 12, 'optimizer': 'SGD', 'sgd_opt_learning_rate': 0.020677480733153064, 'sgd_opt_momentum': 3.6144247580248076e-05}. Best is trial 306 with value: 0.761904776096344.
Trial 339 finished with value: 0.5714285969734192 and parameters: {'n_layers': 17, 'weight_decay': 1.409845702645843e-10, 'n_units_l0': 61, 'n_units_l1': 7, 'n_units_l2': 25, 'n_units_l3': 119, 'n_units_l4': 110, 'n_units_l5': 58, 'n_units_l6': 66, 'n_units_l7': 12, 'n_units_l8': 31, 'n_units_l9': 12, 'n_units_l10': 27, 'n_units_l11': 8, 'n_units_l12': 50, 'n_units_l13': 11, 'n_units_l14': 20, 'n_units_l15': 7, 'n_units_l16': 11, 'optimizer': 'SGD', 'sgd_opt_learning_rate': 0.0005037785595620046, 'sgd_opt_momentum': 0.0002549434767587483}. Best is trial 306 with value: 0.761904776096344.
Trial 340 finished with value: 0.6349206566810608 and parameters: {'n_layers': 3, 'weight_decay': 3.109265373279432e-10, 'n_units_l0': 66, 'n_units_l1': 26, 'n_units_l2': 34, 'optimizer': 'Adam', 'adam_learning_rate': 0.0015686400531778031}. Best is trial 306 with value: 0.761904776096344.
Trial 341 finished with value: 0.5396825671195984 and parameters: {'n_layers': 5, 'weight_decay': 0.0001670536646397, 'n_units_l0': 25, 'n_units_l1': 28, 'n_units_l2': 29, 'n_units_l3': 6, 'n_units_l4': 5, 'optimizer': 'SGD', 'sgd_opt_learning_rate': 0.050105825689592765, 'sgd_opt_momentum': 5.088811053937332e-05}. Best is trial 306 with value: 0.761904776096344.
Trial 342 finished with value: 0.6666666865348816 and parameters: {'n_layers': 4, 'weight_decay': 5.446484052686612e-10, 'n_units_l0': 53, 'n_units_l1': 5, 'n_units_l2': 96, 'n_units_l3': 7, 'optimizer': 'RMSprop', 'rmsprop_learning_rate': 0.03610947930693174, 'rmsprop_weight_decay': 0.9895271216894962, 'rmsprop_momentum': 0.0025849856450317447}. Best is trial 306 with value: 0.761904776096344.
Trial 343 finished with value: 0.6507936716079712 and parameters: {'n_layers': 2, 'weight_decay': 1.8072520235116168e-10, 'n_units_l0': 71, 'n_units_l1': 34, 'optimizer': 'RMSprop', 'rmsprop_learning_rate': 9.021921327404403e-05, 'rmsprop_weight_decay': 0.9583378768289617, 'rmsprop_momentum': 0.0003210744116078361}. Best is trial 306 with value: 0.761904776096344.
Trial 344 finished with value: 0.5714285969734192 and parameters: {'n_layers': 15, 'weight_decay': 2.461178539124888e-10, 'n_units_l0': 76, 'n_units_l1': 24, 'n_units_l2': 20, 'n_units_l3': 9, 'n_units_l4': 70, 'n_units_l5': 48, 'n_units_l6': 46, 'n_units_l7': 17, 'n_units_l8': 11, 'n_units_l9': 33, 'n_units_l10': 109, 'n_units_l11': 11, 'n_units_l12': 5, 'n_units_l13': 42, 'n_units_l14': 15, 'optimizer': 'RMSprop', 'rmsprop_learning_rate': 4.7609204795022016e-05, 'rmsprop_weight_decay': 0.9627370931910217, 'rmsprop_momentum': 0.00019242121295772458}. Best is trial 306 with value: 0.761904776096344.
Trial 345 finished with value: 0.5714285969734192 and parameters: {'n_layers': 16, 'weight_decay': 1.2455436498919858e-10, 'n_units_l0': 64, 'n_units_l1': 8, 'n_units_l2': 25, 'n_units_l3': 11, 'n_units_l4': 88, 'n_units_l5': 35, 'n_units_l6': 38, 'n_units_l7': 41, 'n_units_l8': 18, 'n_units_l9': 10, 'n_units_l10': 24, 'n_units_l11': 9, 'n_units_l12': 55, 'n_units_l13': 6, 'n_units_l14': 17, 'n_units_l15': 5, 'optimizer': 'RMSprop', 'rmsprop_learning_rate': 0.01216881349680699, 'rmsprop_weight_decay': 0.9840799793829262, 'rmsprop_momentum': 0.00011452047807839921}. Best is trial 306 with value: 0.761904776096344.
Trial 346 finished with value: 0.5555555820465088 and parameters: {'n_layers': 5, 'weight_decay': 5.9616290502758676e-06, 'n_units_l0': 101, 'n_units_l1': 5, 'n_units_l2': 111, 'n_units_l3': 103, 'n_units_l4': 74, 'optimizer': 'SGD', 'sgd_opt_learning_rate': 0.008041292177086542, 'sgd_opt_momentum': 0.01795027076522971}. Best is trial 306 with value: 0.761904776096344.
Trial 347 finished with value: 0.4920634925365448 and parameters: {'n_layers': 5, 'weight_decay': 3.65333083535355e-10, 'n_units_l0': 60, 'n_units_l1': 30, 'n_units_l2': 22, 'n_units_l3': 113, 'n_units_l4': 5, 'optimizer': 'RMSprop', 'rmsprop_learning_rate': 0.029335154357329626, 'rmsprop_weight_decay': 0.9850013359238059, 'rmsprop_momentum': 0.0014175077652122396}. Best is trial 306 with value: 0.761904776096344.
Trial 348 finished with value: 0.60317462682724 and parameters: {'n_layers': 16, 'weight_decay': 1.0145623712328013e-10, 'n_units_l0': 110, 'n_units_l1': 51, 'n_units_l2': 27, 'n_units_l3': 85, 'n_units_l4': 4, 'n_units_l5': 52, 'n_units_l6': 83, 'n_units_l7': 16, 'n_units_l8': 20, 'n_units_l9': 5, 'n_units_l10': 81, 'n_units_l11': 8, 'n_units_l12': 61, 'n_units_l13': 9, 'n_units_l14': 29, 'n_units_l15': 4, 'optimizer': 'RMSprop', 'rmsprop_learning_rate': 0.04247518666108213, 'rmsprop_weight_decay': 0.9899687345680538, 'rmsprop_momentum': 0.00013568927456504332}. Best is trial 306 with value: 0.761904776096344.
Trial 349 finished with value: 0.4761904776096344 and parameters: {'n_layers': 19, 'weight_decay': 1.6196767275772434e-10, 'n_units_l0': 79, 'n_units_l1': 9, 'n_units_l2': 31, 'n_units_l3': 16, 'n_units_l4': 9, 'n_units_l5': 41, 'n_units_l6': 64, 'n_units_l7': 34, 'n_units_l8': 36, 'n_units_l9': 10, 'n_units_l10': 67, 'n_units_l11': 10, 'n_units_l12': 11, 'n_units_l13': 5, 'n_units_l14': 51, 'n_units_l15': 6, 'n_units_l16': 67, 'n_units_l17': 6, 'n_units_l18': 10, 'optimizer': 'RMSprop', 'rmsprop_learning_rate': 0.0001246738831039415, 'rmsprop_weight_decay': 0.9618318644704182, 'rmsprop_momentum': 0.0002166094394585702}. Best is trial 306 with value: 0.761904776096344.
Trial 350 finished with value: 0.5714285969734192 and parameters: {'n_layers': 17, 'weight_decay': 6.177485912596944e-10, 'n_units_l0': 70, 'n_units_l1': 32, 'n_units_l2': 121, 'n_units_l3': 127, 'n_units_l4': 13, 'n_units_l5': 46, 'n_units_l6': 98, 'n_units_l7': 37, 'n_units_l8': 16, 'n_units_l9': 8, 'n_units_l10': 19, 'n_units_l11': 12, 'n_units_l12': 73, 'n_units_l13': 8, 'n_units_l14': 10, 'n_units_l15': 8, 'n_units_l16': 114, 'optimizer': 'RMSprop', 'rmsprop_learning_rate': 0.008527062126024198, 'rmsprop_weight_decay': 0.9650789049862311, 'rmsprop_momentum': 0.00026865327539071093}. Best is trial 306 with value: 0.761904776096344.
Trial 351 finished with value: 0.5555555820465088 and parameters: {'n_layers': 16, 'weight_decay': 1.962491775627042e-06, 'n_units_l0': 55, 'n_units_l1': 61, 'n_units_l2': 89, 'n_units_l3': 93, 'n_units_l4': 8, 'n_units_l5': 33, 'n_units_l6': 12, 'n_units_l7': 19, 'n_units_l8': 21, 'n_units_l9': 28, 'n_units_l10': 103, 'n_units_l11': 8, 'n_units_l12': 19, 'n_units_l13': 31, 'n_units_l14': 15, 'n_units_l15': 9, 'optimizer': 'RMSprop', 'rmsprop_learning_rate': 0.08692097021714981, 'rmsprop_weight_decay': 0.9597157807368824, 'rmsprop_momentum': 0.00016746172281898158}. Best is trial 306 with value: 0.761904776096344.
Trial 352 finished with value: 0.6349206566810608 and parameters: {'n_layers': 15, 'weight_decay': 2.5990547181085213e-10, 'n_units_l0': 51, 'n_units_l1': 27, 'n_units_l2': 28, 'n_units_l3': 112, 'n_units_l4': 66, 'n_units_l5': 49, 'n_units_l6': 8, 'n_units_l7': 13, 'n_units_l8': 19, 'n_units_l9': 11, 'n_units_l10': 54, 'n_units_l11': 7, 'n_units_l12': 40, 'n_units_l13': 36, 'n_units_l14': 56, 'optimizer': 'RMSprop', 'rmsprop_learning_rate': 0.01472681380531309, 'rmsprop_weight_decay': 0.8720884225976991, 'rmsprop_momentum': 0.0022779058511152744}. Best is trial 306 with value: 0.761904776096344.
Trial 353 finished with value: 0.523809552192688 and parameters: {'n_layers': 17, 'weight_decay': 4.133388412936595e-10, 'n_units_l0': 128, 'n_units_l1': 7, 'n_units_l2': 83, 'n_units_l3': 18, 'n_units_l4': 21, 'n_units_l5': 37, 'n_units_l6': 11, 'n_units_l7': 29, 'n_units_l8': 22, 'n_units_l9': 7, 'n_units_l10': 59, 'n_units_l11': 12, 'n_units_l12': 33, 'n_units_l13': 7, 'n_units_l14': 24, 'n_units_l15': 5, 'n_units_l16': 41, 'optimizer': 'RMSprop', 'rmsprop_learning_rate': 0.022960657233280588, 'rmsprop_weight_decay': 0.9831451816493457, 'rmsprop_momentum': 0.00011024003302330298}. Best is trial 306 with value: 0.761904776096344.
Trial 354 finished with value: 0.60317462682724 and parameters: {'n_layers': 18, 'weight_decay': 2.0459349166663413e-10, 'n_units_l0': 85, 'n_units_l1': 30, 'n_units_l2': 97, 'n_units_l3': 121, 'n_units_l4': 87, 'n_units_l5': 43, 'n_units_l6': 4, 'n_units_l7': 14, 'n_units_l8': 29, 'n_units_l9': 9, 'n_units_l10': 95, 'n_units_l11': 11, 'n_units_l12': 30, 'n_units_l13': 12, 'n_units_l14': 94, 'n_units_l15': 62, 'n_units_l16': 5, 'n_units_l17': 25, 'optimizer': 'Adam', 'adam_learning_rate': 0.00020654164434257376}. Best is trial 306 with value: 0.761904776096344.
Trial 355 finished with value: 0.60317462682724 and parameters: {'n_layers': 16, 'weight_decay': 1.5460714490178993e-10, 'n_units_l0': 75, 'n_units_l1': 34, 'n_units_l2': 24, 'n_units_l3': 102, 'n_units_l4': 97, 'n_units_l5': 56, 'n_units_l6': 123, 'n_units_l7': 31, 'n_units_l8': 23, 'n_units_l9': 9, 'n_units_l10': 82, 'n_units_l11': 9, 'n_units_l12': 26, 'n_units_l13': 17, 'n_units_l14': 79, 'n_units_l15': 7, 'optimizer': 'RMSprop', 'rmsprop_learning_rate': 0.07916057387886402, 'rmsprop_weight_decay': 0.9566243279728535, 'rmsprop_momentum': 0.00036527086586975264}. Best is trial 306 with value: 0.761904776096344.
Trial 356 finished with value: 0.5555555820465088 and parameters: {'n_layers': 8, 'weight_decay': 7.016624314657504e-08, 'n_units_l0': 20, 'n_units_l1': 6, 'n_units_l2': 92, 'n_units_l3': 14, 'n_units_l4': 55, 'n_units_l5': 62, 'n_units_l6': 19, 'n_units_l7': 27, 'optimizer': 'RMSprop', 'rmsprop_learning_rate': 0.05371533434928206, 'rmsprop_weight_decay': 0.9876245843459643, 'rmsprop_momentum': 0.0016308648449176605}. Best is trial 306 with value: 0.761904776096344.
Trial 357 finished with value: 0.5873016119003296 and parameters: {'n_layers': 15, 'weight_decay': 0.0003056518064833221, 'n_units_l0': 96, 'n_units_l1': 9, 'n_units_l2': 14, 'n_units_l3': 128, 'n_units_l4': 60, 'n_units_l5': 40, 'n_units_l6': 9, 'n_units_l7': 21, 'n_units_l8': 33, 'n_units_l9': 8, 'n_units_l10': 37, 'n_units_l11': 13, 'n_units_l12': 15, 'n_units_l13': 19, 'n_units_l14': 46, 'optimizer': 'SGD', 'sgd_opt_learning_rate': 0.00179379362464169, 'sgd_opt_momentum': 2.113546515020335e-05}. Best is trial 306 with value: 0.761904776096344.
Trial 358 finished with value: 0.6349206566810608 and parameters: {'n_layers': 17, 'weight_decay': 2.596907965891955e-10, 'n_units_l0': 63, 'n_units_l1': 25, 'n_units_l2': 12, 'n_units_l3': 8, 'n_units_l4': 47, 'n_units_l5': 29, 'n_units_l6': 13, 'n_units_l7': 17, 'n_units_l8': 17, 'n_units_l9': 7, 'n_units_l10': 70, 'n_units_l11': 7, 'n_units_l12': 4, 'n_units_l13': 39, 'n_units_l14': 70, 'n_units_l15': 10, 'n_units_l16': 92, 'optimizer': 'RMSprop', 'rmsprop_learning_rate': 0.098837487581726, 'rmsprop_weight_decay': 0.969773062823985, 'rmsprop_momentum': 0.0019664200490690617}. Best is trial 306 with value: 0.761904776096344.
Trial 359 finished with value: 0.5714285969734192 and parameters: {'n_layers': 16, 'weight_decay': 4.879311761103087e-10, 'n_units_l0': 114, 'n_units_l1': 12, 'n_units_l2': 7, 'n_units_l3': 110, 'n_units_l4': 6, 'n_units_l5': 52, 'n_units_l6': 10, 'n_units_l7': 18, 'n_units_l8': 26, 'n_units_l9': 25, 'n_units_l10': 45, 'n_units_l11': 10, 'n_units_l12': 37, 'n_units_l13': 6, 'n_units_l14': 13, 'n_units_l15': 6, 'optimizer': 'RMSprop', 'rmsprop_learning_rate': 0.06939662096772045, 'rmsprop_weight_decay': 0.9861998443866642, 'rmsprop_momentum': 1.2316663822805371e-05}. Best is trial 306 with value: 0.761904776096344.
Trial 360 finished with value: 0.5873016119003296 and parameters: {'n_layers': 15, 'weight_decay': 3.2920178592548886e-10, 'n_units_l0': 68, 'n_units_l1': 28, 'n_units_l2': 107, 'n_units_l3': 100, 'n_units_l4': 12, 'n_units_l5': 37, 'n_units_l6': 11, 'n_units_l7': 12, 'n_units_l8': 13, 'n_units_l9': 6, 'n_units_l10': 14, 'n_units_l11': 4, 'n_units_l12': 7, 'n_units_l13': 21, 'n_units_l14': 31, 'optimizer': 'RMSprop', 'rmsprop_learning_rate': 0.0455229999266956, 'rmsprop_weight_decay': 0.9349713083405321, 'rmsprop_momentum': 0.00010093524078016728}. Best is trial 306 with value: 0.761904776096344.
Trial 361 finished with value: 0.5714285969734192 and parameters: {'n_layers': 14, 'weight_decay': 1.3310446027546926e-10, 'n_units_l0': 93, 'n_units_l1': 4, 'n_units_l2': 31, 'n_units_l3': 119, 'n_units_l4': 8, 'n_units_l5': 46, 'n_units_l6': 21, 'n_units_l7': 10, 'n_units_l8': 19, 'n_units_l9': 10, 'n_units_l10': 29, 'n_units_l11': 8, 'n_units_l12': 11, 'n_units_l13': 14, 'optimizer': 'RMSprop', 'rmsprop_learning_rate': 0.015800708680512757, 'rmsprop_weight_decay': 0.9812029305603628, 'rmsprop_momentum': 1.676476169941231e-05}. Best is trial 306 with value: 0.761904776096344.
Trial 362 finished with value: 0.6984127163887024 and parameters: {'n_layers': 17, 'weight_decay': 1.0052298176407433e-10, 'n_units_l0': 58, 'n_units_l1': 14, 'n_units_l2': 36, 'n_units_l3': 107, 'n_units_l4': 14, 'n_units_l5': 50, 'n_units_l6': 12, 'n_units_l7': 15, 'n_units_l8': 20, 'n_units_l9': 8, 'n_units_l10': 100, 'n_units_l11': 12, 'n_units_l12': 9, 'n_units_l13': 10, 'n_units_l14': 58, 'n_units_l15': 107, 'n_units_l16': 10, 'optimizer': 'RMSprop', 'rmsprop_learning_rate': 0.01087931860083148, 'rmsprop_weight_decay': 0.9664654874395174, 'rmsprop_momentum': 0.0029222128770939057}. Best is trial 306 with value: 0.761904776096344.
Trial 363 finished with value: 0.6190476417541504 and parameters: {'n_layers': 18, 'weight_decay': 6.483107074302582e-10, 'n_units_l0': 56, 'n_units_l1': 15, 'n_units_l2': 39, 'n_units_l3': 113, 'n_units_l4': 16, 'n_units_l5': 42, 'n_units_l6': 12, 'n_units_l7': 14, 'n_units_l8': 24, 'n_units_l9': 8, 'n_units_l10': 103, 'n_units_l11': 12, 'n_units_l12': 8, 'n_units_l13': 35, 'n_units_l14': 18, 'n_units_l15': 126, 'n_units_l16': 10, 'n_units_l17': 15, 'optimizer': 'RMSprop', 'rmsprop_learning_rate': 0.08262335828582838, 'rmsprop_weight_decay': 0.9677136741005026, 'rmsprop_momentum': 0.004539539501103718}. Best is trial 306 with value: 0.761904776096344.
Trial 364 finished with value: 0.6507936716079712 and parameters: {'n_layers': 17, 'weight_decay': 1.0774152355482851e-10, 'n_units_l0': 13, 'n_units_l1': 13, 'n_units_l2': 36, 'n_units_l3': 121, 'n_units_l4': 59, 'n_units_l5': 14, 'n_units_l6': 13, 'n_units_l7': 15, 'n_units_l8': 27, 'n_units_l9': 8, 'n_units_l10': 115, 'n_units_l11': 13, 'n_units_l12': 10, 'n_units_l13': 10, 'n_units_l14': 5, 'n_units_l15': 94, 'n_units_l16': 9, 'optimizer': 'RMSprop', 'rmsprop_learning_rate': 0.03867557295416859, 'rmsprop_weight_decay': 0.9642801859867912, 'rmsprop_momentum': 0.06414343095832327}. Best is trial 306 with value: 0.761904776096344.
Trial 365 finished with value: 0.5079365372657776 and parameters: {'n_layers': 18, 'weight_decay': 6.748776924451914e-05, 'n_units_l0': 50, 'n_units_l1': 14, 'n_units_l2': 31, 'n_units_l3': 107, 'n_units_l4': 52, 'n_units_l5': 44, 'n_units_l6': 12, 'n_units_l7': 15, 'n_units_l8': 22, 'n_units_l9': 9, 'n_units_l10': 62, 'n_units_l11': 11, 'n_units_l12': 9, 'n_units_l13': 8, 'n_units_l14': 52, 'n_units_l15': 80, 'n_units_l16': 13, 'n_units_l17': 33, 'optimizer': 'RMSprop', 'rmsprop_learning_rate': 0.011669822784098519, 'rmsprop_weight_decay': 0.966926089460723, 'rmsprop_momentum': 0.0035149692082553914}. Best is trial 306 with value: 0.761904776096344.
