Trial 38 finished with value: 0.523809552192688 and parameters: {'n_layers': 18, 'weight_decay': 0.0004837159887992376, 'n_units_l0': 40, 'n_units_l1': 7, 'n_units_l2': 13, 'n_units_l3': 67, 'n_units_l4': 6, 'n_units_l5': 19, 'n_units_l6': 18, 'n_units_l7': 16, 'n_units_l8': 24, 'n_units_l9': 14, 'n_units_l10': 29, 'n_units_l11': 11, 'n_units_l12': 15, 'n_units_l13': 32, 'n_units_l14': 42, 'n_units_l15': 29, 'n_units_l16': 13, 'n_units_l17': 38, 'optimizer': 'RMSprop', 'rmsprop_learning_rate': 0.00524513314651631, 'rmsprop_weight_decay': 0.9307838391804182, 'rmsprop_momentum': 0.00045026646726660047}. Best is trial 12 with value: 0.682539701461792.
Trial 39 finished with value: 0.5873016119003296 and parameters: {'n_layers': 22, 'weight_decay': 6.538198707385897e-08, 'n_units_l0': 29, 'n_units_l1': 14, 'n_units_l2': 19, 'n_units_l3': 20, 'n_units_l4': 50, 'n_units_l5': 29, 'n_units_l6': 25, 'n_units_l7': 4, 'n_units_l8': 34, 'n_units_l9': 52, 'n_units_l10': 123, 'n_units_l11': 8, 'n_units_l12': 32, 'n_units_l13': 78, 'n_units_l14': 80, 'n_units_l15': 10, 'n_units_l16': 6, 'n_units_l17': 16, 'n_units_l18': 59, 'n_units_l19': 11, 'n_units_l20': 6, 'n_units_l21': 118, 'optimizer': 'SGD', 'sgd_opt_learning_rate': 0.03574627544531141, 'sgd_opt_momentum': 0.08225737639619687}. Best is trial 12 with value: 0.682539701461792.
Trial 40 finished with value: 0.5873016119003296 and parameters: {'n_layers': 24, 'weight_decay': 1.219737896966023e-05, 'n_units_l0': 46, 'n_units_l1': 24, 'n_units_l2': 9, 'n_units_l3': 44, 'n_units_l4': 5, 'n_units_l5': 5, 'n_units_l6': 12, 'n_units_l7': 5, 'n_units_l8': 19, 'n_units_l9': 38, 'n_units_l10': 46, 'n_units_l11': 23, 'n_units_l12': 4, 'n_units_l13': 11, 'n_units_l14': 18, 'n_units_l15': 5, 'n_units_l16': 31, 'n_units_l17': 127, 'n_units_l18': 11, 'n_units_l19': 32, 'n_units_l20': 126, 'n_units_l21': 39, 'n_units_l22': 126, 'n_units_l23': 122, 'optimizer': 'RMSprop', 'rmsprop_learning_rate': 0.0012085692067401426, 'rmsprop_weight_decay': 0.9613956849582428, 'rmsprop_momentum': 0.0022459076273217134}. Best is trial 12 with value: 0.682539701461792.
Trial 41 finished with value: 0.5714285969734192 and parameters: {'n_layers': 1, 'weight_decay': 2.0233163507407294e-08, 'n_units_l0': 26, 'optimizer': 'RMSprop', 'rmsprop_learning_rate': 0.035419309640347695, 'rmsprop_weight_decay': 0.9677728233077959, 'rmsprop_momentum': 5.66721933334692e-05}. Best is trial 12 with value: 0.682539701461792.
Trial 42 finished with value: 0.6349206566810608 and parameters: {'n_layers': 6, 'weight_decay': 8.769932184220084e-09, 'n_units_l0': 22, 'n_units_l1': 20, 'n_units_l2': 6, 'n_units_l3': 10, 'n_units_l4': 7, 'n_units_l5': 16, 'optimizer': 'RMSprop', 'rmsprop_learning_rate': 0.031505979580917734, 'rmsprop_weight_decay': 0.9506932322887853, 'rmsprop_momentum': 2.661846399075064e-05}. Best is trial 12 with value: 0.682539701461792.
Trial 43 finished with value: 0.60317462682724 and parameters: {'n_layers': 6, 'weight_decay': 1.7920714120015807e-08, 'n_units_l0': 32, 'n_units_l1': 18, 'n_units_l2': 6, 'n_units_l3': 5, 'n_units_l4': 90, 'n_units_l5': 16, 'optimizer': 'RMSprop', 'rmsprop_learning_rate': 0.009121768126127295, 'rmsprop_weight_decay': 0.9797350418844974, 'rmsprop_momentum': 0.00011630465718255489}. Best is trial 12 with value: 0.682539701461792.
Trial 44 finished with value: 0.5396825671195984 and parameters: {'n_layers': 13, 'weight_decay': 2.4307434667555036e-06, 'n_units_l0': 12, 'n_units_l1': 9, 'n_units_l2': 5, 'n_units_l3': 7, 'n_units_l4': 6, 'n_units_l5': 10, 'n_units_l6': 10, 'n_units_l7': 66, 'n_units_l8': 10, 'n_units_l9': 18, 'n_units_l10': 38, 'n_units_l11': 36, 'n_units_l12': 11, 'optimizer': 'SGD', 'sgd_opt_learning_rate': 0.004565866294707403, 'sgd_opt_momentum': 0.06334782072538131}. Best is trial 12 with value: 0.682539701461792.
Trial 45 finished with value: 0.5396825671195984 and parameters: {'n_layers': 11, 'weight_decay': 1.7800226075101202e-07, 'n_units_l0': 15, 'n_units_l1': 53, 'n_units_l2': 4, 'n_units_l3': 15, 'n_units_l4': 14, 'n_units_l5': 43, 'n_units_l6': 13, 'n_units_l7': 13, 'n_units_l8': 15, 'n_units_l9': 24, 'n_units_l10': 81, 'optimizer': 'Adam', 'adam_learning_rate': 0.09627324025382175}. Best is trial 12 with value: 0.682539701461792.
Trial 46 finished with value: 0.5555555820465088 and parameters: {'n_layers': 16, 'weight_decay': 5.323655720865828e-09, 'n_units_l0': 56, 'n_units_l1': 23, 'n_units_l2': 8, 'n_units_l3': 24, 'n_units_l4': 26, 'n_units_l5': 7, 'n_units_l6': 7, 'n_units_l7': 7, 'n_units_l8': 47, 'n_units_l9': 32, 'n_units_l10': 18, 'n_units_l11': 17, 'n_units_l12': 7, 'n_units_l13': 17, 'n_units_l14': 32, 'n_units_l15': 38, 'optimizer': 'RMSprop', 'rmsprop_learning_rate': 0.0293917690172518, 'rmsprop_weight_decay': 0.9668818185482249, 'rmsprop_momentum': 0.0006477341387024241}. Best is trial 12 with value: 0.682539701461792.
Trial 47 finished with value: 0.6984127163887024 and parameters: {'n_layers': 17, 'weight_decay': 2.585748334003727e-10, 'n_units_l0': 19, 'n_units_l1': 10, 'n_units_l2': 5, 'n_units_l3': 115, 'n_units_l4': 5, 'n_units_l5': 35, 'n_units_l6': 10, 'n_units_l7': 27, 'n_units_l8': 6, 'n_units_l9': 13, 'n_units_l10': 12, 'n_units_l11': 7, 'n_units_l12': 5, 'n_units_l13': 26, 'n_units_l14': 47, 'n_units_l15': 82, 'n_units_l16': 14, 'optimizer': 'RMSprop', 'rmsprop_learning_rate': 0.09994020946403993, 'rmsprop_weight_decay': 0.9898120109157271, 'rmsprop_momentum': 0.00024407436904836586}. Best is trial 47 with value: 0.6984127163887024.
Trial 48 finished with value: 0.5714285969734192 and parameters: {'n_layers': 17, 'weight_decay': 2.5726809412869905e-10, 'n_units_l0': 19, 'n_units_l1': 10, 'n_units_l2': 5, 'n_units_l3': 107, 'n_units_l4': 5, 'n_units_l5': 73, 'n_units_l6': 57, 'n_units_l7': 40, 'n_units_l8': 5, 'n_units_l9': 12, 'n_units_l10': 10, 'n_units_l11': 7, 'n_units_l12': 5, 'n_units_l13': 27, 'n_units_l14': 50, 'n_units_l15': 86, 'n_units_l16': 15, 'optimizer': 'SGD', 'sgd_opt_learning_rate': 0.0004734135090972775, 'sgd_opt_momentum': 0.006214588635075237}. Best is trial 47 with value: 0.6984127163887024.
Trial 49 finished with value: 0.5714285969734192 and parameters: {'n_layers': 19, 'weight_decay': 2.2143165442010794e-10, 'n_units_l0': 91, 'n_units_l1': 5, 'n_units_l2': 4, 'n_units_l3': 128, 'n_units_l4': 4, 'n_units_l5': 36, 'n_units_l6': 6, 'n_units_l7': 25, 'n_units_l8': 4, 'n_units_l9': 16, 'n_units_l10': 13, 'n_units_l11': 5, 'n_units_l12': 4, 'n_units_l13': 41, 'n_units_l14': 28, 'n_units_l15': 75, 'n_units_l16': 5, 'n_units_l17': 6, 'n_units_l18': 68, 'optimizer': 'Adam', 'adam_learning_rate': 0.004796681774009402}. Best is trial 47 with value: 0.6984127163887024.
Trial 50 finished with value: 0.682539701461792 and parameters: {'n_layers': 14, 'weight_decay': 9.846640899686778e-10, 'n_units_l0': 73, 'n_units_l1': 8, 'n_units_l2': 26, 'n_units_l3': 86, 'n_units_l4': 8, 'n_units_l5': 52, 'n_units_l6': 4, 'n_units_l7': 31, 'n_units_l8': 8, 'n_units_l9': 8, 'n_units_l10': 6, 'n_units_l11': 9, 'n_units_l12': 6, 'n_units_l13': 20, 'optimizer': 'RMSprop', 'rmsprop_learning_rate': 0.07859281147432072, 'rmsprop_weight_decay': 0.9893059265078636, 'rmsprop_momentum': 0.00028293930792959654}. Best is trial 47 with value: 0.6984127163887024.
Trial 51 finished with value: 0.5714285969734192 and parameters: {'n_layers': 14, 'weight_decay': 9.39961735043992e-10, 'n_units_l0': 70, 'n_units_l1': 8, 'n_units_l2': 27, 'n_units_l3': 89, 'n_units_l4': 9, 'n_units_l5': 51, 'n_units_l6': 4, 'n_units_l7': 30, 'n_units_l8': 8, 'n_units_l9': 7, 'n_units_l10': 7, 'n_units_l11': 9, 'n_units_l12': 6, 'n_units_l13': 25, 'optimizer': 'RMSprop', 'rmsprop_learning_rate': 0.08924254244734442, 'rmsprop_weight_decay': 0.9890499179574395, 'rmsprop_momentum': 0.0002158540019982566}. Best is trial 47 with value: 0.6984127163887024.
Trial 52 finished with value: 0.5555555820465088 and parameters: {'n_layers': 16, 'weight_decay': 1.112219521986286e-10, 'n_units_l0': 114, 'n_units_l1': 13, 'n_units_l2': 44, 'n_units_l3': 113, 'n_units_l4': 7, 'n_units_l5': 68, 'n_units_l6': 5, 'n_units_l7': 20, 'n_units_l8': 6, 'n_units_l9': 9, 'n_units_l10': 5, 'n_units_l11': 11, 'n_units_l12': 5, 'n_units_l13': 19, 'n_units_l14': 44, 'n_units_l15': 55, 'optimizer': 'RMSprop', 'rmsprop_learning_rate': 0.0469326788447086, 'rmsprop_weight_decay': 0.9817957619490353, 'rmsprop_momentum': 0.0003603973766605011}. Best is trial 47 with value: 0.6984127163887024.
Trial 53 finished with value: 0.523809552192688 and parameters: {'n_layers': 15, 'weight_decay': 1.5023023782755397e-09, 'n_units_l0': 74, 'n_units_l1': 6, 'n_units_l2': 23, 'n_units_l3': 76, 'n_units_l4': 8, 'n_units_l5': 52, 'n_units_l6': 7, 'n_units_l7': 50, 'n_units_l8': 20, 'n_units_l9': 12, 'n_units_l10': 8, 'n_units_l11': 15, 'n_units_l12': 7, 'n_units_l13': 6, 'n_units_l14': 17, 'optimizer': 'RMSprop', 'rmsprop_learning_rate': 0.08450054262177135, 'rmsprop_weight_decay': 0.9889142568125937, 'rmsprop_momentum': 0.0010405343664402138}. Best is trial 47 with value: 0.6984127163887024.
Trial 54 finished with value: 0.5873016119003296 and parameters: {'n_layers': 18, 'weight_decay': 4.834871181021241e-10, 'n_units_l0': 58, 'n_units_l1': 5, 'n_units_l2': 15, 'n_units_l3': 92, 'n_units_l4': 18, 'n_units_l5': 39, 'n_units_l6': 29, 'n_units_l7': 33, 'n_units_l8': 5, 'n_units_l9': 10, 'n_units_l10': 27, 'n_units_l11': 8, 'n_units_l12': 4, 'n_units_l13': 35, 'n_units_l14': 83, 'n_units_l15': 103, 'n_units_l16': 10, 'n_units_l17': 15, 'optimizer': 'RMSprop', 'rmsprop_learning_rate': 0.0003748830553969166, 'rmsprop_weight_decay': 0.8594330006891171, 'rmsprop_momentum': 1.473052723877609e-05}. Best is trial 47 with value: 0.6984127163887024.
Trial 55 finished with value: 0.60317462682724 and parameters: {'n_layers': 12, 'weight_decay': 4.392315660056692e-09, 'n_units_l0': 4, 'n_units_l1': 8, 'n_units_l2': 67, 'n_units_l3': 63, 'n_units_l4': 12, 'n_units_l5': 26, 'n_units_l6': 22, 'n_units_l7': 25, 'n_units_l8': 10, 'n_units_l9': 23, 'n_units_l10': 21, 'n_units_l11': 7, 'optimizer': 'RMSprop', 'rmsprop_learning_rate': 0.09825468685285772, 'rmsprop_weight_decay': 0.9811944159222068, 'rmsprop_momentum': 0.0017905443702799567}. Best is trial 47 with value: 0.6984127163887024.
Trial 56 finished with value: 0.5396825671195984 and parameters: {'n_layers': 14, 'weight_decay': 3.507485974542438e-10, 'n_units_l0': 127, 'n_units_l1': 15, 'n_units_l2': 35, 'n_units_l3': 112, 'n_units_l4': 5, 'n_units_l5': 32, 'n_units_l6': 8, 'n_units_l7': 49, 'n_units_l8': 8, 'n_units_l9': 7, 'n_units_l10': 74, 'n_units_l11': 67, 'n_units_l12': 8, 'n_units_l13': 14, 'optimizer': 'RMSprop', 'rmsprop_learning_rate': 0.044201842419522276, 'rmsprop_weight_decay': 0.988673915494932, 'rmsprop_momentum': 0.0008952393233478943}. Best is trial 47 with value: 0.6984127163887024.
Trial 57 finished with value: 0.5714285969734192 and parameters: {'n_layers': 17, 'weight_decay': 1.2152460264244438e-09, 'n_units_l0': 102, 'n_units_l1': 8, 'n_units_l2': 24, 'n_units_l3': 83, 'n_units_l4': 9, 'n_units_l5': 60, 'n_units_l6': 38, 'n_units_l7': 14, 'n_units_l8': 14, 'n_units_l9': 5, 'n_units_l10': 12, 'n_units_l11': 10, 'n_units_l12': 6, 'n_units_l13': 50, 'n_units_l14': 9, 'n_units_l15': 125, 'n_units_l16': 33, 'optimizer': 'RMSprop', 'rmsprop_learning_rate': 0.057374080321157976, 'rmsprop_weight_decay': 0.9362775556514417, 'rmsprop_momentum': 0.00035014878965611805}. Best is trial 47 with value: 0.6984127163887024.
Trial 58 finished with value: 0.6349206566810608 and parameters: {'n_layers': 20, 'weight_decay': 5.654795231220362e-07, 'n_units_l0': 50, 'n_units_l1': 10, 'n_units_l2': 93, 'n_units_l3': 57, 'n_units_l4': 7, 'n_units_l5': 93, 'n_units_l6': 16, 'n_units_l7': 73, 'n_units_l8': 5, 'n_units_l9': 14, 'n_units_l10': 4, 'n_units_l11': 5, 'n_units_l12': 5, 'n_units_l13': 25, 'n_units_l14': 26, 'n_units_l15': 22, 'n_units_l16': 5, 'n_units_l17': 36, 'n_units_l18': 4, 'n_units_l19': 9, 'optimizer': 'Adam', 'adam_learning_rate': 0.00688900328237417}. Best is trial 47 with value: 0.6984127163887024.
Trial 59 finished with value: 0.5873016119003296 and parameters: {'n_layers': 13, 'weight_decay': 3.5633567416439598e-09, 'n_units_l0': 5, 'n_units_l1': 29, 'n_units_l2': 7, 'n_units_l3': 48, 'n_units_l4': 6, 'n_units_l5': 48, 'n_units_l6': 20, 'n_units_l7': 18, 'n_units_l8': 26, 'n_units_l9': 27, 'n_units_l10': 5, 'n_units_l11': 18, 'n_units_l12': 30, 'optimizer': 'RMSprop', 'rmsprop_learning_rate': 0.00020371571857131853, 'rmsprop_weight_decay': 0.9760648383860735, 'rmsprop_momentum': 0.006941831085275074}. Best is trial 47 with value: 0.6984127163887024.
Trial 60 finished with value: 0.5555555820465088 and parameters: {'n_layers': 18, 'weight_decay': 1.6680394327298504e-06, 'n_units_l0': 82, 'n_units_l1': 11, 'n_units_l2': 10, 'n_units_l3': 72, 'n_units_l4': 4, 'n_units_l5': 4, 'n_units_l6': 4, 'n_units_l7': 32, 'n_units_l8': 22, 'n_units_l9': 17, 'n_units_l10': 20, 'n_units_l11': 14, 'n_units_l12': 9, 'n_units_l13': 11, 'n_units_l14': 37, 'n_units_l15': 15, 'n_units_l16': 11, 'n_units_l17': 23, 'optimizer': 'SGD', 'sgd_opt_learning_rate': 0.00981349836287096, 'sgd_opt_momentum': 0.01034718084191599}. Best is trial 47 with value: 0.6984127163887024.
Trial 61 finished with value: 0.682539701461792 and parameters: {'n_layers': 15, 'weight_decay': 5.805360806787725e-10, 'n_units_l0': 36, 'n_units_l1': 35, 'n_units_l2': 6, 'n_units_l3': 11, 'n_units_l4': 6, 'n_units_l5': 19, 'n_units_l6': 11, 'n_units_l7': 22, 'n_units_l8': 7, 'n_units_l9': 8, 'n_units_l10': 51, 'n_units_l11': 8, 'n_units_l12': 12, 'n_units_l13': 19, 'n_units_l14': 65, 'optimizer': 'RMSprop', 'rmsprop_learning_rate': 0.013459367697597143, 'rmsprop_weight_decay': 0.9712351521560223, 'rmsprop_momentum': 0.00015455619705647086}. Best is trial 47 with value: 0.6984127163887024.
Trial 62 finished with value: 0.6507936716079712 and parameters: {'n_layers': 16, 'weight_decay': 5.239505286043343e-10, 'n_units_l0': 35, 'n_units_l1': 38, 'n_units_l2': 5, 'n_units_l3': 38, 'n_units_l4': 38, 'n_units_l5': 83, 'n_units_l6': 10, 'n_units_l7': 22, 'n_units_l8': 6, 'n_units_l9': 8, 'n_units_l10': 52, 'n_units_l11': 8, 'n_units_l12': 12, 'n_units_l13': 20, 'n_units_l14': 71, 'n_units_l15': 42, 'optimizer': 'RMSprop', 'rmsprop_learning_rate': 0.0038606004062177336, 'rmsprop_weight_decay': 0.9458903714777902, 'rmsprop_momentum': 0.0005255957384485918}. Best is trial 47 with value: 0.6984127163887024.
Trial 63 finished with value: 0.4920634925365448 and parameters: {'n_layers': 15, 'weight_decay': 6.434111119999842e-10, 'n_units_l0': 36, 'n_units_l1': 40, 'n_units_l2': 8, 'n_units_l3': 37, 'n_units_l4': 37, 'n_units_l5': 81, 'n_units_l6': 5, 'n_units_l7': 22, 'n_units_l8': 6, 'n_units_l9': 8, 'n_units_l10': 50, 'n_units_l11': 6, 'n_units_l12': 13, 'n_units_l13': 19, 'n_units_l14': 71, 'optimizer': 'RMSprop', 'rmsprop_learning_rate': 0.004493548794359565, 'rmsprop_weight_decay': 0.9472988502832157, 'rmsprop_momentum': 0.0006266242883875512}. Best is trial 47 with value: 0.6984127163887024.
Trial 64 finished with value: 0.6190476417541504 and parameters: {'n_layers': 14, 'weight_decay': 2.4425059912462944e-10, 'n_units_l0': 32, 'n_units_l1': 35, 'n_units_l2': 6, 'n_units_l3': 34, 'n_units_l4': 44, 'n_units_l5': 94, 'n_units_l6': 11, 'n_units_l7': 17, 'n_units_l8': 7, 'n_units_l9': 6, 'n_units_l10': 97, 'n_units_l11': 9, 'n_units_l12': 15, 'n_units_l13': 18, 'optimizer': 'RMSprop', 'rmsprop_learning_rate': 0.003242192795973732, 'rmsprop_weight_decay': 0.9142987105670091, 'rmsprop_momentum': 0.00011698772828057018}. Best is trial 47 with value: 0.6984127163887024.
Trial 65 finished with value: 0.5873016119003296 and parameters: {'n_layers': 17, 'weight_decay': 1.0090149017627664e-10, 'n_units_l0': 41, 'n_units_l1': 32, 'n_units_l2': 7, 'n_units_l3': 29, 'n_units_l4': 25, 'n_units_l5': 113, 'n_units_l6': 9, 'n_units_l7': 24, 'n_units_l8': 7, 'n_units_l9': 8, 'n_units_l10': 55, 'n_units_l11': 4, 'n_units_l12': 19, 'n_units_l13': 15, 'n_units_l14': 92, 'n_units_l15': 44, 'n_units_l16': 19, 'optimizer': 'RMSprop', 'rmsprop_learning_rate': 0.0014936261731273652, 'rmsprop_weight_decay': 0.9832471253233458, 'rmsprop_momentum': 0.00032125625462859627}. Best is trial 47 with value: 0.6984127163887024.
Trial 66 finished with value: 0.5714285969734192 and parameters: {'n_layers': 12, 'weight_decay': 1.9264892688880963e-09, 'n_units_l0': 44, 'n_units_l1': 51, 'n_units_l2': 5, 'n_units_l3': 15, 'n_units_l4': 31, 'n_units_l5': 58, 'n_units_l6': 14, 'n_units_l7': 27, 'n_units_l8': 4, 'n_units_l9': 4, 'n_units_l10': 38, 'n_units_l11': 8, 'optimizer': 'RMSprop', 'rmsprop_learning_rate': 0.021594138785467683, 'rmsprop_weight_decay': 0.9214822690971146, 'rmsprop_momentum': 0.00017795842803172961}. Best is trial 47 with value: 0.6984127163887024.
Trial 67 finished with value: 0.523809552192688 and parameters: {'n_layers': 16, 'weight_decay': 5.189213219523845e-10, 'n_units_l0': 23, 'n_units_l1': 75, 'n_units_l2': 9, 'n_units_l3': 24, 'n_units_l4': 18, 'n_units_l5': 66, 'n_units_l6': 8, 'n_units_l7': 35, 'n_units_l8': 73, 'n_units_l9': 11, 'n_units_l10': 67, 'n_units_l11': 7, 'n_units_l12': 10, 'n_units_l13': 24, 'n_units_l14': 59, 'n_units_l15': 29, 'optimizer': 'RMSprop', 'rmsprop_learning_rate': 0.06666647105305279, 'rmsprop_weight_decay': 0.9724045650726707, 'rmsprop_momentum': 0.0005834579214221461}. Best is trial 47 with value: 0.6984127163887024.
Trial 68 finished with value: 0.5079365372657776 and parameters: {'n_layers': 10, 'weight_decay': 9.793367553719905e-10, 'n_units_l0': 35, 'n_units_l1': 45, 'n_units_l2': 11, 'n_units_l3': 43, 'n_units_l4': 22, 'n_units_l5': 41, 'n_units_l6': 10, 'n_units_l7': 20, 'n_units_l8': 8, 'n_units_l9': 6, 'optimizer': 'RMSprop', 'rmsprop_learning_rate': 0.0078102449914801845, 'rmsprop_weight_decay': 0.9430891506678167, 'rmsprop_momentum': 1.876920792145494e-05}. Best is trial 47 with value: 0.6984127163887024.
Trial 69 finished with value: 0.5873016119003296 and parameters: {'n_layers': 15, 'weight_decay': 1.773213556282369e-10, 'n_units_l0': 13, 'n_units_l1': 60, 'n_units_l2': 16, 'n_units_l3': 20, 'n_units_l4': 83, 'n_units_l5': 13, 'n_units_l6': 8, 'n_units_l7': 11, 'n_units_l8': 39, 'n_units_l9': 9, 'n_units_l10': 52, 'n_units_l11': 10, 'n_units_l12': 16, 'n_units_l13': 37, 'n_units_l14': 49, 'optimizer': 'RMSprop', 'rmsprop_learning_rate': 0.0037369054761766584, 'rmsprop_weight_decay': 0.933318182184057, 'rmsprop_momentum': 0.0009760115422954655}. Best is trial 47 with value: 0.6984127163887024.
Trial 70 finished with value: 0.5396825671195984 and parameters: {'n_layers': 19, 'weight_decay': 2.605798188396241e-09, 'n_units_l0': 17, 'n_units_l1': 27, 'n_units_l2': 26, 'n_units_l3': 38, 'n_units_l4': 13, 'n_units_l5': 25, 'n_units_l6': 6, 'n_units_l7': 44, 'n_units_l8': 117, 'n_units_l9': 5, 'n_units_l10': 45, 'n_units_l11': 8, 'n_units_l12': 12, 'n_units_l13': 29, 'n_units_l14': 116, 'n_units_l15': 64, 'n_units_l16': 6, 'n_units_l17': 7, 'n_units_l18': 13, 'optimizer': 'RMSprop', 'rmsprop_learning_rate': 0.022637546459462858, 'rmsprop_weight_decay': 0.956173010515675, 'rmsprop_momentum': 8.536657076925324e-05}. Best is trial 47 with value: 0.6984127163887024.
Trial 71 finished with value: 0.60317462682724 and parameters: {'n_layers': 16, 'weight_decay': 2.766177200455494e-07, 'n_units_l0': 9, 'n_units_l1': 37, 'n_units_l2': 6, 'n_units_l3': 116, 'n_units_l4': 5, 'n_units_l5': 102, 'n_units_l6': 28, 'n_units_l7': 29, 'n_units_l8': 12, 'n_units_l9': 12, 'n_units_l10': 13, 'n_units_l11': 13, 'n_units_l12': 7, 'n_units_l13': 20, 'n_units_l14': 64, 'n_units_l15': 91, 'optimizer': 'RMSprop', 'rmsprop_learning_rate': 0.0006147890508239766, 'rmsprop_weight_decay': 0.960048901292751, 'rmsprop_momentum': 0.0038202591239248}. Best is trial 47 with value: 0.6984127163887024.
Trial 72 finished with value: 0.5714285969734192 and parameters: {'n_layers': 14, 'weight_decay': 1.0114884085696403e-07, 'n_units_l0': 68, 'n_units_l1': 10, 'n_units_l2': 5, 'n_units_l3': 99, 'n_units_l4': 8, 'n_units_l5': 77, 'n_units_l6': 22, 'n_units_l7': 22, 'n_units_l8': 30, 'n_units_l9': 10, 'n_units_l10': 73, 'n_units_l11': 12, 'n_units_l12': 10, 'n_units_l13': 6, 'optimizer': 'RMSprop', 'rmsprop_learning_rate': 0.002408039891986947, 'rmsprop_weight_decay': 0.9838364876539666, 'rmsprop_momentum': 0.0030390776344950514}. Best is trial 47 with value: 0.6984127163887024.
Trial 73 finished with value: 0.6349206566810608 and parameters: {'n_layers': 17, 'weight_decay': 3.018817086219266e-10, 'n_units_l0': 53, 'n_units_l1': 13, 'n_units_l2': 4, 'n_units_l3': 83, 'n_units_l4': 6, 'n_units_l5': 6, 'n_units_l6': 13, 'n_units_l7': 9, 'n_units_l8': 6, 'n_units_l9': 19, 'n_units_l10': 17, 'n_units_l11': 11, 'n_units_l12': 6, 'n_units_l13': 9, 'n_units_l14': 21, 'n_units_l15': 48, 'n_units_l16': 28, 'optimizer': 'RMSprop', 'rmsprop_learning_rate': 0.011824377312583222, 'rmsprop_weight_decay': 0.9448672872425413, 'rmsprop_momentum': 0.00030232743148283847}. Best is trial 47 with value: 0.6984127163887024.
Trial 74 finished with value: 0.6507936716079712 and parameters: {'n_layers': 15, 'weight_decay': 0.00012028394612631189, 'n_units_l0': 29, 'n_units_l1': 31, 'n_units_l2': 7, 'n_units_l3': 118, 'n_units_l4': 10, 'n_units_l5': 20, 'n_units_l6': 20, 'n_units_l7': 5, 'n_units_l8': 19, 'n_units_l9': 81, 'n_units_l10': 59, 'n_units_l11': 9, 'n_units_l12': 8, 'n_units_l13': 26, 'n_units_l14': 34, 'optimizer': 'RMSprop', 'rmsprop_learning_rate': 1.1067103485746403e-05, 'rmsprop_weight_decay': 0.9709276474292383, 'rmsprop_momentum': 0.0004889611328974935}. Best is trial 47 with value: 0.6984127163887024.
