Trial 147 finished with value: 0.523809552192688 and parameters: {'n_layers': 19, 'weight_decay': 8.602505110427406e-07, 'n_units_l0': 103, 'n_units_l1': 38, 'n_units_l2': 5, 'n_units_l3': 86, 'n_units_l4': 8, 'n_units_l5': 52, 'n_units_l6': 16, 'n_units_l7': 7, 'n_units_l8': 14, 'n_units_l9': 22, 'n_units_l10': 23, 'n_units_l11': 9, 'n_units_l12': 8, 'n_units_l13': 19, 'n_units_l14': 91, 'n_units_l15': 30, 'n_units_l16': 123, 'n_units_l17': 8, 'n_units_l18': 6, 'optimizer': 'RMSprop', 'rmsprop_learning_rate': 0.003922098795229178, 'rmsprop_weight_decay': 0.9057540095029871, 'rmsprop_momentum': 0.0002737687583259707}. Best is trial 111 with value: 0.7301587462425232.
Trial 148 finished with value: 0.5396825671195984 and parameters: {'n_layers': 16, 'weight_decay': 0.00031424536213873263, 'n_units_l0': 40, 'n_units_l1': 15, 'n_units_l2': 31, 'n_units_l3': 56, 'n_units_l4': 7, 'n_units_l5': 21, 'n_units_l6': 20, 'n_units_l7': 11, 'n_units_l8': 28, 'n_units_l9': 41, 'n_units_l10': 105, 'n_units_l11': 61, 'n_units_l12': 5, 'n_units_l13': 12, 'n_units_l14': 43, 'n_units_l15': 42, 'optimizer': 'RMSprop', 'rmsprop_learning_rate': 0.00015261480163088068, 'rmsprop_weight_decay': 0.9338069635074864, 'rmsprop_momentum': 0.00020983432313004247}. Best is trial 111 with value: 0.7301587462425232.
Trial 149 finished with value: 0.5873016119003296 and parameters: {'n_layers': 14, 'weight_decay': 5.139471823583909e-07, 'n_units_l0': 112, 'n_units_l1': 10, 'n_units_l2': 24, 'n_units_l3': 9, 'n_units_l4': 9, 'n_units_l5': 94, 'n_units_l6': 13, 'n_units_l7': 4, 'n_units_l8': 21, 'n_units_l9': 12, 'n_units_l10': 24, 'n_units_l11': 14, 'n_units_l12': 12, 'n_units_l13': 43, 'optimizer': 'RMSprop', 'rmsprop_learning_rate': 1.433783506461105e-05, 'rmsprop_weight_decay': 0.9899399085560942, 'rmsprop_momentum': 0.00013969135129348877}. Best is trial 111 with value: 0.7301587462425232.
Trial 150 finished with value: 0.5555555820465088 and parameters: {'n_layers': 13, 'weight_decay': 2.9518980941172055e-10, 'n_units_l0': 91, 'n_units_l1': 21, 'n_units_l2': 6, 'n_units_l3': 37, 'n_units_l4': 32, 'n_units_l5': 19, 'n_units_l6': 18, 'n_units_l7': 5, 'n_units_l8': 36, 'n_units_l9': 10, 'n_units_l10': 27, 'n_units_l11': 8, 'n_units_l12': 10, 'optimizer': 'RMSprop', 'rmsprop_learning_rate': 0.034227924043345334, 'rmsprop_weight_decay': 0.9742409589949969, 'rmsprop_momentum': 7.54229442310299e-05}. Best is trial 111 with value: 0.7301587462425232.
Trial 151 finished with value: 0.6349206566810608 and parameters: {'n_layers': 4, 'weight_decay': 2.9011553776785503e-09, 'n_units_l0': 38, 'n_units_l1': 14, 'n_units_l2': 9, 'n_units_l3': 123, 'optimizer': 'RMSprop', 'rmsprop_learning_rate': 0.001872362476372086, 'rmsprop_weight_decay': 0.9784659515633443, 'rmsprop_momentum': 0.0005095656749629518}. Best is trial 111 with value: 0.7301587462425232.
Trial 152 finished with value: 0.6349206566810608 and parameters: {'n_layers': 16, 'weight_decay': 1.4545656752156958e-09, 'n_units_l0': 37, 'n_units_l1': 32, 'n_units_l2': 7, 'n_units_l3': 118, 'n_units_l4': 4, 'n_units_l5': 80, 'n_units_l6': 23, 'n_units_l7': 19, 'n_units_l8': 6, 'n_units_l9': 78, 'n_units_l10': 5, 'n_units_l11': 15, 'n_units_l12': 6, 'n_units_l13': 9, 'n_units_l14': 74, 'n_units_l15': 87, 'optimizer': 'RMSprop', 'rmsprop_learning_rate': 0.0014797508703906235, 'rmsprop_weight_decay': 0.9762541115596217, 'rmsprop_momentum': 0.0004180971577972653}. Best is trial 111 with value: 0.7301587462425232.
Trial 153 finished with value: 0.5873016119003296 and parameters: {'n_layers': 15, 'weight_decay': 9.44015012723086e-10, 'n_units_l0': 44, 'n_units_l1': 18, 'n_units_l2': 105, 'n_units_l3': 110, 'n_units_l4': 4, 'n_units_l5': 125, 'n_units_l6': 25, 'n_units_l7': 17, 'n_units_l8': 6, 'n_units_l9': 116, 'n_units_l10': 4, 'n_units_l11': 13, 'n_units_l12': 7, 'n_units_l13': 8, 'n_units_l14': 69, 'optimizer': 'RMSprop', 'rmsprop_learning_rate': 0.0788572139910628, 'rmsprop_weight_decay': 0.9439508494915767, 'rmsprop_momentum': 0.0003444163765452561}. Best is trial 111 with value: 0.7301587462425232.
Trial 154 finished with value: 0.5714285969734192 and parameters: {'n_layers': 16, 'weight_decay': 2.3991780022848744e-06, 'n_units_l0': 42, 'n_units_l1': 12, 'n_units_l2': 9, 'n_units_l3': 104, 'n_units_l4': 38, 'n_units_l5': 9, 'n_units_l6': 21, 'n_units_l7': 18, 'n_units_l8': 7, 'n_units_l9': 7, 'n_units_l10': 5, 'n_units_l11': 12, 'n_units_l12': 13, 'n_units_l13': 25, 'n_units_l14': 16, 'n_units_l15': 128, 'optimizer': 'RMSprop', 'rmsprop_learning_rate': 0.05879009286455255, 'rmsprop_weight_decay': 0.9832064133242848, 'rmsprop_momentum': 0.002634270788198725}. Best is trial 111 with value: 0.7301587462425232.
Trial 155 finished with value: 0.5396825671195984 and parameters: {'n_layers': 14, 'weight_decay': 3.511335356335502e-08, 'n_units_l0': 34, 'n_units_l1': 15, 'n_units_l2': 10, 'n_units_l3': 77, 'n_units_l4': 11, 'n_units_l5': 97, 'n_units_l6': 27, 'n_units_l7': 14, 'n_units_l8': 5, 'n_units_l9': 110, 'n_units_l10': 8, 'n_units_l11': 11, 'n_units_l12': 8, 'n_units_l13': 9, 'optimizer': 'RMSprop', 'rmsprop_learning_rate': 0.002613319326797695, 'rmsprop_weight_decay': 0.9720581237315735, 'rmsprop_momentum': 0.00017182716239346434}. Best is trial 111 with value: 0.7301587462425232.
Trial 156 finished with value: 0.5714285969734192 and parameters: {'n_layers': 17, 'weight_decay': 4.176829256940701e-10, 'n_units_l0': 29, 'n_units_l1': 15, 'n_units_l2': 8, 'n_units_l3': 25, 'n_units_l4': 5, 'n_units_l5': 107, 'n_units_l6': 31, 'n_units_l7': 17, 'n_units_l8': 15, 'n_units_l9': 92, 'n_units_l10': 52, 'n_units_l11': 10, 'n_units_l12': 11, 'n_units_l13': 7, 'n_units_l14': 61, 'n_units_l15': 97, 'n_units_l16': 7, 'optimizer': 'RMSprop', 'rmsprop_learning_rate': 0.00042516510093623, 'rmsprop_weight_decay': 0.9656692164123867, 'rmsprop_momentum': 0.00011418150440766265}. Best is trial 111 with value: 0.7301587462425232.
Trial 157 finished with value: 0.5714285969734192 and parameters: {'n_layers': 25, 'weight_decay': 2.0135845425858666e-09, 'n_units_l0': 19, 'n_units_l1': 9, 'n_units_l2': 40, 'n_units_l3': 21, 'n_units_l4': 20, 'n_units_l5': 87, 'n_units_l6': 19, 'n_units_l7': 25, 'n_units_l8': 20, 'n_units_l9': 16, 'n_units_l10': 19, 'n_units_l11': 6, 'n_units_l12': 9, 'n_units_l13': 10, 'n_units_l14': 52, 'n_units_l15': 78, 'n_units_l16': 55, 'n_units_l17': 104, 'n_units_l18': 12, 'n_units_l19': 16, 'n_units_l20': 11, 'n_units_l21': 37, 'n_units_l22': 97, 'n_units_l23': 72, 'n_units_l24': 4, 'optimizer': 'RMSprop', 'rmsprop_learning_rate': 0.0005650909728653673, 'rmsprop_weight_decay': 0.985811307601397, 'rmsprop_momentum': 0.00024168581694316028}. Best is trial 111 with value: 0.7301587462425232.
Trial 158 finished with value: 0.5714285969734192 and parameters: {'n_layers': 18, 'weight_decay': 4.878404392926297e-09, 'n_units_l0': 74, 'n_units_l1': 11, 'n_units_l2': 37, 'n_units_l3': 119, 'n_units_l4': 4, 'n_units_l5': 114, 'n_units_l6': 13, 'n_units_l7': 13, 'n_units_l8': 9, 'n_units_l9': 127, 'n_units_l10': 47, 'n_units_l11': 17, 'n_units_l12': 5, 'n_units_l13': 29, 'n_units_l14': 89, 'n_units_l15': 59, 'n_units_l16': 16, 'n_units_l17': 76, 'optimizer': 'RMSprop', 'rmsprop_learning_rate': 0.0011870450113629063, 'rmsprop_weight_decay': 0.9682266794730378, 'rmsprop_momentum': 0.0010210609562597646}. Best is trial 111 with value: 0.7301587462425232.
Trial 159 finished with value: 0.6190476417541504 and parameters: {'n_layers': 15, 'weight_decay': 6.145683352965573e-10, 'n_units_l0': 97, 'n_units_l1': 10, 'n_units_l2': 10, 'n_units_l3': 96, 'n_units_l4': 49, 'n_units_l5': 16, 'n_units_l6': 11, 'n_units_l7': 15, 'n_units_l8': 17, 'n_units_l9': 31, 'n_units_l10': 9, 'n_units_l11': 9, 'n_units_l12': 10, 'n_units_l13': 6, 'n_units_l14': 76, 'optimizer': 'RMSprop', 'rmsprop_learning_rate': 0.06658475835329601, 'rmsprop_weight_decay': 0.9762568594319142, 'rmsprop_momentum': 0.0005272947809832237}. Best is trial 111 with value: 0.7301587462425232.
Trial 160 finished with value: 0.5714285969734192 and parameters: {'n_layers': 16, 'weight_decay': 2.1293960700448932e-10, 'n_units_l0': 53, 'n_units_l1': 16, 'n_units_l2': 9, 'n_units_l3': 45, 'n_units_l4': 5, 'n_units_l5': 75, 'n_units_l6': 25, 'n_units_l7': 29, 'n_units_l8': 24, 'n_units_l9': 51, 'n_units_l10': 7, 'n_units_l11': 13, 'n_units_l12': 6, 'n_units_l13': 23, 'n_units_l14': 27, 'n_units_l15': 72, 'optimizer': 'Adam', 'adam_learning_rate': 0.0020278270570243365}. Best is trial 111 with value: 0.7301587462425232.
Trial 161 finished with value: 0.4761904776096344 and parameters: {'n_layers': 14, 'weight_decay': 1.0114159771179666e-09, 'n_units_l0': 89, 'n_units_l1': 9, 'n_units_l2': 6, 'n_units_l3': 33, 'n_units_l4': 40, 'n_units_l5': 18, 'n_units_l6': 15, 'n_units_l7': 9, 'n_units_l8': 26, 'n_units_l9': 8, 'n_units_l10': 10, 'n_units_l11': 15, 'n_units_l12': 11, 'n_units_l13': 8, 'optimizer': 'RMSprop', 'rmsprop_learning_rate': 0.0408976301674225, 'rmsprop_weight_decay': 0.9815696883602856, 'rmsprop_momentum': 5.171082532844962e-05}. Best is trial 111 with value: 0.7301587462425232.
Trial 162 finished with value: 0.5873016119003296 and parameters: {'n_layers': 15, 'weight_decay': 7.87027223760397e-10, 'n_units_l0': 83, 'n_units_l1': 10, 'n_units_l2': 56, 'n_units_l3': 27, 'n_units_l4': 45, 'n_units_l5': 18, 'n_units_l6': 15, 'n_units_l7': 11, 'n_units_l8': 22, 'n_units_l9': 9, 'n_units_l10': 12, 'n_units_l11': 14, 'n_units_l12': 11, 'n_units_l13': 7, 'n_units_l14': 55, 'optimizer': 'RMSprop', 'rmsprop_learning_rate': 0.028598476226547237, 'rmsprop_weight_decay': 0.9819534939641884, 'rmsprop_momentum': 8.0705483621504e-05}. Best is trial 111 with value: 0.7301587462425232.
Trial 163 finished with value: 0.5873016119003296 and parameters: {'n_layers': 14, 'weight_decay': 1.4749758717414793e-09, 'n_units_l0': 32, 'n_units_l1': 11, 'n_units_l2': 52, 'n_units_l3': 30, 'n_units_l4': 42, 'n_units_l5': 20, 'n_units_l6': 12, 'n_units_l7': 10, 'n_units_l8': 25, 'n_units_l9': 10, 'n_units_l10': 25, 'n_units_l11': 18, 'n_units_l12': 11, 'n_units_l13': 21, 'optimizer': 'RMSprop', 'rmsprop_learning_rate': 0.001917830391863605, 'rmsprop_weight_decay': 0.987424197165133, 'rmsprop_momentum': 9.817690895525907e-05}. Best is trial 111 with value: 0.7301587462425232.
Trial 164 finished with value: 0.4920634925365448 and parameters: {'n_layers': 14, 'weight_decay': 5.253389915038084e-10, 'n_units_l0': 128, 'n_units_l1': 35, 'n_units_l2': 59, 'n_units_l3': 26, 'n_units_l4': 38, 'n_units_l5': 17, 'n_units_l6': 14, 'n_units_l7': 12, 'n_units_l8': 19, 'n_units_l9': 81, 'n_units_l10': 9, 'n_units_l11': 16, 'n_units_l12': 12, 'n_units_l13': 26, 'optimizer': 'RMSprop', 'rmsprop_learning_rate': 0.05378542614588899, 'rmsprop_weight_decay': 0.9842744782625621, 'rmsprop_momentum': 4.5430676532947485e-05}. Best is trial 111 with value: 0.7301587462425232.
Trial 165 finished with value: 0.523809552192688 and parameters: {'n_layers': 13, 'weight_decay': 3.2516471589796245e-09, 'n_units_l0': 86, 'n_units_l1': 10, 'n_units_l2': 7, 'n_units_l3': 106, 'n_units_l4': 33, 'n_units_l5': 22, 'n_units_l6': 16, 'n_units_l7': 20, 'n_units_l8': 8, 'n_units_l9': 9, 'n_units_l10': 9, 'n_units_l11': 10, 'n_units_l12': 23, 'optimizer': 'RMSprop', 'rmsprop_learning_rate': 0.04782863244271258, 'rmsprop_weight_decay': 0.9801814812124611, 'rmsprop_momentum': 0.0006592826366870004}. Best is trial 111 with value: 0.7301587462425232.
Trial 166 finished with value: 0.60317462682724 and parameters: {'n_layers': 15, 'weight_decay': 1.4006549687791364e-10, 'n_units_l0': 78, 'n_units_l1': 13, 'n_units_l2': 15, 'n_units_l3': 23, 'n_units_l4': 35, 'n_units_l5': 14, 'n_units_l6': 17, 'n_units_l7': 11, 'n_units_l8': 30, 'n_units_l9': 8, 'n_units_l10': 5, 'n_units_l11': 15, 'n_units_l12': 7, 'n_units_l13': 7, 'n_units_l14': 102, 'optimizer': 'RMSprop', 'rmsprop_learning_rate': 0.03717176128208399, 'rmsprop_weight_decay': 0.9307873056035605, 'rmsprop_momentum': 1.9384520725679498e-05}. Best is trial 111 with value: 0.7301587462425232.
Trial 167 finished with value: 0.5714285969734192 and parameters: {'n_layers': 16, 'weight_decay': 8.768714816607582e-10, 'n_units_l0': 38, 'n_units_l1': 12, 'n_units_l2': 8, 'n_units_l3': 25, 'n_units_l4': 29, 'n_units_l5': 32, 'n_units_l6': 22, 'n_units_l7': 22, 'n_units_l8': 24, 'n_units_l9': 11, 'n_units_l10': 11, 'n_units_l11': 12, 'n_units_l12': 9, 'n_units_l13': 6, 'n_units_l14': 46, 'n_units_l15': 84, 'optimizer': 'RMSprop', 'rmsprop_learning_rate': 0.00033186896320848555, 'rmsprop_weight_decay': 0.9389276832128447, 'rmsprop_momentum': 0.0001522050260440028}. Best is trial 111 with value: 0.7301587462425232.
Trial 168 finished with value: 0.5396825671195984 and parameters: {'n_layers': 17, 'weight_decay': 0.00010852367210187728, 'n_units_l0': 46, 'n_units_l1': 8, 'n_units_l2': 33, 'n_units_l3': 20, 'n_units_l4': 6, 'n_units_l5': 19, 'n_units_l6': 24, 'n_units_l7': 16, 'n_units_l8': 18, 'n_units_l9': 9, 'n_units_l10': 55, 'n_units_l11': 13, 'n_units_l12': 13, 'n_units_l13': 31, 'n_units_l14': 33, 'n_units_l15': 20, 'n_units_l16': 83, 'optimizer': 'RMSprop', 'rmsprop_learning_rate': 0.017929988160122652, 'rmsprop_weight_decay': 0.9717584637247761, 'rmsprop_momentum': 0.00034948607243910233}. Best is trial 111 with value: 0.7301587462425232.
Trial 169 finished with value: 0.5555555820465088 and parameters: {'n_layers': 13, 'weight_decay': 2.172716992910436e-09, 'n_units_l0': 115, 'n_units_l1': 27, 'n_units_l2': 84, 'n_units_l3': 28, 'n_units_l4': 60, 'n_units_l5': 16, 'n_units_l6': 9, 'n_units_l7': 13, 'n_units_l8': 27, 'n_units_l9': 18, 'n_units_l10': 17, 'n_units_l11': 7, 'n_units_l12': 10, 'optimizer': 'SGD', 'sgd_opt_learning_rate': 0.0003321219457421494, 'sgd_opt_momentum': 0.030987635319596512}. Best is trial 111 with value: 0.7301587462425232.
Trial 170 finished with value: 0.60317462682724 and parameters: {'n_layers': 14, 'weight_decay': 3.1657655213347095e-10, 'n_units_l0': 36, 'n_units_l1': 24, 'n_units_l2': 63, 'n_units_l3': 4, 'n_units_l4': 7, 'n_units_l5': 68, 'n_units_l6': 18, 'n_units_l7': 31, 'n_units_l8': 22, 'n_units_l9': 25, 'n_units_l10': 41, 'n_units_l11': 12, 'n_units_l12': 14, 'n_units_l13': 33, 'optimizer': 'RMSprop', 'rmsprop_learning_rate': 0.06328300056512838, 'rmsprop_weight_decay': 0.9898192865244995, 'rmsprop_momentum': 7.130741110201521e-05}. Best is trial 111 with value: 0.7301587462425232.
Trial 171 finished with value: 0.60317462682724 and parameters: {'n_layers': 15, 'weight_decay': 2.4966783315326076e-09, 'n_units_l0': 103, 'n_units_l1': 13, 'n_units_l2': 29, 'n_units_l3': 18, 'n_units_l4': 46, 'n_units_l5': 30, 'n_units_l6': 11, 'n_units_l7': 14, 'n_units_l8': 21, 'n_units_l9': 7, 'n_units_l10': 6, 'n_units_l11': 12, 'n_units_l12': 10, 'n_units_l13': 8, 'n_units_l14': 37, 'optimizer': 'SGD', 'sgd_opt_learning_rate': 0.01580026024295262, 'sgd_opt_momentum': 0.0002544315767304234}. Best is trial 111 with value: 0.7301587462425232.
Trial 172 finished with value: 0.6349206566810608 and parameters: {'n_layers': 14, 'weight_decay': 1.966850328149884e-09, 'n_units_l0': 112, 'n_units_l1': 14, 'n_units_l2': 30, 'n_units_l3': 17, 'n_units_l4': 49, 'n_units_l5': 31, 'n_units_l6': 8, 'n_units_l7': 17, 'n_units_l8': 19, 'n_units_l9': 6, 'n_units_l10': 6, 'n_units_l11': 14, 'n_units_l12': 12, 'n_units_l13': 8, 'optimizer': 'SGD', 'sgd_opt_learning_rate': 0.009722194778393076, 'sgd_opt_momentum': 0.00045185342796165055}. Best is trial 111 with value: 0.7301587462425232.
Trial 173 finished with value: 0.5714285969734192 and parameters: {'n_layers': 16, 'weight_decay': 1.45205913991093e-09, 'n_units_l0': 93, 'n_units_l1': 12, 'n_units_l2': 27, 'n_units_l3': 113, 'n_units_l4': 47, 'n_units_l5': 27, 'n_units_l6': 8, 'n_units_l7': 15, 'n_units_l8': 6, 'n_units_l9': 68, 'n_units_l10': 7, 'n_units_l11': 11, 'n_units_l12': 11, 'n_units_l13': 19, 'n_units_l14': 19, 'n_units_l15': 111, 'optimizer': 'SGD', 'sgd_opt_learning_rate': 0.0012861734981514394, 'sgd_opt_momentum': 0.002632156306173439}. Best is trial 111 with value: 0.7301587462425232.
Trial 174 finished with value: 0.6666666865348816 and parameters: {'n_layers': 15, 'weight_decay': 4.3108131642321355e-10, 'n_units_l0': 107, 'n_units_l1': 11, 'n_units_l2': 25, 'n_units_l3': 120, 'n_units_l4': 52, 'n_units_l5': 45, 'n_units_l6': 10, 'n_units_l7': 18, 'n_units_l8': 20, 'n_units_l9': 7, 'n_units_l10': 85, 'n_units_l11': 13, 'n_units_l12': 9, 'n_units_l13': 9, 'n_units_l14': 67, 'optimizer': 'SGD', 'sgd_opt_learning_rate': 0.004122176136789608, 'sgd_opt_momentum': 5.362603531182522e-05}. Best is trial 111 with value: 0.7301587462425232.
Trial 175 finished with value: 0.5396825671195984 and parameters: {'n_layers': 15, 'weight_decay': 2.553018263095679e-10, 'n_units_l0': 69, 'n_units_l1': 10, 'n_units_l2': 23, 'n_units_l3': 123, 'n_units_l4': 53, 'n_units_l5': 41, 'n_units_l6': 10, 'n_units_l7': 18, 'n_units_l8': 23, 'n_units_l9': 8, 'n_units_l10': 68, 'n_units_l11': 11, 'n_units_l12': 85, 'n_units_l13': 16, 'n_units_l14': 66, 'optimizer': 'SGD', 'sgd_opt_learning_rate': 0.004493113494570438, 'sgd_opt_momentum': 6.969974042817239e-05}. Best is trial 111 with value: 0.7301587462425232.
Trial 176 finished with value: 0.5714285969734192 and parameters: {'n_layers': 16, 'weight_decay': 5.108549298270103e-10, 'n_units_l0': 120, 'n_units_l1': 11, 'n_units_l2': 25, 'n_units_l3': 99, 'n_units_l4': 42, 'n_units_l5': 50, 'n_units_l6': 12, 'n_units_l7': 21, 'n_units_l8': 16, 'n_units_l9': 10, 'n_units_l10': 115, 'n_units_l11': 15, 'n_units_l12': 8, 'n_units_l13': 39, 'n_units_l14': 85, 'n_units_l15': 95, 'optimizer': 'RMSprop', 'rmsprop_learning_rate': 0.09938204900926084, 'rmsprop_weight_decay': 0.9774198452971327, 'rmsprop_momentum': 0.0016536578732083572}. Best is trial 111 with value: 0.7301587462425232.
Trial 177 finished with value: 0.682539701461792 and parameters: {'n_layers': 17, 'weight_decay': 3.8187430407395424e-10, 'n_units_l0': 59, 'n_units_l1': 9, 'n_units_l2': 76, 'n_units_l3': 113, 'n_units_l4': 9, 'n_units_l5': 45, 'n_units_l6': 14, 'n_units_l7': 23, 'n_units_l8': 24, 'n_units_l9': 9, 'n_units_l10': 86, 'n_units_l11': 10, 'n_units_l12': 27, 'n_units_l13': 12, 'n_units_l14': 23, 'n_units_l15': 7, 'n_units_l16': 4, 'optimizer': 'RMSprop', 'rmsprop_learning_rate': 0.010737875164329702, 'rmsprop_weight_decay': 0.9869550265780835, 'rmsprop_momentum': 6.114175955753647e-05}. Best is trial 111 with value: 0.7301587462425232.
Trial 178 finished with value: 0.60317462682724 and parameters: {'n_layers': 17, 'weight_decay': 1.8300240979219612e-10, 'n_units_l0': 59, 'n_units_l1': 9, 'n_units_l2': 5, 'n_units_l3': 127, 'n_units_l4': 8, 'n_units_l5': 47, 'n_units_l6': 10, 'n_units_l7': 24, 'n_units_l8': 7, 'n_units_l9': 35, 'n_units_l10': 92, 'n_units_l11': 32, 'n_units_l12': 30, 'n_units_l13': 13, 'n_units_l14': 24, 'n_units_l15': 6, 'n_units_l16': 4, 'optimizer': 'RMSprop', 'rmsprop_learning_rate': 0.011340058444059975, 'rmsprop_weight_decay': 0.9464231795033573, 'rmsprop_momentum': 6.224507032509096e-05}. Best is trial 111 with value: 0.7301587462425232.
Trial 179 finished with value: 0.5396825671195984 and parameters: {'n_layers': 18, 'weight_decay': 4.2089759698429116e-10, 'n_units_l0': 51, 'n_units_l1': 7, 'n_units_l2': 26, 'n_units_l3': 109, 'n_units_l4': 9, 'n_units_l5': 45, 'n_units_l6': 13, 'n_units_l7': 27, 'n_units_l8': 17, 'n_units_l9': 11, 'n_units_l10': 101, 'n_units_l11': 10, 'n_units_l12': 32, 'n_units_l13': 12, 'n_units_l14': 22, 'n_units_l15': 8, 'n_units_l16': 6, 'n_units_l17': 13, 'optimizer': 'RMSprop', 'rmsprop_learning_rate': 0.008270742550880878, 'rmsprop_weight_decay': 0.9876437742156174, 'rmsprop_momentum': 0.0003012591681047545}. Best is trial 111 with value: 0.7301587462425232.
Trial 180 finished with value: 0.682539701461792 and parameters: {'n_layers': 17, 'weight_decay': 1.0551339258895844e-10, 'n_units_l0': 65, 'n_units_l1': 29, 'n_units_l2': 68, 'n_units_l3': 118, 'n_units_l4': 11, 'n_units_l5': 44, 'n_units_l6': 11, 'n_units_l7': 23, 'n_units_l8': 20, 'n_units_l9': 20, 'n_units_l10': 82, 'n_units_l11': 8, 'n_units_l12': 26, 'n_units_l13': 9, 'n_units_l14': 60, 'n_units_l15': 7, 'n_units_l16': 8, 'optimizer': 'RMSprop', 'rmsprop_learning_rate': 0.01455976022863606, 'rmsprop_weight_decay': 0.9852674946532559, 'rmsprop_momentum': 0.00020827050840285054}. Best is trial 111 with value: 0.7301587462425232.
Trial 181 finished with value: 0.6190476417541504 and parameters: {'n_layers': 17, 'weight_decay': 1.0438087230321554e-10, 'n_units_l0': 61, 'n_units_l1': 28, 'n_units_l2': 12, 'n_units_l3': 118, 'n_units_l4': 10, 'n_units_l5': 43, 'n_units_l6': 11, 'n_units_l7': 23, 'n_units_l8': 20, 'n_units_l9': 18, 'n_units_l10': 82, 'n_units_l11': 8, 'n_units_l12': 24, 'n_units_l13': 9, 'n_units_l14': 68, 'n_units_l15': 5, 'n_units_l16': 5, 'optimizer': 'RMSprop', 'rmsprop_learning_rate': 0.012644444422430524, 'rmsprop_weight_decay': 0.9859117225902652, 'rmsprop_momentum': 0.00021327897747396913}. Best is trial 111 with value: 0.7301587462425232.
Trial 182 finished with value: 0.6666666865348816 and parameters: {'n_layers': 16, 'weight_decay': 1.4464129073179315e-10, 'n_units_l0': 65, 'n_units_l1': 31, 'n_units_l2': 74, 'n_units_l3': 102, 'n_units_l4': 11, 'n_units_l5': 55, 'n_units_l6': 70, 'n_units_l7': 21, 'n_units_l8': 20, 'n_units_l9': 20, 'n_units_l10': 89, 'n_units_l11': 9, 'n_units_l12': 25, 'n_units_l13': 10, 'n_units_l14': 59, 'n_units_l15': 7, 'optimizer': 'RMSprop', 'rmsprop_learning_rate': 0.010402748213733333, 'rmsprop_weight_decay': 0.9845715657096424, 'rmsprop_momentum': 0.00012955818931189257}. Best is trial 111 with value: 0.7301587462425232.
