Trial 183 finished with value: 0.6190476417541504 and parameters: {'n_layers': 17, 'weight_decay': 1.3669541511073715e-10, 'n_units_l0': 65, 'n_units_l1': 34, 'n_units_l2': 71, 'n_units_l3': 106, 'n_units_l4': 10, 'n_units_l5': 56, 'n_units_l6': 105, 'n_units_l7': 22, 'n_units_l8': 18, 'n_units_l9': 24, 'n_units_l10': 86, 'n_units_l11': 9, 'n_units_l12': 27, 'n_units_l13': 10, 'n_units_l14': 58, 'n_units_l15': 7, 'n_units_l16': 8, 'optimizer': 'RMSprop', 'rmsprop_learning_rate': 0.010536458719461345, 'rmsprop_weight_decay': 0.9845732421100648, 'rmsprop_momentum': 0.00017902328858282696}. Best is trial 111 with value: 0.7301587462425232.
Trial 184 finished with value: 0.60317462682724 and parameters: {'n_layers': 18, 'weight_decay': 2.2105317167724374e-10, 'n_units_l0': 56, 'n_units_l1': 30, 'n_units_l2': 81, 'n_units_l3': 93, 'n_units_l4': 11, 'n_units_l5': 53, 'n_units_l6': 14, 'n_units_l7': 26, 'n_units_l8': 21, 'n_units_l9': 20, 'n_units_l10': 73, 'n_units_l11': 8, 'n_units_l12': 27, 'n_units_l13': 11, 'n_units_l14': 60, 'n_units_l15': 10, 'n_units_l16': 7, 'n_units_l17': 5, 'optimizer': 'RMSprop', 'rmsprop_learning_rate': 0.01669016272978899, 'rmsprop_weight_decay': 0.9872980558120427, 'rmsprop_momentum': 0.00011960908510961795}. Best is trial 111 with value: 0.7301587462425232.
Trial 185 finished with value: 0.5079365372657776 and parameters: {'n_layers': 16, 'weight_decay': 1.6404390132615918e-10, 'n_units_l0': 71, 'n_units_l1': 32, 'n_units_l2': 70, 'n_units_l3': 100, 'n_units_l4': 12, 'n_units_l5': 47, 'n_units_l6': 9, 'n_units_l7': 20, 'n_units_l8': 20, 'n_units_l9': 22, 'n_units_l10': 96, 'n_units_l11': 9, 'n_units_l12': 26, 'n_units_l13': 14, 'n_units_l14': 40, 'n_units_l15': 6, 'optimizer': 'RMSprop', 'rmsprop_learning_rate': 0.007183201222647241, 'rmsprop_weight_decay': 0.9899507580312383, 'rmsprop_momentum': 0.0001506642191307192}. Best is trial 111 with value: 0.7301587462425232.
Trial 186 finished with value: 0.5555555820465088 and parameters: {'n_layers': 15, 'weight_decay': 2.843525596552096e-10, 'n_units_l0': 64, 'n_units_l1': 30, 'n_units_l2': 98, 'n_units_l3': 83, 'n_units_l4': 12, 'n_units_l5': 39, 'n_units_l6': 12, 'n_units_l7': 24, 'n_units_l8': 22, 'n_units_l9': 21, 'n_units_l10': 78, 'n_units_l11': 8, 'n_units_l12': 22, 'n_units_l13': 17, 'n_units_l14': 53, 'optimizer': 'RMSprop', 'rmsprop_learning_rate': 0.013824893356996786, 'rmsprop_weight_decay': 0.983117048356464, 'rmsprop_momentum': 3.5948160153887055e-05}. Best is trial 111 with value: 0.7301587462425232.
Trial 187 finished with value: 0.5396825671195984 and parameters: {'n_layers': 17, 'weight_decay': 1.359066791694363e-10, 'n_units_l0': 68, 'n_units_l1': 36, 'n_units_l2': 78, 'n_units_l3': 128, 'n_units_l4': 8, 'n_units_l5': 36, 'n_units_l6': 80, 'n_units_l7': 21, 'n_units_l8': 32, 'n_units_l9': 19, 'n_units_l10': 86, 'n_units_l11': 7, 'n_units_l12': 29, 'n_units_l13': 11, 'n_units_l14': 49, 'n_units_l15': 5, 'n_units_l16': 4, 'optimizer': 'RMSprop', 'rmsprop_learning_rate': 0.010114068301260933, 'rmsprop_weight_decay': 0.9800174338869316, 'rmsprop_momentum': 8.837851450415431e-05}. Best is trial 111 with value: 0.7301587462425232.
Trial 188 finished with value: 0.7142857313156128 and parameters: {'n_layers': 15, 'weight_decay': 1.0091038105315742e-10, 'n_units_l0': 76, 'n_units_l1': 25, 'n_units_l2': 91, 'n_units_l3': 114, 'n_units_l4': 14, 'n_units_l5': 61, 'n_units_l6': 11, 'n_units_l7': 29, 'n_units_l8': 19, 'n_units_l9': 9, 'n_units_l10': 90, 'n_units_l11': 10, 'n_units_l12': 36, 'n_units_l13': 36, 'n_units_l14': 62, 'optimizer': 'RMSprop', 'rmsprop_learning_rate': 0.00019332879182135207, 'rmsprop_weight_decay': 0.9519008139108299, 'rmsprop_momentum': 0.00011186547664102855}. Best is trial 111 with value: 0.7301587462425232.
Trial 189 finished with value: 0.6349206566810608 and parameters: {'n_layers': 16, 'weight_decay': 1.1069434898900202e-10, 'n_units_l0': 79, 'n_units_l1': 22, 'n_units_l2': 73, 'n_units_l3': 113, 'n_units_l4': 13, 'n_units_l5': 58, 'n_units_l6': 7, 'n_units_l7': 27, 'n_units_l8': 24, 'n_units_l9': 16, 'n_units_l10': 114, 'n_units_l11': 10, 'n_units_l12': 35, 'n_units_l13': 35, 'n_units_l14': 62, 'n_units_l15': 7, 'optimizer': 'SGD', 'sgd_opt_learning_rate': 0.0001661255586572418, 'sgd_opt_momentum': 6.534532151383291e-05}. Best is trial 111 with value: 0.7301587462425232.
Trial 190 finished with value: 0.6190476417541504 and parameters: {'n_layers': 15, 'weight_decay': 1.8381411605432463e-10, 'n_units_l0': 77, 'n_units_l1': 24, 'n_units_l2': 109, 'n_units_l3': 110, 'n_units_l4': 14, 'n_units_l5': 53, 'n_units_l6': 10, 'n_units_l7': 30, 'n_units_l8': 19, 'n_units_l9': 10, 'n_units_l10': 97, 'n_units_l11': 9, 'n_units_l12': 20, 'n_units_l13': 22, 'n_units_l14': 54, 'optimizer': 'RMSprop', 'rmsprop_learning_rate': 8.965938100090853e-05, 'rmsprop_weight_decay': 0.9579939116890859, 'rmsprop_momentum': 0.0020662504799309786}. Best is trial 111 with value: 0.7301587462425232.
Trial 191 finished with value: 0.6507936716079712 and parameters: {'n_layers': 15, 'weight_decay': 1.0327154187443062e-10, 'n_units_l0': 56, 'n_units_l1': 40, 'n_units_l2': 79, 'n_units_l3': 104, 'n_units_l4': 9, 'n_units_l5': 67, 'n_units_l6': 72, 'n_units_l7': 35, 'n_units_l8': 17, 'n_units_l9': 9, 'n_units_l10': 85, 'n_units_l11': 11, 'n_units_l12': 37, 'n_units_l13': 41, 'n_units_l14': 70, 'optimizer': 'RMSprop', 'rmsprop_learning_rate': 0.00019810971086970977, 'rmsprop_weight_decay': 0.9509819400539634, 'rmsprop_momentum': 0.00013284060503389688}. Best is trial 111 with value: 0.7301587462425232.
Trial 192 finished with value: 0.5714285969734192 and parameters: {'n_layers': 15, 'weight_decay': 3.605623115245691e-10, 'n_units_l0': 72, 'n_units_l1': 29, 'n_units_l2': 66, 'n_units_l3': 89, 'n_units_l4': 13, 'n_units_l5': 60, 'n_units_l6': 58, 'n_units_l7': 32, 'n_units_l8': 19, 'n_units_l9': 7, 'n_units_l10': 74, 'n_units_l11': 9, 'n_units_l12': 24, 'n_units_l13': 36, 'n_units_l14': 31, 'optimizer': 'RMSprop', 'rmsprop_learning_rate': 0.00024569025393655474, 'rmsprop_weight_decay': 0.9486813969958857, 'rmsprop_momentum': 0.00010739396175662042}. Best is trial 111 with value: 0.7301587462425232.
Trial 193 finished with value: 0.6190476417541504 and parameters: {'n_layers': 16, 'weight_decay': 2.1011401809095165e-10, 'n_units_l0': 62, 'n_units_l1': 26, 'n_units_l2': 86, 'n_units_l3': 118, 'n_units_l4': 10, 'n_units_l5': 63, 'n_units_l6': 11, 'n_units_l7': 25, 'n_units_l8': 21, 'n_units_l9': 8, 'n_units_l10': 91, 'n_units_l11': 10, 'n_units_l12': 21, 'n_units_l13': 10, 'n_units_l14': 18, 'n_units_l15': 8, 'optimizer': 'RMSprop', 'rmsprop_learning_rate': 0.00015331677842496912, 'rmsprop_weight_decay': 0.9547130438673127, 'rmsprop_momentum': 0.00018804803577243256}. Best is trial 111 with value: 0.7301587462425232.
Trial 194 finished with value: 0.5555555820465088 and parameters: {'n_layers': 17, 'weight_decay': 2.7596414474734554e-10, 'n_units_l0': 21, 'n_units_l1': 25, 'n_units_l2': 83, 'n_units_l3': 128, 'n_units_l4': 11, 'n_units_l5': 42, 'n_units_l6': 12, 'n_units_l7': 29, 'n_units_l8': 18, 'n_units_l9': 20, 'n_units_l10': 108, 'n_units_l11': 10, 'n_units_l12': 26, 'n_units_l13': 20, 'n_units_l14': 13, 'n_units_l15': 9, 'n_units_l16': 10, 'optimizer': 'RMSprop', 'rmsprop_learning_rate': 0.005577043000989405, 'rmsprop_weight_decay': 0.9863038136299094, 'rmsprop_momentum': 0.000255195113748275}. Best is trial 111 with value: 0.7301587462425232.
Trial 195 finished with value: 0.682539701461792 and parameters: {'n_layers': 16, 'weight_decay': 1.4828683933589623e-10, 'n_units_l0': 59, 'n_units_l1': 34, 'n_units_l2': 96, 'n_units_l3': 100, 'n_units_l4': 9, 'n_units_l5': 47, 'n_units_l6': 13, 'n_units_l7': 23, 'n_units_l8': 28, 'n_units_l9': 27, 'n_units_l10': 64, 'n_units_l11': 8, 'n_units_l12': 45, 'n_units_l13': 24, 'n_units_l14': 79, 'n_units_l15': 5, 'optimizer': 'RMSprop', 'rmsprop_learning_rate': 0.019863659255817328, 'rmsprop_weight_decay': 0.9636675436797023, 'rmsprop_momentum': 0.003243920272747661}. Best is trial 111 with value: 0.7301587462425232.
Trial 196 finished with value: 0.5396825671195984 and parameters: {'n_layers': 16, 'weight_decay': 1.4351816136928657e-10, 'n_units_l0': 66, 'n_units_l1': 33, 'n_units_l2': 126, 'n_units_l3': 99, 'n_units_l4': 16, 'n_units_l5': 49, 'n_units_l6': 45, 'n_units_l7': 21, 'n_units_l8': 28, 'n_units_l9': 8, 'n_units_l10': 81, 'n_units_l11': 7, 'n_units_l12': 51, 'n_units_l13': 45, 'n_units_l14': 81, 'n_units_l15': 5, 'optimizer': 'RMSprop', 'rmsprop_learning_rate': 0.018672812288524458, 'rmsprop_weight_decay': 0.9630224127592767, 'rmsprop_momentum': 0.0033112380963212468}. Best is trial 111 with value: 0.7301587462425232.
Trial 197 finished with value: 0.5714285969734192 and parameters: {'n_layers': 18, 'weight_decay': 1.7683740102460384e-10, 'n_units_l0': 73, 'n_units_l1': 38, 'n_units_l2': 92, 'n_units_l3': 112, 'n_units_l4': 9, 'n_units_l5': 50, 'n_units_l6': 13, 'n_units_l7': 23, 'n_units_l8': 26, 'n_units_l9': 10, 'n_units_l10': 59, 'n_units_l11': 8, 'n_units_l12': 43, 'n_units_l13': 30, 'n_units_l14': 61, 'n_units_l15': 4, 'n_units_l16': 12, 'n_units_l17': 99, 'optimizer': 'Adam', 'adam_learning_rate': 6.880157718224772e-05}. Best is trial 111 with value: 0.7301587462425232.
Trial 198 finished with value: 0.5555555820465088 and parameters: {'n_layers': 16, 'weight_decay': 1.0080355297518638e-10, 'n_units_l0': 60, 'n_units_l1': 28, 'n_units_l2': 100, 'n_units_l3': 118, 'n_units_l4': 9, 'n_units_l5': 44, 'n_units_l6': 58, 'n_units_l7': 19, 'n_units_l8': 29, 'n_units_l9': 9, 'n_units_l10': 103, 'n_units_l11': 9, 'n_units_l12': 34, 'n_units_l13': 23, 'n_units_l14': 78, 'n_units_l15': 10, 'optimizer': 'RMSprop', 'rmsprop_learning_rate': 0.014130444305461719, 'rmsprop_weight_decay': 0.9231811726213887, 'rmsprop_momentum': 0.004247261171057547}. Best is trial 111 with value: 0.7301587462425232.
Trial 199 finished with value: 0.682539701461792 and parameters: {'n_layers': 17, 'weight_decay': 3.8177336404470737e-10, 'n_units_l0': 86, 'n_units_l1': 43, 'n_units_l2': 93, 'n_units_l3': 104, 'n_units_l4': 57, 'n_units_l5': 46, 'n_units_l6': 10, 'n_units_l7': 22, 'n_units_l8': 23, 'n_units_l9': 8, 'n_units_l10': 69, 'n_units_l11': 8, 'n_units_l12': 44, 'n_units_l13': 25, 'n_units_l14': 71, 'n_units_l15': 7, 'n_units_l16': 9, 'optimizer': 'RMSprop', 'rmsprop_learning_rate': 0.021216169148885147, 'rmsprop_weight_decay': 0.9668955533853251, 'rmsprop_momentum': 0.002496707994923645}. Best is trial 111 with value: 0.7301587462425232.
Trial 200 finished with value: 0.523809552192688 and parameters: {'n_layers': 19, 'weight_decay': 3.599218786400738e-10, 'n_units_l0': 85, 'n_units_l1': 43, 'n_units_l2': 90, 'n_units_l3': 101, 'n_units_l4': 53, 'n_units_l5': 40, 'n_units_l6': 10, 'n_units_l7': 23, 'n_units_l8': 25, 'n_units_l9': 9, 'n_units_l10': 63, 'n_units_l11': 8, 'n_units_l12': 44, 'n_units_l13': 28, 'n_units_l14': 72, 'n_units_l15': 7, 'n_units_l16': 6, 'n_units_l17': 65, 'n_units_l18': 85, 'optimizer': 'RMSprop', 'rmsprop_learning_rate': 0.02543750080965676, 'rmsprop_weight_decay': 0.9653211719047909, 'rmsprop_momentum': 0.004779826375983025}. Best is trial 111 with value: 0.7301587462425232.
Trial 201 finished with value: 0.5396825671195984 and parameters: {'n_layers': 17, 'weight_decay': 6.454587723734178e-10, 'n_units_l0': 96, 'n_units_l1': 56, 'n_units_l2': 90, 'n_units_l3': 106, 'n_units_l4': 57, 'n_units_l5': 54, 'n_units_l6': 11, 'n_units_l7': 22, 'n_units_l8': 23, 'n_units_l9': 8, 'n_units_l10': 65, 'n_units_l11': 8, 'n_units_l12': 52, 'n_units_l13': 24, 'n_units_l14': 65, 'n_units_l15': 6, 'n_units_l16': 9, 'optimizer': 'RMSprop', 'rmsprop_learning_rate': 0.019457029246733603, 'rmsprop_weight_decay': 0.9690305401226504, 'rmsprop_momentum': 0.0021386670866011376}. Best is trial 111 with value: 0.7301587462425232.
Trial 202 finished with value: 0.5555555820465088 and parameters: {'n_layers': 17, 'weight_decay': 2.171103868152773e-10, 'n_units_l0': 18, 'n_units_l1': 31, 'n_units_l2': 89, 'n_units_l3': 116, 'n_units_l4': 8, 'n_units_l5': 46, 'n_units_l6': 68, 'n_units_l7': 26, 'n_units_l8': 23, 'n_units_l9': 7, 'n_units_l10': 68, 'n_units_l11': 7, 'n_units_l12': 43, 'n_units_l13': 27, 'n_units_l14': 56, 'n_units_l15': 13, 'n_units_l16': 5, 'optimizer': 'RMSprop', 'rmsprop_learning_rate': 0.02534398995754371, 'rmsprop_weight_decay': 0.9629868258844612, 'rmsprop_momentum': 0.00301147473467938}. Best is trial 111 with value: 0.7301587462425232.
Trial 203 finished with value: 0.5396825671195984 and parameters: {'n_layers': 16, 'weight_decay': 4.545363771199949e-10, 'n_units_l0': 79, 'n_units_l1': 36, 'n_units_l2': 73, 'n_units_l3': 95, 'n_units_l4': 50, 'n_units_l5': 51, 'n_units_l6': 9, 'n_units_l7': 28, 'n_units_l8': 27, 'n_units_l9': 12, 'n_units_l10': 71, 'n_units_l11': 9, 'n_units_l12': 58, 'n_units_l13': 26, 'n_units_l14': 68, 'n_units_l15': 8, 'optimizer': 'RMSprop', 'rmsprop_learning_rate': 0.07740384305192528, 'rmsprop_weight_decay': 0.9847435508541554, 'rmsprop_momentum': 9.511265520460744e-05}. Best is trial 111 with value: 0.7301587462425232.
Trial 204 finished with value: 0.5873016119003296 and parameters: {'n_layers': 15, 'weight_decay': 2.8081775136853e-10, 'n_units_l0': 107, 'n_units_l1': 40, 'n_units_l2': 100, 'n_units_l3': 106, 'n_units_l4': 10, 'n_units_l5': 45, 'n_units_l6': 10, 'n_units_l7': 20, 'n_units_l8': 21, 'n_units_l9': 17, 'n_units_l10': 77, 'n_units_l11': 10, 'n_units_l12': 47, 'n_units_l13': 25, 'n_units_l14': 34, 'optimizer': 'RMSprop', 'rmsprop_learning_rate': 0.021708808010280273, 'rmsprop_weight_decay': 0.9677046069254516, 'rmsprop_momentum': 0.002473635203172226}. Best is trial 111 with value: 0.7301587462425232.
Trial 205 finished with value: 0.6190476417541504 and parameters: {'n_layers': 18, 'weight_decay': 1.6508909961400715e-10, 'n_units_l0': 87, 'n_units_l1': 32, 'n_units_l2': 77, 'n_units_l3': 119, 'n_units_l4': 65, 'n_units_l5': 56, 'n_units_l6': 11, 'n_units_l7': 24, 'n_units_l8': 33, 'n_units_l9': 29, 'n_units_l10': 61, 'n_units_l11': 7, 'n_units_l12': 38, 'n_units_l13': 20, 'n_units_l14': 43, 'n_units_l15': 11, 'n_units_l16': 9, 'n_units_l17': 28, 'optimizer': 'RMSprop', 'rmsprop_learning_rate': 0.015455489391262274, 'rmsprop_weight_decay': 0.9739093027894448, 'rmsprop_momentum': 0.001297352799774766}. Best is trial 111 with value: 0.7301587462425232.
Trial 206 finished with value: 0.682539701461792 and parameters: {'n_layers': 17, 'weight_decay': 2.126075744843256e-05, 'n_units_l0': 68, 'n_units_l1': 27, 'n_units_l2': 116, 'n_units_l3': 113, 'n_units_l4': 61, 'n_units_l5': 37, 'n_units_l6': 13, 'n_units_l7': 34, 'n_units_l8': 29, 'n_units_l9': 9, 'n_units_l10': 55, 'n_units_l11': 6, 'n_units_l12': 29, 'n_units_l13': 18, 'n_units_l14': 64, 'n_units_l15': 9, 'n_units_l16': 19, 'optimizer': 'RMSprop', 'rmsprop_learning_rate': 5.0597967580605695e-05, 'rmsprop_weight_decay': 0.9597249664376358, 'rmsprop_momentum': 0.0035310397024300904}. Best is trial 111 with value: 0.7301587462425232.
Trial 207 finished with value: 0.4920634925365448 and parameters: {'n_layers': 17, 'weight_decay': 3.606627027734603e-10, 'n_units_l0': 68, 'n_units_l1': 45, 'n_units_l2': 122, 'n_units_l3': 111, 'n_units_l4': 58, 'n_units_l5': 36, 'n_units_l6': 13, 'n_units_l7': 34, 'n_units_l8': 31, 'n_units_l9': 10, 'n_units_l10': 54, 'n_units_l11': 6, 'n_units_l12': 29, 'n_units_l13': 19, 'n_units_l14': 63, 'n_units_l15': 9, 'n_units_l16': 14, 'optimizer': 'RMSprop', 'rmsprop_learning_rate': 0.006759830550586634, 'rmsprop_weight_decay': 0.9562032382368248, 'rmsprop_momentum': 0.0038201617231013747}. Best is trial 111 with value: 0.7301587462425232.
Trial 208 finished with value: 0.4761904776096344 and parameters: {'n_layers': 17, 'weight_decay': 2.0321965187795238e-05, 'n_units_l0': 75, 'n_units_l1': 50, 'n_units_l2': 112, 'n_units_l3': 128, 'n_units_l4': 73, 'n_units_l5': 41, 'n_units_l6': 14, 'n_units_l7': 39, 'n_units_l8': 29, 'n_units_l9': 9, 'n_units_l10': 88, 'n_units_l11': 6, 'n_units_l12': 34, 'n_units_l13': 18, 'n_units_l14': 57, 'n_units_l15': 7, 'n_units_l16': 19, 'optimizer': 'RMSprop', 'rmsprop_learning_rate': 0.012685268049248015, 'rmsprop_weight_decay': 0.9603980929330661, 'rmsprop_momentum': 0.005756458146502779}. Best is trial 111 with value: 0.7301587462425232.
Trial 209 finished with value: 0.60317462682724 and parameters: {'n_layers': 18, 'weight_decay': 0.0007309821382143988, 'n_units_l0': 59, 'n_units_l1': 27, 'n_units_l2': 111, 'n_units_l3': 96, 'n_units_l4': 62, 'n_units_l5': 38, 'n_units_l6': 12, 'n_units_l7': 30, 'n_units_l8': 25, 'n_units_l9': 8, 'n_units_l10': 52, 'n_units_l11': 11, 'n_units_l12': 32, 'n_units_l13': 21, 'n_units_l14': 73, 'n_units_l15': 11, 'n_units_l16': 26, 'n_units_l17': 4, 'optimizer': 'RMSprop', 'rmsprop_learning_rate': 0.08454446444059632, 'rmsprop_weight_decay': 0.9526670837159024, 'rmsprop_momentum': 0.00012099293192671239}. Best is trial 111 with value: 0.7301587462425232.
Trial 210 finished with value: 0.60317462682724 and parameters: {'n_layers': 16, 'weight_decay': 6.350686806594177e-10, 'n_units_l0': 65, 'n_units_l1': 11, 'n_units_l2': 98, 'n_units_l3': 103, 'n_units_l4': 57, 'n_units_l5': 34, 'n_units_l6': 13, 'n_units_l7': 25, 'n_units_l8': 11, 'n_units_l9': 9, 'n_units_l10': 120, 'n_units_l11': 13, 'n_units_l12': 39, 'n_units_l13': 17, 'n_units_l14': 16, 'n_units_l15': 24, 'optimizer': 'RMSprop', 'rmsprop_learning_rate': 0.00011879998640392597, 'rmsprop_weight_decay': 0.9600840073746336, 'rmsprop_momentum': 0.003446731702905912}. Best is trial 111 with value: 0.7301587462425232.
Trial 211 finished with value: 0.6349206566810608 and parameters: {'n_layers': 15, 'weight_decay': 5.7649664919780615e-05, 'n_units_l0': 71, 'n_units_l1': 26, 'n_units_l2': 103, 'n_units_l3': 112, 'n_units_l4': 51, 'n_units_l5': 47, 'n_units_l6': 5, 'n_units_l7': 19, 'n_units_l8': 20, 'n_units_l9': 8, 'n_units_l10': 58, 'n_units_l11': 8, 'n_units_l12': 29, 'n_units_l13': 15, 'n_units_l14': 48, 'optimizer': 'RMSprop', 'rmsprop_learning_rate': 1.965279530490433e-05, 'rmsprop_weight_decay': 0.9899683104205464, 'rmsprop_momentum': 0.0026901740517743513}. Best is trial 111 with value: 0.7301587462425232.
Trial 212 finished with value: 0.5555555820465088 and parameters: {'n_layers': 16, 'weight_decay': 0.0001565579587974685, 'n_units_l0': 82, 'n_units_l1': 29, 'n_units_l2': 94, 'n_units_l3': 22, 'n_units_l4': 11, 'n_units_l5': 43, 'n_units_l6': 15, 'n_units_l7': 32, 'n_units_l8': 36, 'n_units_l9': 7, 'n_units_l10': 48, 'n_units_l11': 9, 'n_units_l12': 41, 'n_units_l13': 24, 'n_units_l14': 66, 'n_units_l15': 16, 'optimizer': 'RMSprop', 'rmsprop_learning_rate': 0.06954719636900596, 'rmsprop_weight_decay': 0.9632179334738167, 'rmsprop_momentum': 8.336326281253354e-05}. Best is trial 111 with value: 0.7301587462425232.
Trial 213 finished with value: 0.6190476417541504 and parameters: {'n_layers': 15, 'weight_decay': 4.628143326991569e-06, 'n_units_l0': 98, 'n_units_l1': 23, 'n_units_l2': 75, 'n_units_l3': 119, 'n_units_l4': 7, 'n_units_l5': 50, 'n_units_l6': 11, 'n_units_l7': 10, 'n_units_l8': 27, 'n_units_l9': 10, 'n_units_l10': 64, 'n_units_l11': 5, 'n_units_l12': 4, 'n_units_l13': 22, 'n_units_l14': 29, 'optimizer': 'RMSprop', 'rmsprop_learning_rate': 5.910234392206801e-05, 'rmsprop_weight_decay': 0.9871780798726074, 'rmsprop_momentum': 0.011920522525055637}. Best is trial 111 with value: 0.7301587462425232.
Trial 214 finished with value: 0.60317462682724 and parameters: {'n_layers': 17, 'weight_decay': 1.1214731368417994e-05, 'n_units_l0': 55, 'n_units_l1': 35, 'n_units_l2': 24, 'n_units_l3': 108, 'n_units_l4': 45, 'n_units_l5': 39, 'n_units_l6': 12, 'n_units_l7': 22, 'n_units_l8': 22, 'n_units_l9': 11, 'n_units_l10': 55, 'n_units_l11': 12, 'n_units_l12': 25, 'n_units_l13': 33, 'n_units_l14': 38, 'n_units_l15': 8, 'n_units_l16': 22, 'optimizer': 'RMSprop', 'rmsprop_learning_rate': 4.2138413660404875e-05, 'rmsprop_weight_decay': 0.9818234097080578, 'rmsprop_momentum': 0.0001468517817166854}. Best is trial 111 with value: 0.7301587462425232.
Trial 215 finished with value: 0.523809552192688 and parameters: {'n_layers': 17, 'weight_decay': 2.3106441399850234e-10, 'n_units_l0': 31, 'n_units_l1': 32, 'n_units_l2': 21, 'n_units_l3': 120, 'n_units_l4': 23, 'n_units_l5': 44, 'n_units_l6': 9, 'n_units_l7': 20, 'n_units_l8': 23, 'n_units_l9': 8, 'n_units_l10': 71, 'n_units_l11': 7, 'n_units_l12': 49, 'n_units_l13': 38, 'n_units_l14': 59, 'n_units_l15': 6, 'n_units_l16': 31, 'optimizer': 'RMSprop', 'rmsprop_learning_rate': 0.00942786579046926, 'rmsprop_weight_decay': 0.9697520116321222, 'rmsprop_momentum': 0.00446789582073235}. Best is trial 111 with value: 0.7301587462425232.
Trial 216 finished with value: 0.523809552192688 and parameters: {'n_layers': 14, 'weight_decay': 1.4334886562805933e-10, 'n_units_l0': 64, 'n_units_l1': 9, 'n_units_l2': 84, 'n_units_l3': 51, 'n_units_l4': 54, 'n_units_l5': 20, 'n_units_l6': 4, 'n_units_l7': 28, 'n_units_l8': 31, 'n_units_l9': 9, 'n_units_l10': 50, 'n_units_l11': 9, 'n_units_l12': 27, 'n_units_l13': 27, 'optimizer': 'RMSprop', 'rmsprop_learning_rate': 0.004191359315085974, 'rmsprop_weight_decay': 0.9578779016236488, 'rmsprop_momentum': 0.00084972220932288}. Best is trial 111 with value: 0.7301587462425232.
Trial 217 finished with value: 0.5714285969734192 and parameters: {'n_layers': 16, 'weight_decay': 0.0002161537301751613, 'n_units_l0': 92, 'n_units_l1': 25, 'n_units_l2': 64, 'n_units_l3': 87, 'n_units_l4': 19, 'n_units_l5': 37, 'n_units_l6': 10, 'n_units_l7': 37, 'n_units_l8': 25, 'n_units_l9': 42, 'n_units_l10': 80, 'n_units_l11': 10, 'n_units_l12': 56, 'n_units_l13': 7, 'n_units_l14': 80, 'n_units_l15': 9, 'optimizer': 'RMSprop', 'rmsprop_learning_rate': 1.2929148243187905e-05, 'rmsprop_weight_decay': 0.9665858165251672, 'rmsprop_momentum': 5.964700333283512e-05}. Best is trial 111 with value: 0.7301587462425232.
