Trial 289 finished with value: 0.60317462682724 and parameters: {'n_layers': 16, 'weight_decay': 4.1293740252105953e-10, 'n_units_l0': 74, 'n_units_l1': 25, 'n_units_l2': 113, 'n_units_l3': 80, 'n_units_l4': 68, 'n_units_l5': 46, 'n_units_l6': 13, 'n_units_l7': 28, 'n_units_l8': 9, 'n_units_l9': 9, 'n_units_l10': 34, 'n_units_l11': 7, 'n_units_l12': 42, 'n_units_l13': 22, 'n_units_l14': 68, 'n_units_l15': 16, 'optimizer': 'RMSprop', 'rmsprop_learning_rate': 0.00784011381070301, 'rmsprop_weight_decay': 0.9895885416710493, 'rmsprop_momentum': 2.9891632921729267e-05}. Best is trial 275 with value: 0.7460317611694336.
Trial 290 finished with value: 0.6190476417541504 and parameters: {'n_layers': 19, 'weight_decay': 1.4586062039504546e-10, 'n_units_l0': 85, 'n_units_l1': 34, 'n_units_l2': 60, 'n_units_l3': 108, 'n_units_l4': 57, 'n_units_l5': 12, 'n_units_l6': 10, 'n_units_l7': 22, 'n_units_l8': 27, 'n_units_l9': 9, 'n_units_l10': 71, 'n_units_l11': 6, 'n_units_l12': 27, 'n_units_l13': 34, 'n_units_l14': 59, 'n_units_l15': 11, 'n_units_l16': 10, 'n_units_l17': 79, 'n_units_l18': 45, 'optimizer': 'RMSprop', 'rmsprop_learning_rate': 0.03438735790412357, 'rmsprop_weight_decay': 0.985479579259728, 'rmsprop_momentum': 0.0041134751295252205}. Best is trial 275 with value: 0.7460317611694336.
Trial 291 finished with value: 0.5396825671195984 and parameters: {'n_layers': 16, 'weight_decay': 2.498414062492904e-10, 'n_units_l0': 104, 'n_units_l1': 11, 'n_units_l2': 83, 'n_units_l3': 8, 'n_units_l4': 45, 'n_units_l5': 18, 'n_units_l6': 12, 'n_units_l7': 20, 'n_units_l8': 23, 'n_units_l9': 11, 'n_units_l10': 53, 'n_units_l11': 8, 'n_units_l12': 16, 'n_units_l13': 15, 'n_units_l14': 16, 'n_units_l15': 40, 'optimizer': 'RMSprop', 'rmsprop_learning_rate': 0.05192648304051583, 'rmsprop_weight_decay': 0.9576981856841514, 'rmsprop_momentum': 7.61660608025756e-05}. Best is trial 275 with value: 0.7460317611694336.
Trial 292 finished with value: 0.460317462682724 and parameters: {'n_layers': 15, 'weight_decay': 6.996239940731844e-10, 'n_units_l0': 77, 'n_units_l1': 55, 'n_units_l2': 28, 'n_units_l3': 27, 'n_units_l4': 6, 'n_units_l5': 30, 'n_units_l6': 13, 'n_units_l7': 24, 'n_units_l8': 21, 'n_units_l9': 7, 'n_units_l10': 40, 'n_units_l11': 16, 'n_units_l12': 11, 'n_units_l13': 19, 'n_units_l14': 85, 'optimizer': 'RMSprop', 'rmsprop_learning_rate': 0.005820294196001976, 'rmsprop_weight_decay': 0.9805526158841051, 'rmsprop_momentum': 9.756204273610433e-05}. Best is trial 275 with value: 0.7460317611694336.
Trial 293 finished with value: 0.6190476417541504 and parameters: {'n_layers': 17, 'weight_decay': 1.1267642140601812e-09, 'n_units_l0': 64, 'n_units_l1': 48, 'n_units_l2': 104, 'n_units_l3': 120, 'n_units_l4': 54, 'n_units_l5': 58, 'n_units_l6': 14, 'n_units_l7': 9, 'n_units_l8': 24, 'n_units_l9': 10, 'n_units_l10': 11, 'n_units_l11': 19, 'n_units_l12': 13, 'n_units_l13': 24, 'n_units_l14': 12, 'n_units_l15': 12, 'n_units_l16': 15, 'optimizer': 'RMSprop', 'rmsprop_learning_rate': 0.010015013501658867, 'rmsprop_weight_decay': 0.9877691391215044, 'rmsprop_momentum': 0.0022522507108634973}. Best is trial 275 with value: 0.7460317611694336.
Trial 294 finished with value: 0.5555555820465088 and parameters: {'n_layers': 16, 'weight_decay': 3.4180521209408025e-10, 'n_units_l0': 96, 'n_units_l1': 9, 'n_units_l2': 24, 'n_units_l3': 36, 'n_units_l4': 7, 'n_units_l5': 22, 'n_units_l6': 11, 'n_units_l7': 10, 'n_units_l8': 34, 'n_units_l9': 8, 'n_units_l10': 99, 'n_units_l11': 12, 'n_units_l12': 30, 'n_units_l13': 27, 'n_units_l14': 44, 'n_units_l15': 7, 'optimizer': 'RMSprop', 'rmsprop_learning_rate': 0.012828255234725798, 'rmsprop_weight_decay': 0.9110274989151078, 'rmsprop_momentum': 0.0025670613416426424}. Best is trial 275 with value: 0.7460317611694336.
Trial 295 finished with value: 0.60317462682724 and parameters: {'n_layers': 1, 'weight_decay': 1.7304646309022446e-10, 'n_units_l0': 20, 'optimizer': 'SGD', 'sgd_opt_learning_rate': 5.7810819756145e-05, 'sgd_opt_momentum': 0.000519521865415488}. Best is trial 275 with value: 0.7460317611694336.
Trial 296 finished with value: 0.523809552192688 and parameters: {'n_layers': 15, 'weight_decay': 2.346037432151096e-10, 'n_units_l0': 89, 'n_units_l1': 10, 'n_units_l2': 4, 'n_units_l3': 107, 'n_units_l4': 50, 'n_units_l5': 4, 'n_units_l6': 10, 'n_units_l7': 8, 'n_units_l8': 8, 'n_units_l9': 21, 'n_units_l10': 7, 'n_units_l11': 8, 'n_units_l12': 14, 'n_units_l13': 17, 'n_units_l14': 72, 'optimizer': 'RMSprop', 'rmsprop_learning_rate': 0.07890341118407947, 'rmsprop_weight_decay': 0.976250756643985, 'rmsprop_momentum': 4.921398900682386e-05}. Best is trial 275 with value: 0.7460317611694336.
Trial 297 finished with value: 0.5396825671195984 and parameters: {'n_layers': 17, 'weight_decay': 4.938001072426174e-10, 'n_units_l0': 16, 'n_units_l1': 8, 'n_units_l2': 16, 'n_units_l3': 90, 'n_units_l4': 40, 'n_units_l5': 20, 'n_units_l6': 12, 'n_units_l7': 7, 'n_units_l8': 22, 'n_units_l9': 9, 'n_units_l10': 88, 'n_units_l11': 13, 'n_units_l12': 47, 'n_units_l13': 86, 'n_units_l14': 64, 'n_units_l15': 5, 'n_units_l16': 4, 'optimizer': 'RMSprop', 'rmsprop_learning_rate': 0.0010077603307837558, 'rmsprop_weight_decay': 0.9837612920328208, 'rmsprop_momentum': 0.005614528771166953}. Best is trial 275 with value: 0.7460317611694336.
Trial 298 finished with value: 0.6507936716079712 and parameters: {'n_layers': 16, 'weight_decay': 1.0236454042728013e-10, 'n_units_l0': 113, 'n_units_l1': 38, 'n_units_l2': 81, 'n_units_l3': 128, 'n_units_l4': 14, 'n_units_l5': 41, 'n_units_l6': 15, 'n_units_l7': 36, 'n_units_l8': 9, 'n_units_l9': 18, 'n_units_l10': 127, 'n_units_l11': 7, 'n_units_l12': 23, 'n_units_l13': 21, 'n_units_l14': 56, 'n_units_l15': 13, 'optimizer': 'RMSprop', 'rmsprop_learning_rate': 0.0207458063662696, 'rmsprop_weight_decay': 0.989807552075361, 'rmsprop_momentum': 0.0010890170986040313}. Best is trial 275 with value: 0.7460317611694336.
Trial 299 finished with value: 0.5714285969734192 and parameters: {'n_layers': 14, 'weight_decay': 1.655108105900014e-09, 'n_units_l0': 69, 'n_units_l1': 29, 'n_units_l2': 94, 'n_units_l3': 113, 'n_units_l4': 5, 'n_units_l5': 44, 'n_units_l6': 5, 'n_units_l7': 21, 'n_units_l8': 20, 'n_units_l9': 9, 'n_units_l10': 66, 'n_units_l11': 10, 'n_units_l12': 12, 'n_units_l13': 5, 'optimizer': 'RMSprop', 'rmsprop_learning_rate': 0.06001194678442428, 'rmsprop_weight_decay': 0.954472133354855, 'rmsprop_momentum': 6.0326875972333364e-05}. Best is trial 275 with value: 0.7460317611694336.
Trial 300 finished with value: 0.5396825671195984 and parameters: {'n_layers': 18, 'weight_decay': 2.7647344301961567e-09, 'n_units_l0': 81, 'n_units_l1': 9, 'n_units_l2': 35, 'n_units_l3': 46, 'n_units_l4': 47, 'n_units_l5': 17, 'n_units_l6': 9, 'n_units_l7': 31, 'n_units_l8': 5, 'n_units_l9': 8, 'n_units_l10': 77, 'n_units_l11': 6, 'n_units_l12': 10, 'n_units_l13': 6, 'n_units_l14': 52, 'n_units_l15': 9, 'n_units_l16': 20, 'n_units_l17': 11, 'optimizer': 'RMSprop', 'rmsprop_learning_rate': 0.017027192733369584, 'rmsprop_weight_decay': 0.9826409919492777, 'rmsprop_momentum': 0.0015910752519151241}. Best is trial 275 with value: 0.7460317611694336.
Trial 301 finished with value: 0.6190476417541504 and parameters: {'n_layers': 15, 'weight_decay': 3.0379865396511256e-10, 'n_units_l0': 70, 'n_units_l1': 36, 'n_units_l2': 26, 'n_units_l3': 24, 'n_units_l4': 8, 'n_units_l5': 37, 'n_units_l6': 13, 'n_units_l7': 26, 'n_units_l8': 26, 'n_units_l9': 11, 'n_units_l10': 48, 'n_units_l11': 14, 'n_units_l12': 10, 'n_units_l13': 8, 'n_units_l14': 48, 'optimizer': 'RMSprop', 'rmsprop_learning_rate': 0.08691431606136961, 'rmsprop_weight_decay': 0.986007985304655, 'rmsprop_momentum': 8.978531296106088e-05}. Best is trial 275 with value: 0.7460317611694336.
Trial 302 finished with value: 0.60317462682724 and parameters: {'n_layers': 16, 'weight_decay': 3.3007887403009555e-08, 'n_units_l0': 101, 'n_units_l1': 10, 'n_units_l2': 38, 'n_units_l3': 101, 'n_units_l4': 41, 'n_units_l5': 49, 'n_units_l6': 11, 'n_units_l7': 23, 'n_units_l8': 29, 'n_units_l9': 15, 'n_units_l10': 86, 'n_units_l11': 91, 'n_units_l12': 12, 'n_units_l13': 7, 'n_units_l14': 39, 'n_units_l15': 20, 'optimizer': 'RMSprop', 'rmsprop_learning_rate': 0.09719423311663017, 'rmsprop_weight_decay': 0.9618535419532996, 'rmsprop_momentum': 0.003135745042996535}. Best is trial 275 with value: 0.7460317611694336.
Trial 303 finished with value: 0.5079365372657776 and parameters: {'n_layers': 14, 'weight_decay': 1.333158610166102e-10, 'n_units_l0': 57, 'n_units_l1': 40, 'n_units_l2': 29, 'n_units_l3': 29, 'n_units_l4': 7, 'n_units_l5': 40, 'n_units_l6': 14, 'n_units_l7': 39, 'n_units_l8': 7, 'n_units_l9': 7, 'n_units_l10': 15, 'n_units_l11': 11, 'n_units_l12': 36, 'n_units_l13': 25, 'optimizer': 'RMSprop', 'rmsprop_learning_rate': 6.871136008946225e-05, 'rmsprop_weight_decay': 0.9789703395495004, 'rmsprop_momentum': 0.00010948217157518443}. Best is trial 275 with value: 0.7460317611694336.
Trial 304 finished with value: 0.60317462682724 and parameters: {'n_layers': 15, 'weight_decay': 8.523386089255355e-10, 'n_units_l0': 74, 'n_units_l1': 11, 'n_units_l2': 67, 'n_units_l3': 42, 'n_units_l4': 43, 'n_units_l5': 54, 'n_units_l6': 15, 'n_units_l7': 28, 'n_units_l8': 42, 'n_units_l9': 10, 'n_units_l10': 93, 'n_units_l11': 9, 'n_units_l12': 11, 'n_units_l13': 32, 'n_units_l14': 72, 'optimizer': 'RMSprop', 'rmsprop_learning_rate': 0.0012675490968833438, 'rmsprop_weight_decay': 0.9380815649304299, 'rmsprop_momentum': 7.272429732609355e-05}. Best is trial 275 with value: 0.7460317611694336.
Trial 305 finished with value: 0.5555555820465088 and parameters: {'n_layers': 17, 'weight_decay': 5.128159808488061e-10, 'n_units_l0': 63, 'n_units_l1': 27, 'n_units_l2': 77, 'n_units_l3': 20, 'n_units_l4': 54, 'n_units_l5': 19, 'n_units_l6': 10, 'n_units_l7': 22, 'n_units_l8': 19, 'n_units_l9': 8, 'n_units_l10': 113, 'n_units_l11': 16, 'n_units_l12': 39, 'n_units_l13': 23, 'n_units_l14': 63, 'n_units_l15': 35, 'n_units_l16': 7, 'optimizer': 'RMSprop', 'rmsprop_learning_rate': 0.03891685961167299, 'rmsprop_weight_decay': 0.9591846226630272, 'rmsprop_momentum': 0.00013178910519518687}. Best is trial 275 with value: 0.7460317611694336.
Trial 306 finished with value: 0.761904776096344 and parameters: {'n_layers': 16, 'weight_decay': 1.9084298310896022e-10, 'n_units_l0': 91, 'n_units_l1': 31, 'n_units_l2': 86, 'n_units_l3': 21, 'n_units_l4': 47, 'n_units_l5': 10, 'n_units_l6': 34, 'n_units_l7': 19, 'n_units_l8': 25, 'n_units_l9': 9, 'n_units_l10': 103, 'n_units_l11': 12, 'n_units_l12': 28, 'n_units_l13': 20, 'n_units_l14': 34, 'n_units_l15': 6, 'optimizer': 'RMSprop', 'rmsprop_learning_rate': 0.06755505881871705, 'rmsprop_weight_decay': 0.9665220285501586, 'rmsprop_momentum': 0.00023833866647308694}. Best is trial 306 with value: 0.761904776096344.
Trial 307 finished with value: 0.7301587462425232 and parameters: {'n_layers': 5, 'weight_decay': 1.7925009818752566e-10, 'n_units_l0': 91, 'n_units_l1': 32, 'n_units_l2': 90, 'n_units_l3': 15, 'n_units_l4': 49, 'optimizer': 'RMSprop', 'rmsprop_learning_rate': 0.06496129171781595, 'rmsprop_weight_decay': 0.9660302703489114, 'rmsprop_momentum': 0.00018754252243681412}. Best is trial 306 with value: 0.761904776096344.
Trial 308 finished with value: 0.6190476417541504 and parameters: {'n_layers': 14, 'weight_decay': 1.69689806225411e-10, 'n_units_l0': 86, 'n_units_l1': 31, 'n_units_l2': 95, 'n_units_l3': 12, 'n_units_l4': 49, 'n_units_l5': 9, 'n_units_l6': 32, 'n_units_l7': 18, 'n_units_l8': 26, 'n_units_l9': 10, 'n_units_l10': 104, 'n_units_l11': 12, 'n_units_l12': 24, 'n_units_l13': 47, 'optimizer': 'SGD', 'sgd_opt_learning_rate': 0.00012771062190618772, 'sgd_opt_momentum': 0.028166359192789377}. Best is trial 306 with value: 0.761904776096344.
Trial 309 finished with value: 0.6190476417541504 and parameters: {'n_layers': 9, 'weight_decay': 1.310773055640998e-10, 'n_units_l0': 93, 'n_units_l1': 29, 'n_units_l2': 87, 'n_units_l3': 17, 'n_units_l4': 60, 'n_units_l5': 10, 'n_units_l6': 35, 'n_units_l7': 19, 'n_units_l8': 24, 'optimizer': 'RMSprop', 'rmsprop_learning_rate': 0.0644397783060252, 'rmsprop_weight_decay': 0.9668482339757415, 'rmsprop_momentum': 0.00025564139655871265}. Best is trial 306 with value: 0.761904776096344.
Trial 310 finished with value: 0.6349206566810608 and parameters: {'n_layers': 15, 'weight_decay': 2.0934123438270827e-10, 'n_units_l0': 89, 'n_units_l1': 32, 'n_units_l2': 102, 'n_units_l3': 13, 'n_units_l4': 53, 'n_units_l5': 7, 'n_units_l6': 14, 'n_units_l7': 20, 'n_units_l8': 28, 'n_units_l9': 13, 'n_units_l10': 96, 'n_units_l11': 13, 'n_units_l12': 4, 'n_units_l13': 40, 'n_units_l14': 35, 'optimizer': 'RMSprop', 'rmsprop_learning_rate': 0.052240093087625054, 'rmsprop_weight_decay': 0.9701065267977905, 'rmsprop_momentum': 0.00017570006787644008}. Best is trial 306 with value: 0.761904776096344.
Trial 311 finished with value: 0.5873016119003296 and parameters: {'n_layers': 14, 'weight_decay': 1.6636040150148388e-10, 'n_units_l0': 81, 'n_units_l1': 27, 'n_units_l2': 87, 'n_units_l3': 16, 'n_units_l4': 51, 'n_units_l5': 13, 'n_units_l6': 29, 'n_units_l7': 17, 'n_units_l8': 22, 'n_units_l9': 12, 'n_units_l10': 89, 'n_units_l11': 11, 'n_units_l12': 26, 'n_units_l13': 20, 'optimizer': 'Adam', 'adam_learning_rate': 4.198778774361076e-05}. Best is trial 306 with value: 0.761904776096344.
Trial 312 finished with value: 0.5555555820465088 and parameters: {'n_layers': 2, 'weight_decay': 2.4054419942045154e-10, 'n_units_l0': 77, 'n_units_l1': 25, 'optimizer': 'RMSprop', 'rmsprop_learning_rate': 0.06916847434164873, 'rmsprop_weight_decay': 0.9658082058895656, 'rmsprop_momentum': 0.00016247941720177284}. Best is trial 306 with value: 0.761904776096344.
Trial 313 finished with value: 0.6349206566810608 and parameters: {'n_layers': 6, 'weight_decay': 1.0163120837936364e-10, 'n_units_l0': 94, 'n_units_l1': 30, 'n_units_l2': 22, 'n_units_l3': 15, 'n_units_l4': 56, 'n_units_l5': 45, 'optimizer': 'RMSprop', 'rmsprop_learning_rate': 0.07778256001010067, 'rmsprop_weight_decay': 0.964060992417249, 'rmsprop_momentum': 0.00023644449804028934}. Best is trial 306 with value: 0.761904776096344.
Trial 314 finished with value: 0.6349206566810608 and parameters: {'n_layers': 24, 'weight_decay': 1.369980200068842e-10, 'n_units_l0': 86, 'n_units_l1': 32, 'n_units_l2': 93, 'n_units_l3': 19, 'n_units_l4': 64, 'n_units_l5': 32, 'n_units_l6': 16, 'n_units_l7': 35, 'n_units_l8': 24, 'n_units_l9': 19, 'n_units_l10': 80, 'n_units_l11': 13, 'n_units_l12': 22, 'n_units_l13': 17, 'n_units_l14': 31, 'n_units_l15': 6, 'n_units_l16': 5, 'n_units_l17': 8, 'n_units_l18': 5, 'n_units_l19': 121, 'n_units_l20': 8, 'n_units_l21': 16, 'n_units_l22': 34, 'n_units_l23': 25, 'optimizer': 'RMSprop', 'rmsprop_learning_rate': 0.04537275122335026, 'rmsprop_weight_decay': 0.9688792865066508, 'rmsprop_momentum': 0.024925909480075448}. Best is trial 306 with value: 0.761904776096344.
Trial 315 finished with value: 0.60317462682724 and parameters: {'n_layers': 16, 'weight_decay': 0.0006606610124527535, 'n_units_l0': 82, 'n_units_l1': 23, 'n_units_l2': 75, 'n_units_l3': 9, 'n_units_l4': 47, 'n_units_l5': 35, 'n_units_l6': 16, 'n_units_l7': 9, 'n_units_l8': 30, 'n_units_l9': 11, 'n_units_l10': 12, 'n_units_l11': 12, 'n_units_l12': 9, 'n_units_l13': 7, 'n_units_l14': 28, 'n_units_l15': 6, 'optimizer': 'RMSprop', 'rmsprop_learning_rate': 0.0583404742985433, 'rmsprop_weight_decay': 0.9710986578277809, 'rmsprop_momentum': 0.00021033517599483256}. Best is trial 306 with value: 0.761904776096344.
Trial 316 finished with value: 0.5396825671195984 and parameters: {'n_layers': 15, 'weight_decay': 2.0479413045890762e-10, 'n_units_l0': 99, 'n_units_l1': 12, 'n_units_l2': 102, 'n_units_l3': 21, 'n_units_l4': 49, 'n_units_l5': 8, 'n_units_l6': 26, 'n_units_l7': 10, 'n_units_l8': 25, 'n_units_l9': 17, 'n_units_l10': 23, 'n_units_l11': 5, 'n_units_l12': 45, 'n_units_l13': 18, 'n_units_l14': 33, 'optimizer': 'RMSprop', 'rmsprop_learning_rate': 0.06592533579267226, 'rmsprop_weight_decay': 0.960598590077458, 'rmsprop_momentum': 0.00014830378625069416}. Best is trial 306 with value: 0.761904776096344.
Trial 317 finished with value: 0.5396825671195984 and parameters: {'n_layers': 3, 'weight_decay': 1.4657744989352408e-10, 'n_units_l0': 61, 'n_units_l1': 28, 'n_units_l2': 32, 'optimizer': 'RMSprop', 'rmsprop_learning_rate': 0.08833075858800037, 'rmsprop_weight_decay': 0.9735446184259708, 'rmsprop_momentum': 0.00012976460630317928}. Best is trial 306 with value: 0.761904776096344.
Trial 318 finished with value: 0.523809552192688 and parameters: {'n_layers': 16, 'weight_decay': 2.7258318856219895e-10, 'n_units_l0': 72, 'n_units_l1': 34, 'n_units_l2': 88, 'n_units_l3': 12, 'n_units_l4': 79, 'n_units_l5': 15, 'n_units_l6': 13, 'n_units_l7': 46, 'n_units_l8': 32, 'n_units_l9': 21, 'n_units_l10': 105, 'n_units_l11': 10, 'n_units_l12': 28, 'n_units_l13': 29, 'n_units_l14': 42, 'n_units_l15': 8, 'optimizer': 'RMSprop', 'rmsprop_learning_rate': 0.08011375835463637, 'rmsprop_weight_decay': 0.9646274296636258, 'rmsprop_momentum': 0.00010418682101015295}. Best is trial 306 with value: 0.761904776096344.
Trial 319 finished with value: 0.523809552192688 and parameters: {'n_layers': 13, 'weight_decay': 1.8959937002471076e-10, 'n_units_l0': 89, 'n_units_l1': 10, 'n_units_l2': 73, 'n_units_l3': 117, 'n_units_l4': 56, 'n_units_l5': 26, 'n_units_l6': 15, 'n_units_l7': 30, 'n_units_l8': 27, 'n_units_l9': 23, 'n_units_l10': 9, 'n_units_l11': 11, 'n_units_l12': 113, 'optimizer': 'RMSprop', 'rmsprop_learning_rate': 0.03418442862807315, 'rmsprop_weight_decay': 0.9674551247280697, 'rmsprop_momentum': 0.00019801923551418591}. Best is trial 306 with value: 0.761904776096344.
Trial 320 finished with value: 0.5714285969734192 and parameters: {'n_layers': 14, 'weight_decay': 1.2748723166742235e-09, 'n_units_l0': 68, 'n_units_l1': 9, 'n_units_l2': 41, 'n_units_l3': 22, 'n_units_l4': 46, 'n_units_l5': 10, 'n_units_l6': 12, 'n_units_l7': 19, 'n_units_l8': 20, 'n_units_l9': 37, 'n_units_l10': 21, 'n_units_l11': 12, 'n_units_l12': 25, 'n_units_l13': 37, 'optimizer': 'RMSprop', 'rmsprop_learning_rate': 0.043267077933363846, 'rmsprop_weight_decay': 0.9636645739004418, 'rmsprop_momentum': 0.0002809365595921303}. Best is trial 306 with value: 0.761904776096344.
Trial 321 finished with value: 0.4444444477558136 and parameters: {'n_layers': 4, 'weight_decay': 1.326099273531316e-08, 'n_units_l0': 80, 'n_units_l1': 11, 'n_units_l2': 112, 'n_units_l3': 98, 'optimizer': 'SGD', 'sgd_opt_learning_rate': 2.1411741825986227e-05, 'sgd_opt_momentum': 0.0001571318587355356}. Best is trial 306 with value: 0.761904776096344.
Trial 322 finished with value: 0.60317462682724 and parameters: {'n_layers': 15, 'weight_decay': 2.939324117571986e-10, 'n_units_l0': 95, 'n_units_l1': 8, 'n_units_l2': 55, 'n_units_l3': 14, 'n_units_l4': 6, 'n_units_l5': 63, 'n_units_l6': 7, 'n_units_l7': 33, 'n_units_l8': 23, 'n_units_l9': 10, 'n_units_l10': 13, 'n_units_l11': 57, 'n_units_l12': 9, 'n_units_l13': 8, 'n_units_l14': 37, 'optimizer': 'RMSprop', 'rmsprop_learning_rate': 0.05236169443494789, 'rmsprop_weight_decay': 0.9226009618029021, 'rmsprop_momentum': 0.0018013877114216618}. Best is trial 306 with value: 0.761904776096344.
Trial 323 finished with value: 0.5555555820465088 and parameters: {'n_layers': 16, 'weight_decay': 3.836013656228198e-09, 'n_units_l0': 114, 'n_units_l1': 29, 'n_units_l2': 100, 'n_units_l3': 10, 'n_units_l4': 52, 'n_units_l5': 9, 'n_units_l6': 14, 'n_units_l7': 61, 'n_units_l8': 17, 'n_units_l9': 9, 'n_units_l10': 72, 'n_units_l11': 11, 'n_units_l12': 33, 'n_units_l13': 15, 'n_units_l14': 108, 'n_units_l15': 7, 'optimizer': 'RMSprop', 'rmsprop_learning_rate': 0.09885085909977902, 'rmsprop_weight_decay': 0.9866371056623328, 'rmsprop_momentum': 8.360679805466414e-05}. Best is trial 306 with value: 0.761904776096344.
Trial 324 finished with value: 0.5396825671195984 and parameters: {'n_layers': 10, 'weight_decay': 1.2256268741912722e-10, 'n_units_l0': 76, 'n_units_l1': 26, 'n_units_l2': 62, 'n_units_l3': 25, 'n_units_l4': 8, 'n_units_l5': 6, 'n_units_l6': 51, 'n_units_l7': 93, 'n_units_l8': 21, 'n_units_l9': 11, 'optimizer': 'RMSprop', 'rmsprop_learning_rate': 0.07543136670643052, 'rmsprop_weight_decay': 0.9613941675841288, 'rmsprop_momentum': 5.35857784212915e-05}. Best is trial 306 with value: 0.761904776096344.
Trial 325 finished with value: 0.60317462682724 and parameters: {'n_layers': 21, 'weight_decay': 2.178901060628072e-09, 'n_units_l0': 65, 'n_units_l1': 10, 'n_units_l2': 69, 'n_units_l3': 121, 'n_units_l4': 15, 'n_units_l5': 11, 'n_units_l6': 42, 'n_units_l7': 15, 'n_units_l8': 18, 'n_units_l9': 6, 'n_units_l10': 87, 'n_units_l11': 14, 'n_units_l12': 21, 'n_units_l13': 22, 'n_units_l14': 22, 'n_units_l15': 5, 'n_units_l16': 8, 'n_units_l17': 64, 'n_units_l18': 17, 'n_units_l19': 21, 'n_units_l20': 25, 'optimizer': 'RMSprop', 'rmsprop_learning_rate': 0.0007679663628522496, 'rmsprop_weight_decay': 0.9725465096451117, 'rmsprop_momentum': 6.446125819073826e-05}. Best is trial 306 with value: 0.761904776096344.
Trial 326 finished with value: 0.6349206566810608 and parameters: {'n_layers': 15, 'weight_decay': 1.0082299712879022e-10, 'n_units_l0': 57, 'n_units_l1': 13, 'n_units_l2': 18, 'n_units_l3': 109, 'n_units_l4': 7, 'n_units_l5': 24, 'n_units_l6': 24, 'n_units_l7': 16, 'n_units_l8': 26, 'n_units_l9': 40, 'n_units_l10': 10, 'n_units_l11': 9, 'n_units_l12': 4, 'n_units_l13': 33, 'n_units_l14': 26, 'optimizer': 'RMSprop', 'rmsprop_learning_rate': 0.025915064028110082, 'rmsprop_weight_decay': 0.9673598274497304, 'rmsprop_momentum': 0.00015623563717656497}. Best is trial 306 with value: 0.761904776096344.
