Trial 111 finished with value: 0.7301587462425232 and parameters: {'n_layers': 14, 'weight_decay': 3.1523106235070226e-10, 'n_units_l0': 85, 'n_units_l1': 11, 'n_units_l2': 29, 'n_units_l3': 22, 'n_units_l4': 49, 'n_units_l5': 18, 'n_units_l6': 15, 'n_units_l7': 15, 'n_units_l8': 28, 'n_units_l9': 9, 'n_units_l10': 19, 'n_units_l11': 12, 'n_units_l12': 9, 'n_units_l13': 7, 'optimizer': 'RMSprop', 'rmsprop_learning_rate': 0.05623848633271422, 'rmsprop_weight_decay': 0.9897624092771432, 'rmsprop_momentum': 7.008927580364278e-05}. Best is trial 111 with value: 0.7301587462425232.
Trial 112 finished with value: 0.5714285969734192 and parameters: {'n_layers': 15, 'weight_decay': 2.818273343873027e-10, 'n_units_l0': 75, 'n_units_l1': 11, 'n_units_l2': 32, 'n_units_l3': 14, 'n_units_l4': 60, 'n_units_l5': 23, 'n_units_l6': 11, 'n_units_l7': 15, 'n_units_l8': 34, 'n_units_l9': 13, 'n_units_l10': 19, 'n_units_l11': 18, 'n_units_l12': 14, 'n_units_l13': 7, 'n_units_l14': 11, 'optimizer': 'RMSprop', 'rmsprop_learning_rate': 0.052871460772718884, 'rmsprop_weight_decay': 0.9800940880308946, 'rmsprop_momentum': 6.805307932563396e-05}. Best is trial 111 with value: 0.7301587462425232.
Trial 113 finished with value: 0.6349206566810608 and parameters: {'n_layers': 13, 'weight_decay': 1.646596411993354e-10, 'n_units_l0': 81, 'n_units_l1': 8, 'n_units_l2': 31, 'n_units_l3': 22, 'n_units_l4': 50, 'n_units_l5': 16, 'n_units_l6': 9, 'n_units_l7': 23, 'n_units_l8': 29, 'n_units_l9': 11, 'n_units_l10': 14, 'n_units_l11': 10, 'n_units_l12': 9, 'optimizer': 'RMSprop', 'rmsprop_learning_rate': 0.06836063414192214, 'rmsprop_weight_decay': 0.98782398524173, 'rmsprop_momentum': 3.100985128795298e-05}. Best is trial 111 with value: 0.7301587462425232.
Trial 114 finished with value: 0.6666666865348816 and parameters: {'n_layers': 15, 'weight_decay': 1.8450917100904839e-09, 'n_units_l0': 120, 'n_units_l1': 9, 'n_units_l2': 35, 'n_units_l3': 26, 'n_units_l4': 47, 'n_units_l5': 18, 'n_units_l6': 13, 'n_units_l7': 10, 'n_units_l8': 24, 'n_units_l9': 10, 'n_units_l10': 8, 'n_units_l11': 15, 'n_units_l12': 11, 'n_units_l13': 7, 'n_units_l14': 58, 'optimizer': 'RMSprop', 'rmsprop_learning_rate': 0.02344715391013744, 'rmsprop_weight_decay': 0.9695909591607327, 'rmsprop_momentum': 9.705752155343647e-05}. Best is trial 111 with value: 0.7301587462425232.
Trial 115 finished with value: 0.5555555820465088 and parameters: {'n_layers': 13, 'weight_decay': 1.7431867690631865e-09, 'n_units_l0': 120, 'n_units_l1': 7, 'n_units_l2': 29, 'n_units_l3': 23, 'n_units_l4': 53, 'n_units_l5': 14, 'n_units_l6': 12, 'n_units_l7': 9, 'n_units_l8': 27, 'n_units_l9': 10, 'n_units_l10': 7, 'n_units_l11': 16, 'n_units_l12': 12, 'optimizer': 'RMSprop', 'rmsprop_learning_rate': 0.022733860602643118, 'rmsprop_weight_decay': 0.9893032512730777, 'rmsprop_momentum': 9.919040505816173e-05}. Best is trial 111 with value: 0.7301587462425232.
Trial 116 finished with value: 0.6507936716079712 and parameters: {'n_layers': 14, 'weight_decay': 8.880074154579774e-10, 'n_units_l0': 87, 'n_units_l1': 10, 'n_units_l2': 57, 'n_units_l3': 26, 'n_units_l4': 39, 'n_units_l5': 18, 'n_units_l6': 15, 'n_units_l7': 11, 'n_units_l8': 24, 'n_units_l9': 9, 'n_units_l10': 9, 'n_units_l11': 15, 'n_units_l12': 11, 'n_units_l13': 7, 'optimizer': 'RMSprop', 'rmsprop_learning_rate': 0.039805839925946405, 'rmsprop_weight_decay': 0.9818057834138372, 'rmsprop_momentum': 4.745819363235976e-05}. Best is trial 111 with value: 0.7301587462425232.
Trial 117 finished with value: 0.6349206566810608 and parameters: {'n_layers': 16, 'weight_decay': 4.714884061171867e-10, 'n_units_l0': 96, 'n_units_l1': 9, 'n_units_l2': 36, 'n_units_l3': 21, 'n_units_l4': 34, 'n_units_l5': 15, 'n_units_l6': 13, 'n_units_l7': 10, 'n_units_l8': 25, 'n_units_l9': 12, 'n_units_l10': 8, 'n_units_l11': 19, 'n_units_l12': 13, 'n_units_l13': 5, 'n_units_l14': 58, 'n_units_l15': 76, 'optimizer': 'RMSprop', 'rmsprop_learning_rate': 0.029504299108962132, 'rmsprop_weight_decay': 0.9246128382117296, 'rmsprop_momentum': 9.072424044956324e-05}. Best is trial 111 with value: 0.7301587462425232.
Trial 118 finished with value: 0.6507936716079712 and parameters: {'n_layers': 14, 'weight_decay': 2.2340071627515398e-09, 'n_units_l0': 108, 'n_units_l1': 13, 'n_units_l2': 30, 'n_units_l3': 18, 'n_units_l4': 47, 'n_units_l5': 30, 'n_units_l6': 8, 'n_units_l7': 17, 'n_units_l8': 21, 'n_units_l9': 7, 'n_units_l10': 6, 'n_units_l11': 12, 'n_units_l12': 10, 'n_units_l13': 8, 'optimizer': 'SGD', 'sgd_opt_learning_rate': 0.015097091812035472, 'sgd_opt_momentum': 0.00023340704574418216}. Best is trial 111 with value: 0.7301587462425232.
Trial 119 finished with value: 0.523809552192688 and parameters: {'n_layers': 18, 'weight_decay': 3.29364244268907e-10, 'n_units_l0': 117, 'n_units_l1': 11, 'n_units_l2': 40, 'n_units_l3': 32, 'n_units_l4': 70, 'n_units_l5': 17, 'n_units_l6': 17, 'n_units_l7': 13, 'n_units_l8': 44, 'n_units_l9': 8, 'n_units_l10': 16, 'n_units_l11': 17, 'n_units_l12': 4, 'n_units_l13': 8, 'n_units_l14': 64, 'n_units_l15': 41, 'n_units_l16': 24, 'n_units_l17': 48, 'optimizer': 'RMSprop', 'rmsprop_learning_rate': 0.05664033646517645, 'rmsprop_weight_decay': 0.9860099428656995, 'rmsprop_momentum': 0.00014330054508353212}. Best is trial 111 with value: 0.7301587462425232.
Trial 120 finished with value: 0.5555555820465088 and parameters: {'n_layers': 15, 'weight_decay': 1.1936901370490671e-09, 'n_units_l0': 69, 'n_units_l1': 9, 'n_units_l2': 23, 'n_units_l3': 27, 'n_units_l4': 59, 'n_units_l5': 11, 'n_units_l6': 13, 'n_units_l7': 19, 'n_units_l8': 7, 'n_units_l9': 9, 'n_units_l10': 10, 'n_units_l11': 13, 'n_units_l12': 16, 'n_units_l13': 4, 'n_units_l14': 51, 'optimizer': 'RMSprop', 'rmsprop_learning_rate': 0.07018329691393327, 'rmsprop_weight_decay': 0.9739367800818219, 'rmsprop_momentum': 1.8692048698814478e-05}. Best is trial 111 with value: 0.7301587462425232.
Trial 121 finished with value: 0.4761904776096344 and parameters: {'n_layers': 15, 'weight_decay': 2.004159502820468e-10, 'n_units_l0': 85, 'n_units_l1': 30, 'n_units_l2': 34, 'n_units_l3': 24, 'n_units_l4': 53, 'n_units_l5': 20, 'n_units_l6': 15, 'n_units_l7': 25, 'n_units_l8': 26, 'n_units_l9': 10, 'n_units_l10': 12, 'n_units_l11': 14, 'n_units_l12': 9, 'n_units_l13': 30, 'n_units_l14': 35, 'optimizer': 'RMSprop', 'rmsprop_learning_rate': 0.006262279458289594, 'rmsprop_weight_decay': 0.9711382598752341, 'rmsprop_momentum': 0.00029623847470287477}. Best is trial 111 with value: 0.7301587462425232.
Trial 122 finished with value: 0.60317462682724 and parameters: {'n_layers': 17, 'weight_decay': 5.798986305317715e-10, 'n_units_l0': 127, 'n_units_l1': 12, 'n_units_l2': 51, 'n_units_l3': 20, 'n_units_l4': 34, 'n_units_l5': 19, 'n_units_l6': 10, 'n_units_l7': 9, 'n_units_l8': 19, 'n_units_l9': 11, 'n_units_l10': 8, 'n_units_l11': 8, 'n_units_l12': 7, 'n_units_l13': 26, 'n_units_l14': 82, 'n_units_l15': 67, 'n_units_l16': 63, 'optimizer': 'RMSprop', 'rmsprop_learning_rate': 0.01889157992804929, 'rmsprop_weight_decay': 0.9688781730109988, 'rmsprop_momentum': 0.00010452295369637483}. Best is trial 111 with value: 0.7301587462425232.
Trial 123 finished with value: 0.6984127163887024 and parameters: {'n_layers': 16, 'weight_decay': 0.00010643706651030606, 'n_units_l0': 33, 'n_units_l1': 26, 'n_units_l2': 21, 'n_units_l3': 30, 'n_units_l4': 45, 'n_units_l5': 35, 'n_units_l6': 20, 'n_units_l7': 34, 'n_units_l8': 28, 'n_units_l9': 9, 'n_units_l10': 61, 'n_units_l11': 9, 'n_units_l12': 11, 'n_units_l13': 34, 'n_units_l14': 46, 'n_units_l15': 24, 'optimizer': 'RMSprop', 'rmsprop_learning_rate': 0.08140031612411061, 'rmsprop_weight_decay': 0.980282246511158, 'rmsprop_momentum': 6.829045648419728e-05}. Best is trial 111 with value: 0.7301587462425232.
Trial 124 finished with value: 0.6190476417541504 and parameters: {'n_layers': 16, 'weight_decay': 1.3082832618040872e-10, 'n_units_l0': 33, 'n_units_l1': 26, 'n_units_l2': 19, 'n_units_l3': 30, 'n_units_l4': 48, 'n_units_l5': 34, 'n_units_l6': 26, 'n_units_l7': 33, 'n_units_l8': 29, 'n_units_l9': 9, 'n_units_l10': 28, 'n_units_l11': 11, 'n_units_l12': 15, 'n_units_l13': 35, 'n_units_l14': 41, 'n_units_l15': 26, 'optimizer': 'RMSprop', 'rmsprop_learning_rate': 0.08440756293579559, 'rmsprop_weight_decay': 0.979308913525533, 'rmsprop_momentum': 4.386452152605645e-05}. Best is trial 111 with value: 0.7301587462425232.
Trial 125 finished with value: 0.4920634925365448 and parameters: {'n_layers': 15, 'weight_decay': 6.385207717760378e-09, 'n_units_l0': 78, 'n_units_l1': 36, 'n_units_l2': 27, 'n_units_l3': 16, 'n_units_l4': 41, 'n_units_l5': 38, 'n_units_l6': 16, 'n_units_l7': 28, 'n_units_l8': 22, 'n_units_l9': 6, 'n_units_l10': 70, 'n_units_l11': 12, 'n_units_l12': 11, 'n_units_l13': 46, 'n_units_l14': 64, 'optimizer': 'RMSprop', 'rmsprop_learning_rate': 0.05068108436924, 'rmsprop_weight_decay': 0.9830623510425347, 'rmsprop_momentum': 6.69883405954936e-05}. Best is trial 111 with value: 0.7301587462425232.
Trial 126 finished with value: 0.60317462682724 and parameters: {'n_layers': 16, 'weight_decay': 2.616624820250955e-10, 'n_units_l0': 102, 'n_units_l1': 8, 'n_units_l2': 41, 'n_units_l3': 35, 'n_units_l4': 69, 'n_units_l5': 49, 'n_units_l6': 14, 'n_units_l7': 12, 'n_units_l8': 35, 'n_units_l9': 8, 'n_units_l10': 21, 'n_units_l11': 15, 'n_units_l12': 12, 'n_units_l13': 6, 'n_units_l14': 20, 'n_units_l15': 33, 'optimizer': 'RMSprop', 'rmsprop_learning_rate': 0.09381691638616652, 'rmsprop_weight_decay': 0.9764245725867509, 'rmsprop_momentum': 0.00018260521547063652}. Best is trial 111 with value: 0.7301587462425232.
Trial 127 finished with value: 0.60317462682724 and parameters: {'n_layers': 13, 'weight_decay': 1.033741526634212e-10, 'n_units_l0': 66, 'n_units_l1': 10, 'n_units_l2': 25, 'n_units_l3': 25, 'n_units_l4': 45, 'n_units_l5': 42, 'n_units_l6': 22, 'n_units_l7': 21, 'n_units_l8': 23, 'n_units_l9': 7, 'n_units_l10': 127, 'n_units_l11': 14, 'n_units_l12': 14, 'optimizer': 'RMSprop', 'rmsprop_learning_rate': 0.039936187209532584, 'rmsprop_weight_decay': 0.986606901150039, 'rmsprop_momentum': 8.320421175730232e-05}. Best is trial 111 with value: 0.7301587462425232.
Trial 128 finished with value: 0.6349206566810608 and parameters: {'n_layers': 17, 'weight_decay': 4.2238853940582354e-10, 'n_units_l0': 24, 'n_units_l1': 13, 'n_units_l2': 33, 'n_units_l3': 31, 'n_units_l4': 52, 'n_units_l5': 46, 'n_units_l6': 12, 'n_units_l7': 35, 'n_units_l8': 28, 'n_units_l9': 10, 'n_units_l10': 48, 'n_units_l11': 23, 'n_units_l12': 10, 'n_units_l13': 61, 'n_units_l14': 47, 'n_units_l15': 25, 'n_units_l16': 8, 'optimizer': 'RMSprop', 'rmsprop_learning_rate': 0.009429209450065888, 'rmsprop_weight_decay': 0.9894948038956863, 'rmsprop_momentum': 3.6431397087601425e-05}. Best is trial 111 with value: 0.7301587462425232.
Trial 129 finished with value: 0.523809552192688 and parameters: {'n_layers': 18, 'weight_decay': 7.776073040163676e-10, 'n_units_l0': 17, 'n_units_l1': 11, 'n_units_l2': 22, 'n_units_l3': 19, 'n_units_l4': 76, 'n_units_l5': 17, 'n_units_l6': 17, 'n_units_l7': 42, 'n_units_l8': 40, 'n_units_l9': 12, 'n_units_l10': 36, 'n_units_l11': 7, 'n_units_l12': 9, 'n_units_l13': 23, 'n_units_l14': 57, 'n_units_l15': 17, 'n_units_l16': 17, 'n_units_l17': 17, 'optimizer': 'RMSprop', 'rmsprop_learning_rate': 0.08048915743277638, 'rmsprop_weight_decay': 0.9822919393037746, 'rmsprop_momentum': 6.0696192241505216e-05}. Best is trial 111 with value: 0.7301587462425232.
Trial 130 finished with value: 0.6507936716079712 and parameters: {'n_layers': 14, 'weight_decay': 1.2098090407187274e-09, 'n_units_l0': 95, 'n_units_l1': 34, 'n_units_l2': 36, 'n_units_l3': 22, 'n_units_l4': 42, 'n_units_l5': 13, 'n_units_l6': 6, 'n_units_l7': 15, 'n_units_l8': 31, 'n_units_l9': 9, 'n_units_l10': 56, 'n_units_l11': 9, 'n_units_l12': 12, 'n_units_l13': 105, 'optimizer': 'RMSprop', 'rmsprop_learning_rate': 0.02524084482499287, 'rmsprop_weight_decay': 0.8766454633663187, 'rmsprop_momentum': 0.0008130339989665796}. Best is trial 111 with value: 0.7301587462425232.
Trial 131 finished with value: 0.6349206566810608 and parameters: {'n_layers': 16, 'weight_decay': 0.00021922509741773805, 'n_units_l0': 34, 'n_units_l1': 26, 'n_units_l2': 119, 'n_units_l3': 28, 'n_units_l4': 36, 'n_units_l5': 22, 'n_units_l6': 19, 'n_units_l7': 30, 'n_units_l8': 18, 'n_units_l9': 102, 'n_units_l10': 62, 'n_units_l11': 10, 'n_units_l12': 11, 'n_units_l13': 20, 'n_units_l14': 44, 'n_units_l15': 21, 'optimizer': 'RMSprop', 'rmsprop_learning_rate': 0.0021297008715790862, 'rmsprop_weight_decay': 0.9745959137987783, 'rmsprop_momentum': 0.00053711630707761}. Best is trial 111 with value: 0.7301587462425232.
Trial 132 finished with value: 0.6190476417541504 and parameters: {'n_layers': 15, 'weight_decay': 3.4879305080167376e-05, 'n_units_l0': 37, 'n_units_l1': 33, 'n_units_l2': 29, 'n_units_l3': 126, 'n_units_l4': 29, 'n_units_l5': 27, 'n_units_l6': 20, 'n_units_l7': 11, 'n_units_l8': 5, 'n_units_l9': 90, 'n_units_l10': 42, 'n_units_l11': 9, 'n_units_l12': 8, 'n_units_l13': 30, 'n_units_l14': 4, 'optimizer': 'RMSprop', 'rmsprop_learning_rate': 0.004894658504157079, 'rmsprop_weight_decay': 0.9651796571177537, 'rmsprop_momentum': 0.0003835037436121728}. Best is trial 111 with value: 0.7301587462425232.
Trial 133 finished with value: 0.523809552192688 and parameters: {'n_layers': 15, 'weight_decay': 2.2209555845104218e-05, 'n_units_l0': 31, 'n_units_l1': 30, 'n_units_l2': 18, 'n_units_l3': 40, 'n_units_l4': 64, 'n_units_l5': 23, 'n_units_l6': 11, 'n_units_l7': 26, 'n_units_l8': 24, 'n_units_l9': 14, 'n_units_l10': 77, 'n_units_l11': 12, 'n_units_l12': 5, 'n_units_l13': 27, 'n_units_l14': 29, 'optimizer': 'RMSprop', 'rmsprop_learning_rate': 0.06003132036588449, 'rmsprop_weight_decay': 0.978497199432911, 'rmsprop_momentum': 0.0006252628941580228}. Best is trial 111 with value: 0.7301587462425232.
Trial 134 finished with value: 0.6349206566810608 and parameters: {'n_layers': 14, 'weight_decay': 3.509996502800999e-10, 'n_units_l0': 41, 'n_units_l1': 42, 'n_units_l2': 12, 'n_units_l3': 114, 'n_units_l4': 56, 'n_units_l5': 20, 'n_units_l6': 15, 'n_units_l7': 23, 'n_units_l8': 21, 'n_units_l9': 70, 'n_units_l10': 57, 'n_units_l11': 8, 'n_units_l12': 8, 'n_units_l13': 32, 'optimizer': 'RMSprop', 'rmsprop_learning_rate': 0.015365942795670065, 'rmsprop_weight_decay': 0.9414873196980684, 'rmsprop_momentum': 0.0012081609949505078}. Best is trial 111 with value: 0.7301587462425232.
Trial 135 finished with value: 0.5714285969734192 and parameters: {'n_layers': 16, 'weight_decay': 0.00011530886196928611, 'n_units_l0': 72, 'n_units_l1': 17, 'n_units_l2': 26, 'n_units_l3': 104, 'n_units_l4': 46, 'n_units_l5': 15, 'n_units_l6': 25, 'n_units_l7': 6, 'n_units_l8': 26, 'n_units_l9': 9, 'n_units_l10': 52, 'n_units_l11': 10, 'n_units_l12': 10, 'n_units_l13': 38, 'n_units_l14': 25, 'n_units_l15': 115, 'optimizer': 'RMSprop', 'rmsprop_learning_rate': 0.04469949612160487, 'rmsprop_weight_decay': 0.9693488628500339, 'rmsprop_momentum': 0.0017453239016907212}. Best is trial 111 with value: 0.7301587462425232.
Trial 136 finished with value: 0.5714285969734192 and parameters: {'n_layers': 14, 'weight_decay': 0.00035355656380481055, 'n_units_l0': 28, 'n_units_l1': 24, 'n_units_l2': 7, 'n_units_l3': 27, 'n_units_l4': 39, 'n_units_l5': 18, 'n_units_l6': 21, 'n_units_l7': 10, 'n_units_l8': 19, 'n_units_l9': 8, 'n_units_l10': 44, 'n_units_l11': 11, 'n_units_l12': 39, 'n_units_l13': 21, 'optimizer': 'Adam', 'adam_learning_rate': 0.019933317594774777}. Best is trial 111 with value: 0.7301587462425232.
Trial 137 finished with value: 0.5396825671195984 and parameters: {'n_layers': 15, 'weight_decay': 1.8068800067002346e-10, 'n_units_l0': 82, 'n_units_l1': 28, 'n_units_l2': 46, 'n_units_l3': 128, 'n_units_l4': 49, 'n_units_l5': 34, 'n_units_l6': 9, 'n_units_l7': 8, 'n_units_l8': 6, 'n_units_l9': 57, 'n_units_l10': 11, 'n_units_l11': 13, 'n_units_l12': 13, 'n_units_l13': 18, 'n_units_l14': 5, 'optimizer': 'RMSprop', 'rmsprop_learning_rate': 0.09961069897433975, 'rmsprop_weight_decay': 0.9868285956401556, 'rmsprop_momentum': 0.00022781624039058687}. Best is trial 111 with value: 0.7301587462425232.
Trial 138 finished with value: 0.60317462682724 and parameters: {'n_layers': 12, 'weight_decay': 3.56409635260731e-09, 'n_units_l0': 23, 'n_units_l1': 14, 'n_units_l2': 28, 'n_units_l3': 23, 'n_units_l4': 7, 'n_units_l5': 25, 'n_units_l6': 17, 'n_units_l7': 38, 'n_units_l8': 16, 'n_units_l9': 11, 'n_units_l10': 63, 'n_units_l11': 7, 'optimizer': 'RMSprop', 'rmsprop_learning_rate': 2.6630000818181004e-05, 'rmsprop_weight_decay': 0.9628675801189093, 'rmsprop_momentum': 0.0003116262626805365}. Best is trial 111 with value: 0.7301587462425232.
Trial 139 finished with value: 0.6190476417541504 and parameters: {'n_layers': 17, 'weight_decay': 6.157148192701958e-10, 'n_units_l0': 26, 'n_units_l1': 9, 'n_units_l2': 5, 'n_units_l3': 12, 'n_units_l4': 4, 'n_units_l5': 36, 'n_units_l6': 23, 'n_units_l7': 96, 'n_units_l8': 7, 'n_units_l9': 7, 'n_units_l10': 14, 'n_units_l11': 9, 'n_units_l12': 11, 'n_units_l13': 7, 'n_units_l14': 38, 'n_units_l15': 9, 'n_units_l16': 5, 'optimizer': 'RMSprop', 'rmsprop_learning_rate': 5.6078835453908285e-05, 'rmsprop_weight_decay': 0.9169924136128466, 'rmsprop_momentum': 0.0001633484278028008}. Best is trial 111 with value: 0.7301587462425232.
Trial 140 finished with value: 0.5555555820465088 and parameters: {'n_layers': 16, 'weight_decay': 5.369091731503921e-05, 'n_units_l0': 35, 'n_units_l1': 10, 'n_units_l2': 22, 'n_units_l3': 112, 'n_units_l4': 5, 'n_units_l5': 29, 'n_units_l6': 10, 'n_units_l7': 33, 'n_units_l8': 20, 'n_units_l9': 13, 'n_units_l10': 6, 'n_units_l11': 10, 'n_units_l12': 4, 'n_units_l13': 15, 'n_units_l14': 75, 'n_units_l15': 12, 'optimizer': 'SGD', 'sgd_opt_learning_rate': 0.0018009397727389775, 'sgd_opt_momentum': 0.003211623014222864}. Best is trial 111 with value: 0.7301587462425232.
Trial 141 finished with value: 0.60317462682724 and parameters: {'n_layers': 14, 'weight_decay': 0.0005747234786192383, 'n_units_l0': 52, 'n_units_l1': 12, 'n_units_l2': 6, 'n_units_l3': 90, 'n_units_l4': 10, 'n_units_l5': 84, 'n_units_l6': 18, 'n_units_l7': 16, 'n_units_l8': 16, 'n_units_l9': 28, 'n_units_l10': 31, 'n_units_l11': 11, 'n_units_l12': 9, 'n_units_l13': 10, 'optimizer': 'RMSprop', 'rmsprop_learning_rate': 0.0012585833626210991, 'rmsprop_weight_decay': 0.9362501329476636, 'rmsprop_momentum': 0.0001936977373761138}. Best is trial 111 with value: 0.7301587462425232.
Trial 142 finished with value: 0.60317462682724 and parameters: {'n_layers': 13, 'weight_decay': 1.1952552637566104e-08, 'n_units_l0': 44, 'n_units_l1': 12, 'n_units_l2': 6, 'n_units_l3': 99, 'n_units_l4': 9, 'n_units_l5': 70, 'n_units_l6': 19, 'n_units_l7': 12, 'n_units_l8': 18, 'n_units_l9': 11, 'n_units_l10': 21, 'n_units_l11': 8, 'n_units_l12': 8, 'optimizer': 'RMSprop', 'rmsprop_learning_rate': 0.0748657433752916, 'rmsprop_weight_decay': 0.9493639490959188, 'rmsprop_momentum': 0.00012921174519633767}. Best is trial 111 with value: 0.7301587462425232.
Trial 143 finished with value: 0.60317462682724 and parameters: {'n_layers': 14, 'weight_decay': 7.603339047171188e-06, 'n_units_l0': 49, 'n_units_l1': 13, 'n_units_l2': 20, 'n_units_l3': 118, 'n_units_l4': 43, 'n_units_l5': 64, 'n_units_l6': 23, 'n_units_l7': 19, 'n_units_l8': 17, 'n_units_l9': 10, 'n_units_l10': 60, 'n_units_l11': 16, 'n_units_l12': 6, 'n_units_l13': 23, 'optimizer': 'RMSprop', 'rmsprop_learning_rate': 0.0007426092003556436, 'rmsprop_weight_decay': 0.9537390796989205, 'rmsprop_momentum': 0.00010454627038146616}. Best is trial 111 with value: 0.7301587462425232.
Trial 144 finished with value: 0.5555555820465088 and parameters: {'n_layers': 15, 'weight_decay': 1.5653980532417776e-06, 'n_units_l0': 56, 'n_units_l1': 11, 'n_units_l2': 7, 'n_units_l3': 6, 'n_units_l4': 6, 'n_units_l5': 59, 'n_units_l6': 14, 'n_units_l7': 13, 'n_units_l8': 33, 'n_units_l9': 15, 'n_units_l10': 18, 'n_units_l11': 13, 'n_units_l12': 7, 'n_units_l13': 10, 'n_units_l14': 49, 'optimizer': 'RMSprop', 'rmsprop_learning_rate': 0.002910372698592526, 'rmsprop_weight_decay': 0.9843809386578436, 'rmsprop_momentum': 0.00042648157539892446}. Best is trial 111 with value: 0.7301587462425232.
Trial 145 finished with value: 0.6190476417541504 and parameters: {'n_layers': 17, 'weight_decay': 3.615475802777262e-07, 'n_units_l0': 62, 'n_units_l1': 115, 'n_units_l2': 17, 'n_units_l3': 94, 'n_units_l4': 55, 'n_units_l5': 39, 'n_units_l6': 21, 'n_units_l7': 14, 'n_units_l8': 23, 'n_units_l9': 8, 'n_units_l10': 23, 'n_units_l11': 11, 'n_units_l12': 9, 'n_units_l13': 34, 'n_units_l14': 30, 'n_units_l15': 49, 'n_units_l16': 10, 'optimizer': 'RMSprop', 'rmsprop_learning_rate': 0.0009220308214916408, 'rmsprop_weight_decay': 0.9800146729380924, 'rmsprop_momentum': 1.3081548742676294e-05}. Best is trial 111 with value: 0.7301587462425232.
Trial 146 finished with value: 0.5555555820465088 and parameters: {'n_layers': 15, 'weight_decay': 1.5605015263466225e-07, 'n_units_l0': 47, 'n_units_l1': 8, 'n_units_l2': 8, 'n_units_l3': 71, 'n_units_l4': 5, 'n_units_l5': 74, 'n_units_l6': 12, 'n_units_l7': 15, 'n_units_l8': 13, 'n_units_l9': 9, 'n_units_l10': 67, 'n_units_l11': 12, 'n_units_l12': 10, 'n_units_l13': 17, 'n_units_l14': 35, 'optimizer': 'RMSprop', 'rmsprop_learning_rate': 0.00025451313630635254, 'rmsprop_weight_decay': 0.9582985426950814, 'rmsprop_momentum': 0.0007344487208474447}. Best is trial 111 with value: 0.7301587462425232.
