A new study created in memory with name: no-name-0fb0e779-a858-473d-8a86-8af1030f7b81
Trial 0 finished with value: 0.5873016119003296 and parameters: {'n_layers': 2, 'weight_decay': 1.9678781466545146e-06, 'n_units_l0': 15, 'n_units_l1': 13, 'optimizer': 'RMSprop', 'rmsprop_learning_rate': 0.00031206958269829727, 'rmsprop_weight_decay': 0.8535838980168322, 'rmsprop_momentum': 0.09205958297295218}. Best is trial 0 with value: 0.5873016119003296.
Trial 1 finished with value: 0.6190476417541504 and parameters: {'n_layers': 18, 'weight_decay': 1.7187979963666694e-06, 'n_units_l0': 51, 'n_units_l1': 9, 'n_units_l2': 72, 'n_units_l3': 97, 'n_units_l4': 4, 'n_units_l5': 5, 'n_units_l6': 93, 'n_units_l7': 4, 'n_units_l8': 35, 'n_units_l9': 24, 'n_units_l10': 4, 'n_units_l11': 9, 'n_units_l12': 11, 'n_units_l13': 8, 'n_units_l14': 4, 'n_units_l15': 18, 'n_units_l16': 70, 'n_units_l17': 73, 'optimizer': 'Adam', 'adam_learning_rate': 2.359230528703554e-05}. Best is trial 1 with value: 0.6190476417541504.
Trial 2 finished with value: 0.523809552192688 and parameters: {'n_layers': 25, 'weight_decay': 1.3174699955251962e-06, 'n_units_l0': 6, 'n_units_l1': 15, 'n_units_l2': 60, 'n_units_l3': 23, 'n_units_l4': 68, 'n_units_l5': 31, 'n_units_l6': 15, 'n_units_l7': 17, 'n_units_l8': 8, 'n_units_l9': 38, 'n_units_l10': 85, 'n_units_l11': 30, 'n_units_l12': 23, 'n_units_l13': 4, 'n_units_l14': 6, 'n_units_l15': 53, 'n_units_l16': 21, 'n_units_l17': 124, 'n_units_l18': 4, 'n_units_l19': 29, 'n_units_l20': 34, 'n_units_l21': 6, 'n_units_l22': 21, 'n_units_l23': 11, 'n_units_l24': 73, 'optimizer': 'SGD', 'sgd_opt_learning_rate': 5.2074695949699254e-05, 'sgd_opt_momentum': 0.00016519541794945419}. Best is trial 1 with value: 0.6190476417541504.
Trial 3 finished with value: 0.60317462682724 and parameters: {'n_layers': 3, 'weight_decay': 0.00026241889736502045, 'n_units_l0': 19, 'n_units_l1': 48, 'n_units_l2': 13, 'optimizer': 'SGD', 'sgd_opt_learning_rate': 7.878856592444156e-05, 'sgd_opt_momentum': 0.00011245885919165408}. Best is trial 1 with value: 0.6190476417541504.
Trial 4 finished with value: 0.5873016119003296 and parameters: {'n_layers': 23, 'weight_decay': 1.0519599018680635e-07, 'n_units_l0': 7, 'n_units_l1': 4, 'n_units_l2': 22, 'n_units_l3': 13, 'n_units_l4': 119, 'n_units_l5': 14, 'n_units_l6': 58, 'n_units_l7': 102, 'n_units_l8': 4, 'n_units_l9': 78, 'n_units_l10': 4, 'n_units_l11': 20, 'n_units_l12': 4, 'n_units_l13': 52, 'n_units_l14': 12, 'n_units_l15': 30, 'n_units_l16': 34, 'n_units_l17': 4, 'n_units_l18': 20, 'n_units_l19': 61, 'n_units_l20': 117, 'n_units_l21': 9, 'n_units_l22': 9, 'optimizer': 'SGD', 'sgd_opt_learning_rate': 0.04657501096755403, 'sgd_opt_momentum': 0.0008131844014503889}. Best is trial 1 with value: 0.6190476417541504.
Trial 5 finished with value: 0.5714285969734192 and parameters: {'n_layers': 24, 'weight_decay': 6.0949509180755145e-05, 'n_units_l0': 9, 'n_units_l1': 6, 'n_units_l2': 47, 'n_units_l3': 36, 'n_units_l4': 32, 'n_units_l5': 5, 'n_units_l6': 7, 'n_units_l7': 5, 'n_units_l8': 4, 'n_units_l9': 26, 'n_units_l10': 96, 'n_units_l11': 46, 'n_units_l12': 6, 'n_units_l13': 16, 'n_units_l14': 6, 'n_units_l15': 41, 'n_units_l16': 4, 'n_units_l17': 5, 'n_units_l18': 8, 'n_units_l19': 75, 'n_units_l20': 33, 'n_units_l21': 17, 'n_units_l22': 5, 'n_units_l23': 6, 'optimizer': 'SGD', 'sgd_opt_learning_rate': 2.0804060132566562e-05, 'sgd_opt_momentum': 3.8839011090314585e-05}. Best is trial 1 with value: 0.6190476417541504.
Trial 6 finished with value: 0.5555555820465088 and parameters: {'n_layers': 22, 'weight_decay': 6.1982864855270675e-06, 'n_units_l0': 7, 'n_units_l1': 5, 'n_units_l2': 4, 'n_units_l3': 40, 'n_units_l4': 24, 'n_units_l5': 12, 'n_units_l6': 46, 'n_units_l7': 13, 'n_units_l8': 42, 'n_units_l9': 80, 'n_units_l10': 11, 'n_units_l11': 47, 'n_units_l12': 59, 'n_units_l13': 13, 'n_units_l14': 64, 'n_units_l15': 23, 'n_units_l16': 13, 'n_units_l17': 67, 'n_units_l18': 7, 'n_units_l19': 14, 'n_units_l20': 15, 'n_units_l21': 97, 'optimizer': 'Adam', 'adam_learning_rate': 0.0006771610798636296}. Best is trial 1 with value: 0.6190476417541504.
Trial 7 finished with value: 0.6190476417541504 and parameters: {'n_layers': 17, 'weight_decay': 1.6238271835065284e-10, 'n_units_l0': 11, 'n_units_l1': 63, 'n_units_l2': 15, 'n_units_l3': 17, 'n_units_l4': 14, 'n_units_l5': 91, 'n_units_l6': 6, 'n_units_l7': 54, 'n_units_l8': 22, 'n_units_l9': 7, 'n_units_l10': 23, 'n_units_l11': 17, 'n_units_l12': 18, 'n_units_l13': 74, 'n_units_l14': 18, 'n_units_l15': 9, 'n_units_l16': 4, 'optimizer': 'SGD', 'sgd_opt_learning_rate': 0.0007251696547823974, 'sgd_opt_momentum': 2.690496420868445e-05}. Best is trial 1 with value: 0.6190476417541504.
Trial 8 finished with value: 0.6190476417541504 and parameters: {'n_layers': 12, 'weight_decay': 5.006563387968616e-06, 'n_units_l0': 34, 'n_units_l1': 126, 'n_units_l2': 79, 'n_units_l3': 54, 'n_units_l4': 31, 'n_units_l5': 7, 'n_units_l6': 49, 'n_units_l7': 118, 'n_units_l8': 44, 'n_units_l9': 11, 'n_units_l10': 97, 'n_units_l11': 8, 'optimizer': 'SGD', 'sgd_opt_learning_rate': 0.0001605512539081606, 'sgd_opt_momentum': 2.7040598404242027e-05}. Best is trial 1 with value: 0.6190476417541504.
Trial 9 finished with value: 0.5873016119003296 and parameters: {'n_layers': 8, 'weight_decay': 7.646431594159962e-09, 'n_units_l0': 4, 'n_units_l1': 26, 'n_units_l2': 5, 'n_units_l3': 4, 'n_units_l4': 128, 'n_units_l5': 13, 'n_units_l6': 9, 'n_units_l7': 42, 'optimizer': 'SGD', 'sgd_opt_learning_rate': 0.0027118570217013, 'sgd_opt_momentum': 1.422879805170918e-05}. Best is trial 1 with value: 0.6190476417541504.
Trial 10 finished with value: 0.5873016119003296 and parameters: {'n_layers': 17, 'weight_decay': 2.324612316412241e-08, 'n_units_l0': 110, 'n_units_l1': 9, 'n_units_l2': 115, 'n_units_l3': 126, 'n_units_l4': 4, 'n_units_l5': 4, 'n_units_l6': 126, 'n_units_l7': 4, 'n_units_l8': 113, 'n_units_l9': 4, 'n_units_l10': 4, 'n_units_l11': 123, 'n_units_l12': 12, 'n_units_l13': 4, 'n_units_l14': 59, 'n_units_l15': 4, 'n_units_l16': 120, 'optimizer': 'Adam', 'adam_learning_rate': 1.259940680791432e-05}. Best is trial 1 with value: 0.6190476417541504.
Trial 11 finished with value: 0.5714285969734192 and parameters: {'n_layers': 17, 'weight_decay': 4.5572866453577475e-10, 'n_units_l0': 54, 'n_units_l1': 61, 'n_units_l2': 21, 'n_units_l3': 11, 'n_units_l4': 5, 'n_units_l5': 106, 'n_units_l6': 4, 'n_units_l7': 37, 'n_units_l8': 19, 'n_units_l9': 9, 'n_units_l10': 22, 'n_units_l11': 5, 'n_units_l12': 22, 'n_units_l13': 111, 'n_units_l14': 23, 'n_units_l15': 7, 'n_units_l16': 98, 'optimizer': 'Adam', 'adam_learning_rate': 1.1435760292987186e-05}. Best is trial 1 with value: 0.6190476417541504.
Trial 12 finished with value: 0.682539701461792 and parameters: {'n_layers': 17, 'weight_decay': 1.0852150455734e-10, 'n_units_l0': 59, 'n_units_l1': 30, 'n_units_l2': 11, 'n_units_l3': 107, 'n_units_l4': 8, 'n_units_l5': 48, 'n_units_l6': 23, 'n_units_l7': 9, 'n_units_l8': 22, 'n_units_l9': 11, 'n_units_l10': 24, 'n_units_l11': 12, 'n_units_l12': 10, 'n_units_l13': 38, 'n_units_l14': 20, 'n_units_l15': 11, 'n_units_l16': 5, 'optimizer': 'RMSprop', 'rmsprop_learning_rate': 0.09406074581978142, 'rmsprop_weight_decay': 0.9840400342474359, 'rmsprop_momentum': 1.1768968887354707e-05}. Best is trial 12 with value: 0.682539701461792.
Trial 13 finished with value: 0.5555555820465088 and parameters: {'n_layers': 13, 'weight_decay': 5.977595618227576e-09, 'n_units_l0': 72, 'n_units_l1': 26, 'n_units_l2': 8, 'n_units_l3': 115, 'n_units_l4': 10, 'n_units_l5': 41, 'n_units_l6': 25, 'n_units_l7': 8, 'n_units_l8': 22, 'n_units_l9': 17, 'n_units_l10': 11, 'n_units_l11': 9, 'n_units_l12': 8, 'optimizer': 'RMSprop', 'rmsprop_learning_rate': 0.0639914974377481, 'rmsprop_weight_decay': 0.9854159389271403, 'rmsprop_momentum': 1.0393329772745978e-05}. Best is trial 12 with value: 0.682539701461792.
Trial 14 finished with value: 0.5714285969734192 and parameters: {'n_layers': 20, 'weight_decay': 1.67571866288366e-07, 'n_units_l0': 33, 'n_units_l1': 9, 'n_units_l2': 35, 'n_units_l3': 72, 'n_units_l4': 7, 'n_units_l5': 54, 'n_units_l6': 126, 'n_units_l7': 9, 'n_units_l8': 55, 'n_units_l9': 26, 'n_units_l10': 34, 'n_units_l11': 10, 'n_units_l12': 49, 'n_units_l13': 29, 'n_units_l14': 4, 'n_units_l15': 13, 'n_units_l16': 47, 'n_units_l17': 30, 'n_units_l18': 126, 'n_units_l19': 4, 'optimizer': 'RMSprop', 'rmsprop_learning_rate': 0.06892127684291616, 'rmsprop_weight_decay': 0.9877434196344275, 'rmsprop_momentum': 1.1955805536538897e-05}. Best is trial 12 with value: 0.682539701461792.
Trial 15 finished with value: 0.5714285969734192 and parameters: {'n_layers': 9, 'weight_decay': 3.485390005861013e-05, 'n_units_l0': 37, 'n_units_l1': 38, 'n_units_l2': 10, 'n_units_l3': 83, 'n_units_l4': 8, 'n_units_l5': 23, 'n_units_l6': 21, 'n_units_l7': 6, 'n_units_l8': 12, 'optimizer': 'Adam', 'adam_learning_rate': 0.05640721422295006}. Best is trial 12 with value: 0.682539701461792.
Trial 16 finished with value: 0.5555555820465088 and parameters: {'n_layers': 19, 'weight_decay': 6.667937473431759e-10, 'n_units_l0': 102, 'n_units_l1': 17, 'n_units_l2': 31, 'n_units_l3': 7, 'n_units_l4': 14, 'n_units_l5': 64, 'n_units_l6': 32, 'n_units_l7': 11, 'n_units_l8': 82, 'n_units_l9': 15, 'n_units_l10': 9, 'n_units_l11': 4, 'n_units_l12': 10, 'n_units_l13': 8, 'n_units_l14': 108, 'n_units_l15': 16, 'n_units_l16': 9, 'n_units_l17': 22, 'n_units_l18': 122, 'optimizer': 'RMSprop', 'rmsprop_learning_rate': 1.1225007915990795e-05, 'rmsprop_weight_decay': 0.9173342744225287, 'rmsprop_momentum': 0.0007243962987805691}. Best is trial 12 with value: 0.682539701461792.
Trial 17 finished with value: 0.6666666865348816 and parameters: {'n_layers': 15, 'weight_decay': 1.9727699621717555e-09, 'n_units_l0': 56, 'n_units_l1': 10, 'n_units_l2': 7, 'n_units_l3': 29, 'n_units_l4': 4, 'n_units_l5': 8, 'n_units_l6': 13, 'n_units_l7': 4, 'n_units_l8': 33, 'n_units_l9': 36, 'n_units_l10': 44, 'n_units_l11': 11, 'n_units_l12': 4, 'n_units_l13': 31, 'n_units_l14': 31, 'optimizer': 'RMSprop', 'rmsprop_learning_rate': 0.0025810692031215535, 'rmsprop_weight_decay': 0.9367480614378815, 'rmsprop_momentum': 0.0007801944193514108}. Best is trial 12 with value: 0.682539701461792.
Trial 18 finished with value: 0.5555555820465088 and parameters: {'n_layers': 10, 'weight_decay': 1.6882732324265733e-09, 'n_units_l0': 77, 'n_units_l1': 33, 'n_units_l2': 7, 'n_units_l3': 26, 'n_units_l4': 6, 'n_units_l5': 8, 'n_units_l6': 14, 'n_units_l7': 23, 'n_units_l8': 13, 'n_units_l9': 47, 'optimizer': 'RMSprop', 'rmsprop_learning_rate': 0.002234540914579427, 'rmsprop_weight_decay': 0.9402458009096512, 'rmsprop_momentum': 0.0004691274038783253}. Best is trial 12 with value: 0.682539701461792.
Trial 19 finished with value: 0.523809552192688 and parameters: {'n_layers': 15, 'weight_decay': 1.0969605984431654e-10, 'n_units_l0': 24, 'n_units_l1': 101, 'n_units_l2': 6, 'n_units_l3': 53, 'n_units_l4': 11, 'n_units_l5': 23, 'n_units_l6': 12, 'n_units_l7': 7, 'n_units_l8': 29, 'n_units_l9': 5, 'n_units_l10': 44, 'n_units_l11': 13, 'n_units_l12': 5, 'n_units_l13': 34, 'n_units_l14': 36, 'optimizer': 'RMSprop', 'rmsprop_learning_rate': 0.0024517240173367143, 'rmsprop_weight_decay': 0.9425164469949614, 'rmsprop_momentum': 0.01599243555631082}. Best is trial 12 with value: 0.682539701461792.
Trial 20 finished with value: 0.5555555820465088 and parameters: {'n_layers': 14, 'weight_decay': 2.5090171879982235e-09, 'n_units_l0': 51, 'n_units_l1': 21, 'n_units_l2': 11, 'n_units_l3': 35, 'n_units_l4': 17, 'n_units_l5': 35, 'n_units_l6': 18, 'n_units_l7': 19, 'n_units_l8': 63, 'n_units_l9': 125, 'n_units_l10': 53, 'n_units_l11': 28, 'n_units_l12': 103, 'n_units_l13': 43, 'optimizer': 'RMSprop', 'rmsprop_learning_rate': 0.005736094505701557, 'rmsprop_weight_decay': 0.902707247134104, 'rmsprop_momentum': 5.712802420042459e-05}. Best is trial 12 with value: 0.682539701461792.
Trial 21 finished with value: 0.60317462682724 and parameters: {'n_layers': 20, 'weight_decay': 4.5437869293096476e-08, 'n_units_l0': 56, 'n_units_l1': 9, 'n_units_l2': 17, 'n_units_l3': 81, 'n_units_l4': 4, 'n_units_l5': 6, 'n_units_l6': 81, 'n_units_l7': 4, 'n_units_l8': 32, 'n_units_l9': 39, 'n_units_l10': 31, 'n_units_l11': 7, 'n_units_l12': 14, 'n_units_l13': 22, 'n_units_l14': 14, 'n_units_l15': 6, 'n_units_l16': 59, 'n_units_l17': 56, 'n_units_l18': 40, 'n_units_l19': 5, 'optimizer': 'Adam', 'adam_learning_rate': 0.0004211593000079491}. Best is trial 12 with value: 0.682539701461792.
Trial 22 finished with value: 0.6349206566810608 and parameters: {'n_layers': 16, 'weight_decay': 4.229100820831851e-07, 'n_units_l0': 76, 'n_units_l1': 12, 'n_units_l2': 4, 'n_units_l3': 128, 'n_units_l4': 4, 'n_units_l5': 4, 'n_units_l6': 32, 'n_units_l7': 4, 'n_units_l8': 14, 'n_units_l9': 20, 'n_units_l10': 15, 'n_units_l11': 12, 'n_units_l12': 7, 'n_units_l13': 11, 'n_units_l14': 32, 'n_units_l15': 105, 'optimizer': 'RMSprop', 'rmsprop_learning_rate': 0.00012769233858950222, 'rmsprop_weight_decay': 0.9605496525099575, 'rmsprop_momentum': 0.004133857728528684}. Best is trial 12 with value: 0.682539701461792.
Trial 23 finished with value: 0.523809552192688 and parameters: {'n_layers': 15, 'weight_decay': 4.383391962159408e-07, 'n_units_l0': 122, 'n_units_l1': 12, 'n_units_l2': 4, 'n_units_l3': 59, 'n_units_l4': 5, 'n_units_l5': 9, 'n_units_l6': 31, 'n_units_l7': 6, 'n_units_l8': 13, 'n_units_l9': 14, 'n_units_l10': 15, 'n_units_l11': 14, 'n_units_l12': 6, 'n_units_l13': 12, 'n_units_l14': 32, 'optimizer': 'RMSprop', 'rmsprop_learning_rate': 0.00012127228866314765, 'rmsprop_weight_decay': 0.9636131545785008, 'rmsprop_momentum': 0.005186340016268501}. Best is trial 12 with value: 0.682539701461792.
Trial 24 finished with value: 0.5873016119003296 and parameters: {'n_layers': 12, 'weight_decay': 3.7902214515745894e-10, 'n_units_l0': 83, 'n_units_l1': 6, 'n_units_l2': 9, 'n_units_l3': 127, 'n_units_l4': 8, 'n_units_l5': 4, 'n_units_l6': 34, 'n_units_l7': 5, 'n_units_l8': 7, 'n_units_l9': 8, 'n_units_l10': 15, 'n_units_l11': 6, 'optimizer': 'RMSprop', 'rmsprop_learning_rate': 6.017272333243613e-05, 'rmsprop_weight_decay': 0.9562398064602048, 'rmsprop_momentum': 0.00362691065485966}. Best is trial 12 with value: 0.682539701461792.
Trial 25 finished with value: 0.6349206566810608 and parameters: {'n_layers': 7, 'weight_decay': 1.3946593398729449e-08, 'n_units_l0': 26, 'n_units_l1': 20, 'n_units_l2': 6, 'n_units_l3': 8, 'n_units_l4': 6, 'n_units_l5': 17, 'n_units_l6': 11, 'optimizer': 'RMSprop', 'rmsprop_learning_rate': 0.01546068359001072, 'rmsprop_weight_decay': 0.9676136257580571, 'rmsprop_momentum': 9.751342230007799e-05}. Best is trial 12 with value: 0.682539701461792.
Trial 26 finished with value: 0.6666666865348816 and parameters: {'n_layers': 15, 'weight_decay': 4.138154567289238e-07, 'n_units_l0': 40, 'n_units_l1': 12, 'n_units_l2': 5, 'n_units_l3': 62, 'n_units_l4': 5, 'n_units_l5': 67, 'n_units_l6': 24, 'n_units_l7': 10, 'n_units_l8': 19, 'n_units_l9': 18, 'n_units_l10': 58, 'n_units_l11': 13, 'n_units_l12': 4, 'n_units_l13': 23, 'n_units_l14': 34, 'optimizer': 'RMSprop', 'rmsprop_learning_rate': 0.00045619375724903017, 'rmsprop_weight_decay': 0.9301810561247122, 'rmsprop_momentum': 0.002053811605836096}. Best is trial 12 with value: 0.682539701461792.
Trial 27 finished with value: 0.5873016119003296 and parameters: {'n_layers': 11, 'weight_decay': 2.3971608373343472e-09, 'n_units_l0': 39, 'n_units_l1': 29, 'n_units_l2': 5, 'n_units_l3': 43, 'n_units_l4': 9, 'n_units_l5': 74, 'n_units_l6': 21, 'n_units_l7': 12, 'n_units_l8': 25, 'n_units_l9': 12, 'n_units_l10': 58, 'optimizer': 'RMSprop', 'rmsprop_learning_rate': 0.0008158284682092001, 'rmsprop_weight_decay': 0.900582184413358, 'rmsprop_momentum': 0.00016305928917252293}. Best is trial 12 with value: 0.682539701461792.
Trial 28 finished with value: 0.6349206566810608 and parameters: {'n_layers': 6, 'weight_decay': 5.9369316789114616e-08, 'n_units_l0': 43, 'n_units_l1': 7, 'n_units_l2': 11, 'n_units_l3': 28, 'n_units_l4': 6, 'n_units_l5': 46, 'optimizer': 'RMSprop', 'rmsprop_learning_rate': 0.017869618865646204, 'rmsprop_weight_decay': 0.9274541639838261, 'rmsprop_momentum': 0.001450500885353472}. Best is trial 12 with value: 0.682539701461792.
Trial 29 finished with value: 0.5714285969734192 and parameters: {'n_layers': 21, 'weight_decay': 7.958389918219933e-10, 'n_units_l0': 19, 'n_units_l1': 14, 'n_units_l2': 7, 'n_units_l3': 18, 'n_units_l4': 11, 'n_units_l5': 84, 'n_units_l6': 9, 'n_units_l7': 9, 'n_units_l8': 17, 'n_units_l9': 32, 'n_units_l10': 63, 'n_units_l11': 28, 'n_units_l12': 4, 'n_units_l13': 22, 'n_units_l14': 52, 'n_units_l15': 120, 'n_units_l16': 8, 'n_units_l17': 9, 'n_units_l18': 32, 'n_units_l19': 122, 'n_units_l20': 4, 'optimizer': 'RMSprop', 'rmsprop_learning_rate': 0.0006434870237059106, 'rmsprop_weight_decay': 0.8820571519786905, 'rmsprop_momentum': 0.020007339051598183}. Best is trial 12 with value: 0.682539701461792.
Trial 30 finished with value: 0.6349206566810608 and parameters: {'n_layers': 14, 'weight_decay': 1.7166221210946382e-10, 'n_units_l0': 28, 'n_units_l1': 41, 'n_units_l2': 5, 'n_units_l3': 65, 'n_units_l4': 5, 'n_units_l5': 125, 'n_units_l6': 17, 'n_units_l7': 15, 'n_units_l8': 9, 'n_units_l9': 62, 'n_units_l10': 33, 'n_units_l11': 17, 'n_units_l12': 4, 'n_units_l13': 56, 'optimizer': 'RMSprop', 'rmsprop_learning_rate': 0.011695122091146527, 'rmsprop_weight_decay': 0.9276129424407898, 'rmsprop_momentum': 0.0002474940138206255}. Best is trial 12 with value: 0.682539701461792.
Trial 31 finished with value: 0.5714285969734192 and parameters: {'n_layers': 16, 'weight_decay': 4.0248614928037284e-07, 'n_units_l0': 65, 'n_units_l1': 12, 'n_units_l2': 4, 'n_units_l3': 95, 'n_units_l4': 4, 'n_units_l5': 29, 'n_units_l6': 26, 'n_units_l7': 28, 'n_units_l8': 16, 'n_units_l9': 19, 'n_units_l10': 40, 'n_units_l11': 12, 'n_units_l12': 7, 'n_units_l13': 30, 'n_units_l14': 29, 'n_units_l15': 109, 'optimizer': 'RMSprop', 'rmsprop_learning_rate': 0.00015096103734885366, 'rmsprop_weight_decay': 0.9504359668862961, 'rmsprop_momentum': 0.0022022830495946207}. Best is trial 12 with value: 0.682539701461792.
Trial 32 finished with value: 0.5714285969734192 and parameters: {'n_layers': 18, 'weight_decay': 1.0382336124937506e-06, 'n_units_l0': 85, 'n_units_l1': 11, 'n_units_l2': 6, 'n_units_l3': 97, 'n_units_l4': 4, 'n_units_l5': 5, 'n_units_l6': 43, 'n_units_l7': 5, 'n_units_l8': 11, 'n_units_l9': 21, 'n_units_l10': 25, 'n_units_l11': 12, 'n_units_l12': 8, 'n_units_l13': 22, 'n_units_l14': 40, 'n_units_l15': 61, 'n_units_l16': 7, 'n_units_l17': 10, 'optimizer': 'RMSprop', 'rmsprop_learning_rate': 3.5717482523135086e-05, 'rmsprop_weight_decay': 0.9720832558348254, 'rmsprop_momentum': 0.008222658324590477}. Best is trial 12 with value: 0.682539701461792.
Trial 33 finished with value: 0.6349206566810608 and parameters: {'n_layers': 15, 'weight_decay': 5.78155472697066e-06, 'n_units_l0': 64, 'n_units_l1': 16, 'n_units_l2': 8, 'n_units_l3': 101, 'n_units_l4': 5, 'n_units_l5': 9, 'n_units_l6': 25, 'n_units_l7': 7, 'n_units_l8': 6, 'n_units_l9': 10, 'n_units_l10': 15, 'n_units_l11': 15, 'n_units_l12': 5, 'n_units_l13': 16, 'n_units_l14': 21, 'optimizer': 'RMSprop', 'rmsprop_learning_rate': 0.0002792148723689992, 'rmsprop_weight_decay': 0.9756251011180346, 'rmsprop_momentum': 4.041014470434725e-05}. Best is trial 12 with value: 0.682539701461792.
Trial 34 finished with value: 0.5714285969734192 and parameters: {'n_layers': 19, 'weight_decay': 8.211407867933043e-07, 'n_units_l0': 48, 'n_units_l1': 19, 'n_units_l2': 13, 'n_units_l3': 50, 'n_units_l4': 7, 'n_units_l5': 59, 'n_units_l6': 74, 'n_units_l7': 4, 'n_units_l8': 16, 'n_units_l9': 6, 'n_units_l10': 6, 'n_units_l11': 21, 'n_units_l12': 5, 'n_units_l13': 8, 'n_units_l14': 13, 'n_units_l15': 78, 'n_units_l16': 20, 'n_units_l17': 10, 'n_units_l18': 17, 'optimizer': 'RMSprop', 'rmsprop_learning_rate': 0.0019181181743543859, 'rmsprop_weight_decay': 0.9387529050571621, 'rmsprop_momentum': 0.0013139666206033631}. Best is trial 12 with value: 0.682539701461792.
Trial 35 finished with value: 0.6190476417541504 and parameters: {'n_layers': 13, 'weight_decay': 1.7997883372294646e-07, 'n_units_l0': 96, 'n_units_l1': 7, 'n_units_l2': 5, 'n_units_l3': 78, 'n_units_l4': 57, 'n_units_l5': 6, 'n_units_l6': 38, 'n_units_l7': 10, 'n_units_l8': 39, 'n_units_l9': 30, 'n_units_l10': 65, 'n_units_l11': 10, 'n_units_l12': 9, 'optimizer': 'RMSprop', 'rmsprop_learning_rate': 0.00040083162877422945, 'rmsprop_weight_decay': 0.954476250498094, 'rmsprop_momentum': 0.013270813765065373}. Best is trial 12 with value: 0.682539701461792.
Trial 36 finished with value: 0.5555555820465088 and parameters: {'n_layers': 16, 'weight_decay': 3.2165122208266426e-06, 'n_units_l0': 15, 'n_units_l1': 11, 'n_units_l2': 4, 'n_units_l3': 31, 'n_units_l4': 4, 'n_units_l5': 11, 'n_units_l6': 15, 'n_units_l7': 6, 'n_units_l8': 28, 'n_units_l9': 21, 'n_units_l10': 18, 'n_units_l11': 6, 'n_units_l12': 6, 'n_units_l13': 43, 'n_units_l14': 24, 'n_units_l15': 12, 'optimizer': 'RMSprop', 'rmsprop_learning_rate': 4.116914997628559e-05, 'rmsprop_weight_decay': 0.9124037471568119, 'rmsprop_momentum': 0.03573345309391766}. Best is trial 12 with value: 0.682539701461792.
Trial 37 finished with value: 0.4920634925365448 and parameters: {'n_layers': 3, 'weight_decay': 2.6414013230555105e-05, 'n_units_l0': 62, 'n_units_l1': 4, 'n_units_l2': 7, 'optimizer': 'RMSprop', 'rmsprop_learning_rate': 0.00010916273590059848, 'rmsprop_weight_decay': 0.9784919828026433, 'rmsprop_momentum': 0.0038496019151700645}. Best is trial 12 with value: 0.682539701461792.
