Trial 218 finished with value: 0.60317462682724 and parameters: {'n_layers': 15, 'weight_decay': 4.469164814367006e-10, 'n_units_l0': 75, 'n_units_l1': 30, 'n_units_l2': 27, 'n_units_l3': 32, 'n_units_l4': 66, 'n_units_l5': 61, 'n_units_l6': 14, 'n_units_l7': 4, 'n_units_l8': 20, 'n_units_l9': 13, 'n_units_l10': 58, 'n_units_l11': 8, 'n_units_l12': 9, 'n_units_l13': 29, 'n_units_l14': 71, 'optimizer': 'RMSprop', 'rmsprop_learning_rate': 0.03023949460804644, 'rmsprop_weight_decay': 0.9841840653851112, 'rmsprop_momentum': 0.001892698056615994}. Best is trial 111 with value: 0.7301587462425232.
Trial 219 finished with value: 0.5555555820465088 and parameters: {'n_layers': 16, 'weight_decay': 3.2267549730580133e-10, 'n_units_l0': 34, 'n_units_l1': 8, 'n_units_l2': 117, 'n_units_l3': 24, 'n_units_l4': 8, 'n_units_l5': 48, 'n_units_l6': 37, 'n_units_l7': 42, 'n_units_l8': 30, 'n_units_l9': 20, 'n_units_l10': 93, 'n_units_l11': 113, 'n_units_l12': 24, 'n_units_l13': 9, 'n_units_l14': 50, 'n_units_l15': 13, 'optimizer': 'SGD', 'sgd_opt_learning_rate': 0.03098726839442736, 'sgd_opt_momentum': 0.0021534822662923263}. Best is trial 111 with value: 0.7301587462425232.
Trial 220 finished with value: 0.5396825671195984 and parameters: {'n_layers': 15, 'weight_decay': 1.0000149546182698e-10, 'n_units_l0': 84, 'n_units_l1': 46, 'n_units_l2': 106, 'n_units_l3': 101, 'n_units_l4': 9, 'n_units_l5': 55, 'n_units_l6': 12, 'n_units_l7': 24, 'n_units_l8': 27, 'n_units_l9': 18, 'n_units_l10': 65, 'n_units_l11': 14, 'n_units_l12': 64, 'n_units_l13': 20, 'n_units_l14': 21, 'optimizer': 'RMSprop', 'rmsprop_learning_rate': 9.950285879663476e-05, 'rmsprop_weight_decay': 0.927899972669556, 'rmsprop_momentum': 0.0014997721530496716}. Best is trial 111 with value: 0.7301587462425232.
Trial 221 finished with value: 0.6349206566810608 and parameters: {'n_layers': 14, 'weight_decay': 2.4878471482837825e-07, 'n_units_l0': 51, 'n_units_l1': 11, 'n_units_l2': 7, 'n_units_l3': 80, 'n_units_l4': 10, 'n_units_l5': 69, 'n_units_l6': 20, 'n_units_l7': 21, 'n_units_l8': 18, 'n_units_l9': 23, 'n_units_l10': 20, 'n_units_l11': 11, 'n_units_l12': 47, 'n_units_l13': 12, 'optimizer': 'RMSprop', 'rmsprop_learning_rate': 0.00017020276792035908, 'rmsprop_weight_decay': 0.9401090956721206, 'rmsprop_momentum': 0.0001849519814497746}. Best is trial 111 with value: 0.7301587462425232.
Trial 222 finished with value: 0.60317462682724 and parameters: {'n_layers': 14, 'weight_decay': 0.00010588258039488077, 'n_units_l0': 5, 'n_units_l1': 10, 'n_units_l2': 6, 'n_units_l3': 113, 'n_units_l4': 10, 'n_units_l5': 10, 'n_units_l6': 16, 'n_units_l7': 6, 'n_units_l8': 19, 'n_units_l9': 27, 'n_units_l10': 45, 'n_units_l11': 11, 'n_units_l12': 31, 'n_units_l13': 23, 'optimizer': 'RMSprop', 'rmsprop_learning_rate': 0.0002918264847546975, 'rmsprop_weight_decay': 0.9508310851042068, 'rmsprop_momentum': 0.00023131000142381867}. Best is trial 111 with value: 0.7301587462425232.
Trial 223 finished with value: 0.523809552192688 and parameters: {'n_layers': 14, 'weight_decay': 3.843225328010644e-05, 'n_units_l0': 15, 'n_units_l1': 9, 'n_units_l2': 96, 'n_units_l3': 94, 'n_units_l4': 48, 'n_units_l5': 34, 'n_units_l6': 18, 'n_units_l7': 16, 'n_units_l8': 15, 'n_units_l9': 24, 'n_units_l10': 22, 'n_units_l11': 10, 'n_units_l12': 8, 'n_units_l13': 10, 'optimizer': 'RMSprop', 'rmsprop_learning_rate': 0.00022207226248595067, 'rmsprop_weight_decay': 0.9422526605900055, 'rmsprop_momentum': 0.00016260815909039536}. Best is trial 111 with value: 0.7301587462425232.
Trial 224 finished with value: 0.4920634925365448 and parameters: {'n_layers': 16, 'weight_decay': 8.227374564679621e-07, 'n_units_l0': 59, 'n_units_l1': 12, 'n_units_l2': 28, 'n_units_l3': 90, 'n_units_l4': 11, 'n_units_l5': 17, 'n_units_l6': 14, 'n_units_l7': 9, 'n_units_l8': 21, 'n_units_l9': 26, 'n_units_l10': 26, 'n_units_l11': 12, 'n_units_l12': 9, 'n_units_l13': 21, 'n_units_l14': 87, 'n_units_l15': 5, 'optimizer': 'RMSprop', 'rmsprop_learning_rate': 0.016009787973243657, 'rmsprop_weight_decay': 0.9473624663153871, 'rmsprop_momentum': 0.00011153871849737805}. Best is trial 111 with value: 0.7301587462425232.
Trial 225 finished with value: 0.5396825671195984 and parameters: {'n_layers': 15, 'weight_decay': 2.398248935738217e-10, 'n_units_l0': 52, 'n_units_l1': 28, 'n_units_l2': 128, 'n_units_l3': 107, 'n_units_l4': 9, 'n_units_l5': 19, 'n_units_l6': 15, 'n_units_l7': 26, 'n_units_l8': 16, 'n_units_l9': 34, 'n_units_l10': 14, 'n_units_l11': 13, 'n_units_l12': 10, 'n_units_l13': 8, 'n_units_l14': 45, 'optimizer': 'RMSprop', 'rmsprop_learning_rate': 0.00013646377749924153, 'rmsprop_weight_decay': 0.9875044633370698, 'rmsprop_momentum': 7.138786373437439e-05}. Best is trial 111 with value: 0.7301587462425232.
Trial 226 finished with value: 0.6349206566810608 and parameters: {'n_layers': 17, 'weight_decay': 1.4371963799230513e-10, 'n_units_l0': 68, 'n_units_l1': 36, 'n_units_l2': 31, 'n_units_l3': 62, 'n_units_l4': 61, 'n_units_l5': 6, 'n_units_l6': 13, 'n_units_l7': 23, 'n_units_l8': 19, 'n_units_l9': 31, 'n_units_l10': 60, 'n_units_l11': 9, 'n_units_l12': 22, 'n_units_l13': 18, 'n_units_l14': 53, 'n_units_l15': 64, 'n_units_l16': 17, 'optimizer': 'RMSprop', 'rmsprop_learning_rate': 0.0003645841499727623, 'rmsprop_weight_decay': 0.9831717347268593, 'rmsprop_momentum': 0.00013088238672994944}. Best is trial 111 with value: 0.7301587462425232.
Trial 227 finished with value: 0.5555555820465088 and parameters: {'n_layers': 15, 'weight_decay': 0.00048323956027269586, 'n_units_l0': 55, 'n_units_l1': 70, 'n_units_l2': 5, 'n_units_l3': 121, 'n_units_l4': 12, 'n_units_l5': 64, 'n_units_l6': 11, 'n_units_l7': 5, 'n_units_l8': 17, 'n_units_l9': 9, 'n_units_l10': 85, 'n_units_l11': 8, 'n_units_l12': 28, 'n_units_l13': 13, 'n_units_l14': 27, 'optimizer': 'RMSprop', 'rmsprop_learning_rate': 0.09993403329641191, 'rmsprop_weight_decay': 0.9360802120733829, 'rmsprop_momentum': 0.002963709766656214}. Best is trial 111 with value: 0.7301587462425232.
Trial 228 finished with value: 0.6507936716079712 and parameters: {'n_layers': 16, 'weight_decay': 5.447012548750697e-10, 'n_units_l0': 48, 'n_units_l1': 38, 'n_units_l2': 34, 'n_units_l3': 127, 'n_units_l4': 7, 'n_units_l5': 74, 'n_units_l6': 20, 'n_units_l7': 12, 'n_units_l8': 24, 'n_units_l9': 22, 'n_units_l10': 51, 'n_units_l11': 11, 'n_units_l12': 10, 'n_units_l13': 6, 'n_units_l14': 63, 'n_units_l15': 37, 'optimizer': 'RMSprop', 'rmsprop_learning_rate': 4.7672296288050606e-05, 'rmsprop_weight_decay': 0.8544425204310333, 'rmsprop_momentum': 0.0023649520325062213}. Best is trial 111 with value: 0.7301587462425232.
Trial 229 finished with value: 0.5873016119003296 and parameters: {'n_layers': 18, 'weight_decay': 8.007735702160454e-05, 'n_units_l0': 62, 'n_units_l1': 10, 'n_units_l2': 87, 'n_units_l3': 98, 'n_units_l4': 84, 'n_units_l5': 8, 'n_units_l6': 17, 'n_units_l7': 33, 'n_units_l8': 22, 'n_units_l9': 11, 'n_units_l10': 97, 'n_units_l11': 10, 'n_units_l12': 35, 'n_units_l13': 32, 'n_units_l14': 96, 'n_units_l15': 15, 'n_units_l16': 13, 'n_units_l17': 55, 'optimizer': 'RMSprop', 'rmsprop_learning_rate': 0.0004425565873172236, 'rmsprop_weight_decay': 0.9439175736303045, 'rmsprop_momentum': 9.644447398548695e-05}. Best is trial 111 with value: 0.7301587462425232.
Trial 230 finished with value: 0.5396825671195984 and parameters: {'n_layers': 14, 'weight_decay': 7.530192211531164e-10, 'n_units_l0': 41, 'n_units_l1': 34, 'n_units_l2': 68, 'n_units_l3': 111, 'n_units_l4': 52, 'n_units_l5': 21, 'n_units_l6': 10, 'n_units_l7': 36, 'n_units_l8': 18, 'n_units_l9': 8, 'n_units_l10': 75, 'n_units_l11': 12, 'n_units_l12': 11, 'n_units_l13': 9, 'optimizer': 'RMSprop', 'rmsprop_learning_rate': 0.08214791861041089, 'rmsprop_weight_decay': 0.9784820272174165, 'rmsprop_momentum': 0.0002051815448496764}. Best is trial 111 with value: 0.7301587462425232.
Trial 231 finished with value: 0.5079365372657776 and parameters: {'n_layers': 17, 'weight_decay': 3.403357544276019e-10, 'n_units_l0': 37, 'n_units_l1': 11, 'n_units_l2': 8, 'n_units_l3': 118, 'n_units_l4': 4, 'n_units_l5': 86, 'n_units_l6': 24, 'n_units_l7': 18, 'n_units_l8': 6, 'n_units_l9': 118, 'n_units_l10': 24, 'n_units_l11': 16, 'n_units_l12': 7, 'n_units_l13': 9, 'n_units_l14': 73, 'n_units_l15': 85, 'n_units_l16': 11, 'optimizer': 'RMSprop', 'rmsprop_learning_rate': 0.0032195412073508785, 'rmsprop_weight_decay': 0.9720835388440188, 'rmsprop_momentum': 0.00060775367391457}. Best is trial 111 with value: 0.7301587462425232.
Trial 232 finished with value: 0.5873016119003296 and parameters: {'n_layers': 16, 'weight_decay': 4.0757740559557333e-07, 'n_units_l0': 35, 'n_units_l1': 31, 'n_units_l2': 6, 'n_units_l3': 30, 'n_units_l4': 45, 'n_units_l5': 58, 'n_units_l6': 22, 'n_units_l7': 18, 'n_units_l8': 20, 'n_units_l9': 83, 'n_units_l10': 56, 'n_units_l11': 9, 'n_units_l12': 8, 'n_units_l13': 8, 'n_units_l14': 69, 'n_units_l15': 69, 'optimizer': 'RMSprop', 'rmsprop_learning_rate': 0.0006315289567006557, 'rmsprop_weight_decay': 0.9760159947377971, 'rmsprop_momentum': 0.0004097402878520248}. Best is trial 111 with value: 0.7301587462425232.
Trial 233 finished with value: 0.5079365372657776 and parameters: {'n_layers': 16, 'weight_decay': 7.180901052022006e-08, 'n_units_l0': 43, 'n_units_l1': 12, 'n_units_l2': 7, 'n_units_l3': 121, 'n_units_l4': 13, 'n_units_l5': 79, 'n_units_l6': 19, 'n_units_l7': 20, 'n_units_l8': 7, 'n_units_l9': 37, 'n_units_l10': 4, 'n_units_l11': 14, 'n_units_l12': 9, 'n_units_l13': 25, 'n_units_l14': 76, 'n_units_l15': 81, 'optimizer': 'RMSprop', 'rmsprop_learning_rate': 0.0025620346602035398, 'rmsprop_weight_decay': 0.9805785032375093, 'rmsprop_momentum': 0.0005045301887137438}. Best is trial 111 with value: 0.7301587462425232.
Trial 234 finished with value: 0.5555555820465088 and parameters: {'n_layers': 15, 'weight_decay': 1.143903609234614e-09, 'n_units_l0': 32, 'n_units_l1': 19, 'n_units_l2': 5, 'n_units_l3': 104, 'n_units_l4': 4, 'n_units_l5': 52, 'n_units_l6': 13, 'n_units_l7': 17, 'n_units_l8': 8, 'n_units_l9': 10, 'n_units_l10': 69, 'n_units_l11': 13, 'n_units_l12': 4, 'n_units_l13': 11, 'n_units_l14': 35, 'optimizer': 'RMSprop', 'rmsprop_learning_rate': 7.687178626854962e-05, 'rmsprop_weight_decay': 0.9870802326933243, 'rmsprop_momentum': 0.0003385152700359004}. Best is trial 111 with value: 0.7301587462425232.
Trial 235 finished with value: 0.6190476417541504 and parameters: {'n_layers': 17, 'weight_decay': 1.892042031288985e-10, 'n_units_l0': 120, 'n_units_l1': 8, 'n_units_l2': 7, 'n_units_l3': 113, 'n_units_l4': 10, 'n_units_l5': 43, 'n_units_l6': 11, 'n_units_l7': 14, 'n_units_l8': 22, 'n_units_l9': 9, 'n_units_l10': 22, 'n_units_l11': 12, 'n_units_l12': 25, 'n_units_l13': 10, 'n_units_l14': 82, 'n_units_l15': 103, 'n_units_l16': 20, 'optimizer': 'Adam', 'adam_learning_rate': 0.00025126825496904286}. Best is trial 111 with value: 0.7301587462425232.
Trial 236 finished with value: 0.5714285969734192 and parameters: {'n_layers': 15, 'weight_decay': 4.738506245651721e-10, 'n_units_l0': 38, 'n_units_l1': 10, 'n_units_l2': 80, 'n_units_l3': 128, 'n_units_l4': 8, 'n_units_l5': 18, 'n_units_l6': 9, 'n_units_l7': 15, 'n_units_l8': 5, 'n_units_l9': 10, 'n_units_l10': 90, 'n_units_l11': 14, 'n_units_l12': 12, 'n_units_l13': 7, 'n_units_l14': 60, 'optimizer': 'RMSprop', 'rmsprop_learning_rate': 0.001051930539442563, 'rmsprop_weight_decay': 0.9652932361305774, 'rmsprop_momentum': 0.0007378617552928968}. Best is trial 111 with value: 0.7301587462425232.
Trial 237 finished with value: 0.5714285969734192 and parameters: {'n_layers': 16, 'weight_decay': 1.50593583831198e-10, 'n_units_l0': 105, 'n_units_l1': 27, 'n_units_l2': 11, 'n_units_l3': 103, 'n_units_l4': 9, 'n_units_l5': 49, 'n_units_l6': 12, 'n_units_l7': 22, 'n_units_l8': 20, 'n_units_l9': 7, 'n_units_l10': 80, 'n_units_l11': 13, 'n_units_l12': 18, 'n_units_l13': 9, 'n_units_l14': 66, 'n_units_l15': 91, 'optimizer': 'RMSprop', 'rmsprop_learning_rate': 3.067821179932865e-05, 'rmsprop_weight_decay': 0.9710032242762819, 'rmsprop_momentum': 0.00015392495096584435}. Best is trial 111 with value: 0.7301587462425232.
Trial 238 finished with value: 0.5873016119003296 and parameters: {'n_layers': 15, 'weight_decay': 6.117793904456517e-07, 'n_units_l0': 77, 'n_units_l1': 9, 'n_units_l2': 52, 'n_units_l3': 35, 'n_units_l4': 43, 'n_units_l5': 23, 'n_units_l6': 23, 'n_units_l7': 30, 'n_units_l8': 33, 'n_units_l9': 8, 'n_units_l10': 60, 'n_units_l11': 8, 'n_units_l12': 5, 'n_units_l13': 16, 'n_units_l14': 32, 'optimizer': 'RMSprop', 'rmsprop_learning_rate': 0.020613574743968317, 'rmsprop_weight_decay': 0.985205970309388, 'rmsprop_momentum': 0.0004291701153932662}. Best is trial 111 with value: 0.7301587462425232.
Trial 239 finished with value: 0.6190476417541504 and parameters: {'n_layers': 14, 'weight_decay': 8.183011594363168e-10, 'n_units_l0': 59, 'n_units_l1': 21, 'n_units_l2': 8, 'n_units_l3': 115, 'n_units_l4': 48, 'n_units_l5': 108, 'n_units_l6': 21, 'n_units_l7': 10, 'n_units_l8': 6, 'n_units_l9': 54, 'n_units_l10': 52, 'n_units_l11': 10, 'n_units_l12': 9, 'n_units_l13': 19, 'optimizer': 'SGD', 'sgd_opt_learning_rate': 0.0986986364265044, 'sgd_opt_momentum': 1.594162598559581e-05}. Best is trial 111 with value: 0.7301587462425232.
Trial 240 finished with value: 0.5873016119003296 and parameters: {'n_layers': 16, 'weight_decay': 1.6544019104244797e-05, 'n_units_l0': 71, 'n_units_l1': 11, 'n_units_l2': 14, 'n_units_l3': 20, 'n_units_l4': 54, 'n_units_l5': 45, 'n_units_l6': 15, 'n_units_l7': 7, 'n_units_l8': 28, 'n_units_l9': 100, 'n_units_l10': 16, 'n_units_l11': 11, 'n_units_l12': 45, 'n_units_l13': 36, 'n_units_l14': 56, 'n_units_l15': 31, 'optimizer': 'RMSprop', 'rmsprop_learning_rate': 0.011105608744916763, 'rmsprop_weight_decay': 0.9899723603595977, 'rmsprop_momentum': 0.0002700116683323429}. Best is trial 111 with value: 0.7301587462425232.
Trial 241 finished with value: 0.6349206566810608 and parameters: {'n_layers': 14, 'weight_decay': 1.1177816704140697e-09, 'n_units_l0': 80, 'n_units_l1': 10, 'n_units_l2': 61, 'n_units_l3': 28, 'n_units_l4': 41, 'n_units_l5': 19, 'n_units_l6': 16, 'n_units_l7': 11, 'n_units_l8': 26, 'n_units_l9': 9, 'n_units_l10': 8, 'n_units_l11': 17, 'n_units_l12': 11, 'n_units_l13': 7, 'optimizer': 'RMSprop', 'rmsprop_learning_rate': 0.0528433613706845, 'rmsprop_weight_decay': 0.9818759633747777, 'rmsprop_momentum': 4.5067441769136206e-05}. Best is trial 111 with value: 0.7301587462425232.
Trial 242 finished with value: 0.5873016119003296 and parameters: {'n_layers': 13, 'weight_decay': 6.773302901606049e-10, 'n_units_l0': 85, 'n_units_l1': 13, 'n_units_l2': 69, 'n_units_l3': 120, 'n_units_l4': 37, 'n_units_l5': 18, 'n_units_l6': 14, 'n_units_l7': 11, 'n_units_l8': 23, 'n_units_l9': 9, 'n_units_l10': 10, 'n_units_l11': 15, 'n_units_l12': 12, 'optimizer': 'RMSprop', 'rmsprop_learning_rate': 0.0017083033122465337, 'rmsprop_weight_decay': 0.9775427331131521, 'rmsprop_momentum': 8.308604164975897e-05}. Best is trial 111 with value: 0.7301587462425232.
Trial 243 finished with value: 0.6666666865348816 and parameters: {'n_layers': 14, 'weight_decay': 9.438359280737066e-10, 'n_units_l0': 90, 'n_units_l1': 10, 'n_units_l2': 58, 'n_units_l3': 26, 'n_units_l4': 40, 'n_units_l5': 20, 'n_units_l6': 14, 'n_units_l7': 24, 'n_units_l8': 24, 'n_units_l9': 20, 'n_units_l10': 9, 'n_units_l11': 15, 'n_units_l12': 10, 'n_units_l13': 22, 'optimizer': 'RMSprop', 'rmsprop_learning_rate': 0.0611694982916474, 'rmsprop_weight_decay': 0.9750095970424211, 'rmsprop_momentum': 5.447728101399966e-05}. Best is trial 111 with value: 0.7301587462425232.
Trial 244 finished with value: 0.6507936716079712 and parameters: {'n_layers': 15, 'weight_decay': 7.713072786900834e-06, 'n_units_l0': 90, 'n_units_l1': 33, 'n_units_l2': 74, 'n_units_l3': 24, 'n_units_l4': 40, 'n_units_l5': 20, 'n_units_l6': 52, 'n_units_l7': 24, 'n_units_l8': 24, 'n_units_l9': 19, 'n_units_l10': 100, 'n_units_l11': 14, 'n_units_l12': 10, 'n_units_l13': 22, 'n_units_l14': 23, 'optimizer': 'RMSprop', 'rmsprop_learning_rate': 0.06402838002372194, 'rmsprop_weight_decay': 0.9724925554240141, 'rmsprop_momentum': 2.309829159306825e-05}. Best is trial 111 with value: 0.7301587462425232.
Trial 245 finished with value: 0.5396825671195984 and parameters: {'n_layers': 17, 'weight_decay': 2.4587753809386437e-10, 'n_units_l0': 98, 'n_units_l1': 11, 'n_units_l2': 56, 'n_units_l3': 27, 'n_units_l4': 5, 'n_units_l5': 21, 'n_units_l6': 13, 'n_units_l7': 26, 'n_units_l8': 21, 'n_units_l9': 21, 'n_units_l10': 11, 'n_units_l11': 13, 'n_units_l12': 9, 'n_units_l13': 24, 'n_units_l14': 40, 'n_units_l15': 51, 'n_units_l16': 15, 'optimizer': 'RMSprop', 'rmsprop_learning_rate': 0.06859670993490428, 'rmsprop_weight_decay': 0.9739669750524651, 'rmsprop_momentum': 5.4761486480546845e-05}. Best is trial 111 with value: 0.7301587462425232.
Trial 246 finished with value: 0.60317462682724 and parameters: {'n_layers': 14, 'weight_decay': 4.2627375445132484e-10, 'n_units_l0': 65, 'n_units_l1': 12, 'n_units_l2': 25, 'n_units_l3': 22, 'n_units_l4': 12, 'n_units_l5': 99, 'n_units_l6': 6, 'n_units_l7': 22, 'n_units_l8': 19, 'n_units_l9': 19, 'n_units_l10': 10, 'n_units_l11': 20, 'n_units_l12': 41, 'n_units_l13': 23, 'optimizer': 'RMSprop', 'rmsprop_learning_rate': 0.09031851234249144, 'rmsprop_weight_decay': 0.8842722881206068, 'rmsprop_momentum': 6.78304472134066e-05}. Best is trial 111 with value: 0.7301587462425232.
Trial 247 finished with value: 0.6349206566810608 and parameters: {'n_layers': 15, 'weight_decay': 1.2331625690176685e-10, 'n_units_l0': 111, 'n_units_l1': 9, 'n_units_l2': 28, 'n_units_l3': 108, 'n_units_l4': 44, 'n_units_l5': 41, 'n_units_l6': 10, 'n_units_l7': 28, 'n_units_l8': 57, 'n_units_l9': 20, 'n_units_l10': 12, 'n_units_l11': 16, 'n_units_l12': 10, 'n_units_l13': 20, 'n_units_l14': 8, 'optimizer': 'RMSprop', 'rmsprop_learning_rate': 1.8545357926727593e-05, 'rmsprop_weight_decay': 0.9672956258178977, 'rmsprop_momentum': 0.00011233474679139175}. Best is trial 111 with value: 0.7301587462425232.
Trial 248 finished with value: 0.5714285969734192 and parameters: {'n_layers': 16, 'weight_decay': 1.5872934553074533e-09, 'n_units_l0': 34, 'n_units_l1': 29, 'n_units_l2': 77, 'n_units_l3': 5, 'n_units_l4': 11, 'n_units_l5': 15, 'n_units_l6': 29, 'n_units_l7': 23, 'n_units_l8': 18, 'n_units_l9': 17, 'n_units_l10': 55, 'n_units_l11': 12, 'n_units_l12': 6, 'n_units_l13': 27, 'n_units_l14': 76, 'n_units_l15': 4, 'optimizer': 'RMSprop', 'rmsprop_learning_rate': 0.04443021527294797, 'rmsprop_weight_decay': 0.9748796552609542, 'rmsprop_momentum': 0.0002161099981725925}. Best is trial 111 with value: 0.7301587462425232.
Trial 249 finished with value: 0.6349206566810608 and parameters: {'n_layers': 17, 'weight_decay': 2.870331894979936e-10, 'n_units_l0': 91, 'n_units_l1': 41, 'n_units_l2': 67, 'n_units_l3': 26, 'n_units_l4': 114, 'n_units_l5': 33, 'n_units_l6': 12, 'n_units_l7': 20, 'n_units_l8': 25, 'n_units_l9': 22, 'n_units_l10': 63, 'n_units_l11': 9, 'n_units_l12': 7, 'n_units_l13': 40, 'n_units_l14': 61, 'n_units_l15': 57, 'n_units_l16': 7, 'optimizer': 'RMSprop', 'rmsprop_learning_rate': 0.05766719724648956, 'rmsprop_weight_decay': 0.962018497315255, 'rmsprop_momentum': 0.0035065160571116083}. Best is trial 111 with value: 0.7301587462425232.
Trial 250 finished with value: 0.5555555820465088 and parameters: {'n_layers': 14, 'weight_decay': 1.0838023340355855e-09, 'n_units_l0': 29, 'n_units_l1': 26, 'n_units_l2': 44, 'n_units_l3': 39, 'n_units_l4': 8, 'n_units_l5': 61, 'n_units_l6': 14, 'n_units_l7': 25, 'n_units_l8': 29, 'n_units_l9': 8, 'n_units_l10': 84, 'n_units_l11': 9, 'n_units_l12': 11, 'n_units_l13': 34, 'optimizer': 'RMSprop', 'rmsprop_learning_rate': 0.0021653887651688704, 'rmsprop_weight_decay': 0.984720007197867, 'rmsprop_momentum': 0.00013105763774331173}. Best is trial 111 with value: 0.7301587462425232.
Trial 251 finished with value: 0.5079365372657776 and parameters: {'n_layers': 15, 'weight_decay': 4.870838383415272e-10, 'n_units_l0': 40, 'n_units_l1': 10, 'n_units_l2': 85, 'n_units_l3': 93, 'n_units_l4': 6, 'n_units_l5': 47, 'n_units_l6': 18, 'n_units_l7': 22, 'n_units_l8': 21, 'n_units_l9': 63, 'n_units_l10': 47, 'n_units_l11': 13, 'n_units_l12': 27, 'n_units_l13': 18, 'n_units_l14': 20, 'optimizer': 'RMSprop', 'rmsprop_learning_rate': 0.0008294303782702614, 'rmsprop_weight_decay': 0.9694706850731728, 'rmsprop_momentum': 0.00010079906487073068}. Best is trial 111 with value: 0.7301587462425232.
Trial 252 finished with value: 0.5079365372657776 and parameters: {'n_layers': 13, 'weight_decay': 2.7527249784040676e-05, 'n_units_l0': 72, 'n_units_l1': 31, 'n_units_l2': 9, 'n_units_l3': 30, 'n_units_l4': 9, 'n_units_l5': 52, 'n_units_l6': 11, 'n_units_l7': 21, 'n_units_l8': 17, 'n_units_l9': 14, 'n_units_l10': 8, 'n_units_l11': 11, 'n_units_l12': 8, 'optimizer': 'RMSprop', 'rmsprop_learning_rate': 2.4133617312167957e-05, 'rmsprop_weight_decay': 0.952744564251976, 'rmsprop_momentum': 0.00029198513456339155}. Best is trial 111 with value: 0.7301587462425232.
Trial 253 finished with value: 0.5396825671195984 and parameters: {'n_layers': 18, 'weight_decay': 1.8627409188049427e-10, 'n_units_l0': 55, 'n_units_l1': 11, 'n_units_l2': 30, 'n_units_l3': 100, 'n_units_l4': 57, 'n_units_l5': 37, 'n_units_l6': 27, 'n_units_l7': 16, 'n_units_l8': 23, 'n_units_l9': 12, 'n_units_l10': 107, 'n_units_l11': 8, 'n_units_l12': 23, 'n_units_l13': 11, 'n_units_l14': 14, 'n_units_l15': 10, 'n_units_l16': 12, 'n_units_l17': 19, 'optimizer': 'RMSprop', 'rmsprop_learning_rate': 0.0014998817280831404, 'rmsprop_weight_decay': 0.979010318398375, 'rmsprop_momentum': 0.0009744142311358916}. Best is trial 111 with value: 0.7301587462425232.
