Trial 75 finished with value: 0.6349206566810608 and parameters: {'n_layers': 15, 'weight_decay': 7.029646608734827e-05, 'n_units_l0': 30, 'n_units_l1': 29, 'n_units_l2': 7, 'n_units_l3': 88, 'n_units_l4': 10, 'n_units_l5': 21, 'n_units_l6': 17, 'n_units_l7': 8, 'n_units_l8': 17, 'n_units_l9': 97, 'n_units_l10': 59, 'n_units_l11': 6, 'n_units_l12': 127, 'n_units_l13': 28, 'n_units_l14': 53, 'optimizer': 'RMSprop', 'rmsprop_learning_rate': 2.0343137958148453e-05, 'rmsprop_weight_decay': 0.9207333057451559, 'rmsprop_momentum': 0.00015267342725860874}. Best is trial 47 with value: 0.6984127163887024.
Trial 76 finished with value: 0.5714285969734192 and parameters: {'n_layers': 13, 'weight_decay': 8.446819882290527e-05, 'n_units_l0': 21, 'n_units_l1': 32, 'n_units_l2': 12, 'n_units_l3': 11, 'n_units_l4': 11, 'n_units_l5': 19, 'n_units_l6': 15, 'n_units_l7': 5, 'n_units_l8': 50, 'n_units_l9': 71, 'n_units_l10': 40, 'n_units_l11': 9, 'n_units_l12': 8, 'optimizer': 'RMSprop', 'rmsprop_learning_rate': 0.007314376146445558, 'rmsprop_weight_decay': 0.9256479750718607, 'rmsprop_momentum': 0.0002550436246383544}. Best is trial 47 with value: 0.6984127163887024.
Trial 77 finished with value: 0.5396825671195984 and parameters: {'n_layers': 17, 'weight_decay': 0.0001475631000138186, 'n_units_l0': 47, 'n_units_l1': 44, 'n_units_l2': 44, 'n_units_l3': 105, 'n_units_l4': 7, 'n_units_l5': 35, 'n_units_l6': 11, 'n_units_l7': 6, 'n_units_l8': 23, 'n_units_l9': 7, 'n_units_l10': 92, 'n_units_l11': 7, 'n_units_l12': 12, 'n_units_l13': 21, 'n_units_l14': 68, 'n_units_l15': 34, 'n_units_l16': 17, 'optimizer': 'Adam', 'adam_learning_rate': 0.000110278932143248}. Best is trial 47 with value: 0.6984127163887024.
Trial 78 finished with value: 0.5396825671195984 and parameters: {'n_layers': 15, 'weight_decay': 9.167782851079261e-09, 'n_units_l0': 25, 'n_units_l1': 23, 'n_units_l2': 32, 'n_units_l3': 33, 'n_units_l4': 16, 'n_units_l5': 14, 'n_units_l6': 5, 'n_units_l7': 16, 'n_units_l8': 9, 'n_units_l9': 106, 'n_units_l10': 49, 'n_units_l11': 5, 'n_units_l12': 9, 'n_units_l13': 24, 'n_units_l14': 34, 'optimizer': 'RMSprop', 'rmsprop_learning_rate': 1.5279566259430022e-05, 'rmsprop_weight_decay': 0.971775238369123, 'rmsprop_momentum': 0.00046678499678528266}. Best is trial 47 with value: 0.6984127163887024.
Trial 79 finished with value: 0.60317462682724 and parameters: {'n_layers': 18, 'weight_decay': 1.5864305759360413e-05, 'n_units_l0': 28, 'n_units_l1': 25, 'n_units_l2': 10, 'n_units_l3': 61, 'n_units_l4': 9, 'n_units_l5': 49, 'n_units_l6': 19, 'n_units_l7': 36, 'n_units_l8': 98, 'n_units_l9': 13, 'n_units_l10': 36, 'n_units_l11': 9, 'n_units_l12': 25, 'n_units_l13': 32, 'n_units_l14': 44, 'n_units_l15': 19, 'n_units_l16': 25, 'n_units_l17': 89, 'optimizer': 'RMSprop', 'rmsprop_learning_rate': 0.047203989875338075, 'rmsprop_weight_decay': 0.9849737596492076, 'rmsprop_momentum': 1.0324803408019269e-05}. Best is trial 47 with value: 0.6984127163887024.
Trial 80 finished with value: 0.5873016119003296 and parameters: {'n_layers': 11, 'weight_decay': 1.6191545392241847e-10, 'n_units_l0': 36, 'n_units_l1': 6, 'n_units_l2': 19, 'n_units_l3': 72, 'n_units_l4': 8, 'n_units_l5': 57, 'n_units_l6': 23, 'n_units_l7': 27, 'n_units_l8': 27, 'n_units_l9': 39, 'n_units_l10': 42, 'optimizer': 'SGD', 'sgd_opt_learning_rate': 1.010352390864629e-05, 'sgd_opt_momentum': 0.0009700615805764583}. Best is trial 47 with value: 0.6984127163887024.
Trial 81 finished with value: 0.5555555820465088 and parameters: {'n_layers': 16, 'weight_decay': 5.97301828299669e-10, 'n_units_l0': 62, 'n_units_l1': 16, 'n_units_l2': 6, 'n_units_l3': 119, 'n_units_l4': 4, 'n_units_l5': 43, 'n_units_l6': 33, 'n_units_l7': 4, 'n_units_l8': 19, 'n_units_l9': 15, 'n_units_l10': 9, 'n_units_l11': 13, 'n_units_l12': 7, 'n_units_l13': 40, 'n_units_l14': 28, 'n_units_l15': 69, 'optimizer': 'RMSprop', 'rmsprop_learning_rate': 0.00010741622863951219, 'rmsprop_weight_decay': 0.9671818790083898, 'rmsprop_momentum': 0.0014283095641297323}. Best is trial 47 with value: 0.6984127163887024.
Trial 82 finished with value: 0.6190476417541504 and parameters: {'n_layers': 14, 'weight_decay': 4.0964367674716757e-08, 'n_units_l0': 39, 'n_units_l1': 34, 'n_units_l2': 5, 'n_units_l3': 102, 'n_units_l4': 10, 'n_units_l5': 7, 'n_units_l6': 28, 'n_units_l7': 7, 'n_units_l8': 18, 'n_units_l9': 47, 'n_units_l10': 62, 'n_units_l11': 11, 'n_units_l12': 5, 'n_units_l13': 13, 'optimizer': 'RMSprop', 'rmsprop_learning_rate': 1.027413480728251e-05, 'rmsprop_weight_decay': 0.9737073679258365, 'rmsprop_momentum': 0.0008575385848361963}. Best is trial 47 with value: 0.6984127163887024.
Trial 83 finished with value: 0.6666666865348816 and parameters: {'n_layers': 15, 'weight_decay': 0.0009474991366629847, 'n_units_l0': 81, 'n_units_l1': 11, 'n_units_l2': 8, 'n_units_l3': 126, 'n_units_l4': 7, 'n_units_l5': 31, 'n_units_l6': 10, 'n_units_l7': 5, 'n_units_l8': 14, 'n_units_l9': 9, 'n_units_l10': 113, 'n_units_l11': 16, 'n_units_l12': 11, 'n_units_l13': 16, 'n_units_l14': 37, 'optimizer': 'RMSprop', 'rmsprop_learning_rate': 0.0008641141266918393, 'rmsprop_weight_decay': 0.9612530243427587, 'rmsprop_momentum': 0.0022024206668218647}. Best is trial 47 with value: 0.6984127163887024.
Trial 84 finished with value: 0.6349206566810608 and parameters: {'n_layers': 13, 'weight_decay': 0.000353660482354644, 'n_units_l0': 57, 'n_units_l1': 8, 'n_units_l2': 9, 'n_units_l3': 124, 'n_units_l4': 6, 'n_units_l5': 28, 'n_units_l6': 10, 'n_units_l7': 5, 'n_units_l8': 32, 'n_units_l9': 11, 'n_units_l10': 113, 'n_units_l11': 19, 'n_units_l12': 11, 'optimizer': 'RMSprop', 'rmsprop_learning_rate': 0.0016301373911930363, 'rmsprop_weight_decay': 0.9631058447997182, 'rmsprop_momentum': 0.0024329861120541926}. Best is trial 47 with value: 0.6984127163887024.
Trial 85 finished with value: 0.60317462682724 and parameters: {'n_layers': 16, 'weight_decay': 0.0001819134608575782, 'n_units_l0': 32, 'n_units_l1': 12, 'n_units_l2': 8, 'n_units_l3': 96, 'n_units_l4': 8, 'n_units_l5': 32, 'n_units_l6': 12, 'n_units_l7': 6, 'n_units_l8': 11, 'n_units_l9': 9, 'n_units_l10': 76, 'n_units_l11': 16, 'n_units_l12': 10, 'n_units_l13': 16, 'n_units_l14': 39, 'n_units_l15': 26, 'optimizer': 'RMSprop', 'rmsprop_learning_rate': 0.000681026113545611, 'rmsprop_weight_decay': 0.9779849572185532, 'rmsprop_momentum': 0.0011200934157596118}. Best is trial 47 with value: 0.6984127163887024.
Trial 86 finished with value: 0.6349206566810608 and parameters: {'n_layers': 14, 'weight_decay': 4.1108228046597224e-05, 'n_units_l0': 43, 'n_units_l1': 7, 'n_units_l2': 7, 'n_units_l3': 5, 'n_units_l4': 7, 'n_units_l5': 22, 'n_units_l6': 13, 'n_units_l7': 8, 'n_units_l8': 15, 'n_units_l9': 8, 'n_units_l10': 31, 'n_units_l11': 23, 'n_units_l12': 13, 'n_units_l13': 22, 'optimizer': 'RMSprop', 'rmsprop_learning_rate': 0.0009742480462059901, 'rmsprop_weight_decay': 0.952801761250669, 'rmsprop_momentum': 0.0005092065980970224}. Best is trial 47 with value: 0.6984127163887024.
Trial 87 finished with value: 0.6349206566810608 and parameters: {'n_layers': 17, 'weight_decay': 0.0005011183361592477, 'n_units_l0': 79, 'n_units_l1': 37, 'n_units_l2': 8, 'n_units_l3': 106, 'n_units_l4': 29, 'n_units_l5': 45, 'n_units_l6': 9, 'n_units_l7': 12, 'n_units_l8': 5, 'n_units_l9': 61, 'n_units_l10': 25, 'n_units_l11': 10, 'n_units_l12': 9, 'n_units_l13': 50, 'n_units_l14': 55, 'n_units_l15': 8, 'n_units_l16': 46, 'optimizer': 'RMSprop', 'rmsprop_learning_rate': 0.06585058727969594, 'rmsprop_weight_decay': 0.9395481520512262, 'rmsprop_momentum': 7.639542567483435e-05}. Best is trial 47 with value: 0.6984127163887024.
Trial 88 finished with value: 0.5396825671195984 and parameters: {'n_layers': 15, 'weight_decay': 0.0008044562129709436, 'n_units_l0': 52, 'n_units_l1': 9, 'n_units_l2': 10, 'n_units_l3': 53, 'n_units_l4': 65, 'n_units_l5': 38, 'n_units_l6': 16, 'n_units_l7': 20, 'n_units_l8': 21, 'n_units_l9': 9, 'n_units_l10': 108, 'n_units_l11': 14, 'n_units_l12': 17, 'n_units_l13': 18, 'n_units_l14': 46, 'optimizer': 'RMSprop', 'rmsprop_learning_rate': 0.003079350693322458, 'rmsprop_weight_decay': 0.9705241867347874, 'rmsprop_momentum': 0.0014915650919478762}. Best is trial 47 with value: 0.6984127163887024.
Trial 89 finished with value: 0.60317462682724 and parameters: {'n_layers': 20, 'weight_decay': 3.7656894823194295e-10, 'n_units_l0': 95, 'n_units_l1': 42, 'n_units_l2': 21, 'n_units_l3': 88, 'n_units_l4': 5, 'n_units_l5': 25, 'n_units_l6': 7, 'n_units_l7': 10, 'n_units_l8': 13, 'n_units_l9': 10, 'n_units_l10': 90, 'n_units_l11': 8, 'n_units_l12': 68, 'n_units_l13': 26, 'n_units_l14': 36, 'n_units_l15': 11, 'n_units_l16': 79, 'n_units_l17': 44, 'n_units_l18': 31, 'n_units_l19': 42, 'optimizer': 'RMSprop', 'rmsprop_learning_rate': 0.013661501745330835, 'rmsprop_weight_decay': 0.9776068936713572, 'rmsprop_momentum': 0.0003957925749106981}. Best is trial 47 with value: 0.6984127163887024.
Trial 90 finished with value: 0.6349206566810608 and parameters: {'n_layers': 18, 'weight_decay': 1.4023366451502598e-10, 'n_units_l0': 63, 'n_units_l1': 48, 'n_units_l2': 6, 'n_units_l3': 68, 'n_units_l4': 37, 'n_units_l5': 65, 'n_units_l6': 24, 'n_units_l7': 39, 'n_units_l8': 9, 'n_units_l9': 6, 'n_units_l10': 68, 'n_units_l11': 12, 'n_units_l12': 19, 'n_units_l13': 32, 'n_units_l14': 98, 'n_units_l15': 4, 'n_units_l16': 4, 'n_units_l17': 13, 'optimizer': 'Adam', 'adam_learning_rate': 0.008098173625620445}. Best is trial 47 with value: 0.6984127163887024.
Trial 91 finished with value: 0.5714285969734192 and parameters: {'n_layers': 15, 'weight_decay': 1.1095560587821261e-09, 'n_units_l0': 90, 'n_units_l1': 11, 'n_units_l2': 5, 'n_units_l3': 118, 'n_units_l4': 6, 'n_units_l5': 8, 'n_units_l6': 41, 'n_units_l7': 4, 'n_units_l8': 7, 'n_units_l9': 21, 'n_units_l10': 58, 'n_units_l11': 10, 'n_units_l12': 8, 'n_units_l13': 22, 'n_units_l14': 31, 'optimizer': 'RMSprop', 'rmsprop_learning_rate': 3.458508457372029e-05, 'rmsprop_weight_decay': 0.9609401713596258, 'rmsprop_momentum': 0.005148257703826879}. Best is trial 47 with value: 0.6984127163887024.
Trial 92 finished with value: 0.6190476417541504 and parameters: {'n_layers': 16, 'weight_decay': 1.0184578639206138e-05, 'n_units_l0': 74, 'n_units_l1': 14, 'n_units_l2': 4, 'n_units_l3': 127, 'n_units_l4': 5, 'n_units_l5': 18, 'n_units_l6': 20, 'n_units_l7': 5, 'n_units_l8': 15, 'n_units_l9': 15, 'n_units_l10': 82, 'n_units_l11': 13, 'n_units_l12': 11, 'n_units_l13': 14, 'n_units_l14': 24, 'n_units_l15': 54, 'optimizer': 'RMSprop', 'rmsprop_learning_rate': 0.00044103403503992954, 'rmsprop_weight_decay': 0.9589165350680171, 'rmsprop_momentum': 0.0019710038958857617}. Best is trial 47 with value: 0.6984127163887024.
Trial 93 finished with value: 0.6190476417541504 and parameters: {'n_layers': 16, 'weight_decay': 0.0009663124322699719, 'n_units_l0': 68, 'n_units_l1': 18, 'n_units_l2': 5, 'n_units_l3': 110, 'n_units_l4': 11, 'n_units_l5': 12, 'n_units_l6': 27, 'n_units_l7': 18, 'n_units_l8': 12, 'n_units_l9': 13, 'n_units_l10': 16, 'n_units_l11': 15, 'n_units_l12': 4, 'n_units_l13': 20, 'n_units_l14': 19, 'n_units_l15': 100, 'optimizer': 'RMSprop', 'rmsprop_learning_rate': 0.0011982739390658764, 'rmsprop_weight_decay': 0.9896797938935911, 'rmsprop_momentum': 0.0007228963518877742}. Best is trial 47 with value: 0.6984127163887024.
Trial 94 finished with value: 0.523809552192688 and parameters: {'n_layers': 17, 'weight_decay': 7.065898600016314e-10, 'n_units_l0': 20, 'n_units_l1': 10, 'n_units_l2': 28, 'n_units_l3': 26, 'n_units_l4': 9, 'n_units_l5': 87, 'n_units_l6': 35, 'n_units_l7': 24, 'n_units_l8': 25, 'n_units_l9': 19, 'n_units_l10': 7, 'n_units_l11': 115, 'n_units_l12': 6, 'n_units_l13': 17, 'n_units_l14': 32, 'n_units_l15': 36, 'n_units_l16': 12, 'optimizer': 'RMSprop', 'rmsprop_learning_rate': 7.464887217896269e-05, 'rmsprop_weight_decay': 0.9655260803634625, 'rmsprop_momentum': 0.0028991115471322707}. Best is trial 47 with value: 0.6984127163887024.
Trial 95 finished with value: 0.6507936716079712 and parameters: {'n_layers': 14, 'weight_decay': 5.713166272629425e-07, 'n_units_l0': 48, 'n_units_l1': 12, 'n_units_l2': 6, 'n_units_l3': 91, 'n_units_l4': 10, 'n_units_l5': 71, 'n_units_l6': 18, 'n_units_l7': 14, 'n_units_l8': 17, 'n_units_l9': 27, 'n_units_l10': 23, 'n_units_l11': 11, 'n_units_l12': 8, 'n_units_l13': 10, 'optimizer': 'RMSprop', 'rmsprop_learning_rate': 0.00026352453897790447, 'rmsprop_weight_decay': 0.948087033300527, 'rmsprop_momentum': 0.0001973118463966934}. Best is trial 47 with value: 0.6984127163887024.
Trial 96 finished with value: 0.5396825671195984 and parameters: {'n_layers': 12, 'weight_decay': 6.19211496862787e-07, 'n_units_l0': 49, 'n_units_l1': 13, 'n_units_l2': 9, 'n_units_l3': 77, 'n_units_l4': 12, 'n_units_l5': 71, 'n_units_l6': 18, 'n_units_l7': 14, 'n_units_l8': 17, 'n_units_l9': 28, 'n_units_l10': 26, 'n_units_l11': 11, 'optimizer': 'RMSprop', 'rmsprop_learning_rate': 0.0003035560035869235, 'rmsprop_weight_decay': 0.9493640243954236, 'rmsprop_momentum': 0.0002413305237562716}. Best is trial 47 with value: 0.6984127163887024.
Trial 97 finished with value: 0.5396825671195984 and parameters: {'n_layers': 13, 'weight_decay': 1.4612078283290294e-09, 'n_units_l0': 40, 'n_units_l1': 28, 'n_units_l2': 7, 'n_units_l3': 91, 'n_units_l4': 10, 'n_units_l5': 78, 'n_units_l6': 14, 'n_units_l7': 11, 'n_units_l8': 20, 'n_units_l9': 34, 'n_units_l10': 33, 'n_units_l11': 9, 'n_units_l12': 8, 'optimizer': 'RMSprop', 'rmsprop_learning_rate': 0.0008263046159806388, 'rmsprop_weight_decay': 0.9367425121449825, 'rmsprop_momentum': 0.0001548977892104787}. Best is trial 47 with value: 0.6984127163887024.
Trial 98 finished with value: 0.60317462682724 and parameters: {'n_layers': 14, 'weight_decay': 1.1526339212936815e-06, 'n_units_l0': 17, 'n_units_l1': 22, 'n_units_l2': 8, 'n_units_l3': 96, 'n_units_l4': 15, 'n_units_l5': 62, 'n_units_l6': 12, 'n_units_l7': 31, 'n_units_l8': 23, 'n_units_l9': 23, 'n_units_l10': 20, 'n_units_l11': 8, 'n_units_l12': 13, 'n_units_l13': 9, 'optimizer': 'SGD', 'sgd_opt_learning_rate': 0.09427261857672381, 'sgd_opt_momentum': 0.009060923808404934}. Best is trial 47 with value: 0.6984127163887024.
Trial 99 finished with value: 0.60317462682724 and parameters: {'n_layers': 12, 'weight_decay': 3.769617252898885e-06, 'n_units_l0': 27, 'n_units_l1': 31, 'n_units_l2': 6, 'n_units_l3': 8, 'n_units_l4': 8, 'n_units_l5': 54, 'n_units_l6': 16, 'n_units_l7': 8, 'n_units_l8': 10, 'n_units_l9': 7, 'n_units_l10': 46, 'n_units_l11': 7, 'optimizer': 'RMSprop', 'rmsprop_learning_rate': 0.0005035489205831034, 'rmsprop_weight_decay': 0.9291818555442831, 'rmsprop_momentum': 5.4058777169811934e-05}. Best is trial 47 with value: 0.6984127163887024.
Trial 100 finished with value: 0.523809552192688 and parameters: {'n_layers': 15, 'weight_decay': 2.513519170430508e-07, 'n_units_l0': 45, 'n_units_l1': 9, 'n_units_l2': 14, 'n_units_l3': 108, 'n_units_l4': 108, 'n_units_l5': 32, 'n_units_l6': 11, 'n_units_l7': 10, 'n_units_l8': 8, 'n_units_l9': 25, 'n_units_l10': 29, 'n_units_l11': 6, 'n_units_l12': 9, 'n_units_l13': 28, 'n_units_l14': 11, 'optimizer': 'RMSprop', 'rmsprop_learning_rate': 0.00023244940341295538, 'rmsprop_weight_decay': 0.9457714248571883, 'rmsprop_momentum': 2.7177813929515787e-05}. Best is trial 47 with value: 0.6984127163887024.
Trial 101 finished with value: 0.5396825671195984 and parameters: {'n_layers': 15, 'weight_decay': 1.0241014639194712e-07, 'n_units_l0': 57, 'n_units_l1': 12, 'n_units_l2': 6, 'n_units_l3': 114, 'n_units_l4': 7, 'n_units_l5': 21, 'n_units_l6': 30, 'n_units_l7': 27, 'n_units_l8': 14, 'n_units_l9': 17, 'n_units_l10': 23, 'n_units_l11': 12, 'n_units_l12': 7, 'n_units_l13': 24, 'n_units_l14': 40, 'optimizer': 'RMSprop', 'rmsprop_learning_rate': 0.00018465236394614557, 'rmsprop_weight_decay': 0.956029394507569, 'rmsprop_momentum': 0.0063969091132853656}. Best is trial 47 with value: 0.6984127163887024.
Trial 102 finished with value: 0.5873016119003296 and parameters: {'n_layers': 14, 'weight_decay': 2.45761236314473e-10, 'n_units_l0': 60, 'n_units_l1': 11, 'n_units_l2': 4, 'n_units_l3': 83, 'n_units_l4': 6, 'n_units_l5': 55, 'n_units_l6': 49, 'n_units_l7': 21, 'n_units_l8': 37, 'n_units_l9': 11, 'n_units_l10': 13, 'n_units_l11': 16, 'n_units_l12': 5, 'n_units_l13': 11, 'optimizer': 'RMSprop', 'rmsprop_learning_rate': 0.0005443303040162386, 'rmsprop_weight_decay': 0.9331612850356765, 'rmsprop_momentum': 0.0001976116371561811}. Best is trial 47 with value: 0.6984127163887024.
Trial 103 finished with value: 0.6666666865348816 and parameters: {'n_layers': 17, 'weight_decay': 4.078153945520595e-10, 'n_units_l0': 106, 'n_units_l1': 15, 'n_units_l2': 7, 'n_units_l3': 128, 'n_units_l4': 4, 'n_units_l5': 16, 'n_units_l6': 20, 'n_units_l7': 15, 'n_units_l8': 18, 'n_units_l9': 8, 'n_units_l10': 11, 'n_units_l11': 10, 'n_units_l12': 10, 'n_units_l13': 7, 'n_units_l14': 16, 'n_units_l15': 83, 'n_units_l16': 23, 'optimizer': 'RMSprop', 'rmsprop_learning_rate': 0.00013781240340167438, 'rmsprop_weight_decay': 0.9850942756739707, 'rmsprop_momentum': 0.0001212493628996015}. Best is trial 47 with value: 0.6984127163887024.
Trial 104 finished with value: 0.4920634925365448 and parameters: {'n_layers': 17, 'weight_decay': 3.851441763907053e-10, 'n_units_l0': 111, 'n_units_l1': 14, 'n_units_l2': 7, 'n_units_l3': 102, 'n_units_l4': 21, 'n_units_l5': 15, 'n_units_l6': 10, 'n_units_l7': 16, 'n_units_l8': 18, 'n_units_l9': 8, 'n_units_l10': 10, 'n_units_l11': 10, 'n_units_l12': 11, 'n_units_l13': 6, 'n_units_l14': 14, 'n_units_l15': 18, 'n_units_l16': 22, 'optimizer': 'RMSprop', 'rmsprop_learning_rate': 0.07850160179099892, 'rmsprop_weight_decay': 0.9840039681625162, 'rmsprop_momentum': 0.00012137568316303318}. Best is trial 47 with value: 0.6984127163887024.
Trial 105 finished with value: 0.5555555820465088 and parameters: {'n_layers': 19, 'weight_decay': 7.662108235881069e-10, 'n_units_l0': 101, 'n_units_l1': 16, 'n_units_l2': 8, 'n_units_l3': 40, 'n_units_l4': 8, 'n_units_l5': 17, 'n_units_l6': 19, 'n_units_l7': 13, 'n_units_l8': 20, 'n_units_l9': 34, 'n_units_l10': 6, 'n_units_l11': 11, 'n_units_l12': 10, 'n_units_l13': 5, 'n_units_l14': 17, 'n_units_l15': 48, 'n_units_l16': 42, 'n_units_l17': 4, 'n_units_l18': 65, 'optimizer': 'RMSprop', 'rmsprop_learning_rate': 0.09717570017868893, 'rmsprop_weight_decay': 0.9855561017934226, 'rmsprop_momentum': 0.00025500231565531194}. Best is trial 47 with value: 0.6984127163887024.
Trial 106 finished with value: 0.5079365372657776 and parameters: {'n_layers': 18, 'weight_decay': 4.95516934576329e-10, 'n_units_l0': 30, 'n_units_l1': 10, 'n_units_l2': 11, 'n_units_l3': 48, 'n_units_l4': 12, 'n_units_l5': 24, 'n_units_l6': 21, 'n_units_l7': 14, 'n_units_l8': 16, 'n_units_l9': 45, 'n_units_l10': 54, 'n_units_l11': 9, 'n_units_l12': 14, 'n_units_l13': 37, 'n_units_l14': 15, 'n_units_l15': 6, 'n_units_l16': 14, 'n_units_l17': 28, 'optimizer': 'RMSprop', 'rmsprop_learning_rate': 0.00034464905358124777, 'rmsprop_weight_decay': 0.9812173384809346, 'rmsprop_momentum': 0.06144966303649386}. Best is trial 47 with value: 0.6984127163887024.
Trial 107 finished with value: 0.6507936716079712 and parameters: {'n_layers': 16, 'weight_decay': 3.385966108769102e-09, 'n_units_l0': 38, 'n_units_l1': 15, 'n_units_l2': 9, 'n_units_l3': 120, 'n_units_l4': 4, 'n_units_l5': 102, 'n_units_l6': 24, 'n_units_l7': 18, 'n_units_l8': 6, 'n_units_l9': 126, 'n_units_l10': 5, 'n_units_l11': 13, 'n_units_l12': 6, 'n_units_l13': 9, 'n_units_l14': 75, 'n_units_l15': 88, 'optimizer': 'RMSprop', 'rmsprop_learning_rate': 0.0017663410126073878, 'rmsprop_weight_decay': 0.9761184188931272, 'rmsprop_momentum': 0.00045106294161257774}. Best is trial 47 with value: 0.6984127163887024.
Trial 108 finished with value: 0.682539701461792 and parameters: {'n_layers': 14, 'weight_decay': 2.0376058298592956e-10, 'n_units_l0': 88, 'n_units_l1': 11, 'n_units_l2': 30, 'n_units_l3': 22, 'n_units_l4': 43, 'n_units_l5': 19, 'n_units_l6': 14, 'n_units_l7': 12, 'n_units_l8': 21, 'n_units_l9': 10, 'n_units_l10': 23, 'n_units_l11': 14, 'n_units_l12': 8, 'n_units_l13': 7, 'optimizer': 'RMSprop', 'rmsprop_learning_rate': 0.055031792688095035, 'rmsprop_weight_decay': 0.9870762468035509, 'rmsprop_momentum': 0.00013395060912275807}. Best is trial 47 with value: 0.6984127163887024.
Trial 109 finished with value: 0.5714285969734192 and parameters: {'n_layers': 17, 'weight_decay': 2.0817312658468414e-10, 'n_units_l0': 90, 'n_units_l1': 20, 'n_units_l2': 38, 'n_units_l3': 18, 'n_units_l4': 41, 'n_units_l5': 27, 'n_units_l6': 14, 'n_units_l7': 12, 'n_units_l8': 31, 'n_units_l9': 8, 'n_units_l10': 50, 'n_units_l11': 14, 'n_units_l12': 12, 'n_units_l13': 7, 'n_units_l14': 22, 'n_units_l15': 14, 'n_units_l16': 37, 'optimizer': 'RMSprop', 'rmsprop_learning_rate': 0.03570454387285247, 'rmsprop_weight_decay': 0.9860373269426514, 'rmsprop_momentum': 0.00012978368538434765}. Best is trial 47 with value: 0.6984127163887024.
Trial 110 finished with value: 0.5396825671195984 and parameters: {'n_layers': 16, 'weight_decay': 1.2298019286045608e-10, 'n_units_l0': 107, 'n_units_l1': 39, 'n_units_l2': 25, 'n_units_l3': 29, 'n_units_l4': 44, 'n_units_l5': 20, 'n_units_l6': 108, 'n_units_l7': 126, 'n_units_l8': 22, 'n_units_l9': 10, 'n_units_l10': 11, 'n_units_l11': 21, 'n_units_l12': 10, 'n_units_l13': 5, 'n_units_l14': 26, 'n_units_l15': 59, 'optimizer': 'Adam', 'adam_learning_rate': 0.00012174521993236562}. Best is trial 47 with value: 0.6984127163887024.
