Trial 366 finished with value: 0.6190476417541504 and parameters: {'n_layers': 17, 'weight_decay': 2.0011870815645817e-10, 'n_units_l0': 102, 'n_units_l1': 16, 'n_units_l2': 33, 'n_units_l3': 94, 'n_units_l4': 17, 'n_units_l5': 49, 'n_units_l6': 11, 'n_units_l7': 11, 'n_units_l8': 20, 'n_units_l9': 14, 'n_units_l10': 110, 'n_units_l11': 14, 'n_units_l12': 9, 'n_units_l13': 23, 'n_units_l14': 86, 'n_units_l15': 102, 'n_units_l16': 12, 'optimizer': 'RMSprop', 'rmsprop_learning_rate': 0.05702055162285317, 'rmsprop_weight_decay': 0.9601844379253541, 'rmsprop_momentum': 0.003020798517454927}. Best is trial 306 with value: 0.761904776096344.
Trial 367 finished with value: 0.5555555820465088 and parameters: {'n_layers': 17, 'weight_decay': 1.0081894841678879e-10, 'n_units_l0': 59, 'n_units_l1': 14, 'n_units_l2': 35, 'n_units_l3': 113, 'n_units_l4': 4, 'n_units_l5': 31, 'n_units_l6': 13, 'n_units_l7': 16, 'n_units_l8': 14, 'n_units_l9': 12, 'n_units_l10': 41, 'n_units_l11': 12, 'n_units_l12': 5, 'n_units_l13': 17, 'n_units_l14': 38, 'n_units_l15': 105, 'n_units_l16': 8, 'optimizer': 'SGD', 'sgd_opt_learning_rate': 0.00028181355726312503, 'sgd_opt_momentum': 0.00012922054254477979}. Best is trial 306 with value: 0.761904776096344.
Trial 368 finished with value: 0.5714285969734192 and parameters: {'n_layers': 13, 'weight_decay': 1.7641288142507766e-10, 'n_units_l0': 83, 'n_units_l1': 12, 'n_units_l2': 29, 'n_units_l3': 128, 'n_units_l4': 45, 'n_units_l5': 40, 'n_units_l6': 17, 'n_units_l7': 14, 'n_units_l8': 31, 'n_units_l9': 10, 'n_units_l10': 49, 'n_units_l11': 12, 'n_units_l12': 8, 'optimizer': 'RMSprop', 'rmsprop_learning_rate': 0.026045046605684057, 'rmsprop_weight_decay': 0.9636011020522915, 'rmsprop_momentum': 0.002623285433423016}. Best is trial 306 with value: 0.761904776096344.
Trial 369 finished with value: 0.5873016119003296 and parameters: {'n_layers': 14, 'weight_decay': 3.422066898776695e-10, 'n_units_l0': 46, 'n_units_l1': 11, 'n_units_l2': 26, 'n_units_l3': 104, 'n_units_l4': 25, 'n_units_l5': 34, 'n_units_l6': 10, 'n_units_l7': 32, 'n_units_l8': 18, 'n_units_l9': 8, 'n_units_l10': 94, 'n_units_l11': 24, 'n_units_l12': 47, 'n_units_l13': 7, 'optimizer': 'RMSprop', 'rmsprop_learning_rate': 0.00957204501091085, 'rmsprop_weight_decay': 0.9538093677151276, 'rmsprop_momentum': 0.002379448757943083}. Best is trial 306 with value: 0.761904776096344.
Trial 370 finished with value: 0.5396825671195984 and parameters: {'n_layers': 15, 'weight_decay': 4.030693771549563e-06, 'n_units_l0': 89, 'n_units_l1': 13, 'n_units_l2': 44, 'n_units_l3': 119, 'n_units_l4': 18, 'n_units_l5': 12, 'n_units_l6': 23, 'n_units_l7': 13, 'n_units_l8': 24, 'n_units_l9': 9, 'n_units_l10': 25, 'n_units_l11': 14, 'n_units_l12': 10, 'n_units_l13': 20, 'n_units_l14': 33, 'optimizer': 'RMSprop', 'rmsprop_learning_rate': 0.005094383257925562, 'rmsprop_weight_decay': 0.9657121271034055, 'rmsprop_momentum': 0.0032019473183087306}. Best is trial 306 with value: 0.761904776096344.
Trial 371 finished with value: 0.6349206566810608 and parameters: {'n_layers': 16, 'weight_decay': 1.6274677185365353e-05, 'n_units_l0': 53, 'n_units_l1': 8, 'n_units_l2': 8, 'n_units_l3': 11, 'n_units_l4': 7, 'n_units_l5': 8, 'n_units_l6': 26, 'n_units_l7': 28, 'n_units_l8': 29, 'n_units_l9': 11, 'n_units_l10': 57, 'n_units_l11': 13, 'n_units_l12': 6, 'n_units_l13': 31, 'n_units_l14': 65, 'n_units_l15': 120, 'optimizer': 'RMSprop', 'rmsprop_learning_rate': 0.018932460155967168, 'rmsprop_weight_decay': 0.9703832875434407, 'rmsprop_momentum': 0.001200801702620954}. Best is trial 306 with value: 0.761904776096344.
Trial 372 finished with value: 0.5555555820465088 and parameters: {'n_layers': 17, 'weight_decay': 4.622696217971644e-10, 'n_units_l0': 118, 'n_units_l1': 12, 'n_units_l2': 28, 'n_units_l3': 97, 'n_units_l4': 78, 'n_units_l5': 47, 'n_units_l6': 11, 'n_units_l7': 34, 'n_units_l8': 21, 'n_units_l9': 7, 'n_units_l10': 21, 'n_units_l11': 11, 'n_units_l12': 9, 'n_units_l13': 9, 'n_units_l14': 16, 'n_units_l15': 88, 'n_units_l16': 7, 'optimizer': 'RMSprop', 'rmsprop_learning_rate': 0.06968897760502928, 'rmsprop_weight_decay': 0.9163323772401983, 'rmsprop_momentum': 0.0018305756040459037}. Best is trial 306 with value: 0.761904776096344.
Trial 373 finished with value: 0.6190476417541504 and parameters: {'n_layers': 18, 'weight_decay': 2.766148609375326e-05, 'n_units_l0': 18, 'n_units_l1': 19, 'n_units_l2': 36, 'n_units_l3': 109, 'n_units_l4': 15, 'n_units_l5': 43, 'n_units_l6': 12, 'n_units_l7': 15, 'n_units_l8': 25, 'n_units_l9': 9, 'n_units_l10': 7, 'n_units_l11': 7, 'n_units_l12': 11, 'n_units_l13': 28, 'n_units_l14': 44, 'n_units_l15': 107, 'n_units_l16': 4, 'n_units_l17': 53, 'optimizer': 'RMSprop', 'rmsprop_learning_rate': 0.006688801361688303, 'rmsprop_weight_decay': 0.9588823868369185, 'rmsprop_momentum': 0.00023206331473851714}. Best is trial 306 with value: 0.761904776096344.
Trial 374 finished with value: 0.523809552192688 and parameters: {'n_layers': 14, 'weight_decay': 2.2409641117023132e-10, 'n_units_l0': 79, 'n_units_l1': 11, 'n_units_l2': 33, 'n_units_l3': 12, 'n_units_l4': 14, 'n_units_l5': 7, 'n_units_l6': 6, 'n_units_l7': 18, 'n_units_l8': 40, 'n_units_l9': 8, 'n_units_l10': 35, 'n_units_l11': 10, 'n_units_l12': 10, 'n_units_l13': 19, 'optimizer': 'RMSprop', 'rmsprop_learning_rate': 0.031681894393525076, 'rmsprop_weight_decay': 0.9616864912027685, 'rmsprop_momentum': 3.8005614846444035e-05}. Best is trial 306 with value: 0.761904776096344.
Trial 375 finished with value: 0.6190476417541504 and parameters: {'n_layers': 16, 'weight_decay': 1.2631361627300354e-10, 'n_units_l0': 106, 'n_units_l1': 46, 'n_units_l2': 48, 'n_units_l3': 119, 'n_units_l4': 70, 'n_units_l5': 16, 'n_units_l6': 13, 'n_units_l7': 38, 'n_units_l8': 34, 'n_units_l9': 9, 'n_units_l10': 102, 'n_units_l11': 11, 'n_units_l12': 8, 'n_units_l13': 18, 'n_units_l14': 55, 'n_units_l15': 74, 'optimizer': 'SGD', 'sgd_opt_learning_rate': 4.143930291997504e-05, 'sgd_opt_momentum': 0.0054345219299704655}. Best is trial 306 with value: 0.761904776096344.
Trial 376 finished with value: 0.6507936716079712 and parameters: {'n_layers': 15, 'weight_decay': 2.7406272133847336e-10, 'n_units_l0': 62, 'n_units_l1': 10, 'n_units_l2': 42, 'n_units_l3': 19, 'n_units_l4': 6, 'n_units_l5': 36, 'n_units_l6': 11, 'n_units_l7': 17, 'n_units_l8': 16, 'n_units_l9': 10, 'n_units_l10': 52, 'n_units_l11': 14, 'n_units_l12': 35, 'n_units_l13': 4, 'n_units_l14': 49, 'optimizer': 'RMSprop', 'rmsprop_learning_rate': 0.09084669488718475, 'rmsprop_weight_decay': 0.9693511762891922, 'rmsprop_momentum': 0.004279175265977585}. Best is trial 306 with value: 0.761904776096344.
Trial 377 finished with value: 0.5555555820465088 and parameters: {'n_layers': 17, 'weight_decay': 7.427070362370298e-10, 'n_units_l0': 23, 'n_units_l1': 36, 'n_units_l2': 99, 'n_units_l3': 6, 'n_units_l4': 56, 'n_units_l5': 50, 'n_units_l6': 9, 'n_units_l7': 30, 'n_units_l8': 22, 'n_units_l9': 7, 'n_units_l10': 6, 'n_units_l11': 13, 'n_units_l12': 45, 'n_units_l13': 33, 'n_units_l14': 76, 'n_units_l15': 111, 'n_units_l16': 9, 'optimizer': 'RMSprop', 'rmsprop_learning_rate': 0.00014197665385159636, 'rmsprop_weight_decay': 0.9558252591180014, 'rmsprop_momentum': 0.0003088340859804051}. Best is trial 306 with value: 0.761904776096344.
Trial 378 finished with value: 0.60317462682724 and parameters: {'n_layers': 12, 'weight_decay': 9.107822497451101e-06, 'n_units_l0': 73, 'n_units_l1': 14, 'n_units_l2': 6, 'n_units_l3': 17, 'n_units_l4': 50, 'n_units_l5': 38, 'n_units_l6': 12, 'n_units_l7': 25, 'n_units_l8': 27, 'n_units_l9': 8, 'n_units_l10': 64, 'n_units_l11': 6, 'optimizer': 'Adam', 'adam_learning_rate': 0.025030433388334713}. Best is trial 306 with value: 0.761904776096344.
Trial 379 finished with value: 0.6190476417541504 and parameters: {'n_layers': 16, 'weight_decay': 1.6283078566423304e-10, 'n_units_l0': 90, 'n_units_l1': 9, 'n_units_l2': 4, 'n_units_l3': 106, 'n_units_l4': 9, 'n_units_l5': 45, 'n_units_l6': 13, 'n_units_l7': 23, 'n_units_l8': 20, 'n_units_l9': 10, 'n_units_l10': 85, 'n_units_l11': 12, 'n_units_l12': 11, 'n_units_l13': 24, 'n_units_l14': 21, 'n_units_l15': 91, 'optimizer': 'RMSprop', 'rmsprop_learning_rate': 0.05077719059088075, 'rmsprop_weight_decay': 0.9723082454552403, 'rmsprop_momentum': 0.0022098451416842726}. Best is trial 306 with value: 0.761904776096344.
Trial 380 finished with value: 0.5396825671195984 and parameters: {'n_layers': 7, 'weight_decay': 3.3757580226141806e-10, 'n_units_l0': 98, 'n_units_l1': 10, 'n_units_l2': 115, 'n_units_l3': 84, 'n_units_l4': 64, 'n_units_l5': 54, 'n_units_l6': 30, 'optimizer': 'RMSprop', 'rmsprop_learning_rate': 0.06999278008829567, 'rmsprop_weight_decay': 0.9872912081278595, 'rmsprop_momentum': 0.00018607514104085045}. Best is trial 306 with value: 0.761904776096344.
Trial 381 finished with value: 0.60317462682724 and parameters: {'n_layers': 4, 'weight_decay': 5.016969336152548e-10, 'n_units_l0': 58, 'n_units_l1': 22, 'n_units_l2': 88, 'n_units_l3': 91, 'optimizer': 'RMSprop', 'rmsprop_learning_rate': 0.013476021131162187, 'rmsprop_weight_decay': 0.9660327192000371, 'rmsprop_momentum': 0.002865983927055334}. Best is trial 306 with value: 0.761904776096344.
Trial 382 finished with value: 0.5396825671195984 and parameters: {'n_layers': 15, 'weight_decay': 1.0034964907860238e-10, 'n_units_l0': 83, 'n_units_l1': 11, 'n_units_l2': 25, 'n_units_l3': 10, 'n_units_l4': 23, 'n_units_l5': 42, 'n_units_l6': 15, 'n_units_l7': 4, 'n_units_l8': 18, 'n_units_l9': 9, 'n_units_l10': 74, 'n_units_l11': 15, 'n_units_l12': 9, 'n_units_l13': 12, 'n_units_l14': 59, 'optimizer': 'RMSprop', 'rmsprop_learning_rate': 3.229207724326955e-05, 'rmsprop_weight_decay': 0.989694844763945, 'rmsprop_momentum': 0.0001523709326199062}. Best is trial 306 with value: 0.761904776096344.
Trial 383 finished with value: 0.5714285969734192 and parameters: {'n_layers': 14, 'weight_decay': 2.0059915754791822e-10, 'n_units_l0': 72, 'n_units_l1': 13, 'n_units_l2': 29, 'n_units_l3': 128, 'n_units_l4': 5, 'n_units_l5': 59, 'n_units_l6': 10, 'n_units_l7': 12, 'n_units_l8': 23, 'n_units_l9': 11, 'n_units_l10': 68, 'n_units_l11': 9, 'n_units_l12': 11, 'n_units_l13': 7, 'optimizer': 'RMSprop', 'rmsprop_learning_rate': 0.05822691784204578, 'rmsprop_weight_decay': 0.929318518363096, 'rmsprop_momentum': 7.581540841496144e-05}. Best is trial 306 with value: 0.761904776096344.
Trial 384 finished with value: 0.5396825671195984 and parameters: {'n_layers': 16, 'weight_decay': 5.2873406822881604e-09, 'n_units_l0': 66, 'n_units_l1': 24, 'n_units_l2': 106, 'n_units_l3': 21, 'n_units_l4': 45, 'n_units_l5': 32, 'n_units_l6': 16, 'n_units_l7': 28, 'n_units_l8': 26, 'n_units_l9': 8, 'n_units_l10': 19, 'n_units_l11': 7, 'n_units_l12': 12, 'n_units_l13': 22, 'n_units_l14': 68, 'n_units_l15': 4, 'optimizer': 'SGD', 'sgd_opt_learning_rate': 0.0006491709042593612, 'sgd_opt_momentum': 0.0008706841585780036}. Best is trial 306 with value: 0.761904776096344.
Trial 385 finished with value: 0.5079365372657776 and parameters: {'n_layers': 9, 'weight_decay': 1.447842230880454e-10, 'n_units_l0': 106, 'n_units_l1': 12, 'n_units_l2': 22, 'n_units_l3': 114, 'n_units_l4': 19, 'n_units_l5': 48, 'n_units_l6': 11, 'n_units_l7': 11, 'n_units_l8': 19, 'optimizer': 'RMSprop', 'rmsprop_learning_rate': 0.021075022388822418, 'rmsprop_weight_decay': 0.9585077139340575, 'rmsprop_momentum': 0.00010274601519249027}. Best is trial 306 with value: 0.761904776096344.
Trial 386 finished with value: 0.5396825671195984 and parameters: {'n_layers': 15, 'weight_decay': 2.6033487567188063e-10, 'n_units_l0': 80, 'n_units_l1': 26, 'n_units_l2': 11, 'n_units_l3': 118, 'n_units_l4': 8, 'n_units_l5': 40, 'n_units_l6': 21, 'n_units_l7': 19, 'n_units_l8': 29, 'n_units_l9': 11, 'n_units_l10': 15, 'n_units_l11': 10, 'n_units_l12': 10, 'n_units_l13': 8, 'n_units_l14': 59, 'optimizer': 'RMSprop', 'rmsprop_learning_rate': 0.08003775957779087, 'rmsprop_weight_decay': 0.9636995014390688, 'rmsprop_momentum': 0.0002741511436568909}. Best is trial 306 with value: 0.761904776096344.
Trial 387 finished with value: 0.5079365372657776 and parameters: {'n_layers': 18, 'weight_decay': 8.879352233584928e-05, 'n_units_l0': 53, 'n_units_l1': 32, 'n_units_l2': 10, 'n_units_l3': 100, 'n_units_l4': 49, 'n_units_l5': 52, 'n_units_l6': 14, 'n_units_l7': 26, 'n_units_l8': 21, 'n_units_l9': 10, 'n_units_l10': 97, 'n_units_l11': 13, 'n_units_l12': 13, 'n_units_l13': 9, 'n_units_l14': 27, 'n_units_l15': 97, 'n_units_l16': 16, 'n_units_l17': 9, 'optimizer': 'RMSprop', 'rmsprop_learning_rate': 0.09984186696227523, 'rmsprop_weight_decay': 0.9780052382624284, 'rmsprop_momentum': 0.00014074808729501155}. Best is trial 306 with value: 0.761904776096344.
Trial 388 finished with value: 0.5396825671195984 and parameters: {'n_layers': 17, 'weight_decay': 3.9499744559487187e-10, 'n_units_l0': 114, 'n_units_l1': 8, 'n_units_l2': 27, 'n_units_l3': 15, 'n_units_l4': 55, 'n_units_l5': 66, 'n_units_l6': 19, 'n_units_l7': 16, 'n_units_l8': 23, 'n_units_l9': 15, 'n_units_l10': 112, 'n_units_l11': 11, 'n_units_l12': 6, 'n_units_l13': 16, 'n_units_l14': 23, 'n_units_l15': 45, 'n_units_l16': 29, 'optimizer': 'RMSprop', 'rmsprop_learning_rate': 0.04250873340621334, 'rmsprop_weight_decay': 0.9678693794121898, 'rmsprop_momentum': 0.0001706246787753487}. Best is trial 306 with value: 0.761904776096344.
Trial 389 finished with value: 0.6666666865348816 and parameters: {'n_layers': 15, 'weight_decay': 6.567783094634364e-10, 'n_units_l0': 96, 'n_units_l1': 17, 'n_units_l2': 18, 'n_units_l3': 8, 'n_units_l4': 7, 'n_units_l5': 35, 'n_units_l6': 55, 'n_units_l7': 32, 'n_units_l8': 17, 'n_units_l9': 7, 'n_units_l10': 77, 'n_units_l11': 10, 'n_units_l12': 18, 'n_units_l13': 48, 'n_units_l14': 36, 'optimizer': 'RMSprop', 'rmsprop_learning_rate': 0.06549132841447608, 'rmsprop_weight_decay': 0.9828257478164035, 'rmsprop_momentum': 0.0009627045021432863}. Best is trial 306 with value: 0.761904776096344.
Trial 390 finished with value: 0.5396825671195984 and parameters: {'n_layers': 17, 'weight_decay': 1.480651217733166e-10, 'n_units_l0': 86, 'n_units_l1': 11, 'n_units_l2': 38, 'n_units_l3': 73, 'n_units_l4': 48, 'n_units_l5': 46, 'n_units_l6': 10, 'n_units_l7': 10, 'n_units_l8': 12, 'n_units_l9': 9, 'n_units_l10': 22, 'n_units_l11': 20, 'n_units_l12': 38, 'n_units_l13': 15, 'n_units_l14': 40, 'n_units_l15': 27, 'n_units_l16': 11, 'optimizer': 'RMSprop', 'rmsprop_learning_rate': 0.0009413890591980099, 'rmsprop_weight_decay': 0.9254102697153432, 'rmsprop_momentum': 0.001560062579229596}. Best is trial 306 with value: 0.761904776096344.
Trial 391 finished with value: 0.5396825671195984 and parameters: {'n_layers': 14, 'weight_decay': 2.5309679604450394e-10, 'n_units_l0': 49, 'n_units_l1': 28, 'n_units_l2': 94, 'n_units_l3': 108, 'n_units_l4': 52, 'n_units_l5': 17, 'n_units_l6': 12, 'n_units_l7': 13, 'n_units_l8': 25, 'n_units_l9': 8, 'n_units_l10': 55, 'n_units_l11': 8, 'n_units_l12': 4, 'n_units_l13': 13, 'optimizer': 'RMSprop', 'rmsprop_learning_rate': 0.01742957950395723, 'rmsprop_weight_decay': 0.9618514045977065, 'rmsprop_momentum': 0.00023101467958256387}. Best is trial 306 with value: 0.761904776096344.
Trial 392 finished with value: 0.4761904776096344 and parameters: {'n_layers': 18, 'weight_decay': 1.8988635359104917e-10, 'n_units_l0': 57, 'n_units_l1': 7, 'n_units_l2': 7, 'n_units_l3': 115, 'n_units_l4': 29, 'n_units_l5': 11, 'n_units_l6': 25, 'n_units_l7': 9, 'n_units_l8': 10, 'n_units_l9': 30, 'n_units_l10': 91, 'n_units_l11': 11, 'n_units_l12': 9, 'n_units_l13': 29, 'n_units_l14': 46, 'n_units_l15': 67, 'n_units_l16': 35, 'n_units_l17': 18, 'optimizer': 'RMSprop', 'rmsprop_learning_rate': 0.0003656225632949766, 'rmsprop_weight_decay': 0.9088645277155253, 'rmsprop_momentum': 8.858622629227669e-05}. Best is trial 306 with value: 0.761904776096344.
Trial 393 finished with value: 0.5079365372657776 and parameters: {'n_layers': 16, 'weight_decay': 4.688938774239202e-10, 'n_units_l0': 27, 'n_units_l1': 6, 'n_units_l2': 128, 'n_units_l3': 97, 'n_units_l4': 44, 'n_units_l5': 38, 'n_units_l6': 13, 'n_units_l7': 23, 'n_units_l8': 20, 'n_units_l9': 9, 'n_units_l10': 60, 'n_units_l11': 12, 'n_units_l12': 32, 'n_units_l13': 6, 'n_units_l14': 65, 'n_units_l15': 80, 'optimizer': 'SGD', 'sgd_opt_learning_rate': 0.0012861615887672362, 'sgd_opt_momentum': 0.014678094490395326}. Best is trial 306 with value: 0.761904776096344.
Trial 394 finished with value: 0.6984127163887024 and parameters: {'n_layers': 13, 'weight_decay': 1.2348145257276266e-07, 'n_units_l0': 16, 'n_units_l1': 9, 'n_units_l2': 83, 'n_units_l3': 23, 'n_units_l4': 8, 'n_units_l5': 43, 'n_units_l6': 17, 'n_units_l7': 27, 'n_units_l8': 21, 'n_units_l9': 12, 'n_units_l10': 44, 'n_units_l11': 8, 'n_units_l12': 10, 'optimizer': 'RMSprop', 'rmsprop_learning_rate': 0.011096119461900734, 'rmsprop_weight_decay': 0.9851883030861895, 'rmsprop_momentum': 0.003677771599260328}. Best is trial 306 with value: 0.761904776096344.
Trial 395 finished with value: 0.60317462682724 and parameters: {'n_layers': 13, 'weight_decay': 5.056378732554023e-08, 'n_units_l0': 16, 'n_units_l1': 9, 'n_units_l2': 83, 'n_units_l3': 23, 'n_units_l4': 8, 'n_units_l5': 42, 'n_units_l6': 17, 'n_units_l7': 27, 'n_units_l8': 28, 'n_units_l9': 11, 'n_units_l10': 42, 'n_units_l11': 9, 'n_units_l12': 14, 'optimizer': 'RMSprop', 'rmsprop_learning_rate': 0.011257334426621704, 'rmsprop_weight_decay': 0.9858848964398833, 'rmsprop_momentum': 0.005275423214668059}. Best is trial 306 with value: 0.761904776096344.
Trial 396 finished with value: 0.60317462682724 and parameters: {'n_layers': 13, 'weight_decay': 1.874131734814611e-07, 'n_units_l0': 21, 'n_units_l1': 10, 'n_units_l2': 89, 'n_units_l3': 21, 'n_units_l4': 9, 'n_units_l5': 39, 'n_units_l6': 17, 'n_units_l7': 31, 'n_units_l8': 22, 'n_units_l9': 13, 'n_units_l10': 46, 'n_units_l11': 8, 'n_units_l12': 16, 'optimizer': 'RMSprop', 'rmsprop_learning_rate': 0.013933542623119613, 'rmsprop_weight_decay': 0.9840507642256996, 'rmsprop_momentum': 0.003942176408930245}. Best is trial 306 with value: 0.761904776096344.
Trial 397 finished with value: 0.5714285969734192 and parameters: {'n_layers': 13, 'weight_decay': 1.301813906335164e-10, 'n_units_l0': 13, 'n_units_l1': 8, 'n_units_l2': 81, 'n_units_l3': 31, 'n_units_l4': 8, 'n_units_l5': 34, 'n_units_l6': 18, 'n_units_l7': 25, 'n_units_l8': 32, 'n_units_l9': 12, 'n_units_l10': 44, 'n_units_l11': 7, 'n_units_l12': 12, 'optimizer': 'RMSprop', 'rmsprop_learning_rate': 0.00885894632895032, 'rmsprop_weight_decay': 0.9875512772808722, 'rmsprop_momentum': 0.0029269815312651594}. Best is trial 306 with value: 0.761904776096344.
Trial 398 finished with value: 0.6507936716079712 and parameters: {'n_layers': 12, 'weight_decay': 2.5566721482182783e-08, 'n_units_l0': 68, 'n_units_l1': 9, 'n_units_l2': 100, 'n_units_l3': 20, 'n_units_l4': 7, 'n_units_l5': 49, 'n_units_l6': 22, 'n_units_l7': 29, 'n_units_l8': 24, 'n_units_l9': 12, 'n_units_l10': 38, 'n_units_l11': 8, 'optimizer': 'RMSprop', 'rmsprop_learning_rate': 0.00010706840796941271, 'rmsprop_weight_decay': 0.9830950845414917, 'rmsprop_momentum': 0.004218862703535088}. Best is trial 306 with value: 0.761904776096344.
Trial 399 finished with value: 0.60317462682724 and parameters: {'n_layers': 19, 'weight_decay': 0.00013121097236113325, 'n_units_l0': 61, 'n_units_l1': 36, 'n_units_l2': 88, 'n_units_l3': 22, 'n_units_l4': 10, 'n_units_l5': 44, 'n_units_l6': 19, 'n_units_l7': 27, 'n_units_l8': 27, 'n_units_l9': 14, 'n_units_l10': 49, 'n_units_l11': 6, 'n_units_l12': 10, 'n_units_l13': 24, 'n_units_l14': 14, 'n_units_l15': 53, 'n_units_l16': 18, 'n_units_l17': 39, 'n_units_l18': 94, 'optimizer': 'RMSprop', 'rmsprop_learning_rate': 8.077245941636912e-05, 'rmsprop_weight_decay': 0.9809712610992416, 'rmsprop_momentum': 0.0034501361170380202}. Best is trial 306 with value: 0.761904776096344.
Trial 400 finished with value: 0.6349206566810608 and parameters: {'n_layers': 17, 'weight_decay': 1.0308712562743387e-10, 'n_units_l0': 75, 'n_units_l1': 30, 'n_units_l2': 94, 'n_units_l3': 26, 'n_units_l4': 82, 'n_units_l5': 29, 'n_units_l6': 15, 'n_units_l7': 34, 'n_units_l8': 25, 'n_units_l9': 10, 'n_units_l10': 39, 'n_units_l11': 9, 'n_units_l12': 11, 'n_units_l13': 20, 'n_units_l14': 33, 'n_units_l15': 116, 'n_units_l16': 14, 'optimizer': 'RMSprop', 'rmsprop_learning_rate': 0.011974694796339136, 'rmsprop_weight_decay': 0.9880508095121413, 'rmsprop_momentum': 0.002049520077854204}. Best is trial 306 with value: 0.761904776096344.
Trial 401 finished with value: 0.6190476417541504 and parameters: {'n_layers': 14, 'weight_decay': 0.0002116714920990621, 'n_units_l0': 15, 'n_units_l1': 33, 'n_units_l2': 84, 'n_units_l3': 23, 'n_units_l4': 9, 'n_units_l5': 56, 'n_units_l6': 16, 'n_units_l7': 25, 'n_units_l8': 30, 'n_units_l9': 11, 'n_units_l10': 16, 'n_units_l11': 8, 'n_units_l12': 29, 'n_units_l13': 41, 'optimizer': 'RMSprop', 'rmsprop_learning_rate': 0.0073986068622478906, 'rmsprop_weight_decay': 0.9860557687038909, 'rmsprop_momentum': 0.0028954392286311384}. Best is trial 306 with value: 0.761904776096344.
Trial 402 finished with value: 0.6666666865348816 and parameters: {'n_layers': 13, 'weight_decay': 0.0005176315093156049, 'n_units_l0': 18, 'n_units_l1': 9, 'n_units_l2': 5, 'n_units_l3': 13, 'n_units_l4': 8, 'n_units_l5': 38, 'n_units_l6': 20, 'n_units_l7': 23, 'n_units_l8': 15, 'n_units_l9': 36, 'n_units_l10': 27, 'n_units_l11': 7, 'n_units_l12': 42, 'optimizer': 'RMSprop', 'rmsprop_learning_rate': 0.010279784712729756, 'rmsprop_weight_decay': 0.9735344152325746, 'rmsprop_momentum': 0.007859888864370697}. Best is trial 306 with value: 0.761904776096344.
