Trial 254 finished with value: 0.5873016119003296 and parameters: {'n_layers': 16, 'weight_decay': 6.028949266202648e-10, 'n_units_l0': 81, 'n_units_l1': 7, 'n_units_l2': 107, 'n_units_l3': 128, 'n_units_l4': 7, 'n_units_l5': 22, 'n_units_l6': 124, 'n_units_l7': 13, 'n_units_l8': 26, 'n_units_l9': 10, 'n_units_l10': 67, 'n_units_l11': 7, 'n_units_l12': 13, 'n_units_l13': 22, 'n_units_l14': 66, 'n_units_l15': 117, 'optimizer': 'RMSprop', 'rmsprop_learning_rate': 0.01307695689837672, 'rmsprop_weight_decay': 0.9873009618733204, 'rmsprop_momentum': 0.00016801675935851262}. Best is trial 111 with value: 0.7301587462425232.
Trial 255 finished with value: 0.5079365372657776 and parameters: {'n_layers': 17, 'weight_decay': 0.00025731807323899796, 'n_units_l0': 101, 'n_units_l1': 12, 'n_units_l2': 96, 'n_units_l3': 112, 'n_units_l4': 47, 'n_units_l5': 119, 'n_units_l6': 20, 'n_units_l7': 24, 'n_units_l8': 20, 'n_units_l9': 6, 'n_units_l10': 75, 'n_units_l11': 15, 'n_units_l12': 11, 'n_units_l13': 21, 'n_units_l14': 52, 'n_units_l15': 7, 'n_units_l16': 8, 'optimizer': 'RMSprop', 'rmsprop_learning_rate': 0.017311113820098718, 'rmsprop_weight_decay': 0.9824224524519181, 'rmsprop_momentum': 5.548873380296343e-05}. Best is trial 111 with value: 0.7301587462425232.
Trial 256 finished with value: 0.5714285969734192 and parameters: {'n_layers': 14, 'weight_decay': 1.4982182257484028e-07, 'n_units_l0': 67, 'n_units_l1': 17, 'n_units_l2': 23, 'n_units_l3': 73, 'n_units_l4': 10, 'n_units_l5': 17, 'n_units_l6': 15, 'n_units_l7': 32, 'n_units_l8': 6, 'n_units_l9': 7, 'n_units_l10': 5, 'n_units_l11': 10, 'n_units_l12': 10, 'n_units_l13': 25, 'optimizer': 'SGD', 'sgd_opt_learning_rate': 0.0046050397754939226, 'sgd_opt_momentum': 1.0921814364786354e-05}. Best is trial 111 with value: 0.7301587462425232.
Trial 257 finished with value: 0.5714285969734192 and parameters: {'n_layers': 15, 'weight_decay': 1.4074297827790994e-10, 'n_units_l0': 46, 'n_units_l1': 38, 'n_units_l2': 63, 'n_units_l3': 86, 'n_units_l4': 52, 'n_units_l5': 71, 'n_units_l6': 13, 'n_units_l7': 19, 'n_units_l8': 30, 'n_units_l9': 25, 'n_units_l10': 29, 'n_units_l11': 8, 'n_units_l12': 5, 'n_units_l13': 30, 'n_units_l14': 25, 'optimizer': 'RMSprop', 'rmsprop_learning_rate': 0.008543457810583636, 'rmsprop_weight_decay': 0.9898603488734898, 'rmsprop_momentum': 1.5100440548835035e-05}. Best is trial 111 with value: 0.7301587462425232.
Trial 258 finished with value: 0.6190476417541504 and parameters: {'n_layers': 16, 'weight_decay': 3.4594483440555836e-10, 'n_units_l0': 19, 'n_units_l1': 33, 'n_units_l2': 6, 'n_units_l3': 119, 'n_units_l4': 4, 'n_units_l5': 24, 'n_units_l6': 10, 'n_units_l7': 27, 'n_units_l8': 22, 'n_units_l9': 8, 'n_units_l10': 13, 'n_units_l11': 26, 'n_units_l12': 4, 'n_units_l13': 16, 'n_units_l14': 30, 'n_units_l15': 27, 'optimizer': 'RMSprop', 'rmsprop_learning_rate': 0.07730649768264275, 'rmsprop_weight_decay': 0.9653228036148901, 'rmsprop_momentum': 0.0005515264474880384}. Best is trial 111 with value: 0.7301587462425232.
Trial 259 finished with value: 0.5873016119003296 and parameters: {'n_layers': 18, 'weight_decay': 1.003242221916087e-10, 'n_units_l0': 62, 'n_units_l1': 10, 'n_units_l2': 7, 'n_units_l3': 23, 'n_units_l4': 8, 'n_units_l5': 90, 'n_units_l6': 16, 'n_units_l7': 13, 'n_units_l8': 35, 'n_units_l9': 48, 'n_units_l10': 20, 'n_units_l11': 9, 'n_units_l12': 9, 'n_units_l13': 8, 'n_units_l14': 36, 'n_units_l15': 8, 'n_units_l16': 9, 'n_units_l17': 5, 'optimizer': 'RMSprop', 'rmsprop_learning_rate': 0.022989240453215154, 'rmsprop_weight_decay': 0.9860291334939765, 'rmsprop_momentum': 7.385140145355758e-05}. Best is trial 111 with value: 0.7301587462425232.
Trial 260 finished with value: 0.5714285969734192 and parameters: {'n_layers': 15, 'weight_decay': 8.655536779329154e-10, 'n_units_l0': 10, 'n_units_l1': 9, 'n_units_l2': 26, 'n_units_l3': 108, 'n_units_l4': 15, 'n_units_l5': 16, 'n_units_l6': 8, 'n_units_l7': 18, 'n_units_l8': 16, 'n_units_l9': 18, 'n_units_l10': 58, 'n_units_l11': 14, 'n_units_l12': 37, 'n_units_l13': 9, 'n_units_l14': 17, 'optimizer': 'RMSprop', 'rmsprop_learning_rate': 0.09974273411951264, 'rmsprop_weight_decay': 0.9612996097948239, 'rmsprop_momentum': 0.00013615179694688995}. Best is trial 111 with value: 0.7301587462425232.
Trial 261 finished with value: 0.6349206566810608 and parameters: {'n_layers': 17, 'weight_decay': 2.016057074361151e-10, 'n_units_l0': 37, 'n_units_l1': 24, 'n_units_l2': 32, 'n_units_l3': 21, 'n_units_l4': 6, 'n_units_l5': 56, 'n_units_l6': 22, 'n_units_l7': 35, 'n_units_l8': 12, 'n_units_l9': 16, 'n_units_l10': 9, 'n_units_l11': 10, 'n_units_l12': 32, 'n_units_l13': 19, 'n_units_l14': 71, 'n_units_l15': 74, 'n_units_l16': 28, 'optimizer': 'RMSprop', 'rmsprop_learning_rate': 0.00017500716127787249, 'rmsprop_weight_decay': 0.9458509666328324, 'rmsprop_momentum': 0.0022614028386475733}. Best is trial 111 with value: 0.7301587462425232.
Trial 262 finished with value: 0.4920634925365448 and parameters: {'n_layers': 14, 'weight_decay': 2.5863358252441444e-10, 'n_units_l0': 75, 'n_units_l1': 29, 'n_units_l2': 90, 'n_units_l3': 10, 'n_units_l4': 26, 'n_units_l5': 39, 'n_units_l6': 12, 'n_units_l7': 30, 'n_units_l8': 24, 'n_units_l9': 11, 'n_units_l10': 25, 'n_units_l11': 12, 'n_units_l12': 8, 'n_units_l13': 10, 'optimizer': 'Adam', 'adam_learning_rate': 0.0017393563294453365}. Best is trial 111 with value: 0.7301587462425232.
Trial 263 finished with value: 0.6666666865348816 and parameters: {'n_layers': 16, 'weight_decay': 1.478567788233064e-09, 'n_units_l0': 88, 'n_units_l1': 11, 'n_units_l2': 73, 'n_units_l3': 25, 'n_units_l4': 50, 'n_units_l5': 19, 'n_units_l6': 14, 'n_units_l7': 8, 'n_units_l8': 5, 'n_units_l9': 9, 'n_units_l10': 90, 'n_units_l11': 6, 'n_units_l12': 12, 'n_units_l13': 26, 'n_units_l14': 41, 'n_units_l15': 12, 'optimizer': 'RMSprop', 'rmsprop_learning_rate': 0.00048655329936142847, 'rmsprop_weight_decay': 0.9558043214433123, 'rmsprop_momentum': 8.627577423870183e-05}. Best is trial 111 with value: 0.7301587462425232.
Trial 264 finished with value: 0.5396825671195984 and parameters: {'n_layers': 17, 'weight_decay': 1.372406278336218e-09, 'n_units_l0': 88, 'n_units_l1': 11, 'n_units_l2': 75, 'n_units_l3': 28, 'n_units_l4': 50, 'n_units_l5': 19, 'n_units_l6': 14, 'n_units_l7': 9, 'n_units_l8': 5, 'n_units_l9': 9, 'n_units_l10': 91, 'n_units_l11': 6, 'n_units_l12': 12, 'n_units_l13': 28, 'n_units_l14': 40, 'n_units_l15': 12, 'n_units_l16': 6, 'optimizer': 'RMSprop', 'rmsprop_learning_rate': 0.0004414372365900735, 'rmsprop_weight_decay': 0.957169935853362, 'rmsprop_momentum': 8.45331047490853e-05}. Best is trial 111 with value: 0.7301587462425232.
Trial 265 finished with value: 0.5396825671195984 and parameters: {'n_layers': 15, 'weight_decay': 3.966231841918e-10, 'n_units_l0': 86, 'n_units_l1': 8, 'n_units_l2': 82, 'n_units_l3': 25, 'n_units_l4': 43, 'n_units_l5': 20, 'n_units_l6': 13, 'n_units_l7': 4, 'n_units_l8': 19, 'n_units_l9': 9, 'n_units_l10': 86, 'n_units_l11': 7, 'n_units_l12': 14, 'n_units_l13': 26, 'n_units_l14': 46, 'optimizer': 'RMSprop', 'rmsprop_learning_rate': 0.0005937118091750825, 'rmsprop_weight_decay': 0.9550333255568475, 'rmsprop_momentum': 0.00011167854554483049}. Best is trial 111 with value: 0.7301587462425232.
Trial 266 finished with value: 0.5873016119003296 and parameters: {'n_layers': 16, 'weight_decay': 3.253727724934923e-07, 'n_units_l0': 99, 'n_units_l1': 10, 'n_units_l2': 71, 'n_units_l3': 24, 'n_units_l4': 62, 'n_units_l5': 5, 'n_units_l6': 15, 'n_units_l7': 6, 'n_units_l8': 4, 'n_units_l9': 23, 'n_units_l10': 82, 'n_units_l11': 5, 'n_units_l12': 13, 'n_units_l13': 21, 'n_units_l14': 42, 'n_units_l15': 14, 'optimizer': 'RMSprop', 'rmsprop_learning_rate': 0.0002769743100668967, 'rmsprop_weight_decay': 0.9590201226593863, 'rmsprop_momentum': 3.852712592037804e-05}. Best is trial 111 with value: 0.7301587462425232.
Trial 267 finished with value: 0.6507936716079712 and parameters: {'n_layers': 13, 'weight_decay': 4.875395347360705e-05, 'n_units_l0': 79, 'n_units_l1': 13, 'n_units_l2': 5, 'n_units_l3': 7, 'n_units_l4': 55, 'n_units_l5': 18, 'n_units_l6': 17, 'n_units_l7': 8, 'n_units_l8': 27, 'n_units_l9': 8, 'n_units_l10': 93, 'n_units_l11': 6, 'n_units_l12': 12, 'optimizer': 'RMSprop', 'rmsprop_learning_rate': 0.000713763313735994, 'rmsprop_weight_decay': 0.9487396713633863, 'rmsprop_momentum': 9.079766064627212e-05}. Best is trial 111 with value: 0.7301587462425232.
Trial 268 finished with value: 0.6190476417541504 and parameters: {'n_layers': 16, 'weight_decay': 0.0004162707588259164, 'n_units_l0': 95, 'n_units_l1': 11, 'n_units_l2': 65, 'n_units_l3': 25, 'n_units_l4': 47, 'n_units_l5': 7, 'n_units_l6': 11, 'n_units_l7': 8, 'n_units_l8': 18, 'n_units_l9': 10, 'n_units_l10': 73, 'n_units_l11': 9, 'n_units_l12': 11, 'n_units_l13': 25, 'n_units_l14': 38, 'n_units_l15': 10, 'optimizer': 'RMSprop', 'rmsprop_learning_rate': 0.00020848524101054174, 'rmsprop_weight_decay': 0.9316807699245857, 'rmsprop_momentum': 6.497137633009134e-05}. Best is trial 111 with value: 0.7301587462425232.
Trial 269 finished with value: 0.460317462682724 and parameters: {'n_layers': 15, 'weight_decay': 7.352576073119397e-10, 'n_units_l0': 106, 'n_units_l1': 36, 'n_units_l2': 49, 'n_units_l3': 33, 'n_units_l4': 11, 'n_units_l5': 21, 'n_units_l6': 12, 'n_units_l7': 10, 'n_units_l8': 38, 'n_units_l9': 10, 'n_units_l10': 101, 'n_units_l11': 10, 'n_units_l12': 10, 'n_units_l13': 31, 'n_units_l14': 33, 'optimizer': 'SGD', 'sgd_opt_learning_rate': 0.0007666311889194779, 'sgd_opt_momentum': 0.00042401344945524884}. Best is trial 111 with value: 0.7301587462425232.
Trial 270 finished with value: 0.5555555820465088 and parameters: {'n_layers': 14, 'weight_decay': 2.816876591448474e-06, 'n_units_l0': 59, 'n_units_l1': 9, 'n_units_l2': 79, 'n_units_l3': 67, 'n_units_l4': 51, 'n_units_l5': 67, 'n_units_l6': 14, 'n_units_l7': 5, 'n_units_l8': 14, 'n_units_l9': 9, 'n_units_l10': 50, 'n_units_l11': 41, 'n_units_l12': 53, 'n_units_l13': 23, 'optimizer': 'RMSprop', 'rmsprop_learning_rate': 0.03075347032910542, 'rmsprop_weight_decay': 0.9507193649316644, 'rmsprop_momentum': 1.0073070899215931e-05}. Best is trial 111 with value: 0.7301587462425232.
Trial 271 finished with value: 0.5555555820465088 and parameters: {'n_layers': 13, 'weight_decay': 1.3157253435321364e-10, 'n_units_l0': 68, 'n_units_l1': 12, 'n_units_l2': 6, 'n_units_l3': 13, 'n_units_l4': 10, 'n_units_l5': 42, 'n_units_l6': 13, 'n_units_l7': 12, 'n_units_l8': 21, 'n_units_l9': 30, 'n_units_l10': 37, 'n_units_l11': 8, 'n_units_l12': 9, 'optimizer': 'RMSprop', 'rmsprop_learning_rate': 0.0005313002829503663, 'rmsprop_weight_decay': 0.9533959952934972, 'rmsprop_momentum': 0.002749686111193911}. Best is trial 111 with value: 0.7301587462425232.
Trial 272 finished with value: 0.5714285969734192 and parameters: {'n_layers': 17, 'weight_decay': 0.0009512886801777978, 'n_units_l0': 22, 'n_units_l1': 27, 'n_units_l2': 119, 'n_units_l3': 22, 'n_units_l4': 39, 'n_units_l5': 49, 'n_units_l6': 10, 'n_units_l7': 9, 'n_units_l8': 84, 'n_units_l9': 20, 'n_units_l10': 63, 'n_units_l11': 11, 'n_units_l12': 25, 'n_units_l13': 12, 'n_units_l14': 57, 'n_units_l15': 9, 'n_units_l16': 18, 'optimizer': 'RMSprop', 'rmsprop_learning_rate': 0.07118988896687127, 'rmsprop_weight_decay': 0.9841617511343445, 'rmsprop_momentum': 0.00015913474636269074}. Best is trial 111 with value: 0.7301587462425232.
Trial 273 finished with value: 0.5873016119003296 and parameters: {'n_layers': 8, 'weight_decay': 1.938783595727493e-09, 'n_units_l0': 53, 'n_units_l1': 31, 'n_units_l2': 5, 'n_units_l3': 43, 'n_units_l4': 59, 'n_units_l5': 17, 'n_units_l6': 9, 'n_units_l7': 26, 'optimizer': 'RMSprop', 'rmsprop_learning_rate': 0.014773078413779986, 'rmsprop_weight_decay': 0.9866727664301556, 'rmsprop_momentum': 0.0001964443539914737}. Best is trial 111 with value: 0.7301587462425232.
Trial 274 finished with value: 0.5079365372657776 and parameters: {'n_layers': 16, 'weight_decay': 5.56280667333457e-10, 'n_units_l0': 124, 'n_units_l1': 23, 'n_units_l2': 71, 'n_units_l3': 96, 'n_units_l4': 9, 'n_units_l5': 31, 'n_units_l6': 93, 'n_units_l7': 24, 'n_units_l8': 25, 'n_units_l9': 8, 'n_units_l10': 57, 'n_units_l11': 6, 'n_units_l12': 28, 'n_units_l13': 14, 'n_units_l14': 48, 'n_units_l15': 11, 'optimizer': 'RMSprop', 'rmsprop_learning_rate': 0.0003358178369943765, 'rmsprop_weight_decay': 0.9632255742145451, 'rmsprop_momentum': 0.00012045147239849553}. Best is trial 111 with value: 0.7301587462425232.
Trial 275 finished with value: 0.7460317611694336 and parameters: {'n_layers': 15, 'weight_decay': 1.9194407109968978e-10, 'n_units_l0': 113, 'n_units_l1': 43, 'n_units_l2': 92, 'n_units_l3': 102, 'n_units_l4': 45, 'n_units_l5': 35, 'n_units_l6': 12, 'n_units_l7': 28, 'n_units_l8': 20, 'n_units_l9': 9, 'n_units_l10': 31, 'n_units_l11': 7, 'n_units_l12': 15, 'n_units_l13': 6, 'n_units_l14': 42, 'optimizer': 'RMSprop', 'rmsprop_learning_rate': 0.05668208076058639, 'rmsprop_weight_decay': 0.9595440316091821, 'rmsprop_momentum': 0.0011870584965022635}. Best is trial 275 with value: 0.7460317611694336.
Trial 276 finished with value: 0.380952388048172 and parameters: {'n_layers': 22, 'weight_decay': 1.9036610665248526e-10, 'n_units_l0': 91, 'n_units_l1': 46, 'n_units_l2': 93, 'n_units_l3': 19, 'n_units_l4': 44, 'n_units_l5': 36, 'n_units_l6': 12, 'n_units_l7': 27, 'n_units_l8': 4, 'n_units_l9': 9, 'n_units_l10': 33, 'n_units_l11': 7, 'n_units_l12': 17, 'n_units_l13': 5, 'n_units_l14': 43, 'n_units_l15': 45, 'n_units_l16': 23, 'n_units_l17': 12, 'n_units_l18': 26, 'n_units_l19': 6, 'n_units_l20': 62, 'n_units_l21': 5, 'optimizer': 'RMSprop', 'rmsprop_learning_rate': 0.050084634494374815, 'rmsprop_weight_decay': 0.9680412142724275, 'rmsprop_momentum': 0.0013888818574383872}. Best is trial 275 with value: 0.7460317611694336.
Trial 277 finished with value: 0.5714285969734192 and parameters: {'n_layers': 15, 'weight_decay': 2.831810220508827e-10, 'n_units_l0': 119, 'n_units_l1': 42, 'n_units_l2': 98, 'n_units_l3': 29, 'n_units_l4': 41, 'n_units_l5': 46, 'n_units_l6': 11, 'n_units_l7': 33, 'n_units_l8': 32, 'n_units_l9': 10, 'n_units_l10': 30, 'n_units_l11': 7, 'n_units_l12': 11, 'n_units_l13': 29, 'n_units_l14': 37, 'optimizer': 'RMSprop', 'rmsprop_learning_rate': 0.08276006552809609, 'rmsprop_weight_decay': 0.960915963718212, 'rmsprop_momentum': 0.0008539134653465198}. Best is trial 275 with value: 0.7460317611694336.
Trial 278 finished with value: 0.5396825671195984 and parameters: {'n_layers': 15, 'weight_decay': 1.5446807067342585e-10, 'n_units_l0': 118, 'n_units_l1': 44, 'n_units_l2': 20, 'n_units_l3': 103, 'n_units_l4': 47, 'n_units_l5': 34, 'n_units_l6': 13, 'n_units_l7': 28, 'n_units_l8': 10, 'n_units_l9': 11, 'n_units_l10': 43, 'n_units_l11': 18, 'n_units_l12': 10, 'n_units_l13': 36, 'n_units_l14': 41, 'optimizer': 'RMSprop', 'rmsprop_learning_rate': 0.058644113525972895, 'rmsprop_weight_decay': 0.9644396038241729, 'rmsprop_momentum': 0.002009755133442589}. Best is trial 275 with value: 0.7460317611694336.
Trial 279 finished with value: 0.5079365372657776 and parameters: {'n_layers': 16, 'weight_decay': 2.1553998619516557e-08, 'n_units_l0': 82, 'n_units_l1': 35, 'n_units_l2': 86, 'n_units_l3': 26, 'n_units_l4': 51, 'n_units_l5': 28, 'n_units_l6': 12, 'n_units_l7': 29, 'n_units_l8': 23, 'n_units_l9': 7, 'n_units_l10': 27, 'n_units_l11': 8, 'n_units_l12': 15, 'n_units_l13': 24, 'n_units_l14': 53, 'n_units_l15': 7, 'optimizer': 'RMSprop', 'rmsprop_learning_rate': 0.04315227483196958, 'rmsprop_weight_decay': 0.956440980074496, 'rmsprop_momentum': 0.0018305138282432467}. Best is trial 275 with value: 0.7460317611694336.
Trial 280 finished with value: 0.6349206566810608 and parameters: {'n_layers': 18, 'weight_decay': 2.2225385962949767e-10, 'n_units_l0': 111, 'n_units_l1': 49, 'n_units_l2': 104, 'n_units_l3': 113, 'n_units_l4': 46, 'n_units_l5': 39, 'n_units_l6': 11, 'n_units_l7': 23, 'n_units_l8': 22, 'n_units_l9': 8, 'n_units_l10': 80, 'n_units_l11': 9, 'n_units_l12': 13, 'n_units_l13': 6, 'n_units_l14': 46, 'n_units_l15': 6, 'n_units_l16': 11, 'n_units_l17': 23, 'optimizer': 'RMSprop', 'rmsprop_learning_rate': 0.06859717773351331, 'rmsprop_weight_decay': 0.9595969652416979, 'rmsprop_momentum': 0.001182605639075804}. Best is trial 275 with value: 0.7460317611694336.
Trial 281 finished with value: 0.6666666865348816 and parameters: {'n_layers': 17, 'weight_decay': 3.6904564081951864e-10, 'n_units_l0': 106, 'n_units_l1': 39, 'n_units_l2': 82, 'n_units_l3': 58, 'n_units_l4': 43, 'n_units_l5': 19, 'n_units_l6': 11, 'n_units_l7': 25, 'n_units_l8': 9, 'n_units_l9': 9, 'n_units_l10': 121, 'n_units_l11': 16, 'n_units_l12': 30, 'n_units_l13': 26, 'n_units_l14': 62, 'n_units_l15': 12, 'n_units_l16': 15, 'optimizer': 'RMSprop', 'rmsprop_learning_rate': 0.01845826012987232, 'rmsprop_weight_decay': 0.9800557931275583, 'rmsprop_momentum': 0.003695786085939665}. Best is trial 275 with value: 0.7460317611694336.
Trial 282 finished with value: 0.523809552192688 and parameters: {'n_layers': 17, 'weight_decay': 4.11666893209207e-10, 'n_units_l0': 128, 'n_units_l1': 44, 'n_units_l2': 80, 'n_units_l3': 56, 'n_units_l4': 42, 'n_units_l5': 53, 'n_units_l6': 12, 'n_units_l7': 25, 'n_units_l8': 7, 'n_units_l9': 9, 'n_units_l10': 117, 'n_units_l11': 17, 'n_units_l12': 34, 'n_units_l13': 7, 'n_units_l14': 61, 'n_units_l15': 12, 'n_units_l16': 14, 'optimizer': 'SGD', 'sgd_opt_learning_rate': 0.0003359927663563134, 'sgd_opt_momentum': 9.626500253445205e-05}. Best is trial 275 with value: 0.7460317611694336.
Trial 283 finished with value: 0.60317462682724 and parameters: {'n_layers': 18, 'weight_decay': 3.4322159462191503e-10, 'n_units_l0': 108, 'n_units_l1': 10, 'n_units_l2': 90, 'n_units_l3': 52, 'n_units_l4': 39, 'n_units_l5': 19, 'n_units_l6': 11, 'n_units_l7': 21, 'n_units_l8': 8, 'n_units_l9': 9, 'n_units_l10': 111, 'n_units_l11': 17, 'n_units_l12': 29, 'n_units_l13': 18, 'n_units_l14': 66, 'n_units_l15': 18, 'n_units_l16': 16, 'n_units_l17': 34, 'optimizer': 'RMSprop', 'rmsprop_learning_rate': 0.0209818756899035, 'rmsprop_weight_decay': 0.9819494158236554, 'rmsprop_momentum': 0.003010683611584599}. Best is trial 275 with value: 0.7460317611694336.
Trial 284 finished with value: 0.6507936716079712 and parameters: {'n_layers': 17, 'weight_decay': 9.147403364202661e-10, 'n_units_l0': 99, 'n_units_l1': 39, 'n_units_l2': 76, 'n_units_l3': 60, 'n_units_l4': 37, 'n_units_l5': 42, 'n_units_l6': 10, 'n_units_l7': 26, 'n_units_l8': 28, 'n_units_l9': 10, 'n_units_l10': 123, 'n_units_l11': 16, 'n_units_l12': 12, 'n_units_l13': 43, 'n_units_l14': 56, 'n_units_l15': 14, 'n_units_l16': 19, 'optimizer': 'RMSprop', 'rmsprop_learning_rate': 0.026767874118918556, 'rmsprop_weight_decay': 0.978711240597937, 'rmsprop_momentum': 0.003507237474176995}. Best is trial 275 with value: 0.7460317611694336.
Trial 285 finished with value: 0.5873016119003296 and parameters: {'n_layers': 17, 'weight_decay': 1.0222726854790865e-10, 'n_units_l0': 7, 'n_units_l1': 40, 'n_units_l2': 92, 'n_units_l3': 99, 'n_units_l4': 49, 'n_units_l5': 36, 'n_units_l6': 11, 'n_units_l7': 23, 'n_units_l8': 8, 'n_units_l9': 8, 'n_units_l10': 107, 'n_units_l11': 15, 'n_units_l12': 31, 'n_units_l13': 6, 'n_units_l14': 50, 'n_units_l15': 23, 'n_units_l16': 26, 'optimizer': 'RMSprop', 'rmsprop_learning_rate': 0.011386349482852937, 'rmsprop_weight_decay': 0.9876869809727603, 'rmsprop_momentum': 0.0049060485224677545}. Best is trial 275 with value: 0.7460317611694336.
Trial 286 finished with value: 0.5873016119003296 and parameters: {'n_layers': 18, 'weight_decay': 2.8024596435929025e-10, 'n_units_l0': 107, 'n_units_l1': 42, 'n_units_l2': 79, 'n_units_l3': 23, 'n_units_l4': 44, 'n_units_l5': 16, 'n_units_l6': 14, 'n_units_l7': 25, 'n_units_l8': 20, 'n_units_l9': 10, 'n_units_l10': 96, 'n_units_l11': 18, 'n_units_l12': 20, 'n_units_l13': 27, 'n_units_l14': 62, 'n_units_l15': 8, 'n_units_l16': 38, 'n_units_l17': 6, 'optimizer': 'RMSprop', 'rmsprop_learning_rate': 0.014982971726898678, 'rmsprop_weight_decay': 0.9840144722776836, 'rmsprop_momentum': 0.003779015328416869}. Best is trial 275 with value: 0.7460317611694336.
Trial 287 finished with value: 0.4444444477558136 and parameters: {'n_layers': 16, 'weight_decay': 5.558926950276731e-10, 'n_units_l0': 116, 'n_units_l1': 38, 'n_units_l2': 71, 'n_units_l3': 48, 'n_units_l4': 17, 'n_units_l5': 33, 'n_units_l6': 41, 'n_units_l7': 32, 'n_units_l8': 25, 'n_units_l9': 8, 'n_units_l10': 121, 'n_units_l11': 14, 'n_units_l12': 26, 'n_units_l13': 20, 'n_units_l14': 78, 'n_units_l15': 9, 'optimizer': 'Adam', 'adam_learning_rate': 0.02537399872320333}. Best is trial 275 with value: 0.7460317611694336.
Trial 288 finished with value: 0.6507936716079712 and parameters: {'n_layers': 17, 'weight_decay': 1.885589585298954e-10, 'n_units_l0': 94, 'n_units_l1': 94, 'n_units_l2': 86, 'n_units_l3': 32, 'n_units_l4': 35, 'n_units_l5': 51, 'n_units_l6': 9, 'n_units_l7': 30, 'n_units_l8': 30, 'n_units_l9': 12, 'n_units_l10': 18, 'n_units_l11': 15, 'n_units_l12': 31, 'n_units_l13': 38, 'n_units_l14': 19, 'n_units_l15': 10, 'n_units_l16': 13, 'optimizer': 'RMSprop', 'rmsprop_learning_rate': 0.01803332019490988, 'rmsprop_weight_decay': 0.9806464083953401, 'rmsprop_momentum': 0.007172555266757921}. Best is trial 275 with value: 0.7460317611694336.
