Trial 440 finished with value: 0.6507936716079712 and parameters: {'n_layers': 13, 'weight_decay': 1.501147544026473e-10, 'n_units_l0': 55, 'n_units_l1': 22, 'n_units_l2': 74, 'n_units_l3': 105, 'n_units_l4': 9, 'n_units_l5': 22, 'n_units_l6': 16, 'n_units_l7': 42, 'n_units_l8': 34, 'n_units_l9': 9, 'n_units_l10': 50, 'n_units_l11': 88, 'n_units_l12': 38, 'optimizer': 'RMSprop', 'rmsprop_learning_rate': 0.08646494874171524, 'rmsprop_weight_decay': 0.9780372753730218, 'rmsprop_momentum': 0.0034048679078752335}. Best is trial 306 with value: 0.761904776096344.
Trial 441 finished with value: 0.682539701461792 and parameters: {'n_layers': 12, 'weight_decay': 1.3016807810950844e-10, 'n_units_l0': 59, 'n_units_l1': 21, 'n_units_l2': 82, 'n_units_l3': 99, 'n_units_l4': 11, 'n_units_l5': 22, 'n_units_l6': 15, 'n_units_l7': 38, 'n_units_l8': 39, 'n_units_l9': 11, 'n_units_l10': 44, 'n_units_l11': 8, 'optimizer': 'RMSprop', 'rmsprop_learning_rate': 0.0734735182184409, 'rmsprop_weight_decay': 0.9798270940924229, 'rmsprop_momentum': 0.0026156837982297637}. Best is trial 306 with value: 0.761904776096344.
Trial 442 finished with value: 0.523809552192688 and parameters: {'n_layers': 12, 'weight_decay': 1.2730852065199412e-10, 'n_units_l0': 57, 'n_units_l1': 19, 'n_units_l2': 77, 'n_units_l3': 98, 'n_units_l4': 13, 'n_units_l5': 20, 'n_units_l6': 16, 'n_units_l7': 40, 'n_units_l8': 37, 'n_units_l9': 11, 'n_units_l10': 44, 'n_units_l11': 8, 'optimizer': 'RMSprop', 'rmsprop_learning_rate': 0.07525810944524305, 'rmsprop_weight_decay': 0.9788871387097201, 'rmsprop_momentum': 0.0026171175195349116}. Best is trial 306 with value: 0.761904776096344.
Trial 443 finished with value: 0.6190476417541504 and parameters: {'n_layers': 10, 'weight_decay': 1.3213537705998702e-10, 'n_units_l0': 50, 'n_units_l1': 22, 'n_units_l2': 79, 'n_units_l3': 110, 'n_units_l4': 11, 'n_units_l5': 23, 'n_units_l6': 17, 'n_units_l7': 34, 'n_units_l8': 59, 'n_units_l9': 12, 'optimizer': 'RMSprop', 'rmsprop_learning_rate': 0.06323867063481556, 'rmsprop_weight_decay': 0.9768033361035154, 'rmsprop_momentum': 0.00413661320910329}. Best is trial 306 with value: 0.761904776096344.
Trial 444 finished with value: 0.5873016119003296 and parameters: {'n_layers': 12, 'weight_decay': 2.2758762254012945e-10, 'n_units_l0': 61, 'n_units_l1': 24, 'n_units_l2': 72, 'n_units_l3': 93, 'n_units_l4': 10, 'n_units_l5': 21, 'n_units_l6': 15, 'n_units_l7': 40, 'n_units_l8': 45, 'n_units_l9': 11, 'n_units_l10': 42, 'n_units_l11': 7, 'optimizer': 'RMSprop', 'rmsprop_learning_rate': 0.08576752742475324, 'rmsprop_weight_decay': 0.8985229998032448, 'rmsprop_momentum': 2.2629111357434602e-05}. Best is trial 306 with value: 0.761904776096344.
Trial 445 finished with value: 0.60317462682724 and parameters: {'n_layers': 13, 'weight_decay': 1.9476975713530046e-10, 'n_units_l0': 53, 'n_units_l1': 21, 'n_units_l2': 85, 'n_units_l3': 100, 'n_units_l4': 14, 'n_units_l5': 25, 'n_units_l6': 15, 'n_units_l7': 44, 'n_units_l8': 40, 'n_units_l9': 10, 'n_units_l10': 46, 'n_units_l11': 8, 'n_units_l12': 37, 'optimizer': 'RMSprop', 'rmsprop_learning_rate': 0.05153807919387667, 'rmsprop_weight_decay': 0.9807496492792526, 'rmsprop_momentum': 0.00018867094138669605}. Best is trial 306 with value: 0.761904776096344.
Trial 446 finished with value: 0.5873016119003296 and parameters: {'n_layers': 18, 'weight_decay': 1.2763805983681146e-10, 'n_units_l0': 58, 'n_units_l1': 20, 'n_units_l2': 67, 'n_units_l3': 87, 'n_units_l4': 11, 'n_units_l5': 21, 'n_units_l6': 17, 'n_units_l7': 37, 'n_units_l8': 45, 'n_units_l9': 13, 'n_units_l10': 48, 'n_units_l11': 9, 'n_units_l12': 31, 'n_units_l13': 45, 'n_units_l14': 81, 'n_units_l15': 5, 'n_units_l16': 4, 'n_units_l17': 14, 'optimizer': 'RMSprop', 'rmsprop_learning_rate': 0.07151839182044428, 'rmsprop_weight_decay': 0.9752428812492033, 'rmsprop_momentum': 0.005187465490822196}. Best is trial 306 with value: 0.761904776096344.
Trial 447 finished with value: 0.5873016119003296 and parameters: {'n_layers': 12, 'weight_decay': 1.0229178317526233e-10, 'n_units_l0': 62, 'n_units_l1': 24, 'n_units_l2': 78, 'n_units_l3': 7, 'n_units_l4': 11, 'n_units_l5': 45, 'n_units_l6': 14, 'n_units_l7': 55, 'n_units_l8': 40, 'n_units_l9': 12, 'n_units_l10': 39, 'n_units_l11': 7, 'optimizer': 'RMSprop', 'rmsprop_learning_rate': 0.06429398210678379, 'rmsprop_weight_decay': 0.9821539493351202, 'rmsprop_momentum': 0.0002669566818258675}. Best is trial 306 with value: 0.761904776096344.
Trial 448 finished with value: 0.5079365372657776 and parameters: {'n_layers': 11, 'weight_decay': 3.1448348751951775e-10, 'n_units_l0': 64, 'n_units_l1': 27, 'n_units_l2': 85, 'n_units_l3': 111, 'n_units_l4': 16, 'n_units_l5': 48, 'n_units_l6': 15, 'n_units_l7': 49, 'n_units_l8': 37, 'n_units_l9': 10, 'n_units_l10': 43, 'optimizer': 'RMSprop', 'rmsprop_learning_rate': 0.04188541479642427, 'rmsprop_weight_decay': 0.9803037063660986, 'rmsprop_momentum': 0.00037834926195989154}. Best is trial 306 with value: 0.761904776096344.
Trial 449 finished with value: 0.6190476417541504 and parameters: {'n_layers': 6, 'weight_decay': 1.8512190260312753e-10, 'n_units_l0': 57, 'n_units_l1': 26, 'n_units_l2': 76, 'n_units_l3': 102, 'n_units_l4': 9, 'n_units_l5': 27, 'optimizer': 'RMSprop', 'rmsprop_learning_rate': 0.09887124939602905, 'rmsprop_weight_decay': 0.98470004891741, 'rmsprop_momentum': 0.0001176523347372305}. Best is trial 306 with value: 0.761904776096344.
Trial 450 finished with value: 0.6190476417541504 and parameters: {'n_layers': 8, 'weight_decay': 2.359340602734733e-10, 'n_units_l0': 19, 'n_units_l1': 23, 'n_units_l2': 92, 'n_units_l3': 111, 'n_units_l4': 10, 'n_units_l5': 10, 'n_units_l6': 18, 'n_units_l7': 37, 'optimizer': 'RMSprop', 'rmsprop_learning_rate': 0.07717342901698676, 'rmsprop_weight_decay': 0.9724842412677582, 'rmsprop_momentum': 0.003223574284292443}. Best is trial 306 with value: 0.761904776096344.
Trial 451 finished with value: 0.4761904776096344 and parameters: {'n_layers': 13, 'weight_decay': 1.2950275515078312e-10, 'n_units_l0': 51, 'n_units_l1': 26, 'n_units_l2': 13, 'n_units_l3': 13, 'n_units_l4': 103, 'n_units_l5': 52, 'n_units_l6': 16, 'n_units_l7': 35, 'n_units_l8': 38, 'n_units_l9': 8, 'n_units_l10': 40, 'n_units_l11': 8, 'n_units_l12': 47, 'optimizer': 'Adam', 'adam_learning_rate': 0.011718613444545379}. Best is trial 306 with value: 0.761904776096344.
Trial 452 finished with value: 0.60317462682724 and parameters: {'n_layers': 17, 'weight_decay': 1.747369389311187e-10, 'n_units_l0': 66, 'n_units_l1': 35, 'n_units_l2': 83, 'n_units_l3': 94, 'n_units_l4': 12, 'n_units_l5': 41, 'n_units_l6': 13, 'n_units_l7': 42, 'n_units_l8': 29, 'n_units_l9': 11, 'n_units_l10': 50, 'n_units_l11': 8, 'n_units_l12': 40, 'n_units_l13': 30, 'n_units_l14': 54, 'n_units_l15': 8, 'n_units_l16': 5, 'optimizer': 'RMSprop', 'rmsprop_learning_rate': 0.05419021097117721, 'rmsprop_weight_decay': 0.9772057536860507, 'rmsprop_momentum': 0.00016766114207071472}. Best is trial 306 with value: 0.761904776096344.
Trial 453 finished with value: 0.60317462682724 and parameters: {'n_layers': 2, 'weight_decay': 1.0052706846851584e-10, 'n_units_l0': 59, 'n_units_l1': 47, 'optimizer': 'RMSprop', 'rmsprop_learning_rate': 0.06653780095192491, 'rmsprop_weight_decay': 0.9835217930982014, 'rmsprop_momentum': 6.837856631088029e-05}. Best is trial 306 with value: 0.761904776096344.
Trial 454 finished with value: 0.6349206566810608 and parameters: {'n_layers': 10, 'weight_decay': 3.006346184022045e-10, 'n_units_l0': 56, 'n_units_l1': 8, 'n_units_l2': 93, 'n_units_l3': 104, 'n_units_l4': 10, 'n_units_l5': 45, 'n_units_l6': 12, 'n_units_l7': 35, 'n_units_l8': 65, 'n_units_l9': 38, 'optimizer': 'RMSprop', 'rmsprop_learning_rate': 0.08137568688447165, 'rmsprop_weight_decay': 0.9862937302743913, 'rmsprop_momentum': 0.0005309140935611693}. Best is trial 306 with value: 0.761904776096344.
Trial 455 finished with value: 0.60317462682724 and parameters: {'n_layers': 4, 'weight_decay': 1.7505519362117283e-10, 'n_units_l0': 61, 'n_units_l1': 23, 'n_units_l2': 83, 'n_units_l3': 115, 'optimizer': 'RMSprop', 'rmsprop_learning_rate': 0.029778875849961757, 'rmsprop_weight_decay': 0.9898119532272002, 'rmsprop_momentum': 0.00025382907015211113}. Best is trial 306 with value: 0.761904776096344.
Trial 456 finished with value: 0.6666666865348816 and parameters: {'n_layers': 13, 'weight_decay': 3.632786826501725e-10, 'n_units_l0': 70, 'n_units_l1': 21, 'n_units_l2': 99, 'n_units_l3': 99, 'n_units_l4': 9, 'n_units_l5': 13, 'n_units_l6': 14, 'n_units_l7': 47, 'n_units_l8': 50, 'n_units_l9': 9, 'n_units_l10': 46, 'n_units_l11': 9, 'n_units_l12': 29, 'optimizer': 'RMSprop', 'rmsprop_learning_rate': 0.048837435305531945, 'rmsprop_weight_decay': 0.979845790173909, 'rmsprop_momentum': 0.0025307349904702095}. Best is trial 306 with value: 0.761904776096344.
Trial 457 finished with value: 0.5873016119003296 and parameters: {'n_layers': 17, 'weight_decay': 2.524683268197659e-10, 'n_units_l0': 53, 'n_units_l1': 127, 'n_units_l2': 79, 'n_units_l3': 21, 'n_units_l4': 68, 'n_units_l5': 21, 'n_units_l6': 15, 'n_units_l7': 39, 'n_units_l8': 41, 'n_units_l9': 9, 'n_units_l10': 36, 'n_units_l11': 9, 'n_units_l12': 34, 'n_units_l13': 28, 'n_units_l14': 24, 'n_units_l15': 30, 'n_units_l16': 10, 'optimizer': 'RMSprop', 'rmsprop_learning_rate': 1.0029134433478846e-05, 'rmsprop_weight_decay': 0.9827674485743286, 'rmsprop_momentum': 0.00014196046422531772}. Best is trial 306 with value: 0.761904776096344.
Trial 458 finished with value: 0.6190476417541504 and parameters: {'n_layers': 12, 'weight_decay': 1.4347522458538227e-10, 'n_units_l0': 65, 'n_units_l1': 28, 'n_units_l2': 71, 'n_units_l3': 119, 'n_units_l4': 15, 'n_units_l5': 54, 'n_units_l6': 13, 'n_units_l7': 31, 'n_units_l8': 50, 'n_units_l9': 10, 'n_units_l10': 29, 'n_units_l11': 10, 'optimizer': 'RMSprop', 'rmsprop_learning_rate': 0.017721876776363162, 'rmsprop_weight_decay': 0.9690858069015564, 'rmsprop_momentum': 0.00021549762771186254}. Best is trial 306 with value: 0.761904776096344.
Trial 459 finished with value: 0.6190476417541504 and parameters: {'n_layers': 14, 'weight_decay': 2.1849487554903543e-10, 'n_units_l0': 17, 'n_units_l1': 25, 'n_units_l2': 91, 'n_units_l3': 108, 'n_units_l4': 13, 'n_units_l5': 40, 'n_units_l6': 14, 'n_units_l7': 31, 'n_units_l8': 35, 'n_units_l9': 11, 'n_units_l10': 55, 'n_units_l11': 8, 'n_units_l12': 35, 'n_units_l13': 31, 'optimizer': 'RMSprop', 'rmsprop_learning_rate': 0.06276344003872308, 'rmsprop_weight_decay': 0.975767061913704, 'rmsprop_momentum': 0.00031104599588696775}. Best is trial 306 with value: 0.761904776096344.
Trial 460 finished with value: 0.5079365372657776 and parameters: {'n_layers': 18, 'weight_decay': 1.2646864010372183e-10, 'n_units_l0': 60, 'n_units_l1': 6, 'n_units_l2': 32, 'n_units_l3': 16, 'n_units_l4': 12, 'n_units_l5': 7, 'n_units_l6': 17, 'n_units_l7': 115, 'n_units_l8': 53, 'n_units_l9': 8, 'n_units_l10': 26, 'n_units_l11': 7, 'n_units_l12': 7, 'n_units_l13': 39, 'n_units_l14': 93, 'n_units_l15': 7, 'n_units_l16': 8, 'n_units_l17': 30, 'optimizer': 'RMSprop', 'rmsprop_learning_rate': 0.014773909028501727, 'rmsprop_weight_decay': 0.9857362767612361, 'rmsprop_momentum': 0.004892918146359227}. Best is trial 306 with value: 0.761904776096344.
Trial 461 finished with value: 0.6349206566810608 and parameters: {'n_layers': 17, 'weight_decay': 3.408733862476236e-10, 'n_units_l0': 71, 'n_units_l1': 31, 'n_units_l2': 37, 'n_units_l3': 10, 'n_units_l4': 9, 'n_units_l5': 9, 'n_units_l6': 12, 'n_units_l7': 28, 'n_units_l8': 33, 'n_units_l9': 9, 'n_units_l10': 49, 'n_units_l11': 6, 'n_units_l12': 26, 'n_units_l13': 34, 'n_units_l14': 57, 'n_units_l15': 7, 'n_units_l16': 14, 'optimizer': 'RMSprop', 'rmsprop_learning_rate': 0.09729941976430778, 'rmsprop_weight_decay': 0.9714944894907174, 'rmsprop_momentum': 0.0038141741518401846}. Best is trial 306 with value: 0.761904776096344.
Trial 462 finished with value: 0.5714285969734192 and parameters: {'n_layers': 14, 'weight_decay': 1.0017967838115993e-10, 'n_units_l0': 21, 'n_units_l1': 29, 'n_units_l2': 88, 'n_units_l3': 90, 'n_units_l4': 27, 'n_units_l5': 49, 'n_units_l6': 16, 'n_units_l7': 32, 'n_units_l8': 46, 'n_units_l9': 34, 'n_units_l10': 22, 'n_units_l11': 7, 'n_units_l12': 32, 'n_units_l13': 28, 'optimizer': 'RMSprop', 'rmsprop_learning_rate': 0.07450634749744202, 'rmsprop_weight_decay': 0.9790579475883227, 'rmsprop_momentum': 9.534480444046869e-05}. Best is trial 306 with value: 0.761904776096344.
Trial 463 finished with value: 0.6190476417541504 and parameters: {'n_layers': 13, 'weight_decay': 1.7064045123765351e-10, 'n_units_l0': 18, 'n_units_l1': 34, 'n_units_l2': 26, 'n_units_l3': 113, 'n_units_l4': 61, 'n_units_l5': 43, 'n_units_l6': 13, 'n_units_l7': 38, 'n_units_l8': 34, 'n_units_l9': 43, 'n_units_l10': 44, 'n_units_l11': 5, 'n_units_l12': 29, 'optimizer': 'RMSprop', 'rmsprop_learning_rate': 0.03858680416025448, 'rmsprop_weight_decay': 0.9823729607006904, 'rmsprop_momentum': 0.0001856599124546058}. Best is trial 306 with value: 0.761904776096344.
Trial 464 finished with value: 0.5714285969734192 and parameters: {'n_layers': 17, 'weight_decay': 5.912921143577201e-10, 'n_units_l0': 89, 'n_units_l1': 40, 'n_units_l2': 103, 'n_units_l3': 82, 'n_units_l4': 20, 'n_units_l5': 47, 'n_units_l6': 116, 'n_units_l7': 68, 'n_units_l8': 43, 'n_units_l9': 7, 'n_units_l10': 55, 'n_units_l11': 8, 'n_units_l12': 43, 'n_units_l13': 24, 'n_units_l14': 76, 'n_units_l15': 11, 'n_units_l16': 13, 'optimizer': 'RMSprop', 'rmsprop_learning_rate': 0.006619242649499778, 'rmsprop_weight_decay': 0.9868854859465281, 'rmsprop_momentum': 1.4404592326008178e-05}. Best is trial 306 with value: 0.761904776096344.
Trial 465 finished with value: 0.60317462682724 and parameters: {'n_layers': 18, 'weight_decay': 2.3938039508705296e-10, 'n_units_l0': 26, 'n_units_l1': 38, 'n_units_l2': 73, 'n_units_l3': 104, 'n_units_l4': 42, 'n_units_l5': 24, 'n_units_l6': 18, 'n_units_l7': 29, 'n_units_l8': 38, 'n_units_l9': 14, 'n_units_l10': 52, 'n_units_l11': 9, 'n_units_l12': 8, 'n_units_l13': 36, 'n_units_l14': 47, 'n_units_l15': 17, 'n_units_l16': 11, 'n_units_l17': 43, 'optimizer': 'RMSprop', 'rmsprop_learning_rate': 0.010766578004373733, 'rmsprop_weight_decay': 0.9737228602250356, 'rmsprop_momentum': 0.006282217571889508}. Best is trial 306 with value: 0.761904776096344.
Trial 466 finished with value: 0.6666666865348816 and parameters: {'n_layers': 14, 'weight_decay': 3.6079841080726364e-10, 'n_units_l0': 55, 'n_units_l1': 25, 'n_units_l2': 23, 'n_units_l3': 8, 'n_units_l4': 8, 'n_units_l5': 19, 'n_units_l6': 36, 'n_units_l7': 42, 'n_units_l8': 31, 'n_units_l9': 10, 'n_units_l10': 81, 'n_units_l11': 8, 'n_units_l12': 25, 'n_units_l13': 32, 'optimizer': 'RMSprop', 'rmsprop_learning_rate': 0.054049712632710814, 'rmsprop_weight_decay': 0.9844325339827971, 'rmsprop_momentum': 0.0001277214085856281}. Best is trial 306 with value: 0.761904776096344.
Trial 467 finished with value: 0.6507936716079712 and parameters: {'n_layers': 17, 'weight_decay': 1.5512533071680328e-10, 'n_units_l0': 64, 'n_units_l1': 44, 'n_units_l2': 17, 'n_units_l3': 19, 'n_units_l4': 11, 'n_units_l5': 39, 'n_units_l6': 14, 'n_units_l7': 22, 'n_units_l8': 6, 'n_units_l9': 12, 'n_units_l10': 20, 'n_units_l11': 10, 'n_units_l12': 35, 'n_units_l13': 27, 'n_units_l14': 19, 'n_units_l15': 10, 'n_units_l16': 18, 'optimizer': 'RMSprop', 'rmsprop_learning_rate': 0.004728054546725084, 'rmsprop_weight_decay': 0.987521099010895, 'rmsprop_momentum': 5.7744570486834606e-05}. Best is trial 306 with value: 0.761904776096344.
Trial 468 finished with value: 0.60317462682724 and parameters: {'n_layers': 16, 'weight_decay': 0.0001370043118123889, 'n_units_l0': 8, 'n_units_l1': 63, 'n_units_l2': 81, 'n_units_l3': 22, 'n_units_l4': 14, 'n_units_l5': 45, 'n_units_l6': 12, 'n_units_l7': 34, 'n_units_l8': 42, 'n_units_l9': 29, 'n_units_l10': 59, 'n_units_l11': 10, 'n_units_l12': 37, 'n_units_l13': 42, 'n_units_l14': 11, 'n_units_l15': 9, 'optimizer': 'RMSprop', 'rmsprop_learning_rate': 0.09967425770924793, 'rmsprop_weight_decay': 0.9898724627885608, 'rmsprop_momentum': 0.0008627402437040843}. Best is trial 306 with value: 0.761904776096344.
Trial 469 finished with value: 0.5555555820465088 and parameters: {'n_layers': 17, 'weight_decay': 5.622775246765944e-05, 'n_units_l0': 51, 'n_units_l1': 32, 'n_units_l2': 30, 'n_units_l3': 121, 'n_units_l4': 9, 'n_units_l5': 52, 'n_units_l6': 13, 'n_units_l7': 25, 'n_units_l8': 27, 'n_units_l9': 9, 'n_units_l10': 41, 'n_units_l11': 9, 'n_units_l12': 53, 'n_units_l13': 26, 'n_units_l14': 50, 'n_units_l15': 6, 'n_units_l16': 6, 'optimizer': 'RMSprop', 'rmsprop_learning_rate': 0.012475629546745063, 'rmsprop_weight_decay': 0.9655249977615666, 'rmsprop_momentum': 2.7987072009834986e-05}. Best is trial 306 with value: 0.761904776096344.
Trial 470 finished with value: 0.5873016119003296 and parameters: {'n_layers': 16, 'weight_decay': 4.41269648930979e-10, 'n_units_l0': 14, 'n_units_l1': 18, 'n_units_l2': 66, 'n_units_l3': 96, 'n_units_l4': 10, 'n_units_l5': 30, 'n_units_l6': 15, 'n_units_l7': 24, 'n_units_l8': 35, 'n_units_l9': 8, 'n_units_l10': 47, 'n_units_l11': 8, 'n_units_l12': 27, 'n_units_l13': 38, 'n_units_l14': 62, 'n_units_l15': 8, 'optimizer': 'RMSprop', 'rmsprop_learning_rate': 0.08382338756665667, 'rmsprop_weight_decay': 0.8621578624468863, 'rmsprop_momentum': 0.0021407452264948948}. Best is trial 306 with value: 0.761904776096344.
Trial 471 finished with value: 0.5873016119003296 and parameters: {'n_layers': 14, 'weight_decay': 2.0657302770356383e-10, 'n_units_l0': 73, 'n_units_l1': 8, 'n_units_l2': 107, 'n_units_l3': 106, 'n_units_l4': 74, 'n_units_l5': 58, 'n_units_l6': 11, 'n_units_l7': 27, 'n_units_l8': 30, 'n_units_l9': 10, 'n_units_l10': 24, 'n_units_l11': 7, 'n_units_l12': 22, 'n_units_l13': 25, 'optimizer': 'Adam', 'adam_learning_rate': 3.69453961223875e-05}. Best is trial 306 with value: 0.761904776096344.
Trial 472 finished with value: 0.6349206566810608 and parameters: {'n_layers': 16, 'weight_decay': 8.201865450055488e-10, 'n_units_l0': 15, 'n_units_l1': 7, 'n_units_l2': 95, 'n_units_l3': 115, 'n_units_l4': 8, 'n_units_l5': 37, 'n_units_l6': 14, 'n_units_l7': 20, 'n_units_l8': 26, 'n_units_l9': 9, 'n_units_l10': 33, 'n_units_l11': 11, 'n_units_l12': 88, 'n_units_l13': 23, 'n_units_l14': 72, 'n_units_l15': 6, 'optimizer': 'RMSprop', 'rmsprop_learning_rate': 0.021750038494738468, 'rmsprop_weight_decay': 0.9703177139846108, 'rmsprop_momentum': 0.003144848044595518}. Best is trial 306 with value: 0.761904776096344.
Trial 473 finished with value: 0.5714285969734192 and parameters: {'n_layers': 18, 'weight_decay': 1.314619111290928e-10, 'n_units_l0': 84, 'n_units_l1': 27, 'n_units_l2': 27, 'n_units_l3': 95, 'n_units_l4': 62, 'n_units_l5': 22, 'n_units_l6': 16, 'n_units_l7': 30, 'n_units_l8': 54, 'n_units_l9': 8, 'n_units_l10': 72, 'n_units_l11': 9, 'n_units_l12': 40, 'n_units_l13': 30, 'n_units_l14': 54, 'n_units_l15': 4, 'n_units_l16': 24, 'n_units_l17': 25, 'optimizer': 'RMSprop', 'rmsprop_learning_rate': 2.4494100122873784e-05, 'rmsprop_weight_decay': 0.9805535397367295, 'rmsprop_momentum': 0.0001558243570806911}. Best is trial 306 with value: 0.761904776096344.
Trial 474 finished with value: 0.6507936716079712 and parameters: {'n_layers': 8, 'weight_decay': 2.9049740163513127e-10, 'n_units_l0': 67, 'n_units_l1': 30, 'n_units_l2': 34, 'n_units_l3': 121, 'n_units_l4': 58, 'n_units_l5': 20, 'n_units_l6': 12, 'n_units_l7': 33, 'optimizer': 'RMSprop', 'rmsprop_learning_rate': 1.5792348947346818e-05, 'rmsprop_weight_decay': 0.968245423811488, 'rmsprop_momentum': 8.193559658195163e-05}. Best is trial 306 with value: 0.761904776096344.
Trial 475 finished with value: 0.6190476417541504 and parameters: {'n_layers': 3, 'weight_decay': 1.7793597981948659e-10, 'n_units_l0': 47, 'n_units_l1': 33, 'n_units_l2': 86, 'optimizer': 'RMSprop', 'rmsprop_learning_rate': 0.062155120574819624, 'rmsprop_weight_decay': 0.9618697441280489, 'rmsprop_momentum': 0.0027355384297939353}. Best is trial 306 with value: 0.761904776096344.
Trial 476 finished with value: 0.4920634925365448 and parameters: {'n_layers': 13, 'weight_decay': 5.165969905718732e-10, 'n_units_l0': 61, 'n_units_l1': 52, 'n_units_l2': 78, 'n_units_l3': 23, 'n_units_l4': 101, 'n_units_l5': 43, 'n_units_l6': 12, 'n_units_l7': 37, 'n_units_l8': 32, 'n_units_l9': 11, 'n_units_l10': 90, 'n_units_l11': 10, 'n_units_l12': 10, 'optimizer': 'RMSprop', 'rmsprop_learning_rate': 0.04597094307203649, 'rmsprop_weight_decay': 0.9842809091575889, 'rmsprop_momentum': 0.00020236751979501658}. Best is trial 306 with value: 0.761904776096344.
Trial 477 finished with value: 0.5555555820465088 and parameters: {'n_layers': 17, 'weight_decay': 2.579917394962388e-10, 'n_units_l0': 56, 'n_units_l1': 21, 'n_units_l2': 30, 'n_units_l3': 12, 'n_units_l4': 82, 'n_units_l5': 48, 'n_units_l6': 5, 'n_units_l7': 22, 'n_units_l8': 24, 'n_units_l9': 26, 'n_units_l10': 77, 'n_units_l11': 9, 'n_units_l12': 24, 'n_units_l13': 53, 'n_units_l14': 83, 'n_units_l15': 35, 'n_units_l16': 10, 'optimizer': 'RMSprop', 'rmsprop_learning_rate': 0.0716132996446507, 'rmsprop_weight_decay': 0.9775360185282013, 'rmsprop_momentum': 0.0002933754779964734}. Best is trial 306 with value: 0.761904776096344.
Trial 478 finished with value: 0.5873016119003296 and parameters: {'n_layers': 11, 'weight_decay': 1.0084722907124595e-10, 'n_units_l0': 76, 'n_units_l1': 36, 'n_units_l2': 90, 'n_units_l3': 128, 'n_units_l4': 10, 'n_units_l5': 50, 'n_units_l6': 7, 'n_units_l7': 7, 'n_units_l8': 28, 'n_units_l9': 13, 'n_units_l10': 56, 'optimizer': 'RMSprop', 'rmsprop_learning_rate': 0.027435821104595907, 'rmsprop_weight_decay': 0.9527220023499122, 'rmsprop_momentum': 0.00011581246615912008}. Best is trial 306 with value: 0.761904776096344.
