Trial 403 finished with value: 0.6190476417541504 and parameters: {'n_layers': 17, 'weight_decay': 1.8704959786035953e-10, 'n_units_l0': 42, 'n_units_l1': 5, 'n_units_l2': 78, 'n_units_l3': 65, 'n_units_l4': 7, 'n_units_l5': 18, 'n_units_l6': 15, 'n_units_l7': 29, 'n_units_l8': 21, 'n_units_l9': 16, 'n_units_l10': 53, 'n_units_l11': 7, 'n_units_l12': 49, 'n_units_l13': 37, 'n_units_l14': 29, 'n_units_l15': 5, 'n_units_l16': 21, 'optimizer': 'RMSprop', 'rmsprop_learning_rate': 0.014201025257576452, 'rmsprop_weight_decay': 0.9520522718446975, 'rmsprop_momentum': 0.0024137261005979242}. Best is trial 306 with value: 0.761904776096344.
Trial 404 finished with value: 0.5714285969734192 and parameters: {'n_layers': 16, 'weight_decay': 2.7939973717048134e-10, 'n_units_l0': 17, 'n_units_l1': 42, 'n_units_l2': 104, 'n_units_l3': 89, 'n_units_l4': 4, 'n_units_l5': 47, 'n_units_l6': 14, 'n_units_l7': 36, 'n_units_l8': 23, 'n_units_l9': 12, 'n_units_l10': 56, 'n_units_l11': 10, 'n_units_l12': 10, 'n_units_l13': 22, 'n_units_l14': 17, 'n_units_l15': 6, 'optimizer': 'RMSprop', 'rmsprop_learning_rate': 0.01647960040010586, 'rmsprop_weight_decay': 0.9895918339296563, 'rmsprop_momentum': 0.009611147838478521}. Best is trial 306 with value: 0.761904776096344.
Trial 405 finished with value: 0.5873016119003296 and parameters: {'n_layers': 12, 'weight_decay': 1.438113019694811e-10, 'n_units_l0': 69, 'n_units_l1': 25, 'n_units_l2': 15, 'n_units_l3': 24, 'n_units_l4': 9, 'n_units_l5': 15, 'n_units_l6': 18, 'n_units_l7': 26, 'n_units_l8': 7, 'n_units_l9': 13, 'n_units_l10': 46, 'n_units_l11': 9, 'optimizer': 'RMSprop', 'rmsprop_learning_rate': 6.466306653723177e-05, 'rmsprop_weight_decay': 0.970109274127296, 'rmsprop_momentum': 0.006213680410812294}. Best is trial 306 with value: 0.761904776096344.
Trial 406 finished with value: 0.682539701461792 and parameters: {'n_layers': 14, 'weight_decay': 1.1318046570664677e-07, 'n_units_l0': 16, 'n_units_l1': 53, 'n_units_l2': 33, 'n_units_l3': 104, 'n_units_l4': 92, 'n_units_l5': 21, 'n_units_l6': 14, 'n_units_l7': 44, 'n_units_l8': 19, 'n_units_l9': 14, 'n_units_l10': 50, 'n_units_l11': 8, 'n_units_l12': 11, 'n_units_l13': 34, 'optimizer': 'RMSprop', 'rmsprop_learning_rate': 0.02291661073853232, 'rmsprop_weight_decay': 0.9651769445608818, 'rmsprop_momentum': 0.00012447892746861522}. Best is trial 306 with value: 0.761904776096344.
Trial 407 finished with value: 0.5873016119003296 and parameters: {'n_layers': 14, 'weight_decay': 1.301449182127693e-07, 'n_units_l0': 16, 'n_units_l1': 57, 'n_units_l2': 30, 'n_units_l3': 101, 'n_units_l4': 108, 'n_units_l5': 26, 'n_units_l6': 14, 'n_units_l7': 49, 'n_units_l8': 19, 'n_units_l9': 14, 'n_units_l10': 50, 'n_units_l11': 8, 'n_units_l12': 11, 'n_units_l13': 32, 'optimizer': 'RMSprop', 'rmsprop_learning_rate': 0.07852662770974014, 'rmsprop_weight_decay': 0.9846678578794559, 'rmsprop_momentum': 0.0001942199492619625}. Best is trial 306 with value: 0.761904776096344.
Trial 408 finished with value: 0.60317462682724 and parameters: {'n_layers': 11, 'weight_decay': 9.23159596231529e-08, 'n_units_l0': 14, 'n_units_l1': 53, 'n_units_l2': 93, 'n_units_l3': 19, 'n_units_l4': 96, 'n_units_l5': 23, 'n_units_l6': 17, 'n_units_l7': 24, 'n_units_l8': 18, 'n_units_l9': 16, 'n_units_l10': 31, 'optimizer': 'Adam', 'adam_learning_rate': 0.003181871619508557}. Best is trial 306 with value: 0.761904776096344.
Trial 409 finished with value: 0.6190476417541504 and parameters: {'n_layers': 13, 'weight_decay': 6.096811324791517e-08, 'n_units_l0': 15, 'n_units_l1': 60, 'n_units_l2': 31, 'n_units_l3': 79, 'n_units_l4': 92, 'n_units_l5': 8, 'n_units_l6': 16, 'n_units_l7': 75, 'n_units_l8': 19, 'n_units_l9': 14, 'n_units_l10': 43, 'n_units_l11': 8, 'n_units_l12': 12, 'optimizer': 'RMSprop', 'rmsprop_learning_rate': 0.0002387657641912194, 'rmsprop_weight_decay': 0.9630057532559754, 'rmsprop_momentum': 0.00011956756373086131}. Best is trial 306 with value: 0.761904776096344.
Trial 410 finished with value: 0.6190476417541504 and parameters: {'n_layers': 18, 'weight_decay': 1.3435687769044252e-07, 'n_units_l0': 14, 'n_units_l1': 64, 'n_units_l2': 33, 'n_units_l3': 107, 'n_units_l4': 94, 'n_units_l5': 51, 'n_units_l6': 23, 'n_units_l7': 31, 'n_units_l8': 17, 'n_units_l9': 13, 'n_units_l10': 48, 'n_units_l11': 8, 'n_units_l12': 21, 'n_units_l13': 34, 'n_units_l14': 124, 'n_units_l15': 8, 'n_units_l16': 12, 'n_units_l17': 10, 'optimizer': 'RMSprop', 'rmsprop_learning_rate': 0.0035956809103821624, 'rmsprop_weight_decay': 0.9572027250986733, 'rmsprop_momentum': 0.0001363164236287191}. Best is trial 306 with value: 0.761904776096344.
Trial 411 finished with value: 0.6190476417541504 and parameters: {'n_layers': 11, 'weight_decay': 2.9269950043187135e-07, 'n_units_l0': 17, 'n_units_l1': 66, 'n_units_l2': 85, 'n_units_l3': 97, 'n_units_l4': 86, 'n_units_l5': 41, 'n_units_l6': 15, 'n_units_l7': 43, 'n_units_l8': 16, 'n_units_l9': 13, 'n_units_l10': 59, 'optimizer': 'RMSprop', 'rmsprop_learning_rate': 0.047876246693075, 'rmsprop_weight_decay': 0.9607225964429754, 'rmsprop_momentum': 0.000167837062298597}. Best is trial 306 with value: 0.761904776096344.
Trial 412 finished with value: 0.5555555820465088 and parameters: {'n_layers': 14, 'weight_decay': 8.127288936698589e-08, 'n_units_l0': 17, 'n_units_l1': 49, 'n_units_l2': 8, 'n_units_l3': 92, 'n_units_l4': 89, 'n_units_l5': 36, 'n_units_l6': 14, 'n_units_l7': 45, 'n_units_l8': 17, 'n_units_l9': 15, 'n_units_l10': 18, 'n_units_l11': 9, 'n_units_l12': 10, 'n_units_l13': 38, 'optimizer': 'RMSprop', 'rmsprop_learning_rate': 0.06399165924411486, 'rmsprop_weight_decay': 0.9648560204219327, 'rmsprop_momentum': 0.0035714538752859505}. Best is trial 306 with value: 0.761904776096344.
Trial 413 finished with value: 0.5714285969734192 and parameters: {'n_layers': 13, 'weight_decay': 2.183648386986502e-07, 'n_units_l0': 15, 'n_units_l1': 15, 'n_units_l2': 113, 'n_units_l3': 113, 'n_units_l4': 75, 'n_units_l5': 59, 'n_units_l6': 62, 'n_units_l7': 22, 'n_units_l8': 37, 'n_units_l9': 12, 'n_units_l10': 50, 'n_units_l11': 7, 'n_units_l12': 13, 'optimizer': 'RMSprop', 'rmsprop_learning_rate': 5.33301827122748e-05, 'rmsprop_weight_decay': 0.9898560691803154, 'rmsprop_momentum': 0.00021170621761832558}. Best is trial 306 with value: 0.761904776096344.
Trial 414 finished with value: 0.682539701461792 and parameters: {'n_layers': 17, 'weight_decay': 4.525839252341816e-05, 'n_units_l0': 20, 'n_units_l1': 53, 'n_units_l2': 5, 'n_units_l3': 102, 'n_units_l4': 106, 'n_units_l5': 45, 'n_units_l6': 13, 'n_units_l7': 67, 'n_units_l8': 50, 'n_units_l9': 9, 'n_units_l10': 54, 'n_units_l11': 9, 'n_units_l12': 8, 'n_units_l13': 35, 'n_units_l14': 42, 'n_units_l15': 31, 'n_units_l16': 6, 'optimizer': 'RMSprop', 'rmsprop_learning_rate': 0.022682876274102735, 'rmsprop_weight_decay': 0.9799363357365867, 'rmsprop_momentum': 0.00035782134992141343}. Best is trial 306 with value: 0.761904776096344.
Trial 415 finished with value: 0.6349206566810608 and parameters: {'n_layers': 14, 'weight_decay': 5.0151240936748933e-05, 'n_units_l0': 20, 'n_units_l1': 52, 'n_units_l2': 5, 'n_units_l3': 103, 'n_units_l4': 119, 'n_units_l5': 44, 'n_units_l6': 13, 'n_units_l7': 64, 'n_units_l8': 77, 'n_units_l9': 9, 'n_units_l10': 52, 'n_units_l11': 8, 'n_units_l12': 8, 'n_units_l13': 35, 'optimizer': 'RMSprop', 'rmsprop_learning_rate': 0.028921221107738298, 'rmsprop_weight_decay': 0.9781707197515365, 'rmsprop_momentum': 0.0003607164002005454}. Best is trial 306 with value: 0.761904776096344.
Trial 416 finished with value: 0.6190476417541504 and parameters: {'n_layers': 17, 'weight_decay': 1.0090109379409888e-10, 'n_units_l0': 14, 'n_units_l1': 54, 'n_units_l2': 5, 'n_units_l3': 88, 'n_units_l4': 118, 'n_units_l5': 52, 'n_units_l6': 13, 'n_units_l7': 53, 'n_units_l8': 48, 'n_units_l9': 11, 'n_units_l10': 46, 'n_units_l11': 9, 'n_units_l12': 8, 'n_units_l13': 31, 'n_units_l14': 39, 'n_units_l15': 22, 'n_units_l16': 6, 'optimizer': 'RMSprop', 'rmsprop_learning_rate': 0.020240332132256244, 'rmsprop_weight_decay': 0.980001534276756, 'rmsprop_momentum': 0.0002828371228981354}. Best is trial 306 with value: 0.761904776096344.
Trial 417 finished with value: 0.60317462682724 and parameters: {'n_layers': 5, 'weight_decay': 4.155324031221773e-05, 'n_units_l0': 19, 'n_units_l1': 46, 'n_units_l2': 97, 'n_units_l3': 95, 'n_units_l4': 128, 'optimizer': 'RMSprop', 'rmsprop_learning_rate': 0.02257174711665426, 'rmsprop_weight_decay': 0.9669988273841772, 'rmsprop_momentum': 0.0007429885422459531}. Best is trial 306 with value: 0.761904776096344.
Trial 418 finished with value: 0.6190476417541504 and parameters: {'n_layers': 16, 'weight_decay': 1.2218292632943297e-05, 'n_units_l0': 19, 'n_units_l1': 49, 'n_units_l2': 89, 'n_units_l3': 109, 'n_units_l4': 100, 'n_units_l5': 42, 'n_units_l6': 12, 'n_units_l7': 51, 'n_units_l8': 43, 'n_units_l9': 47, 'n_units_l10': 62, 'n_units_l11': 9, 'n_units_l12': 7, 'n_units_l13': 40, 'n_units_l14': 43, 'n_units_l15': 33, 'optimizer': 'RMSprop', 'rmsprop_learning_rate': 0.025068875681331586, 'rmsprop_weight_decay': 0.9591805142490654, 'rmsprop_momentum': 3.228869649331877e-05}. Best is trial 306 with value: 0.761904776096344.
Trial 419 finished with value: 0.5873016119003296 and parameters: {'n_layers': 1, 'weight_decay': 2.626481722281082e-05, 'n_units_l0': 16, 'optimizer': 'RMSprop', 'rmsprop_learning_rate': 0.0013006637673970197, 'rmsprop_weight_decay': 0.9415602291030394, 'rmsprop_momentum': 0.0004498684930142598}. Best is trial 306 with value: 0.761904776096344.
Trial 420 finished with value: 0.5714285969734192 and parameters: {'n_layers': 17, 'weight_decay': 3.626526820695441e-08, 'n_units_l0': 18, 'n_units_l1': 56, 'n_units_l2': 16, 'n_units_l3': 84, 'n_units_l4': 79, 'n_units_l5': 46, 'n_units_l6': 33, 'n_units_l7': 39, 'n_units_l8': 56, 'n_units_l9': 10, 'n_units_l10': 54, 'n_units_l11': 8, 'n_units_l12': 5, 'n_units_l13': 29, 'n_units_l14': 49, 'n_units_l15': 27, 'n_units_l16': 7, 'optimizer': 'RMSprop', 'rmsprop_learning_rate': 0.03650546845863722, 'rmsprop_weight_decay': 0.982007256666832, 'rmsprop_momentum': 0.0003191028309574612}. Best is trial 306 with value: 0.761904776096344.
Trial 421 finished with value: 0.6190476417541504 and parameters: {'n_layers': 14, 'weight_decay': 1.8924357177257727e-08, 'n_units_l0': 24, 'n_units_l1': 27, 'n_units_l2': 79, 'n_units_l3': 17, 'n_units_l4': 6, 'n_units_l5': 48, 'n_units_l6': 12, 'n_units_l7': 58, 'n_units_l8': 21, 'n_units_l9': 13, 'n_units_l10': 59, 'n_units_l11': 10, 'n_units_l12': 7, 'n_units_l13': 52, 'optimizer': 'RMSprop', 'rmsprop_learning_rate': 0.01811240211939262, 'rmsprop_weight_decay': 0.976694937290102, 'rmsprop_momentum': 0.00024198199326922235}. Best is trial 306 with value: 0.761904776096344.
Trial 422 finished with value: 0.5873016119003296 and parameters: {'n_layers': 18, 'weight_decay': 1.7522267514162918e-10, 'n_units_l0': 21, 'n_units_l1': 50, 'n_units_l2': 5, 'n_units_l3': 103, 'n_units_l4': 13, 'n_units_l5': 5, 'n_units_l6': 16, 'n_units_l7': 29, 'n_units_l8': 67, 'n_units_l9': 9, 'n_units_l10': 43, 'n_units_l11': 7, 'n_units_l12': 27, 'n_units_l13': 35, 'n_units_l14': 36, 'n_units_l15': 25, 'n_units_l16': 10, 'n_units_l17': 87, 'optimizer': 'RMSprop', 'rmsprop_learning_rate': 0.009432805250828633, 'rmsprop_weight_decay': 0.9548218675625091, 'rmsprop_momentum': 0.0004022073908876399}. Best is trial 306 with value: 0.761904776096344.
Trial 423 finished with value: 0.6349206566810608 and parameters: {'n_layers': 6, 'weight_decay': 7.010850275555546e-05, 'n_units_l0': 12, 'n_units_l1': 30, 'n_units_l2': 35, 'n_units_l3': 99, 'n_units_l4': 102, 'n_units_l5': 40, 'optimizer': 'RMSprop', 'rmsprop_learning_rate': 0.08382544083624248, 'rmsprop_weight_decay': 0.9618257376369466, 'rmsprop_momentum': 4.425543827661013e-05}. Best is trial 306 with value: 0.761904776096344.
Trial 424 finished with value: 0.60317462682724 and parameters: {'n_layers': 16, 'weight_decay': 9.433100401898056e-07, 'n_units_l0': 23, 'n_units_l1': 44, 'n_units_l2': 102, 'n_units_l3': 90, 'n_units_l4': 81, 'n_units_l5': 32, 'n_units_l6': 14, 'n_units_l7': 79, 'n_units_l8': 22, 'n_units_l9': 10, 'n_units_l10': 128, 'n_units_l11': 9, 'n_units_l12': 34, 'n_units_l13': 33, 'n_units_l14': 44, 'n_units_l15': 18, 'optimizer': 'RMSprop', 'rmsprop_learning_rate': 0.015866267420184554, 'rmsprop_weight_decay': 0.9656616424315853, 'rmsprop_momentum': 0.0012401877868148611}. Best is trial 306 with value: 0.761904776096344.
Trial 425 finished with value: 0.5555555820465088 and parameters: {'n_layers': 15, 'weight_decay': 1.4583414808366696e-10, 'n_units_l0': 78, 'n_units_l1': 59, 'n_units_l2': 6, 'n_units_l3': 106, 'n_units_l4': 110, 'n_units_l5': 22, 'n_units_l6': 13, 'n_units_l7': 6, 'n_units_l8': 61, 'n_units_l9': 8, 'n_units_l10': 57, 'n_units_l11': 7, 'n_units_l12': 9, 'n_units_l13': 59, 'n_units_l14': 31, 'optimizer': 'RMSprop', 'rmsprop_learning_rate': 0.09925721470525724, 'rmsprop_weight_decay': 0.9328162162655969, 'rmsprop_momentum': 0.004677606027693576}. Best is trial 306 with value: 0.761904776096344.
Trial 426 finished with value: 0.5396825671195984 and parameters: {'n_layers': 13, 'weight_decay': 4.598571387216835e-07, 'n_units_l0': 54, 'n_units_l1': 34, 'n_units_l2': 33, 'n_units_l3': 18, 'n_units_l4': 109, 'n_units_l5': 43, 'n_units_l6': 15, 'n_units_l7': 68, 'n_units_l8': 51, 'n_units_l9': 12, 'n_units_l10': 66, 'n_units_l11': 6, 'n_units_l12': 15, 'optimizer': 'RMSprop', 'rmsprop_learning_rate': 0.0541422715639952, 'rmsprop_weight_decay': 0.9853782414922799, 'rmsprop_momentum': 0.00027508178327763843}. Best is trial 306 with value: 0.761904776096344.
Trial 427 finished with value: 0.6190476417541504 and parameters: {'n_layers': 17, 'weight_decay': 9.662720667806607e-05, 'n_units_l0': 22, 'n_units_l1': 52, 'n_units_l2': 29, 'n_units_l3': 98, 'n_units_l4': 94, 'n_units_l5': 72, 'n_units_l6': 11, 'n_units_l7': 27, 'n_units_l8': 126, 'n_units_l9': 15, 'n_units_l10': 54, 'n_units_l11': 8, 'n_units_l12': 8, 'n_units_l13': 26, 'n_units_l14': 40, 'n_units_l15': 20, 'n_units_l16': 8, 'optimizer': 'RMSprop', 'rmsprop_learning_rate': 0.013156144151136289, 'rmsprop_weight_decay': 0.9813057930806143, 'rmsprop_momentum': 0.0027365655820636653}. Best is trial 306 with value: 0.761904776096344.
Trial 428 finished with value: 0.5873016119003296 and parameters: {'n_layers': 15, 'weight_decay': 1.8078992274188687e-05, 'n_units_l0': 63, 'n_units_l1': 79, 'n_units_l2': 82, 'n_units_l3': 14, 'n_units_l4': 8, 'n_units_l5': 36, 'n_units_l6': 12, 'n_units_l7': 24, 'n_units_l8': 25, 'n_units_l9': 9, 'n_units_l10': 24, 'n_units_l11': 10, 'n_units_l12': 40, 'n_units_l13': 126, 'n_units_l14': 34, 'optimizer': 'Adam', 'adam_learning_rate': 0.0007806080891281799}. Best is trial 306 with value: 0.761904776096344.
Trial 429 finished with value: 0.5396825671195984 and parameters: {'n_layers': 16, 'weight_decay': 2.241043240948188e-10, 'n_units_l0': 59, 'n_units_l1': 32, 'n_units_l2': 31, 'n_units_l3': 111, 'n_units_l4': 100, 'n_units_l5': 55, 'n_units_l6': 15, 'n_units_l7': 4, 'n_units_l8': 83, 'n_units_l9': 10, 'n_units_l10': 47, 'n_units_l11': 9, 'n_units_l12': 23, 'n_units_l13': 30, 'n_units_l14': 26, 'n_units_l15': 22, 'optimizer': 'RMSprop', 'rmsprop_learning_rate': 0.07332608008259563, 'rmsprop_weight_decay': 0.9637084697489968, 'rmsprop_momentum': 0.0002123672790604098}. Best is trial 306 with value: 0.761904776096344.
Trial 430 finished with value: 0.60317462682724 and parameters: {'n_layers': 18, 'weight_decay': 1.0039727707084371e-10, 'n_units_l0': 65, 'n_units_l1': 28, 'n_units_l2': 119, 'n_units_l3': 9, 'n_units_l4': 7, 'n_units_l5': 51, 'n_units_l6': 12, 'n_units_l7': 21, 'n_units_l8': 13, 'n_units_l9': 32, 'n_units_l10': 52, 'n_units_l11': 11, 'n_units_l12': 31, 'n_units_l13': 27, 'n_units_l14': 47, 'n_units_l15': 9, 'n_units_l16': 5, 'n_units_l17': 5, 'optimizer': 'RMSprop', 'rmsprop_learning_rate': 0.033181069971284186, 'rmsprop_weight_decay': 0.9685740591391658, 'rmsprop_momentum': 0.0022096066441130015}. Best is trial 306 with value: 0.761904776096344.
Trial 431 finished with value: 0.6190476417541504 and parameters: {'n_layers': 17, 'weight_decay': 2.1464381715201514e-10, 'n_units_l0': 32, 'n_units_l1': 37, 'n_units_l2': 20, 'n_units_l3': 35, 'n_units_l4': 116, 'n_units_l5': 46, 'n_units_l6': 13, 'n_units_l7': 45, 'n_units_l8': 93, 'n_units_l9': 11, 'n_units_l10': 35, 'n_units_l11': 10, 'n_units_l12': 4, 'n_units_l13': 38, 'n_units_l14': 53, 'n_units_l15': 19, 'n_units_l16': 6, 'optimizer': 'RMSprop', 'rmsprop_learning_rate': 0.02436154466729074, 'rmsprop_weight_decay': 0.9871306910602433, 'rmsprop_momentum': 0.0006346885530030343}. Best is trial 306 with value: 0.761904776096344.
Trial 432 finished with value: 0.5396825671195984 and parameters: {'n_layers': 19, 'weight_decay': 3.225942422733318e-05, 'n_units_l0': 74, 'n_units_l1': 70, 'n_units_l2': 4, 'n_units_l3': 118, 'n_units_l4': 65, 'n_units_l5': 64, 'n_units_l6': 8, 'n_units_l7': 5, 'n_units_l8': 28, 'n_units_l9': 8, 'n_units_l10': 105, 'n_units_l11': 8, 'n_units_l12': 51, 'n_units_l13': 42, 'n_units_l14': 104, 'n_units_l15': 31, 'n_units_l16': 9, 'n_units_l17': 7, 'n_units_l18': 48, 'optimizer': 'RMSprop', 'rmsprop_learning_rate': 0.05570765094380034, 'rmsprop_weight_decay': 0.9571311748959539, 'rmsprop_momentum': 0.003151497357187278}. Best is trial 306 with value: 0.761904776096344.
Trial 433 finished with value: 0.60317462682724 and parameters: {'n_layers': 14, 'weight_decay': 0.0003779079784007732, 'n_units_l0': 83, 'n_units_l1': 24, 'n_units_l2': 5, 'n_units_l3': 15, 'n_units_l4': 10, 'n_units_l5': 24, 'n_units_l6': 11, 'n_units_l7': 103, 'n_units_l8': 47, 'n_units_l9': 4, 'n_units_l10': 39, 'n_units_l11': 7, 'n_units_l12': 9, 'n_units_l13': 18, 'optimizer': 'RMSprop', 'rmsprop_learning_rate': 0.020775071439565227, 'rmsprop_weight_decay': 0.9604321112052563, 'rmsprop_momentum': 0.0017929002361426161}. Best is trial 306 with value: 0.761904776096344.
Trial 434 finished with value: 0.5555555820465088 and parameters: {'n_layers': 23, 'weight_decay': 1.0401864499145102e-07, 'n_units_l0': 16, 'n_units_l1': 29, 'n_units_l2': 92, 'n_units_l3': 20, 'n_units_l4': 12, 'n_units_l5': 6, 'n_units_l6': 14, 'n_units_l7': 80, 'n_units_l8': 20, 'n_units_l9': 9, 'n_units_l10': 66, 'n_units_l11': 30, 'n_units_l12': 28, 'n_units_l13': 21, 'n_units_l14': 38, 'n_units_l15': 24, 'n_units_l16': 7, 'n_units_l17': 117, 'n_units_l18': 4, 'n_units_l19': 9, 'n_units_l20': 59, 'n_units_l21': 48, 'n_units_l22': 35, 'optimizer': 'RMSprop', 'rmsprop_learning_rate': 0.0006456961237409657, 'rmsprop_weight_decay': 0.974573220803852, 'rmsprop_momentum': 0.0001796604780405017}. Best is trial 306 with value: 0.761904776096344.
Trial 435 finished with value: 0.5555555820465088 and parameters: {'n_layers': 16, 'weight_decay': 1.7506588817412917e-10, 'n_units_l0': 77, 'n_units_l1': 31, 'n_units_l2': 87, 'n_units_l3': 104, 'n_units_l4': 71, 'n_units_l5': 38, 'n_units_l6': 46, 'n_units_l7': 26, 'n_units_l8': 23, 'n_units_l9': 8, 'n_units_l10': 71, 'n_units_l11': 12, 'n_units_l12': 44, 'n_units_l13': 45, 'n_units_l14': 41, 'n_units_l15': 39, 'optimizer': 'RMSprop', 'rmsprop_learning_rate': 0.011203510819548096, 'rmsprop_weight_decay': 0.9719711189661874, 'rmsprop_momentum': 0.00033731436266198444}. Best is trial 306 with value: 0.761904776096344.
Trial 436 finished with value: 0.4285714328289032 and parameters: {'n_layers': 15, 'weight_decay': 3.007834505785699e-10, 'n_units_l0': 20, 'n_units_l1': 55, 'n_units_l2': 109, 'n_units_l3': 122, 'n_units_l4': 6, 'n_units_l5': 34, 'n_units_l6': 13, 'n_units_l7': 89, 'n_units_l8': 26, 'n_units_l9': 27, 'n_units_l10': 100, 'n_units_l11': 11, 'n_units_l12': 20, 'n_units_l13': 36, 'n_units_l14': 8, 'optimizer': 'RMSprop', 'rmsprop_learning_rate': 0.04588620004699317, 'rmsprop_weight_decay': 0.9836472954556171, 'rmsprop_momentum': 0.0040192722093817}. Best is trial 306 with value: 0.761904776096344.
Trial 437 finished with value: 0.5396825671195984 and parameters: {'n_layers': 16, 'weight_decay': 1.4259187244456912e-10, 'n_units_l0': 69, 'n_units_l1': 41, 'n_units_l2': 99, 'n_units_l3': 93, 'n_units_l4': 90, 'n_units_l5': 49, 'n_units_l6': 14, 'n_units_l7': 33, 'n_units_l8': 21, 'n_units_l9': 10, 'n_units_l10': 116, 'n_units_l11': 6, 'n_units_l12': 9, 'n_units_l13': 33, 'n_units_l14': 50, 'n_units_l15': 15, 'optimizer': 'RMSprop', 'rmsprop_learning_rate': 0.06336431430455132, 'rmsprop_weight_decay': 0.9652966084803298, 'rmsprop_momentum': 0.0001487647366040803}. Best is trial 306 with value: 0.761904776096344.
Trial 438 finished with value: 0.6349206566810608 and parameters: {'n_layers': 17, 'weight_decay': 1.1427575806384362e-08, 'n_units_l0': 46, 'n_units_l1': 7, 'n_units_l2': 28, 'n_units_l3': 11, 'n_units_l4': 87, 'n_units_l5': 43, 'n_units_l6': 11, 'n_units_l7': 37, 'n_units_l8': 31, 'n_units_l9': 18, 'n_units_l10': 63, 'n_units_l11': 9, 'n_units_l12': 12, 'n_units_l13': 11, 'n_units_l14': 88, 'n_units_l15': 28, 'n_units_l16': 128, 'optimizer': 'RMSprop', 'rmsprop_learning_rate': 0.008098542465520485, 'rmsprop_weight_decay': 0.9878162767473203, 'rmsprop_momentum': 0.00023386023559153718}. Best is trial 306 with value: 0.761904776096344.
Trial 439 finished with value: 0.6984127163887024 and parameters: {'n_layers': 13, 'weight_decay': 1.3262349138166538e-10, 'n_units_l0': 57, 'n_units_l1': 23, 'n_units_l2': 77, 'n_units_l3': 112, 'n_units_l4': 9, 'n_units_l5': 21, 'n_units_l6': 16, 'n_units_l7': 40, 'n_units_l8': 40, 'n_units_l9': 9, 'n_units_l10': 49, 'n_units_l11': 8, 'n_units_l12': 36, 'optimizer': 'RMSprop', 'rmsprop_learning_rate': 0.07139627533810493, 'rmsprop_weight_decay': 0.9788504807436966, 'rmsprop_momentum': 0.0026816214918684734}. Best is trial 306 with value: 0.761904776096344.
