Trial 479 finished with value: 0.4920634925365448 and parameters: {'n_layers': 14, 'weight_decay': 1.4114679666871528e-10, 'n_units_l0': 91, 'n_units_l1': 28, 'n_units_l2': 101, 'n_units_l3': 39, 'n_units_l4': 38, 'n_units_l5': 41, 'n_units_l6': 40, 'n_units_l7': 26, 'n_units_l8': 24, 'n_units_l9': 10, 'n_units_l10': 53, 'n_units_l11': 8, 'n_units_l12': 8, 'n_units_l13': 19, 'optimizer': 'RMSprop', 'rmsprop_learning_rate': 0.015635332484547355, 'rmsprop_weight_decay': 0.9821707769060408, 'rmsprop_momentum': 0.00023800801942181255}. Best is trial 306 with value: 0.761904776096344.
Trial 480 finished with value: 0.4920634925365448 and parameters: {'n_layers': 19, 'weight_decay': 2.0237901483989367e-10, 'n_units_l0': 79, 'n_units_l1': 9, 'n_units_l2': 112, 'n_units_l3': 102, 'n_units_l4': 18, 'n_units_l5': 35, 'n_units_l6': 18, 'n_units_l7': 23, 'n_units_l8': 22, 'n_units_l9': 8, 'n_units_l10': 95, 'n_units_l11': 8, 'n_units_l12': 6, 'n_units_l13': 34, 'n_units_l14': 22, 'n_units_l15': 7, 'n_units_l16': 46, 'n_units_l17': 4, 'n_units_l18': 23, 'optimizer': 'RMSprop', 'rmsprop_learning_rate': 0.05578950470399706, 'rmsprop_weight_decay': 0.9875449688907001, 'rmsprop_momentum': 0.00039958977591281463}. Best is trial 306 with value: 0.761904776096344.
Trial 481 finished with value: 0.60317462682724 and parameters: {'n_layers': 15, 'weight_decay': 3.6172341325823596e-10, 'n_units_l0': 69, 'n_units_l1': 59, 'n_units_l2': 74, 'n_units_l3': 18, 'n_units_l4': 47, 'n_units_l5': 9, 'n_units_l6': 11, 'n_units_l7': 41, 'n_units_l8': 72, 'n_units_l9': 11, 'n_units_l10': 45, 'n_units_l11': 7, 'n_units_l12': 31, 'n_units_l13': 36, 'n_units_l14': 45, 'optimizer': 'RMSprop', 'rmsprop_learning_rate': 0.03497555035508886, 'rmsprop_weight_decay': 0.9580387877084574, 'rmsprop_momentum': 4.607443657705324e-05}. Best is trial 306 with value: 0.761904776096344.
Trial 482 finished with value: 0.5079365372657776 and parameters: {'n_layers': 5, 'weight_decay': 1.0102425640688985e-10, 'n_units_l0': 16, 'n_units_l1': 26, 'n_units_l2': 86, 'n_units_l3': 110, 'n_units_l4': 43, 'optimizer': 'RMSprop', 'rmsprop_learning_rate': 0.009803704688778314, 'rmsprop_weight_decay': 0.9744964646440547, 'rmsprop_momentum': 0.0038003243398763292}. Best is trial 306 with value: 0.761904776096344.
Trial 483 finished with value: 0.6349206566810608 and parameters: {'n_layers': 16, 'weight_decay': 2.688843710764837e-10, 'n_units_l0': 22, 'n_units_l1': 5, 'n_units_l2': 24, 'n_units_l3': 113, 'n_units_l4': 118, 'n_units_l5': 56, 'n_units_l6': 13, 'n_units_l7': 56, 'n_units_l8': 30, 'n_units_l9': 9, 'n_units_l10': 85, 'n_units_l11': 10, 'n_units_l12': 46, 'n_units_l13': 67, 'n_units_l14': 20, 'n_units_l15': 5, 'optimizer': 'RMSprop', 'rmsprop_learning_rate': 0.0794823030254779, 'rmsprop_weight_decay': 0.9674133125832255, 'rmsprop_momentum': 0.00015002944151110847}. Best is trial 306 with value: 0.761904776096344.
Trial 484 finished with value: 0.4920634925365448 and parameters: {'n_layers': 18, 'weight_decay': 1.5609078703735315e-10, 'n_units_l0': 85, 'n_units_l1': 48, 'n_units_l2': 21, 'n_units_l3': 100, 'n_units_l4': 32, 'n_units_l5': 46, 'n_units_l6': 14, 'n_units_l7': 29, 'n_units_l8': 7, 'n_units_l9': 10, 'n_units_l10': 50, 'n_units_l11': 7, 'n_units_l12': 9, 'n_units_l13': 32, 'n_units_l14': 67, 'n_units_l15': 21, 'n_units_l16': 9, 'n_units_l17': 60, 'optimizer': 'RMSprop', 'rmsprop_learning_rate': 0.018986337400253028, 'rmsprop_weight_decay': 0.9629212621873107, 'rmsprop_momentum': 9.803058799230583e-05}. Best is trial 306 with value: 0.761904776096344.
Trial 485 finished with value: 0.6190476417541504 and parameters: {'n_layers': 13, 'weight_decay': 6.246455273473993e-10, 'n_units_l0': 48, 'n_units_l1': 23, 'n_units_l2': 11, 'n_units_l3': 88, 'n_units_l4': 12, 'n_units_l5': 28, 'n_units_l6': 10, 'n_units_l7': 35, 'n_units_l8': 26, 'n_units_l9': 53, 'n_units_l10': 38, 'n_units_l11': 9, 'n_units_l12': 7, 'optimizer': 'RMSprop', 'rmsprop_learning_rate': 0.013635288952641334, 'rmsprop_weight_decay': 0.9848636157503416, 'rmsprop_momentum': 0.0014822265735148778}. Best is trial 306 with value: 0.761904776096344.
Trial 486 finished with value: 0.5714285969734192 and parameters: {'n_layers': 17, 'weight_decay': 2.0432934473966593e-10, 'n_units_l0': 60, 'n_units_l1': 30, 'n_units_l2': 120, 'n_units_l3': 110, 'n_units_l4': 53, 'n_units_l5': 38, 'n_units_l6': 15, 'n_units_l7': 21, 'n_units_l8': 22, 'n_units_l9': 7, 'n_units_l10': 61, 'n_units_l11': 6, 'n_units_l12': 5, 'n_units_l13': 14, 'n_units_l14': 59, 'n_units_l15': 23, 'n_units_l16': 86, 'optimizer': 'RMSprop', 'rmsprop_learning_rate': 0.04507989338227358, 'rmsprop_weight_decay': 0.9897243572421318, 'rmsprop_momentum': 0.0031750069530066187}. Best is trial 306 with value: 0.761904776096344.
Trial 487 finished with value: 0.4761904776096344 and parameters: {'n_layers': 7, 'weight_decay': 3.876799196180306e-05, 'n_units_l0': 65, 'n_units_l1': 80, 'n_units_l2': 28, 'n_units_l3': 9, 'n_units_l4': 9, 'n_units_l5': 17, 'n_units_l6': 13, 'optimizer': 'SGD', 'sgd_opt_learning_rate': 1.0432329838353932e-05, 'sgd_opt_momentum': 0.047287067032058185}. Best is trial 306 with value: 0.761904776096344.
Trial 488 finished with value: 0.523809552192688 and parameters: {'n_layers': 15, 'weight_decay': 8.246198532747206e-05, 'n_units_l0': 18, 'n_units_l1': 36, 'n_units_l2': 32, 'n_units_l3': 120, 'n_units_l4': 11, 'n_units_l5': 12, 'n_units_l6': 17, 'n_units_l7': 32, 'n_units_l8': 39, 'n_units_l9': 9, 'n_units_l10': 41, 'n_units_l11': 11, 'n_units_l12': 13, 'n_units_l13': 11, 'n_units_l14': 74, 'optimizer': 'RMSprop', 'rmsprop_learning_rate': 0.07093193131754494, 'rmsprop_weight_decay': 0.9789526295265745, 'rmsprop_momentum': 0.0024315409868423256}. Best is trial 306 with value: 0.761904776096344.
Trial 489 finished with value: 0.60317462682724 and parameters: {'n_layers': 12, 'weight_decay': 3.678876727876827e-10, 'n_units_l0': 55, 'n_units_l1': 32, 'n_units_l2': 96, 'n_units_l3': 4, 'n_units_l4': 57, 'n_units_l5': 25, 'n_units_l6': 19, 'n_units_l7': 47, 'n_units_l8': 28, 'n_units_l9': 12, 'n_units_l10': 21, 'n_units_l11': 8, 'optimizer': 'RMSprop', 'rmsprop_learning_rate': 0.08729982602447171, 'rmsprop_weight_decay': 0.9816862661336333, 'rmsprop_momentum': 0.0001819625233182939}. Best is trial 306 with value: 0.761904776096344.
Trial 490 finished with value: 0.4920634925365448 and parameters: {'n_layers': 16, 'weight_decay': 1.2832387222083552e-10, 'n_units_l0': 79, 'n_units_l1': 8, 'n_units_l2': 82, 'n_units_l3': 95, 'n_units_l4': 8, 'n_units_l5': 42, 'n_units_l6': 11, 'n_units_l7': 24, 'n_units_l8': 23, 'n_units_l9': 8, 'n_units_l10': 23, 'n_units_l11': 9, 'n_units_l12': 17, 'n_units_l13': 21, 'n_units_l14': 25, 'n_units_l15': 33, 'optimizer': 'RMSprop', 'rmsprop_learning_rate': 3.868902993113664e-05, 'rmsprop_weight_decay': 0.949849709549576, 'rmsprop_momentum': 0.004668701794289423}. Best is trial 306 with value: 0.761904776096344.
Trial 491 finished with value: 0.5873016119003296 and parameters: {'n_layers': 17, 'weight_decay': 1.8035108961631615e-10, 'n_units_l0': 73, 'n_units_l1': 42, 'n_units_l2': 70, 'n_units_l3': 104, 'n_units_l4': 16, 'n_units_l5': 23, 'n_units_l6': 12, 'n_units_l7': 20, 'n_units_l8': 32, 'n_units_l9': 14, 'n_units_l10': 66, 'n_units_l11': 10, 'n_units_l12': 11, 'n_units_l13': 40, 'n_units_l14': 52, 'n_units_l15': 25, 'n_units_l16': 16, 'optimizer': 'RMSprop', 'rmsprop_learning_rate': 0.059137057834124006, 'rmsprop_weight_decay': 0.9554477798163706, 'rmsprop_momentum': 0.0001305871628766166}. Best is trial 306 with value: 0.761904776096344.
Trial 492 finished with value: 0.5714285969734192 and parameters: {'n_layers': 14, 'weight_decay': 2.6513563469034455e-10, 'n_units_l0': 94, 'n_units_l1': 25, 'n_units_l2': 37, 'n_units_l3': 86, 'n_units_l4': 105, 'n_units_l5': 18, 'n_units_l6': 16, 'n_units_l7': 28, 'n_units_l8': 20, 'n_units_l9': 7, 'n_units_l10': 28, 'n_units_l11': 8, 'n_units_l12': 14, 'n_units_l13': 28, 'optimizer': 'Adam', 'adam_learning_rate': 2.260936565803559e-05}. Best is trial 306 with value: 0.761904776096344.
Trial 493 finished with value: 0.6507936716079712 and parameters: {'n_layers': 18, 'weight_decay': 5.177595949339301e-10, 'n_units_l0': 24, 'n_units_l1': 29, 'n_units_l2': 89, 'n_units_l3': 21, 'n_units_l4': 67, 'n_units_l5': 52, 'n_units_l6': 9, 'n_units_l7': 38, 'n_units_l8': 24, 'n_units_l9': 9, 'n_units_l10': 92, 'n_units_l11': 7, 'n_units_l12': 8, 'n_units_l13': 17, 'n_units_l14': 43, 'n_units_l15': 48, 'n_units_l16': 4, 'n_units_l17': 50, 'optimizer': 'RMSprop', 'rmsprop_learning_rate': 0.025919120883826224, 'rmsprop_weight_decay': 0.9656473491663597, 'rmsprop_momentum': 0.0010353280606534454}. Best is trial 306 with value: 0.761904776096344.
Trial 494 finished with value: 0.5555555820465088 and parameters: {'n_layers': 16, 'weight_decay': 1.2631515211887392e-10, 'n_units_l0': 5, 'n_units_l1': 38, 'n_units_l2': 53, 'n_units_l3': 118, 'n_units_l4': 75, 'n_units_l5': 32, 'n_units_l6': 14, 'n_units_l7': 83, 'n_units_l8': 6, 'n_units_l9': 8, 'n_units_l10': 31, 'n_units_l11': 37, 'n_units_l12': 10, 'n_units_l13': 25, 'n_units_l14': 98, 'n_units_l15': 10, 'optimizer': 'RMSprop', 'rmsprop_learning_rate': 0.06383468512698266, 'rmsprop_weight_decay': 0.9860331688377943, 'rmsprop_momentum': 6.653701294060704e-05}. Best is trial 306 with value: 0.761904776096344.
Trial 495 finished with value: 0.5079365372657776 and parameters: {'n_layers': 17, 'weight_decay': 9.761513249118167e-10, 'n_units_l0': 20, 'n_units_l1': 10, 'n_units_l2': 78, 'n_units_l3': 128, 'n_units_l4': 86, 'n_units_l5': 5, 'n_units_l6': 15, 'n_units_l7': 26, 'n_units_l8': 35, 'n_units_l9': 10, 'n_units_l10': 17, 'n_units_l11': 11, 'n_units_l12': 27, 'n_units_l13': 10, 'n_units_l14': 63, 'n_units_l15': 17, 'n_units_l16': 12, 'optimizer': 'RMSprop', 'rmsprop_learning_rate': 0.09979398776992222, 'rmsprop_weight_decay': 0.9597283879225523, 'rmsprop_momentum': 0.0004983286932682925}. Best is trial 306 with value: 0.761904776096344.
Trial 496 finished with value: 0.6984127163887024 and parameters: {'n_layers': 9, 'weight_decay': 2.2026151228178473e-10, 'n_units_l0': 62, 'n_units_l1': 56, 'n_units_l2': 29, 'n_units_l3': 20, 'n_units_l4': 49, 'n_units_l5': 20, 'n_units_l6': 13, 'n_units_l7': 108, 'n_units_l8': 47, 'optimizer': 'RMSprop', 'rmsprop_learning_rate': 0.041045039193712204, 'rmsprop_weight_decay': 0.9724074487912181, 'rmsprop_momentum': 0.0003375506390136586}. Best is trial 306 with value: 0.761904776096344.
Trial 497 finished with value: 0.5714285969734192 and parameters: {'n_layers': 9, 'weight_decay': 2.174499888130176e-10, 'n_units_l0': 66, 'n_units_l1': 55, 'n_units_l2': 26, 'n_units_l3': 21, 'n_units_l4': 48, 'n_units_l5': 21, 'n_units_l6': 10, 'n_units_l7': 103, 'n_units_l8': 47, 'optimizer': 'RMSprop', 'rmsprop_learning_rate': 0.03531100021491026, 'rmsprop_weight_decay': 0.9718383258260709, 'rmsprop_momentum': 0.00036605595173617506}. Best is trial 306 with value: 0.761904776096344.
Trial 498 finished with value: 0.6349206566810608 and parameters: {'n_layers': 7, 'weight_decay': 3.093302857460551e-10, 'n_units_l0': 61, 'n_units_l1': 52, 'n_units_l2': 28, 'n_units_l3': 20, 'n_units_l4': 51, 'n_units_l5': 20, 'n_units_l6': 13, 'optimizer': 'RMSprop', 'rmsprop_learning_rate': 0.043433541440330695, 'rmsprop_weight_decay': 0.9754101685033526, 'rmsprop_momentum': 0.00030194533589992384}. Best is trial 306 with value: 0.761904776096344.
Trial 499 finished with value: 0.6349206566810608 and parameters: {'n_layers': 8, 'weight_decay': 1.5527905504527274e-10, 'n_units_l0': 70, 'n_units_l1': 70, 'n_units_l2': 30, 'n_units_l3': 23, 'n_units_l4': 45, 'n_units_l5': 19, 'n_units_l6': 12, 'n_units_l7': 111, 'optimizer': 'RMSprop', 'rmsprop_learning_rate': 0.052600046873059345, 'rmsprop_weight_decay': 0.973884203753529, 'rmsprop_momentum': 0.0002619645635481717}. Best is trial 306 with value: 0.761904776096344.
