A new study created in memory with name: no-name-59919a33-7163-4f8d-8b16-837163a7f09c
Trial 0 finished with value: 0.60317462682724 and parameters: {'n_layers': 1, 'weight_decay': 0.00021025438061550957, 'n_units_l0': 30, 'optimizer': 'SGD', 'sgd_opt_learning_rate': 0.0019283423130957078, 'sgd_opt_momentum': 3.180678445973623e-05}. Best is trial 0 with value: 0.60317462682724.
Trial 1 finished with value: 0.5396825671195984 and parameters: {'n_layers': 3, 'weight_decay': 1.0492390171317717e-06, 'n_units_l0': 9, 'n_units_l1': 71, 'n_units_l2': 5, 'optimizer': 'SGD', 'sgd_opt_learning_rate': 0.0633893014316276, 'sgd_opt_momentum': 0.06675175907506087}. Best is trial 0 with value: 0.60317462682724.
Trial 2 finished with value: 0.5396825671195984 and parameters: {'n_layers': 3, 'weight_decay': 4.52378924379303e-10, 'n_units_l0': 32, 'n_units_l1': 29, 'n_units_l2': 6, 'optimizer': 'Adam', 'adam_learning_rate': 0.00028453116480180434}. Best is trial 0 with value: 0.60317462682724.
Trial 3 finished with value: 0.5555555820465088 and parameters: {'n_layers': 2, 'weight_decay': 3.3913185896821833e-07, 'n_units_l0': 120, 'n_units_l1': 13, 'optimizer': 'Adam', 'adam_learning_rate': 0.018051588854335627}. Best is trial 0 with value: 0.60317462682724.
Trial 4 finished with value: 0.5714285969734192 and parameters: {'n_layers': 2, 'weight_decay': 2.9055250103223157e-10, 'n_units_l0': 8, 'n_units_l1': 18, 'optimizer': 'RMSprop', 'rmsprop_learning_rate': 0.03480512669168953, 'rmsprop_weight_decay': 0.8849751301140435, 'rmsprop_momentum': 0.0006000787921783419}. Best is trial 0 with value: 0.60317462682724.
Trial 5 finished with value: 0.5714285969734192 and parameters: {'n_layers': 3, 'weight_decay': 1.7500196922979447e-05, 'n_units_l0': 47, 'n_units_l1': 5, 'n_units_l2': 51, 'optimizer': 'RMSprop', 'rmsprop_learning_rate': 0.0027676821320729668, 'rmsprop_weight_decay': 0.8878043891972167, 'rmsprop_momentum': 0.00150306827862229}. Best is trial 0 with value: 0.60317462682724.
Trial 6 finished with value: 0.60317462682724 and parameters: {'n_layers': 1, 'weight_decay': 6.34226504267705e-06, 'n_units_l0': 9, 'optimizer': 'RMSprop', 'rmsprop_learning_rate': 0.03336348471363039, 'rmsprop_weight_decay': 0.8933693425999539, 'rmsprop_momentum': 1.4602660679545879e-05}. Best is trial 0 with value: 0.60317462682724.
Trial 7 finished with value: 0.5555555820465088 and parameters: {'n_layers': 2, 'weight_decay': 4.150512711170271e-08, 'n_units_l0': 6, 'n_units_l1': 8, 'optimizer': 'RMSprop', 'rmsprop_learning_rate': 0.00021195369878495817, 'rmsprop_weight_decay': 0.8944906878995954, 'rmsprop_momentum': 0.0030025555370406533}. Best is trial 0 with value: 0.60317462682724.
Trial 8 finished with value: 0.5714285969734192 and parameters: {'n_layers': 1, 'weight_decay': 8.975345909139363e-08, 'n_units_l0': 63, 'optimizer': 'SGD', 'sgd_opt_learning_rate': 0.004411307734357267, 'sgd_opt_momentum': 0.002267473874856493}. Best is trial 0 with value: 0.60317462682724.
Trial 9 finished with value: 0.5873016119003296 and parameters: {'n_layers': 3, 'weight_decay': 0.00016445589895221587, 'n_units_l0': 77, 'n_units_l1': 43, 'n_units_l2': 10, 'optimizer': 'RMSprop', 'rmsprop_learning_rate': 0.00026664856474866247, 'rmsprop_weight_decay': 0.8779730619094115, 'rmsprop_momentum': 0.03950021367298581}. Best is trial 0 with value: 0.60317462682724.
Trial 10 finished with value: 0.460317462682724 and parameters: {'n_layers': 1, 'weight_decay': 0.00046974958875702446, 'n_units_l0': 18, 'optimizer': 'SGD', 'sgd_opt_learning_rate': 2.480821902446462e-05, 'sgd_opt_momentum': 1.0863555633922674e-05}. Best is trial 0 with value: 0.60317462682724.
Trial 11 finished with value: 0.4920634925365448 and parameters: {'n_layers': 1, 'weight_decay': 1.3335575658142968e-05, 'n_units_l0': 18, 'optimizer': 'SGD', 'sgd_opt_learning_rate': 0.00043736204071671733, 'sgd_opt_momentum': 2.265329627762899e-05}. Best is trial 0 with value: 0.60317462682724.
Trial 12 finished with value: 0.682539701461792 and parameters: {'n_layers': 1, 'weight_decay': 1.6167054143771368e-05, 'n_units_l0': 4, 'optimizer': 'RMSprop', 'rmsprop_learning_rate': 0.09331363635620667, 'rmsprop_weight_decay': 0.9524138372883195, 'rmsprop_momentum': 1.2791201260115087e-05}. Best is trial 12 with value: 0.682539701461792.
Trial 13 finished with value: 0.4920634925365448 and parameters: {'n_layers': 1, 'weight_decay': 0.0009298201522121598, 'n_units_l0': 4, 'optimizer': 'SGD', 'sgd_opt_learning_rate': 0.0011772816666749334, 'sgd_opt_momentum': 0.0002404562735603861}. Best is trial 12 with value: 0.682539701461792.
Trial 14 finished with value: 0.523809552192688 and parameters: {'n_layers': 1, 'weight_decay': 4.084483568292842e-05, 'n_units_l0': 27, 'optimizer': 'Adam', 'adam_learning_rate': 1.4328133350636764e-05}. Best is trial 12 with value: 0.682539701461792.
Trial 15 finished with value: 0.60317462682724 and parameters: {'n_layers': 2, 'weight_decay': 2.3259808126917673e-06, 'n_units_l0': 14, 'n_units_l1': 92, 'optimizer': 'RMSprop', 'rmsprop_learning_rate': 1.710441993373848e-05, 'rmsprop_weight_decay': 0.9712212164101252, 'rmsprop_momentum': 1.1099807866768206e-05}. Best is trial 12 with value: 0.682539701461792.
Trial 16 finished with value: 0.5396825671195984 and parameters: {'n_layers': 1, 'weight_decay': 0.00012874224400121815, 'n_units_l0': 4, 'optimizer': 'SGD', 'sgd_opt_learning_rate': 7.443845167022223e-05, 'sgd_opt_momentum': 0.0004068461443130565}. Best is trial 12 with value: 0.682539701461792.
Trial 17 finished with value: 0.4920634925365448 and parameters: {'n_layers': 2, 'weight_decay': 5.478271742772677e-09, 'n_units_l0': 39, 'n_units_l1': 4, 'optimizer': 'RMSprop', 'rmsprop_learning_rate': 0.08617120655674541, 'rmsprop_weight_decay': 0.9583771802529332, 'rmsprop_momentum': 0.00011827903242023618}. Best is trial 12 with value: 0.682539701461792.
Trial 18 finished with value: 0.5714285969734192 and parameters: {'n_layers': 1, 'weight_decay': 8.469502608775297e-05, 'n_units_l0': 13, 'optimizer': 'SGD', 'sgd_opt_learning_rate': 0.02208454045159942, 'sgd_opt_momentum': 8.307366811033395e-05}. Best is trial 12 with value: 0.682539701461792.
Trial 19 finished with value: 0.6190476417541504 and parameters: {'n_layers': 1, 'weight_decay': 2.2666691692206492e-06, 'n_units_l0': 6, 'optimizer': 'Adam', 'adam_learning_rate': 0.0595759200927651}. Best is trial 12 with value: 0.682539701461792.
Trial 20 finished with value: 0.4920634925365448 and parameters: {'n_layers': 2, 'weight_decay': 1.643416001194749e-06, 'n_units_l0': 6, 'n_units_l1': 111, 'optimizer': 'Adam', 'adam_learning_rate': 0.0746632907909889}. Best is trial 12 with value: 0.682539701461792.
Trial 21 finished with value: 0.6666666865348816 and parameters: {'n_layers': 1, 'weight_decay': 6.264730144784102e-06, 'n_units_l0': 5, 'optimizer': 'Adam', 'adam_learning_rate': 0.002777238703572568}. Best is trial 12 with value: 0.682539701461792.
Trial 22 finished with value: 0.4285714328289032 and parameters: {'n_layers': 1, 'weight_decay': 2.1263018549111473e-07, 'n_units_l0': 5, 'optimizer': 'Adam', 'adam_learning_rate': 0.0017943544800973854}. Best is trial 12 with value: 0.682539701461792.
Trial 23 finished with value: 0.5555555820465088 and parameters: {'n_layers': 1, 'weight_decay': 6.547006255860928e-06, 'n_units_l0': 7, 'optimizer': 'Adam', 'adam_learning_rate': 0.003603343754232032}. Best is trial 12 with value: 0.682539701461792.
Trial 24 finished with value: 0.5396825671195984 and parameters: {'n_layers': 1, 'weight_decay': 1.3558366051454322e-08, 'n_units_l0': 4, 'optimizer': 'Adam', 'adam_learning_rate': 0.061261663868586946}. Best is trial 12 with value: 0.682539701461792.
Trial 25 finished with value: 0.6507936716079712 and parameters: {'n_layers': 1, 'weight_decay': 5.227740115133845e-07, 'n_units_l0': 5, 'optimizer': 'Adam', 'adam_learning_rate': 0.00020793861234814}. Best is trial 12 with value: 0.682539701461792.
Trial 26 finished with value: 0.6190476417541504 and parameters: {'n_layers': 2, 'weight_decay': 5.056033655224064e-07, 'n_units_l0': 11, 'n_units_l1': 9, 'optimizer': 'Adam', 'adam_learning_rate': 0.00016655549259537655}. Best is trial 12 with value: 0.682539701461792.
Trial 27 finished with value: 0.6507936716079712 and parameters: {'n_layers': 1, 'weight_decay': 3.1264954548002345e-05, 'n_units_l0': 4, 'optimizer': 'Adam', 'adam_learning_rate': 0.00021090085411817704}. Best is trial 12 with value: 0.682539701461792.
Trial 28 finished with value: 0.4761904776096344 and parameters: {'n_layers': 1, 'weight_decay': 7.643264359705229e-08, 'n_units_l0': 5, 'optimizer': 'Adam', 'adam_learning_rate': 4.5346190658220815e-05}. Best is trial 12 with value: 0.682539701461792.
Trial 29 finished with value: 0.5555555820465088 and parameters: {'n_layers': 1, 'weight_decay': 5.886622131183061e-06, 'n_units_l0': 5, 'optimizer': 'RMSprop', 'rmsprop_learning_rate': 0.004185256826802569, 'rmsprop_weight_decay': 0.9403445288827198, 'rmsprop_momentum': 8.846447066144582e-05}. Best is trial 12 with value: 0.682539701461792.
Trial 30 finished with value: 0.5873016119003296 and parameters: {'n_layers': 2, 'weight_decay': 8.95753240154476e-07, 'n_units_l0': 11, 'n_units_l1': 44, 'optimizer': 'Adam', 'adam_learning_rate': 0.005880443442180654}. Best is trial 12 with value: 0.682539701461792.
Trial 31 finished with value: 0.60317462682724 and parameters: {'n_layers': 1, 'weight_decay': 4.2641862596647174e-05, 'n_units_l0': 4, 'optimizer': 'Adam', 'adam_learning_rate': 0.0004993206731852398}. Best is trial 12 with value: 0.682539701461792.
Trial 32 finished with value: 0.6507936716079712 and parameters: {'n_layers': 1, 'weight_decay': 2.895579109940746e-05, 'n_units_l0': 7, 'optimizer': 'Adam', 'adam_learning_rate': 9.52625665280919e-05}. Best is trial 12 with value: 0.682539701461792.
Trial 33 finished with value: 0.5555555820465088 and parameters: {'n_layers': 1, 'weight_decay': 6.159634040905479e-06, 'n_units_l0': 5, 'optimizer': 'Adam', 'adam_learning_rate': 0.0006384125135061334}. Best is trial 12 with value: 0.682539701461792.
Trial 34 finished with value: 0.5396825671195984 and parameters: {'n_layers': 1, 'weight_decay': 0.00037581058034933854, 'n_units_l0': 4, 'optimizer': 'Adam', 'adam_learning_rate': 0.0012483203804893191}. Best is trial 12 with value: 0.682539701461792.
Trial 35 finished with value: 0.5873016119003296 and parameters: {'n_layers': 1, 'weight_decay': 6.847410169762442e-05, 'n_units_l0': 8, 'optimizer': 'Adam', 'adam_learning_rate': 3.475878215031619e-05}. Best is trial 12 with value: 0.682539701461792.
Trial 36 finished with value: 0.5714285969734192 and parameters: {'n_layers': 1, 'weight_decay': 1.80710415468614e-05, 'n_units_l0': 5, 'optimizer': 'Adam', 'adam_learning_rate': 0.00022142065633337651}. Best is trial 12 with value: 0.682539701461792.
Trial 37 finished with value: 0.523809552192688 and parameters: {'n_layers': 3, 'weight_decay': 2.108215097634113e-09, 'n_units_l0': 7, 'n_units_l1': 23, 'n_units_l2': 80, 'optimizer': 'RMSprop', 'rmsprop_learning_rate': 0.0054689651658798594, 'rmsprop_weight_decay': 0.9877927387873133, 'rmsprop_momentum': 0.024523130550914735}. Best is trial 12 with value: 0.682539701461792.
Trial 38 finished with value: 0.682539701461792 and parameters: {'n_layers': 2, 'weight_decay': 2.3380447672966076e-07, 'n_units_l0': 11, 'n_units_l1': 54, 'optimizer': 'RMSprop', 'rmsprop_learning_rate': 1.0626941332644753e-05, 'rmsprop_weight_decay': 0.8500815416716662, 'rmsprop_momentum': 9.815123981929367e-05}. Best is trial 12 with value: 0.682539701461792.
Trial 39 finished with value: 0.5555555820465088 and parameters: {'n_layers': 3, 'weight_decay': 1.7259816345159385e-07, 'n_units_l0': 10, 'n_units_l1': 54, 'n_units_l2': 22, 'optimizer': 'RMSprop', 'rmsprop_learning_rate': 1.4523926611159773e-05, 'rmsprop_weight_decay': 0.8529799191915668, 'rmsprop_momentum': 6.456664168460407e-05}. Best is trial 12 with value: 0.682539701461792.
Trial 40 finished with value: 0.6507936716079712 and parameters: {'n_layers': 2, 'weight_decay': 6.396744485785421e-07, 'n_units_l0': 14, 'n_units_l1': 29, 'optimizer': 'RMSprop', 'rmsprop_learning_rate': 9.323047752659014e-05, 'rmsprop_weight_decay': 0.9360148793314137, 'rmsprop_momentum': 0.00030121321822845163}. Best is trial 12 with value: 0.682539701461792.
Trial 41 finished with value: 0.60317462682724 and parameters: {'n_layers': 1, 'weight_decay': 3.7574934305041533e-06, 'n_units_l0': 6, 'optimizer': 'RMSprop', 'rmsprop_learning_rate': 0.000736891624596144, 'rmsprop_weight_decay': 0.9187108133210086, 'rmsprop_momentum': 3.202339946851513e-05}. Best is trial 12 with value: 0.682539701461792.
Trial 42 finished with value: 0.5555555820465088 and parameters: {'n_layers': 2, 'weight_decay': 1.236590845847751e-05, 'n_units_l0': 8, 'n_units_l1': 77, 'optimizer': 'RMSprop', 'rmsprop_learning_rate': 4.87552579514762e-05, 'rmsprop_weight_decay': 0.8560810414078767, 'rmsprop_momentum': 0.00020779022017264765}. Best is trial 12 with value: 0.682539701461792.
Trial 43 finished with value: 0.6190476417541504 and parameters: {'n_layers': 1, 'weight_decay': 2.6713414926149278e-08, 'n_units_l0': 9, 'optimizer': 'RMSprop', 'rmsprop_learning_rate': 0.0007873248297877691, 'rmsprop_weight_decay': 0.9229793532816343, 'rmsprop_momentum': 2.825016136614961e-05}. Best is trial 12 with value: 0.682539701461792.
Trial 44 finished with value: 0.5555555820465088 and parameters: {'n_layers': 3, 'weight_decay': 7.982471335416925e-07, 'n_units_l0': 22, 'n_units_l1': 124, 'n_units_l2': 26, 'optimizer': 'RMSprop', 'rmsprop_learning_rate': 0.012413986354630294, 'rmsprop_weight_decay': 0.9585515814940998, 'rmsprop_momentum': 4.0228525089368886e-05}. Best is trial 12 with value: 0.682539701461792.
Trial 45 finished with value: 0.5714285969734192 and parameters: {'n_layers': 2, 'weight_decay': 1.0171721694396266e-07, 'n_units_l0': 5, 'n_units_l1': 15, 'optimizer': 'Adam', 'adam_learning_rate': 0.00620235105336132}. Best is trial 12 with value: 0.682539701461792.
Trial 46 finished with value: 0.4920634925365448 and parameters: {'n_layers': 1, 'weight_decay': 2.9438501340413963e-07, 'n_units_l0': 92, 'optimizer': 'RMSprop', 'rmsprop_learning_rate': 4.563574748400395e-05, 'rmsprop_weight_decay': 0.9128034528012162, 'rmsprop_momentum': 0.0043285627281691485}. Best is trial 12 with value: 0.682539701461792.
Trial 47 finished with value: 0.6349206566810608 and parameters: {'n_layers': 1, 'weight_decay': 1.0235541990290157e-10, 'n_units_l0': 4, 'optimizer': 'Adam', 'adam_learning_rate': 8.074082290538223e-05}. Best is trial 12 with value: 0.682539701461792.
Trial 48 finished with value: 0.5079365372657776 and parameters: {'n_layers': 2, 'weight_decay': 1.3378370253097054e-06, 'n_units_l0': 6, 'n_units_l1': 32, 'optimizer': 'RMSprop', 'rmsprop_learning_rate': 0.0012741935976905824, 'rmsprop_weight_decay': 0.943606340429533, 'rmsprop_momentum': 0.0004043665360590715}. Best is trial 12 with value: 0.682539701461792.
Trial 49 finished with value: 0.4761904776096344 and parameters: {'n_layers': 1, 'weight_decay': 0.00025308262764813536, 'n_units_l0': 18, 'optimizer': 'SGD', 'sgd_opt_learning_rate': 1.2232991312647897e-05, 'sgd_opt_momentum': 0.006553808145085479}. Best is trial 12 with value: 0.682539701461792.
Trial 50 finished with value: 0.60317462682724 and parameters: {'n_layers': 1, 'weight_decay': 1.8651712249579948e-05, 'n_units_l0': 50, 'optimizer': 'Adam', 'adam_learning_rate': 0.0019718249647073705}. Best is trial 12 with value: 0.682539701461792.
Trial 51 finished with value: 0.6507936716079712 and parameters: {'n_layers': 1, 'weight_decay': 3.393229165118782e-05, 'n_units_l0': 7, 'optimizer': 'Adam', 'adam_learning_rate': 0.00011443449178076362}. Best is trial 12 with value: 0.682539701461792.
Trial 52 finished with value: 0.60317462682724 and parameters: {'n_layers': 1, 'weight_decay': 2.4647117659421417e-05, 'n_units_l0': 7, 'optimizer': 'Adam', 'adam_learning_rate': 0.00035441667967880014}. Best is trial 12 with value: 0.682539701461792.
Trial 53 finished with value: 0.5079365372657776 and parameters: {'n_layers': 1, 'weight_decay': 8.626584642223309e-05, 'n_units_l0': 6, 'optimizer': 'Adam', 'adam_learning_rate': 8.065269622612033e-05}. Best is trial 12 with value: 0.682539701461792.
Trial 54 finished with value: 0.5714285969734192 and parameters: {'n_layers': 1, 'weight_decay': 2.5902185140054886e-06, 'n_units_l0': 8, 'optimizer': 'Adam', 'adam_learning_rate': 2.221737400131106e-05}. Best is trial 12 with value: 0.682539701461792.
Trial 55 finished with value: 0.60317462682724 and parameters: {'n_layers': 1, 'weight_decay': 8.493758750515994e-06, 'n_units_l0': 9, 'optimizer': 'Adam', 'adam_learning_rate': 0.000801619476144167}. Best is trial 12 with value: 0.682539701461792.
Trial 56 finished with value: 0.6190476417541504 and parameters: {'n_layers': 1, 'weight_decay': 4.267908196868451e-06, 'n_units_l0': 5, 'optimizer': 'SGD', 'sgd_opt_learning_rate': 0.00017739721248837388, 'sgd_opt_momentum': 0.09774964892394389}. Best is trial 12 with value: 0.682539701461792.
Trial 57 finished with value: 0.5873016119003296 and parameters: {'n_layers': 1, 'weight_decay': 0.00016673412255929724, 'n_units_l0': 12, 'optimizer': 'Adam', 'adam_learning_rate': 4.719894795226843e-05}. Best is trial 12 with value: 0.682539701461792.
Trial 58 finished with value: 0.5555555820465088 and parameters: {'n_layers': 1, 'weight_decay': 5.1933863764750296e-05, 'n_units_l0': 15, 'optimizer': 'RMSprop', 'rmsprop_learning_rate': 0.01360742611500306, 'rmsprop_weight_decay': 0.867986507871296, 'rmsprop_momentum': 0.00014775257935152383}. Best is trial 12 with value: 0.682539701461792.
Trial 59 finished with value: 0.6190476417541504 and parameters: {'n_layers': 2, 'weight_decay': 1.0673004041641893e-05, 'n_units_l0': 4, 'n_units_l1': 53, 'optimizer': 'Adam', 'adam_learning_rate': 0.00014076560616087746}. Best is trial 12 with value: 0.682539701461792.
Trial 60 finished with value: 0.5396825671195984 and parameters: {'n_layers': 1, 'weight_decay': 4.268393744066079e-07, 'n_units_l0': 7, 'optimizer': 'RMSprop', 'rmsprop_learning_rate': 0.09250056186502394, 'rmsprop_weight_decay': 0.9862723654278169, 'rmsprop_momentum': 1.1388406624621332e-05}. Best is trial 12 with value: 0.682539701461792.
Trial 61 finished with value: 0.523809552192688 and parameters: {'n_layers': 2, 'weight_decay': 6.697625386770444e-07, 'n_units_l0': 14, 'n_units_l1': 30, 'optimizer': 'RMSprop', 'rmsprop_learning_rate': 6.26581632837358e-05, 'rmsprop_weight_decay': 0.9354774642017817, 'rmsprop_momentum': 0.0002930899490564807}. Best is trial 12 with value: 0.682539701461792.
Trial 62 finished with value: 0.5873016119003296 and parameters: {'n_layers': 2, 'weight_decay': 1.3189658325921416e-07, 'n_units_l0': 22, 'n_units_l1': 25, 'optimizer': 'RMSprop', 'rmsprop_learning_rate': 0.00014461655499903203, 'rmsprop_weight_decay': 0.9061144449719057, 'rmsprop_momentum': 0.001428747550302424}. Best is trial 12 with value: 0.682539701461792.
Trial 63 finished with value: 0.5714285969734192 and parameters: {'n_layers': 2, 'weight_decay': 4.892625231731151e-08, 'n_units_l0': 16, 'n_units_l1': 39, 'optimizer': 'RMSprop', 'rmsprop_learning_rate': 1.1974677765466073e-05, 'rmsprop_weight_decay': 0.9556018127012832, 'rmsprop_momentum': 6.607788899752411e-05}. Best is trial 12 with value: 0.682539701461792.
Trial 64 finished with value: 0.5873016119003296 and parameters: {'n_layers': 3, 'weight_decay': 2.820802863422982e-07, 'n_units_l0': 10, 'n_units_l1': 61, 'n_units_l2': 118, 'optimizer': 'RMSprop', 'rmsprop_learning_rate': 9.53540495808473e-05, 'rmsprop_weight_decay': 0.9299478322992486, 'rmsprop_momentum': 0.0007172788822627207}. Best is trial 12 with value: 0.682539701461792.
Trial 65 finished with value: 0.5396825671195984 and parameters: {'n_layers': 2, 'weight_decay': 1.242266792498019e-06, 'n_units_l0': 13, 'n_units_l1': 10, 'optimizer': 'Adam', 'adam_learning_rate': 0.00031046898937250926}. Best is trial 12 with value: 0.682539701461792.
Trial 66 finished with value: 0.6190476417541504 and parameters: {'n_layers': 2, 'weight_decay': 2.5950456335328866e-06, 'n_units_l0': 11, 'n_units_l1': 19, 'optimizer': 'SGD', 'sgd_opt_learning_rate': 0.0076992033357605166, 'sgd_opt_momentum': 0.01431446366700385}. Best is trial 12 with value: 0.682539701461792.
Trial 67 finished with value: 0.5555555820465088 and parameters: {'n_layers': 1, 'weight_decay': 3.963549048418862e-06, 'n_units_l0': 4, 'optimizer': 'RMSprop', 'rmsprop_learning_rate': 3.114919787002689e-05, 'rmsprop_weight_decay': 0.9469064648043886, 'rmsprop_momentum': 0.011470323954432886}. Best is trial 12 with value: 0.682539701461792.
Trial 68 finished with value: 0.5079365372657776 and parameters: {'n_layers': 2, 'weight_decay': 2.9857677076544278e-05, 'n_units_l0': 6, 'n_units_l1': 37, 'optimizer': 'Adam', 'adam_learning_rate': 0.00039057113927508776}. Best is trial 12 with value: 0.682539701461792.
Trial 69 finished with value: 0.6190476417541504 and parameters: {'n_layers': 1, 'weight_decay': 0.00010444304142698603, 'n_units_l0': 5, 'optimizer': 'RMSprop', 'rmsprop_learning_rate': 0.0004098596647173572, 'rmsprop_weight_decay': 0.9733245809687253, 'rmsprop_momentum': 2.768371325265065e-05}. Best is trial 12 with value: 0.682539701461792.
Trial 70 finished with value: 0.60317462682724 and parameters: {'n_layers': 1, 'weight_decay': 0.0008248766910084272, 'n_units_l0': 25, 'optimizer': 'Adam', 'adam_learning_rate': 0.020904647607273737}. Best is trial 12 with value: 0.682539701461792.
Trial 71 finished with value: 0.6190476417541504 and parameters: {'n_layers': 1, 'weight_decay': 2.9388271158241013e-05, 'n_units_l0': 7, 'optimizer': 'Adam', 'adam_learning_rate': 8.59144834955772e-05}. Best is trial 12 with value: 0.682539701461792.
