Trial 72 finished with value: 0.5396825671195984 and parameters: {'n_layers': 1, 'weight_decay': 5.043905624824042e-05, 'n_units_l0': 8, 'optimizer': 'Adam', 'adam_learning_rate': 0.0001312511919498316}. Best is trial 12 with value: 0.682539701461792.
Trial 73 finished with value: 0.5079365372657776 and parameters: {'n_layers': 1, 'weight_decay': 1.4794620039812827e-05, 'n_units_l0': 6, 'optimizer': 'Adam', 'adam_learning_rate': 1.1799188419409325e-05}. Best is trial 12 with value: 0.682539701461792.
Trial 74 finished with value: 0.4761904776096344 and parameters: {'n_layers': 1, 'weight_decay': 7.221104387051027e-06, 'n_units_l0': 10, 'optimizer': 'Adam', 'adam_learning_rate': 0.0001944357903653015}. Best is trial 12 with value: 0.682539701461792.
Trial 75 finished with value: 0.6666666865348816 and parameters: {'n_layers': 1, 'weight_decay': 5.642201262219368e-07, 'n_units_l0': 5, 'optimizer': 'Adam', 'adam_learning_rate': 0.001147406403260849}. Best is trial 12 with value: 0.682539701461792.
Trial 76 finished with value: 0.523809552192688 and parameters: {'n_layers': 1, 'weight_decay': 5.329000671141993e-07, 'n_units_l0': 5, 'optimizer': 'Adam', 'adam_learning_rate': 0.0012395685008636836}. Best is trial 12 with value: 0.682539701461792.
Trial 77 finished with value: 0.6507936716079712 and parameters: {'n_layers': 1, 'weight_decay': 2.0690351244367063e-07, 'n_units_l0': 17, 'optimizer': 'RMSprop', 'rmsprop_learning_rate': 2.4919459839962094e-05, 'rmsprop_weight_decay': 0.9283309094496186, 'rmsprop_momentum': 0.0002224321511940533}. Best is trial 12 with value: 0.682539701461792.
Trial 78 finished with value: 0.6507936716079712 and parameters: {'n_layers': 3, 'weight_decay': 4.680163837344643e-08, 'n_units_l0': 33, 'n_units_l1': 80, 'n_units_l2': 11, 'optimizer': 'Adam', 'adam_learning_rate': 0.004450210383336694}. Best is trial 12 with value: 0.682539701461792.
Trial 79 finished with value: 0.682539701461792 and parameters: {'n_layers': 1, 'weight_decay': 8.820779195650108e-07, 'n_units_l0': 4, 'optimizer': 'RMSprop', 'rmsprop_learning_rate': 8.938081617468624e-05, 'rmsprop_weight_decay': 0.9049851588756055, 'rmsprop_momentum': 0.0004353099046496413}. Best is trial 12 with value: 0.682539701461792.
Trial 80 finished with value: 0.6190476417541504 and parameters: {'n_layers': 1, 'weight_decay': 1.194580172307544e-06, 'n_units_l0': 4, 'optimizer': 'SGD', 'sgd_opt_learning_rate': 6.088666116031749e-05, 'sgd_opt_momentum': 0.0017537510635526564}. Best is trial 12 with value: 0.682539701461792.
Trial 81 finished with value: 0.6507936716079712 and parameters: {'n_layers': 1, 'weight_decay': 1.9968985655385114e-06, 'n_units_l0': 4, 'optimizer': 'RMSprop', 'rmsprop_learning_rate': 9.833721149700707e-05, 'rmsprop_weight_decay': 0.9028824602871711, 'rmsprop_momentum': 0.0005306084008556735}. Best is trial 12 with value: 0.682539701461792.
Trial 82 finished with value: 0.5555555820465088 and parameters: {'n_layers': 1, 'weight_decay': 7.446051206718307e-07, 'n_units_l0': 5, 'optimizer': 'RMSprop', 'rmsprop_learning_rate': 0.0015931353110875102, 'rmsprop_weight_decay': 0.876085118233684, 'rmsprop_momentum': 0.0004457015583245275}. Best is trial 12 with value: 0.682539701461792.
Trial 83 finished with value: 0.6190476417541504 and parameters: {'n_layers': 1, 'weight_decay': 4.0341814363478966e-07, 'n_units_l0': 6, 'optimizer': 'RMSprop', 'rmsprop_learning_rate': 0.00033174584250991756, 'rmsprop_weight_decay': 0.9495612866443801, 'rmsprop_momentum': 0.0015154013536638454}. Best is trial 12 with value: 0.682539701461792.
Trial 84 finished with value: 0.523809552192688 and parameters: {'n_layers': 1, 'weight_decay': 1.665456689203574e-07, 'n_units_l0': 4, 'optimizer': 'RMSprop', 'rmsprop_learning_rate': 2.7352268384423326e-05, 'rmsprop_weight_decay': 0.970610378760638, 'rmsprop_momentum': 0.0007552519613728845}. Best is trial 12 with value: 0.682539701461792.
Trial 85 finished with value: 0.523809552192688 and parameters: {'n_layers': 1, 'weight_decay': 7.3219798068288e-08, 'n_units_l0': 122, 'optimizer': 'RMSprop', 'rmsprop_learning_rate': 0.0005056717124458678, 'rmsprop_weight_decay': 0.8648300523818521, 'rmsprop_momentum': 0.00017389002815425457}. Best is trial 12 with value: 0.682539701461792.
Trial 86 finished with value: 0.5714285969734192 and parameters: {'n_layers': 2, 'weight_decay': 2.8224488691994454e-07, 'n_units_l0': 7, 'n_units_l1': 6, 'optimizer': 'Adam', 'adam_learning_rate': 0.0023036489369695004}. Best is trial 12 with value: 0.682539701461792.
Trial 87 finished with value: 0.6507936716079712 and parameters: {'n_layers': 1, 'weight_decay': 1.655755921787972e-06, 'n_units_l0': 19, 'optimizer': 'Adam', 'adam_learning_rate': 0.003029968675978649}. Best is trial 12 with value: 0.682539701461792.
Trial 88 finished with value: 0.5714285969734192 and parameters: {'n_layers': 1, 'weight_decay': 1.495953935747902e-08, 'n_units_l0': 9, 'optimizer': 'RMSprop', 'rmsprop_learning_rate': 0.00016332636972314326, 'rmsprop_weight_decay': 0.8890338727179715, 'rmsprop_momentum': 0.0025412411568578605}. Best is trial 12 with value: 0.682539701461792.
Trial 89 finished with value: 0.523809552192688 and parameters: {'n_layers': 1, 'weight_decay': 1.9209496954344773e-05, 'n_units_l0': 5, 'optimizer': 'Adam', 'adam_learning_rate': 0.008383239768140078}. Best is trial 12 with value: 0.682539701461792.
Trial 90 finished with value: 0.5396825671195984 and parameters: {'n_layers': 2, 'weight_decay': 3.1583696544383653e-06, 'n_units_l0': 13, 'n_units_l1': 13, 'optimizer': 'RMSprop', 'rmsprop_learning_rate': 0.03840569022175883, 'rmsprop_weight_decay': 0.9024014792536399, 'rmsprop_momentum': 1.8828440123417715e-05}. Best is trial 12 with value: 0.682539701461792.
Trial 91 finished with value: 0.523809552192688 and parameters: {'n_layers': 1, 'weight_decay': 6.706162932978356e-05, 'n_units_l0': 6, 'optimizer': 'Adam', 'adam_learning_rate': 0.00010648997218140289}. Best is trial 12 with value: 0.682539701461792.
Trial 92 finished with value: 0.5873016119003296 and parameters: {'n_layers': 1, 'weight_decay': 5.119349927947102e-06, 'n_units_l0': 9, 'optimizer': 'Adam', 'adam_learning_rate': 5.433603715954285e-05}. Best is trial 12 with value: 0.682539701461792.
Trial 93 finished with value: 0.5555555820465088 and parameters: {'n_layers': 1, 'weight_decay': 1.0275599131238168e-05, 'n_units_l0': 12, 'optimizer': 'Adam', 'adam_learning_rate': 0.0009898532188715075}. Best is trial 12 with value: 0.682539701461792.
Trial 94 finished with value: 0.5714285969734192 and parameters: {'n_layers': 1, 'weight_decay': 4.12251584125928e-05, 'n_units_l0': 8, 'optimizer': 'Adam', 'adam_learning_rate': 0.0005543994951308827}. Best is trial 12 with value: 0.682539701461792.
Trial 95 finished with value: 0.5555555820465088 and parameters: {'n_layers': 1, 'weight_decay': 9.719764249393653e-07, 'n_units_l0': 10, 'optimizer': 'Adam', 'adam_learning_rate': 0.00023141974561283256}. Best is trial 12 with value: 0.682539701461792.
Trial 96 finished with value: 0.5079365372657776 and parameters: {'n_layers': 1, 'weight_decay': 2.718273892760914e-05, 'n_units_l0': 20, 'optimizer': 'Adam', 'adam_learning_rate': 2.889396387773563e-05}. Best is trial 12 with value: 0.682539701461792.
Trial 97 finished with value: 0.5396825671195984 and parameters: {'n_layers': 1, 'weight_decay': 1.1233531818793812e-07, 'n_units_l0': 7, 'optimizer': 'RMSprop', 'rmsprop_learning_rate': 8.995506568899298e-05, 'rmsprop_weight_decay': 0.9350976134708133, 'rmsprop_momentum': 6.342038331331188e-05}. Best is trial 12 with value: 0.682539701461792.
Trial 98 finished with value: 0.523809552192688 and parameters: {'n_layers': 1, 'weight_decay': 4.388282067895322e-07, 'n_units_l0': 5, 'optimizer': 'Adam', 'adam_learning_rate': 0.013417211874086546}. Best is trial 12 with value: 0.682539701461792.
Trial 99 finished with value: 0.5873016119003296 and parameters: {'n_layers': 2, 'weight_decay': 0.0001509197344357218, 'n_units_l0': 15, 'n_units_l1': 65, 'optimizer': 'SGD', 'sgd_opt_learning_rate': 0.02559779983787286, 'sgd_opt_momentum': 0.01711400650492206}. Best is trial 12 with value: 0.682539701461792.
