Trial 54 finished with value: 0.5416755676269531 and parameters: {'n_layers': 7, 'weight_decay': 9.12303437933476e-08, 'n_units_l0': 17, 'n_units_l1': 37, 'n_units_l2': 29, 'n_units_l3': 43, 'n_units_l4': 10, 'n_units_l5': 7, 'n_units_l6': 67, 'optimizer': 'Adam', 'adam_learning_rate': 8.75050277365427e-05}. Best is trial 30 with value: 0.5492335557937622.
Trial 55 finished with value: 0.5071658492088318 and parameters: {'n_layers': 7, 'weight_decay': 1.0909016984197063e-07, 'n_units_l0': 12, 'n_units_l1': 37, 'n_units_l2': 30, 'n_units_l3': 55, 'n_units_l4': 9, 'n_units_l5': 6, 'n_units_l6': 83, 'optimizer': 'Adam', 'adam_learning_rate': 9.673143382085782e-05}. Best is trial 30 with value: 0.5492335557937622.
Trial 56 finished with value: 0.5116577744483948 and parameters: {'n_layers': 6, 'weight_decay': 8.674134702926234e-07, 'n_units_l0': 8, 'n_units_l1': 99, 'n_units_l2': 40, 'n_units_l3': 43, 'n_units_l4': 23, 'n_units_l5': 7, 'optimizer': 'Adam', 'adam_learning_rate': 1.0078691900297258e-05}. Best is trial 30 with value: 0.5492335557937622.
Trial 57 finished with value: 0.5189661383628845 and parameters: {'n_layers': 25, 'weight_decay': 6.27187464215893e-08, 'n_units_l0': 21, 'n_units_l1': 71, 'n_units_l2': 95, 'n_units_l3': 32, 'n_units_l4': 6, 'n_units_l5': 4, 'n_units_l6': 126, 'n_units_l7': 10, 'n_units_l8': 18, 'n_units_l9': 40, 'n_units_l10': 4, 'n_units_l11': 7, 'n_units_l12': 30, 'n_units_l13': 33, 'n_units_l14': 114, 'n_units_l15': 4, 'n_units_l16': 15, 'n_units_l17': 4, 'n_units_l18': 8, 'n_units_l19': 13, 'n_units_l20': 120, 'n_units_l21': 105, 'n_units_l22': 4, 'n_units_l23': 4, 'n_units_l24': 117, 'optimizer': 'Adam', 'adam_learning_rate': 0.00024342195136849726}. Best is trial 30 with value: 0.5492335557937622.
Trial 58 finished with value: 0.5274153351783752 and parameters: {'n_layers': 19, 'weight_decay': 7.589135118655597e-09, 'n_units_l0': 121, 'n_units_l1': 105, 'n_units_l2': 5, 'n_units_l3': 24, 'n_units_l4': 13, 'n_units_l5': 9, 'n_units_l6': 60, 'n_units_l7': 6, 'n_units_l8': 31, 'n_units_l9': 6, 'n_units_l10': 19, 'n_units_l11': 20, 'n_units_l12': 121, 'n_units_l13': 61, 'n_units_l14': 42, 'n_units_l15': 35, 'n_units_l16': 95, 'n_units_l17': 16, 'n_units_l18': 126, 'optimizer': 'SGD', 'sgd_opt_learning_rate': 0.007599602658988109, 'sgd_opt_momentum': 0.0001599033040798192}. Best is trial 30 with value: 0.5492335557937622.
Trial 59 finished with value: 0.5159000754356384 and parameters: {'n_layers': 11, 'weight_decay': 2.3645096334719388e-07, 'n_units_l0': 13, 'n_units_l1': 50, 'n_units_l2': 16, 'n_units_l3': 82, 'n_units_l4': 10, 'n_units_l5': 5, 'n_units_l6': 45, 'n_units_l7': 25, 'n_units_l8': 84, 'n_units_l9': 85, 'n_units_l10': 32, 'optimizer': 'Adam', 'adam_learning_rate': 1.536753526577779e-05}. Best is trial 30 with value: 0.5492335557937622.
Trial 60 finished with value: 0.5283422470092773 and parameters: {'n_layers': 10, 'weight_decay': 2.862463905723507e-08, 'n_units_l0': 5, 'n_units_l1': 40, 'n_units_l2': 12, 'n_units_l3': 65, 'n_units_l4': 20, 'n_units_l5': 7, 'n_units_l6': 93, 'n_units_l7': 38, 'n_units_l8': 10, 'n_units_l9': 14, 'optimizer': 'Adam', 'adam_learning_rate': 6.194189623520047e-05}. Best is trial 30 with value: 0.5492335557937622.
Trial 61 finished with value: 0.5146167874336243 and parameters: {'n_layers': 2, 'weight_decay': 1.9138269813141963e-08, 'n_units_l0': 17, 'n_units_l1': 20, 'optimizer': 'Adam', 'adam_learning_rate': 2.9494903195951636e-05}. Best is trial 30 with value: 0.5492335557937622.
Trial 62 finished with value: 0.5107665061950684 and parameters: {'n_layers': 5, 'weight_decay': 1.6213850015631767e-09, 'n_units_l0': 16, 'n_units_l1': 29, 'n_units_l2': 23, 'n_units_l3': 35, 'n_units_l4': 4, 'optimizer': 'Adam', 'adam_learning_rate': 0.0001284305016126531}. Best is trial 30 with value: 0.5492335557937622.
Trial 63 finished with value: 0.5237788558006287 and parameters: {'n_layers': 8, 'weight_decay': 5.289382062141914e-07, 'n_units_l0': 23, 'n_units_l1': 15, 'n_units_l2': 38, 'n_units_l3': 51, 'n_units_l4': 5, 'n_units_l5': 14, 'n_units_l6': 37, 'n_units_l7': 8, 'optimizer': 'Adam', 'adam_learning_rate': 1.695824931052395e-05}. Best is trial 30 with value: 0.5492335557937622.
Trial 64 finished with value: 0.5146524310112 and parameters: {'n_layers': 3, 'weight_decay': 3.0548252212394e-09, 'n_units_l0': 10, 'n_units_l1': 12, 'n_units_l2': 30, 'optimizer': 'Adam', 'adam_learning_rate': 3.802289985230885e-05}. Best is trial 30 with value: 0.5492335557937622.
Trial 65 finished with value: 0.525597095489502 and parameters: {'n_layers': 5, 'weight_decay': 5.908666659934919e-09, 'n_units_l0': 13, 'n_units_l1': 23, 'n_units_l2': 54, 'n_units_l3': 43, 'n_units_l4': 13, 'optimizer': 'Adam', 'adam_learning_rate': 1.636296565734919e-05}. Best is trial 30 with value: 0.5492335557937622.
Trial 66 finished with value: 0.5343673229217529 and parameters: {'n_layers': 7, 'weight_decay': 1.0124614344342286e-09, 'n_units_l0': 7, 'n_units_l1': 33, 'n_units_l2': 20, 'n_units_l3': 106, 'n_units_l4': 8, 'n_units_l5': 8, 'n_units_l6': 75, 'optimizer': 'RMSprop', 'rmsprop_learning_rate': 0.00015266532382369815, 'rmsprop_weight_decay': 0.970957290601765, 'rmsprop_momentum': 0.006909384800087594}. Best is trial 30 with value: 0.5492335557937622.
Trial 67 finished with value: 0.5219607949256897 and parameters: {'n_layers': 7, 'weight_decay': 1.02201277282781e-09, 'n_units_l0': 7, 'n_units_l1': 84, 'n_units_l2': 10, 'n_units_l3': 110, 'n_units_l4': 8, 'n_units_l5': 8, 'n_units_l6': 77, 'optimizer': 'RMSprop', 'rmsprop_learning_rate': 3.4351580017940344e-05, 'rmsprop_weight_decay': 0.9728365211742933, 'rmsprop_momentum': 0.013178095747109335}. Best is trial 30 with value: 0.5492335557937622.
Trial 68 finished with value: 0.5068092346191406 and parameters: {'n_layers': 10, 'weight_decay': 2.2973728099700705e-10, 'n_units_l0': 6, 'n_units_l1': 35, 'n_units_l2': 66, 'n_units_l3': 88, 'n_units_l4': 8, 'n_units_l5': 6, 'n_units_l6': 51, 'n_units_l7': 5, 'n_units_l8': 54, 'n_units_l9': 35, 'optimizer': 'RMSprop', 'rmsprop_learning_rate': 0.00021106239904737482, 'rmsprop_weight_decay': 0.9872812962915782, 'rmsprop_momentum': 0.0016136305461851126}. Best is trial 30 with value: 0.5492335557937622.
Trial 69 finished with value: 0.5319430232048035 and parameters: {'n_layers': 8, 'weight_decay': 5.279689853018561e-10, 'n_units_l0': 8, 'n_units_l1': 66, 'n_units_l2': 7, 'n_units_l3': 126, 'n_units_l4': 6, 'n_units_l5': 10, 'n_units_l6': 110, 'n_units_l7': 17, 'optimizer': 'RMSprop', 'rmsprop_learning_rate': 2.3392690544028838e-05, 'rmsprop_weight_decay': 0.9368912789553163, 'rmsprop_momentum': 0.009910578753786179}. Best is trial 30 with value: 0.5492335557937622.
Trial 70 finished with value: 0.5170766711235046 and parameters: {'n_layers': 12, 'weight_decay': 4.1070313298057874e-10, 'n_units_l0': 6, 'n_units_l1': 67, 'n_units_l2': 6, 'n_units_l3': 108, 'n_units_l4': 6, 'n_units_l5': 10, 'n_units_l6': 110, 'n_units_l7': 15, 'n_units_l8': 31, 'n_units_l9': 6, 'n_units_l10': 74, 'n_units_l11': 4, 'optimizer': 'RMSprop', 'rmsprop_learning_rate': 2.3922828700971935e-05, 'rmsprop_weight_decay': 0.9397148227288195, 'rmsprop_momentum': 0.010619836111162103}. Best is trial 30 with value: 0.5492335557937622.
Trial 71 finished with value: 0.5089125633239746 and parameters: {'n_layers': 8, 'weight_decay': 1.3147443712987966e-09, 'n_units_l0': 8, 'n_units_l1': 45, 'n_units_l2': 8, 'n_units_l3': 127, 'n_units_l4': 11, 'n_units_l5': 8, 'n_units_l6': 74, 'n_units_l7': 10, 'optimizer': 'RMSprop', 'rmsprop_learning_rate': 0.000166325183352629, 'rmsprop_weight_decay': 0.9639935894460298, 'rmsprop_momentum': 0.04600361265596791}. Best is trial 30 with value: 0.5492335557937622.
Trial 72 finished with value: 0.5289483070373535 and parameters: {'n_layers': 6, 'weight_decay': 6.054089983033964e-10, 'n_units_l0': 9, 'n_units_l1': 111, 'n_units_l2': 7, 'n_units_l3': 71, 'n_units_l4': 6, 'n_units_l5': 5, 'optimizer': 'RMSprop', 'rmsprop_learning_rate': 2.5733443157632815e-05, 'rmsprop_weight_decay': 0.9467184114762494, 'rmsprop_momentum': 0.0027372717431881897}. Best is trial 30 with value: 0.5492335557937622.
Trial 73 finished with value: 0.5052406787872314 and parameters: {'n_layers': 10, 'weight_decay': 1.7818331163104764e-10, 'n_units_l0': 10, 'n_units_l1': 86, 'n_units_l2': 5, 'n_units_l3': 90, 'n_units_l4': 4, 'n_units_l5': 7, 'n_units_l6': 92, 'n_units_l7': 20, 'n_units_l8': 82, 'n_units_l9': 25, 'optimizer': 'RMSprop', 'rmsprop_learning_rate': 1.7616602602819276e-05, 'rmsprop_weight_decay': 0.9222621880204944, 'rmsprop_momentum': 0.016343886529520547}. Best is trial 30 with value: 0.5492335557937622.
Trial 74 finished with value: 0.5258466601371765 and parameters: {'n_layers': 9, 'weight_decay': 1.0232278613075621e-07, 'n_units_l0': 7, 'n_units_l1': 51, 'n_units_l2': 5, 'n_units_l3': 128, 'n_units_l4': 9, 'n_units_l5': 12, 'n_units_l6': 58, 'n_units_l7': 23, 'n_units_l8': 19, 'optimizer': 'RMSprop', 'rmsprop_learning_rate': 0.0002039309703866684, 'rmsprop_weight_decay': 0.9725583415903276, 'rmsprop_momentum': 0.0004075046256074386}. Best is trial 30 with value: 0.5492335557937622.
Trial 75 finished with value: 0.5110872983932495 and parameters: {'n_layers': 8, 'weight_decay': 2.076391318012739e-09, 'n_units_l0': 11, 'n_units_l1': 33, 'n_units_l2': 6, 'n_units_l3': 81, 'n_units_l4': 17, 'n_units_l5': 6, 'n_units_l6': 104, 'n_units_l7': 12, 'optimizer': 'RMSprop', 'rmsprop_learning_rate': 5.858647155914473e-05, 'rmsprop_weight_decay': 0.9701006312870912, 'rmsprop_momentum': 0.0039582816564875944}. Best is trial 30 with value: 0.5492335557937622.
Trial 76 finished with value: 0.5089483261108398 and parameters: {'n_layers': 7, 'weight_decay': 4.03426943156761e-10, 'n_units_l0': 8, 'n_units_l1': 63, 'n_units_l2': 4, 'n_units_l3': 60, 'n_units_l4': 7, 'n_units_l5': 9, 'n_units_l6': 68, 'optimizer': 'RMSprop', 'rmsprop_learning_rate': 0.0005520001328841554, 'rmsprop_weight_decay': 0.9240631946469794, 'rmsprop_momentum': 0.007071246318483103}. Best is trial 30 with value: 0.5492335557937622.
Trial 77 finished with value: 0.5207487344741821 and parameters: {'n_layers': 6, 'weight_decay': 1.1004944119402665e-08, 'n_units_l0': 57, 'n_units_l1': 8, 'n_units_l2': 20, 'n_units_l3': 96, 'n_units_l4': 6, 'n_units_l5': 4, 'optimizer': 'RMSprop', 'rmsprop_learning_rate': 0.00013014193561516953, 'rmsprop_weight_decay': 0.949488625074669, 'rmsprop_momentum': 0.028483951704833636}. Best is trial 30 with value: 0.5492335557937622.
Trial 78 finished with value: 0.5268092751502991 and parameters: {'n_layers': 15, 'weight_decay': 4.374297754387344e-09, 'n_units_l0': 20, 'n_units_l1': 18, 'n_units_l2': 34, 'n_units_l3': 115, 'n_units_l4': 92, 'n_units_l5': 17, 'n_units_l6': 79, 'n_units_l7': 5, 'n_units_l8': 6, 'n_units_l9': 77, 'n_units_l10': 10, 'n_units_l11': 51, 'n_units_l12': 12, 'n_units_l13': 4, 'n_units_l14': 23, 'optimizer': 'SGD', 'sgd_opt_learning_rate': 0.005020915613650745, 'sgd_opt_momentum': 0.07024933319161605}. Best is trial 30 with value: 0.5492335557937622.
Trial 79 finished with value: 0.5210695266723633 and parameters: {'n_layers': 9, 'weight_decay': 3.277689293175339e-07, 'n_units_l0': 4, 'n_units_l1': 124, 'n_units_l2': 48, 'n_units_l3': 73, 'n_units_l4': 23, 'n_units_l5': 7, 'n_units_l6': 118, 'n_units_l7': 53, 'n_units_l8': 9, 'optimizer': 'RMSprop', 'rmsprop_learning_rate': 3.899679225306854e-05, 'rmsprop_weight_decay': 0.9094905939056676, 'rmsprop_momentum': 0.0005699662615717828}. Best is trial 30 with value: 0.5492335557937622.
Trial 80 finished with value: 0.4941176772117615 and parameters: {'n_layers': 4, 'weight_decay': 0.00046183339405507875, 'n_units_l0': 12, 'n_units_l1': 39, 'n_units_l2': 87, 'n_units_l3': 57, 'optimizer': 'RMSprop', 'rmsprop_learning_rate': 1.748061591907987e-05, 'rmsprop_weight_decay': 0.9772258826189665, 'rmsprop_momentum': 0.001449570846210687}. Best is trial 30 with value: 0.5492335557937622.
Trial 81 finished with value: 0.5162210464477539 and parameters: {'n_layers': 1, 'weight_decay': 4.3983242989625374e-08, 'n_units_l0': 14, 'optimizer': 'Adam', 'adam_learning_rate': 7.182991611692096e-05}. Best is trial 30 with value: 0.5492335557937622.
Trial 82 finished with value: 0.5210695266723633 and parameters: {'n_layers': 2, 'weight_decay': 1.7109347904149132e-06, 'n_units_l0': 15, 'n_units_l1': 25, 'optimizer': 'Adam', 'adam_learning_rate': 8.47483695016878e-05}. Best is trial 30 with value: 0.5492335557937622.
Trial 83 finished with value: 0.5240997672080994 and parameters: {'n_layers': 5, 'weight_decay': 9.168482861239368e-10, 'n_units_l0': 9, 'n_units_l1': 26, 'n_units_l2': 17, 'n_units_l3': 47, 'n_units_l4': 5, 'optimizer': 'Adam', 'adam_learning_rate': 1.0972051821648004e-05}. Best is trial 30 with value: 0.5492335557937622.
Trial 84 finished with value: 0.521354615688324 and parameters: {'n_layers': 4, 'weight_decay': 3.173754093382e-09, 'n_units_l0': 16, 'n_units_l1': 17, 'n_units_l2': 22, 'n_units_l3': 27, 'optimizer': 'Adam', 'adam_learning_rate': 5.5603743752778064e-05}. Best is trial 30 with value: 0.5492335557937622.
Trial 85 finished with value: 0.49739745259284973 and parameters: {'n_layers': 6, 'weight_decay': 2.2892539832371982e-08, 'n_units_l0': 33, 'n_units_l1': 21, 'n_units_l2': 26, 'n_units_l3': 100, 'n_units_l4': 7, 'n_units_l5': 23, 'optimizer': 'Adam', 'adam_learning_rate': 0.00021939355992003324}. Best is trial 30 with value: 0.5492335557937622.
Trial 86 finished with value: 0.5153297781944275 and parameters: {'n_layers': 7, 'weight_decay': 6.290248498209308e-08, 'n_units_l0': 10, 'n_units_l1': 28, 'n_units_l2': 14, 'n_units_l3': 68, 'n_units_l4': 36, 'n_units_l5': 5, 'n_units_l6': 53, 'optimizer': 'Adam', 'adam_learning_rate': 2.6399399980970012e-05}. Best is trial 30 with value: 0.5492335557937622.
Trial 87 finished with value: 0.5201069712638855 and parameters: {'n_layers': 2, 'weight_decay': 4.040230752817241e-06, 'n_units_l0': 23, 'n_units_l1': 10, 'optimizer': 'Adam', 'adam_learning_rate': 0.0007222082510884262}. Best is trial 30 with value: 0.5492335557937622.
Trial 88 finished with value: 0.520784318447113 and parameters: {'n_layers': 3, 'weight_decay': 1.1808650464489819e-08, 'n_units_l0': 26, 'n_units_l1': 5, 'n_units_l2': 10, 'optimizer': 'RMSprop', 'rmsprop_learning_rate': 0.0014002761492386314, 'rmsprop_weight_decay': 0.9881443130908568, 'rmsprop_momentum': 0.08767355597330409}. Best is trial 30 with value: 0.5492335557937622.
Trial 89 finished with value: 0.5192155838012695 and parameters: {'n_layers': 8, 'weight_decay': 1.2313951203024488e-07, 'n_units_l0': 14, 'n_units_l1': 48, 'n_units_l2': 41, 'n_units_l3': 86, 'n_units_l4': 11, 'n_units_l5': 10, 'n_units_l6': 41, 'n_units_l7': 27, 'optimizer': 'Adam', 'adam_learning_rate': 4.009449460201995e-05}. Best is trial 30 with value: 0.5492335557937622.
Trial 90 finished with value: 0.5113725066184998 and parameters: {'n_layers': 1, 'weight_decay': 7.016330175519996e-09, 'n_units_l0': 105, 'optimizer': 'SGD', 'sgd_opt_learning_rate': 0.0002324199759142997, 'sgd_opt_momentum': 0.00021619083485028564}. Best is trial 30 with value: 0.5492335557937622.
Trial 91 finished with value: 0.4880213737487793 and parameters: {'n_layers': 11, 'weight_decay': 2.767059669897899e-10, 'n_units_l0': 28, 'n_units_l1': 128, 'n_units_l2': 8, 'n_units_l3': 5, 'n_units_l4': 126, 'n_units_l5': 104, 'n_units_l6': 9, 'n_units_l7': 71, 'n_units_l8': 96, 'n_units_l9': 6, 'n_units_l10': 36, 'optimizer': 'Adam', 'adam_learning_rate': 1.3560757867802205e-05}. Best is trial 30 with value: 0.5492335557937622.
Trial 92 finished with value: 0.5222459435462952 and parameters: {'n_layers': 9, 'weight_decay': 1.5844843940167905e-10, 'n_units_l0': 17, 'n_units_l1': 111, 'n_units_l2': 11, 'n_units_l3': 11, 'n_units_l4': 108, 'n_units_l5': 49, 'n_units_l6': 7, 'n_units_l7': 101, 'n_units_l8': 105, 'optimizer': 'Adam', 'adam_learning_rate': 0.0003783810129669281}. Best is trial 30 with value: 0.5492335557937622.
Trial 93 finished with value: 0.5110160112380981 and parameters: {'n_layers': 8, 'weight_decay': 1.1856010261572013e-10, 'n_units_l0': 41, 'n_units_l1': 78, 'n_units_l2': 21, 'n_units_l3': 19, 'n_units_l4': 101, 'n_units_l5': 20, 'n_units_l6': 28, 'n_units_l7': 81, 'optimizer': 'Adam', 'adam_learning_rate': 2.1110728739476013e-05}. Best is trial 30 with value: 0.5492335557937622.
Trial 94 finished with value: 0.5228520035743713 and parameters: {'n_layers': 9, 'weight_decay': 5.444177378513785e-10, 'n_units_l0': 19, 'n_units_l1': 93, 'n_units_l2': 15, 'n_units_l3': 8, 'n_units_l4': 52, 'n_units_l5': 28, 'n_units_l6': 5, 'n_units_l7': 111, 'n_units_l8': 67, 'optimizer': 'Adam', 'adam_learning_rate': 0.00010163921031556463}. Best is trial 30 with value: 0.5492335557937622.
Trial 95 finished with value: 0.5161140561103821 and parameters: {'n_layers': 7, 'weight_decay': 8.50368239373054e-10, 'n_units_l0': 11, 'n_units_l1': 102, 'n_units_l2': 7, 'n_units_l3': 16, 'n_units_l4': 80, 'n_units_l5': 87, 'n_units_l6': 10, 'optimizer': 'Adam', 'adam_learning_rate': 0.0018039273263768753}. Best is trial 30 with value: 0.5492335557937622.
Trial 96 finished with value: 0.4998929500579834 and parameters: {'n_layers': 10, 'weight_decay': 1.3975043942891098e-09, 'n_units_l0': 5, 'n_units_l1': 42, 'n_units_l2': 36, 'n_units_l3': 111, 'n_units_l4': 68, 'n_units_l5': 33, 'n_units_l6': 8, 'n_units_l7': 61, 'n_units_l8': 42, 'n_units_l9': 5, 'optimizer': 'Adam', 'adam_learning_rate': 2.8516308026577036e-05}. Best is trial 30 with value: 0.5492335557937622.
Trial 97 finished with value: 0.5216042995452881 and parameters: {'n_layers': 12, 'weight_decay': 5.909909829059911e-07, 'n_units_l0': 12, 'n_units_l1': 70, 'n_units_l2': 9, 'n_units_l3': 9, 'n_units_l4': 32, 'n_units_l5': 8, 'n_units_l6': 12, 'n_units_l7': 48, 'n_units_l8': 107, 'n_units_l9': 12, 'n_units_l10': 125, 'n_units_l11': 80, 'optimizer': 'Adam', 'adam_learning_rate': 1.0151478182589159e-05}. Best is trial 30 with value: 0.5492335557937622.
Trial 98 finished with value: 0.5037789344787598 and parameters: {'n_layers': 13, 'weight_decay': 1.0063063289887384e-10, 'n_units_l0': 74, 'n_units_l1': 56, 'n_units_l2': 6, 'n_units_l3': 35, 'n_units_l4': 75, 'n_units_l5': 69, 'n_units_l6': 19, 'n_units_l7': 75, 'n_units_l8': 35, 'n_units_l9': 8, 'n_units_l10': 19, 'n_units_l11': 26, 'n_units_l12': 4, 'optimizer': 'RMSprop', 'rmsprop_learning_rate': 7.740533430422366e-05, 'rmsprop_weight_decay': 0.8863264443524559, 'rmsprop_momentum': 2.8393958210840034e-05}. Best is trial 30 with value: 0.5492335557937622.
Trial 99 finished with value: 0.5270945429801941 and parameters: {'n_layers': 6, 'weight_decay': 2.406471969360972e-07, 'n_units_l0': 7, 'n_units_l1': 6, 'n_units_l2': 71, 'n_units_l3': 7, 'n_units_l4': 9, 'n_units_l5': 6, 'optimizer': 'Adam', 'adam_learning_rate': 4.694751987935396e-05}. Best is trial 30 with value: 0.5492335557937622.
Trial 100 finished with value: 0.5026025176048279 and parameters: {'n_layers': 5, 'weight_decay': 1.5078298028223586e-05, 'n_units_l0': 6, 'n_units_l1': 23, 'n_units_l2': 53, 'n_units_l3': 13, 'n_units_l4': 105, 'optimizer': 'Adam', 'adam_learning_rate': 0.00034535602418275915}. Best is trial 30 with value: 0.5492335557937622.
Trial 101 finished with value: 0.4928697645664215 and parameters: {'n_layers': 3, 'weight_decay': 3.5639933341142263e-08, 'n_units_l0': 23, 'n_units_l1': 33, 'n_units_l2': 87, 'optimizer': 'Adam', 'adam_learning_rate': 1.9568164462493015e-05}. Best is trial 30 with value: 0.5492335557937622.
Trial 102 finished with value: 0.5280213356018066 and parameters: {'n_layers': 4, 'weight_decay': 1.7110881691656236e-08, 'n_units_l0': 16, 'n_units_l1': 32, 'n_units_l2': 61, 'n_units_l3': 105, 'optimizer': 'Adam', 'adam_learning_rate': 1.4706828182550875e-05}. Best is trial 30 with value: 0.5492335557937622.
Trial 103 finished with value: 0.5064883828163147 and parameters: {'n_layers': 2, 'weight_decay': 7.58461013561739e-08, 'n_units_l0': 15, 'n_units_l1': 38, 'optimizer': 'Adam', 'adam_learning_rate': 2.3087048527355834e-05}. Best is trial 30 with value: 0.5492335557937622.
Trial 104 finished with value: 0.5104098916053772 and parameters: {'n_layers': 4, 'weight_decay': 1.0828495128903745e-08, 'n_units_l0': 20, 'n_units_l1': 43, 'n_units_l2': 28, 'n_units_l3': 119, 'optimizer': 'Adam', 'adam_learning_rate': 3.8453407544168795e-05}. Best is trial 30 with value: 0.5492335557937622.
Trial 105 finished with value: 0.5240998864173889 and parameters: {'n_layers': 8, 'weight_decay': 3.178962529971156e-09, 'n_units_l0': 14, 'n_units_l1': 35, 'n_units_l2': 78, 'n_units_l3': 100, 'n_units_l4': 15, 'n_units_l5': 4, 'n_units_l6': 89, 'n_units_l7': 38, 'optimizer': 'Adam', 'adam_learning_rate': 1.3548516787611963e-05}. Best is trial 30 with value: 0.5492335557937622.
Trial 106 finished with value: 0.533155083656311 and parameters: {'n_layers': 7, 'weight_decay': 1.3998595861188792e-08, 'n_units_l0': 18, 'n_units_l1': 30, 'n_units_l2': 25, 'n_units_l3': 41, 'n_units_l4': 10, 'n_units_l5': 5, 'n_units_l6': 106, 'optimizer': 'RMSprop', 'rmsprop_learning_rate': 0.00042975971125257836, 'rmsprop_weight_decay': 0.9649065792373174, 'rmsprop_momentum': 0.02234181365475172}. Best is trial 30 with value: 0.5492335557937622.
Trial 107 finished with value: 0.5243494510650635 and parameters: {'n_layers': 7, 'weight_decay': 2.0113774257994235e-09, 'n_units_l0': 18, 'n_units_l1': 28, 'n_units_l2': 24, 'n_units_l3': 41, 'n_units_l4': 12, 'n_units_l5': 5, 'n_units_l6': 107, 'optimizer': 'RMSprop', 'rmsprop_learning_rate': 0.00036071658480019565, 'rmsprop_weight_decay': 0.9625479569600702, 'rmsprop_momentum': 0.018050129881531648}. Best is trial 30 with value: 0.5492335557937622.
