A new study created in memory with name: no-name-bfe8413b-046b-4a69-befb-00e3b0b87ad8
Trial 0 finished with value: 0.5174331665039062 and parameters: {'n_layers': 5, 'weight_decay': 1.9182517751785916e-05, 'n_units_l0': 82, 'n_units_l1': 4, 'n_units_l2': 6, 'n_units_l3': 115, 'n_units_l4': 6, 'optimizer': 'Adam', 'adam_learning_rate': 0.06787788072036928}. Best is trial 0 with value: 0.5174331665039062.
Trial 1 finished with value: 0.5182887315750122 and parameters: {'n_layers': 4, 'weight_decay': 9.603120477888277e-10, 'n_units_l0': 62, 'n_units_l1': 61, 'n_units_l2': 22, 'n_units_l3': 86, 'optimizer': 'RMSprop', 'rmsprop_learning_rate': 0.0005113684792320828, 'rmsprop_weight_decay': 0.9612489731814101, 'rmsprop_momentum': 0.0010880833957468965}. Best is trial 1 with value: 0.5182887315750122.
Trial 2 finished with value: 0.5098395347595215 and parameters: {'n_layers': 10, 'weight_decay': 2.6746472160769912e-08, 'n_units_l0': 8, 'n_units_l1': 63, 'n_units_l2': 54, 'n_units_l3': 35, 'n_units_l4': 11, 'n_units_l5': 10, 'n_units_l6': 49, 'n_units_l7': 9, 'n_units_l8': 12, 'n_units_l9': 54, 'optimizer': 'RMSprop', 'rmsprop_learning_rate': 0.07781311795812323, 'rmsprop_weight_decay': 0.8847044584318502, 'rmsprop_momentum': 0.005960520169734304}. Best is trial 1 with value: 0.5182887315750122.
Trial 3 finished with value: 0.5098752975463867 and parameters: {'n_layers': 17, 'weight_decay': 0.00012605043994436024, 'n_units_l0': 10, 'n_units_l1': 44, 'n_units_l2': 6, 'n_units_l3': 18, 'n_units_l4': 21, 'n_units_l5': 8, 'n_units_l6': 5, 'n_units_l7': 19, 'n_units_l8': 8, 'n_units_l9': 22, 'n_units_l10': 7, 'n_units_l11': 4, 'n_units_l12': 14, 'n_units_l13': 9, 'n_units_l14': 44, 'n_units_l15': 5, 'n_units_l16': 36, 'optimizer': 'SGD', 'sgd_opt_learning_rate': 2.9364536942083225e-05, 'sgd_opt_momentum': 0.001037466001383049}. Best is trial 1 with value: 0.5182887315750122.
Trial 4 finished with value: 0.5204991698265076 and parameters: {'n_layers': 15, 'weight_decay': 3.737648177491172e-05, 'n_units_l0': 9, 'n_units_l1': 16, 'n_units_l2': 63, 'n_units_l3': 9, 'n_units_l4': 4, 'n_units_l5': 13, 'n_units_l6': 95, 'n_units_l7': 4, 'n_units_l8': 125, 'n_units_l9': 17, 'n_units_l10': 89, 'n_units_l11': 10, 'n_units_l12': 4, 'n_units_l13': 7, 'n_units_l14': 12, 'optimizer': 'SGD', 'sgd_opt_learning_rate': 9.129371976811648e-05, 'sgd_opt_momentum': 0.0031609551703923326}. Best is trial 4 with value: 0.5204991698265076.
Trial 5 finished with value: 0.5268092155456543 and parameters: {'n_layers': 17, 'weight_decay': 2.6152742270783865e-06, 'n_units_l0': 37, 'n_units_l1': 44, 'n_units_l2': 20, 'n_units_l3': 74, 'n_units_l4': 12, 'n_units_l5': 40, 'n_units_l6': 31, 'n_units_l7': 65, 'n_units_l8': 39, 'n_units_l9': 60, 'n_units_l10': 26, 'n_units_l11': 55, 'n_units_l12': 7, 'n_units_l13': 16, 'n_units_l14': 48, 'n_units_l15': 9, 'n_units_l16': 84, 'optimizer': 'SGD', 'sgd_opt_learning_rate': 0.0005606729958757469, 'sgd_opt_momentum': 0.0010100528575321753}. Best is trial 5 with value: 0.5268092155456543.
Trial 6 finished with value: 0.5283066034317017 and parameters: {'n_layers': 7, 'weight_decay': 1.2702279333973048e-05, 'n_units_l0': 73, 'n_units_l1': 78, 'n_units_l2': 11, 'n_units_l3': 28, 'n_units_l4': 4, 'n_units_l5': 7, 'n_units_l6': 63, 'optimizer': 'SGD', 'sgd_opt_learning_rate': 0.0009537831448540816, 'sgd_opt_momentum': 0.002991299540778485}. Best is trial 6 with value: 0.5283066034317017.
Trial 7 finished with value: 0.5259178876876831 and parameters: {'n_layers': 18, 'weight_decay': 1.0368246873255773e-06, 'n_units_l0': 62, 'n_units_l1': 31, 'n_units_l2': 35, 'n_units_l3': 8, 'n_units_l4': 30, 'n_units_l5': 8, 'n_units_l6': 28, 'n_units_l7': 25, 'n_units_l8': 7, 'n_units_l9': 56, 'n_units_l10': 55, 'n_units_l11': 39, 'n_units_l12': 20, 'n_units_l13': 11, 'n_units_l14': 6, 'n_units_l15': 59, 'n_units_l16': 17, 'n_units_l17': 36, 'optimizer': 'SGD', 'sgd_opt_learning_rate': 0.00013348517924320193, 'sgd_opt_momentum': 0.06072104213262581}. Best is trial 6 with value: 0.5283066034317017.
Trial 8 finished with value: 0.521675705909729 and parameters: {'n_layers': 4, 'weight_decay': 1.3801617995899416e-07, 'n_units_l0': 4, 'n_units_l1': 16, 'n_units_l2': 126, 'n_units_l3': 10, 'optimizer': 'SGD', 'sgd_opt_learning_rate': 1.7675222943238434e-05, 'sgd_opt_momentum': 0.015082233595703253}. Best is trial 6 with value: 0.5283066034317017.
Trial 9 finished with value: 0.5278074741363525 and parameters: {'n_layers': 16, 'weight_decay': 7.999275334485292e-05, 'n_units_l0': 61, 'n_units_l1': 123, 'n_units_l2': 14, 'n_units_l3': 12, 'n_units_l4': 12, 'n_units_l5': 17, 'n_units_l6': 66, 'n_units_l7': 12, 'n_units_l8': 43, 'n_units_l9': 111, 'n_units_l10': 6, 'n_units_l11': 6, 'n_units_l12': 8, 'n_units_l13': 43, 'n_units_l14': 14, 'n_units_l15': 112, 'optimizer': 'RMSprop', 'rmsprop_learning_rate': 0.03750428988743722, 'rmsprop_weight_decay': 0.931135568673991, 'rmsprop_momentum': 4.57642547654185e-05}. Best is trial 6 with value: 0.5283066034317017.
Trial 10 finished with value: 0.5304456353187561 and parameters: {'n_layers': 10, 'weight_decay': 1.0662119625503203e-10, 'n_units_l0': 24, 'n_units_l1': 122, 'n_units_l2': 10, 'n_units_l3': 4, 'n_units_l4': 128, 'n_units_l5': 121, 'n_units_l6': 9, 'n_units_l7': 125, 'n_units_l8': 114, 'n_units_l9': 4, 'optimizer': 'Adam', 'adam_learning_rate': 1.5180795447189298e-05}. Best is trial 10 with value: 0.5304456353187561.
Trial 11 finished with value: 0.5141177773475647 and parameters: {'n_layers': 24, 'weight_decay': 5.933633035790466e-10, 'n_units_l0': 23, 'n_units_l1': 117, 'n_units_l2': 9, 'n_units_l3': 4, 'n_units_l4': 122, 'n_units_l5': 122, 'n_units_l6': 10, 'n_units_l7': 128, 'n_units_l8': 127, 'n_units_l9': 4, 'n_units_l10': 15, 'n_units_l11': 104, 'n_units_l12': 116, 'n_units_l13': 100, 'n_units_l14': 5, 'n_units_l15': 26, 'n_units_l16': 4, 'n_units_l17': 4, 'n_units_l18': 70, 'n_units_l19': 93, 'n_units_l20': 26, 'n_units_l21': 11, 'n_units_l22': 36, 'n_units_l23': 89, 'optimizer': 'Adam', 'adam_learning_rate': 1.4866361462269463e-05}. Best is trial 10 with value: 0.5304456353187561.
Trial 12 finished with value: 0.5343316197395325 and parameters: {'n_layers': 9, 'weight_decay': 7.007924514839669e-09, 'n_units_l0': 27, 'n_units_l1': 124, 'n_units_l2': 4, 'n_units_l3': 38, 'n_units_l4': 111, 'n_units_l5': 4, 'n_units_l6': 12, 'n_units_l7': 55, 'n_units_l8': 45, 'optimizer': 'Adam', 'adam_learning_rate': 1.0922842998867396e-05}. Best is trial 12 with value: 0.5343316197395325.
Trial 13 finished with value: 0.508021354675293 and parameters: {'n_layers': 10, 'weight_decay': 1.412743195728715e-10, 'n_units_l0': 21, 'n_units_l1': 7, 'n_units_l2': 4, 'n_units_l3': 48, 'n_units_l4': 118, 'n_units_l5': 41, 'n_units_l6': 11, 'n_units_l7': 70, 'n_units_l8': 49, 'n_units_l9': 4, 'optimizer': 'Adam', 'adam_learning_rate': 1.021304642502245e-05}. Best is trial 12 with value: 0.5343316197395325.
Trial 14 finished with value: 0.5141175985336304 and parameters: {'n_layers': 1, 'weight_decay': 5.1687226925800575e-09, 'n_units_l0': 25, 'optimizer': 'Adam', 'adam_learning_rate': 0.00010547972103242716}. Best is trial 12 with value: 0.5343316197395325.
Trial 15 finished with value: 0.5131194591522217 and parameters: {'n_layers': 11, 'weight_decay': 4.0977507954239795e-09, 'n_units_l0': 14, 'n_units_l1': 119, 'n_units_l2': 4, 'n_units_l3': 4, 'n_units_l4': 59, 'n_units_l5': 4, 'n_units_l6': 12, 'n_units_l7': 55, 'n_units_l8': 70, 'n_units_l9': 9, 'n_units_l10': 4, 'optimizer': 'Adam', 'adam_learning_rate': 0.0005250004112133058}. Best is trial 12 with value: 0.5343316197395325.
Trial 16 finished with value: 0.5125846862792969 and parameters: {'n_layers': 21, 'weight_decay': 1.5510306645240626e-10, 'n_units_l0': 37, 'n_units_l1': 27, 'n_units_l2': 7, 'n_units_l3': 46, 'n_units_l4': 61, 'n_units_l5': 113, 'n_units_l6': 4, 'n_units_l7': 120, 'n_units_l8': 23, 'n_units_l9': 9, 'n_units_l10': 123, 'n_units_l11': 14, 'n_units_l12': 74, 'n_units_l13': 119, 'n_units_l14': 119, 'n_units_l15': 18, 'n_units_l16': 4, 'n_units_l17': 109, 'n_units_l18': 4, 'n_units_l19': 4, 'n_units_l20': 4, 'optimizer': 'Adam', 'adam_learning_rate': 6.809066073598724e-05}. Best is trial 12 with value: 0.5343316197395325.
Trial 17 finished with value: 0.5155436992645264 and parameters: {'n_layers': 13, 'weight_decay': 7.943710671412866e-08, 'n_units_l0': 36, 'n_units_l1': 80, 'n_units_l2': 4, 'n_units_l3': 21, 'n_units_l4': 68, 'n_units_l5': 31, 'n_units_l6': 17, 'n_units_l7': 44, 'n_units_l8': 84, 'n_units_l9': 8, 'n_units_l10': 26, 'n_units_l11': 28, 'n_units_l12': 50, 'optimizer': 'Adam', 'adam_learning_rate': 0.01159946173875122}. Best is trial 12 with value: 0.5343316197395325.
Trial 18 finished with value: 0.5291978120803833 and parameters: {'n_layers': 8, 'weight_decay': 0.0006077529090666311, 'n_units_l0': 15, 'n_units_l1': 10, 'n_units_l2': 15, 'n_units_l3': 14, 'n_units_l4': 35, 'n_units_l5': 76, 'n_units_l6': 6, 'n_units_l7': 34, 'optimizer': 'Adam', 'adam_learning_rate': 7.796541408216109e-05}. Best is trial 12 with value: 0.5343316197395325.
Trial 19 finished with value: 0.5134759545326233 and parameters: {'n_layers': 12, 'weight_decay': 9.763471634045292e-09, 'n_units_l0': 6, 'n_units_l1': 42, 'n_units_l2': 8, 'n_units_l3': 6, 'n_units_l4': 83, 'n_units_l5': 4, 'n_units_l6': 9, 'n_units_l7': 88, 'n_units_l8': 24, 'n_units_l9': 21, 'n_units_l10': 13, 'n_units_l11': 112, 'optimizer': 'Adam', 'adam_learning_rate': 0.0012289753341056169}. Best is trial 12 with value: 0.5343316197395325.
Trial 20 finished with value: 0.5359001755714417 and parameters: {'n_layers': 1, 'weight_decay': 1.1278991518524744e-09, 'n_units_l0': 120, 'optimizer': 'Adam', 'adam_learning_rate': 2.5114158473175883e-05}. Best is trial 20 with value: 0.5359001755714417.
Trial 21 finished with value: 0.5135116577148438 and parameters: {'n_layers': 1, 'weight_decay': 9.947556528131009e-10, 'n_units_l0': 42, 'optimizer': 'Adam', 'adam_learning_rate': 1.1785964887221776e-05}. Best is trial 20 with value: 0.5359001755714417.
Trial 22 finished with value: 0.5162209868431091 and parameters: {'n_layers': 8, 'weight_decay': 1.1379732684418179e-10, 'n_units_l0': 101, 'n_units_l1': 91, 'n_units_l2': 5, 'n_units_l3': 28, 'n_units_l4': 38, 'n_units_l5': 58, 'n_units_l6': 20, 'n_units_l7': 94, 'optimizer': 'Adam', 'adam_learning_rate': 5.005163518488031e-05}. Best is trial 20 with value: 0.5359001755714417.
Trial 23 finished with value: 0.515008807182312 and parameters: {'n_layers': 6, 'weight_decay': 1.526572586542156e-09, 'n_units_l0': 123, 'n_units_l1': 63, 'n_units_l2': 13, 'n_units_l3': 6, 'n_units_l4': 89, 'n_units_l5': 24, 'optimizer': 'Adam', 'adam_learning_rate': 0.0003931038821321197}. Best is trial 20 with value: 0.5359001755714417.
Trial 24 finished with value: 0.5309804081916809 and parameters: {'n_layers': 3, 'weight_decay': 1.5181225166840282e-08, 'n_units_l0': 16, 'n_units_l1': 23, 'n_units_l2': 25, 'optimizer': 'Adam', 'adam_learning_rate': 2.91958242552117e-05}. Best is trial 20 with value: 0.5359001755714417.
Trial 25 finished with value: 0.5186096429824829 and parameters: {'n_layers': 3, 'weight_decay': 3.3057838986847156e-08, 'n_units_l0': 15, 'n_units_l1': 9, 'n_units_l2': 31, 'optimizer': 'RMSprop', 'rmsprop_learning_rate': 1.0060150479675692e-05, 'rmsprop_weight_decay': 0.8581536709686917, 'rmsprop_momentum': 0.08029129643428348}. Best is trial 20 with value: 0.5359001755714417.
Trial 26 finished with value: 0.5053118467330933 and parameters: {'n_layers': 2, 'weight_decay': 1.6891374555725392e-08, 'n_units_l0': 6, 'n_units_l1': 20, 'optimizer': 'Adam', 'adam_learning_rate': 4.247953139723499e-05}. Best is trial 20 with value: 0.5359001755714417.
Trial 27 finished with value: 0.5319429636001587 and parameters: {'n_layers': 6, 'weight_decay': 2.3453942644944626e-07, 'n_units_l0': 11, 'n_units_l1': 5, 'n_units_l2': 46, 'n_units_l3': 70, 'n_units_l4': 20, 'n_units_l5': 5, 'optimizer': 'Adam', 'adam_learning_rate': 0.0003018970576772146}. Best is trial 20 with value: 0.5359001755714417.
Trial 28 finished with value: 0.523493766784668 and parameters: {'n_layers': 6, 'weight_decay': 3.775503730728373e-07, 'n_units_l0': 11, 'n_units_l1': 4, 'n_units_l2': 93, 'n_units_l3': 67, 'n_units_l4': 20, 'n_units_l5': 5, 'optimizer': 'Adam', 'adam_learning_rate': 0.00026114071409800565}. Best is trial 20 with value: 0.5359001755714417.
Trial 29 finished with value: 0.523493766784668 and parameters: {'n_layers': 5, 'weight_decay': 5.125441100568429e-07, 'n_units_l0': 4, 'n_units_l1': 5, 'n_units_l2': 44, 'n_units_l3': 52, 'n_units_l4': 17, 'optimizer': 'Adam', 'adam_learning_rate': 0.0019451204283804629}. Best is trial 20 with value: 0.5359001755714417.
Trial 30 finished with value: 0.5492335557937622 and parameters: {'n_layers': 8, 'weight_decay': 4.053040037668421e-06, 'n_units_l0': 7, 'n_units_l1': 12, 'n_units_l2': 71, 'n_units_l3': 122, 'n_units_l4': 7, 'n_units_l5': 6, 'n_units_l6': 126, 'n_units_l7': 5, 'optimizer': 'RMSprop', 'rmsprop_learning_rate': 1.07600032481164e-05, 'rmsprop_weight_decay': 0.9826945740093362, 'rmsprop_momentum': 1.0331352319816896e-05}. Best is trial 30 with value: 0.5492335557937622.
Trial 31 finished with value: 0.5289483666419983 and parameters: {'n_layers': 9, 'weight_decay': 7.898876471075928e-08, 'n_units_l0': 7, 'n_units_l1': 6, 'n_units_l2': 76, 'n_units_l3': 117, 'n_units_l4': 7, 'n_units_l5': 6, 'n_units_l6': 34, 'n_units_l7': 7, 'n_units_l8': 15, 'optimizer': 'RMSprop', 'rmsprop_learning_rate': 1.0927154100138058e-05, 'rmsprop_weight_decay': 0.980788062816593, 'rmsprop_momentum': 1.0224059219599192e-05}. Best is trial 30 with value: 0.5492335557937622.
Trial 32 finished with value: 0.5247058868408203 and parameters: {'n_layers': 5, 'weight_decay': 5.3343167999970005e-06, 'n_units_l0': 5, 'n_units_l1': 11, 'n_units_l2': 44, 'n_units_l3': 91, 'n_units_l4': 7, 'optimizer': 'RMSprop', 'rmsprop_learning_rate': 0.0004905464455087397, 'rmsprop_weight_decay': 0.937225396765357, 'rmsprop_momentum': 0.0001360470803040355}. Best is trial 30 with value: 0.5492335557937622.
Trial 33 finished with value: 0.5180392265319824 and parameters: {'n_layers': 7, 'weight_decay': 6.037129751483869e-06, 'n_units_l0': 11, 'n_units_l1': 13, 'n_units_l2': 106, 'n_units_l3': 59, 'n_units_l4': 45, 'n_units_l5': 5, 'n_units_l6': 98, 'optimizer': 'RMSprop', 'rmsprop_learning_rate': 9.8565362036932e-05, 'rmsprop_weight_decay': 0.985945005790615, 'rmsprop_momentum': 0.0003568083519097582}. Best is trial 30 with value: 0.5492335557937622.
Trial 34 finished with value: 0.5140819549560547 and parameters: {'n_layers': 12, 'weight_decay': 2.6318594892139895e-09, 'n_units_l0': 50, 'n_units_l1': 4, 'n_units_l2': 61, 'n_units_l3': 127, 'n_units_l4': 28, 'n_units_l5': 11, 'n_units_l6': 122, 'n_units_l7': 4, 'n_units_l8': 32, 'n_units_l9': 120, 'n_units_l10': 48, 'n_units_l11': 14, 'optimizer': 'RMSprop', 'rmsprop_learning_rate': 0.0073385790395280375, 'rmsprop_weight_decay': 0.8999195392797926, 'rmsprop_momentum': 1.4157021932450138e-05}. Best is trial 30 with value: 0.5492335557937622.
Trial 35 finished with value: 0.5235294699668884 and parameters: {'n_layers': 4, 'weight_decay': 3.6307327014478805e-10, 'n_units_l0': 8, 'n_units_l1': 8, 'n_units_l2': 79, 'n_units_l3': 95, 'optimizer': 'RMSprop', 'rmsprop_learning_rate': 6.522512338120097e-05, 'rmsprop_weight_decay': 0.9539844735179525, 'rmsprop_momentum': 0.003148027294096206}. Best is trial 30 with value: 0.5492335557937622.
Trial 36 finished with value: 0.5201782584190369 and parameters: {'n_layers': 14, 'weight_decay': 2.3971793489726e-06, 'n_units_l0': 30, 'n_units_l1': 5, 'n_units_l2': 46, 'n_units_l3': 39, 'n_units_l4': 15, 'n_units_l5': 4, 'n_units_l6': 15, 'n_units_l7': 17, 'n_units_l8': 5, 'n_units_l9': 32, 'n_units_l10': 9, 'n_units_l11': 57, 'n_units_l12': 35, 'n_units_l13': 4, 'optimizer': 'RMSprop', 'rmsprop_learning_rate': 0.0035344815438371553, 'rmsprop_weight_decay': 0.9091600006534533, 'rmsprop_momentum': 0.029853060526999722}. Best is trial 30 with value: 0.5492335557937622.
Trial 37 finished with value: 0.5238146185874939 and parameters: {'n_layers': 8, 'weight_decay': 8.602950948316187e-07, 'n_units_l0': 18, 'n_units_l1': 14, 'n_units_l2': 19, 'n_units_l3': 78, 'n_units_l4': 10, 'n_units_l5': 6, 'n_units_l6': 7, 'n_units_l7': 6, 'optimizer': 'Adam', 'adam_learning_rate': 0.00017703068598093452}. Best is trial 30 with value: 0.5492335557937622.
Trial 38 finished with value: 0.5085918307304382 and parameters: {'n_layers': 6, 'weight_decay': 1.6757549418193363e-07, 'n_units_l0': 12, 'n_units_l1': 6, 'n_units_l2': 34, 'n_units_l3': 30, 'n_units_l4': 5, 'n_units_l5': 17, 'optimizer': 'SGD', 'sgd_opt_learning_rate': 0.03310785699381895, 'sgd_opt_momentum': 1.2856783044112755e-05}. Best is trial 30 with value: 0.5492335557937622.
Trial 39 finished with value: 0.5226026177406311 and parameters: {'n_layers': 9, 'weight_decay': 2.9892364781924967e-05, 'n_units_l0': 9, 'n_units_l1': 37, 'n_units_l2': 26, 'n_units_l3': 100, 'n_units_l4': 8, 'n_units_l5': 5, 'n_units_l6': 44, 'n_units_l7': 30, 'n_units_l8': 61, 'optimizer': 'RMSprop', 'rmsprop_learning_rate': 5.6723585004881755e-05, 'rmsprop_weight_decay': 0.9560478565958233, 'rmsprop_momentum': 0.00016259229975065928}. Best is trial 30 with value: 0.5492335557937622.
Trial 40 finished with value: 0.46527624130249023 and parameters: {'n_layers': 3, 'weight_decay': 4.301620478270167e-08, 'n_units_l0': 90, 'n_units_l1': 18, 'n_units_l2': 65, 'optimizer': 'SGD', 'sgd_opt_learning_rate': 0.09677605712857812, 'sgd_opt_momentum': 3.1411483264973945e-05}. Best is trial 30 with value: 0.5492335557937622.
Trial 41 finished with value: 0.498680979013443 and parameters: {'n_layers': 3, 'weight_decay': 8.115088713958177e-09, 'n_units_l0': 19, 'n_units_l1': 23, 'n_units_l2': 27, 'optimizer': 'Adam', 'adam_learning_rate': 2.971875599071916e-05}. Best is trial 30 with value: 0.5492335557937622.
Trial 42 finished with value: 0.5371121764183044 and parameters: {'n_layers': 2, 'weight_decay': 1.5116250459278305e-08, 'n_units_l0': 13, 'n_units_l1': 56, 'optimizer': 'Adam', 'adam_learning_rate': 2.7818043205939982e-05}. Best is trial 30 with value: 0.5492335557937622.
Trial 43 finished with value: 0.5216756463050842 and parameters: {'n_layers': 1, 'weight_decay': 2.198132739242672e-09, 'n_units_l0': 13, 'optimizer': 'Adam', 'adam_learning_rate': 0.005117033030584112}. Best is trial 30 with value: 0.5492335557937622.
Trial 44 finished with value: 0.5183243751525879 and parameters: {'n_layers': 5, 'weight_decay': 2.0668930738570887e-07, 'n_units_l0': 9, 'n_units_l1': 94, 'n_units_l2': 50, 'n_units_l3': 38, 'n_units_l4': 27, 'optimizer': 'Adam', 'adam_learning_rate': 0.00014630371746522877}. Best is trial 30 with value: 0.5492335557937622.
Trial 45 finished with value: 0.518966019153595 and parameters: {'n_layers': 7, 'weight_decay': 2.063688823610034e-06, 'n_units_l0': 5, 'n_units_l1': 59, 'n_units_l2': 18, 'n_units_l3': 63, 'n_units_l4': 45, 'n_units_l5': 9, 'n_units_l6': 23, 'optimizer': 'Adam', 'adam_learning_rate': 3.365447902521077e-05}. Best is trial 30 with value: 0.5492335557937622.
Trial 46 finished with value: 0.5213192105293274 and parameters: {'n_layers': 2, 'weight_decay': 4.447635611201397e-08, 'n_units_l0': 7, 'n_units_l1': 56, 'optimizer': 'Adam', 'adam_learning_rate': 2.4073531557100126e-05}. Best is trial 30 with value: 0.5492335557937622.
Trial 47 finished with value: 0.5120141506195068 and parameters: {'n_layers': 2, 'weight_decay': 9.996503420748415e-06, 'n_units_l0': 72, 'n_units_l1': 30, 'optimizer': 'SGD', 'sgd_opt_learning_rate': 0.006732621090582535, 'sgd_opt_momentum': 9.489094534260215e-05}. Best is trial 30 with value: 0.5492335557937622.
Trial 48 finished with value: 0.5028876662254333 and parameters: {'n_layers': 4, 'weight_decay': 7.065820915535389e-10, 'n_units_l0': 10, 'n_units_l1': 74, 'n_units_l2': 39, 'n_units_l3': 23, 'optimizer': 'Adam', 'adam_learning_rate': 2.0485338951662742e-05}. Best is trial 30 with value: 0.5492335557937622.
Trial 49 finished with value: 0.503101646900177 and parameters: {'n_layers': 11, 'weight_decay': 7.789429446368312e-05, 'n_units_l0': 26, 'n_units_l1': 46, 'n_units_l2': 119, 'n_units_l3': 76, 'n_units_l4': 5, 'n_units_l5': 11, 'n_units_l6': 14, 'n_units_l7': 14, 'n_units_l8': 13, 'n_units_l9': 12, 'n_units_l10': 47, 'optimizer': 'Adam', 'adam_learning_rate': 0.0006126134543710025}. Best is trial 30 with value: 0.5492335557937622.
Trial 50 finished with value: 0.5031728744506836 and parameters: {'n_layers': 9, 'weight_decay': 4.423354253198088e-09, 'n_units_l0': 49, 'n_units_l1': 52, 'n_units_l2': 57, 'n_units_l3': 17, 'n_units_l4': 15, 'n_units_l5': 14, 'n_units_l6': 22, 'n_units_l7': 45, 'n_units_l8': 4, 'optimizer': 'RMSprop', 'rmsprop_learning_rate': 0.0028816649855520045, 'rmsprop_weight_decay': 0.8591483711859872, 'rmsprop_momentum': 4.055034563928009e-05}. Best is trial 30 with value: 0.5492335557937622.
Trial 51 finished with value: 0.5285919308662415 and parameters: {'n_layers': 3, 'weight_decay': 1.659598334578276e-08, 'n_units_l0': 18, 'n_units_l1': 25, 'n_units_l2': 24, 'optimizer': 'Adam', 'adam_learning_rate': 4.67035113289108e-05}. Best is trial 30 with value: 0.5492335557937622.
Trial 52 finished with value: 0.5298039317131042 and parameters: {'n_layers': 4, 'weight_decay': 1.4121938684415045e-08, 'n_units_l0': 15, 'n_units_l1': 32, 'n_units_l2': 75, 'n_units_l3': 105, 'optimizer': 'Adam', 'adam_learning_rate': 2.048527353129587e-05}. Best is trial 30 with value: 0.5492335557937622.
Trial 53 finished with value: 0.5174687504768372 and parameters: {'n_layers': 1, 'weight_decay': 2.7487282063036984e-10, 'n_units_l0': 31, 'optimizer': 'Adam', 'adam_learning_rate': 0.06563631666162781}. Best is trial 30 with value: 0.5492335557937622.
