Trial 108 finished with value: 0.5055614709854126 and parameters: {'n_layers': 10, 'weight_decay': 4.837142281484673e-09, 'n_units_l0': 22, 'n_units_l1': 19, 'n_units_l2': 32, 'n_units_l3': 51, 'n_units_l4': 8, 'n_units_l5': 6, 'n_units_l6': 125, 'n_units_l7': 128, 'n_units_l8': 52, 'n_units_l9': 16, 'optimizer': 'RMSprop', 'rmsprop_learning_rate': 0.0010856468359009097, 'rmsprop_weight_decay': 0.964492098845541, 'rmsprop_momentum': 0.007169263795570161}. Best is trial 30 with value: 0.5492335557937622.
Trial 109 finished with value: 0.5028876662254333 and parameters: {'n_layers': 8, 'weight_decay': 1.8496945114876568e-07, 'n_units_l0': 25, 'n_units_l1': 7, 'n_units_l2': 12, 'n_units_l3': 32, 'n_units_l4': 10, 'n_units_l5': 7, 'n_units_l6': 103, 'n_units_l7': 56, 'optimizer': 'RMSprop', 'rmsprop_learning_rate': 0.0003289665938560199, 'rmsprop_weight_decay': 0.9401940613817759, 'rmsprop_momentum': 0.03316981838239781}. Best is trial 30 with value: 0.5492335557937622.
Trial 110 finished with value: 0.4927985370159149 and parameters: {'n_layers': 7, 'weight_decay': 1.2125653492850529e-06, 'n_units_l0': 13, 'n_units_l1': 116, 'n_units_l2': 43, 'n_units_l3': 38, 'n_units_l4': 7, 'n_units_l5': 4, 'n_units_l6': 14, 'optimizer': 'RMSprop', 'rmsprop_learning_rate': 1.4861707111704767e-05, 'rmsprop_weight_decay': 0.9573974427058143, 'rmsprop_momentum': 0.0048976461130542095}. Best is trial 30 with value: 0.5492335557937622.
Trial 111 finished with value: 0.5167914032936096 and parameters: {'n_layers': 6, 'weight_decay': 2.5689413180772132e-08, 'n_units_l0': 17, 'n_units_l1': 24, 'n_units_l2': 112, 'n_units_l3': 79, 'n_units_l4': 18, 'n_units_l5': 8, 'optimizer': 'RMSprop', 'rmsprop_learning_rate': 0.0007469078462798925, 'rmsprop_weight_decay': 0.9787897885649129, 'rmsprop_momentum': 0.0008312654259149659}. Best is trial 30 with value: 0.5492335557937622.
Trial 112 finished with value: 0.5131906270980835 and parameters: {'n_layers': 5, 'weight_decay': 7.937004164538157e-09, 'n_units_l0': 19, 'n_units_l1': 30, 'n_units_l2': 69, 'n_units_l3': 118, 'n_units_l4': 113, 'optimizer': 'Adam', 'adam_learning_rate': 2.279770089227816e-05}. Best is trial 30 with value: 0.5492335557937622.
Trial 113 finished with value: 0.510516881942749 and parameters: {'n_layers': 9, 'weight_decay': 1.3981938767105568e-08, 'n_units_l0': 11, 'n_units_l1': 36, 'n_units_l2': 19, 'n_units_l3': 92, 'n_units_l4': 9, 'n_units_l5': 5, 'n_units_l6': 84, 'n_units_l7': 4, 'n_units_l8': 120, 'optimizer': 'RMSprop', 'rmsprop_learning_rate': 4.134453140731399e-05, 'rmsprop_weight_decay': 0.9310102521538187, 'rmsprop_momentum': 0.04649390866069079}. Best is trial 30 with value: 0.5492335557937622.
Trial 114 finished with value: 0.5076648592948914 and parameters: {'n_layers': 3, 'weight_decay': 2.0696433731804115e-08, 'n_units_l0': 13, 'n_units_l1': 27, 'n_units_l2': 25, 'optimizer': 'SGD', 'sgd_opt_learning_rate': 0.003692410357771352, 'sgd_opt_momentum': 0.012896186193404345}. Best is trial 30 with value: 0.5492335557937622.
Trial 115 finished with value: 0.5313724875450134 and parameters: {'n_layers': 7, 'weight_decay': 3.4563786844436324e-08, 'n_units_l0': 15, 'n_units_l1': 31, 'n_units_l2': 57, 'n_units_l3': 63, 'n_units_l4': 26, 'n_units_l5': 15, 'n_units_l6': 68, 'optimizer': 'Adam', 'adam_learning_rate': 0.00015753903330512095}. Best is trial 30 with value: 0.5492335557937622.
Trial 116 finished with value: 0.5268092751502991 and parameters: {'n_layers': 7, 'weight_decay': 4.176089925594794e-08, 'n_units_l0': 21, 'n_units_l1': 21, 'n_units_l2': 28, 'n_units_l3': 63, 'n_units_l4': 43, 'n_units_l5': 12, 'n_units_l6': 65, 'optimizer': 'Adam', 'adam_learning_rate': 0.00018078162094572732}. Best is trial 30 with value: 0.5492335557937622.
Trial 117 finished with value: 0.515294075012207 and parameters: {'n_layers': 8, 'weight_decay': 3.188236941939053e-08, 'n_units_l0': 9, 'n_units_l1': 40, 'n_units_l2': 58, 'n_units_l3': 53, 'n_units_l4': 13, 'n_units_l5': 16, 'n_units_l6': 73, 'n_units_l7': 18, 'optimizer': 'RMSprop', 'rmsprop_learning_rate': 0.08135046642646446, 'rmsprop_weight_decay': 0.9489415479168369, 'rmsprop_momentum': 0.0021030787600418675}. Best is trial 30 with value: 0.5492335557937622.
Trial 118 finished with value: 0.5280213952064514 and parameters: {'n_layers': 6, 'weight_decay': 4.5823966489649465e-10, 'n_units_l0': 8, 'n_units_l1': 55, 'n_units_l2': 49, 'n_units_l3': 46, 'n_units_l4': 24, 'n_units_l5': 20, 'optimizer': 'Adam', 'adam_learning_rate': 6.388898382755792e-05}. Best is trial 30 with value: 0.5492335557937622.
Trial 119 finished with value: 0.513761043548584 and parameters: {'n_layers': 11, 'weight_decay': 9.139060709696188e-08, 'n_units_l0': 14, 'n_units_l1': 30, 'n_units_l2': 17, 'n_units_l3': 26, 'n_units_l4': 92, 'n_units_l5': 11, 'n_units_l6': 97, 'n_units_l7': 31, 'n_units_l8': 77, 'n_units_l9': 29, 'n_units_l10': 6, 'optimizer': 'RMSprop', 'rmsprop_learning_rate': 1.0769909140628728e-05, 'rmsprop_weight_decay': 0.9688266072518031, 'rmsprop_momentum': 0.00016888108858416356}. Best is trial 30 with value: 0.5492335557937622.
Trial 120 finished with value: 0.5331550240516663 and parameters: {'n_layers': 1, 'weight_decay': 5.813104502403447e-08, 'n_units_l0': 16, 'optimizer': 'Adam', 'adam_learning_rate': 0.00013073938713621894}. Best is trial 30 with value: 0.5492335557937622.
Trial 121 finished with value: 0.5041353702545166 and parameters: {'n_layers': 1, 'weight_decay': 2.5357443957283466e-08, 'n_units_l0': 16, 'optimizer': 'Adam', 'adam_learning_rate': 0.00014609805063190982}. Best is trial 30 with value: 0.5492335557937622.
Trial 122 finished with value: 0.5074509978294373 and parameters: {'n_layers': 1, 'weight_decay': 5.405232404848458e-08, 'n_units_l0': 17, 'optimizer': 'Adam', 'adam_learning_rate': 0.00013395533041835313}. Best is trial 30 with value: 0.5492335557937622.
Trial 123 finished with value: 0.5101604461669922 and parameters: {'n_layers': 9, 'weight_decay': 2.417764092536036e-10, 'n_units_l0': 12, 'n_units_l1': 84, 'n_units_l2': 31, 'n_units_l3': 30, 'n_units_l4': 59, 'n_units_l5': 10, 'n_units_l6': 128, 'n_units_l7': 91, 'n_units_l8': 25, 'optimizer': 'Adam', 'adam_learning_rate': 0.00027835963557267364}. Best is trial 30 with value: 0.5492335557937622.
Trial 124 finished with value: 0.5074154138565063 and parameters: {'n_layers': 2, 'weight_decay': 1.2887396655480513e-07, 'n_units_l0': 18, 'n_units_l1': 13, 'optimizer': 'Adam', 'adam_learning_rate': 0.00010895405424641624}. Best is trial 30 with value: 0.5492335557937622.
Trial 125 finished with value: 0.5313725471496582 and parameters: {'n_layers': 7, 'weight_decay': 3.916940714815065e-07, 'n_units_l0': 20, 'n_units_l1': 65, 'n_units_l2': 36, 'n_units_l3': 60, 'n_units_l4': 52, 'n_units_l5': 15, 'n_units_l6': 71, 'optimizer': 'Adam', 'adam_learning_rate': 0.0005265338508670411}. Best is trial 30 with value: 0.5492335557937622.
Trial 126 finished with value: 0.5329055190086365 and parameters: {'n_layers': 7, 'weight_decay': 2.7496593729826133e-05, 'n_units_l0': 15, 'n_units_l1': 68, 'n_units_l2': 36, 'n_units_l3': 56, 'n_units_l4': 40, 'n_units_l5': 15, 'n_units_l6': 70, 'optimizer': 'Adam', 'adam_learning_rate': 0.0008708228218546262}. Best is trial 30 with value: 0.5492335557937622.
Trial 127 finished with value: 0.5089126229286194 and parameters: {'n_layers': 7, 'weight_decay': 3.0258458874051794e-05, 'n_units_l0': 15, 'n_units_l1': 61, 'n_units_l2': 37, 'n_units_l3': 57, 'n_units_l4': 40, 'n_units_l5': 15, 'n_units_l6': 57, 'optimizer': 'Adam', 'adam_learning_rate': 0.0009416336325516053}. Best is trial 30 with value: 0.5492335557937622.
Trial 128 finished with value: 0.501568615436554 and parameters: {'n_layers': 23, 'weight_decay': 7.711438798810877e-05, 'n_units_l0': 10, 'n_units_l1': 65, 'n_units_l2': 41, 'n_units_l3': 50, 'n_units_l4': 27, 'n_units_l5': 13, 'n_units_l6': 67, 'n_units_l7': 12, 'n_units_l8': 11, 'n_units_l9': 47, 'n_units_l10': 83, 'n_units_l11': 7, 'n_units_l12': 56, 'n_units_l13': 22, 'n_units_l14': 4, 'n_units_l15': 126, 'n_units_l16': 9, 'n_units_l17': 126, 'n_units_l18': 28, 'n_units_l19': 127, 'n_units_l20': 4, 'n_units_l21': 4, 'n_units_l22': 98, 'optimizer': 'Adam', 'adam_learning_rate': 0.0004815121753628633}. Best is trial 30 with value: 0.5492335557937622.
Trial 129 finished with value: 0.5247413516044617 and parameters: {'n_layers': 8, 'weight_decay': 0.000143472156045966, 'n_units_l0': 20, 'n_units_l1': 47, 'n_units_l2': 52, 'n_units_l3': 71, 'n_units_l4': 50, 'n_units_l5': 9, 'n_units_l6': 86, 'n_units_l7': 9, 'optimizer': 'RMSprop', 'rmsprop_learning_rate': 0.016633361759468845, 'rmsprop_weight_decay': 0.9808157965764976, 'rmsprop_momentum': 0.007516426344655247}. Best is trial 30 with value: 0.5492335557937622.
Trial 130 finished with value: 0.5146880745887756 and parameters: {'n_layers': 7, 'weight_decay': 3.862771946073276e-06, 'n_units_l0': 7, 'n_units_l1': 74, 'n_units_l2': 44, 'n_units_l3': 63, 'n_units_l4': 54, 'n_units_l5': 13, 'n_units_l6': 114, 'optimizer': 'Adam', 'adam_learning_rate': 0.0012386648990402955}. Best is trial 30 with value: 0.5492335557937622.
Trial 131 finished with value: 0.5310516953468323 and parameters: {'n_layers': 6, 'weight_decay': 5.1947903968362544e-08, 'n_units_l0': 16, 'n_units_l1': 53, 'n_units_l2': 33, 'n_units_l3': 44, 'n_units_l4': 21, 'n_units_l5': 21, 'optimizer': 'Adam', 'adam_learning_rate': 0.000548130322826045}. Best is trial 30 with value: 0.5492335557937622.
Trial 132 finished with value: 0.5064883232116699 and parameters: {'n_layers': 6, 'weight_decay': 8.11473612195768e-06, 'n_units_l0': 19, 'n_units_l1': 52, 'n_units_l2': 35, 'n_units_l3': 42, 'n_units_l4': 30, 'n_units_l5': 19, 'optimizer': 'Adam', 'adam_learning_rate': 0.0005583564358982771}. Best is trial 30 with value: 0.5492335557937622.
Trial 133 finished with value: 0.5101248025894165 and parameters: {'n_layers': 5, 'weight_decay': 5.486789377755028e-08, 'n_units_l0': 14, 'n_units_l1': 59, 'n_units_l2': 28, 'n_units_l3': 44, 'n_units_l4': 33, 'optimizer': 'Adam', 'adam_learning_rate': 0.0008251056288983958}. Best is trial 30 with value: 0.5492335557937622.
Trial 134 finished with value: 0.5146880149841309 and parameters: {'n_layers': 6, 'weight_decay': 7.319203182701251e-08, 'n_units_l0': 17, 'n_units_l1': 69, 'n_units_l2': 32, 'n_units_l3': 37, 'n_units_l4': 18, 'n_units_l5': 15, 'optimizer': 'Adam', 'adam_learning_rate': 0.0002993053814220665}. Best is trial 30 with value: 0.5492335557937622.
Trial 135 finished with value: 0.5134760141372681 and parameters: {'n_layers': 7, 'weight_decay': 4.1543419735914016e-07, 'n_units_l0': 15, 'n_units_l1': 55, 'n_units_l2': 46, 'n_units_l3': 48, 'n_units_l4': 21, 'n_units_l5': 26, 'n_units_l6': 70, 'optimizer': 'Adam', 'adam_learning_rate': 0.0012600845335208808}. Best is trial 30 with value: 0.5492335557937622.
Trial 136 finished with value: 0.5264527797698975 and parameters: {'n_layers': 8, 'weight_decay': 1.741509814537591e-07, 'n_units_l0': 16, 'n_units_l1': 76, 'n_units_l2': 30, 'n_units_l3': 57, 'n_units_l4': 19, 'n_units_l5': 18, 'n_units_l6': 48, 'n_units_l7': 14, 'optimizer': 'SGD', 'sgd_opt_learning_rate': 0.027273201860708543, 'sgd_opt_momentum': 1.0078500640416544e-05}. Best is trial 30 with value: 0.5492335557937622.
Trial 137 finished with value: 0.5174687504768372 and parameters: {'n_layers': 7, 'weight_decay': 2.751433849603501e-07, 'n_units_l0': 13, 'n_units_l1': 49, 'n_units_l2': 34, 'n_units_l3': 67, 'n_units_l4': 23, 'n_units_l5': 21, 'n_units_l6': 82, 'optimizer': 'Adam', 'adam_learning_rate': 0.0001890563730323137}. Best is trial 30 with value: 0.5492335557937622.
Trial 138 finished with value: 0.5352584719657898 and parameters: {'n_layers': 8, 'weight_decay': 1.1175720401721454e-07, 'n_units_l0': 6, 'n_units_l1': 66, 'n_units_l2': 40, 'n_units_l3': 60, 'n_units_l4': 47, 'n_units_l5': 12, 'n_units_l6': 58, 'n_units_l7': 7, 'optimizer': 'Adam', 'adam_learning_rate': 0.0004015145769841936}. Best is trial 30 with value: 0.5492335557937622.
Trial 139 finished with value: 0.5201426148414612 and parameters: {'n_layers': 9, 'weight_decay': 9.908497376302966e-08, 'n_units_l0': 6, 'n_units_l1': 87, 'n_units_l2': 57, 'n_units_l3': 85, 'n_units_l4': 46, 'n_units_l5': 12, 'n_units_l6': 61, 'n_units_l7': 7, 'n_units_l8': 8, 'optimizer': 'RMSprop', 'rmsprop_learning_rate': 9.471217602609725e-05, 'rmsprop_weight_decay': 0.9292210729038322, 'rmsprop_momentum': 9.02687853834613e-05}. Best is trial 30 with value: 0.5492335557937622.
Trial 140 finished with value: 0.5076291561126709 and parameters: {'n_layers': 8, 'weight_decay': 6.530615639355644e-07, 'n_units_l0': 5, 'n_units_l1': 65, 'n_units_l2': 38, 'n_units_l3': 76, 'n_units_l4': 66, 'n_units_l5': 11, 'n_units_l6': 96, 'n_units_l7': 5, 'optimizer': 'Adam', 'adam_learning_rate': 0.00044126819917503115}. Best is trial 30 with value: 0.5492335557937622.
Trial 141 finished with value: 0.4898752272129059 and parameters: {'n_layers': 6, 'weight_decay': 1.3378838853367931e-07, 'n_units_l0': 7, 'n_units_l1': 61, 'n_units_l2': 40, 'n_units_l3': 62, 'n_units_l4': 38, 'n_units_l5': 14, 'optimizer': 'Adam', 'adam_learning_rate': 0.0003543760395171161}. Best is trial 30 with value: 0.5492335557937622.
Trial 142 finished with value: 0.5283065438270569 and parameters: {'n_layers': 7, 'weight_decay': 2.0619462322666272e-05, 'n_units_l0': 18, 'n_units_l1': 44, 'n_units_l2': 49, 'n_units_l3': 59, 'n_units_l4': 16, 'n_units_l5': 16, 'n_units_l6': 54, 'optimizer': 'Adam', 'adam_learning_rate': 0.0002161210635502433}. Best is trial 30 with value: 0.5492335557937622.
Trial 143 finished with value: 0.5234580039978027 and parameters: {'n_layers': 8, 'weight_decay': 5.9325106810521484e-08, 'n_units_l0': 91, 'n_units_l1': 34, 'n_units_l2': 22, 'n_units_l3': 54, 'n_units_l4': 25, 'n_units_l5': 18, 'n_units_l6': 74, 'n_units_l7': 6, 'optimizer': 'Adam', 'adam_learning_rate': 0.001808137338548841}. Best is trial 30 with value: 0.5492335557937622.
Trial 144 finished with value: 0.5116221904754639 and parameters: {'n_layers': 6, 'weight_decay': 3.278574241102289e-08, 'n_units_l0': 51, 'n_units_l1': 58, 'n_units_l2': 33, 'n_units_l3': 35, 'n_units_l4': 57, 'n_units_l5': 13, 'optimizer': 'Adam', 'adam_learning_rate': 0.0006634315407228504}. Best is trial 30 with value: 0.5492335557937622.
Trial 145 finished with value: 0.5146879553794861 and parameters: {'n_layers': 17, 'weight_decay': 5.3759074130207084e-05, 'n_units_l0': 6, 'n_units_l1': 80, 'n_units_l2': 46, 'n_units_l3': 40, 'n_units_l4': 30, 'n_units_l5': 9, 'n_units_l6': 112, 'n_units_l7': 7, 'n_units_l8': 4, 'n_units_l9': 74, 'n_units_l10': 12, 'n_units_l11': 15, 'n_units_l12': 7, 'n_units_l13': 67, 'n_units_l14': 8, 'n_units_l15': 11, 'n_units_l16': 41, 'optimizer': 'Adam', 'adam_learning_rate': 0.003552513679481389}. Best is trial 30 with value: 0.5492335557937622.
Trial 146 finished with value: 0.5282710790634155 and parameters: {'n_layers': 7, 'weight_decay': 0.00036036367873080544, 'n_units_l0': 15, 'n_units_l1': 71, 'n_units_l2': 29, 'n_units_l3': 44, 'n_units_l4': 48, 'n_units_l5': 10, 'n_units_l6': 63, 'optimizer': 'Adam', 'adam_learning_rate': 0.00046370069506278125}. Best is trial 30 with value: 0.5492335557937622.
Trial 147 finished with value: 0.5301604270935059 and parameters: {'n_layers': 5, 'weight_decay': 1.961941717791731e-08, 'n_units_l0': 12, 'n_units_l1': 54, 'n_units_l2': 26, 'n_units_l3': 49, 'n_units_l4': 40, 'optimizer': 'RMSprop', 'rmsprop_learning_rate': 0.0002882522771626877, 'rmsprop_weight_decay': 0.9157016715546079, 'rmsprop_momentum': 0.019870494210370432}. Best is trial 30 with value: 0.5492335557937622.
Trial 148 finished with value: 0.5156149864196777 and parameters: {'n_layers': 9, 'weight_decay': 7.354859912844113e-10, 'n_units_l0': 8, 'n_units_l1': 97, 'n_units_l2': 36, 'n_units_l3': 72, 'n_units_l4': 8, 'n_units_l5': 8, 'n_units_l6': 25, 'n_units_l7': 4, 'n_units_l8': 16, 'optimizer': 'Adam', 'adam_learning_rate': 0.0002844826545363807}. Best is trial 30 with value: 0.5492335557937622.
Trial 149 finished with value: 0.518288791179657 and parameters: {'n_layers': 6, 'weight_decay': 1.526625794558312e-07, 'n_units_l0': 16, 'n_units_l1': 66, 'n_units_l2': 42, 'n_units_l3': 121, 'n_units_l4': 14, 'n_units_l5': 12, 'optimizer': 'Adam', 'adam_learning_rate': 0.0005860602057921807}. Best is trial 30 with value: 0.5492335557937622.
Trial 150 finished with value: 0.5107663869857788 and parameters: {'n_layers': 1, 'weight_decay': 3.6393429310542284e-07, 'n_units_l0': 20, 'optimizer': 'RMSprop', 'rmsprop_learning_rate': 0.00013061106941915837, 'rmsprop_weight_decay': 0.9450147115889799, 'rmsprop_momentum': 0.05805888949147421}. Best is trial 30 with value: 0.5492335557937622.
Trial 151 finished with value: 0.5067737698554993 and parameters: {'n_layers': 2, 'weight_decay': 1.3039398686328428e-08, 'n_units_l0': 14, 'n_units_l1': 26, 'optimizer': 'Adam', 'adam_learning_rate': 0.0009778722265009394}. Best is trial 30 with value: 0.5492335557937622.
Trial 152 finished with value: 0.5056684017181396 and parameters: {'n_layers': 1, 'weight_decay': 4.264812489865372e-08, 'n_units_l0': 22, 'optimizer': 'Adam', 'adam_learning_rate': 3.4426016645241756e-05}. Best is trial 30 with value: 0.5492335557937622.
Trial 153 finished with value: 0.520819902420044 and parameters: {'n_layers': 2, 'weight_decay': 5.8211327358161e-09, 'n_units_l0': 17, 'n_units_l1': 16, 'optimizer': 'Adam', 'adam_learning_rate': 8.628833021468666e-05}. Best is trial 30 with value: 0.5492335557937622.
Trial 154 finished with value: 0.5022459030151367 and parameters: {'n_layers': 7, 'weight_decay': 3.1072233642184355e-08, 'n_units_l0': 18, 'n_units_l1': 40, 'n_units_l2': 20, 'n_units_l3': 102, 'n_units_l4': 10, 'n_units_l5': 22, 'n_units_l6': 78, 'optimizer': 'Adam', 'adam_learning_rate': 0.03464009113624004}. Best is trial 30 with value: 0.5492335557937622.
Trial 155 finished with value: 0.5256327390670776 and parameters: {'n_layers': 8, 'weight_decay': 1.0293924480032293e-09, 'n_units_l0': 66, 'n_units_l1': 29, 'n_units_l2': 64, 'n_units_l3': 32, 'n_units_l4': 12, 'n_units_l5': 15, 'n_units_l6': 101, 'n_units_l7': 11, 'optimizer': 'Adam', 'adam_learning_rate': 0.0007468992773395436}. Best is trial 30 with value: 0.5492335557937622.
Trial 156 finished with value: 0.5279856324195862 and parameters: {'n_layers': 3, 'weight_decay': 8.994880984107236e-09, 'n_units_l0': 13, 'n_units_l1': 31, 'n_units_l2': 25, 'optimizer': 'Adam', 'adam_learning_rate': 0.00012004907990685459}. Best is trial 30 with value: 0.5492335557937622.
Trial 157 finished with value: 0.5101603865623474 and parameters: {'n_layers': 5, 'weight_decay': 8.512154673893543e-08, 'n_units_l0': 16, 'n_units_l1': 37, 'n_units_l2': 37, 'n_units_l3': 54, 'n_units_l4': 63, 'optimizer': 'RMSprop', 'rmsprop_learning_rate': 0.0016903216872587467, 'rmsprop_weight_decay': 0.9553482780921708, 'rmsprop_momentum': 0.012019816000309214}. Best is trial 30 with value: 0.5492335557937622.
Trial 158 finished with value: 0.5213546752929688 and parameters: {'n_layers': 8, 'weight_decay': 1.599283602397985e-08, 'n_units_l0': 11, 'n_units_l1': 4, 'n_units_l2': 32, 'n_units_l3': 68, 'n_units_l4': 11, 'n_units_l5': 7, 'n_units_l6': 47, 'n_units_l7': 16, 'optimizer': 'Adam', 'adam_learning_rate': 0.00016384926765979373}. Best is trial 30 with value: 0.5492335557937622.
Trial 159 finished with value: 0.5279856324195862 and parameters: {'n_layers': 7, 'weight_decay': 2.1795930941931562e-07, 'n_units_l0': 9, 'n_units_l1': 10, 'n_units_l2': 23, 'n_units_l3': 81, 'n_units_l4': 73, 'n_units_l5': 6, 'n_units_l6': 37, 'optimizer': 'Adam', 'adam_learning_rate': 0.0002169883055689529}. Best is trial 30 with value: 0.5492335557937622.
Trial 160 finished with value: 0.5174331665039062 and parameters: {'n_layers': 6, 'weight_decay': 5.2399250474719455e-08, 'n_units_l0': 14, 'n_units_l1': 46, 'n_units_l2': 56, 'n_units_l3': 47, 'n_units_l4': 34, 'n_units_l5': 14, 'optimizer': 'SGD', 'sgd_opt_learning_rate': 1.0222937391652127e-05, 'sgd_opt_momentum': 0.01666933992929682}. Best is trial 30 with value: 0.5492335557937622.
Trial 161 finished with value: 0.5113725662231445 and parameters: {'n_layers': 10, 'weight_decay': 1.7677986857712722e-09, 'n_units_l0': 30, 'n_units_l1': 125, 'n_units_l2': 9, 'n_units_l3': 4, 'n_units_l4': 117, 'n_units_l5': 47, 'n_units_l6': 6, 'n_units_l7': 8, 'n_units_l8': 45, 'n_units_l9': 19, 'optimizer': 'Adam', 'adam_learning_rate': 1.7834622058223632e-05}. Best is trial 30 with value: 0.5492335557937622.
Trial 162 finished with value: 0.5040998458862305 and parameters: {'n_layers': 9, 'weight_decay': 1.9092649228037075e-10, 'n_units_l0': 24, 'n_units_l1': 111, 'n_units_l2': 7, 'n_units_l3': 94, 'n_units_l4': 128, 'n_units_l5': 16, 'n_units_l6': 87, 'n_units_l7': 112, 'n_units_l8': 26, 'optimizer': 'Adam', 'adam_learning_rate': 1.351141505573329e-05}. Best is trial 30 with value: 0.5492335557937622.
Trial 163 finished with value: 0.5144385099411011 and parameters: {'n_layers': 8, 'weight_decay': 0.00015859278285946295, 'n_units_l0': 27, 'n_units_l1': 101, 'n_units_l2': 8, 'n_units_l3': 52, 'n_units_l4': 86, 'n_units_l5': 10, 'n_units_l6': 9, 'n_units_l7': 22, 'optimizer': 'Adam', 'adam_learning_rate': 2.8237337116926545e-05}. Best is trial 30 with value: 0.5492335557937622.
Trial 164 finished with value: 0.503208577632904 and parameters: {'n_layers': 9, 'weight_decay': 1.2549997021971915e-09, 'n_units_l0': 20, 'n_units_l1': 24, 'n_units_l2': 27, 'n_units_l3': 60, 'n_units_l4': 43, 'n_units_l5': 11, 'n_units_l6': 8, 'n_units_l7': 42, 'n_units_l8': 61, 'optimizer': 'Adam', 'adam_learning_rate': 5.521536389551428e-05}. Best is trial 30 with value: 0.5492335557937622.
