Trial 165 finished with value: 0.5255970358848572 and parameters: {'n_layers': 7, 'weight_decay': 2.060232661720877e-08, 'n_units_l0': 19, 'n_units_l1': 22, 'n_units_l2': 39, 'n_units_l3': 127, 'n_units_l4': 6, 'n_units_l5': 26, 'n_units_l6': 69, 'optimizer': 'RMSprop', 'rmsprop_learning_rate': 3.063444310651778e-05, 'rmsprop_weight_decay': 0.8934904583847595, 'rmsprop_momentum': 1.5980167029043824e-05}. Best is trial 30 with value: 0.5492335557937622.
Trial 166 finished with value: 0.5146878957748413 and parameters: {'n_layers': 8, 'weight_decay': 1.3161290288462368e-06, 'n_units_l0': 21, 'n_units_l1': 74, 'n_units_l2': 72, 'n_units_l3': 39, 'n_units_l4': 7, 'n_units_l5': 18, 'n_units_l6': 11, 'n_units_l7': 8, 'optimizer': 'Adam', 'adam_learning_rate': 1.2077810660407723e-05}. Best is trial 30 with value: 0.5492335557937622.
Trial 167 finished with value: 0.5189304351806641 and parameters: {'n_layers': 1, 'weight_decay': 3.857114298287999e-09, 'n_units_l0': 15, 'optimizer': 'Adam', 'adam_learning_rate': 0.000389442198689475}. Best is trial 30 with value: 0.5492335557937622.
Trial 168 finished with value: 0.520071268081665 and parameters: {'n_layers': 2, 'weight_decay': 7.096795526292036e-08, 'n_units_l0': 25, 'n_units_l1': 91, 'optimizer': 'Adam', 'adam_learning_rate': 7.11915014215106e-05}. Best is trial 30 with value: 0.5492335557937622.
Trial 169 finished with value: 0.5305168032646179 and parameters: {'n_layers': 19, 'weight_decay': 1.0041002041897017e-08, 'n_units_l0': 36, 'n_units_l1': 9, 'n_units_l2': 13, 'n_units_l3': 112, 'n_units_l4': 25, 'n_units_l5': 40, 'n_units_l6': 56, 'n_units_l7': 63, 'n_units_l8': 37, 'n_units_l9': 5, 'n_units_l10': 64, 'n_units_l11': 38, 'n_units_l12': 17, 'n_units_l13': 24, 'n_units_l14': 23, 'n_units_l15': 64, 'n_units_l16': 9, 'n_units_l17': 16, 'n_units_l18': 19, 'optimizer': 'RMSprop', 'rmsprop_learning_rate': 1.0236981269785994e-05, 'rmsprop_weight_decay': 0.8670734895489763, 'rmsprop_momentum': 0.0009316100898872604}. Best is trial 30 with value: 0.5492335557937622.
Trial 170 finished with value: 0.5325490236282349 and parameters: {'n_layers': 23, 'weight_decay': 1.4329784243163567e-08, 'n_units_l0': 40, 'n_units_l1': 50, 'n_units_l2': 14, 'n_units_l3': 119, 'n_units_l4': 27, 'n_units_l5': 35, 'n_units_l6': 42, 'n_units_l7': 62, 'n_units_l8': 37, 'n_units_l9': 11, 'n_units_l10': 57, 'n_units_l11': 35, 'n_units_l12': 22, 'n_units_l13': 24, 'n_units_l14': 24, 'n_units_l15': 53, 'n_units_l16': 9, 'n_units_l17': 15, 'n_units_l18': 19, 'n_units_l19': 31, 'n_units_l20': 124, 'n_units_l21': 127, 'n_units_l22': 4, 'optimizer': 'RMSprop', 'rmsprop_learning_rate': 1.0407425658570933e-05, 'rmsprop_weight_decay': 0.9815475839142535, 'rmsprop_momentum': 6.908636552959144e-05}. Best is trial 30 with value: 0.5492335557937622.
Trial 171 finished with value: 0.5038146376609802 and parameters: {'n_layers': 21, 'weight_decay': 1.0423551014725623e-08, 'n_units_l0': 32, 'n_units_l1': 5, 'n_units_l2': 13, 'n_units_l3': 108, 'n_units_l4': 26, 'n_units_l5': 36, 'n_units_l6': 56, 'n_units_l7': 63, 'n_units_l8': 38, 'n_units_l9': 5, 'n_units_l10': 69, 'n_units_l11': 36, 'n_units_l12': 22, 'n_units_l13': 23, 'n_units_l14': 24, 'n_units_l15': 51, 'n_units_l16': 8, 'n_units_l17': 15, 'n_units_l18': 20, 'n_units_l19': 25, 'n_units_l20': 122, 'optimizer': 'RMSprop', 'rmsprop_learning_rate': 1.0696569244567606e-05, 'rmsprop_weight_decay': 0.9836467863507773, 'rmsprop_momentum': 9.578212370904076e-05}. Best is trial 30 with value: 0.5492335557937622.
Trial 172 finished with value: 0.5046702027320862 and parameters: {'n_layers': 23, 'weight_decay': 5.984958378126149e-09, 'n_units_l0': 54, 'n_units_l1': 7, 'n_units_l2': 31, 'n_units_l3': 112, 'n_units_l4': 28, 'n_units_l5': 39, 'n_units_l6': 42, 'n_units_l7': 49, 'n_units_l8': 21, 'n_units_l9': 12, 'n_units_l10': 40, 'n_units_l11': 68, 'n_units_l12': 14, 'n_units_l13': 33, 'n_units_l14': 31, 'n_units_l15': 72, 'n_units_l16': 8, 'n_units_l17': 10, 'n_units_l18': 20, 'n_units_l19': 34, 'n_units_l20': 35, 'n_units_l21': 128, 'n_units_l22': 4, 'optimizer': 'RMSprop', 'rmsprop_learning_rate': 1.6108669568318124e-05, 'rmsprop_weight_decay': 0.869724272936352, 'rmsprop_momentum': 2.109745453682514e-05}. Best is trial 30 with value: 0.5492335557937622.
Trial 173 finished with value: 0.5170766711235046 and parameters: {'n_layers': 18, 'weight_decay': 1.3527089843998263e-08, 'n_units_l0': 33, 'n_units_l1': 9, 'n_units_l2': 16, 'n_units_l3': 119, 'n_units_l4': 31, 'n_units_l5': 44, 'n_units_l6': 61, 'n_units_l7': 35, 'n_units_l8': 29, 'n_units_l9': 10, 'n_units_l10': 60, 'n_units_l11': 41, 'n_units_l12': 23, 'n_units_l13': 15, 'n_units_l14': 71, 'n_units_l15': 33, 'n_units_l16': 11, 'n_units_l17': 35, 'optimizer': 'RMSprop', 'rmsprop_learning_rate': 2.4463921640856345e-05, 'rmsprop_weight_decay': 0.8694470173454264, 'rmsprop_momentum': 1.099233255784023e-05}. Best is trial 30 with value: 0.5492335557937622.
Trial 174 finished with value: 0.5383244752883911 and parameters: {'n_layers': 21, 'weight_decay': 2.5701474670559428e-08, 'n_units_l0': 41, 'n_units_l1': 11, 'n_units_l2': 11, 'n_units_l3': 102, 'n_units_l4': 22, 'n_units_l5': 13, 'n_units_l6': 92, 'n_units_l7': 57, 'n_units_l8': 38, 'n_units_l9': 7, 'n_units_l10': 93, 'n_units_l11': 22, 'n_units_l12': 10, 'n_units_l13': 32, 'n_units_l14': 13, 'n_units_l15': 75, 'n_units_l16': 26, 'n_units_l17': 8, 'n_units_l18': 10, 'n_units_l19': 10, 'n_units_l20': 12, 'optimizer': 'RMSprop', 'rmsprop_learning_rate': 1.3595680901372602e-05, 'rmsprop_weight_decay': 0.9795923589688905, 'rmsprop_momentum': 6.341061924555191e-05}. Best is trial 30 with value: 0.5492335557937622.
Trial 175 finished with value: 0.5273796916007996 and parameters: {'n_layers': 22, 'weight_decay': 4.184301883910083e-08, 'n_units_l0': 44, 'n_units_l1': 60, 'n_units_l2': 23, 'n_units_l3': 98, 'n_units_l4': 22, 'n_units_l5': 13, 'n_units_l6': 92, 'n_units_l7': 80, 'n_units_l8': 46, 'n_units_l9': 7, 'n_units_l10': 99, 'n_units_l11': 19, 'n_units_l12': 9, 'n_units_l13': 49, 'n_units_l14': 13, 'n_units_l15': 89, 'n_units_l16': 25, 'n_units_l17': 7, 'n_units_l18': 8, 'n_units_l19': 10, 'n_units_l20': 11, 'n_units_l21': 40, 'optimizer': 'RMSprop', 'rmsprop_learning_rate': 4.951028626703161e-05, 'rmsprop_weight_decay': 0.9730353685717668, 'rmsprop_momentum': 4.9169883513973275e-05}. Best is trial 30 with value: 0.5492335557937622.
Trial 176 finished with value: 0.5010694265365601 and parameters: {'n_layers': 16, 'weight_decay': 2.813507287230025e-08, 'n_units_l0': 45, 'n_units_l1': 51, 'n_units_l2': 11, 'n_units_l3': 88, 'n_units_l4': 19, 'n_units_l5': 58, 'n_units_l6': 79, 'n_units_l7': 57, 'n_units_l8': 13, 'n_units_l9': 16, 'n_units_l10': 92, 'n_units_l11': 27, 'n_units_l12': 31, 'n_units_l13': 15, 'n_units_l14': 9, 'n_units_l15': 43, 'optimizer': 'RMSprop', 'rmsprop_learning_rate': 1.7308434508335434e-05, 'rmsprop_weight_decay': 0.9896924484282889, 'rmsprop_momentum': 0.0002658189035863677}. Best is trial 30 with value: 0.5492335557937622.
Trial 177 finished with value: 0.5122995376586914 and parameters: {'n_layers': 24, 'weight_decay': 2.6044314021909545e-08, 'n_units_l0': 62, 'n_units_l1': 42, 'n_units_l2': 4, 'n_units_l3': 65, 'n_units_l4': 21, 'n_units_l5': 11, 'n_units_l6': 109, 'n_units_l7': 41, 'n_units_l8': 55, 'n_units_l9': 26, 'n_units_l10': 26, 'n_units_l11': 10, 'n_units_l12': 5, 'n_units_l13': 33, 'n_units_l14': 17, 'n_units_l15': 19, 'n_units_l16': 49, 'n_units_l17': 8, 'n_units_l18': 9, 'n_units_l19': 48, 'n_units_l20': 12, 'n_units_l21': 30, 'n_units_l22': 13, 'n_units_l23': 11, 'optimizer': 'RMSprop', 'rmsprop_learning_rate': 2.3598937505192266e-05, 'rmsprop_weight_decay': 0.9758186767884304, 'rmsprop_momentum': 6.002004560033663e-05}. Best is trial 30 with value: 0.5492335557937622.
Trial 178 finished with value: 0.5304456353187561 and parameters: {'n_layers': 25, 'weight_decay': 1.0523141875190145e-07, 'n_units_l0': 18, 'n_units_l1': 13, 'n_units_l2': 84, 'n_units_l3': 126, 'n_units_l4': 36, 'n_units_l5': 30, 'n_units_l6': 118, 'n_units_l7': 26, 'n_units_l8': 28, 'n_units_l9': 10, 'n_units_l10': 110, 'n_units_l11': 79, 'n_units_l12': 10, 'n_units_l13': 72, 'n_units_l14': 9, 'n_units_l15': 88, 'n_units_l16': 24, 'n_units_l17': 33, 'n_units_l18': 36, 'n_units_l19': 9, 'n_units_l20': 53, 'n_units_l21': 53, 'n_units_l22': 12, 'n_units_l23': 127, 'n_units_l24': 4, 'optimizer': 'RMSprop', 'rmsprop_learning_rate': 1.4719315599049635e-05, 'rmsprop_weight_decay': 0.9823151657318959, 'rmsprop_momentum': 2.8295082332272662e-05}. Best is trial 30 with value: 0.5492335557937622.
Trial 179 finished with value: 0.49622103571891785 and parameters: {'n_layers': 22, 'weight_decay': 3.5791978348438205e-10, 'n_units_l0': 39, 'n_units_l1': 33, 'n_units_l2': 34, 'n_units_l3': 104, 'n_units_l4': 20, 'n_units_l5': 7, 'n_units_l6': 90, 'n_units_l7': 29, 'n_units_l8': 22, 'n_units_l9': 4, 'n_units_l10': 46, 'n_units_l11': 11, 'n_units_l12': 6, 'n_units_l13': 6, 'n_units_l14': 73, 'n_units_l15': 13, 'n_units_l16': 62, 'n_units_l17': 65, 'n_units_l18': 10, 'n_units_l19': 5, 'n_units_l20': 10, 'n_units_l21': 11, 'optimizer': 'RMSprop', 'rmsprop_learning_rate': 3.2637206281748484e-05, 'rmsprop_weight_decay': 0.9696606711141853, 'rmsprop_momentum': 0.0002446334828440532}. Best is trial 30 with value: 0.5492335557937622.
Trial 180 finished with value: 0.5425667762756348 and parameters: {'n_layers': 7, 'weight_decay': 1.7658500938179134e-08, 'n_units_l0': 108, 'n_units_l1': 8, 'n_units_l2': 19, 'n_units_l3': 94, 'n_units_l4': 29, 'n_units_l5': 9, 'n_units_l6': 74, 'optimizer': 'RMSprop', 'rmsprop_learning_rate': 7.097317486558063e-05, 'rmsprop_weight_decay': 0.959451188726917, 'rmsprop_momentum': 9.252526758596768e-05}. Best is trial 30 with value: 0.5492335557937622.
Trial 181 finished with value: 0.5152584910392761 and parameters: {'n_layers': 7, 'weight_decay': 1.7684728470564897e-08, 'n_units_l0': 121, 'n_units_l1': 8, 'n_units_l2': 18, 'n_units_l3': 78, 'n_units_l4': 24, 'n_units_l5': 9, 'n_units_l6': 73, 'optimizer': 'RMSprop', 'rmsprop_learning_rate': 9.366261903176351e-05, 'rmsprop_weight_decay': 0.964089926351093, 'rmsprop_momentum': 0.00011247311088696018}. Best is trial 30 with value: 0.5492335557937622.
Trial 182 finished with value: 0.5162210464477539 and parameters: {'n_layers': 7, 'weight_decay': 3.738005964922991e-08, 'n_units_l0': 93, 'n_units_l1': 63, 'n_units_l2': 15, 'n_units_l3': 92, 'n_units_l4': 27, 'n_units_l5': 12, 'n_units_l6': 65, 'optimizer': 'RMSprop', 'rmsprop_learning_rate': 5.859410804344979e-05, 'rmsprop_weight_decay': 0.9593330446441729, 'rmsprop_momentum': 7.349572540059162e-05}. Best is trial 30 with value: 0.5492335557937622.
Trial 183 finished with value: 0.5011051297187805 and parameters: {'n_layers': 20, 'weight_decay': 2.090327110329158e-08, 'n_units_l0': 113, 'n_units_l1': 12, 'n_units_l2': 21, 'n_units_l3': 112, 'n_units_l4': 28, 'n_units_l5': 14, 'n_units_l6': 100, 'n_units_l7': 5, 'n_units_l8': 71, 'n_units_l9': 14, 'n_units_l10': 31, 'n_units_l11': 24, 'n_units_l12': 41, 'n_units_l13': 11, 'n_units_l14': 32, 'n_units_l15': 40, 'n_units_l16': 6, 'n_units_l17': 6, 'n_units_l18': 4, 'n_units_l19': 15, 'optimizer': 'RMSprop', 'rmsprop_learning_rate': 2.2177385718472104e-05, 'rmsprop_weight_decay': 0.9836594687415217, 'rmsprop_momentum': 3.181479091313731e-05}. Best is trial 30 with value: 0.5492335557937622.
Trial 184 finished with value: 0.520819902420044 and parameters: {'n_layers': 6, 'weight_decay': 7.761084647886387e-09, 'n_units_l0': 111, 'n_units_l1': 11, 'n_units_l2': 18, 'n_units_l3': 84, 'n_units_l4': 22, 'n_units_l5': 5, 'optimizer': 'RMSprop', 'rmsprop_learning_rate': 0.00014210699367237818, 'rmsprop_weight_decay': 0.9669525835274366, 'rmsprop_momentum': 4.3174197947341695e-05}. Best is trial 30 with value: 0.5492335557937622.
Trial 185 finished with value: 0.5110874176025391 and parameters: {'n_layers': 7, 'weight_decay': 1.473801799544377e-08, 'n_units_l0': 98, 'n_units_l1': 15, 'n_units_l2': 20, 'n_units_l3': 45, 'n_units_l4': 29, 'n_units_l5': 24, 'n_units_l6': 83, 'optimizer': 'RMSprop', 'rmsprop_learning_rate': 0.00023094733321017184, 'rmsprop_weight_decay': 0.9740262312033928, 'rmsprop_momentum': 0.00018257527146514}. Best is trial 30 with value: 0.5492335557937622.
Trial 186 finished with value: 0.5374330878257751 and parameters: {'n_layers': 8, 'weight_decay': 2.5423006629462818e-08, 'n_units_l0': 75, 'n_units_l1': 6, 'n_units_l2': 14, 'n_units_l3': 97, 'n_units_l4': 6, 'n_units_l5': 17, 'n_units_l6': 17, 'n_units_l7': 70, 'optimizer': 'RMSprop', 'rmsprop_learning_rate': 0.0005081190410555293, 'rmsprop_weight_decay': 0.9780721180885176, 'rmsprop_momentum': 0.009921869680445441}. Best is trial 30 with value: 0.5492335557937622.
Trial 187 finished with value: 0.5277717113494873 and parameters: {'n_layers': 14, 'weight_decay': 5.2263004634216976e-08, 'n_units_l0': 128, 'n_units_l1': 7, 'n_units_l2': 14, 'n_units_l3': 98, 'n_units_l4': 6, 'n_units_l5': 17, 'n_units_l6': 16, 'n_units_l7': 70, 'n_units_l8': 33, 'n_units_l9': 21, 'n_units_l10': 86, 'n_units_l11': 18, 'n_units_l12': 11, 'n_units_l13': 40, 'optimizer': 'RMSprop', 'rmsprop_learning_rate': 0.0004922448408444758, 'rmsprop_weight_decay': 0.9780576065144311, 'rmsprop_momentum': 0.009540555701489779}. Best is trial 30 with value: 0.5492335557937622.
Trial 188 finished with value: 0.5152941346168518 and parameters: {'n_layers': 8, 'weight_decay': 2.806684015425335e-08, 'n_units_l0': 84, 'n_units_l1': 57, 'n_units_l2': 12, 'n_units_l3': 128, 'n_units_l4': 7, 'n_units_l5': 15, 'n_units_l6': 18, 'n_units_l7': 51, 'optimizer': 'RMSprop', 'rmsprop_learning_rate': 1.4042926749194279e-05, 'rmsprop_weight_decay': 0.9860024387820758, 'rmsprop_momentum': 0.023773476319122425}. Best is trial 30 with value: 0.5492335557937622.
Trial 189 finished with value: 0.50352942943573 and parameters: {'n_layers': 8, 'weight_decay': 7.374202139857664e-08, 'n_units_l0': 111, 'n_units_l1': 5, 'n_units_l2': 16, 'n_units_l3': 104, 'n_units_l4': 9, 'n_units_l5': 16, 'n_units_l6': 14, 'n_units_l7': 46, 'optimizer': 'RMSprop', 'rmsprop_learning_rate': 0.0008170094388300837, 'rmsprop_weight_decay': 0.9530064756627954, 'rmsprop_momentum': 0.014657922369033833}. Best is trial 30 with value: 0.5492335557937622.
Trial 190 finished with value: 0.5359358191490173 and parameters: {'n_layers': 7, 'weight_decay': 1.610286611336287e-07, 'n_units_l0': 73, 'n_units_l1': 6, 'n_units_l2': 13, 'n_units_l3': 116, 'n_units_l4': 5, 'n_units_l5': 17, 'n_units_l6': 71, 'optimizer': 'RMSprop', 'rmsprop_learning_rate': 0.00043160883905633384, 'rmsprop_weight_decay': 0.9612846403939609, 'rmsprop_momentum': 0.004627655418286827}. Best is trial 30 with value: 0.5492335557937622.
Trial 191 finished with value: 0.5116934180259705 and parameters: {'n_layers': 7, 'weight_decay': 1.8617109875095407e-07, 'n_units_l0': 77, 'n_units_l1': 5, 'n_units_l2': 13, 'n_units_l3': 113, 'n_units_l4': 8, 'n_units_l5': 20, 'n_units_l6': 71, 'optimizer': 'RMSprop', 'rmsprop_learning_rate': 0.00043679348125690097, 'rmsprop_weight_decay': 0.968744982056335, 'rmsprop_momentum': 0.003501825631400373}. Best is trial 30 with value: 0.5492335557937622.
Trial 192 finished with value: 0.5267736315727234 and parameters: {'n_layers': 6, 'weight_decay': 1.038957007158192e-07, 'n_units_l0': 69, 'n_units_l1': 6, 'n_units_l2': 11, 'n_units_l3': 120, 'n_units_l4': 5, 'n_units_l5': 17, 'optimizer': 'RMSprop', 'rmsprop_learning_rate': 0.0002083518595073689, 'rmsprop_weight_decay': 0.9611543690689447, 'rmsprop_momentum': 0.004878726814929605}. Best is trial 30 with value: 0.5492335557937622.
Trial 193 finished with value: 0.5213191509246826 and parameters: {'n_layers': 7, 'weight_decay': 2.980287883426902e-07, 'n_units_l0': 86, 'n_units_l1': 6, 'n_units_l2': 14, 'n_units_l3': 93, 'n_units_l4': 5, 'n_units_l5': 15, 'n_units_l6': 75, 'optimizer': 'RMSprop', 'rmsprop_learning_rate': 0.0006145583189004213, 'rmsprop_weight_decay': 0.9769320117140752, 'rmsprop_momentum': 0.009991510203547136}. Best is trial 30 with value: 0.5492335557937622.
Trial 194 finished with value: 0.5149731636047363 and parameters: {'n_layers': 6, 'weight_decay': 3.722625201094114e-08, 'n_units_l0': 53, 'n_units_l1': 9, 'n_units_l2': 17, 'n_units_l3': 104, 'n_units_l4': 6, 'n_units_l5': 19, 'optimizer': 'RMSprop', 'rmsprop_learning_rate': 0.00035244819631647056, 'rmsprop_weight_decay': 0.9718962065845822, 'rmsprop_momentum': 0.005547829371574572}. Best is trial 30 with value: 0.5492335557937622.
Trial 195 finished with value: 0.5182531476020813 and parameters: {'n_layers': 8, 'weight_decay': 3.152919795107526e-06, 'n_units_l0': 115, 'n_units_l1': 68, 'n_units_l2': 51, 'n_units_l3': 73, 'n_units_l4': 25, 'n_units_l5': 8, 'n_units_l6': 64, 'n_units_l7': 81, 'optimizer': 'RMSprop', 'rmsprop_learning_rate': 0.0022437681546019182, 'rmsprop_weight_decay': 0.9807824163166194, 'rmsprop_momentum': 0.00890990496219952}. Best is trial 30 with value: 0.5492335557937622.
Trial 196 finished with value: 0.504349410533905 and parameters: {'n_layers': 8, 'weight_decay': 2.463522014679907e-08, 'n_units_l0': 59, 'n_units_l1': 49, 'n_units_l2': 15, 'n_units_l3': 115, 'n_units_l4': 53, 'n_units_l5': 13, 'n_units_l6': 51, 'n_units_l7': 97, 'optimizer': 'RMSprop', 'rmsprop_learning_rate': 0.0010165595954970583, 'rmsprop_weight_decay': 0.9358732965861388, 'rmsprop_momentum': 0.012866635708164605}. Best is trial 30 with value: 0.5492335557937622.
Trial 197 finished with value: 0.49921566247940063 and parameters: {'n_layers': 7, 'weight_decay': 5.810513772127533e-10, 'n_units_l0': 102, 'n_units_l1': 8, 'n_units_l2': 12, 'n_units_l3': 56, 'n_units_l4': 32, 'n_units_l5': 21, 'n_units_l6': 12, 'optimizer': 'RMSprop', 'rmsprop_learning_rate': 7.544527557774634e-05, 'rmsprop_weight_decay': 0.9658025192467936, 'rmsprop_momentum': 0.003036804344147272}. Best is trial 30 with value: 0.5492335557937622.
Trial 198 finished with value: 0.5232086181640625 and parameters: {'n_layers': 9, 'weight_decay': 1.0821029090008604e-05, 'n_units_l0': 17, 'n_units_l1': 6, 'n_units_l2': 45, 'n_units_l3': 86, 'n_units_l4': 40, 'n_units_l5': 14, 'n_units_l6': 79, 'n_units_l7': 6, 'n_units_l8': 41, 'optimizer': 'RMSprop', 'rmsprop_learning_rate': 0.00027631068531170614, 'rmsprop_weight_decay': 0.9604663192690645, 'rmsprop_momentum': 0.034127970349469655}. Best is trial 30 with value: 0.5492335557937622.
Trial 199 finished with value: 0.5049909949302673 and parameters: {'n_layers': 6, 'weight_decay': 1.2168845833086138e-07, 'n_units_l0': 47, 'n_units_l1': 11, 'n_units_l2': 60, 'n_units_l3': 98, 'n_units_l4': 17, 'n_units_l5': 17, 'optimizer': 'RMSprop', 'rmsprop_learning_rate': 0.00016423410485743664, 'rmsprop_weight_decay': 0.9514545151812787, 'rmsprop_momentum': 0.0006393380528149963}. Best is trial 30 with value: 0.5492335557937622.
Trial 200 finished with value: 0.5268092751502991 and parameters: {'n_layers': 8, 'weight_decay': 1.6785204745130217e-07, 'n_units_l0': 77, 'n_units_l1': 4, 'n_units_l2': 19, 'n_units_l3': 67, 'n_units_l4': 4, 'n_units_l5': 9, 'n_units_l6': 60, 'n_units_l7': 59, 'optimizer': 'SGD', 'sgd_opt_learning_rate': 0.002351845998280073, 'sgd_opt_momentum': 0.00035710384971708906}. Best is trial 30 with value: 0.5492335557937622.
Trial 201 finished with value: 0.5189304351806641 and parameters: {'n_layers': 1, 'weight_decay': 1.3202724626505389e-08, 'n_units_l0': 7, 'optimizer': 'Adam', 'adam_learning_rate': 0.0002469063189914845}. Best is trial 30 with value: 0.5492335557937622.
Trial 202 finished with value: 0.5165061950683594 and parameters: {'n_layers': 24, 'weight_decay': 2.12051788601716e-08, 'n_units_l0': 15, 'n_units_l1': 31, 'n_units_l2': 25, 'n_units_l3': 36, 'n_units_l4': 7, 'n_units_l5': 16, 'n_units_l6': 96, 'n_units_l7': 68, 'n_units_l8': 16, 'n_units_l9': 7, 'n_units_l10': 53, 'n_units_l11': 32, 'n_units_l12': 15, 'n_units_l13': 87, 'n_units_l14': 18, 'n_units_l15': 25, 'n_units_l16': 30, 'n_units_l17': 11, 'n_units_l18': 13, 'n_units_l19': 60, 'n_units_l20': 53, 'n_units_l21': 15, 'n_units_l22': 29, 'n_units_l23': 28, 'optimizer': 'Adam', 'adam_learning_rate': 0.0013830902317399309}. Best is trial 30 with value: 0.5492335557937622.
Trial 203 finished with value: 0.5298038721084595 and parameters: {'n_layers': 7, 'weight_decay': 5.193433222432209e-08, 'n_units_l0': 13, 'n_units_l1': 8, 'n_units_l2': 30, 'n_units_l3': 49, 'n_units_l4': 5, 'n_units_l5': 6, 'n_units_l6': 119, 'optimizer': 'Adam', 'adam_learning_rate': 0.00032045588779390163}. Best is trial 30 with value: 0.5492335557937622.
Trial 204 finished with value: 0.5247058272361755 and parameters: {'n_layers': 2, 'weight_decay': 1.5471776514213512e-08, 'n_units_l0': 16, 'n_units_l1': 36, 'optimizer': 'Adam', 'adam_learning_rate': 4.661509971032904e-05}. Best is trial 30 with value: 0.5492335557937622.
Trial 205 finished with value: 0.5001425743103027 and parameters: {'n_layers': 7, 'weight_decay': 8.110128330492703e-08, 'n_units_l0': 8, 'n_units_l1': 19, 'n_units_l2': 10, 'n_units_l3': 119, 'n_units_l4': 10, 'n_units_l5': 19, 'n_units_l6': 21, 'optimizer': 'Adam', 'adam_learning_rate': 0.0004972093815872595}. Best is trial 30 with value: 0.5492335557937622.
Trial 206 finished with value: 0.5170766115188599 and parameters: {'n_layers': 8, 'weight_decay': 9.603374450932938e-09, 'n_units_l0': 66, 'n_units_l1': 27, 'n_units_l2': 28, 'n_units_l3': 59, 'n_units_l4': 24, 'n_units_l5': 10, 'n_units_l6': 69, 'n_units_l7': 88, 'optimizer': 'Adam', 'adam_learning_rate': 0.0001578245777150289}. Best is trial 30 with value: 0.5492335557937622.
