Trial 207 finished with value: 0.517433226108551 and parameters: {'n_layers': 7, 'weight_decay': 4.215069681906047e-08, 'n_units_l0': 14, 'n_units_l1': 53, 'n_units_l2': 5, 'n_units_l3': 92, 'n_units_l4': 49, 'n_units_l5': 5, 'n_units_l6': 106, 'optimizer': 'RMSprop', 'rmsprop_learning_rate': 2.0355976059407805e-05, 'rmsprop_weight_decay': 0.9455771059239539, 'rmsprop_momentum': 0.0014130841728526606}. Best is trial 30 with value: 0.5492335557937622.
Trial 208 finished with value: 0.4980035126209259 and parameters: {'n_layers': 6, 'weight_decay': 3.1375401568190244e-08, 'n_units_l0': 40, 'n_units_l1': 59, 'n_units_l2': 14, 'n_units_l3': 110, 'n_units_l4': 21, 'n_units_l5': 4, 'optimizer': 'Adam', 'adam_learning_rate': 0.00010753098408343637}. Best is trial 30 with value: 0.5492335557937622.
Trial 209 finished with value: 0.4895186424255371 and parameters: {'n_layers': 1, 'weight_decay': 7.564113123520607e-06, 'n_units_l0': 16, 'optimizer': 'Adam', 'adam_learning_rate': 0.0008491030137805425}. Best is trial 30 with value: 0.5492335557937622.
Trial 210 finished with value: 0.5167557597160339 and parameters: {'n_layers': 9, 'weight_decay': 8.357040453935563e-07, 'n_units_l0': 95, 'n_units_l1': 73, 'n_units_l2': 24, 'n_units_l3': 42, 'n_units_l4': 6, 'n_units_l5': 12, 'n_units_l6': 28, 'n_units_l7': 34, 'n_units_l8': 20, 'optimizer': 'RMSprop', 'rmsprop_learning_rate': 4.583786221532494e-05, 'rmsprop_weight_decay': 0.9864199941458562, 'rmsprop_momentum': 1.9744378845909802e-05}. Best is trial 30 with value: 0.5492335557937622.
Trial 211 finished with value: 0.5282708406448364 and parameters: {'n_layers': 20, 'weight_decay': 6.938954609616553e-09, 'n_units_l0': 36, 'n_units_l1': 9, 'n_units_l2': 13, 'n_units_l3': 105, 'n_units_l4': 26, 'n_units_l5': 35, 'n_units_l6': 57, 'n_units_l7': 65, 'n_units_l8': 36, 'n_units_l9': 5, 'n_units_l10': 62, 'n_units_l11': 48, 'n_units_l12': 19, 'n_units_l13': 26, 'n_units_l14': 28, 'n_units_l15': 67, 'n_units_l16': 19, 'n_units_l17': 24, 'n_units_l18': 15, 'n_units_l19': 22, 'optimizer': 'RMSprop', 'rmsprop_learning_rate': 1.0129505170497255e-05, 'rmsprop_weight_decay': 0.9774647818809632, 'rmsprop_momentum': 0.002163628708986571}. Best is trial 30 with value: 0.5492335557937622.
Trial 212 finished with value: 0.5279499888420105 and parameters: {'n_layers': 21, 'weight_decay': 1.0227437821378516e-08, 'n_units_l0': 28, 'n_units_l1': 65, 'n_units_l2': 9, 'n_units_l3': 112, 'n_units_l4': 22, 'n_units_l5': 53, 'n_units_l6': 53, 'n_units_l7': 76, 'n_units_l8': 93, 'n_units_l9': 7, 'n_units_l10': 74, 'n_units_l11': 33, 'n_units_l12': 16, 'n_units_l13': 18, 'n_units_l14': 18, 'n_units_l15': 83, 'n_units_l16': 11, 'n_units_l17': 18, 'n_units_l18': 38, 'n_units_l19': 7, 'n_units_l20': 19, 'optimizer': 'RMSprop', 'rmsprop_learning_rate': 1.3311204011603492e-05, 'rmsprop_weight_decay': 0.9899770004026125, 'rmsprop_momentum': 0.00036826316987465673}. Best is trial 30 with value: 0.5492335557937622.
Trial 213 finished with value: 0.5092335343360901 and parameters: {'n_layers': 23, 'weight_decay': 1.9825343720271738e-05, 'n_units_l0': 41, 'n_units_l1': 9, 'n_units_l2': 12, 'n_units_l3': 107, 'n_units_l4': 25, 'n_units_l5': 7, 'n_units_l6': 67, 'n_units_l7': 52, 'n_units_l8': 61, 'n_units_l9': 4, 'n_units_l10': 107, 'n_units_l11': 43, 'n_units_l12': 27, 'n_units_l13': 25, 'n_units_l14': 11, 'n_units_l15': 51, 'n_units_l16': 6, 'n_units_l17': 12, 'n_units_l18': 6, 'n_units_l19': 32, 'n_units_l20': 7, 'n_units_l21': 72, 'n_units_l22': 8, 'optimizer': 'RMSprop', 'rmsprop_learning_rate': 1.2956043866376654e-05, 'rmsprop_weight_decay': 0.9569885265910202, 'rmsprop_momentum': 0.006736828341358319}. Best is trial 30 with value: 0.5492335557937622.
Trial 214 finished with value: 0.5258822441101074 and parameters: {'n_layers': 22, 'weight_decay': 1.1767143508452346e-08, 'n_units_l0': 35, 'n_units_l1': 10, 'n_units_l2': 13, 'n_units_l3': 126, 'n_units_l4': 44, 'n_units_l5': 14, 'n_units_l6': 85, 'n_units_l7': 86, 'n_units_l8': 50, 'n_units_l9': 10, 'n_units_l10': 22, 'n_units_l11': 65, 'n_units_l12': 16, 'n_units_l13': 54, 'n_units_l14': 36, 'n_units_l15': 96, 'n_units_l16': 12, 'n_units_l17': 6, 'n_units_l18': 14, 'n_units_l19': 18, 'n_units_l20': 20, 'n_units_l21': 6, 'optimizer': 'RMSprop', 'rmsprop_learning_rate': 2.877358463513395e-05, 'rmsprop_weight_decay': 0.9735264235350326, 'rmsprop_momentum': 0.0009770315920456336}. Best is trial 30 with value: 0.5492335557937622.
Trial 215 finished with value: 0.5026025772094727 and parameters: {'n_layers': 7, 'weight_decay': 1.6833242196627714e-08, 'n_units_l0': 17, 'n_units_l1': 34, 'n_units_l2': 22, 'n_units_l3': 120, 'n_units_l4': 19, 'n_units_l5': 18, 'n_units_l6': 128, 'optimizer': 'RMSprop', 'rmsprop_learning_rate': 0.0007087121331312589, 'rmsprop_weight_decay': 0.9813572214459114, 'rmsprop_momentum': 0.016953101176100903}. Best is trial 30 with value: 0.5492335557937622.
Trial 216 finished with value: 0.5113726258277893 and parameters: {'n_layers': 8, 'weight_decay': 4.093762215745495e-07, 'n_units_l0': 37, 'n_units_l1': 12, 'n_units_l2': 11, 'n_units_l3': 77, 'n_units_l4': 35, 'n_units_l5': 22, 'n_units_l6': 75, 'n_units_l7': 109, 'optimizer': 'Adam', 'adam_learning_rate': 8.062584721104173e-05}. Best is trial 30 with value: 0.5492335557937622.
Trial 217 finished with value: 0.530766487121582 and parameters: {'n_layers': 19, 'weight_decay': 2.1900382031222624e-08, 'n_units_l0': 6, 'n_units_l1': 7, 'n_units_l2': 16, 'n_units_l3': 97, 'n_units_l4': 29, 'n_units_l5': 39, 'n_units_l6': 59, 'n_units_l7': 56, 'n_units_l8': 28, 'n_units_l9': 8, 'n_units_l10': 38, 'n_units_l11': 22, 'n_units_l12': 24, 'n_units_l13': 12, 'n_units_l14': 58, 'n_units_l15': 55, 'n_units_l16': 6, 'n_units_l17': 24, 'n_units_l18': 27, 'optimizer': 'RMSprop', 'rmsprop_learning_rate': 1.1996593160519407e-05, 'rmsprop_weight_decay': 0.8519982754928589, 'rmsprop_momentum': 0.00013400816514600196}. Best is trial 30 with value: 0.5492335557937622.
Trial 218 finished with value: 0.5210338830947876 and parameters: {'n_layers': 2, 'weight_decay': 2.1540215617493608e-08, 'n_units_l0': 6, 'n_units_l1': 7, 'optimizer': 'Adam', 'adam_learning_rate': 3.351148884863724e-05}. Best is trial 30 with value: 0.5492335557937622.
Trial 219 finished with value: 0.5355792045593262 and parameters: {'n_layers': 6, 'weight_decay': 3.24502612662252e-08, 'n_units_l0': 6, 'n_units_l1': 7, 'n_units_l2': 16, 'n_units_l3': 98, 'n_units_l4': 34, 'n_units_l5': 15, 'optimizer': 'RMSprop', 'rmsprop_learning_rate': 1.75408618338965e-05, 'rmsprop_weight_decay': 0.9415112843942144, 'rmsprop_momentum': 6.572714677028633e-05}. Best is trial 30 with value: 0.5492335557937622.
Trial 220 finished with value: 0.5156506299972534 and parameters: {'n_layers': 5, 'weight_decay': 6.110254624689835e-08, 'n_units_l0': 106, 'n_units_l1': 79, 'n_units_l2': 19, 'n_units_l3': 52, 'n_units_l4': 39, 'optimizer': 'Adam', 'adam_learning_rate': 0.0004134490877121328}. Best is trial 30 with value: 0.5492335557937622.
Trial 221 finished with value: 0.5123350620269775 and parameters: {'n_layers': 6, 'weight_decay': 3.194982422879395e-08, 'n_units_l0': 6, 'n_units_l1': 6, 'n_units_l2': 16, 'n_units_l3': 99, 'n_units_l4': 34, 'n_units_l5': 15, 'optimizer': 'RMSprop', 'rmsprop_learning_rate': 1.9492934440959302e-05, 'rmsprop_weight_decay': 0.8533676021248572, 'rmsprop_momentum': 7.233088265256678e-05}. Best is trial 30 with value: 0.5492335557937622.
Trial 222 finished with value: 0.505632758140564 and parameters: {'n_layers': 7, 'weight_decay': 2.4254995056404923e-08, 'n_units_l0': 5, 'n_units_l1': 7, 'n_units_l2': 15, 'n_units_l3': 87, 'n_units_l4': 30, 'n_units_l5': 16, 'n_units_l6': 91, 'optimizer': 'RMSprop', 'rmsprop_learning_rate': 1.3160100949363648e-05, 'rmsprop_weight_decay': 0.9180759119836526, 'rmsprop_momentum': 0.00012119553545762131}. Best is trial 30 with value: 0.5492335557937622.
Trial 223 finished with value: 0.5298039317131042 and parameters: {'n_layers': 8, 'weight_decay': 1.763959829105696e-08, 'n_units_l0': 6, 'n_units_l1': 62, 'n_units_l2': 17, 'n_units_l3': 98, 'n_units_l4': 31, 'n_units_l5': 11, 'n_units_l6': 60, 'n_units_l7': 44, 'optimizer': 'RMSprop', 'rmsprop_learning_rate': 3.430581604441057e-05, 'rmsprop_weight_decay': 0.9415266997821333, 'rmsprop_momentum': 5.303891458810254e-05}. Best is trial 30 with value: 0.5492335557937622.
Trial 224 finished with value: 0.5153655409812927 and parameters: {'n_layers': 6, 'weight_decay': 2.4156955236606734e-07, 'n_units_l0': 7, 'n_units_l1': 7, 'n_units_l2': 16, 'n_units_l3': 80, 'n_units_l4': 37, 'n_units_l5': 13, 'optimizer': 'RMSprop', 'rmsprop_learning_rate': 0.05382669011567099, 'rmsprop_weight_decay': 0.9252962990993014, 'rmsprop_momentum': 3.807587168333333e-05}. Best is trial 30 with value: 0.5492335557937622.
Trial 225 finished with value: 0.5177540183067322 and parameters: {'n_layers': 20, 'weight_decay': 0.0009219694712648592, 'n_units_l0': 18, 'n_units_l1': 6, 'n_units_l2': 18, 'n_units_l3': 63, 'n_units_l4': 33, 'n_units_l5': 43, 'n_units_l6': 79, 'n_units_l7': 55, 'n_units_l8': 18, 'n_units_l9': 8, 'n_units_l10': 41, 'n_units_l11': 21, 'n_units_l12': 26, 'n_units_l13': 11, 'n_units_l14': 56, 'n_units_l15': 29, 'n_units_l16': 6, 'n_units_l17': 25, 'n_units_l18': 52, 'n_units_l19': 58, 'optimizer': 'RMSprop', 'rmsprop_learning_rate': 0.00042110744518206254, 'rmsprop_weight_decay': 0.897608596008206, 'rmsprop_momentum': 6.997281949719207e-05}. Best is trial 30 with value: 0.5492335557937622.
Trial 226 finished with value: 0.520071268081665 and parameters: {'n_layers': 7, 'weight_decay': 3.876219753795306e-08, 'n_units_l0': 15, 'n_units_l1': 8, 'n_units_l2': 38, 'n_units_l3': 90, 'n_units_l4': 43, 'n_units_l5': 37, 'n_units_l6': 66, 'optimizer': 'RMSprop', 'rmsprop_learning_rate': 1.957331120734608e-05, 'rmsprop_weight_decay': 0.9110151454433224, 'rmsprop_momentum': 9.817770483621959e-05}. Best is trial 30 with value: 0.5492335557937622.
Trial 227 finished with value: 0.5137611627578735 and parameters: {'n_layers': 1, 'weight_decay': 4.786356310783144e-08, 'n_units_l0': 7, 'optimizer': 'Adam', 'adam_learning_rate': 0.0005536799224789934}. Best is trial 30 with value: 0.5492335557937622.
Trial 228 finished with value: 0.5235294103622437 and parameters: {'n_layers': 24, 'weight_decay': 1.170942270604444e-07, 'n_units_l0': 128, 'n_units_l1': 29, 'n_units_l2': 21, 'n_units_l3': 69, 'n_units_l4': 29, 'n_units_l5': 15, 'n_units_l6': 49, 'n_units_l7': 37, 'n_units_l8': 28, 'n_units_l9': 13, 'n_units_l10': 30, 'n_units_l11': 16, 'n_units_l12': 13, 'n_units_l13': 7, 'n_units_l14': 86, 'n_units_l15': 47, 'n_units_l16': 14, 'n_units_l17': 52, 'n_units_l18': 32, 'n_units_l19': 6, 'n_units_l20': 61, 'n_units_l21': 24, 'n_units_l22': 80, 'n_units_l23': 32, 'optimizer': 'RMSprop', 'rmsprop_learning_rate': 1.657571740104517e-05, 'rmsprop_weight_decay': 0.8786302633812918, 'rmsprop_momentum': 0.00013520598855134856}. Best is trial 30 with value: 0.5492335557937622.
Trial 229 finished with value: 0.49832436442375183 and parameters: {'n_layers': 5, 'weight_decay': 2.7219677757300604e-08, 'n_units_l0': 6, 'n_units_l1': 54, 'n_units_l2': 14, 'n_units_l3': 105, 'n_units_l4': 97, 'optimizer': 'Adam', 'adam_learning_rate': 0.0001911189758830074}. Best is trial 30 with value: 0.5492335557937622.
Trial 230 finished with value: 0.5191801190376282 and parameters: {'n_layers': 6, 'weight_decay': 9.116053373320861e-10, 'n_units_l0': 19, 'n_units_l1': 5, 'n_units_l2': 33, 'n_units_l3': 39, 'n_units_l4': 23, 'n_units_l5': 8, 'optimizer': 'Adam', 'adam_learning_rate': 0.000697931489677295}. Best is trial 30 with value: 0.5492335557937622.
Trial 231 finished with value: 0.5277004837989807 and parameters: {'n_layers': 18, 'weight_decay': 9.403675072041234e-09, 'n_units_l0': 44, 'n_units_l1': 10, 'n_units_l2': 15, 'n_units_l3': 112, 'n_units_l4': 27, 'n_units_l5': 42, 'n_units_l6': 33, 'n_units_l7': 62, 'n_units_l8': 39, 'n_units_l9': 5, 'n_units_l10': 60, 'n_units_l11': 24, 'n_units_l12': 19, 'n_units_l13': 18, 'n_units_l14': 21, 'n_units_l15': 63, 'n_units_l16': 5, 'n_units_l17': 20, 'optimizer': 'RMSprop', 'rmsprop_learning_rate': 1.1221629635873895e-05, 'rmsprop_weight_decay': 0.8500924444647865, 'rmsprop_momentum': 0.0001878998683270573}. Best is trial 30 with value: 0.5492335557937622.
Trial 232 finished with value: 0.5128698348999023 and parameters: {'n_layers': 21, 'weight_decay': 1.5569576719715558e-08, 'n_units_l0': 17, 'n_units_l1': 8, 'n_units_l2': 13, 'n_units_l3': 118, 'n_units_l4': 28, 'n_units_l5': 33, 'n_units_l6': 55, 'n_units_l7': 75, 'n_units_l8': 24, 'n_units_l9': 9, 'n_units_l10': 52, 'n_units_l11': 12, 'n_units_l12': 18, 'n_units_l13': 8, 'n_units_l14': 52, 'n_units_l15': 71, 'n_units_l16': 9, 'n_units_l17': 13, 'n_units_l18': 23, 'n_units_l19': 11, 'n_units_l20': 80, 'optimizer': 'RMSprop', 'rmsprop_learning_rate': 1.031101346528259e-05, 'rmsprop_weight_decay': 0.9359189999720826, 'rmsprop_momentum': 0.0002420858773017697}. Best is trial 30 with value: 0.5492335557937622.
Trial 233 finished with value: 0.509269118309021 and parameters: {'n_layers': 7, 'weight_decay': 1.088742983780153e-08, 'n_units_l0': 8, 'n_units_l1': 7, 'n_units_l2': 14, 'n_units_l3': 98, 'n_units_l4': 26, 'n_units_l5': 13, 'n_units_l6': 71, 'optimizer': 'RMSprop', 'rmsprop_learning_rate': 1.326023472569734e-05, 'rmsprop_weight_decay': 0.8595406304502748, 'rmsprop_momentum': 0.008299839857214036}. Best is trial 30 with value: 0.5492335557937622.
Trial 234 finished with value: 0.5040997862815857 and parameters: {'n_layers': 19, 'weight_decay': 2.491187881787851e-09, 'n_units_l0': 34, 'n_units_l1': 71, 'n_units_l2': 36, 'n_units_l3': 109, 'n_units_l4': 9, 'n_units_l5': 14, 'n_units_l6': 62, 'n_units_l7': 70, 'n_units_l8': 33, 'n_units_l9': 6, 'n_units_l10': 69, 'n_units_l11': 30, 'n_units_l12': 43, 'n_units_l13': 29, 'n_units_l14': 41, 'n_units_l15': 7, 'n_units_l16': 34, 'n_units_l17': 9, 'n_units_l18': 16, 'optimizer': 'RMSprop', 'rmsprop_learning_rate': 2.5975763344162238e-05, 'rmsprop_weight_decay': 0.8578764586189246, 'rmsprop_momentum': 0.0042575271476934535}. Best is trial 30 with value: 0.5492335557937622.
Trial 235 finished with value: 0.5114080905914307 and parameters: {'n_layers': 19, 'weight_decay': 2.062227644200307e-06, 'n_units_l0': 38, 'n_units_l1': 31, 'n_units_l2': 101, 'n_units_l3': 128, 'n_units_l4': 31, 'n_units_l5': 41, 'n_units_l6': 58, 'n_units_l7': 47, 'n_units_l8': 47, 'n_units_l9': 11, 'n_units_l10': 39, 'n_units_l11': 38, 'n_units_l12': 9, 'n_units_l13': 13, 'n_units_l14': 15, 'n_units_l15': 55, 'n_units_l16': 7, 'n_units_l17': 26, 'n_units_l18': 24, 'optimizer': 'RMSprop', 'rmsprop_learning_rate': 1.691936194715006e-05, 'rmsprop_weight_decay': 0.96607364351549, 'rmsprop_momentum': 3.7617055336796136e-05}. Best is trial 30 with value: 0.5492335557937622.
Trial 236 finished with value: 0.5150088667869568 and parameters: {'n_layers': 8, 'weight_decay': 2.141886587811815e-08, 'n_units_l0': 14, 'n_units_l1': 39, 'n_units_l2': 42, 'n_units_l3': 56, 'n_units_l4': 47, 'n_units_l5': 31, 'n_units_l6': 112, 'n_units_l7': 41, 'optimizer': 'SGD', 'sgd_opt_learning_rate': 5.944650724939066e-05, 'sgd_opt_momentum': 4.255256404281794e-05}. Best is trial 30 with value: 0.5492335557937622.
Trial 237 finished with value: 0.5113725662231445 and parameters: {'n_layers': 7, 'weight_decay': 7.172467222182785e-08, 'n_units_l0': 30, 'n_units_l1': 26, 'n_units_l2': 17, 'n_units_l3': 117, 'n_units_l4': 7, 'n_units_l5': 51, 'n_units_l6': 66, 'optimizer': 'RMSprop', 'rmsprop_learning_rate': 1.2037397057909397e-05, 'rmsprop_weight_decay': 0.8707584596378037, 'rmsprop_momentum': 5.7455471343002346e-05}. Best is trial 30 with value: 0.5492335557937622.
Trial 238 finished with value: 0.5016756653785706 and parameters: {'n_layers': 3, 'weight_decay': 1.4649399972511947e-08, 'n_units_l0': 16, 'n_units_l1': 44, 'n_units_l2': 6, 'optimizer': 'Adam', 'adam_learning_rate': 0.0014886655556705926}. Best is trial 30 with value: 0.5492335557937622.
Trial 239 finished with value: 0.5292692184448242 and parameters: {'n_layers': 8, 'weight_decay': 7.067623811573648e-09, 'n_units_l0': 15, 'n_units_l1': 56, 'n_units_l2': 12, 'n_units_l3': 46, 'n_units_l4': 24, 'n_units_l5': 39, 'n_units_l6': 83, 'n_units_l7': 20, 'optimizer': 'RMSprop', 'rmsprop_learning_rate': 4.0774248845779547e-05, 'rmsprop_weight_decay': 0.9704540925987959, 'rmsprop_momentum': 8.73020369547121e-05}. Best is trial 30 with value: 0.5492335557937622.
Trial 240 finished with value: 0.5101604461669922 and parameters: {'n_layers': 17, 'weight_decay': 1.5876714882807552e-07, 'n_units_l0': 5, 'n_units_l1': 67, 'n_units_l2': 26, 'n_units_l3': 93, 'n_units_l4': 36, 'n_units_l5': 46, 'n_units_l6': 24, 'n_units_l7': 58, 'n_units_l8': 58, 'n_units_l9': 7, 'n_units_l10': 45, 'n_units_l11': 9, 'n_units_l12': 70, 'n_units_l13': 18, 'n_units_l14': 26, 'n_units_l15': 100, 'n_units_l16': 122, 'optimizer': 'Adam', 'adam_learning_rate': 0.0032335031959681753}. Best is trial 30 with value: 0.5492335557937622.
Trial 241 finished with value: 0.5146879553794861 and parameters: {'n_layers': 9, 'weight_decay': 1.4607986437649257e-10, 'n_units_l0': 26, 'n_units_l1': 114, 'n_units_l2': 10, 'n_units_l3': 6, 'n_units_l4': 8, 'n_units_l5': 6, 'n_units_l6': 7, 'n_units_l7': 118, 'n_units_l8': 36, 'optimizer': 'Adam', 'adam_learning_rate': 2.3717960872199868e-05}. Best is trial 30 with value: 0.5492335557937622.
Trial 242 finished with value: 0.527985692024231 and parameters: {'n_layers': 9, 'weight_decay': 3.49981025804577e-08, 'n_units_l0': 22, 'n_units_l1': 122, 'n_units_l2': 15, 'n_units_l3': 22, 'n_units_l4': 11, 'n_units_l5': 17, 'n_units_l6': 13, 'n_units_l7': 66, 'n_units_l8': 69, 'optimizer': 'Adam', 'adam_learning_rate': 1.0432726911120646e-05}. Best is trial 30 with value: 0.5492335557937622.
Trial 243 finished with value: 0.5119785666465759 and parameters: {'n_layers': 10, 'weight_decay': 2.928772202546459e-10, 'n_units_l0': 21, 'n_units_l1': 50, 'n_units_l2': 11, 'n_units_l3': 10, 'n_units_l4': 26, 'n_units_l5': 68, 'n_units_l6': 10, 'n_units_l7': 100, 'n_units_l8': 30, 'n_units_l9': 5, 'optimizer': 'Adam', 'adam_learning_rate': 1.6093889584515744e-05}. Best is trial 30 with value: 0.5492335557937622.
Trial 244 finished with value: 0.5094829797744751 and parameters: {'n_layers': 6, 'weight_decay': 2.028250850334755e-08, 'n_units_l0': 48, 'n_units_l1': 109, 'n_units_l2': 12, 'n_units_l3': 103, 'n_units_l4': 113, 'n_units_l5': 18, 'optimizer': 'Adam', 'adam_learning_rate': 1.9461777085399638e-05}. Best is trial 30 with value: 0.5492335557937622.
Trial 245 finished with value: 0.5073797702789307 and parameters: {'n_layers': 7, 'weight_decay': 1.2981517315927956e-09, 'n_units_l0': 119, 'n_units_l1': 7, 'n_units_l2': 13, 'n_units_l3': 112, 'n_units_l4': 123, 'n_units_l5': 122, 'n_units_l6': 102, 'optimizer': 'RMSprop', 'rmsprop_learning_rate': 2.1462699150751676e-05, 'rmsprop_weight_decay': 0.9834521478688547, 'rmsprop_momentum': 0.020946578703994627}. Best is trial 30 with value: 0.5492335557937622.
Trial 246 finished with value: 0.5213190913200378 and parameters: {'n_layers': 8, 'weight_decay': 3.9525561357224456e-09, 'n_units_l0': 7, 'n_units_l1': 8, 'n_units_l2': 67, 'n_units_l3': 59, 'n_units_l4': 20, 'n_units_l5': 79, 'n_units_l6': 11, 'n_units_l7': 51, 'optimizer': 'Adam', 'adam_learning_rate': 0.0010168535660884217}. Best is trial 30 with value: 0.5492335557937622.
Trial 247 finished with value: 0.5335116386413574 and parameters: {'n_layers': 8, 'weight_decay': 0.00024130142459333578, 'n_units_l0': 17, 'n_units_l1': 14, 'n_units_l2': 35, 'n_units_l3': 5, 'n_units_l4': 104, 'n_units_l5': 9, 'n_units_l6': 46, 'n_units_l7': 55, 'optimizer': 'Adam', 'adam_learning_rate': 2.6288356113911532e-05}. Best is trial 30 with value: 0.5492335557937622.
Trial 248 finished with value: 0.531372606754303 and parameters: {'n_layers': 8, 'weight_decay': 0.00037076017083142673, 'n_units_l0': 19, 'n_units_l1': 13, 'n_units_l2': 34, 'n_units_l3': 42, 'n_units_l4': 101, 'n_units_l5': 9, 'n_units_l6': 46, 'n_units_l7': 55, 'optimizer': 'RMSprop', 'rmsprop_learning_rate': 0.0074476675509596146, 'rmsprop_weight_decay': 0.8660812744613576, 'rmsprop_momentum': 2.202723754069606e-05}. Best is trial 30 with value: 0.5492335557937622.
Trial 249 finished with value: 0.5274153351783752 and parameters: {'n_layers': 8, 'weight_decay': 0.00024771808588892695, 'n_units_l0': 19, 'n_units_l1': 14, 'n_units_l2': 34, 'n_units_l3': 33, 'n_units_l4': 100, 'n_units_l5': 9, 'n_units_l6': 39, 'n_units_l7': 55, 'optimizer': 'Adam', 'adam_learning_rate': 4.378323288866295e-05}. Best is trial 30 with value: 0.5492335557937622.
