Trial 81 finished with value: 0.9895319938659668 and parameters: {'n_layers': 1, 'weight_decay': 0.0009675495401046262, 'n_units_l0': 10, 'optimizer': 'Adam', 'adam_learning_rate': 0.004323721511007868}. Best is trial 53 with value: 0.9956896305084229.
Trial 82 finished with value: 0.5147783160209656 and parameters: {'n_layers': 1, 'weight_decay': 0.0009482447507420692, 'n_units_l0': 10, 'optimizer': 'Adam', 'adam_learning_rate': 0.003605840053134648}. Best is trial 53 with value: 0.9956896305084229.
Trial 83 finished with value: 0.5147783160209656 and parameters: {'n_layers': 1, 'weight_decay': 0.0005803916349435427, 'n_units_l0': 9, 'optimizer': 'Adam', 'adam_learning_rate': 0.009308398343063594}. Best is trial 53 with value: 0.9956896305084229.
Trial 84 finished with value: 0.5147783160209656 and parameters: {'n_layers': 1, 'weight_decay': 0.000985099196921516, 'n_units_l0': 10, 'optimizer': 'Adam', 'adam_learning_rate': 0.005019615606352742}. Best is trial 53 with value: 0.9956896305084229.
Trial 85 finished with value: 0.5147783160209656 and parameters: {'n_layers': 1, 'weight_decay': 0.00023125488576517024, 'n_units_l0': 8, 'optimizer': 'Adam', 'adam_learning_rate': 0.014056043325858178}. Best is trial 53 with value: 0.9956896305084229.
Trial 86 finished with value: 0.5147783160209656 and parameters: {'n_layers': 1, 'weight_decay': 0.00010141969858724923, 'n_units_l0': 9, 'optimizer': 'RMSprop', 'rmsprop_learning_rate': 0.00014139002345063168, 'rmsprop_weight_decay': 0.8831157713531514, 'rmsprop_momentum': 1.0889255323438522e-05}. Best is trial 53 with value: 0.9956896305084229.
Trial 87 finished with value: 0.5147783160209656 and parameters: {'n_layers': 1, 'weight_decay': 0.0003802534042138814, 'n_units_l0': 10, 'optimizer': 'Adam', 'adam_learning_rate': 0.0020133830835525287}. Best is trial 53 with value: 0.9956896305084229.
Trial 88 finished with value: 0.5147783160209656 and parameters: {'n_layers': 1, 'weight_decay': 0.0006623928063466824, 'n_units_l0': 8, 'optimizer': 'Adam', 'adam_learning_rate': 0.0023822386397409035}. Best is trial 53 with value: 0.9956896305084229.
Trial 89 finished with value: 0.9790640473365784 and parameters: {'n_layers': 1, 'weight_decay': 0.00016569974301205835, 'n_units_l0': 10, 'optimizer': 'Adam', 'adam_learning_rate': 0.0009585991260979536}. Best is trial 53 with value: 0.9956896305084229.
Trial 90 finished with value: 0.5147783160209656 and parameters: {'n_layers': 1, 'weight_decay': 1.9143711500086457e-05, 'n_units_l0': 3, 'optimizer': 'Adam', 'adam_learning_rate': 0.00717942373237638}. Best is trial 53 with value: 0.9956896305084229.
Trial 91 finished with value: 0.5147783160209656 and parameters: {'n_layers': 1, 'weight_decay': 0.0003005411649339296, 'n_units_l0': 7, 'optimizer': 'Adam', 'adam_learning_rate': 0.0013168844696454084}. Best is trial 53 with value: 0.9956896305084229.
Trial 92 finished with value: 0.9932265877723694 and parameters: {'n_layers': 1, 'weight_decay': 0.00037260988179262485, 'n_units_l0': 8, 'optimizer': 'Adam', 'adam_learning_rate': 0.0037028624814740094}. Best is trial 53 with value: 0.9956896305084229.
Trial 93 finished with value: 0.5147783160209656 and parameters: {'n_layers': 1, 'weight_decay': 0.0006605817904826064, 'n_units_l0': 9, 'optimizer': 'Adam', 'adam_learning_rate': 0.004290097103256288}. Best is trial 53 with value: 0.9956896305084229.
Trial 94 finished with value: 0.5147783160209656 and parameters: {'n_layers': 1, 'weight_decay': 0.0004421608093028513, 'n_units_l0': 8, 'optimizer': 'Adam', 'adam_learning_rate': 0.0034041516046696843}. Best is trial 53 with value: 0.9956896305084229.
Trial 95 finished with value: 0.9913793206214905 and parameters: {'n_layers': 1, 'weight_decay': 0.00013993138393887666, 'n_units_l0': 9, 'optimizer': 'Adam', 'adam_learning_rate': 0.00147662825240017}. Best is trial 53 with value: 0.9956896305084229.
Trial 96 finished with value: 0.5147783160209656 and parameters: {'n_layers': 1, 'weight_decay': 0.00015353924623768208, 'n_units_l0': 6, 'optimizer': 'SGD', 'sgd_opt_learning_rate': 0.007992823656304023, 'sgd_opt_momentum': 0.0006528988802358261}. Best is trial 53 with value: 0.9956896305084229.
Trial 97 finished with value: 0.5147783160209656 and parameters: {'n_layers': 1, 'weight_decay': 8.682495888173598e-06, 'n_units_l0': 9, 'optimizer': 'Adam', 'adam_learning_rate': 0.001567290076208311}. Best is trial 53 with value: 0.9956896305084229.
Trial 98 finished with value: 0.5147783160209656 and parameters: {'n_layers': 1, 'weight_decay': 4.4358747196668814e-05, 'n_units_l0': 8, 'optimizer': 'Adam', 'adam_learning_rate': 0.0022320233548771924}. Best is trial 53 with value: 0.9956896305084229.
Trial 99 finished with value: 0.5147783160209656 and parameters: {'n_layers': 1, 'weight_decay': 7.587146811792605e-07, 'n_units_l0': 1, 'optimizer': 'Adam', 'adam_learning_rate': 0.002899556563088197}. Best is trial 53 with value: 0.9956896305084229.
Trial 100 finished with value: 0.5147783160209656 and parameters: {'n_layers': 1, 'weight_decay': 0.0001093181004393843, 'n_units_l0': 7, 'optimizer': 'RMSprop', 'rmsprop_learning_rate': 1.0907790994474509e-05, 'rmsprop_weight_decay': 0.9186411329541031, 'rmsprop_momentum': 0.0207226850323837}. Best is trial 53 with value: 0.9956896305084229.
Trial 101 finished with value: 0.9852216839790344 and parameters: {'n_layers': 1, 'weight_decay': 0.0002473870505652985, 'n_units_l0': 10, 'optimizer': 'Adam', 'adam_learning_rate': 0.0009393494549281708}. Best is trial 53 with value: 0.9956896305084229.
Trial 102 finished with value: 0.5147783160209656 and parameters: {'n_layers': 1, 'weight_decay': 6.868479388744337e-05, 'n_units_l0': 9, 'optimizer': 'Adam', 'adam_learning_rate': 0.00173577081136923}. Best is trial 53 with value: 0.9956896305084229.
Trial 103 finished with value: 0.9784482717514038 and parameters: {'n_layers': 1, 'weight_decay': 0.0007089196269528229, 'n_units_l0': 2, 'optimizer': 'Adam', 'adam_learning_rate': 0.0009294812403129807}. Best is trial 53 with value: 0.9956896305084229.
Trial 104 finished with value: 0.9729064106941223 and parameters: {'n_layers': 1, 'weight_decay': 0.0002510126978468227, 'n_units_l0': 10, 'optimizer': 'Adam', 'adam_learning_rate': 0.0013508501503836884}. Best is trial 53 with value: 0.9956896305084229.
Trial 105 finished with value: 0.5147783160209656 and parameters: {'n_layers': 1, 'weight_decay': 2.2396569719098788e-06, 'n_units_l0': 9, 'optimizer': 'Adam', 'adam_learning_rate': 0.004474304980766534}. Best is trial 53 with value: 0.9956896305084229.
Trial 106 finished with value: 0.5147783160209656 and parameters: {'n_layers': 1, 'weight_decay': 5.346228393961438e-06, 'n_units_l0': 10, 'optimizer': 'Adam', 'adam_learning_rate': 0.0029836485925832544}. Best is trial 53 with value: 0.9956896305084229.
Trial 107 finished with value: 0.5147783160209656 and parameters: {'n_layers': 1, 'weight_decay': 0.00019339082244552384, 'n_units_l0': 8, 'optimizer': 'Adam', 'adam_learning_rate': 0.006835815094768915}. Best is trial 53 with value: 0.9956896305084229.
Trial 108 finished with value: 0.991995096206665 and parameters: {'n_layers': 1, 'weight_decay': 0.00044887883386685897, 'n_units_l0': 10, 'optimizer': 'Adam', 'adam_learning_rate': 0.0010992066367791359}. Best is trial 53 with value: 0.9956896305084229.
Trial 109 finished with value: 0.5147783160209656 and parameters: {'n_layers': 1, 'weight_decay': 0.0005030297713926307, 'n_units_l0': 7, 'optimizer': 'Adam', 'adam_learning_rate': 0.002025970487170651}. Best is trial 53 with value: 0.9956896305084229.
Trial 110 finished with value: 0.8380541801452637 and parameters: {'n_layers': 1, 'weight_decay': 0.00013493894212518315, 'n_units_l0': 8, 'optimizer': 'Adam', 'adam_learning_rate': 0.000626166267730294}. Best is trial 53 with value: 0.9956896305084229.
Trial 111 finished with value: 0.9901477694511414 and parameters: {'n_layers': 1, 'weight_decay': 0.00037399303589966826, 'n_units_l0': 10, 'optimizer': 'Adam', 'adam_learning_rate': 0.0012145233965489175}. Best is trial 53 with value: 0.9956896305084229.
Trial 112 finished with value: 0.9876847267150879 and parameters: {'n_layers': 1, 'weight_decay': 0.000357999482838551, 'n_units_l0': 9, 'optimizer': 'Adam', 'adam_learning_rate': 0.0012321164669430872}. Best is trial 53 with value: 0.9956896305084229.
Trial 113 finished with value: 0.9895319938659668 and parameters: {'n_layers': 1, 'weight_decay': 0.0003774212110742604, 'n_units_l0': 9, 'optimizer': 'Adam', 'adam_learning_rate': 0.0011959630103195488}. Best is trial 53 with value: 0.9956896305084229.
Trial 114 finished with value: 0.9956896305084229 and parameters: {'n_layers': 1, 'weight_decay': 0.000751974382703675, 'n_units_l0': 10, 'optimizer': 'Adam', 'adam_learning_rate': 0.0017389126583042419}. Best is trial 53 with value: 0.9956896305084229.
Trial 115 finished with value: 0.5147783160209656 and parameters: {'n_layers': 1, 'weight_decay': 0.0005865845248901654, 'n_units_l0': 10, 'optimizer': 'Adam', 'adam_learning_rate': 0.003710222147951724}. Best is trial 53 with value: 0.9956896305084229.
Trial 116 finished with value: 0.5147783160209656 and parameters: {'n_layers': 1, 'weight_decay': 0.0007268862430262063, 'n_units_l0': 10, 'optimizer': 'Adam', 'adam_learning_rate': 0.0017092870156826315}. Best is trial 53 with value: 0.9956896305084229.
Trial 117 finished with value: 0.5147783160209656 and parameters: {'n_layers': 1, 'weight_decay': 0.0004940350147253736, 'n_units_l0': 9, 'optimizer': 'SGD', 'sgd_opt_learning_rate': 0.02126928347764172, 'sgd_opt_momentum': 0.00015148862267615806}. Best is trial 53 with value: 0.9956896305084229.
Trial 118 finished with value: 0.991995096206665 and parameters: {'n_layers': 1, 'weight_decay': 0.0008750383594709144, 'n_units_l0': 10, 'optimizer': 'Adam', 'adam_learning_rate': 0.002367329495775913}. Best is trial 53 with value: 0.9956896305084229.
Trial 119 finished with value: 0.988916277885437 and parameters: {'n_layers': 1, 'weight_decay': 9.169424233439267e-05, 'n_units_l0': 9, 'optimizer': 'Adam', 'adam_learning_rate': 0.0023687103551385947}. Best is trial 53 with value: 0.9956896305084229.
Trial 120 finished with value: 0.5147783160209656 and parameters: {'n_layers': 1, 'weight_decay': 0.0002841064163546534, 'n_units_l0': 8, 'optimizer': 'Adam', 'adam_learning_rate': 0.0018555978272814225}. Best is trial 53 with value: 0.9956896305084229.
Trial 121 finished with value: 0.9981527328491211 and parameters: {'n_layers': 1, 'weight_decay': 0.0009546612278355769, 'n_units_l0': 10, 'optimizer': 'Adam', 'adam_learning_rate': 0.0027137060727634695}. Best is trial 121 with value: 0.9981527328491211.
Trial 122 finished with value: 0.5147783160209656 and parameters: {'n_layers': 1, 'weight_decay': 0.0009836386490227676, 'n_units_l0': 10, 'optimizer': 'Adam', 'adam_learning_rate': 0.002915414964927426}. Best is trial 121 with value: 0.9981527328491211.
Trial 123 finished with value: 0.9913793206214905 and parameters: {'n_layers': 1, 'weight_decay': 0.0004038657065950627, 'n_units_l0': 10, 'optimizer': 'Adam', 'adam_learning_rate': 0.0015242058849019792}. Best is trial 121 with value: 0.9981527328491211.
Trial 124 finished with value: 0.9883005023002625 and parameters: {'n_layers': 1, 'weight_decay': 1.0073940897152508e-10, 'n_units_l0': 9, 'optimizer': 'Adam', 'adam_learning_rate': 0.0014529371113319667}. Best is trial 121 with value: 0.9981527328491211.
Trial 125 finished with value: 0.5147783160209656 and parameters: {'n_layers': 1, 'weight_decay': 0.0006869265242992342, 'n_units_l0': 9, 'optimizer': 'Adam', 'adam_learning_rate': 0.005223845588909125}. Best is trial 121 with value: 0.9981527328491211.
Trial 126 finished with value: 0.996921181678772 and parameters: {'n_layers': 1, 'weight_decay': 0.00020818319678370554, 'n_units_l0': 10, 'optimizer': 'Adam', 'adam_learning_rate': 0.002674124469476016}. Best is trial 121 with value: 0.9981527328491211.
Trial 127 finished with value: 0.5147783160209656 and parameters: {'n_layers': 1, 'weight_decay': 0.00019937670626748866, 'n_units_l0': 8, 'optimizer': 'Adam', 'adam_learning_rate': 0.0024143445878693887}. Best is trial 121 with value: 0.9981527328491211.
Trial 128 finished with value: 0.5147783160209656 and parameters: {'n_layers': 1, 'weight_decay': 0.0001299658623314494, 'n_units_l0': 10, 'optimizer': 'RMSprop', 'rmsprop_learning_rate': 0.005956700224635849, 'rmsprop_weight_decay': 0.9621497144098964, 'rmsprop_momentum': 0.0010192459464353392}. Best is trial 121 with value: 0.9981527328491211.
Trial 129 finished with value: 0.5147783160209656 and parameters: {'n_layers': 1, 'weight_decay': 0.000531341830760416, 'n_units_l0': 9, 'optimizer': 'Adam', 'adam_learning_rate': 0.0020001057578226964}. Best is trial 121 with value: 0.9981527328491211.
Trial 130 finished with value: 0.5147783160209656 and parameters: {'n_layers': 1, 'weight_decay': 0.0003438421751683295, 'n_units_l0': 10, 'optimizer': 'Adam', 'adam_learning_rate': 0.0034966761067720055}. Best is trial 121 with value: 0.9981527328491211.
Trial 131 finished with value: 0.9778324961662292 and parameters: {'n_layers': 1, 'weight_decay': 0.0007663811758172945, 'n_units_l0': 9, 'optimizer': 'Adam', 'adam_learning_rate': 0.0015473706357649372}. Best is trial 121 with value: 0.9981527328491211.
Trial 132 finished with value: 0.5147783160209656 and parameters: {'n_layers': 1, 'weight_decay': 0.00018057881289514077, 'n_units_l0': 10, 'optimizer': 'Adam', 'adam_learning_rate': 0.0028022412204681876}. Best is trial 121 with value: 0.9981527328491211.
Trial 133 finished with value: 0.947044312953949 and parameters: {'n_layers': 1, 'weight_decay': 0.0004674560032811429, 'n_units_l0': 10, 'optimizer': 'Adam', 'adam_learning_rate': 0.000753978802150277}. Best is trial 121 with value: 0.9981527328491211.
Trial 134 finished with value: 0.9852216839790344 and parameters: {'n_layers': 1, 'weight_decay': 0.00024412659443101182, 'n_units_l0': 8, 'optimizer': 'Adam', 'adam_learning_rate': 0.001076385308447831}. Best is trial 121 with value: 0.9981527328491211.
Trial 135 finished with value: 0.5147783160209656 and parameters: {'n_layers': 1, 'weight_decay': 0.0007820857541984784, 'n_units_l0': 9, 'optimizer': 'Adam', 'adam_learning_rate': 0.002410028825976038}. Best is trial 121 with value: 0.9981527328491211.
Trial 136 finished with value: 0.9913793206214905 and parameters: {'n_layers': 1, 'weight_decay': 7.146170254563157e-05, 'n_units_l0': 8, 'optimizer': 'Adam', 'adam_learning_rate': 0.001818366852538043}. Best is trial 121 with value: 0.9981527328491211.
Trial 137 finished with value: 0.5147783160209656 and parameters: {'n_layers': 1, 'weight_decay': 8.629638284247153e-05, 'n_units_l0': 8, 'optimizer': 'Adam', 'adam_learning_rate': 0.003848314668108691}. Best is trial 121 with value: 0.9981527328491211.
Trial 138 finished with value: 0.5147783160209656 and parameters: {'n_layers': 1, 'weight_decay': 5.9094787788695965e-05, 'n_units_l0': 7, 'optimizer': 'Adam', 'adam_learning_rate': 0.001947532641355406}. Best is trial 121 with value: 0.9981527328491211.
Trial 139 finished with value: 0.9907635450363159 and parameters: {'n_layers': 1, 'weight_decay': 0.00014258989742059266, 'n_units_l0': 9, 'optimizer': 'Adam', 'adam_learning_rate': 0.0014916460742760772}. Best is trial 121 with value: 0.9981527328491211.
Trial 140 finished with value: 0.5147783160209656 and parameters: {'n_layers': 1, 'weight_decay': 2.9151513411063757e-10, 'n_units_l0': 8, 'optimizer': 'Adam', 'adam_learning_rate': 1.001386934601145e-05}. Best is trial 121 with value: 0.9981527328491211.
Trial 141 finished with value: 0.9895319938659668 and parameters: {'n_layers': 1, 'weight_decay': 0.00014679433150967806, 'n_units_l0': 9, 'optimizer': 'Adam', 'adam_learning_rate': 0.00149421968554509}. Best is trial 121 with value: 0.9981527328491211.
Trial 142 finished with value: 0.5147783160209656 and parameters: {'n_layers': 1, 'weight_decay': 0.0002815520680517556, 'n_units_l0': 9, 'optimizer': 'Adam', 'adam_learning_rate': 0.003135618718167337}. Best is trial 121 with value: 0.9981527328491211.
Trial 143 finished with value: 0.5147783160209656 and parameters: {'n_layers': 1, 'weight_decay': 0.0004256999980480081, 'n_units_l0': 10, 'optimizer': 'Adam', 'adam_learning_rate': 0.001818982261229064}. Best is trial 121 with value: 0.9981527328491211.
Trial 144 finished with value: 0.982758641242981 and parameters: {'n_layers': 1, 'weight_decay': 3.926801855254687e-05, 'n_units_l0': 10, 'optimizer': 'Adam', 'adam_learning_rate': 0.0010062653013888498}. Best is trial 121 with value: 0.9981527328491211.
Trial 145 finished with value: 0.5147783160209656 and parameters: {'n_layers': 1, 'weight_decay': 0.00020538062147254925, 'n_units_l0': 9, 'optimizer': 'SGD', 'sgd_opt_learning_rate': 1.1927216535259822e-05, 'sgd_opt_momentum': 1.4746516994153296e-05}. Best is trial 121 with value: 0.9981527328491211.
Trial 146 finished with value: 0.5147783160209656 and parameters: {'n_layers': 1, 'weight_decay': 0.0009994808450290717, 'n_units_l0': 8, 'optimizer': 'Adam', 'adam_learning_rate': 0.004977473142448345}. Best is trial 121 with value: 0.9981527328491211.
Trial 147 finished with value: 0.5147783160209656 and parameters: {'n_layers': 1, 'weight_decay': 0.00010592828957003096, 'n_units_l0': 7, 'optimizer': 'Adam', 'adam_learning_rate': 0.008010167962113571}. Best is trial 121 with value: 0.9981527328491211.
Trial 148 finished with value: 0.5147783160209656 and parameters: {'n_layers': 1, 'weight_decay': 0.0006000218325217626, 'n_units_l0': 10, 'optimizer': 'Adam', 'adam_learning_rate': 0.0026157320837081255}. Best is trial 121 with value: 0.9981527328491211.
Trial 149 finished with value: 0.5147783160209656 and parameters: {'n_layers': 1, 'weight_decay': 0.00034403467859968074, 'n_units_l0': 9, 'optimizer': 'Adam', 'adam_learning_rate': 0.00138226783527076}. Best is trial 121 with value: 0.9981527328491211.
Trial 150 finished with value: 0.996921181678772 and parameters: {'n_layers': 1, 'weight_decay': 0.00017005687220521937, 'n_units_l0': 8, 'optimizer': 'Adam', 'adam_learning_rate': 0.0023624236675910135}. Best is trial 121 with value: 0.9981527328491211.
Trial 151 finished with value: 0.5147783160209656 and parameters: {'n_layers': 1, 'weight_decay': 0.0001619815725255632, 'n_units_l0': 8, 'optimizer': 'Adam', 'adam_learning_rate': 0.0022199175329534826}. Best is trial 121 with value: 0.9981527328491211.
Trial 152 finished with value: 0.5147783160209656 and parameters: {'n_layers': 1, 'weight_decay': 0.00025396765308320125, 'n_units_l0': 10, 'optimizer': 'Adam', 'adam_learning_rate': 0.0017221614165866214}. Best is trial 121 with value: 0.9981527328491211.
Trial 153 finished with value: 0.9975369572639465 and parameters: {'n_layers': 1, 'weight_decay': 6.639674068406094e-05, 'n_units_l0': 8, 'optimizer': 'Adam', 'adam_learning_rate': 0.002232422133491957}. Best is trial 121 with value: 0.9981527328491211.
Trial 154 finished with value: 0.5147783160209656 and parameters: {'n_layers': 1, 'weight_decay': 7.363340423142182e-05, 'n_units_l0': 8, 'optimizer': 'Adam', 'adam_learning_rate': 0.0031980137418790135}. Best is trial 121 with value: 0.9981527328491211.
Trial 155 finished with value: 0.5147783160209656 and parameters: {'n_layers': 1, 'weight_decay': 0.00047958469006447764, 'n_units_l0': 7, 'optimizer': 'Adam', 'adam_learning_rate': 0.0026191381728731386}. Best is trial 121 with value: 0.9981527328491211.
Trial 156 finished with value: 0.5166256427764893 and parameters: {'n_layers': 1, 'weight_decay': 0.0006548721201509291, 'n_units_l0': 9, 'optimizer': 'RMSprop', 'rmsprop_learning_rate': 0.000492045581968624, 'rmsprop_weight_decay': 0.853109047264125, 'rmsprop_momentum': 4.7652452615490765e-05}. Best is trial 121 with value: 0.9981527328491211.
Trial 157 finished with value: 0.5147783160209656 and parameters: {'n_layers': 1, 'weight_decay': 0.0003449130963496538, 'n_units_l0': 8, 'optimizer': 'Adam', 'adam_learning_rate': 0.005607662382490652}. Best is trial 121 with value: 0.9981527328491211.
Trial 158 finished with value: 0.5147783160209656 and parameters: {'n_layers': 1, 'weight_decay': 0.00010824484581550817, 'n_units_l0': 10, 'optimizer': 'Adam', 'adam_learning_rate': 0.003928619968710208}. Best is trial 121 with value: 0.9981527328491211.
Trial 159 finished with value: 0.9895319938659668 and parameters: {'n_layers': 1, 'weight_decay': 0.00019862876030605827, 'n_units_l0': 7, 'optimizer': 'Adam', 'adam_learning_rate': 0.0020121019313980473}. Best is trial 121 with value: 0.9981527328491211.
Trial 160 finished with value: 0.9926108121871948 and parameters: {'n_layers': 1, 'weight_decay': 5.253274093084927e-05, 'n_units_l0': 8, 'optimizer': 'Adam', 'adam_learning_rate': 0.002354602152040241}. Best is trial 121 with value: 0.9981527328491211.
Trial 161 finished with value: 0.5147783160209656 and parameters: {'n_layers': 1, 'weight_decay': 5.4235818475409665e-05, 'n_units_l0': 8, 'optimizer': 'Adam', 'adam_learning_rate': 0.002497072749449593}. Best is trial 121 with value: 0.9981527328491211.
Trial 162 finished with value: 0.5147783160209656 and parameters: {'n_layers': 1, 'weight_decay': 4.1647550153087945e-05, 'n_units_l0': 9, 'optimizer': 'Adam', 'adam_learning_rate': 0.003022093632576977}. Best is trial 121 with value: 0.9981527328491211.
Trial 163 finished with value: 0.9913793206214905 and parameters: {'n_layers': 1, 'weight_decay': 2.323004512378313e-05, 'n_units_l0': 10, 'optimizer': 'Adam', 'adam_learning_rate': 0.0021771837423816337}. Best is trial 121 with value: 0.9981527328491211.
Trial 164 finished with value: 0.985837459564209 and parameters: {'n_layers': 1, 'weight_decay': 6.836065714646836e-05, 'n_units_l0': 10, 'optimizer': 'Adam', 'adam_learning_rate': 0.0018326587581702807}. Best is trial 121 with value: 0.9981527328491211.
