A new study created in memory with name: no-name-023a7331-8f85-4770-8f52-fe949ce95efb
Trial 0 finished with value: 0.5147783160209656 and parameters: {'n_layers': 1, 'weight_decay': 3.549164071520202e-09, 'n_units_l0': 6, 'optimizer': 'Adam', 'adam_learning_rate': 1.622774455160084e-05}. Best is trial 0 with value: 0.5147783160209656.
Trial 1 finished with value: 0.5147783160209656 and parameters: {'n_layers': 1, 'weight_decay': 4.5764550217966354e-07, 'n_units_l0': 2, 'optimizer': 'SGD', 'sgd_opt_learning_rate': 6.540599912590801e-05, 'sgd_opt_momentum': 0.00015709565836192119}. Best is trial 0 with value: 0.5147783160209656.
Trial 2 finished with value: 0.5147783160209656 and parameters: {'n_layers': 1, 'weight_decay': 1.5939731481300022e-05, 'n_units_l0': 9, 'optimizer': 'Adam', 'adam_learning_rate': 4.057991791671526e-05}. Best is trial 0 with value: 0.5147783160209656.
Trial 3 finished with value: 0.5147783160209656 and parameters: {'n_layers': 1, 'weight_decay': 3.1994625175295077e-09, 'n_units_l0': 1, 'optimizer': 'RMSprop', 'rmsprop_learning_rate': 0.0011246141386374146, 'rmsprop_weight_decay': 0.9784662106210793, 'rmsprop_momentum': 0.002575193004185245}. Best is trial 0 with value: 0.5147783160209656.
Trial 4 finished with value: 0.5147783160209656 and parameters: {'n_layers': 1, 'weight_decay': 4.589537837278799e-07, 'n_units_l0': 4, 'optimizer': 'SGD', 'sgd_opt_learning_rate': 0.001286802303553717, 'sgd_opt_momentum': 1.4895686056642686e-05}. Best is trial 0 with value: 0.5147783160209656.
Trial 5 finished with value: 0.5147783160209656 and parameters: {'n_layers': 1, 'weight_decay': 1.1389159904352606e-07, 'n_units_l0': 1, 'optimizer': 'RMSprop', 'rmsprop_learning_rate': 0.0010863659792570183, 'rmsprop_weight_decay': 0.8939761261294327, 'rmsprop_momentum': 0.0001442919743553186}. Best is trial 0 with value: 0.5147783160209656.
Trial 6 finished with value: 0.5147783160209656 and parameters: {'n_layers': 1, 'weight_decay': 0.0002445946613724053, 'n_units_l0': 1, 'optimizer': 'SGD', 'sgd_opt_learning_rate': 0.00018746024306022028, 'sgd_opt_momentum': 0.0005338623364928871}. Best is trial 0 with value: 0.5147783160209656.
Trial 7 finished with value: 0.5147783160209656 and parameters: {'n_layers': 1, 'weight_decay': 1.597344517155162e-10, 'n_units_l0': 1, 'optimizer': 'RMSprop', 'rmsprop_learning_rate': 0.029362282437231674, 'rmsprop_weight_decay': 0.869637890789117, 'rmsprop_momentum': 8.649495584037021e-05}. Best is trial 0 with value: 0.5147783160209656.
Trial 8 finished with value: 0.5147783160209656 and parameters: {'n_layers': 1, 'weight_decay': 1.381561230589253e-10, 'n_units_l0': 9, 'optimizer': 'RMSprop', 'rmsprop_learning_rate': 5.081339848789455e-05, 'rmsprop_weight_decay': 0.9063676836233272, 'rmsprop_momentum': 1.484885666286295e-05}. Best is trial 0 with value: 0.5147783160209656.
Trial 9 finished with value: 0.5147783160209656 and parameters: {'n_layers': 1, 'weight_decay': 7.22516358205311e-06, 'n_units_l0': 4, 'optimizer': 'Adam', 'adam_learning_rate': 0.000250393988622853}. Best is trial 0 with value: 0.5147783160209656.
Trial 10 finished with value: 0.5147783160209656 and parameters: {'n_layers': 1, 'weight_decay': 5.871964087708359e-09, 'n_units_l0': 5, 'optimizer': 'Adam', 'adam_learning_rate': 0.037789700842850146}. Best is trial 0 with value: 0.5147783160209656.
Trial 11 finished with value: 0.4852216839790344 and parameters: {'n_layers': 1, 'weight_decay': 1.2698830817950066e-07, 'n_units_l0': 2, 'optimizer': 'SGD', 'sgd_opt_learning_rate': 1.0320943551348957e-05, 'sgd_opt_momentum': 0.08178109141197022}. Best is trial 0 with value: 0.5147783160209656.
Trial 12 finished with value: 0.5147783160209656 and parameters: {'n_layers': 1, 'weight_decay': 8.062325909917678e-09, 'n_units_l0': 2, 'optimizer': 'SGD', 'sgd_opt_learning_rate': 0.049349423947760644, 'sgd_opt_momentum': 0.00012835249887501636}. Best is trial 0 with value: 0.5147783160209656.
Trial 13 finished with value: 0.5147783160209656 and parameters: {'n_layers': 1, 'weight_decay': 1.6775881573701623e-06, 'n_units_l0': 3, 'optimizer': 'Adam', 'adam_learning_rate': 1.168603229435302e-05}. Best is trial 0 with value: 0.5147783160209656.
Trial 14 finished with value: 0.4852216839790344 and parameters: {'n_layers': 1, 'weight_decay': 2.5883872759360042e-08, 'n_units_l0': 2, 'optimizer': 'SGD', 'sgd_opt_learning_rate': 3.221908456887005e-05, 'sgd_opt_momentum': 0.014424754779086781}. Best is trial 0 with value: 0.5147783160209656.
Trial 15 finished with value: 0.5147783160209656 and parameters: {'n_layers': 1, 'weight_decay': 1.0346886966685442e-09, 'n_units_l0': 6, 'optimizer': 'Adam', 'adam_learning_rate': 0.0044815360412911185}. Best is trial 0 with value: 0.5147783160209656.
Trial 16 finished with value: 0.5147783160209656 and parameters: {'n_layers': 1, 'weight_decay': 4.647424645501092e-08, 'n_units_l0': 3, 'optimizer': 'SGD', 'sgd_opt_learning_rate': 0.0012044830547602772, 'sgd_opt_momentum': 3.9285234837572254e-05}. Best is trial 0 with value: 0.5147783160209656.
Trial 17 finished with value: 0.8004925847053528 and parameters: {'n_layers': 1, 'weight_decay': 0.0009959675354223937, 'n_units_l0': 6, 'optimizer': 'Adam', 'adam_learning_rate': 0.0004972983706018702}. Best is trial 17 with value: 0.8004925847053528.
Trial 18 finished with value: 0.9298029541969299 and parameters: {'n_layers': 1, 'weight_decay': 0.0005831068944064922, 'n_units_l0': 7, 'optimizer': 'Adam', 'adam_learning_rate': 0.0004315596983315579}. Best is trial 18 with value: 0.9298029541969299.
Trial 19 finished with value: 0.953201949596405 and parameters: {'n_layers': 1, 'weight_decay': 0.0008045200363722639, 'n_units_l0': 10, 'optimizer': 'Adam', 'adam_learning_rate': 0.0008289522825144911}. Best is trial 19 with value: 0.953201949596405.
Trial 20 finished with value: 0.5147783160209656 and parameters: {'n_layers': 1, 'weight_decay': 6.987873256060542e-05, 'n_units_l0': 10, 'optimizer': 'Adam', 'adam_learning_rate': 0.0031240105168232443}. Best is trial 19 with value: 0.953201949596405.
Trial 21 finished with value: 0.5147783160209656 and parameters: {'n_layers': 1, 'weight_decay': 0.0007955591409198186, 'n_units_l0': 7, 'optimizer': 'Adam', 'adam_learning_rate': 0.0003688936429049193}. Best is trial 19 with value: 0.953201949596405.
Trial 22 finished with value: 0.9427340030670166 and parameters: {'n_layers': 1, 'weight_decay': 0.0006973104068925637, 'n_units_l0': 7, 'optimizer': 'Adam', 'adam_learning_rate': 0.0007787823008193435}. Best is trial 19 with value: 0.953201949596405.
Trial 23 finished with value: 0.9944581389427185 and parameters: {'n_layers': 1, 'weight_decay': 5.287520985591742e-05, 'n_units_l0': 8, 'optimizer': 'Adam', 'adam_learning_rate': 0.0019394158424736615}. Best is trial 23 with value: 0.9944581389427185.
Trial 24 finished with value: 0.5147783160209656 and parameters: {'n_layers': 1, 'weight_decay': 4.6872359981192364e-05, 'n_units_l0': 9, 'optimizer': 'Adam', 'adam_learning_rate': 0.005071652207598089}. Best is trial 23 with value: 0.9944581389427185.
Trial 25 finished with value: 0.5147783160209656 and parameters: {'n_layers': 1, 'weight_decay': 0.00011711917834933855, 'n_units_l0': 4, 'optimizer': 'Adam', 'adam_learning_rate': 0.0015369779970459375}. Best is trial 23 with value: 0.9944581389427185.
Trial 26 finished with value: 0.5147783160209656 and parameters: {'n_layers': 1, 'weight_decay': 1.5341396312341998e-05, 'n_units_l0': 8, 'optimizer': 'Adam', 'adam_learning_rate': 0.01659824481485173}. Best is trial 23 with value: 0.9944581389427185.
Trial 27 finished with value: 0.5147783160209656 and parameters: {'n_layers': 1, 'weight_decay': 0.00020778073951988475, 'n_units_l0': 5, 'optimizer': 'Adam', 'adam_learning_rate': 7.765017898474698e-05}. Best is trial 23 with value: 0.9944581389427185.
Trial 28 finished with value: 0.9901477694511414 and parameters: {'n_layers': 1, 'weight_decay': 2.8309688990789836e-05, 'n_units_l0': 10, 'optimizer': 'Adam', 'adam_learning_rate': 0.0011735659388660015}. Best is trial 23 with value: 0.9944581389427185.
Trial 29 finished with value: 0.5147783160209656 and parameters: {'n_layers': 1, 'weight_decay': 3.924031338859323e-06, 'n_units_l0': 10, 'optimizer': 'Adam', 'adam_learning_rate': 0.0016423318969061068}. Best is trial 23 with value: 0.9944581389427185.
Trial 30 finished with value: 0.5147783160209656 and parameters: {'n_layers': 1, 'weight_decay': 2.765085255639196e-05, 'n_units_l0': 5, 'optimizer': 'Adam', 'adam_learning_rate': 0.009162404696944682}. Best is trial 23 with value: 0.9944581389427185.
Trial 31 finished with value: 0.9698275923728943 and parameters: {'n_layers': 1, 'weight_decay': 0.00034816266857052924, 'n_units_l0': 7, 'optimizer': 'Adam', 'adam_learning_rate': 0.0009993875087344177}. Best is trial 23 with value: 0.9944581389427185.
Trial 32 finished with value: 0.5147783160209656 and parameters: {'n_layers': 1, 'weight_decay': 0.000214832325147702, 'n_units_l0': 8, 'optimizer': 'Adam', 'adam_learning_rate': 0.00017034107100707144}. Best is trial 23 with value: 0.9944581389427185.
Trial 33 finished with value: 0.5147783160209656 and parameters: {'n_layers': 1, 'weight_decay': 7.370257301779538e-05, 'n_units_l0': 10, 'optimizer': 'Adam', 'adam_learning_rate': 0.0017494328512616488}. Best is trial 23 with value: 0.9944581389427185.
Trial 34 finished with value: 0.985837459564209 and parameters: {'n_layers': 1, 'weight_decay': 1.3329422556995159e-06, 'n_units_l0': 8, 'optimizer': 'Adam', 'adam_learning_rate': 0.0008338247049196507}. Best is trial 23 with value: 0.9944581389427185.
Trial 35 finished with value: 0.4852216839790344 and parameters: {'n_layers': 1, 'weight_decay': 1.2295720031220789e-06, 'n_units_l0': 6, 'optimizer': 'RMSprop', 'rmsprop_learning_rate': 0.09765568084969917, 'rmsprop_weight_decay': 0.976341425327238, 'rmsprop_momentum': 0.08648312259584764}. Best is trial 23 with value: 0.9944581389427185.
Trial 36 finished with value: 0.5147783160209656 and parameters: {'n_layers': 1, 'weight_decay': 7.767900187511579e-06, 'n_units_l0': 8, 'optimizer': 'Adam', 'adam_learning_rate': 0.002614680925341414}. Best is trial 23 with value: 0.9944581389427185.
Trial 37 finished with value: 0.5147783160209656 and parameters: {'n_layers': 1, 'weight_decay': 1.0634890625644824e-06, 'n_units_l0': 3, 'optimizer': 'Adam', 'adam_learning_rate': 0.00015019578949182851}. Best is trial 23 with value: 0.9944581389427185.
Trial 38 finished with value: 0.5147783160209656 and parameters: {'n_layers': 1, 'weight_decay': 2.5414958349974246e-05, 'n_units_l0': 6, 'optimizer': 'RMSprop', 'rmsprop_learning_rate': 1.2099211214546984e-05, 'rmsprop_weight_decay': 0.9368582805694481, 'rmsprop_momentum': 0.08610422662810358}. Best is trial 23 with value: 0.9944581389427185.
Trial 39 finished with value: 0.5147783160209656 and parameters: {'n_layers': 1, 'weight_decay': 3.4042536773279345e-06, 'n_units_l0': 4, 'optimizer': 'Adam', 'adam_learning_rate': 0.0009770028800579363}. Best is trial 23 with value: 0.9944581389427185.
Trial 40 finished with value: 0.5147783160209656 and parameters: {'n_layers': 1, 'weight_decay': 3.0564193204659766e-07, 'n_units_l0': 8, 'optimizer': 'RMSprop', 'rmsprop_learning_rate': 0.009150945548153802, 'rmsprop_weight_decay': 0.8505763406134852, 'rmsprop_momentum': 0.005211477650191649}. Best is trial 23 with value: 0.9944581389427185.
Trial 41 finished with value: 0.9815270900726318 and parameters: {'n_layers': 1, 'weight_decay': 0.0002995788578092818, 'n_units_l0': 10, 'optimizer': 'Adam', 'adam_learning_rate': 0.0008267729531897312}. Best is trial 23 with value: 0.9944581389427185.
Trial 42 finished with value: 0.9759852290153503 and parameters: {'n_layers': 1, 'weight_decay': 0.00028541530340153736, 'n_units_l0': 7, 'optimizer': 'Adam', 'adam_learning_rate': 0.0007319238313325442}. Best is trial 23 with value: 0.9944581389427185.
Trial 43 finished with value: 0.9722906351089478 and parameters: {'n_layers': 1, 'weight_decay': 0.00011322051879042536, 'n_units_l0': 9, 'optimizer': 'Adam', 'adam_learning_rate': 0.0004971471212712092}. Best is trial 23 with value: 0.9944581389427185.
Trial 44 finished with value: 0.5147783160209656 and parameters: {'n_layers': 1, 'weight_decay': 1.1524903416560226e-05, 'n_units_l0': 5, 'optimizer': 'Adam', 'adam_learning_rate': 0.001988064973204555}. Best is trial 23 with value: 0.9944581389427185.
Trial 45 finished with value: 0.5147783160209656 and parameters: {'n_layers': 1, 'weight_decay': 2.9662695147833185e-05, 'n_units_l0': 8, 'optimizer': 'Adam', 'adam_learning_rate': 0.00911325106641413}. Best is trial 23 with value: 0.9944581389427185.
Trial 46 finished with value: 0.9815270900726318 and parameters: {'n_layers': 1, 'weight_decay': 0.0003171198327107706, 'n_units_l0': 7, 'optimizer': 'Adam', 'adam_learning_rate': 0.0006922793982611624}. Best is trial 23 with value: 0.9944581389427185.
Trial 47 finished with value: 0.9236453175544739 and parameters: {'n_layers': 1, 'weight_decay': 0.00013636183826874776, 'n_units_l0': 9, 'optimizer': 'SGD', 'sgd_opt_learning_rate': 0.08173425422829236, 'sgd_opt_momentum': 0.004524976037249594}. Best is trial 23 with value: 0.9944581389427185.
Trial 48 finished with value: 0.5178571343421936 and parameters: {'n_layers': 1, 'weight_decay': 4.312039118504547e-05, 'n_units_l0': 6, 'optimizer': 'Adam', 'adam_learning_rate': 0.000254460004635476}. Best is trial 23 with value: 0.9944581389427185.
Trial 49 finished with value: 0.5147783160209656 and parameters: {'n_layers': 1, 'weight_decay': 3.057260713826219e-06, 'n_units_l0': 9, 'optimizer': 'RMSprop', 'rmsprop_learning_rate': 0.00013439129058928105, 'rmsprop_weight_decay': 0.9409027714336091, 'rmsprop_momentum': 0.008702794217883916}. Best is trial 23 with value: 0.9944581389427185.
Trial 50 finished with value: 0.5147783160209656 and parameters: {'n_layers': 1, 'weight_decay': 5.094029629654241e-07, 'n_units_l0': 7, 'optimizer': 'SGD', 'sgd_opt_learning_rate': 0.009454104308217538, 'sgd_opt_momentum': 0.0023312877649312976}. Best is trial 23 with value: 0.9944581389427185.
Trial 51 finished with value: 0.9685960412025452 and parameters: {'n_layers': 1, 'weight_decay': 0.00032033165683016614, 'n_units_l0': 7, 'optimizer': 'Adam', 'adam_learning_rate': 0.000716085398369918}. Best is trial 23 with value: 0.9944581389427185.
Trial 52 finished with value: 0.5147783160209656 and parameters: {'n_layers': 1, 'weight_decay': 6.706435207120283e-05, 'n_units_l0': 8, 'optimizer': 'Adam', 'adam_learning_rate': 0.0006135530176079861}. Best is trial 23 with value: 0.9944581389427185.
Trial 53 finished with value: 0.9956896305084229 and parameters: {'n_layers': 1, 'weight_decay': 0.0003760855159045397, 'n_units_l0': 10, 'optimizer': 'Adam', 'adam_learning_rate': 0.0013331436853682588}. Best is trial 53 with value: 0.9956896305084229.
Trial 54 finished with value: 0.5147783160209656 and parameters: {'n_layers': 1, 'weight_decay': 0.0005318602776104999, 'n_units_l0': 10, 'optimizer': 'Adam', 'adam_learning_rate': 0.0014503156643388404}. Best is trial 53 with value: 0.9956896305084229.
Trial 55 finished with value: 0.9907635450363159 and parameters: {'n_layers': 1, 'weight_decay': 0.00015853561592441345, 'n_units_l0': 9, 'optimizer': 'Adam', 'adam_learning_rate': 0.003811884735033046}. Best is trial 53 with value: 0.9956896305084229.
Trial 56 finished with value: 0.5147783160209656 and parameters: {'n_layers': 1, 'weight_decay': 0.00011278897164698607, 'n_units_l0': 9, 'optimizer': 'Adam', 'adam_learning_rate': 0.004101429323530475}. Best is trial 53 with value: 0.9956896305084229.
Trial 57 finished with value: 0.5147783160209656 and parameters: {'n_layers': 1, 'weight_decay': 7.046698641180679e-06, 'n_units_l0': 10, 'optimizer': 'Adam', 'adam_learning_rate': 0.006274864589369024}. Best is trial 53 with value: 0.9956896305084229.
Trial 58 finished with value: 0.5147783160209656 and parameters: {'n_layers': 1, 'weight_decay': 1.534918212763041e-05, 'n_units_l0': 8, 'optimizer': 'Adam', 'adam_learning_rate': 0.0025925905112956686}. Best is trial 53 with value: 0.9956896305084229.
Trial 59 finished with value: 0.5147783160209656 and parameters: {'n_layers': 1, 'weight_decay': 0.00016265605846624284, 'n_units_l0': 9, 'optimizer': 'SGD', 'sgd_opt_learning_rate': 0.005958306536064552, 'sgd_opt_momentum': 0.09702238196875898}. Best is trial 53 with value: 0.9956896305084229.
Trial 60 finished with value: 0.5166256427764893 and parameters: {'n_layers': 1, 'weight_decay': 7.452499088281847e-08, 'n_units_l0': 6, 'optimizer': 'Adam', 'adam_learning_rate': 0.0003012718968354718}. Best is trial 53 with value: 0.9956896305084229.
Trial 61 finished with value: 0.5147783160209656 and parameters: {'n_layers': 1, 'weight_decay': 0.0004630504008345079, 'n_units_l0': 10, 'optimizer': 'Adam', 'adam_learning_rate': 0.0012086274988364922}. Best is trial 53 with value: 0.9956896305084229.
Trial 62 finished with value: 0.5147783160209656 and parameters: {'n_layers': 1, 'weight_decay': 5.6256125836113696e-05, 'n_units_l0': 9, 'optimizer': 'Adam', 'adam_learning_rate': 0.0026772639885401955}. Best is trial 53 with value: 0.9956896305084229.
Trial 63 finished with value: 0.9944581389427185 and parameters: {'n_layers': 1, 'weight_decay': 0.0003183548593691671, 'n_units_l0': 8, 'optimizer': 'Adam', 'adam_learning_rate': 0.001211452419803625}. Best is trial 53 with value: 0.9956896305084229.
Trial 64 finished with value: 0.5147783160209656 and parameters: {'n_layers': 1, 'weight_decay': 8.83407354327225e-05, 'n_units_l0': 8, 'optimizer': 'Adam', 'adam_learning_rate': 0.0011438050166083314}. Best is trial 53 with value: 0.9956896305084229.
Trial 65 finished with value: 0.5147783160209656 and parameters: {'n_layers': 1, 'weight_decay': 8.680351588792269e-10, 'n_units_l0': 9, 'optimizer': 'Adam', 'adam_learning_rate': 0.0033158823839575095}. Best is trial 53 with value: 0.9956896305084229.
Trial 66 finished with value: 0.5147783160209656 and parameters: {'n_layers': 1, 'weight_decay': 3.488685176146856e-05, 'n_units_l0': 10, 'optimizer': 'Adam', 'adam_learning_rate': 0.04278184375507822}. Best is trial 53 with value: 0.9956896305084229.
Trial 67 finished with value: 0.5147783160209656 and parameters: {'n_layers': 1, 'weight_decay': 0.0009323633584510235, 'n_units_l0': 8, 'optimizer': 'Adam', 'adam_learning_rate': 2.9443672564262766e-05}. Best is trial 53 with value: 0.9956896305084229.
Trial 68 finished with value: 0.8645319938659668 and parameters: {'n_layers': 1, 'weight_decay': 0.00020360810459543115, 'n_units_l0': 7, 'optimizer': 'Adam', 'adam_learning_rate': 0.0004852812568695207}. Best is trial 53 with value: 0.9956896305084229.
Trial 69 finished with value: 0.5147783160209656 and parameters: {'n_layers': 1, 'weight_decay': 1.9308803343677098e-08, 'n_units_l0': 6, 'optimizer': 'RMSprop', 'rmsprop_learning_rate': 0.005648193356119128, 'rmsprop_weight_decay': 0.952266205275423, 'rmsprop_momentum': 0.000311660410937931}. Best is trial 53 with value: 0.9956896305084229.
Trial 70 finished with value: 0.5147783160209656 and parameters: {'n_layers': 1, 'weight_decay': 0.0001557005022926002, 'n_units_l0': 10, 'optimizer': 'Adam', 'adam_learning_rate': 0.07378914292664772}. Best is trial 53 with value: 0.9956896305084229.
Trial 71 finished with value: 0.5147783160209656 and parameters: {'n_layers': 1, 'weight_decay': 0.0004104279764150531, 'n_units_l0': 7, 'optimizer': 'Adam', 'adam_learning_rate': 0.002086116658233789}. Best is trial 53 with value: 0.9956896305084229.
Trial 72 finished with value: 0.5147783160209656 and parameters: {'n_layers': 1, 'weight_decay': 0.0002807325958625001, 'n_units_l0': 9, 'optimizer': 'Adam', 'adam_learning_rate': 0.0011566278398097312}. Best is trial 53 with value: 0.9956896305084229.
Trial 73 finished with value: 0.9741379022598267 and parameters: {'n_layers': 1, 'weight_decay': 0.000591139983529722, 'n_units_l0': 8, 'optimizer': 'Adam', 'adam_learning_rate': 0.0005735161582941182}. Best is trial 53 with value: 0.9956896305084229.
Trial 74 finished with value: 0.9766010046005249 and parameters: {'n_layers': 1, 'weight_decay': 2.4524968790163845e-05, 'n_units_l0': 7, 'optimizer': 'Adam', 'adam_learning_rate': 0.00035734281838979687}. Best is trial 53 with value: 0.9956896305084229.
Trial 75 finished with value: 0.9802955389022827 and parameters: {'n_layers': 1, 'weight_decay': 8.048897324951763e-05, 'n_units_l0': 9, 'optimizer': 'Adam', 'adam_learning_rate': 0.0008125893664662748}. Best is trial 53 with value: 0.9956896305084229.
Trial 76 finished with value: 0.5147783160209656 and parameters: {'n_layers': 1, 'weight_decay': 0.0002115174298435678, 'n_units_l0': 5, 'optimizer': 'Adam', 'adam_learning_rate': 0.005878230207172073}. Best is trial 53 with value: 0.9956896305084229.
Trial 77 finished with value: 0.9784482717514038 and parameters: {'n_layers': 1, 'weight_decay': 0.0004434852219538687, 'n_units_l0': 10, 'optimizer': 'Adam', 'adam_learning_rate': 0.0016342207246216858}. Best is trial 53 with value: 0.9956896305084229.
Trial 78 finished with value: 0.5147783160209656 and parameters: {'n_layers': 1, 'weight_decay': 5.1371932718381215e-05, 'n_units_l0': 8, 'optimizer': 'SGD', 'sgd_opt_learning_rate': 0.0004226990585712029, 'sgd_opt_momentum': 0.01677769306965359}. Best is trial 53 with value: 0.9956896305084229.
Trial 79 finished with value: 0.5147783160209656 and parameters: {'n_layers': 1, 'weight_decay': 2.3079916931551115e-07, 'n_units_l0': 9, 'optimizer': 'Adam', 'adam_learning_rate': 0.00018459176058179306}. Best is trial 53 with value: 0.9956896305084229.
Trial 80 finished with value: 0.9956896305084229 and parameters: {'n_layers': 1, 'weight_decay': 0.000992132480604473, 'n_units_l0': 10, 'optimizer': 'Adam', 'adam_learning_rate': 0.003787968162342383}. Best is trial 53 with value: 0.9956896305084229.
