Trial 165 finished with value: 0.996921181678772 and parameters: {'n_layers': 1, 'weight_decay': 3.0878987574580834e-05, 'n_units_l0': 10, 'optimizer': 'Adam', 'adam_learning_rate': 0.0021873691987106133}. Best is trial 121 with value: 0.9981527328491211.
Trial 166 finished with value: 0.9901477694511414 and parameters: {'n_layers': 1, 'weight_decay': 0.0004894428989280499, 'n_units_l0': 9, 'optimizer': 'Adam', 'adam_learning_rate': 0.0013224016790957655}. Best is trial 121 with value: 0.9981527328491211.
Trial 167 finished with value: 0.5147783160209656 and parameters: {'n_layers': 1, 'weight_decay': 1.1395797629342512e-05, 'n_units_l0': 9, 'optimizer': 'Adam', 'adam_learning_rate': 0.0011194516410573032}. Best is trial 121 with value: 0.9981527328491211.
Trial 168 finished with value: 0.988916277885437 and parameters: {'n_layers': 1, 'weight_decay': 3.868460542449755e-05, 'n_units_l0': 10, 'optimizer': 'Adam', 'adam_learning_rate': 0.000874690816598615}. Best is trial 121 with value: 0.9981527328491211.
Trial 169 finished with value: 0.9802955389022827 and parameters: {'n_layers': 1, 'weight_decay': 3.770079918219565e-09, 'n_units_l0': 8, 'optimizer': 'Adam', 'adam_learning_rate': 0.0015677556918156337}. Best is trial 121 with value: 0.9981527328491211.
Trial 170 finished with value: 0.5147783160209656 and parameters: {'n_layers': 1, 'weight_decay': 0.0007933425263252961, 'n_units_l0': 1, 'optimizer': 'Adam', 'adam_learning_rate': 0.0021188283720336627}. Best is trial 121 with value: 0.9981527328491211.
Trial 171 finished with value: 0.5147783160209656 and parameters: {'n_layers': 1, 'weight_decay': 5.4137061264861274e-05, 'n_units_l0': 10, 'optimizer': 'Adam', 'adam_learning_rate': 0.0022125513878304675}. Best is trial 121 with value: 0.9981527328491211.
Trial 172 finished with value: 0.5147783160209656 and parameters: {'n_layers': 1, 'weight_decay': 2.947266273368787e-05, 'n_units_l0': 10, 'optimizer': 'Adam', 'adam_learning_rate': 0.002661087995784182}. Best is trial 121 with value: 0.9981527328491211.
Trial 173 finished with value: 0.9907635450363159 and parameters: {'n_layers': 1, 'weight_decay': 7.93843191924868e-05, 'n_units_l0': 9, 'optimizer': 'Adam', 'adam_learning_rate': 0.0017028403971205528}. Best is trial 121 with value: 0.9981527328491211.
Trial 174 finished with value: 0.996921181678772 and parameters: {'n_layers': 1, 'weight_decay': 1.730499770461949e-05, 'n_units_l0': 10, 'optimizer': 'Adam', 'adam_learning_rate': 0.003168505856317518}. Best is trial 121 with value: 0.9981527328491211.
Trial 175 finished with value: 0.9901477694511414 and parameters: {'n_layers': 1, 'weight_decay': 1.713497774414253e-05, 'n_units_l0': 9, 'optimizer': 'Adam', 'adam_learning_rate': 0.0032919284124212503}. Best is trial 121 with value: 0.9981527328491211.
Trial 176 finished with value: 0.5147783160209656 and parameters: {'n_layers': 1, 'weight_decay': 2.8491801722001394e-05, 'n_units_l0': 10, 'optimizer': 'SGD', 'sgd_opt_learning_rate': 0.00017242826939460238, 'sgd_opt_momentum': 0.019079937839661325}. Best is trial 121 with value: 0.9981527328491211.
Trial 177 finished with value: 0.5147783160209656 and parameters: {'n_layers': 1, 'weight_decay': 0.00030673398801129453, 'n_units_l0': 4, 'optimizer': 'Adam', 'adam_learning_rate': 0.0013131920775815648}. Best is trial 121 with value: 0.9981527328491211.
Trial 178 finished with value: 0.5147783160209656 and parameters: {'n_layers': 1, 'weight_decay': 0.00011610084696378629, 'n_units_l0': 8, 'optimizer': 'Adam', 'adam_learning_rate': 0.004239520979030504}. Best is trial 121 with value: 0.9981527328491211.
Trial 179 finished with value: 0.991995096206665 and parameters: {'n_layers': 1, 'weight_decay': 0.0005801769051814301, 'n_units_l0': 9, 'optimizer': 'Adam', 'adam_learning_rate': 0.003495211940232004}. Best is trial 121 with value: 0.9981527328491211.
Trial 180 finished with value: 0.9913793206214905 and parameters: {'n_layers': 1, 'weight_decay': 0.0005689705183502473, 'n_units_l0': 9, 'optimizer': 'Adam', 'adam_learning_rate': 0.003457641302468556}. Best is trial 121 with value: 0.9981527328491211.
Trial 181 finished with value: 0.5147783160209656 and parameters: {'n_layers': 1, 'weight_decay': 0.0007654689140271629, 'n_units_l0': 10, 'optimizer': 'Adam', 'adam_learning_rate': 0.00286257535004006}. Best is trial 121 with value: 0.9981527328491211.
Trial 182 finished with value: 0.5147783160209656 and parameters: {'n_layers': 1, 'weight_decay': 0.0003965495119887738, 'n_units_l0': 9, 'optimizer': 'Adam', 'adam_learning_rate': 0.004567491571470686}. Best is trial 121 with value: 0.9981527328491211.
Trial 183 finished with value: 0.9975369572639465 and parameters: {'n_layers': 1, 'weight_decay': 0.000950476248577859, 'n_units_l0': 10, 'optimizer': 'Adam', 'adam_learning_rate': 0.002397919258156903}. Best is trial 121 with value: 0.9981527328491211.
Trial 184 finished with value: 0.988916277885437 and parameters: {'n_layers': 1, 'weight_decay': 0.0009024396172745585, 'n_units_l0': 10, 'optimizer': 'Adam', 'adam_learning_rate': 0.0023894088159304053}. Best is trial 121 with value: 0.9981527328491211.
Trial 185 finished with value: 0.5147783160209656 and parameters: {'n_layers': 1, 'weight_decay': 0.0005649603788856471, 'n_units_l0': 10, 'optimizer': 'Adam', 'adam_learning_rate': 0.0037737500003678388}. Best is trial 121 with value: 0.9981527328491211.
Trial 186 finished with value: 0.9963054060935974 and parameters: {'n_layers': 1, 'weight_decay': 0.0009586530957904889, 'n_units_l0': 9, 'optimizer': 'Adam', 'adam_learning_rate': 0.003057394380350012}. Best is trial 121 with value: 0.9981527328491211.
Trial 187 finished with value: 0.5147783160209656 and parameters: {'n_layers': 1, 'weight_decay': 0.0007361061717704523, 'n_units_l0': 9, 'optimizer': 'Adam', 'adam_learning_rate': 0.003058336832283986}. Best is trial 121 with value: 0.9981527328491211.
Trial 188 finished with value: 0.4852216839790344 and parameters: {'n_layers': 1, 'weight_decay': 0.000849375452609874, 'n_units_l0': 2, 'optimizer': 'RMSprop', 'rmsprop_learning_rate': 0.09280931403803994, 'rmsprop_weight_decay': 0.9237927724529568, 'rmsprop_momentum': 0.0005244297507834713}. Best is trial 121 with value: 0.9981527328491211.
Trial 189 finished with value: 0.9975369572639465 and parameters: {'n_layers': 1, 'weight_decay': 0.0005834956538020199, 'n_units_l0': 9, 'optimizer': 'Adam', 'adam_learning_rate': 0.005937358912279021}. Best is trial 121 with value: 0.9981527328491211.
Trial 190 finished with value: 0.5147783160209656 and parameters: {'n_layers': 1, 'weight_decay': 0.0009673655900230406, 'n_units_l0': 8, 'optimizer': 'Adam', 'adam_learning_rate': 0.005869591130301328}. Best is trial 121 with value: 0.9981527328491211.
Trial 191 finished with value: 0.5147783160209656 and parameters: {'n_layers': 1, 'weight_decay': 0.0005777506349971138, 'n_units_l0': 9, 'optimizer': 'Adam', 'adam_learning_rate': 0.004678602435782756}. Best is trial 121 with value: 0.9981527328491211.
Trial 192 finished with value: 0.5147783160209656 and parameters: {'n_layers': 1, 'weight_decay': 0.0004812530050130936, 'n_units_l0': 9, 'optimizer': 'Adam', 'adam_learning_rate': 1.7152717486728424e-05}. Best is trial 121 with value: 0.9981527328491211.
Trial 193 finished with value: 0.993842363357544 and parameters: {'n_layers': 1, 'weight_decay': 0.00026883567493396455, 'n_units_l0': 10, 'optimizer': 'Adam', 'adam_learning_rate': 0.0027007207267456014}. Best is trial 121 with value: 0.9981527328491211.
Trial 194 finished with value: 0.5147783160209656 and parameters: {'n_layers': 1, 'weight_decay': 0.00026612264913499487, 'n_units_l0': 10, 'optimizer': 'Adam', 'adam_learning_rate': 0.003672736729653903}. Best is trial 121 with value: 0.9981527328491211.
Trial 195 finished with value: 0.5147783160209656 and parameters: {'n_layers': 1, 'weight_decay': 0.0006485655766214819, 'n_units_l0': 10, 'optimizer': 'Adam', 'adam_learning_rate': 0.0028044607261083704}. Best is trial 121 with value: 0.9981527328491211.
Trial 196 finished with value: 0.996921181678772 and parameters: {'n_layers': 1, 'weight_decay': 0.0009708570429537409, 'n_units_l0': 10, 'optimizer': 'Adam', 'adam_learning_rate': 0.002363470021038225}. Best is trial 121 with value: 0.9981527328491211.
Trial 197 finished with value: 0.991995096206665 and parameters: {'n_layers': 1, 'weight_decay': 0.0009162438453373164, 'n_units_l0': 10, 'optimizer': 'Adam', 'adam_learning_rate': 0.002344921490017834}. Best is trial 121 with value: 0.9981527328491211.
Trial 198 finished with value: 0.5147783160209656 and parameters: {'n_layers': 1, 'weight_decay': 0.00034469662902294335, 'n_units_l0': 10, 'optimizer': 'Adam', 'adam_learning_rate': 0.00213124553677273}. Best is trial 121 with value: 0.9981527328491211.
Trial 199 finished with value: 0.9895319938659668 and parameters: {'n_layers': 1, 'weight_decay': 0.000967435079481095, 'n_units_l0': 10, 'optimizer': 'Adam', 'adam_learning_rate': 0.002767175588572964}. Best is trial 121 with value: 0.9981527328491211.
Trial 200 finished with value: 0.5147783160209656 and parameters: {'n_layers': 1, 'weight_decay': 0.0004407619948901624, 'n_units_l0': 9, 'optimizer': 'Adam', 'adam_learning_rate': 0.013855045393265658}. Best is trial 121 with value: 0.9981527328491211.
Trial 201 finished with value: 0.996921181678772 and parameters: {'n_layers': 1, 'weight_decay': 0.0006399138528629367, 'n_units_l0': 9, 'optimizer': 'Adam', 'adam_learning_rate': 0.0033076124479160147}. Best is trial 121 with value: 0.9981527328491211.
Trial 202 finished with value: 0.9932265877723694 and parameters: {'n_layers': 1, 'weight_decay': 0.0006788425811030009, 'n_units_l0': 9, 'optimizer': 'Adam', 'adam_learning_rate': 0.0025588716267504878}. Best is trial 121 with value: 0.9981527328491211.
Trial 203 finished with value: 0.9975369572639465 and parameters: {'n_layers': 1, 'weight_decay': 0.0006462914547336148, 'n_units_l0': 8, 'optimizer': 'Adam', 'adam_learning_rate': 0.0031439386882646234}. Best is trial 121 with value: 0.9981527328491211.
Trial 204 finished with value: 0.5147783160209656 and parameters: {'n_layers': 1, 'weight_decay': 0.0006629627062218475, 'n_units_l0': 8, 'optimizer': 'Adam', 'adam_learning_rate': 0.004114563591342312}. Best is trial 121 with value: 0.9981527328491211.
Trial 205 finished with value: 0.991995096206665 and parameters: {'n_layers': 1, 'weight_decay': 0.0006425474866401387, 'n_units_l0': 7, 'optimizer': 'Adam', 'adam_learning_rate': 0.0031508877869114884}. Best is trial 121 with value: 0.9981527328491211.
Trial 206 finished with value: 0.5147783160209656 and parameters: {'n_layers': 1, 'weight_decay': 0.00035682250232535093, 'n_units_l0': 8, 'optimizer': 'Adam', 'adam_learning_rate': 0.005076235301693432}. Best is trial 121 with value: 0.9981527328491211.
Trial 207 finished with value: 0.9975369572639465 and parameters: {'n_layers': 1, 'weight_decay': 0.0005032561064072745, 'n_units_l0': 9, 'optimizer': 'Adam', 'adam_learning_rate': 0.0026674448374950626}. Best is trial 121 with value: 0.9981527328491211.
Trial 208 finished with value: 0.9963054060935974 and parameters: {'n_layers': 1, 'weight_decay': 0.0004832992508180023, 'n_units_l0': 9, 'optimizer': 'Adam', 'adam_learning_rate': 0.006380835838312733}. Best is trial 121 with value: 0.9981527328491211.
Trial 209 finished with value: 0.5147783160209656 and parameters: {'n_layers': 1, 'weight_decay': 0.00027007207938565864, 'n_units_l0': 9, 'optimizer': 'Adam', 'adam_learning_rate': 0.0081736334854882}. Best is trial 121 with value: 0.9981527328491211.
Trial 210 finished with value: 0.5147783160209656 and parameters: {'n_layers': 1, 'weight_decay': 0.000443772398343575, 'n_units_l0': 9, 'optimizer': 'Adam', 'adam_learning_rate': 0.0062237637136898435}. Best is trial 121 with value: 0.9981527328491211.
Trial 211 finished with value: 0.5147783160209656 and parameters: {'n_layers': 1, 'weight_decay': 0.0006233539807849629, 'n_units_l0': 9, 'optimizer': 'Adam', 'adam_learning_rate': 0.0033304681384432556}. Best is trial 121 with value: 0.9981527328491211.
Trial 212 finished with value: 0.9895319938659668 and parameters: {'n_layers': 1, 'weight_decay': 0.0004483986469407955, 'n_units_l0': 9, 'optimizer': 'Adam', 'adam_learning_rate': 0.004184082557610235}. Best is trial 121 with value: 0.9981527328491211.
Trial 213 finished with value: 0.5147783160209656 and parameters: {'n_layers': 1, 'weight_decay': 0.00099986303713636, 'n_units_l0': 10, 'optimizer': 'Adam', 'adam_learning_rate': 0.011754836831897328}. Best is trial 121 with value: 0.9981527328491211.
Trial 214 finished with value: 0.5147783160209656 and parameters: {'n_layers': 1, 'weight_decay': 0.000700051551235803, 'n_units_l0': 9, 'optimizer': 'Adam', 'adam_learning_rate': 0.0027605338360379298}. Best is trial 121 with value: 0.9981527328491211.
Trial 215 finished with value: 0.5147783160209656 and parameters: {'n_layers': 1, 'weight_decay': 0.0002904537512927818, 'n_units_l0': 8, 'optimizer': 'SGD', 'sgd_opt_learning_rate': 0.002487672891126778, 'sgd_opt_momentum': 0.0019296403998221472}. Best is trial 121 with value: 0.9981527328491211.
Trial 216 finished with value: 0.9956896305084229 and parameters: {'n_layers': 1, 'weight_decay': 0.0004614893886013915, 'n_units_l0': 9, 'optimizer': 'Adam', 'adam_learning_rate': 0.0019465487473474229}. Best is trial 121 with value: 0.9981527328491211.
Trial 217 finished with value: 0.9839901328086853 and parameters: {'n_layers': 1, 'weight_decay': 0.00020280684857326294, 'n_units_l0': 10, 'optimizer': 'Adam', 'adam_learning_rate': 0.001857847016137157}. Best is trial 121 with value: 0.9981527328491211.
Trial 218 finished with value: 0.9907635450363159 and parameters: {'n_layers': 1, 'weight_decay': 1.9973007973554558e-08, 'n_units_l0': 8, 'optimizer': 'Adam', 'adam_learning_rate': 0.0019895242958139553}. Best is trial 121 with value: 0.9981527328491211.
Trial 219 finished with value: 0.5147783160209656 and parameters: {'n_layers': 1, 'weight_decay': 0.00048133546155601145, 'n_units_l0': 10, 'optimizer': 'Adam', 'adam_learning_rate': 0.0065211674825263344}. Best is trial 121 with value: 0.9981527328491211.
Trial 220 finished with value: 0.5147783160209656 and parameters: {'n_layers': 1, 'weight_decay': 0.0003578934181714016, 'n_units_l0': 9, 'optimizer': 'Adam', 'adam_learning_rate': 0.010102980823111864}. Best is trial 121 with value: 0.9981527328491211.
Trial 221 finished with value: 0.5147783160209656 and parameters: {'n_layers': 1, 'weight_decay': 0.0007187292117046437, 'n_units_l0': 9, 'optimizer': 'Adam', 'adam_learning_rate': 0.002619400945585705}. Best is trial 121 with value: 0.9981527328491211.
Trial 222 finished with value: 0.9956896305084229 and parameters: {'n_layers': 1, 'weight_decay': 0.0005490845444031353, 'n_units_l0': 10, 'optimizer': 'Adam', 'adam_learning_rate': 0.003239497582089475}. Best is trial 121 with value: 0.9981527328491211.
Trial 223 finished with value: 0.5147783160209656 and parameters: {'n_layers': 1, 'weight_decay': 0.00047878213041418246, 'n_units_l0': 10, 'optimizer': 'Adam', 'adam_learning_rate': 0.00337879751406404}. Best is trial 121 with value: 0.9981527328491211.
Trial 224 finished with value: 0.5147783160209656 and parameters: {'n_layers': 1, 'weight_decay': 0.0009926011625027776, 'n_units_l0': 10, 'optimizer': 'Adam', 'adam_learning_rate': 0.005014922110491665}. Best is trial 121 with value: 0.9981527328491211.
Trial 225 finished with value: 0.9907635450363159 and parameters: {'n_layers': 1, 'weight_decay': 0.00028257758505992043, 'n_units_l0': 10, 'optimizer': 'Adam', 'adam_learning_rate': 0.0040389604909318085}. Best is trial 121 with value: 0.9981527328491211.
Trial 226 finished with value: 0.9963054060935974 and parameters: {'n_layers': 1, 'weight_decay': 0.0005312851503148109, 'n_units_l0': 8, 'optimizer': 'Adam', 'adam_learning_rate': 0.002033247044291345}. Best is trial 121 with value: 0.9981527328491211.
Trial 227 finished with value: 0.9870689511299133 and parameters: {'n_layers': 1, 'weight_decay': 0.0005439450330203802, 'n_units_l0': 9, 'optimizer': 'Adam', 'adam_learning_rate': 0.0017416515874070307}. Best is trial 121 with value: 0.9981527328491211.
Trial 228 finished with value: 0.988916277885437 and parameters: {'n_layers': 1, 'weight_decay': 0.0007576100626012261, 'n_units_l0': 10, 'optimizer': 'Adam', 'adam_learning_rate': 0.0020477937543636267}. Best is trial 121 with value: 0.9981527328491211.
Trial 229 finished with value: 0.5147783160209656 and parameters: {'n_layers': 1, 'weight_decay': 0.0005317699372493118, 'n_units_l0': 9, 'optimizer': 'Adam', 'adam_learning_rate': 9.727788568306741e-05}. Best is trial 121 with value: 0.9981527328491211.
Trial 230 finished with value: 0.5147783160209656 and parameters: {'n_layers': 1, 'weight_decay': 0.0009999436086927335, 'n_units_l0': 9, 'optimizer': 'RMSprop', 'rmsprop_learning_rate': 5.081091186391462e-05, 'rmsprop_weight_decay': 0.9848030689030794, 'rmsprop_momentum': 0.0014787292660262982}. Best is trial 121 with value: 0.9981527328491211.
Trial 231 finished with value: 0.5147783160209656 and parameters: {'n_layers': 1, 'weight_decay': 0.00036960382494803917, 'n_units_l0': 8, 'optimizer': 'Adam', 'adam_learning_rate': 0.003073380808041742}. Best is trial 121 with value: 0.9981527328491211.
Trial 232 finished with value: 0.5147783160209656 and parameters: {'n_layers': 1, 'weight_decay': 0.00021960141486253065, 'n_units_l0': 7, 'optimizer': 'Adam', 'adam_learning_rate': 0.002284318542252778}. Best is trial 121 with value: 0.9981527328491211.
Trial 233 finished with value: 0.5147783160209656 and parameters: {'n_layers': 1, 'weight_decay': 0.00037015284194521494, 'n_units_l0': 8, 'optimizer': 'Adam', 'adam_learning_rate': 0.0029053069388220716}. Best is trial 121 with value: 0.9981527328491211.
Trial 234 finished with value: 0.5147783160209656 and parameters: {'n_layers': 1, 'weight_decay': 1.3357982626811326e-07, 'n_units_l0': 10, 'optimizer': 'Adam', 'adam_learning_rate': 0.002387518813193358}. Best is trial 121 with value: 0.9981527328491211.
Trial 235 finished with value: 0.5147783160209656 and parameters: {'n_layers': 1, 'weight_decay': 0.0005702121079032368, 'n_units_l0': 8, 'optimizer': 'Adam', 'adam_learning_rate': 0.0018113891532947491}. Best is trial 121 with value: 0.9981527328491211.
Trial 236 finished with value: 0.9895319938659668 and parameters: {'n_layers': 1, 'weight_decay': 0.0007135745090205956, 'n_units_l0': 9, 'optimizer': 'Adam', 'adam_learning_rate': 0.0036165234058180475}. Best is trial 121 with value: 0.9981527328491211.
Trial 237 finished with value: 0.9944581389427185 and parameters: {'n_layers': 1, 'weight_decay': 0.000405421067500764, 'n_units_l0': 10, 'optimizer': 'Adam', 'adam_learning_rate': 0.002778781544914284}. Best is trial 121 with value: 0.9981527328491211.
Trial 238 finished with value: 0.9883005023002625 and parameters: {'n_layers': 1, 'weight_decay': 0.0005011890447288804, 'n_units_l0': 10, 'optimizer': 'Adam', 'adam_learning_rate': 0.0020938761459107823}. Best is trial 121 with value: 0.9981527328491211.
Trial 239 finished with value: 0.5147783160209656 and parameters: {'n_layers': 1, 'weight_decay': 0.00025959368351841653, 'n_units_l0': 10, 'optimizer': 'Adam', 'adam_learning_rate': 0.002597565013585006}. Best is trial 121 with value: 0.9981527328491211.
Trial 240 finished with value: 0.9913793206214905 and parameters: {'n_layers': 1, 'weight_decay': 0.0006599359120630398, 'n_units_l0': 9, 'optimizer': 'Adam', 'adam_learning_rate': 0.0015176066397223015}. Best is trial 121 with value: 0.9981527328491211.
Trial 241 finished with value: 0.5147783160209656 and parameters: {'n_layers': 1, 'weight_decay': 0.00037226081224957816, 'n_units_l0': 10, 'optimizer': 'Adam', 'adam_learning_rate': 0.0030736928577778217}. Best is trial 121 with value: 0.9981527328491211.
Trial 242 finished with value: 0.5147783160209656 and parameters: {'n_layers': 1, 'weight_decay': 0.0004407664210506794, 'n_units_l0': 9, 'optimizer': 'Adam', 'adam_learning_rate': 0.0027116160741674595}. Best is trial 121 with value: 0.9981527328491211.
Trial 243 finished with value: 0.5147783160209656 and parameters: {'n_layers': 1, 'weight_decay': 0.0003059384960177, 'n_units_l0': 10, 'optimizer': 'Adam', 'adam_learning_rate': 0.003491115540638857}. Best is trial 121 with value: 0.9981527328491211.
Trial 244 finished with value: 0.5147783160209656 and parameters: {'n_layers': 1, 'weight_decay': 0.0007678396105357091, 'n_units_l0': 9, 'optimizer': 'Adam', 'adam_learning_rate': 0.0021016743182061402}. Best is trial 121 with value: 0.9981527328491211.
Trial 245 finished with value: 0.5147783160209656 and parameters: {'n_layers': 1, 'weight_decay': 0.000556848455208462, 'n_units_l0': 10, 'optimizer': 'Adam', 'adam_learning_rate': 0.004038082355644273}. Best is trial 121 with value: 0.9981527328491211.
Trial 246 finished with value: 0.5147783160209656 and parameters: {'n_layers': 1, 'weight_decay': 0.00018888652149211263, 'n_units_l0': 9, 'optimizer': 'Adam', 'adam_learning_rate': 0.0024516883772999916}. Best is trial 121 with value: 0.9981527328491211.
Trial 247 finished with value: 0.9876847267150879 and parameters: {'n_layers': 1, 'weight_decay': 0.0003990801794132782, 'n_units_l0': 8, 'optimizer': 'Adam', 'adam_learning_rate': 0.0018003858189220671}. Best is trial 121 with value: 0.9981527328491211.
Trial 248 finished with value: 0.9926108121871948 and parameters: {'n_layers': 1, 'weight_decay': 0.000969987938274123, 'n_units_l0': 3, 'optimizer': 'Adam', 'adam_learning_rate': 0.0029709600852684654}. Best is trial 121 with value: 0.9981527328491211.
Trial 249 finished with value: 0.5147783160209656 and parameters: {'n_layers': 1, 'weight_decay': 0.0006490211478373107, 'n_units_l0': 10, 'optimizer': 'Adam', 'adam_learning_rate': 0.004602737506244844}. Best is trial 121 with value: 0.9981527328491211.
